Unnamed: 0,patient_filename,t,text,type,n,mem_n_reasoning,mem_n_ans_str
695,TCGA-AC-A23G.810663DD-1718-4FD6-B9C2-77B4C091B3F1,0,"Acct/Res. DIAGNOSIS. DIAGNOSIS. A. Right axiliary sentinel lymph nodes, excision: Metastatic adenocarcinoma involving da ; frozen section diagnosis confirmed. B. Right breast, mastectomy: Bloom Richardson up to 2.0 cm in maximal diameter as measured on glass slide, ruppecinger quadrent. Areas of anglolymphatic invasion suggested. No in situ component identified. Histologically unremarkable nipple and negative inked deep surgical margin of resection. Background of proliferative fibrocystic changes including moderate usual ductal hyperplasia and a single microscopic focus of atypical ductal. hyperplasia. Anciliary studies previously obtained. C. Right axillary contents, regional resection: Metastatic. The largest lymph node shows a multifocal microgranulomatous reaction associated with refractile foreign material. Staging sheet #25. Stage: T1cN1MX, stage lla. CÉINICA INFORMATION. CLINICAL HISTORY: Preoperative Diagnosis: Right breast cancel-. Postoperative Diagnosis: Symptoms/Radlologic Findings: SPECIMENS: A. Right axiliary sentinel nodes. 8. Right breast. C. Right axillary contents. SPECIMEN DATA. GROSS DESCRIPTION: A. The first container A is labeled and consists of two lymph nodes measuring 1.2 x 1.0x0.5 cm and 1.5 x 1.2 x 0.5 cm. The lymph nodes. were examined at the time of surgery and are subsequently entirely submitted In cassettes. is follows: FSA1--1; FSA2--2,. B. The' second container 8 Is labeled. nd right breast and consists of a portion of fibroadipose breast tissue that has been received previously. inked and sectioned with attached skin measuring 25.0 x 15.0 x 6.0 cm and weighs 830 grams. The skin surface measures 20.0 x 9.0 cm and is light. tan wrinkled. There is an area discolored by blue contrast dye surrounding the nipple measuring 6.0 cm. The nipple is centrally placed and appears. grossly normal. The specimen has oriented with a suture at superior. On sectioning there is a firm gray-tan fibrous mass measuring 1.2 x 1.0 x 0.7 cm. that is 1.0 cm from the deep margin of resection and is located predominantly within the upper inner quadrant. The surrounding breast tissue reveais. fatty fibroadipose breast tissue with fibmus Neque. There are no other lesions grossly Identified. Received with the specimen are two casseltes, one. representative sections are submitted in cassettes. as follows: nipple-1; sections from mass-2. to. 5, doep wargin overiying mass=6; sections from upper Inner quadrant--7; lower Inner quadrant--8; lower outer quadrant-9; upper outer quadrant--10. C. The third container C is labeled. ad right axillary contents and consists of a portion of fibroadipose tissue measuring 8.0 x 5.5x2.5. Sectioning reveals twelve probable lymph nodes measuring from 0.2 to 1.5 cm. The lymph nodes are entirely submitted in cassette: as. follows: five probable nodes-13 six probable nodes-2; one lymph node trisected--3 and 4. INTRA-OPERATIVE CONSULTATION: FSA: 'Metastatic neoplasm in at least one of the two lymph nodes' DE. Addendum: Pathology of positive for invasive lobular carcinoma. Patient needs. to be referred to a breast surgeon; Patient was called with results and will followup with. oni. for the. necessary surgioal referral. END OF ADDENBUM. ### VOICE TO TEXT SYNOPSIS ADDENDUM. Invasive lobular carcinoma Patient needs to be refeured to a surgeon. ADS: (6) Known blopsy - proven malignancy. END on ADDENDUM. FULL RESULT: Indication: Right breast mass. Vacuum-assisted ultrasound-guided core blopsy: Scana through the right breast at 1:00 again confirm a solld Irregular. mass. It has shadowing posterlorly. Following local anesthesia, a 10-gauge Cassi device was Introduced into the mass. under ultrasound guidance. using vacuum assistance, multiple core samples were obtained. Procedure was well tolerated. Clip placement: Under ultrasound guidance, a blopsy cllp was Inserted percutaneously into the area of the mass. This was. successfully deployed under vitrasound guidance. Right mammogram, post procedure: A postblopsy mammogram was obtained. This confirms placement of the biopsy. marker clip. It is well within the spiculated mass in the upper inner quadrant. IMPRESSION: Irregular solid mass right breast at. Ultrasound-gulded vacuum-assisted core blopsy performed. Cllp. deployed auccessfully into the blopsy site. Pathology pending. PATIENT INFORMATION. PHYSICIAN INFORMATION. SPECIMEN INFORMATION. Acct/Reg#: (. ADDENDUM REPORT. ADDENDUM REPORT NUMBER TWO. BREAST PROGNOSTIC PANEL: Block 2. TEST. REFERENCE RANGES. DNA Analysis by Image: DNA Index: SEE COMMENT. 0.9-1.1 is Diploid. < 0.9 or > 1.1 le Aneuploid. COMMENT: Insufficient tumor volume is present for quantitation of DNA by Image analysie. Her2 Gene Amplification By FISH: NEGATIVE. Average copies per cell: Her-2/neu: 1.82. Chromosome 17: 1.67. Ratio: 1.09. 20 Her2/neu. Case interpreted by. Notes: Quantitative analysis performed using Chromavision ACIS. The Her2 /neu and CEP17 probes are manufactured by Vysis Inc. The Her2/neu gene detection by Fluorescence in Situ Hybridization (FISH) was performed using the LSI Her2/neu DNA probe, specific. for the Her2/neu gene locus 17q11.2-q12 and the CEP1 DNA probe specific for the alpha antellite DNA sequence at the centromerio. region of chromosome 17 (17p11.1-q11.1). These tests were developed and performance characteristics determined by the. They have not. been cleared or approved by the US Food and Drug Administration. The FDA has determined that such approval or clearance le not. necessary. These tests are used for clinical purposes. They should not be regarded as Investigational or for research. This. laboratory is certified under the Clinical Laboratory Improvement Act (CLIA) of 1988 as qualified to perform high complexity clinical. laboratory testing. Place of Service: Center for Advanced Diagnostics. ADDENDUM REPORT NUMBER ONE. BREAST PROGNOSTIC PANEL: (Preliminary test results on block A2). TEST. REFERENCE RANGES. Estrogen Receptor: POSITIVE (94%). > 4% is Positive. 2-4% is Borderline. < 2% is Negative. Progesterone Receptor: POSITIVE (89%). > 4% is Positive. 2-4% is Borderline. < 2% le Negative. KI-67 (MIB1) Proliferation Marker: BORDERINE (18%). 20% is High. 10-20% is Borderline. < 10% is Low. REPORT CONTINULE ON NE XT PAGE. Page: lof2. PATIENT INFORMATION. SPECIMEN INFORMATION. $. These results were interpreted by Dr. An additional addendum report will follow when DNA and Her-2-neu tests. are completed. These tests were developed and performance characteristics determined by. hey have not been cleared or approved by. the. US Food and Drug Administration. The FDA has determined that auch approval or clearance ls not necessary, These teats are used for. clinical purposes. They should not be regarded as Investigational or for research. This laboratory is certified under the Clinical Laboratory. improvement Act (CLIA) of 1988 as qualified to perform high complexity clinical laboratory testing. DIAGNOSIS. DIAGNOSIS: 10 gauge true cut ultrasound guided needle core biopsies of an Irregular 1 x 2 cm mass near the 0100 position within the right breast: Invasive lobular carcinoma. Size: Two cores partially Involved with largest linear dimension 6 mm as measured from siide A2. Eiston modification of Bloom-Richardson Grade: Architectural score: 3/3. Nuclear score: 2/3. Mitotic score: 1/3. Total score: No in situ carcinoma component present. No lymphovascular space invasion evident. No microcaleificatione seen. No other significant profiferative breast disease pattern present. Paraffin Block A2 submitted for breast cancer prognostic panel with results reported as an addendum (paraffin block A5 suitable If. additional material necessary). CLINICAL INFORMATION. CLINICAL HISTORY: Preoperative Diagnosis: Core needie biopsy, true cut, uttrasound core blopay anciliary test If malignant: Estrogen/Progesterone receptora, Her2-neu. Postoperative Diagnosis: Symptome/Radiologic Findings: Mammogram, ultresound, size irregular mass 1 x 2 cm. SPECIMENS: Right breast. SPECIMEN DATA. GROSS DESCRIPTION: Received in one container labaled right breast are multiple (15 to 20) soft paie veligw wispy fragments and come massuring up to 1.2 cm in. greetest dimension. The specimen is entirely submitted in five cassettes labeled. Case color blue.",BRCA,1,"The report states that there is metastasis in the axillary lymph nodes (N1), as indicated by the pathology of the sentinel lymph nodes and the regional resection of the axillary contents.",N1
608,TCGA-A7-A6VY.BB85F844-C710-41D5-8620-E246DC9D2C6A,1,"Final Surgical Pathology Report. Procedure: Diagnosis. A. Right breast, excisional biopsy: Infiltrating ductal carcinoma, grade 3, 3.5 cm in greatest dimension. Invasive carcinoma 1 mm from posterior margin of resection. Ductal carcinoma in situ, solid subtype, nuclear grade 3, accounting. for less than 5% of the tumor, margins uninvolved. B. Right axillary contents, resection: Metastatic carcinoma in 2 of 14 lymph nodes, size of largest. metastasis 3.4 cm, extracapsular extension present (2/14). Microscopic Description: Microscopic examination performed. A. Invasive Carcinoma: present. Histologic type: infiltrating ductal cancer. Histologic grade: Overall grade: 3. Architectural score: 3. Nuclear score: 3. Mitotic score: 3. Greatest dimension (pT) : 3.5 cm, pT2. Specimen margins: negative but close, 1 mm from the. posterior margin (black in block A6). Vessel invasion: not identified. Ductal carcinoma in situ: present. Histologic pattern: solid. Nuclear grade: 3. Central Necrosis: focal. 8 DCIS of total tumor (if mixed) : < 5%. Extensive intraductal component (present/absent : absent. Specimen margins: negative, 3 mm from posterior. Calcification: not identified. B. Sections of the axillary dissection demonstrate metastatic. carcinoma in 2 of 14 lymph nodes, (pN1). The size of largest. metastasis is 3.4 cm. Extracapsular extension is present. Specimen. A. Right breast mass. B. Right axillary contents. Clinical Information. Right breast cancer -year-old black female with right cancer and. positive nodes. Gross Description. Received fresh in a transpec container, subsequently fixed in formalin. labeled ""right breast mass"" is a 6.0 x 5.5 x 4.5 cm yellow pink fatty. tissue fragment which has a short suture designating superior and a. long suture designating anterior. The margins are inked as follows. based upon the orienting sutures: superior - orange; anterior - blue;. posterior - black; inferior - green. The specimen is serially. sectioned from medial to lateral. There is a 3.5 x 3.2 x 2.5 cm ill. circumscribed white tan mass centrally located, and within 0.2 cm of. the closest margin (deep) White rice-like pellets or gross identified. in the central which we be grossly consistent with a previous biopsy. site. The specimen is received in pathology it. nd fixed in. formalin and. Representative sections of the specimen are. submitted as IOLLOWS: 1 - medial margin perpendicular, 2 - lateral. margin perpendicular. ? - 10 - representative sections of the remainder. of the specimen. B. Received fresh and subsequently fixed in formalin labeled ""right. axillary contents"" is a 12.0 x 6 x 5 x 2.5 cm aggregate of yellow fatty. tissue grossly consistent with axillary contents. The specimen has a. suture designating superior. Multiple lymph nodes are palpated the. largest measuring 3.4 cm and located midway through the specimen. The. highest is markedly indurated as is the largest lymph node. The lymph. nodes are submitted from highest to lowest as follows: 1 -lymph node. bisected, 2 - 3 possible lymph nodes, 3 - 4 - 3 possible lymph nodes. each, 5 - representative section of largest positive lymph node, /1. possible lymph node bisected, 7 - 2 possible lymph nodes, 8 - 1. possible lymph node.",BRCA,1,"The pathology report indicates metastasis in 2 of 14 lymph nodes, with the largest metastasis measuring 3.4 cm and extracapsular extension being present. According to the rules provided, the presence of metastasis in axillary lymph nodes indicates an N1 stage.",N1
1346,TCGA-EW-A1P0.F9FB00C3-9F86-40AC-A5E8-08712CD5002B,1,"F. Pathologic Interpretation: A. Right breast 1 short stitch superior, 1 long stitch lateral: -Fibrocystic changes including consisting of apocrine metaplasia, stromal fibrosis and microcysts. B. Right axillary node: -Two lymph nodes, no carcinoma seen (0/2). C. Left rotter lymph node: -Metastatic carcinoma to one lymph node,6.0 cm, (1/1). -Perinodal tumoral invasion seen. D. Leftbreast and axilla (fresh) 1 short suture superior; 1 long suture fateral: -Invasive, multifocal moderately differentiated ductal carcinoma with mucinous (colloid) morphology, 2.0 and 2.4 cm. (sum: 4.4 cm). -No carcinoma seen in eighteen lymph nodes, (0/18). -Intraductal papilloma. -Intradermal nevus. (See tumor summary). Tumor Summary. Specimen Type: Mastectomy. Lymph Node Sampling: Axillary dissection. Specimen Size Greatest dimension 21.0 cm. Additional dimension: 21.0 x 6.0 cm. Laterality: Left. Tumor Site: Upper outer quadrant. Size of invasive component: Greatest dimension: 2.0 cm and 2.4 cm (sum: 4.4 cm). Histologic type: Invasive ductal carcinoma with mucinous differentiation. Histologic Grade: Nottingham Histologic Score: 2 (2+2+2=6). Tubule formation: (2). Nuclear Pleomorphism: (2). Mitotic Count: (2). Pathologic staging (pTNM). Primary tumor: pT2. Regional Lymph Nodes: pN1a. Number examined: 21. Number involved: 1. Distant Metastasis: pMX. Margins: Uninvolved by invasive carcinoma, 1.5 cm from the superior margin. Venous/Lymphatic Invasion: Absent. ER: Positive (In-house Immunoperoxidase performed). PR: Negative (In-house Immunoperoxidase performed). Her2: Negative (In-house Immunoperoxidase performed). Note: This neoplasm demonstrates a more defined mucinous differentiation on the 2.4 cm nodule, however focal mucinous. differentiation. is also seen on the 2.0 cm neoplasm. AJCC pathologic staging pT2 N1a Mx. NOTE: Some immunohistochemica/ antibodies are analyte specific reagents (ASRs) validated by our laboratory (Her 2, Parvo, H. pylori, HBcore). These ASRs are clinically uséful. indicators. that. do. not require FDA approval. These ciones are used: ID5=ER, PgR 636=PR, A485=HER2, H-11=EGFR, CCH2/DDG9=CMV, F39 4 1=AR and HPV by ISH. All immunohistochemical stains are used. with formalin or molecular fixed, peraffn embedded tissue. Detection is by LSAB. The results are read by a pathologist as positive or negative. SURGICAL PATHOL Report. As the attending pathologist, / attest that 1. (i) Examined the relevant. preparation(s) for the specimen(s); and (ii) Rendered the diagnosis(es). Procedures/Addenda. Addendum. Date Complete: Addendum Diagnosis. D. Left breast and axilla (fresh) 1 short suture superior; 1 long suture lateral: -The cells of intradermal nevus are positive fo. by immunohistochemistry. :, PhD. Clinical History: Patient is a. I white female with history of left breast cancer. Pre Operative Diagnosis: Right breast cancer. Specimen(s) Received: A: Right breast 1 short stitch superior, 1 long stitch lateral (fresh). B: Right axillary node (perm). C: Left rotter lymph node (perm). D: Left breast and axilla (fresh) 1 short suture superior; 1 long suture lateral. Gross Description: A. Received fresh and labeled ""right breast 1 short stitch superior, 1 long stitch lateral"" specimen consist of right breast. oriented with 1 short stitch superior resection margin and 1 long stitch in lateral resection margin, 18.0 x 150x 5.0 cm and. weighs 775.0 grams. The skin mesures 13.0 x 8.0 cm, nipple measures 1.2 cm and the areola, 4.0 cm in circumference. Sections reveal abundant grossly unremarkable fibroadipose tissue. The central area reveal white-tan, fibrocystic area,. 2.0 cm in greatest dimension. No tumor or any other lesions are grossly identified. Representative sections are submitted. in ten cassettes as follows: 1. Perpendicular representative sections from superior resection margins. 2. Perpendicular representative sections from inferior resection margins. 3. Perpendicular representative sections from medial resection margins. Perpendicular representative sections from lateral resection margins. 5. Representative sections from nipple. 6. Perpendicular representative sections from deep resection margins. 7-10. The lesion described submitted in toto (fibrocystic areas). 11. Representative from upper outer quadrant. 12. Representative sections from lower outer quadrant. 13. Representative sections from upper inner quadrant. 14. Representative sections from lower inner quadrant. B. Received in formalin and labeled 'right axillary node"" specimen consist of yellow-tan, fibroadipose tisseu, 3.0 x 1.5 x 1.0. cm. Section reveal two lymph nodes. The lymph nodes submitted in toto in one cassette bissected each. SURGICAL PATHOL Report. C. Received in formalin and labeled ""left rotter lymph node"" specimen consist of one lymph node, 6.0 x 5.0 x 3.0 cm and. weighs 35.0 grams. Sections reveals pink-tan, well defined multinodular No calcified or hemorrhagic arejas are grossly. identitified. Representative sections are submitted in eight cassettes: D. Received fresh and labeled ""left breast and axilla 1 short suture superior; 1 long suture lateral"" is a mastectomy specimen. with axillary contents, weighing 1150.0 grams and measuring 21.0 x 21.0 x 6.0 cm and the axillary contents, 14.0 x 12.0 x. 2.0 cm. There is an anterior ellipse of white skin, 20.0 x 10.0 cm. Located centrally within this ellipse of skin there is a. nipple areola complex 3.5 cm in circumference and 1.0 cm in circumference. Located toward the outer quadrant there are. two verrucose shaped hyperkeratosis lesions, 0.7 x 0.5 cm in greatest dimension. The remainder of the skin surface is. unremarkable. The rest of the specimen is covered by yellow-tan lobulated adipose tissue. The surgical résection. margins are inked din black. Multiple cross sections reveals an ill circumscribed gray-tan, hard greatly mass, 2.0 cm in. greatest dimension. The mass is located in the outer quadrant approximately 1.00 o'clock position, 1.5 cm from the. superior resection margin (nearest margin) and 2.5 cm from deep resection margin. Located in the same quadrant. 2.5. cm. from the mass previously described there is a second ill circumscribed gray-tan, hard nodule measuring 2 4 cm. in. greatest. dimension, this mass is 2.8 cm from deep resection margin (closest margin). The remainder of the specimen shows a. heterogeneous breast tissue. No other lesions or masses are grossly identified. The stroma to fat ratio is 30.70. Multiple. sections through the axillary contents reveal eighteen possible lymph nodes ranging in size from, 0.3 cm to 2.0 cm in. greatest dimension. Representative sections are submitted as follows: 1. Superior resection margin nearest to the 1.00 o'clock mass. 2. Inferior resection margin. 3. Medial resection margin. 4. Lateral resection margin. 5. Deep margin closest to 1.00 o'clock mass (outer upper quadrant). 6. Deep margin closest to the second mass (outer upper quadrant). 7. Representative sections from the areola and nipple. 8. Representative sections from the skin wit verrucose lesion. 9-11. Representative sections from the mass at 1.00 o'clock (outer upper quadrant). 12-14. Representative sections from the second mass (outer upper quadrant). 15. Representative sections from inner upper quadrant. 16. Representative sections from inner lower quadrant. 17. Representative sections from outer lower quadrant. 18-20. One lymph node multisected. 21-23. One lymph node multisected. 248.25. One lymph node multisected. 26-33. One lymph node bisected per cassette. 34. Four possible lymph nodes submitted in toto. 35. Three possible lymph nodes submitted in toto. ICD-9(s): 174.8 196.3 216.5.",BRCA,1,"The pathology report indicates that there is metastatic carcinoma in one of the left axillary lymph nodes (pN1). The report also mentions perinodal tumoral invasion in the same node, which is a feature of N2 or N3 stages, but its presence in an N1 stage is indicated by the term 'extracapsular extension present' in the report. However, the term 'extracapsular extension' is not explicitly mentioned in this report, so we can only determine that the N stage is N1 based on the presence of metastasis in a lymph node.",N1
855,TCGA-AR-A1AL.E3D44C6B-4497-4212-8CA1-AC9444B4CC54,2,"Final Diagnosis. Breast, left, mastectomy: Infiltrating lobular carcinoma, Nottingham grade I (of III) [tubules 3/3,. nuclei 1/3, mitoses 1/3; Nottingham score 5/9], forming a mass (6.5 x 5.2 x 3.5 cm) located in the. superior portion of the breast [AJCC pT3]. Lobular carcinoma in situ (less than 5% of tumor. volume) is present. The non-neoplastic breast parenchyma shows nonproliferative fibrocystic. changes with duct ectasia. Calcifications are present in benign ducts and acini. The tumor does. not involve the nipple, overlying skin, or underlying chest wall. All surgical margins, including. the deep margin, are negative for tumor (minimum tumor free margin, 0.8 cm, deep margin). A. single (of 6) lymph node is positive for metastatic carcinoma [AJCC pN1]. Lymph node, left axillary, sentinel No. 1, excision: A single left axillary sentinel lymph node is. positive for metastatic carcinoma. Immunohistochemical cytokeratin stain was performed on the. paraffin embedded sentinel lymph node tissue and confirms the H&E impression. Blue dye is not. identified. Lymph node, left axillary sentinel No. 2, excision: A single left axillary sentinel lymph node is. negative for metastatic carcinoma. Immunohistochemical cytokeratin stain was performed on the. paraffin embedded sentinel lymph node tissue and confirms the H&E impression. Blue dye is. identified. Lymph node, left axillary, sentinel No. 3, excision: A single left axillary sentinel lymph node is. positive for metastatic carcinoma with a single focus measuring 0.9 cm in greatest dimensions. Blue dye is identified. Lymph nodes, left axillary, dissection: Multiple (6) axillary lymph nodes are negative for. metastatic carcinoma [AJCC pN1]. Estrogen and progesterone receptor analysis and Her-2/NEU have been ordered on paraffin. embedded tissue. Seen in consultation with Dr.",BRCA,1,"The pathology report indicates that one axillary lymph node is positive for metastatic carcinoma, which is consistent with an N1 stage according to the rules provided.",N1
