Unnamed: 0,patient_filename,t,text,type,n,mem_n_reasoning,mem_n_ans_str
607,TCGA-A7-A6VX.80EDDCAC-B87B-47E6-A48C-F166D227DA6C,1,"Final Surgical Pathology Report. Procedure: Diagnosis. A. Left axillary sentinel lymph node, excision: No evidence of metastasis in 2 lymph nodes (0/2). B. Left breast, excisional biopsy: Infiltrating ductal carcinoma, grade 3, 2.5 cm, extending to within. 0.5 mm from the inferior margin of resection. Ductal carcinoma in situ, comedo and solid subtypes, nuclear grade 3. with necrosis, extending to posterior margin. Microscopic Description: Microscopic examination performed. A. Sections of the left axilla sentinel lymph node demonstrate 2 lymph. nodes with no evidence of metastasis. The nodes are examined by. multilevel sectioning with hematoxylin and eosin, as well as by. immunohistochemistry for pankeratin. B. Invasive Carcinoma: Histologic type: infiltrating ductal carcinoma. Histologic grade: Overall grade: 3. Architectural score: 3. Nuclear score: 3. Mitotic score: 2. Greatest dimension (pT) : 2.5 cm, pT2. Specimen margins: extremely close, < 0.5 mm to black ink,. (inferior margin). Vessel invasion: not identified. Calcification: present. Ductal carcinoma in situ: Histologic pattern: comedo and solid. Nuclear grade: 3. Central Necrosis: present. % DCIS of total tumor (if mixed) : < 10%. Extensive intraductal component (present/absent) : absent. Specimen margins : positive, in situ carcinoma at orange ink (. posterior margin). Prognostic markers : see outside report. Specimen. A. Left axillary sentinel node. B. Left breast biopsy long suture anterior short superior. Clinical Information. year-old black female with left breast cancer. Gross Description. A. Received fresh labeled ""left axillary sentinel node"" is a 3.4 x 3.0. X 1.5 cm portion of soft, lobulated tan gold adipose tissue which. contains two rubbery tan-pink tissues in keeping with lymph nodes. averaging 1.4 cm in greatest dimension. The lymphoid tissues are. bisected and entirely submitted independently in 2 blocks. B. Received fresh and subsequently placed in formalin at. labeled. ""left breast biopsy"" is a 6.2 cm (medial to lateral) by 5.3 cm. (anterior to posterior) by 3.0 cm (superior to inferior) soft,. lobulated tan-white-gold portion of fibroadipose tissue with 2 sutures. as stated previously. The margins are inked as follows: Superior blue,. inferior black, anterior green, and posterior orange. The specimen is. sectioned from medial to lateral. There is a 2.5 cm (medial to. lateral) by 2.0 cm (anterior to posterior) by 1.9 cm (superior to. inferior) rubbery tan-white tumor mass within the lateral half of the. specimen. The tumor focally approaches the superior margin to within. 0.2 cm. The remaining cut surfaces consist predominantly of soft,. lobulated tan gold adipose tissue with a scant amount of interspersed. delicate tan-white fibrous tissue. A representative portion of tumor. and a representative portion of normal parenchyma are submitted for. tissue procurement as requested. Summary: 1 - perpendicular sections medial margin, 2 through 9 -. sequential sections including entire lesion, 10 - perpendicular. sections lateral margin.",BRCA,0,"The pathology report indicates 'No evidence of metastasis in 2 lymph nodes (0/2)' in the left axillary sentinel lymph nodes. According to the rules provided, the absence of metastasis in the sentinel lymph nodes implies an N0 stage.",N0
1178,TCGA-D8-A3Z6.A8F63D86-37DF-472E-AF29-FB734EAB7E5C,2,": XXX. Examination result. Clinical diagnosis (suspicion): Cancer of the left breast. Date of admission: (urgency: Standard). Material: 1) Material: left breast and axillary tissue. Method of collection: Total organ resection. Histopathological diagnosis: Invasive, multifocal labular carcinoma of the left breast. Cancer metastases to axillary lymph nodes (19/22) (NHG2, pT3, pN3a). Macroscopic description: Left breast, sized 27.4 x 15.4 x 6.8 cm, removed without axillary tissues sized 10x11x5 cm and with a skin flap of. 20.2 x 8.2 cm. Tumour sized 6.2 x 3.6 x 4.8 cm found in the central part, placed 1.4 cm from the upper boundary, 0.8 cm from the. base and 0.6 cm from the skin. State after removal of a tumour fragment. Lymph nodes of 3.3 cm in length. Microscopic description: Invasive multifocal lobular carcinoma (histocytoid type) - NHG2 (3 + 3 + 1/5 mitoses/ 10 HPF - vision area 0,55. mm). Ductal carcinoma in situ (solid type, with high nuclear atypia and comedo necrosis, 10% of the tumour). The nipple. without pathological lesions. Glandular tissue showing fibrocytoid lesions adenosis. Axillary lymph nodes: Cancer metastases to axillary lymph nodes. (19/22). Signs of perilymphatic invasion.",BRCA,3,"The pathology report indicates metastasis in 19 out of 22 axillary lymph nodes (N3a), as stated in the report: 'Cancer metastases to axillary lymph nodes (19/22)'. This finding is consistent with an N3 stage.",N3
1514,TCGA-XX-A89A.5D85E578-64B4-4238-922E-802B8ED87800,2,"Research Gross Description. Research Dx. Left breast (1945 g), mastectomy: Invasive lobular carcinoma. 7 regional lymph nodes, negative for malignancy (0/7). Tumor site: Upper outer quadrant ( 2-3:00). Tumor size: Between 7 and 9 cm. Histopathologic type: Invasive lobular carcinoma. Histopathologic grade (Nottingham): 2. Mitotic count: Low proliferative rate. Pathologic tumor stage: pT3. Margin status: Distance of carcinoma from margins: Superior: 0.8 cm. Inferior: At least 1 cm. Medial: Greater than 2 cm. Lateral: Greater than 2 cm. Anterior: 1 cm. Posterior: Greater than 1 cm. Associated in situ carcinoma: Type: Lobular carcinoma in situ (rare focus). Extensive (>25% of total tumor): No. Separate (extra-tumoral) foci away from main lesion: Not identified. Peritumoral angiolymphatic invasion: Not identified. Dermal angiolymphatic invasion: Not identified. Estrogen receptor: Positive (70 % of tumor cell nuclei staining moderately to strongly). Progesterone receptor: Positive (70 % of tumor cell nuclei staining moderately to strongly). HER-2/neu (ERBB2): Negative (score 0). Duration of fixation in 10% NBF: 12 hours 24 minutes. Appropriate internal and external controls: Yes. Standard assay conditions met? Yes. Pathologic lymph node stage: pNO (including sentinel): No regional lymph node metastasis. Number of nodes positive for metastasis/total number nodes sampled: 0/11. Maximum diameter of largest lymph node metastasis: Not applicable. Extranodal extension by tumor: Not applicable. Distant metastasis: M-not applicable. Additional pathologic findings: Fibrocystic change and usual ductal hyperplasia; seborrheic. keratosis. TNM descriptors (if applicable): AJCC Staging (7th Edition): pT3 pNO M-not applicable. Research QC. T1 Tumor: 50% tumor nuclei. 0% necrosis. 50% normal. Normal: 100% fibroadipose. 1. T2. 50% tumor nuclei. 0% necrosis. 50% normal fibrous tissue and fat. minimal normal breast. T3. 70% tumor nuclei. 0% necrosis. 30% normal. T4. 50% tumor nuclei. 0% necrosis. 50% normal fat, could prob be trimmed. Research Specimen. Specimen Process Time. Blood draw time. Plasma frozen time: Serum frozen time. Buffy coat frozen time: Cold ischemia start time: Formalin fixation start time: Total cold ischemia time: Formalin fixation stopped time. Total formalin fixation time: Specimen Weight. Cryovials x 8. Normal X 4 - 1.) 335 mg 2.) 321 mg 3.) 408 mg 4.) 447 mg. Tumor x 4 - 1.) 351 mg 2.) 357 mg 3.) 252 mg 4.) 322 mg. Specimen Size. Plasma x 3. Serum x 2. Buffy coat X 1. Cryovials X 8. Normal x 4. Tumor X 4. FFPE x 8. Normal x 4. Tumor x 4. Study. Patient Consent. 2.",BRCA,0,"The pathology report states 'pNO (including sentinel): No regional lymph node metastasis' and 'Number of nodes positive for metastasis/total number nodes sampled: 0/11'. According to the rules provided, the absence of metastasis in the regional lymph nodes implies an N0 stage.",N0
604,TCGA-A7-A5ZX.A8834D03-81F5-43BC-A4AB-F215C89CB095,1,"Final Surgical Pathology Report. Procedure: Diagnosis. A. Lymph nodes, left axillary sentinel, excision -. Metastatic carcinoma in two of two (2/2) lymph nodes in this part. B. Breast, right, excision -. Invasive lobular carcinoma, 0.5 cm in greatest dimension (see. microscopic description, including for prognostic marker results) . Lobular carcinoma-in-situ. Fibrocystic changes, with microcalcifications present. Skin, nipple, and deep margin negative for tumor. C. Breast, left, excision -. Invasive lobular carcinoma, forming a 3.2 cm in greatest dimension. mass, with additional scattered foci of invasive lobular carcinoma. present. Invasive lobular carcinoma present at least very near (<1 mm from), and. possibly at, the deep margin in the separate foci. Skin and nipple negative for malignancy. Lobular carcinoma-in-situ. Biopsy site changes. Fibrocystic changes, with microcalcifications present. D. Lymph nodes, left axillary, excision. Metastatic carcinoma in nineteen of twenty-two (19/22) lymph nodes in. this part, including with metastatic carcinoma in the superior-most. lymph node. Microscopic Description: A,D. There is metastatic carcinoma in two of two (2/2) sentinel lymph. nodes in part A, and in nineteen of twenty-two (19/22) lymph nodes in. part D. Thus overall in this case, there is metastatic carcinoma in. twenty-one of twenty-four (21/24) lymph nodes (pN3a) There is. extracapsular extension. The largest involved lymph node is one of the. sentinel lymph nodes, 2.5 cm in greatest dimension. The largest lymph. node in part D is negative for tumor. There is metastatic carcinoma in. the superior-most lymph node in part D. Please note that in addition. to examining H&E stained sections, immunostains with antibodies to. keratin (AE1-AE3) were examined on representative blocks in both parts. to aid in assessment. B. The following template summarizes the findings in this part: Invasive carcinoma: Present. Histologic type: Invasive lobular carcinoma, identified. incidentally in block B4. Histologic grade : Overall grade: 2. Architectural score: 3. Nuclear score: 2. Mitotic score: 1. Greatest dimension (pT) : slightly >0.5 cm (pT1b). Specimen margins: Negative. Vessel invasion: Not identified. Nipple: Negative for tumor. Invasion of skin or chest wall: Not identified. Ductal carcinoma in situ: Not identified. Description of non-tumorous 'breast: Fibrocystic changes, with. microcalcifications present. Comments: There is also lobular carcinoma-in-situ present. Please note. that immunostains with antibodies to p63, keratin (AE1-AE3), and. e-cadherin were examined on representative blocks to aid in assessment. Distant metastasis (pM) : Not applicable. Breast prognostic marker results. Estrogen receptor: 80% / moderate intensity. Progesterone receptor: 5% / weak intensity. Her2 by IHC: 1+. Interpretation. Estrogen receptor: Positive. Progesterone receptor: Weakly positive. Her2 by IHC: Negative for Her2 expression. Comments. Fixation time : 30:00. Cold ischemia time: 0:30. The analyzed tissue met quality requirements of the ASCO/CAP guidelines. for Her2 testing. Control materials stained appropriately. Based on data collected in our laboratory and reported in the. literature we recommend FISH analysis for Her2 in cases that stain with. intermediate intensity by immunohistochemistry. Prognostic markers were done by immunohistochemical stain on paraffin. sections from 10% neutral buffered formalin fixed tissue using. antibodies on a Benchmark automated stainer. The Her2 antibody is clone 4B5 and has been approved by the FDA as an. aid in the assessment of breast cancer patients for whom Herceptin. treatment is considered. This laboratory meets the test validation and quality assurance. requirements of the ASCO/CAP guidelines for Her2, ER and PR testing for. carcinoma of the breast. C. The following template summarizes the findings in this part: Invasive carcinoma: Present. Histologic type: Invasive lobular carcinoma. Invasive lobular. carcinoma is identified comprising the main mass lesion, as well as in. multiple additional foci in random sections of this breast (blocks C7,. C8, C10, C11). Histologic grade: Overall grade: 2. Architectural score: 3. Nuclear score: 2. Mitotic score: 1. Greatest dimension (pT) : The main mass lesion is 3.2 cm in. greatest dimension (pT2). Specimen margins: Although the margins surrounding the main mass. lesion are negative, tumor in the additional foci of invasive lobular. carcinoma is present at least very near (<1 mm from). and possibly at,. the deep margin, with fragmentation hindering assessment. Vessel invasion: Not identified. Nipple: Negative for tumor. Invasion of skin or chest wall: Not identified. Ductal carcinoma in situ: Not identified. Description of non-tumorous breast: Fibrocystic changes, with. microcalcifications present. Biopsy site changes. Comments: There is also lobular carcinoma-in-situ present. Please note. that immunostains with antibodies to keratin (AE1-AE3), and e-cadherin. were examined on representative blocks to aid in assessment. Distant metastasis (pM) : Not applicable. Prognostic markers: Previously performed. Note: have reviewed this case. [A few of the antibodies used in our laboratory may be classified as. analyte specific reagents. These antibodies are monitored and. controlled in our laboratory and their performance for in vitro. diagnosis is well described in the medical literature. They have not. been cleared or approved by the FDA.]. Specimen. A. Left axillary sentinel node. B. Right breast. C. Left breast. D. Left axillary contents. Clinical Information. CLINICAL HISTORY: yo white female with invasive lobular cancer left. breast. Intraoperative Consultation. A. Metastatic carcinoma present. Gross Description. A. Received fresh in a container labeled ""left axillary sentinel node"". is a portion of tissue which is tan-yellow and fatty externally. On. palpation, it appears to consist of two adherent lymph nodes, spanning. an area 2.5 x 1 X 0.5 cm and 1.8 x 1 X 0.4 cm. On cut surface, both. vary from soft and tan to yellow, to firmer and tan-white. The. specimen is entirely submitted for frozen section in two blocks, with. one lymph node per block. B. Received fresh (excised at. placed in. formalin at. in a container labeled ""right breast"" is a 21 cm from. superior to inferior x 18 cm from medial to lateral x 3.2 cm from. anterior to posterior soft tan-yellow mastectomy specimen, with an. orienting suture present. On the anterior surface there is a 7. X 4.4. cm. tan-white skin ellipse, with a centrally located 1.3 X 1.3 x 1 cm. nipple. The intact deep margin is inked, and the specimen is serially. sectioned. On cut surface, the specimen consists of interspersed. yellow adipose tissue and tan tissue, without focal lesion. RS-10,. following fixation. BLOCK SUMMARY: B1,B2 - upper outer quadrant; B3,B - upper inner. quadrant; 85,B6 - lower inner quadrant; B7,B8 - lower outer quadrant;. B9 - central breast; B10 - nipple. C. Received fresh (excised at. placed in. formalin at. in a container labeled ""left breast"" is a 20.5 cm. from superior to inferior x 18.8 cm from medial to lateral x 3.2 cm. from anterior to posterior soft tan-yellow mastectomy specimen, with an. orienting suture present. On the anterior surface there is a 7 X 5 cm. tan-white skin ellipse, with a centrally located 1.2 x 1.2 x 0.5 cm. nipple. The intact deep margin is inked, and the specimen is serially. sectioned. There is a circumscribed 3.2 x 2.9 X 1.8 cm rubbery. tan-white mass within the upper outer quadrant. The lesion is 1.1 cm. from the deep margin, and 1.3 cm from the anterior surface, which is. subsequently inked blue. The specimen away from the nodule consists of. interspersed yellow adipose tissue and tan tissue, without additional. focal lesion. RS-12, following fixation. BLOCK SUMMARY: C1-C3 - tumor to anterior surface; C4,C5 - tumor to deep. margin; C6 - central tumor; C7 - upper outer quadrant; C8 - upper. inner quadrant; C9 - lower inner quadrant; C10 - lower outer quadrant;. C11 - central breast; C12 - nipple. D. Received fresh in a container labeled ""left axillary contents"" is a. 6.5 x 6.3 x 2.4 cm aggregate of yellow lobular fatty tissue which has a. suture designating superior axilla. Dissection of the specimen reveals. multiple lymph nodes, up to 3.5 cm in greatest dimension. RS-9,. following fixation, with all lymph nodes submitted, from superior to. inferior, with the superior-most lymph node in block D1, four lymph. nodes in block D2, five lymph nodes in block D3, three lymph nodes in. block D4, one sectioned lymph node in blocks D5 & D6, four lymph nodes. in block D7, one lymph node in block D8, and three lymph nodes in block. D9.",BRCA,3,"The report states that there is metastatic carcinoma in nineteen of twenty-two (19/22) lymph nodes in the left axillary region, indicating an N2 or higher stage. However, since there is extracapsular extension, which is a feature of N3 stage, the N stage is N3.",N3
1256,TCGA-E2-A1LI.B3A319BE-2230-43E2-91E5-A3B3C76B85BA,1,"SPECIMENS: A. SENTINEL LYMPH NODE LEFT AXILLA. B. SENTINEL LYMPH NODE #2 LEFT AXILLA. C. WIDE LOCAL EXCISION LEFT BREAST. DIAGNOSIS: A. SENTINEL LYMPH NODE #1, LEFT AXILLA: -ONE LYMPH NODE, NO TUMOR SEEN (0/1). B. SENTINEL LYMPH NODE #2, LEFT AXILLA: -ONE LYMPH NODE, NO TUMOR SEEN (0/1). C. WIDE LOCAL EXCISION, LEFT BREAST: -INVASIVE AND IN-SITU DUCTAL CARCINOMA, SBR GRADE III/III WITH. EXTENSIVE NECROSIS AND CANCERIZATION OF LOBULES, SEE TEMPLATE. Invasive Breast Cancer Template. INVASIVE TUMOR: Histologic type: ductal. Tumor Size (cm): 2.5 cm. Size of Invasive Focus: 2.5 cm. Grade, Histologic: 3. Grade, Nuclear: 3. Mitoses. 3. Scarff Bloom Richardson grade: III. Necrosis: present. Invasion Vasc/Lymphatic: absent. DCIS component. DCIS Quantity: <25%. DCIS Type: Clining. DCIS Location: outside main mass: diffuse. Nuclear grade: high. Necrosis: absent. Margins: DCIS present within 1 hpf of lateral and 1 mm of deep and medial margins. Lymph nodes: Negative (0/2). Stage, Pathology : T2N1. Hormone receptor status (by IHC): ER & PR: PENDING. HERCEPTEST (by IHC): Pending. ADDENDUM. The ER/PR/HER2 status of the invasive breast carcinoma was determined by immunohistochemistry. and quantitated via ACIS (image analysis). Results are as follows: ER. 0%. PR. 0%. HER2. 2.3 (borderline). A separate ACIS report has been generated. NOTE: FISH analysis for HER2 gene amplification has been ordered. Addendum. Fluorescence in situ hybridization (FISH) for Her-2 gene amplification. Her-2/neu gene: Not amplified. Ratio of Her-2/neu to CEP17: 1.21. The assay is performed on formalin fixed, paraffin embedded section using Her-2 DNA probe kit from. Vysis. The quality of the fluorescence signals and tissue section is adequate for analysis. The signals of. both Her-2 and CEP17 are counted in 60 invasive tumor nuclei. The Her-2 gene is considered amplified. when the ratio of Her-2 to CEP17 signal is >2.0. SPECIMEN(S): A. SENTINEL LYMPH NODE LEFT AXILLA B. SENTINEL LYMPH NODE #2 LEFT AXILLA C. WIDE. LOCAL EXCISION LEFT BREAST. CLINICAL HISTORY: None. FROZEN SECTION DIAGNOSIS: A. SENTINEL LYMPH NODE LEFT AXILLA. Touch prep: No tumor seen by Dr. B. SENTINEL LYMPH NODE #2 LEFT AXILLA. Touch prep: No tumor seen by Dr. GROSS DESCRIPTION: A. SENTINEL LYMPH NODE LEFT AXILLA. Received fresh is a 1x0.8x0.5cm. lymph node. It is bisected and touch prep done. Specimen entirely. submitted for permanent section. B. SENTINEL LYMPH NODE #2 LEFT AXILLA. Received fresh is sentinel lymph node left axilla measuring 0.7x0.5x0.4cm. It is bisected and touch prep. done. Submitted in toto in cassette B for permanent section. C. WIDE LOCAL EXCISION LEFT BREAST. Received fresh is an oriented portion of breast tissue measuring 6x5.5x2.7cm Sectioning shows a well. circumscribed tan nodular tumor mass measuring 2.5x1.8x1cm. It closely approaches the superior. posterior medial margin. Specimen is inked as follows: superior red, inferior orange, medial green,. lateral yellow, posterior black. Tumor tissue and normal tissue given for tissue procurement and tumor. sent for flow cytometry. Representative sections submitted in seventeen cassettes. Microscopic/Diagnostic Dictation: Pathologist. Final Review: Pathologist. Final: Pathologist. Addendum: Pathologist. Addendum Review: Pathologist. Addendum Final: Pathologist. Addendum: Pathologist, 1. Addendum Review: Pathologist,. Addendum Final: Pathologis.",BRCA,1,"The pathology report indicates that there is no tumor seen in the sentinel lymph nodes (0/X) but it does not specify if they were assessed by multilevel sectioning and immunohistochemistry. However, the presence of cancer in the breast itself (T2) and the absence of lymph node assessment in the report (N) implies an N1 or higher stage. The presence of metastasis in any axillary lymph node, regardless of its size or location, indicates an N1 or higher stage.",N1
