Unnamed: 0,patient_filename,t,text,type,n,mem_n_reasoning,mem_n_ans_str
1214,TCGA-E2-A15C.04FF2CF1-737B-4FD2-8A1D-F9B5488DE510,0,"SPECIMENS: TESA-E2-A15C-01A-PR. A. WLE RIGHT BREAST NEEDLE LOCALIZATION. B. SENTINEL L.N. #1 RIGHT AXILLA. C. SENTINEL L.N. #2. D. SENTINEL L.N. #3. E. SENTINEL L.N. #4. SPECIMEN(S): A. WLE RIGHT BREAST NEEDLE LOCALIZATION. B. SENTINEL L.N. #1 RIGHT AXILLA. C. SENTINEL L.N. #2. D. SENTINEL L.N. #3. E. SENTINEL ..N. #4. GROSS DESCRIPTION: A. WLE RIGHT BREAST NEEDLE LOCALIZATION. Received fresh labeled with the patient's identification and ""WLE right breast needle localization"" is a previously. inked 70g, 8 x 5 x 4cm needle localized lumpectomy with radiograph. Ink code: anterior-yellow, posterior-black,. superior-blue, inferior-orange, medial-green, lateral-red. Specimen is serially sectioned from lateral to medial into 9. slices revealing a tan white firm stellate 1.9 x 1.6 x 1.5cm mass, 0.7cm from the closest posterior margin in slices 3-. 6. Representatively submitted: A1-A2: lateral margin slice 1. A3: next to mass slice 2. A4-A8: slice 3 with mass - deep margin A4. A9: mass with deep margin slice 4. A10: inferior margin slice 4. A11-A12: slice 5. A13: mass with deep margin slice 6. A14: slice 7. A15: slice 8. A16: medial margin slice 9. B. SLN #1 RIGHT AXILLA. Received fresh is a tan pink lymph node 0.5 x 0.5 x 0.5cm. The specimen is sectioned and a touch prep is taken. Toto B1. C. SLN #2 RIGHT AXILLA. Received fresh is a tan pink lymph node 0.8 x 0.6 x 0.6cm. The specimen is sectioned and a touch prep is taken. Toto C1. D. SLN #3 RIGHT AXILLA. Received fresh is a tan pink lymph node 0.9 x 0.5 x 0.5cm. The specimen is sectioned and a touch prep is taken. Toto D1. E. SLN #4 RIGHT AXILLA. Received fresh is a tan pink lymph node 0.6 x 0.6 x 0.5cm. The specimen is sectioned and a touch prep is taken. Toto E1. DIAGNOSIS: A. BREAST, RIGHT, WIDE LOCAL EXCISION: INVASIVE DUCTAL CARCINOMA, SBR GRADE 2, MEASURING 1.7-CM, INVOLVING SKELETAL MUSCLE. - INTERMEDIATE NUCLEAR GRADE, DUCTAL CARCINOMA IN SITU, CRIBRIFORM TYPE. - SURGICAL RESECTION MARGINS NEGATIVE FOR TUMOR. - BIOPSY SITE CHANGES WITH FIBROSIS AND GRANULATION TISSUE. - SEE SYNOPTIC REPORT. B. LYMPH NODE, SENTINEL #1, RIGHT AXILLA, EXCISION: - ONE LYMPH NODE, NEGATIVE FOR METASTASES (0/1). C. LYMPH NODE, SENTINEL #2, RIGHT AXILLA, EXCISION: - ONE LYMPH NODE, NEGATIVE FOR METASTASES (0/1). D. LYMPH NODE, SENTINEL #3, RIGHT AXILLA, EXCISION: - ONE LYMPH NODE, NEGATIVE FOR METASTASES (0/1). E. LYMPH NODE, SENTINEL #4, RIGHT AXILLA, EXCISION: - ONE LYMPH NODE, NEGATIVE FOR METASTASES (0/1). SYNOPTIC REPORT - BREAST. Specimen Type: Excision. Needle Localization: Yes For mass. Laterality: Right. Invasive Tumor: Present. Multifocality: No. WHO CLASSIFICATION. Invasive ductal carcinoma, NOS 8500/3. Tumor size: 1.7cm. Tumor Site: Not specified. Margins: Negative. Distance from closest margin: 0.3cm. inferior. Tubular Score; 2. Nuclear Grade: 2. Mitotic Score: 2. Modified Scarff Bloom Richardson Grade: 2. Necrosis: Absent. Vascular/Lymphatic Invasion: None identified. Lobular neoplasia: None. Lymph nodes: Sentinel lymph node only. Lymph node status: Negative 0/4. DCIS present. Margins uninvolved by DCIS. DCIS Quantity: Estimate 1%. DCIS Type: Cribriform. DCIS Location Associated with invasive tumor. Nuclear grade: Intermediate. Necrosis: Absent. ER/PR/HER2 Results. ER: Positive. PR: Positive. HER2: Pending. Performed on Case: Pathological staging (pTN): pT 1c N 0. CLINICAL HISTORY: None provided. PRE-OPERATIVE DIAGNOSIS: None provided. INTRAOPERATIVE CONSULTATION: A. GROSS EXAMINATION: WLE right breast- 1. 9cm mass 0.7cm from closest deep margin. Diagnosis called to Dr. at. by Dr. TPB-TPC-TPD-TPE: Negative for carcinoma. Diagnosis called to Dr. at. by Dr. ADDENDUM: SYNOPTIC REPORT - BREAST HER-2 RESULTS. Specimen: Surgical Excision. Block Number: A9. Interpretation: EQUIVOCAL. Intensity: 2+. % Tumor Staining: 20%. Fish Ordered: Yes on Date. METHODOLOGY: Tissue was fixed in 10% neutral buffered formalin for no less than 8 and no longer than 24 hours. Her2 analysis. was performed using the FDA approved Dako HercepTest (TM) test kit. 1 using rabbit anti-. human HER2. This assay was not modified. External kit-slides provided by the manufacturer (cell lines with high,. low and negative HER2 protein expression) and in-house known HER2 amplified control tissue were evaluated along. with the test tissue. Adequate, well preserved, clear-cut invasive carcinoma was identified for HER2 evaluation. Interpretation of the HER2 immunohistochemical stain is guided by published results in the medical literature,. information provided by the reagent manufacturer and by internal review of staining performance. This assay has been validated according to the 2007 joint recommendations and guidelines from ASCO and CAP. and from the NCCN HER2 testing in Breast Cancer Task Force. The Pathology Department takes full responsibility. for this test's performance. PathVysion HER-2 DNA Probe Kit. Analytical Interpretation of Results: HER-2 NOT AMPLIFIED. Clinical Interpretation of results. Amplification of the HER-2 gene was evaluated with interphase fluorescence in-situ. hybridization (FISH) on formalin-fixed paraffin embedded tissue sections using a chromosome. 17 centromeric probe and a HER-2 probe that spans the entire HER-2 gene in the Pathology. Core Facility by Dr. A majority of tumors cells displayed 2 chromosome 17. signals and 2 HER-2 signals, with a HER-2/CEP 17 Ratio </=2.0, consistent with no. amplification of the HER2/neu gene. Block used. A9. Source of case: Tissue fixation formalin-fixed tissueOutside Case No: NA. Tissue source breast Results interpreted: yes. HER2/CEP17 ratio: 1.02. This ratio is derived by dividing the total number of LSI HER-2/neu signals by the total number of. CEP17 signals in at least 20 interphase nuclei with nonoverlapping nuclei in the neoplastic. mammary epithelial cells. Cells with no signals or with signals of only one color are disregarded. Method of ratio enumeration: manual count. Limitations. The Vysis PathVysion Kit is not intended for use to screen for or diagnose breast cancer. It is. intended to be used as an adjunct to other prognostic factors currently used to predict disease-free. and overall survival in stage II, node-positive breast cancer patients. In making decisions regarding. adjuvant CAF treatment, all other available clinical information should also be taken into. consideration, such as tumor size, number of involved lymph nodes, and steroid receptor status. No. treatment decision for stage II, node-positive breast cancer patients should be based on HER-2/neu. gene amplification status alone. Overview of this test. FDA APPROVED REAGENT. PathVysion HER-2 DNA Probe Kit is FDA approved for selection of. patients for whom Herceptin® theranv is being considered. These tests were performed in the. under the direction. of Dr. The results of these studies should always be interpreted in the context of the. clinical, morphological, and immunophenotypic diagnosis. ONCOTYPE DX BREAST CANCER ASSAY. RESULTS: Recurrence Score: 19. CLINICAL EXPERIENCE: Patients with a recurrence score of: 19 in the clinical validation study had an average. rate of Distant Recurrence at 10 years of 12%. ER Score: 10.2 Positive. PR Score: 8.8 Positive. Her2 Score: 8.9 Negative. Interpretation: ER. Negative < 6.5. Positive >= 6.5. PR Negative < 5.5 Positive >= 5.5. Her2 Negative <10.7 Positive >=1 11.5 Equivocal = 10.7 - 11.4. See separate. report for further information. Microscopic/Diagnostic Dictation: Pathologist,. Final Review: Pathologist,. Final: Pathologist,. Addendum: Pathologist,. Addendum Final: Pathologist,. Addendum: Pathologist,. Addendum Final: Pathologist,. Addendum: Pathologist, 1. Addendum Final: Pathologist,.",BRCA,0,"The pathology report indicates that all sentinel lymph nodes (SLN #1 to SLN #4) were negative for metastases, which means the N stage is N0 according to the AJCC staging system for breast cancer.",N0
1055,TCGA-BH-A18M.4F67B7BE-68C1-40E1-8276-2D26B46C744D,2,"PATIENT HISTORY: nnDATE of LMP: DATE OF LAST DELIVERY: PRE-OP DIAGNOSIS: LEFT BREAST CA. POST-OP DIAGNOSIS: SAME. OPERATIVE PROCEDURE: LEFT MOD. RADICAL MASTECTOMY, TRAM. CLINICAL HISTORY. MATERIAL SUBMITTED: LEFT (MOD) RADICAL MASTECTOMY, PROCUREMENT BY SURGICAL PROCEDURE. & axillary contents. INTRAOPERATIVE CONSULTATION: Skin: 6.0 by 4.5 cm. Overall breast: 17.0 by 24.0 by 5.0 cm. Tumor mass: 2.5 by 2.0 by 3.5 cm. Close to. anterior margin. Possible tumor approximately 1.0 cm close to inferior margin. ADDENDA: Addendum. HER-2/neu AMPLIFICATION ANALYSIS (FISH). AS PER THE REQUEST OF FLUORESCENCE IN SITU HYBRIDIZATION (FISH) WAS PERFORMED ON SURGICAL. CANCER) USING THE VYSIS DNA PROBE FOR THE HER-2/neu GENE. - (BREAST. CHROMOSOME 17 CENTROMERE SIGNALS WAS DETERMINED TO BE 2.05. A RATIO OF 2.0 OR GREATER IS CONSIDERED. THE RATIO OF HER-2/neu SIGNALS TO. AMPLIFIED; THEREFORE, THIS SPECIMEN IS AMPLIFIED,. Addendum. MATERIAL SUBMITTED: BLOCK ""A2"" FOR ER/PR AND HER-2/NEU (BREAST CANCER). FINAL DIAGNOSIS: ESTROGEN/PROGESTERONE RECEPTORS AND HER-2/NEU PERFORMED ON LEFT BREAST TISSUE. ESTROGEN RECEPTOR 20%; 1+ 30%; 2+ 30%; 3+ 20%) HSCORE OF 150. ESTROGEN RECEPTOR IS INTERPRETED AS. POSITIVE. PROGESTERONIE RECEPTOR (0- 10%; 1+ 10%; 2+ 20%; 3+ 60%) HSCORE OF 230. PROGESTERONE RECEPTOR IS INTERPRETED. AS POSITIVE. HSCORE: <= 15 NEGATIVE. > 15 <= 30 BORDERLINIS. > 30 POSITIVE. HER-2/NEU - DAKO HERCEPTEST: A WEAK TO MODERATE COMPLETE MEMBRANE STAINING IS OBSERVED IN MORE THAN 10% OF. THE TUMOR CELLS. HER-2/NEU IS INTERPRETED AS WEAKLY POSITIVE (SCORE 2+). NOTE: Hor-2/Neu FISH was ordered. The Her-2/NEU and estrogen assays were performed with FDA approved. methods. The progesterone receptor. immunoperoxidase test used in this case has been devaloned and the performance characteristics determined by. the Department of Pathology at. They have not been cleared. or. approved by the U.S Food and Drug Adinistration. HSCORE is modified from: Estrogen Receptor Analysis, Arch. Pathol Lab Med 1985; 109:716-721. My signature is attestation that I have personally reviewed the submitted material(s) and the final. diagnosis reflects that evaluation. FINAL DIAGNOSIS: FINAT. DIAGNOSIS: LEFT BREAST AND AXILLARY CONTENTS. - INFILTRATING MULTIFOCAL AND MULTICENTRIE-DUCTAL CARCINONA WITH FOCAL LOBULAR FEATURES, 2.5 BY 2.0 BY 3.5. CM, NOTTINGHAM SCORE 6/9 (TUBULES 3, NUCLEI 2, MITOSIS 1) WITH DUCTAL CARCINOMA IN-SITU, NON-COMEDO WITH. CENTRAL NECROSIS AND CRIBRIFORM TYPE. - DUCTAL CARCINOMA IN-SITU REPRESENT APPROXIMATELY 20% OF THE TUMOR VOLUME. - FIBROCYSTIC CHANGES. TWO (2) SEPARATE NODULE OF INFILTRATING DUCTAL CARCINOMA ARE PRESENT IN THE LOWER INNER QUADRANT, 0.8 CM,. AND UPPER INNER QUADRANT, 0.5 CM. - TUMOR IN THE LOWER INNER QUADRANT IS WITHIN 1.0 MM FROM THE MARGIN OF RESECTION. - ALL MARGINS OF RESECTION ARE FREE OF TUMOR. - FOUR OF SIX (4/6) LYMPH NODES ARE POSITIVE FOR METASTATIC TUMOR. - TWO (2) LYMPH NODES SHOW EXTRACAPSULAR SPREAD. - THREE (3) SMALL FIRM NODULES SIMULATING LYMPH NODES IN THE AXILLARY CONTENTS SHOW INFILTRATING DUCTAL. CARCINOMA. NOTE: ER/PR immunoperoxidase assay and Her-2/NEU testing will be performed on block ""A2"".",BRCA,1,"The report states that 'Four of six (4/6) lymph nodes are positive for metastatic tumor.' According to the rules provided, the presence of metastasis in axillary lymph nodes indicates an N1 stage.",N1
661,TCGA-A8-A092.93D66EAD-B7D3-4688-8EC9-75C4380619D9,1,Diagnosis: 5. Moderately differentiated invasive ductal carcinoma (tumor diameter: 3.8 cm) with. focal intraductal components and focal angioinvasion. NS.,BRCA,2,"The pathology report does not mention the presence or absence of metastasis in the axillary lymph nodes. Therefore, based on the given rules, the N stage is assumed to be N0, which indicates no evidence of metastasis in the axillary lymph nodes.",N0
1431,TCGA-LL-A6FQ.5C3D9179-7434-4776-A2FF-68CEA0149C68,1,"RUN DATE : RUN TIME : RUN USER: ACCT # : AGE/SX: ROOM. REG DR: BED: SPEC #: RECD. COLL. TIME IN FORMALIN: 29:21. nrs. CLINICAL INFORMATION: Pre-Op Diagnosis: Breast CA. Remarks: Specimen(s : Right breast stitch marks axillary contents. MICKOSCOPIC DIAGNOSTS. BREAST. RIGHT. MODIFIED RADICAL MASTECTOMY: MULTIFOCAL INVASIVE DUCTAL CARCINOMA - SEE COMMENT. LARGEST TUMOR MEASURES 4 CM: GRADE 2. ANGIOLYMPHATIC INVASION PRESENT. SEVEN (7) OF EIGHTEEN (18) AXILLARY LYMPH NODES POSITIVE FOR METASTATIC CARCINOMA. WITH FOCAL EXTRACAPSULARY EXTENSION PRESENT. MARGINS NEGATIVE. COMMENT(S). In addition to the two larger tumors present within the upper outer quadrant, a tumor is. also present associated with the nipple measuring 2 cm. This section was evaluated with. E-cadherin with appropriate controls demonstrating that the infiltrating carcinoma is. strongly positive for a E-cadherin confirming ductal type. Additionally, a couple of the. lymph nodes were evaluated with PanKeratin stain with appropriate controls. A section from. the larger mass was evaluated for a breast prognostic panel. PROTOCOL FOR EXAMINATION OF SPECIMENS WITH INVASIVE CARCINOMA OF THE BREAST. PROCEDURE. Total mastectomy. LYMPH NODE SAMPLING: Axillary disection. SPECIMEN LATERALITY: Right. HISTOLOGIC TYPE OF. INVASIVE CARCINOMA. Invasive ductal carcinoma (NOS). TUMOR SIZE: Greatest dimension of largest focus 4 cm. HISTOLOGIC GRADE : Nottingham histologic score. Glandular differentiation Score 3. Nuclear pleomorphism Score 2. Mitotic index: Score 1. Overall grade: Grade 2. TUMOR FOCALITY: Multiple foci of invasive carcinoma. DUCTAL CARCINOMA IN SITU: No DCIS is present. MACROSCOPIC AND MICROSCOPIC. RUN DATE : RUN TIME: RUN USER: Continued). SPEC #. COMMENT (s). EXTENT OF TUMOR: Skin: Invasive carcinoma directly invades into the. dermis without skin ulceration. MARGINS: Margins uninvolved by invasive carcinoma. Distance from closest margin: 3 cm. LYMPH NODES: Number of sentinel lymph nodes examined : 0. Total number of lymph nodes examined (sentinel and. non-sentinel) : 18. Number of lymph nodes with macrometastasis: 5. Number of lymph nodes with micrometastasis: 2. PATHOLOGIC STAGING: Primary tumor: pT2. Regional lymph nodes: pN2a. Distance metastasis: Not applicable. ANCILLARY STUDIES: See microscopic description (ER+, PR+ Her2-). GROSS DESCRIPTION: Received fresh for selection of tissue for tissue banking labeled with the patient's name. is a modified radical mastectomy specimen. The axillary contents measure 16 x 11 x 4 cm,. palpation of which reveals clinically suspicious lymph nodes. The breast weighs ,457. g. and measures 30 x 18 x 6 cm. Skeletal muscle fibers are present on the deep margin. À large mass is palpated in the upper outer quadrant. The deep margin adjacent to this area. is inked blue. The breast is covered by a 30 x 18 cm ellipse of dark brown skin. The. nipple and areolar complex is centrally placed. The nipple measures 2.5 cm in diameter and. is somewhat firm on palpation The breast is serially sectioned revealing a. well-circumscribed grayish-white tumor within the upper outer quadrant measuring 3 x 3.5 x. measures 4 3 cm. The tumor lies 1.5 cm from the skin surface. On further evaluation. there. cm À portion of the tumor is provided to the tissue bank coordinator. The deep margin. is an apparent separate tumor in the upper outer quadrant with a core needle biopsy. track. and this tumor measures 1.5 x 1 x 1 cm. This tumor is well away from the surgical margins. The remainder of the breast tissue is fatty in nature. No other discrete lesions are. identified. Examination of the axillary contents reveals multiple lymph nodes which range. from 0.5 cm to 3.5 cm in greatest dimension each. Some of these are grossly involved by. tumor. Some are fatty in nature. Cassette Summary: 1. nipple. 2. deep margin adjacent to larger tumor. sections of larger tumor. 8. tissue between larger tumor and smaller tumor. 9.10 -. sections of smaller tumor. 11-13-. sections of lateral. central. and medial breast tissue. respectively. 14. two highest axillary lymph nodes. 15. smaller whole lymph nodes. 16-21-. one lymph node each sectioned and entirely submitted. 22.23-. representative section of two large fatty lymph nodes. 24-26-. representative section of each grossly positive lymph node. RUN DATE. RUN TIME. RUN USER. Continued). SPEC #. MICROSCOPIC DESCRIPTION: BREAST PROGNOSTIC PANEL - LARGEST TUMOR. ASSAY TYPE. % TUMOR STAINED. INTENSITY. Estrogen Receptor. 100. 3. POSITIVE. Progesterone Receptor. 85. 2. POSITIVE. Ki-67. 24. 2. HIGH. SCORE. 1+. NEGATIVE. Her2/neu. REFERENCE RANGES: ER/PR; Negative <1%, Positive >=1%. : Ki-67; Low <10%, Boderline 10-20%, High >20%. Her2/neu: Negative 0-1+, Equivocal 2+, Positive 3+. Her2/neu results are reflexed to FISH. All immunohistochemical staining and the. were performed at. performed scoring and. interpretation utilizing. Clone MIB-1. Antibody clones: Clone 6F11;. Clone PgP1294; Ki-67,. Her2/neu,. CAP/ASCO guidelines for ER and PgR IHC: formalin fixation time 6-72 hours; cold ischemia. time 1 hour or less. CAP/ASCO guidelines for Her2 testing: formalin fixation time 6-48. hours: cold ischemia time 1 hour or less. Testing outside of these guidelines may affect. results. INTRAOPERATIVE CONSULTATION: RIGHT BREAST TISSUE: TUMOR ADEQUATE FOR TISSUE BANKING WITH PORTION OF TUMOR PROVIDED TO TISSUE BANK. COORDINATOR. Image. Image. Image. Image. (signature on file).",BRCA,2,"The pathology report indicates that seven out of eighteen axillary lymph nodes are positive for metastatic carcinoma. According to the rules provided, the presence of metastasis in one or more axillary lymph nodes indicates an N1 stage. However, in this case, the number of positive lymph nodes exceeds the threshold for an N1 stage (one or more positive lymph nodes), so the appropriate stage is N2.",N2
1419,TCGA-LD-A7W6.859561F6-3113-45C8-8FBE-718BF860B582,1,"DATE OBTAINED: DATE RECEIVED: SUBMITTING MD: DIAGNOSIS. 1. LEFT BREAST, PROPHYLACTIC SIMPLE MASTECTOMY: FOCAL ATYPICAL DUCTAL HYPERPLASIA. (UPPER INNER QUADRANT, 1 MM, SLIDE 1J), COLUMNAR CELL HYPERPLASIA/CHANGES, COMPLEX. SCLEROSING LESION, USUAL DUCTAL HYPERPLASIA, SMALL PAPILLOMATOSIS, SCLEROSING. ADENOSIS (WITH ASSOCIATED MICROCALCIFICATIONS) AND APROCRINE METAPLASIA; NEGATIVE FOR. MALIGNANCY; NEGATIVE SKIN AND NIPPLE. 2. RIGHT BREAST, SIMPLE MASTECTOMY: INVASIVE LOBULAR CARCINOMA. SIZE (INVASIVE): 30 mm. LATERALITY: Right. TUMOR FOCALITY: Unifocal. LESIONAL SITE: Upper inner quadrant extending to the retroareolar area. HISTOLOGIC TYPE: Invasive lobular carcinoma, mixed classical (70%) and pleomorphic/solld (30%) types. NUCLEAR GRADE: I-II of III (classical type); III (pleomorphic type). HISTOLOGIC GRADE: N/A. (invasive lobular carcinoma). IN-SITU COMPONENT: LCIS. (classical, NG I-II and pleomorphic, NG II-III types). LYMPH NODE SAMPLING: Positive (2/18, largest 23mm; no extranodal involvement) see specimen #3. AJCC CATEGORIES: Stage IIB. (assuming ""cM0"" status). pTNM: pT2. pN1a. CTNM: cT2. cN1. cMO. INTEGRITY/ORIENTATION: Intact specimen with designated margins. MARGINS (invasive lobular): Negative (> 1 cm). LYMPHOVASCULARI INVASION: Focal suspicious for LVI. MICROCALCIFICATIONS: Present, associated with benign acini. NIPPLE/SKIN: (if applicable). Negative for tumor. SKELETAL MUSCLE: Not present. OTHER: Prior biopsy site changes; focal usual ductal hyperplasia, columnar cell changes,. microcysts and apocrine metaplasia. 3. RIGHT AXILLARY CONTENTS, DISSECTION: TWO OUT OF EIGHTEEN (2/18) LYMPH NODES POSITIVE. FOR METASTATIC BREAST CARCINOMA, LARGEST TUMOR 2.3 CM, WITH NO EXTRANODAL. INVOLVEMENT. COMMENT. 88307X3. Clinical Diagnosis and History: Year old female with right central ILC and + LN, left prophylactic. cT2,cN1,cM0, clinical stage IIB. Tissue(s) Submitted: 1: LEFT BREAST MASTECTOMY SUTURE MARKS SHORT SUPERIOR AND LONG LATERAL. 2: RIGHT BREAST MASTECTOMY SUTURE MARKS SHORT SUPERIOR LONG LATERAL. 3: RIGHT AXILLARY CONTENTS. Gross Description: Specimen #1 is received fresh labeled left breast mastectomy suture marks short superior and long lateral and consists. of. a. 719. gram, 19 x 17 x 4 cm left total mastectomy specimen with two attached sutures, the short designating superior and the long. designating lateral. There is a 13 x 4.5 cm elliptical portion of white skin on the anterior aspect displaying a 1 x 1 x 0.3 cm everted. nipple. No skin lesions are appreciated. The posterior margin is intact. The specimen is inked as follows: Superior-anterior-. blue. Inferior-anterior-. green. Posterior-. black. The specimen is serially sectioned to reveal two indurated foci within the fibrous tissue, one located retroareolar located. approximately 3 cm deep to the nipple. The retroareolar nodule measures approximately 0.6 x 0.6 x 0.4 cm and is 2 cm from the. anterior margin and 6.5 cm from the deep margin. Approximately 3 cm lateral to the aforementioned nodule is an additional 0.5 x. 0.4 x 0.4 cm ill-defined tan rubbery to indurated nodule located at the junction of the lower outer and upper outer quadrant, 3 cm. from the deep margin and 4.5 cm from the nearest anterior inferior margin. The remaining cut surface consists of approximately. 75% yellow lobulated adipose tissue and 25% scattered white rubbery micronodular fibrous tissue. Representative sections are. submitted as follows: 1A-1B: retroareolar indurated nodule (no margins). 1C: closest anterior and posterior margins to retroareolar nodule. 1D: skin overlying retroareolar nodule. 1E: nipple. 1F-1G: lateral nodule (no margins). 1H: posterior and nearest anterior margin to lateral nodule. 11: upper outer quadrant. 1J: upper inner quadrant. 1K: lower outer quadrant. 1L: lower outer quadrant. Please note all representative quadrant sections contain no margins. Time in formalin: submitted same day. Specimen #2 is received fresh labeled right breast mastectomy suture marks short superior long lateral and consists of an 833. gram, 23 x 18 x 4 cm right total mastectomy specimen with two attached sutures, short designating superior and the long. designating lateral. There is an 11.5 x 4.2 cm white elliptical portion of skin on the anterior aspect, which displays a 1 x 1 x 0.5. cm. everted nipple. There is a 0.5 x 0.3 X 0.2 cm raised tan-white nodule located on the skin at 4 o'clock, 0.8 cm from the 4 o'clock. margin. The posterior margin is intact. The specimen is inked as follows: Superior-anterior-. blue. Inferior-anterior-. green. Posterior-. black. The specimen is serially sectioned to reveal a 3 x 2.8 x 2.0 cm ill-defined markedly indurated tan-white irregular mass located. predominantly in the upper inner quadrant and extending retroareolar. The mass is located 4 cm from the distal margin and 2.2 cm. from the overlying skin. The specimen is radiographed and two clips are identified located in contiguous slices. Palpably the two. clips are present within the same mass. The mass is located within 1.1 cm of the nearest anterior margin. The remaining breast. parenchyma consists of approximately 75% yellow lobulated adipose tissue and 25% scattered white rubbery nodular fibrous. tissue. No additional masses are identified. Representative sections are submitted as follows: 2A-2D: representative sections of mass, one section per contiguous slices to include both areas surrounding clips. 2E: representative deep margin and mass. 2F-2G: mass to nearest anterior margin. 2H: nipple and skin nodule to closest margin (green 4 o'clock margin). 21: upper outer quadrant. 2J: lower outer quadrant. 2K: lower inner quadrant. 2L: upper inner quadrant. Time in formalin: submitted same day. Specimen #3 is received in formalin labeled right axillary content and consists of a 10 x 7 x 3 cm aggregate of fat in which multiple. lymph nodes are identified ranging from 0.1 cm to 2.3 cm in greatest dimension. Some of the larger lymph nodes are sectioned. to. reveal white and focally firm cut surfaces possibly consistent with tumor. The lymph nodes are submitted in its entirety with the. exception of the largest grossly polypoid lymph node as follows: 3A: five lymph nodes. 3B: six lymph nodes. 3C-3G: each cassette contains one lymph node bisected. 3H-3J: one lymph node trisected. 3K: representative section of largest grossly positive lymph node. 3L: one lymph node bisected.",BRCA,1,"The report states that two out of eighteen (2/18) lymph nodes were positive for metastatic breast carcinoma, with the largest tumor measuring 2.3 cm. According to the rules provided, the presence of metastasis in axillary lymph nodes indicates an N1 stage.",N1
