Unnamed: 0,patient_filename,t,text,type,n,mem_n_reasoning,mem_n_ans_str
1508,TCGA-UL-AAZ6.1AD1E3C4-0D7C-447B-B330-0245F9159FCC,1,"SPECIMEN(S) RECEIVED. A: RIGHT TOTAL MASTECTOMY. B: SENTINEL LYMPH NODE #1 HOT. C: SENTINEL LYMPH NODE #2 HOT. D: SENTINEL LYMPH NODE #3 HOT. FINAL DIAGNOSIS. A. RIGHT TOTAL MASTECTOMY: SYNOPTIC REPORT. MICROSCOPIC: HISTOLOGIC TYPE: INVASIVE DUCTAL CARCINOMA. SIZE OF INVASIVE COMPONENT: 3.4 x 3.0 x 2.5 cm. TUMOR FOCALITY: SINGLE FOCUS OF INVASION. MACRO/MICRO EXTENT OF INVASIVE TUMOR. SKIN. TUMOR DOES NOT INVADE DERMIS/ EPIDERMIS. NIPPLE. DCIS DOES NOT INVOLVE THE NIPPLE EPIDERMIS. SKELETAL MUSCLE. SKELETAL MUSCLE IS PRESENT AND IS FREE OF CARCINOMA. DUCTAL CARCINOMA-IN-SITU (DCIS): DCIS IS PRESENT. EXTENSIVE INTRADUCTAL COMPONENT (EIC) NEGATIVE. LOBULAR CARCINOMA-IN-SITU (LCIS): NOT IDENTIFIED. HISTOLOGIC MODIFIED SCARFF-BLOOM-RICHARDSON GRADE: 2/3. MARGINS. MARGINS UNINVOLVED BY INVASIVE CARCINOMA. DISTANCE FROM CLOSEST MARGIN: 2.0cm (DEEP). MARGINS UNINVOLVED BY DCIS. DISTANCE FROM CLOSEST MARGIN: GREATER THAN 2.0cm (DEEP). MICROCALCIFICATIONS: PRESENT IN DCIS. TREATMENT EFFECT: RESPONSE TO NEOADJUVANT THERAPY. IN THE BREAST: NO KNOWN PRESURGICAL THERAPY. IN THE LYMPH NODES: NO KNOWN PRESURGICAL THERAPY. VENOUS / LYMPHATIC INVASION: NOT IDENTIFIED. SKIN / DERMAL LYMPHATIC INVASION: NOT IDENTIFIED. LYMPH NODES: NUMBER OF SENTINEL LYMPH NODES EXAMINED: 3. TOTAL NUMBER OF LYMPH NODES EXAMINED (SENTINEL AND NONSENTINEL): 4. NUMBER OF LYMPH NODES WITH MACROMETASTASES (>0.2 CM): 0. NUMBER OF LYMPH NODES WITH MICROMETASTASES (>0.2 MM TO 0.2 CM AND/OR >200 CELLS): o. NUMBER OF LYMPH NODES WITH ISOLATED TUMOR CELLS (0.2 MM AND 200 CELLS): 0. SIZE OF LARGEST METASTATIC DEPOSIT (IF PRESENT): o. EXTRANODAL EXTENSION: N/A. METHOD OF EVALUATION OF SENTINEL LYMPH NODES: H&E, MULTIPLE LEVELS. NOTE: ER/ PR/ HER-2/ MIB-1 RESULTS: SEE PRIOR REPORT. MACROSCOPIC. SPECIMEN TYPE: TOTAL BREAST. PROCEDURE: TOTAL MASTECTOMY. LYMPH NODE SAMPLING: SENTINEL LYMPH NODES WITH PARTIAL AXILLARY DISSECTION. SPECIMEN INTEGRITY: SINGLE INTACT SPECIMEN. SPECIMEN SIZE: 27 x 17 x 3.5 cm. LATERALITY: RIGHT. TUMOR SITE: 12 O'CLOCK POSITION. AJCC PATHOLOGIC STAGE (AJCC 7TH ED.): (pT2, pNO). B. SENTINEL LYMPH NODE #1 HOT: ONE (1) REACTIVE LYMPH NODE. NO METASTATIC CARCINOMA IDENTIFIED. c. SENTINEL LYMPH NODE #2 HOT: ONE (1) REACTIVE LYMPH NODE. NO METASTATIC CARCINOMA IDENTIFIED. D. SENTINEL LYMPH NODE #3 HOT: ONE (1) REACTIVE LYMPH NODE. NO METASTATIC CARCINOMA IDENTIFIED. CLINICAL DIAGNOSIS AND HISTORY. Right breast cancer. See. right breast Ca. GROSS DESCRIPTION. The specimen is received fresh in four containers labeled with the patient's name, medical record number, and identified as A. ""Right Total Mastectomy"", B. ""Sentinel Lymph Node #1 Hot"", C. ""Sentinel Lymph Node #2 Hot"" and D. ""Sentinel Lymph Node #3. Hot"". Specimen A consists of a mastectomy (811.1 grams, 27 x 17 x 3.5 cm) with a 22 x 9.5 cm skin ellipse and a centrally located. unremarkable 1.2 cm nipple. The specimen has been oriented by the surgeon with a stitch indicating the tail of the specimen. The. deep margin is inked black. The specimen is serially sectioned to reveal an irregular firm tan colored mass with focal hemorrhage. and calcification (3.4 x 3 x 2.5 cm) in the 12:00 position, 2 cm to the deep margin, 1.2 cm to the anterior skin margin, and 2 cm to. the nipple. The remaining breast parenchyma appears grossly unremarkable. One 0.7 cm lymph node is identified in the tail of the. specimen. The specimen is submitted representatively as follows: A1 thru A3, tumor, A4-tumor and anterior skin, A5-anterior skin. margin, A6-posterior deep margin, 7-nipple, A8 and A9-lateral upper quadrant, A10 and A11-lateral lower quadrant, A13-medial. upper quadrant, A14 and A15-medial lower quadrant, 16-0.7 cm lymph nodes, bisected. Specimen B consists of a 2.2 cm sentinel lymph node. The lymph node is serially sectioned and submitted entirely in two cassettes. labeled B1 and B2. Specimen C consists of a 2.5 cm sentinel lymph node. The lymph node is serially sectioned and submitted entirely in two cassettes. labeled C1 and C2. Specimen D consists of a 1 cm sentinel lymph node with fibroadipose tissue. Lymph nodes are serially sectioned and submitted. entirety in two cassettes labeled D1 and D2. the diagnosis(es) related thereto.",BRCA,0,"The pathology report indicates that all three sentinel lymph nodes were reactive and did not contain metastatic carcinoma. According to the rules provided, the absence of metastasis in the axillary lymph nodes implies an N0 stage.",N0
1362,TCGA-EW-A2FR.792A24F5-065E-4001-97F6-3F9BA121C65D,0,"RUN DATE. RUN TIME: Path # : Copies to: Submit Dr: SPECIMEN ID: A. - RIGHT BREAST MASS, B. . - ADDITIONAL RIGHT BREAST TISSUE, INFEROLATERAL,. C. . - ADDITIONAL RIGHT BREAST TISSUE, SUPERFICIAL, D. . - RIGHT AXILLARY CONTENTS. A. RIGHT BREAST MASS: - INVASIVE AND IN SITU, POORLY DIFFERENTIATED DUCTAL CARCINOMA, 1.0 CM. - THE TUMOR CELLS ARE NEGATIVE FOR er AND pr AND EQUIVOCAL FOR HER2 BY. IMMUNOHISTOCHEMISTRY PERFORMED ON PATIENT'S PREVIOUS BIOPSY (. - HER2 WITH FTSH TS AMDT,IFIED (POSITIVE), PERFORMED ON PATIENTS'S PREVIOUS BIOPSY. - SEE TUMOR SUMMARY. B. ADDITIONAL RIGHT BREAST TISSUE INFEROLATERAL: - INVASIVE DUCTAL CARCINOMA AT LESS THAN 1.0 MM FROM INKED MARGIN. C. ADDITIONAL RIGHT BREAST TISSUE SUPERFICIAL: - NO CARCINOMA SEEN IN FIBROADIPOSE TISSUE. D. RIGHT AXILLARY CONTENTS: - METASTATIC CARCINOMA TO NINETEEN OUT OF TWENTY-ONE LYMPH NODES (19/21). - PERINODAL TUMORAL EXTENSION IS SEEN. - LARGEST METASTATIC NODE: 2.5 CM. - SEE TUMOR SUMMARY. BREAST CANCER SUMMARY. SPECIMEN TYPE: LUMPECTOMY. This report is privileged, confidential and exempt from disclosure under applicable law. If you receive this report inadvertently, please call. and. return the report to us by mail. RUN DATE: RUN TIME: SURGICAL DATHOLOGY REPORT. FINAL DIAGNOSIS. LYMPH NODE SAMPLING: AXILLARY DISSECTION. SPECIMEN SIZE: GREATEST DIMENSION: 9.3 CM. ADDITIONAL DIMENSIONS: 9.0 x 6.5 CM. LATERALITY: RIGHT. TUMOR SITE: NOT SPECIFIED. SIZE OF INVASIVE COMPONENT: GREATEST DIMENSION: 1.0 CM. HISTOLOGIC TYPE: INVASIVE DUCTAL CARCINOMA. NOTTINGHAM SCORE: III (3+3+3=9). TUBULE FORMATION: MINIMAL LESS THAN 10% (SCORE 3). NUCLEAR PLEOMORPHISM: MARKED VARIATION IN SIZE, NUCLEOLI, CHROMATIN CLUMPING, ETC. (SCORE 3). MITOTIC COUNT: GREATER THAN 20 MITOSES PER 10 HPF (SCORE 3). PRIMARY TUMOR: pT1b - TUMOR MORE THAN 0.5 CM BUT NOT MORE THAN 1.0 CM IN GREATEST DIMENSION. REGIONAL LYMPH NODES: pN3a - METASTASIS IN 10 OR MORE AXILLARY LYMPH NODES (AT LEAST 1. TUMOR DEPOSIT GREATER THAN 2.0 MM) OR METASTASIS TO THE INFRACLAVICULAR LYMPH NODES. NUMBER EXAMINED: 21. NUMBER INVOLVED: 19. DISTANT METASTASIS: pMX - CANNOT BE ASSESSED. MARGINS: MARGINS UNINVOLVED BY INVASIVE CARCINOMA. CLOSEST MARGIN: AT LESS THAN 1 MM. (INFEROLATERAL MARGIN ) (SPECIMEN B). MARGINS UNINVOLVED BY DCIS. CLOSEST MARGIN: AT LESS THAN 1 MM. (INFEROLATERAL MARGIN) (SPECIMEN B). VENOUS/LYMPHATIC INVASION: ABSENT. MICROCALCIFICATIONS: PRESENT IN DCIS. AJCC: pT1b, N3a, MX. IMMUNOHISTOCHEMISTRY STAINS AND HER2 FISH ANALYSIS PERFORMED ON PATIENT'S PREVIOUS BIOPSY. ER - NEGATIVE. PR - NEGATIVE. HER2 IHC - EQUIVOCAL. HER2 BY FISH - POSITIVE (AMPLIFIED). This report is privileged, confidential and exempt from disclosure under applicable law. If you receive this report inadvertently, please call. and. return the report to us by mail. RUN DATE: RUN TIME: CLINICAL HISTORY-. PRE-OP DX: RIGHT BREAST CARCINOMA. PROCEDURE: RIGHT BREAST LUMPECTOMY, AXILLARY LYMPH NODE DISSECTION,. GROSS DESCRIPTION: SPECIMEN A IS LABELED RIGHT BREAST MASS AND CONSISTS OF YELLOW-GRAY LUMPECTOMY MEASURING. 9.3 x 9.0 x 6.5 CM AND WEIGHS 75.7 GRAMS. THE SPECIMEN IS ORIENTED WITH A SHORT STITCH AT. THE SUPERIOR MARGIN, A LONG STITCH AT THE LATERAL MARGIN AND CLIP INFEROLATERAL CORNER. THE SPECIMEN REVEALS A LIGHT TAN ELLIPSES OF SKIN MEASURING 3.5 x 0.8 CM. THE SPECIMEN IS. INKED AS FOLLOWS: SUPERIOR MARGIN INKED RED, INFERIOR MARGIN INKED ORANGE, LATERAL MARGIN. INKED GREEN, MEDIAL MARGIN INKED BLUE, INFEROLATERAL MARGIN INKED YELLOW AND DEEP MARGIN. INKED IN BLACK. MULTIPLE CROSS SECTIONS REVEAL AN ILL-DEFINED, GRAY-PINK, INDURATED AREAS. MEASURING APPROXIMATELY 1.0 x 1.0 CM. THIS AREA IS LOCATED AT 0.7 CM FROM THE INFERIOR. MARGIN (NEAREST) THERE IS AN ILL-DEFINED, GRAY-PINK MICROCYSTIC ASPECT LOCATED AT 0.3. CM FROM THE INFEROLATERAL MARGIN (NEAREST). THE REST OF THE SPECIMEN IS YELLOW, HOMOGENOUS. CUT SURFACE. THE STROMA IS SUBMITTED IN TOTO IN 16 CASSETTES. 1 - SUPERIOR MARGIN. 2 - INFEERIOR MARGIN. 3 - LATERAL MARGIN. 4 - MEDIAL MARGIN. 5 - ANTERIOR MARGIN. 6 - DEEP MARGIN. 7-12 - TUMOR. 13-16 -- CLIPPED AREA. SPECIMEN B IS LABELED ADDITIONAL RIGHT BREAST TISSUE, INFEROLATERAL MARGIN AND CONSISTS OF. YELLOW-PINK ADIPSOSE TISSUE MEASURING 3.5 x 1.5 x 0.7 CM. THE NEW MARGIN IS INKED YELLOW. AND THE OPPOSITE MARGIN IS INKED ORANGE. MULTIPLE CROSS SECTIONS REVEAL A GRAY-PINK,. INDURATED AREA MEASURING 1.0 CM. THE REST OF THE TISSUE IS YELLOW, HOMOGENEOUS CUT. SURFACE. SUBMITTED IN TOTO IN FIVE CASSETTES. SPECIMEN C IS LABELED ADDITIONAL RIGHT BREAST TISSUE, SUPERFICIAL AND CONSISTS OF THREE. YELLOW-PINK, ADIPOSE TISSUE MEASURING IN AGGREGATE 3.0 x 2.0 x 1.0 CM. CROSS SECTIONS. REVEAL YELLOW-GRAY, HOMOGENEOUS CUT SURFACE. SUBMITTED IN TOTO IN THREE CASSETTES. SPECIMEN D IS LABELED RIGHT AXILLARY CONTENTS AND CONSISTS OF GRAY-PINK, ADIPOSE TISSUE. MEASURING 9.0 x 7.0 x 3.5 CM. CROSS SECTIONS REVEAL 28 POSSIBLE LYMPH NODES MEASURING UP. TO 2.5 CM IN GREATEST DIMENSION. REPRESENTATIVE SECTIONS SUBMITTED IN 14 CASSETTES. 1-2 - ONE LYMPH NODE BISECTED. 3-8 - ONE LYMPH NODE BISECTED. 9 - TWO LYMPH NODES BISECTED. 10-14 - MULTIPLE LYMPH NODES. This report is privileged, confidential and exempt from disclosure under applicable law. If you receive this report inadvertently, please call. and. return the report to us by mail. RUN DATE: RUN TIME: GROSS DESCRIPTION: (Continued). This report is privileged, confidential and exempt from disclosure under applicable law. If you receive this report inadvertently, please call. and. return the report to us by mail.",BRCA,3,"The pathology report indicates metastasis in nineteen out of twenty-one axillary lymph nodes (19/21), which according to the rules provided, indicates an N3 stage.",N3
700,TCGA-AC-A2FB.F6CFE506-16BA-475A-A81F-1AC4B2EFE24A,1,"Histopathological Examination. 1 Complete: Pre-Op Diagnosis : Absenge of Rreast, Personal History Of Breast Cancer -. MD. Specimens. : Breast, left simple mastectomy for expo study. Suture. marking margins: long-lateral, short-superior. Lymph Node, Sentinel left axillary. Frozen Diagnosis. : GROSS EXAMINATION: A. The specimen is received in a container labeled with the. name of the patient and identified as breast, left simple. mastectomy. The specimen consists of a mastectomy measuring. en bloc 11.5 x 9.! x 4 cm and weighing 158 grams. There is. an anterior ellipse of skin measuring 6 x 3 cm with a. central 3 cm areolar complex with retracted nipple. Sections. of nipple/areola are sampled in block 1. The skin is. sampled in block 2. The superficial superior margin is. inked orange and the superficial inferior margin is inked. blue. The deep margin is inked green and the specimen. sectioned, showing an oval grey-tan firm mass measuring 2.8. cm in the upper inner quadrant of the breast. Grossly, this. mass is 0.4 cm from the inked deep margin of resection,. which is submitted in block 3. Sections of the mass are. submitted in blocks 4-7. The remaining breast is composed. of yellow lobulated adipose tissue admixed with islands of. gray-white rubbery tissue. The breast is divided into four. quadrants, upper inner, lower inner, upper outer and lower. outer and sampled in blocks 8-11 respectively Minimal. axillary tissue is present and no lymph nodes are. identified. Formalin fixation time is 11 hours. B. The specimen is received in a container labeled with the. name of the patient and identified as lymph axillary. sentinel node. Specimen Size: 1.8 x 1.5 x 1 cm. No. of Nodes 1. Size of Nodes : 1.8 cm. The specimen is sectioned and entirely submitted. THIS CONFIDENTIAL AND PRIVILEGED DOCUMENT/INFORMATION IS PROTECTED BY. FEDERAL AND STATE LAW. UNAUTHORIZED DISCLOSURE, DISSEMINATION. OR DUPLICATION IS PROHIBITED. Path # : . of 3. Visit # : DIAGNOSIS BASED ON GROSS AND MICROSCOPIC EXAMINATION: : A. Breast, left, simple mastectomy: Invasive lobular adenocarcinoma,apleomorphic variant,. Nottingham grade 2, 2.8 cm (see cancer case summary. checklist below). B. Lymph node, left axillary sentinel, excision: - One lvmph node, no tumor present (0/1). MACROSCOPIC. SPECIMEN TYPE: Mastectomy. LYMPH NODE SAMPLING: Sentinel lymph node only. LATERALITY Left. TUMOR SITE: Upper inner quadrant. MICROSCOPIC. SIZE OF INVASIVE COMPONENT: Greatest dimension: 2.8 cm (based on gross tumor size) . HISTOLOGIC TYPE: Invasive lobular adenocarcinoma,. pleomorphic variant. HISTOLOGIC GRADE: NOTTINGHAM HISTOLOGIC SCORE. Tubule formation: Minimal less than 10% (score=3). Nuclear pleomorphism: Moderate increase in size, ect. (score=2). Mitotic count for a 40 x objective with a field area of. 0.152 MMTT: 0-5 mitoses per 10 HPF (score=1). Total Nottingham Score: Grade 2 (6-7 points). EXTENT OF INVASION. PRIMARY TUMOR (PT) : pT2: Tumor more than 2.0 but not more. than 5.0 cm in greatest dimension. REGIONAL LYMPH NODES (PN) : pNO: No regional lymph node. metastasis histologically (i.e. none greater than 0.2 mm). no additional examination for isolated tumor cells. Number examined: 1. Number involved 0. DISTANT METASTASIS (PM) : pMX: Cannot be assessed. MARGINS: Uninvolved by invasive carcinoma. Distance of carcinoma from closest margin: 4 mm (deep. margin) . VENOUS/LYMPHATIC (LARGE/SMALL VESSEL) INVASION (V/L) : Absent. MICROCALCIFICATIONS: Present in non-neoplastic tissue. ADDITIONAL PATHOLOGIC FINDINGS : Proliferative fibrocystic changes with ductal hyperplasia,. columnar cell change, sclerosing adenosis (confirmed by. presence of p63 positive myoepithelial cells surrounding. epithelial structures, with appropriate controls), apocrine. metaplasia, and associated microcalcifications. THIS CONFIDENTIAL AND PRIVILEGED DOCUMENT/INFORMATION IS PROTECTED BY. FEDERAL AND STATE LAW. UNAUTHORIZED DISCLOSURE, DISSEMINATION. OR DUPLICATION IS PROHIBITED. Path # : of 3. Visit # : Prior bropsy site. COMMENT: Estrogen and progesterone receptors and Her2neu studies were. performed on the prior biopsy. with results of. estrogen receptor 2+, progesterone receptor 3+, and HER2/neu. 3+. E cadherin, also performed on the prior biopsy, was. negative, confirming a lobular phenotype. Intradepartmental consultation obtained. Results communicated to. THIS CONFIDENTIAL AND PRIVILEGED DOCUMENT/INFORMATION IS PROTECTED BY. FEDERAL AND STATE LAW. UNAUTHORIZED DISCLOSURE, DISSEMINATION. OR DUPLICATION IS PROHIBITED. Path # : I. Visit # :",BRCA,0,"The pathology report states 'One lymph node, no tumor present (0/1)'. According to the rules provided, the absence of tumor in the sentinel lymph node indicates an N0 stage.",N0
1477,TCGA-OL-A5RY.C8297152-7551-49A1-8C9D-6B411391AC77,0,"FINAL PATHOLOGIC DIAGNOSIS. A. Right axillary sentinel lymph node #1, biopsy: - Metastatic ductal carcinoma (1.3cm) involving single lymph node (1/1). B. Right axillary sentinel lymph node #2, biopsy: - One lymph node, no tumor (0/1). C. Right axillary sentinel lymph node #3, biopsy: - One lymph node, no tumor (0/1). D. Right axillary non sentinel lymph node, biopsy: - One lymph node, no tumor (0/1). E. Right breast, wire-guided lumpectomy: - Invasive ductal carcinoma, SBR III, multiple foci (largest 1.3cm). - Ductal carcinoma in situ high grade, solid, cribriform and micropapillary. types with central necrosis and associated calcifications; DCIS spans entire. specimen (8cm in greatest dimension). F. Right breast, new inferior lateral margin, excision: - Ductal carcinoma in situ, intermediate grade, microscopic foci (largest 5mm). - Microscopic foci (each 1mm) of DCIS present at outer medial aspect of specimen. G. Right breast, new outer lateral margin, excision: - Ductal carcinoma in situ, rare microscopic foci (largest 1mm). - DCIS >1cm from nearest new margin. Breast Pathologic Parameters. 1. Invasive carcinoma: A. Microscopic measurement: Multifocal; largest focus (measures 1.3cm). B. Composite histologic (modified SBR) grade: III (largest focus). - Architecture: 2. - Nuclear grade: 3. - Mitotic count: 3. C. Associated intraductal carcinoma in situ (DCIS): - High grade, solid, cribriform and micropapillary types. - DCIS involves entire specimen and spans 8cm in greatest dimension. 2. Excisional biopsy margins: Positive. - DCIS present at medial margin, <1mm from anterior, posterior, lateral,. superior, and inferior margins (tumor approaches margins at multiple foci. throughout specimen). - Invasive carcinoma at inferior and 1mm from posterior margin; additional. margins greater than 2mm away. 3. Blood vessel and lymphatic invasion: Present in breast parenchyma. 4. Axillary lymph nodes: Positive (1/4). - Size of largest metastatic deposit: 13 mm. - Extranodal extension: absent. 5. Special studies. - ER: Weak expression in 10% of invasive tumor nuclei. - PR: No expression. - Her2/neu antigen (FISH): Amplified (ratio: 7.6). 6. pTNM (AJCC, 7th edition, 2010): pT1c(m), N1(sn), MX. Effective. is Checklist utilizes the 7th edition TNM staging. system for breast of the American Joint Committee on Cancer (AJCC) and the. International Union Against Cancer (UICC). has1. Interpretation performed by the Attending Pathologist and reviewed with the. Resident/Fellow. Clinical History: Patient is a. -year-old female with right breast IDC undergoing lumpectomy and. sentinel lymph node biopsy. Specimens Received: A: Sentinel lymph node #1. B: Sentinel lymph node #2. C: Sentinel lymph node #3. D: Non-sentinel lymph node. E: Right wire-guided lumpectomy. F: Right breast new inferior lateral margin. G: New outer lateral margin. Gross Description: The specimens are received in seven containers each labeled with the patient's. name and medical record number. A. The first container is additionally identified as, 'sentinel lymph node #1'. Received fresh and placed in formalin the specimen consists of a 1.5x1x1cm. lymph node which is serially sectioned and entirely submitted in cassette A1. B. The second container is additionally identified as, 'sentinel lymph node. #2'. Received fresh and placed in formalin the specimen consists of a 1x 0.5 X. 0.3 cm lymph node which is bisected and is entirely submitted in cassettes B1. C. The third container is additionallyidentified as, 'sentinel lymph node #3'. Received fresh and placed in formalin the specimen consists of a 0.7 x 0.3 x 0.3. cm lymph node which is entirely submitted in cassette C1. D. The fourth container is additionally identified as, 'non-sentinel lymph. node'. Received fresh and placed in formalin the specimen consists of a 0.5 X. 0.3 x 0.3 cm lymph node which is entirely submitted in cassette D1. E. The fifth container is additionally identified as, 'right wire guided. lumpectomy'. Received fresh on a radiographic grid is a 102 gm lumpectomy. specimen measuring 8 cm from medial to lateral, and 8 in cm from superior to. inferior and 3 cm from anterior to posterior. The specimen is oriented with a. short suture designating the superior pole and a long suture designating the. lateral pole. There is a wire entering the antero-lateral aspect of the specimen. through grid coordinate E5. Accompanying the specimen is an x-ray demonstrating. a metallic clip located in grid coordinate E3. There is a circled mass in grid. positions C3, C4, D3, D4, centered on the clip. The wire enters the specimen in. grid coordinates E5 terminates in E3. 2 other areas of calcifications are. circled in grid coordinates D6 (#2) and F4-F5 (#3). The margins are inked as follows: anterior - black;. posterior - red;. superior - blue;. inferior - green;. medial - yellow;. lateral - violet. The specimen is serially sectioned from medial to lateral into 8 slices. The. area of calcifications noted in grid D6 begins in the slides #2 and extends. laterally the tumor the main to mass and measures 3 X 2 x 1.5 cm. is found in. the slices #2 and 3 adjacent to the red and green ink. The main mass, which is. irregular and firm, is present in slices #5 to #7 and measures 3.5 X 2.5 X 2 cm. It is present adjacent to red ink and is 1 cm from black ink, 3 cm from green. ink, 1.5 cm away from blue ink. The area of calcification noted in grid F4 and. F5 is present in the slices numbers 7 and activated ink measuring 1.5 X 1.1 x 1. cm and is continuous with the main mass. The metallic clip is identified in. slice 6. The wire enters the specimen in slice 5 and terminates in slice 5. The. remainder of the breast parenchyma is white-yellow and lobulated with no. additional masses or lesions. Entire mass including both calcified area was has a largest dimension of 5 cm. Specimen is submitted in toto. Block summary: E1-E4: medial margin, slice 1. E5-E9: slice 2, area of calcification. E10-E23: slice 3, area of calcification. E24-E31: slice 4. E32-E44; slice 5. E45-E62: slice 6, clip in E49-E50. E63-E78: slice 7. E79-E86: lateral margin, slice 8. F. The sixth container is additionally identified as, 'right breast, new. inferior lateral margin'. Received fresh on the radiographic grid is a 13.5 gm,. 6.5 X 4 X 1.2 cm medial inferior lateral margin which is oriented as follows: - new outer lateral margin is marked with a long black stitch (violet). - new outer medial margin is designated with a short black stitch (yellow). - new outer anterior margin is designated with a short blue stitch (black). - new outer posterior margin is designated with a long blue stitch. (red). Inner cauterized margin is inked green. An area of calcification is noted on the. accompanying x-ray in grid D4-D5-E5. Specimen is a serially sectioned from. lateral to medial in to 14 slices. An area of calcification is present in slice. #6 and measures 1 X 0.5 X 0.3 cm. No other lesions are identified. The specimen. is entirely submitted from lateral to medial. F1: slice 1-3. F2: slice 4-5. F3: slice 6. F4: slice 7. F5-F6: slice 8. F7: slice 9. F8: slice 10. F9: slice 11. F10: slice 12. F11: slice 13-14. G. The seventh container is additionally identified as, 'new outer lateral. margin'. Received fresh ona radiographic grid is a 20 gm, 8 x 3.5 X 1 cm new. outer lateral margin. Specimen is oriented as follows. - new outer superior is designated with a short black stitch (blue). - new outer inferior is designated with a long black a stitch (green). - new outer anterior is designated with a short blue stitch (black). - new outer posterior is designated with a long blue stitch (red). Inner cauterized margin is inked violet. Specimen is serially sectioned from. lateral to medial into 14 slices and does not contain any distinct masses or. lesions. Specimen is submitted in toto in cassettes G1-14.",BRCA,1,"The pathology report indicates that one axillary lymph node (sentinel lymph node #1) is positive for metastasis, which is consistent with an N1 stage according to the rules provided.",N1
613,TCGA-A8-A06R.B6B7939C-63AF-4B52-B494-AA09A9C03871,1,"Diagnosis: Poorly differentiated invasive ductal carcinoma (tumor diameter: 2.8 cm). Concluding tumor classification: NOS, G III, pT2N1aLOVORO. (compare E. no. xxxx).",BRCA,1,"The pathology report indicates the presence of a positive axillary lymph node (N1a), as stated in the report: 'N1a'. Therefore, the N stage is N1.",N1
1169,TCGA-D8-A27L.1281F503-C256-4DFF-A3BD-BD5E51CE4249,0,"page 1 / 1. copy No. 2. Examination: Histopathological examination. PESEL: XX. Gender: F. Material: Multiple organ resection 1 right breast.). Expected time of examination: up to 8 working days. Clinical diagnosis: Cancer of the right breast. Macroscopic description: Right breastsized 19.0 x 14.0 x 2.5 cm removed without axillary tissues and with a skin flap of 14 x 8 cm. Tumour sized 1.1 x 0.6. x 1.0 cm found in upper inner quadrant, located 2.5 cm from the lower boundary, 0.5 cm from the base and 1.0 cm from the. skin. Microscopic description: Carcinoma ductale invasivum NHG1 (2 + 2 + 1/5 mitoses/10 HPF - visual area 0.55 mm). Numerous foci of carcinoma ductale in situ (DCIS) found within the tumour (cribrate type with medium nuclear atypia and point. necrosis, 30% of the tumour). Mamilla sine laesionibus. Glandular texture showing lesions of the type mastopathia fibrosa et cystica. Invasive lesions are situated 5 cm from the base. Histopathological diagnosis: Carcinoma ductale invasivum et in situ mammae dextrae. Invasive and in situ ductal carcinoma of the right breast. i. ( NHG1, pT1c, pNx). Compliance validated by: dr. Results of immunohistochemical examination: Estrogen receptors found in over 75% of neoplastic cell nuclei. Progesterone receptors found in over 75% of neoplastic cell. nuclei. HER2 protein stained with Ventana's Pathway HER-2/neu (4B5) Rabbit Monoclonal Antibody. Negative reaction in. invasive cancerous cells (Score=1+). di. dr.",BRCA,2,"The pathology report does not mention the presence of metastasis in any axillary lymph nodes. Therefore, based on the provided rules, the N stage is N0.",N0
