Unnamed: 0,patient_filename,t,text,type,n,cmem_n_reasoning,cmem_n_ans_str,cmem_n_num_update
815,TCGA-AO-A12D.9363D53D-BC3B-4AC0-8185-536C6DB3A6AE,0,"Clinical Diagnosis & History: Core biopsy of left breast shows infiltrating carcipoma with FNA of node. positive for carcinoma. Right mastectomy is prophylactic. Specimens Submitted: 1: SP: Right breast. 2: SP: Left breast and axillary contents levels 1 and 2. 3 : SP: Sentinel node #1 level 1 right axilla. 4: SP: Additional left breast upper flap tissue. DIAGNOSIS: 1). BREAST, RIGHT; PROPHYLACTIC MASTECTOMY: - BENIGN BREAST TISSUE WITH FLORID SCLEROSING ADENOSIS, FOCAL DUCTAL. HYPERPLASIA WITHOUT ATYPIA, SECRETORY CHANGES, CYSTS, FIBROADENOMATOID. CHANGES AND A FEW MICROCALCIFICATIONS. UNREMARKABLE NIPPLE. BREAST AND AXILLARY CONTENTS LEVELS 1 AND 2, LEFT; MODIFIED. RADICAL MASTECTOMY AND AXILLARY LYMPH NODE DISSECTION: INVASIVE DUCTAL CARCINOMA, HISTOLOGIC GRADE II-III/III, NUCLEAR GRADE. III/III, ASSOCIATED WITH LYMPHOCYTIC INFILTRATE AND MEASURING 1.9 CM IN. LARGEST DIMENSION MICROSCOPICALLY. - A MINOR COMPONENT OF DUCTAL CARCINOMA IN SITU (DCIS) SOLID AND. MICROPIPILLARY TYPES WITH HIGH NUCLEAR GRADE AND NECROSIS, IS PRESENT. ADMIXED WITH AND AWAY FROM THE INVASIVE CARCINOMA. - NO INVOLVEMENT OF THE NIPPLE, SKIN OR THE SURGICAL MARGINS BY. CARCINOMA IS IDENTIFIED. - LYMPHOVASCULAR INVASION IS PRESENT. THE NON-NEOPLASTIC BREAST TISSUE SHOWS PREVIOUS BIOPSY SITE CHANGES,. FLORIDSCLEROSING ADENOSIS, DUCTAL HYPERPLASIA WITHOUT ATYPIA AND A BENIGN. INTRADUCTAL PAPILLOMA. THE LYMPH NODE STATUS IS AS FOLLOWS (EXPRESSED AS THE NUMBER OF POSITIVE. LYMPH NODES IN RELATION TO THE TOTAL NUMBER OF LYMPH NODES EXAMINED) : LEVEL I: 0/8. LEVEL II: 1/7. THERE IS FOCAL EXTRANODAL EXTENSION OF CARCINOMA (>2 MM AND PERINODAL. VASCULAR INVASION. - RESULTS OF SPECIAL STAINS (ER, PR, HER-2/NEU) WILL BE REPORTED AS AN. ADDENDUM. the. Page 2 or >. 3). LYMPH NODE, SENTINEL #1 LEVEL 1 RIGHT AXILLA; BIOPSY: ONE BENIGN LYMPH NODE (0/1). - ADDITIONAL H/E LEVELS AND CYTOKERATIN (AE1:AE3) IMMUNOSTAINS ARE ALSO. NEGATIVE FOR METASTATIC TUMOR. 4). SOFT TISSUE, ADDITIONAL LEFT BREAST UPPER FLAP; EXCISION: ADIPOSE TISSUE, NEGATIVE FOR TUMOR. I ATTEST THAT THE ABOVE DIAGNOSIS IS BASED UPON MY PERSONAL EXAMINATION OF. THE SLIDES (AND/OR OTHER MATERIAL), AND THAT I HAVE REVIEWED AND APPROVED. THIS REPORT. Special Studies: Special Stain. Commen t. ER-C. PR-C. HER2-C. NEG-HER2. NEG CONT. IMM RECUT. ER-C. PR-C. ER-C. PR-C. MER2 C. NEG-HER2. NEG CONT. IMM RECUT. AE1:AE3. NEG CONT. IMM RECUT. Gross Description: 1). The specimen is received fresh, labeled ""Right breast. stitch marks. axillary tail"". It consists of a breast measuring 18 x 17 x 5 cm overlaid. by white-tan skin, measuring 10 x 4.5 cm. There is a centrally placed,. slightly inverted nipple, measuring 1.2 cm in diameter, surrounded by an. unrenarkable arcola, measuring 4 cm in diameter. Cross-sectioning of the. specimen reveals dense fibroid tissue in the central portion of the. specimen, but no discrete mass is identified. Representative sections are. taken. Summary of Sections: N Nipple. NB - Nipple base. DM - Deep margin. raye , UL ,. FT - Fibroadipose tissue. LIQ - Lower inner quadrant. LOQ - Lower outer quadrant. UIQ - Upper inner quadrant. UOQ - Upper outer quadrant. 2). The specimen is received fresh, labeled ""Left breast and axillary. contents, levels 1 and 2 (2 specimen tago attached) "". It consists of. breast measuring 16 x 16 x 5.5 cm, with an axillary tail measuring 10 x 7 x. 1.6 cm. The axillary tail has 2 tags designating levels 1 and 2. The. specimen is overlaid by white-tan, unremarkable skin, measuring 10.5 x 1.3. cm. The is a centrally placed, everted nipple, measuring 1.0 cm in. diameter, surrounded by unremarkable areola, measuring 4 cm in diameter. Cross-sectioning of the specimen reveals a firm to hard, fairly. circumscribed, centrally placed mass, measuring 1.7 x 1.5 x 1.5 cm,. approximately 1.0 cm from the deep margin. The mass, arbitrarily designated. T1 is surrounded by dense fibrous tissue. Approximately 5 cm lateral and. 3. cm anterior to T1 is a mass measuring 1.0 cm in diameter and approximately 4. cm from the deep margin. The second mass, which is arbitrarily designated. T2, has a central cavity filled with necrotic material grossly. The. remainder of the breast tissue concists of unremarkable fibroadipose tissue. Examination of the axillary tail show several lymph nodes at levol 1,. ranging from 0.5 cm to 2.0 cm and at level 2 ranging from 0.5 cm to 2.5 cm. The smaller lymph nodes are submitted in toto. The largest lymph nodes are. bisected, alternatively inked and submitted entirely. Summary of Sections: N - Nipple. NB - Nipple base. FT - Fibrous tissue. DM - Deep margin. T1 - Centrally-placed mass, 1 cm to the deep margin. T2 - Laterally-placed mass. LIQ - Lower inner quadrant. LOQ - Lower outer quadrant. UIQ - Upper inner quadrant. UOQ - Upper outer quadrant. LN1 - Level 1 lymph node. BLN1 - Bisected level 1 lymph node. BLLN1 - Bisected largest level 1 lymph node. LN2 - Level 2 lymph node. BLN2 - Bisected level 2 lymph node. BLLN2 - Bisected largest level 2 lymph node. 3). The specimen is received in formalin, labeled ""Sentinel node #1,. level 1. right axilla. It consists of an apparent lymph node, measuring. 1.2 x 1.0 x 0.5 cm, surrounded by pink-tan, unremarkable adipose tissue,. measuring 1.0 x 1.0 x 0.2 cm. The lymph node is bisected and submitted in. toto, in addition to the surrounding fibroadipose tissue. Summary of Sections: SLN - Sentinel lymph node. 4). The specimen is received in formalin, labeled ""Additional left breast. upper flap tissue"". It consists of yellow-tan fibroadipose tissue,. measuring 4 x 3 x 0.5 cm. Cross-sectioning of the specimen reveals groscly. unremarkable adipose tissue. The specimen is entirely submitted. Summary of Sections: FA - Fibroadipose tissue. Summary of Sections: Part 1: SP: Right breast. Block. Sect. Site. PCs. 1. cm. 1. 8. fa. S. 1. lig. 1. 1. log. 1. 1. 1. nb. 1. 1. uiq. 1. 1. uoc. 1. Part 2: SP: Left breast and axillary contents levels 1 and 2. Block. Sect. Site. PCs. 1. blinl. 1. 2. blln2. 2. 1. blnl. 1. 2. bln2. 2. 1. cm. 1. 2. fa. 2. 1. liq. 1. 2. lnl. 2. 1. In2. 1. 1. loq. 1. 1. n. 1. 1. nb. 1. tl. 3. 2. t2. 2. 1. uiq. 1. 1. uog. 1. Part 3: SP: Sentinel node #1 level 1 right axilla. alock. Sect. Site. PCs. sln. 1. Part. 4: SP: Additional left breast upper flap tissue. Block. Sect. Site. PCs. 5. fa. 5. Procedures/Addenda: Addendum. Date Complete: Addendum Diagnosis. ADDENDUM REPORT. SITE: LEFT BREAST (PART #2). ER: 08 NUCLEAR STAINING. PR: of NUCLEAR STAINING. HER-2/NED (HERCEPTEST) : POSITIVE (STAINING INTENSITY OF 3+). CONTROLS ARE SATISFACTORY. End of Report "".",BRCA,1,"Based on the pathology report, there is metastasis in 1 out of 7 lymph nodes examined in level II of the left breast and axillary contents. This corresponds to an N1 stage according to the rules.",N1,57.0
751,TCGA-AN-A0AM.7189A8A8-EB8B-4795-B7FE-725CCC4B7FA7,1,Sex: Female Ethnicity (Race): (. Diagnosis: Breast Cancer Histological description: Infiltrative ductal carcinoma. Anatomic Site: Left Breast Tumor location: Primary. Tissue Specification: Tumor Specimen Matrix: Tissue Specimen Format: Frozen. Container: cryomold Type of Procurement: Radical mastectomy Grade: 2. T Stage: 2 N Stage: 0 M Stage: 0 Treatment: none. Treatment Details: n/a. Normal Sample. Anatomic Site: Blood Sample Type: Normal Type of Procurement: blood draw. Matrix: Blood Specimen Format: frozen Container: tube.,BRCA,0,"The N stage in this report is 0, which indicates no cancer was found in the lymph nodes. This is based on the pathologic examination of the lymph nodes, and not on clinical examination or imaging studies. The absence of cancer in the examined lymph nodes corresponds to an N0 stage, regardless of the grade or T stage of the tumor. Immunohistochemical cytokeratin stain and HER2/neu protein overexpression status do not affect the N stage determination.",N0,57.0
743,TCGA-AN-A046.1304FB17-A20A-4EBC-9CC8-1554808AC1F6,1,Sex: Female. Diagnosis: Breast Cancer Histological description: Infiltrative ductal carcinoma. Anatomic Site: Right Breast Tumor location: Primary. Tissue Specification: Tumor Specimen Matrix: Tissue Specimen Format: Frozen. Container: cryomold Type of Procurement: Radical mastectomy Grade: 2. T Stage: 2 N Stage: 0 M Stage: 0 Treatment: none. Treatment Details: n/a. Normal Sample. Anatomic Site: Blood Sample Type: Normal Type of Procurement: blood draw. Matrix: Blood Specimen Format: frozen Container: tube.,BRCA,0,"The N stage in this report is 0, which indicates no cancer was found in the lymph nodes. This is based on the pathologic examination of the lymph nodes, and not on clinical examination or imaging studies. The absence of cancer in the examined lymph nodes corresponds to an N0 stage, regardless of the grade or T stage of the tumor. Immunohistochemical cytokeratin stain and HER2/neu protein overexpression status do not affect the N stage determination.",N0,58.0
750,TCGA-AN-A0AL.20F4DBD9-02FA-4FFD-AEF5-234910D31263,3,Sex: Female. Diagnosis: Breast Cancer Histological description: Infiltrative ductal carcinoma. 1 Anatomic Site: Left Breast Tumor location: Primary. Tissue Specification: Tumor Specimen Matrix: Tissue Specimen Format: OCT. Container: block Type of Procurement: surgery Grade: 2. T Stage: 4 N Stage: 0 M Stage: 0 Treatment: none. Treatment Details: n/a. Normal Sample. Anatomic Site: Blood Sample Type: Normal Type of Procurement: blood draw. Matrix: Blood Specimen Format: frozen Container: tube.,BRCA,0,"The N stage is determined by the number of positive lymph nodes, and not by the total number of lymph nodes examined. The report states that the N stage is 0, which indicates no cancer found in the lymph nodes. This corresponds to an N0 stage, as there is no evidence of cancer in the lymph nodes.",N0,59.0
768,TCGA-AN-A0G0.08519263-5ADD-4BA3-9BC6-C737ACA7DFE4,1,Sex: Female. Diagnosis: Breast Cancer Histological description: Infiltrative ductal carcinoma. Anatomic Site: Right Breast Tumor location: Primary. Tissue Specification: Tumor Specimen Matrix: Tissue Specimen Format: Frozen. Container: cryomold Type of Procurement: Radical mastectomy Grade: 3. T. Stage: 2 N Stage: 0 M Stage: 0 Treatment: none. Treatment Details: n/a. Normal Sample. Anatomic Site: Blood Sample Type: Normal Type of Procurement: blood draw. Matrix: Blood Specimen Format: frozen Container: tube.,BRCA,0,"The N stage is determined by the number of positive lymph nodes, and not by the total number of lymph nodes examined. The report states that the N stage is 0, which indicates no cancer found in the lymph nodes. This is consistent with the rules that the absence of cancer in the examined lymph nodes corresponds to an N0 stage and that isolated tumor cells (ITCs) in a lymph node correspond to N0 stage.",N0,60.0
826,TCGA-AQ-A04H.D40D0424-E1DA-4AEF-AD00-126038E80218,1,"Diagnosis: A: Posterior margin, left breast, re-excision. - Skeletal muscle and fibroadipose tissue; no carcinoma identified. B: Breast (300 grams), right, total mastectomy. - Focal atypical ductal hyperplasia (slide B5). - Apocrine metaplasia. - Microcalcifications present in association with benign breast ducts and. lobules. - Skin with seborrheic keratoses. - No invasive or in situ carcinoma identified. C: Breast, left, modified radical mastectomy. Tumor type: Infiltrating ductal carcinoma with micropapillary features (two. foci). Nottingham combined histologic grade: 3. Tubule formation score: 3. Nuclear Pleomorphism Score: 3. Mitotic count score: 3. Focality of tumor: Multifocal (two separate invasive tumor masses in lower. inner quadrant, 1.9 cm apart) with intervening tissue showing lymphatic space. invasion (see comment). Tumor size (greatest dimension): Mass #1: 2.5 cm. Mass #2: 1.4 cm. Lymphovascular invasion: Present, extensive. In Situ Component: Present. In Situ Component type/Architecture pattern: Ductal carcinoma in situ, comedo and solid subtypes. Lobular carcinoma in situ. In Situ Component nuclear grade: High grade (nuclear grade 3). In Situ Component necrosis: Present. In Situ Component extent/size: In situ carcinoma comprises less than 10% of. total tumor volume and is present in association with both masses as well as. being present in tissue between the masses. Extensive intraductal component: Not identified. Nipple involvement: Not identified. Skin involvement: Not identified. Margin status: Invasive component: Infiltrating ductal carcinoma is less than 1 mm from. the deep specimen margin (see comment). In Situ component: Ductal carcinoma in situ is 3 mm from the deep specimen. margin. Axillary lymph nodes: Total number with metastasis: 4. Total number examined: 15. Size of largest metastasis: 9mm. Extracapsular extension: not identified. Microcalcifications: not identified. Other findings: Biopsy site changes in Mass #1. Fibroadenomatous change. Skin with seborrheic keratosis. AJCC PATHOLOGIC TNM STAGE: pT2 pN2a pMx. Note: This pathologic stage assessment is based on information available at the. time of this report, and is subject to change pending clinical review and. additional information. Comment: Two foci of infiltrating ductal carcinoma are present, both in the lower inner. quadrant. Grossly, these masses were separated by 1.9 cm of soft fibroadipose. tissue. Histologically, the intervening tissue shows ductal carcinoma in situ. and carcinoma present within lymphatic spaces. The smaller tumor is less than 1. mm from the posterior specimen margin in the mastectomy specimen; however, it is. possible that this margin is superseded by the separately submitted posterior. margin' (part A). The morphology of the invasive carcinoma from the two masses is similar, as is. the morphology of the in situ carcinoma admixed with each mass. These two. masses may represent two separate foci of invasion arising from ductal carcinoma. in situ or may be arising from a focus of lymphovascular invasion (i.e., an. intramammary metastasis). The tumor stage is based on the larger of the two. masses. Immunohistochemical studies for estrogen receptor, progesterone receptor and. HER-2/neu were performed on the biopsy specimen from the larger of the two. masses. Immunohistochemical analysis of the smaller tumor mass will be performed and. the results will be reported in an addendum. Gross Description: Specimen A is received in a formalin-filled container labeled ""left re-excision. posterior margin, tumor clip posterior"" and is a partially oriented 2.6 x 1.8 x. 1.0 cm fragment of mainly brown/red muscle with some minimal adherent. fibroadipose tissue. There is a clip on one surface indicating the margin. This. surface is inked blue. The remainder of the specimen is inked black. Sectioning exhibits unremarkable red/brown muscle with minimal fibroadipose. tissue. The specimen is serially sectioned and entirely submitted in blocks A1. and A2. Specimen B is received in a formalin-filled container labeled ""right total. mastectomy, stitch marks axillary tail"". Specimen fixation: Formalin. Time in fixative: 7 hours. Type of mastectomy: Total, per the specimen container and requisition. Size of specimen: 300 grams, 19 x 15.5 x 3.0 cm. Orientation of specimen: There is a stitch marking axillary tail. At. the time of tissue procurement triage, the specimen is inked as follows: anterior/green, posterior/purple, axillary tail (lateral)/yellow. Skin ellipse dimensions: 18.5 x 4.2 cm. The lightly pigmented skin. ellipse is remarkable for multiple brown papules from 2 to 13 mm in greatest. dimension. Just superior lateral to the nipple, there is a 1.2 x 0.8 x 0.2 cm. raised flesh colored papule identified. The remainder of the papules are. somewhat flatter and some are macules. Nipple/areola: 1.5 cm / 2.7 cm. Axillary tail: Axillary tail is not well-delineated. The lateral. breast tissue is sectioned and no lymph node candidates are identified. Biopsy site: N/A. Residual tumor: N/A. Location of tumor: N/A. Distance of mass/biopsy site from surgical margin: N/A. Gross involvement of skin or fascia/muscle by tumor: N/A. Description of remainder of breast: The entire specimen. consists of yellow lobulated fibroadipose tissue separated by thin fibrous. septae. There is scattered dense white breast tissue throughout the entire. specimen. There are no abnormalities readily appreciated. Other remarkable features: None. Tissue submitted for special investigations: Normal given to. tissue procurement. Digital photograph taken: Block Summary: B1 - Nipple. B2 - Section from largest raised papule (larger section), smaller section. through smaller papule. B3-B4. - Inner upper quadrant. B5-B6. - Inner lower quadrant. B7-B8. - Outer upper quadrant. B9-B10. - Outer lower quadrant. B11-B12. - Central mastectomy. B13-B14. - Lateral breast tissue. Specimen C: Specimen fixation: Formalin. Time in fixative: 7 hours. Type of mastectomy: Modified radical per the specimen requisition. Size of specimen: 400 grams, 19 x 15 x 3.0 cm. Orientation of specimen: Skin ellipse dimensions: 19 x 5.0 cm. The lightly pigmented skin. ellipse is remarkable for scattered light brown to medium brown papules from 3. mm to 1.3 cm in greatest dimension. Nipple/areola: 1.5 cm / 3.5 cm. These structures are. unremarkable. Axillary tail: Axillary tail is 8 x 6.5 x 1.8 cm. The. axillary tail is amputated and palpated for lymph node candidates. Multiple. lymph node candidates are identified from 4 x 4 x 3 mm to 1.5 x 1.0 x 0.6 cm. Biopsy site: N/A. Residual tumor: Present. There are two lesions identified. The. first lesion is 2.5 x 1.2 x 1.0 cm. This lesion is well-circumscribed and has a. tan/red, focally hemorrhagic cut surface. This lesion is found within a. background of dense white breast tissue. There is a second 1.4 x 1.2 x 1.0 cm. mass identified. This mass is also well-circumscribed and has a firm red/white. cut surface. These masses are 1.9 cm from one another. Mass #1 is slightly inferior to the. nipple in the subareol lar region. Mass #2 is inferior and posterior to mass #1. Location of tumor: See above. Both masses are found in the inner lower. quadrant. Distance of mass/biopsy site from surgical margin: Mass #1 2.4 cm to. the deep purple inked margin, 5 mm to the skin, 4.1 cm to the inferior margin,. approximately 6 cm to the medial margin, approximately 8 cm to the superior. margin and distal to the lateral margin. Mass #2 is very close to the purple. inked posterior margin, is approximately 3 cm to the inferior margin, at least. 10 cm to the superior margin, approximately 5.6 cm to the medial margin and. distant to the lateral margin. Mass #2 is 3.4 cm to the green inked anterior. margin. Gross involvement of skin or fascia/muscle by tumor: N/A. Description of remainder of breast: The remainder of the. mastectomy specimen consists of yellow lobulated fibroadipose tissue separated. by thin fibrous septae. There is dense firm white breast tissue scattered. throughout the entire specimen. Other remarkable features: None. Tissue submitted for special investigations: Tumor and normal. given to tissue procurement. Digital photograph taken: Block Summary: C1 - Nipple. C2 - Representative sections of epidermal papules. C3. - Section from edge of mass #1 (larger) and mass #2 (smaller mass); and. the section mass #2 is abutting purple ink and mass #1 is cut through. C4. - Additional medial mass #2. C5. - Additional lateral mass #2. C6. - Additional fibroadipose tissue between masses. C7. - Inferior margin closest to both masses, en face. C8-C9 - Mass #1 and skin, slice bisected. C10 - Mass #1 and adjacent breast tissue (purple ink does not denote true. margin). C11. - Additional mass #1 and adjacent breast tissue (purple ink does not. denote true margin). C12 - Deep margin closest to mass #1, en face. C13. - Inner upper quadrant. C14. - Inner lower quadrant. C15. - Outer upper quadrant. C16. - Outer lower quadrant. C17. - Three lymph node candidates. C18. - One lymph node candidate, trisected (suspicious). C19. - One lymph node candidate, trisected. C20. - Largest lymph node candidate, sectioned. C21. - One lymph node candidate, trisected. C22. - One lymph node candidate, bisected. C23. - One lymph node candidate, sectioned. C24. - One lymph node candidate, sectioned. C25. - One lymph node candidate, sectioned. C26. - Multiple suspected lymph nodes. C27. - One lymph node, serially sectioned. Procedures/Addenda: Addendum. Addendum. The following addendum is issued to report the results of estrogen receptor,. progesterone receptor, and HER2/neu immunohistochemical studies. Estrogen receptor (Ventana, clone SP1): Interpretation: POSITIVE. Computer-assisted quantitative score: 97%. Progesterone receptor (Ventana, clone 1E2): Interpretation: POSITIVE. Computer-assisted quantitative score: 27%. HER2/neu (. clone 4B5, FDA-approved): Interpretation: INDETERMINATE. Computer-assisted quantitative score: 2+ (see comment). Site: Left breast. Performed on block: C3. Fixation: 10% neutral buffered formalin. Fixation time: 6-48 hours. Reference range: Estrogen receptor and progesterone receptor: <1%=NEGATIVE, 1-10% WEAK. POSITIVE,. >10% POSITIVE. HER2/neu: 0, 1=NEGATIVE FOR OVEREXPRESSION, 2=INDETERMINATE,. 3=POSITIVE FOR. OVEREXPRESSION. Comment: The quantitative scores reported above were obtained using the FDA-approved. The control slides for this case show. appropriate staining. The patient' S larger tumor was sampled and tested previously, which showed a similar. pattern of immunohistochemical staining for HER-2/neu. Subsequent in situ. hybridization studies for HER-2/neu gene amplification on that specimen showed that the. tumor was positive for Her-2/neu gene amplification. In situ hybridization studies can be. repeated on the current specimen, if clinically desired. Some of the immunohistochemical reagents used in this case may be classified as. analyte specific reagents (ASR) or research use only (RUO) reagents. These were. developed and have performance characteristics determined by the. These reagents have not. been cleared or approved by the US Food and Drug Administration (FDA). The FDA. has determined that such clearance or approval is not necessary. These tests. are used for clinical purposes. They should not be regarded as investigational. or for research. This laboratory is certified under the Clinical Laboratory. Improvement Amendments of 1988 (CLIA-88) as qualified to perform high complexity. clinical laboratory testing.",BRCA,2,"The N stage is determined by the number of positive lymph nodes, and not by the total number of lymph nodes examined. In this report, there are 4 positive lymph nodes out of 15 examined, which corresponds to an N2 stage.",N2,61.0
