Unnamed: 0,patient_filename,t,text,type,n,cmem_n_reasoning,cmem_n_ans_str,cmem_n_num_update
685,TCGA-A8-A0A1.3BC6CE69-2641-4B6D-85DF-E8FE838015D0,1,"Diagnosis: Invasive lobular breast carcinoma (maximum diameter 2.5 cm, malignancy grade II), with. excision extending into the healthy tissue. Tumor classification (also taking into account xxxxxxxx): pT2 (maximum diameter 2.5 cm),. pNO sn (0/1), MX, R0, G2 (L0, V0).",BRCA,0,"The report states 'pNO sn (0/1)', which means no cancer was found in the lymph nodes (pN0) and one lymph node was examined (sn). This is consistent with the rule that the N stage is determined by the number of positive lymph nodes and not by the total number of lymph nodes examined.",N0,20.0
689,TCGA-A8-A0A7.E306BE26-0358-4BE4-AEF6-AD42CC0DA020,1,"Diagnosis: 1. Polymorphocellular undifferentiated breast, G II (maximum tumor diameter 2.8 cm). showing infiltrative growth, with marked chronic secondary inflammation, focal. invasion of lymph vessels and spread to just below the skin. The conventional histological findings are consistent with the polymorphocellular. variant of invasive lobular breast carcinoma. The nodular tumor infiltration in the. axillary tissue described under 6. is to be interpreted as a lymph node metastasis. extending beyond the capsule into the surrounding soft tissue. This gives rise to the. following summary tumor classification: G II, pT2pN1a(1/14)L1VORO negative for. estrogen and progesterone receptors, positive for C-erb B-2 oncoprotein.",BRCA,1,"The report mentions 'pN1a(1/14)', which indicates that there is metastasis in 1 axillary lymph node (ipsilateral) out of 14 examined lymph nodes. This corresponds to the N1 stage.",N1,21.0
814,TCGA-AO-A12C.7E9202F6-F2DB-4CC0-A10F-3D9A82E84242,1,"Cinical Diagnosis & History: y/o female with left breast IDC and DCIS, now for segmental resection and. SLNB. Specimens Submitted: 1: SP: Sentincl node #1, level 1, left axilla (fs). 2: SP: Sentinel node #2, level 1, left axilla I. 3: SP: Sentinel node #3, level 1, left axilla. 4: SP: Sentinel node #4, level 1, left axilla. 5: SP: Left axillary contents levels 1, 2 and 3. 6 : SP: Additional level 3 nodes, left axilla. 7: SP: Left breast mannographic mass. DIAGNOSIS: 1). LYMPH NODE, SENTINEL #1 LEVEL I LEFT AXILLA BIOPSY: - METASTATIC MAMMARY CARCINOMA IN ONE OF ONE LYMPH NODE (1/1) -. to EXTRANODAL EXTENSION IS PRESENT (>2 MM). LYMPH NODE, SENTINEL #2 LEVEL I LEFT AXILLA; BIOPSY: - ONE BENIGN LYMPH NODE (0/1) WITH A TUMOR EMBOLUS IN PERINODAL. LYMPHATIC VESSEL. 3). LYMPH NODE, SENTINEL #3 LEVEL I LEFT AXILLA; BIOPSY: - ONE BENIGN LYMPH NODE (0/1). 4). LYMPH NODE, SENTINEL #4 LEVEL I LEFT AXILLA; BIOPSY: - ONE BENIGN LYMPH NODE (0/1). 5). AXILLARY CONTENTS, LEFT LEVELS I, II AND III; DISSECTION: LEVEL I: A MICROSCOPIC FOCUS OF METASTATIC MAMMARY CARCINOMA IN ONE. OF THREE LYMPH NODES (1/3). - LEVEL II: EIGHTEEN BENIGN LYMPH NODES (0/18) . - LEVEL III: SIX BENIGN LYMPH NODES (0/6). LYMPH NODE, ADDITIONAL LEVEL III LEFT AXILLA; EXCISION: - BENIGN ADIPOSE TISSUE WITH MICROSCOPIC LYMPHOID AGGREGATES. 7). BREAST, LEFT; EXCISION: - MULTIPLE FOCI OF INVASIVE DUCTAL CARCINOMA, NOS TYPE, HISTOLOGIC. Page 2 or 6. GRADE II-III/III, NUCLEAR GRADE II/III, RANGING IN SIZE FROM 0.1 0x UP TO. 2.5 CM (THE TWO LARGEST FOCI OF TUMOR MEASURE 1.4 CM AND 2.5 CM GROSSLY). A FEW FOCI OF DUCTAL CARCINOMA IN SITU (DCIS), SOLID AND CRIBRIFORM TYPES. WITH INTERMEDIATE NUCLEAR GRADE. NO CALCIFICATIONS ARE IDENTIFIED IN EITHER THE INVASIVE OR IN SITU. COMPONENT. - PROMINENT VASCULAR INVASION IS PRESENT. INVASIVE CARCINOMA EXTENDS TO THE FOLLOWING SHAVED MARGINS: LATERAL (IN. 1/8 SLIDES, 0.6 CM) ; INFERIOR (IN 3/8 SLIDES, THE LARGEST FOCUS MEASURING. 0.8 CM). ANTERIOR (IN 4/19 SLIDES, THE LARGEST FOCUS MEASURING 0.5 CM): AND. POSTERIOR (IN 1/15 SLIDES, THE LARGEST FOCUS MEASURING 0.2 CM) IN. ADDITION, LYMPHATIC TUMOR EMBOLI ARE ALSO SEEN AT THE MARGINS. - NO INVOLVEMENT OF THE SURGICAL MARGINS BY DCIS IS IDENTIFIED. - BIOPSY SITE CHANGES. - RESULTS OF SPECIAL STAINS (ER, PR, HER-2/NEU) WILL BE REPORTED AS AN. ADDENDUM. I ATTEST THAT THE ABOVE DIAGNOSIS IS BASED UPON MY PERSONAL EXAMINATION OF. THE SLIDES (AND/OR OTHER MATERIAL), AND THAT I HAVE REVIEWED AND APPROVED. THIS REPORT. Special Studies: Special Stain. Comment. RECUT. RECUT. RECUT. RECUT. NEG CONT. IMM RECUT. ER-C. PR-c. HER2 C. NEG -HER2. Gross Description: 1). The specimen is received fresh for frozen section consultation. labcled, Sentinel node #1, level 1, left axilla"", and consists of a piece. of yellow-tan fatty tissue Deasuring 3.5 x 2 x 1 cm, containing firm gray. lymph node measuring 1.4 x 1 x 0.7 cm. Representative section is frozen. The remainder of the specimen is entirely submitted. Summary of Sections: FSC frozen section control. U - undesignated. vage 3 or b. 2). The specimen is received in formalin, labeled, ""Sentinel node #2,. level 1, left axilla"". It consists of a 0.9 x 0.5 x 0.4 cm tan lymph node. with attached adipose tissue. The entire lymph node is submitted. Summary of Sections: LN - lymph node. 3). The specimen is received in formalin, labeled, ""Sentinel node #3,. level 1, left axilla"". It consists of a 1.3 x 0.4 x 0.3 cm tan lymph node. The lymph node is entirely submitted. Summary of Sections: LN - lymph node. 4). The specimen is received in formalin, labeled, ""Sentinel node #4,. level 1, left axilla"". It consists of a 0.3 x 0.3 x 0.2 Cm tan lymph node. with attached adipose tissue. The lymph node is entirely submitted. Summary of Sections: LN - lymph node. 5). The specimen is received in formalin, labeled, ""Left axillary. contents levels 1, 2 and 3 (with tags attached) It consists of a. 17.0. x. 15.0 x 4.0 cm fragment of adipose tissue with metallic tags labeling levcls. 1 through 3. Multiple lymph nodes are identified within each level,. measuring from 0.2 to 2.8 ca in greatest dimension. All identified lymph. nodes are submitted. Summary of Sections: LIBLN level one bisected lymph node. LILNSS level one, one lymph node serially sectioned. LII level two lymph nodes. LIII level three lymph nodes. 6). The specimen is received in formalin, labeled, ""Additional level. 3. nodes , left axilla"". It consists of a 2.0 x 1.8 x 1.0 cm aggregate of. adipose tissue. No definite lymph nodes are identified. Entirely. submitted. Summary of Sections: U - undesignated. 7). The specimen is received fresh, labeled, ""Left breast nammographic. mass (short stitch superior, long stitch lateral)"". It consists of a 9.5 x. 8.0 x 5.3 cm fragment of fibroadipose tissue with a needle localizing wire. and sutures marking the superior and lateral margins. The specimen is inked. as follows: black-anterior and posterior, yellow-superior, green-inferior,. blue-lateral, red-medial. The margins are entirely shaved and submitted. There is a palpable mass at the lateral/inferior portion of the specimen. Serial sectioning reveals a 2.5 x 2.0 x 1.8 em firm white stellate mass,. located in the center of the specimen. closely approaching the anterior. margin. Noted adjacent to this mass, near or close to the medial margin is. a. second tan firm nodular mass, measuring 1.4 x 1.1 x 0.9 cm. The remaining. breast parenchyma is predominantly fatty with foci of fibrous tissue. NO. other lesions ure identified. Representative sections are submitted. Portions of both the larger and smaller tumors are submitted for TPS. Summary of Sections: M medial. L lateral. I inferior. A anterior. s superior. P posterior. LT larger tumor. ST smaller tumor. ADJ adjacent to tumor mass. RS representative sections. Summary of Sections: Part 1: SP: Sentinel node #1, level 1, left axilla. Block. Sect. Site. PCs. 1. fsc. 1. 1. u. 1. Part 2: SP: Sentinel node #2, level 1, left axilla. Block. Sect. Site. PCs. 1. In. 1. Part 3: SP: Sentinel node #3, level 1, left axilla. Block. Sect. Site. PCs. 1. In. 1. Part 4: SP: Sentinel node #4, level 1, left axilla. Block. Sect. Site. PCs. 1. In. 1. Part 5: SP: Left axillary contents levels 1, 2 and 3 ,. Block. Sect. Site. PCs. yage 5 of 6. 2. LIBLN. 4. 5. LII. 10. 3. LIII. 6. 5. LILNSS. 5. Part 6: SP: Additional level 3 nodes, left axilla. Block. Sect. Site. PCs. 1. u. 1. Part 7: SP: Left breast marmographic mass. Block. Sect. Site. PCs. 19. a. 19. 2. adj. 2. 8. i. 13. 8. 1. 14. 4. 1t. 4. 4. m. 10. 15. p. 15. 5. rs. 5. 4. 10. 2. st. 2. Procedures/Addenda: Addendum. Date Complete: Addendum Diagnosis. ADDENDUM REPORT. SITE: LEFT BREAST (PART #7). ER: 95% NUCLEAR STAINING WITH MODERATE INTENSITY. PR: 40% NUCLEAR STAINING WITH WEAK TO MODERATE INTENSITY. HER-2/NEU (HERCEPTEST) : POSITIVE (STAINING INTENSITY OF 3+). Intraoperative Consultation: Note: The diagnoses given in this section pertain only to the. tissue sample examined at the time of the intraoperative. consultation. 1). FROZEN SECTION DIAGNOSIS: METASTATIC CARCINOMA. PERMANENT DIAGNOSIS: SAME.",BRCA,1,"Based on the pathology report, there is metastatic carcinoma found in one out of one sentinel lymph node in level I of the left axilla with extranodal extension greater than 2mm (pN1mi, ENE > 2mm). Additionally, there is a microscopic focus of metastatic carcinoma found in one out of three lymph nodes in level I of the left axilla (pN1a). The highest N stage based on these findings is N2, which applies when there is extranodal extension of carcinoma greater than 2mm (ENE > 2mm) or when there is metastasis in 1-3 axillary lymph nodes with ENE > 2mm (pN2a).",N2,22.0
720,TCGA-AC-A3W7.3B77A3E1-AB8F-47B2-A5CC-A3B593A055CE,1,"Peferring Physician: Provider Group : Date of Service: Date Received: Room: A copy of this report will be faxed to: FINAL SURGICAL PATHOLOGY REPORT. Diagnosis: A. - B.) BREAST, AXILLARY LYMPH NODE, RIGHT, MASTECTOMY AND. SENTINEL LYMPH NODE BIOPSY (400): - Invasive lobular carcinoma, grade 1. - Multifocal, 40 mm, 14 mm and 5 mm in greatest dimension. - Lobular carcinoma in situ (LCIS). - Surgical margins negative. - One of two lymph nodes, POSITIVE metastatic carcinoma (1/2). - Largest focus in lymph node: 2.5 mm. - No extracapsular extension identified. C. BREAST, LEFT, MASTECTOMY: - Sclerosing adenosis, usual ductal hyperplasia, columnar cell change and. apocrine metaplasia. - No atypical hyperplasia or carcinoma identified. PATHOLOGIC TUMOR STAGING SYNOPSIS (RIGHT BREAST): Type and grade (invasive): Invasive lobular carcinoma, grade 1. Type and grade (in situ): Lobular carcinoma in situ (LCIS). Primary tumor: pT2. Regional lymph nodes: pN1a (1 of 2 lymph nodes POSITIVE). Distant metastasis: N/A. Pathologic stage: IIB. Lymphovascular invasion: Not identified. Margin status: R0, negative, all margins 20 mm or greater. Breast Invasive Tumor Stag. 7. Information. (AJCC Cancer Staging Handbook,. Ed, and. protocol,. This staging also incorporates: Previous biopsy: Breast profile: Printed: This report continues (FINAL). MR No. -. icct No. -. Pathology Report - Page 1/5. Specimen type: Total breast. Specimen procedure: Total mastectomy. Lymph node sampling: Sentinel lymph nodes. Specimen integrity: Single intact specimen. Specimen laterality: Right. Specimen size (other than mastectomy): N/A. INVASIVE TUMOR FEATURES: Invasive tumor size: 40 mm, 14 mm, 5 mm. Invasive tumor site: 10:30. Invasive tumor focality: Multiple foci. Histologic type: Invasive lobular carcinoma. Total Nottingham Grade: Grade 1, cumulative score 5 of 9. Tubule formation: Less than 10%, 3 of 3. Nuclear Pleomorphism: Low-grade, 1 of 3. Mitotic count for Nottingham: Low, 1 of 3. Mitotic count: 2 per 10 high power field. Other Grading System: N/A. Lymphatic invasion: Not identified. MARGIN STATUS FOR INVASIVE COMPONENT: R0, negative. Distance of tumor from margins: Closest margin: All margins 20 mm or greater. Other margins: N/A. DUCTAL CARCINOMA IN-SITU (DCIS): Not identified. LOBULAR CARCINOMA IN-SITU (LCIS): Present. Skin: Present, not involved. Nipple: Present, not involved. Skeletal Muscle: Not identified. LYMPH NODES: 1 of 2 lymph nodes positive, 2.5 mm focus, no. extracapsular extension identified. INVASIVE PATHOLOGIC TUMOR STAGING (pTNM). Primary tumor (pT): pT2. Regional lymph nodes (pN): pN1a (1 of 2 lymph nodes positive). Distant metastasis (pM): N/A. Pathologic stage: IIB. RECEPTOR STATUS AND HER2/NEU: Estrogen receptors: POSITIVE (99-100% positive cells. strong. intensity). Progesterone receptors: Negative (0% positive cells). Her2/neu: Negative (0, scale 0-3+). Ki-67 proliferative index: Intermediate (11% positive cells). Printed: This report continues. (FINAL). Acct No. -. S. Pathology Report - Page 2/5. FINAL SURGICAL PATHOLOGY REPORT. Comment: The touch preparation of the sentinel lymph. node biopsy was review and no evidence of. metastatic carcinoma is identified. Additional pathologic findings: Usual ductal hyperplasia, columnar cell change. and apocrine metaplasia. Source of Specimen: A. Sentinel lymph node;right sentinel node axillary. B. Breast;right breast. C. Breast;left breast. Clinical History/Operative Dx: Right/left breast cancer. Intraoperative Diagnosis: A. Right sentinel node axillary. No tumor cells identified. (Dr. 1. The intraoperative. interpretation(s) was/were performed and rendered at. Gross Description: A. The specimen is labeled right sentinel node axillary. and is received without fixative. It consists of. two lymph nodes measuring 1 x 0.7 x 0.7 cm and 1.5 x 0.8 x 0.4 cm. Both nodes are serially sectioned. and touch imprints are obtained. The larger node is submitted for permanent section in cassettes A1-A2. The smaller node is submitted for permanent section in cassette A3. Printed: This report continues. MR No. -. Acct No. -. $. Pathology Report - Page 3/5. FINAL SURGICAL PATHOLOGY REPORT. B. The specimen is labeled right breast tissue and is received without fixative. It consists of a mastectomy. specimen which weighs 381 grams. A black suture at one end of the skin ellipse marks medial. With this. orientation, the specimen measures 16 cm from medial to lateral, 11 cm from superior to inferior, and 4. cm from anterior to posterior. There is an overlying ellipse of tan skin measuring 11.8 x 7 cm. The areola. measures 3.3 cm and the nipple appears slightly inverted. The anterior-superior margin is inked blue, the. anterior-inferior margin is inked green, and the posterior margin. which consists variably of smooth facial. appearing tissue and lobulated fatty tissue, is inked black. The breast is serially sectioned along the. superior-inferior axis resulting in fifteen slabs. Slab #1 is most medial. In the central portion of the excision, in slabs 6-9, there is a stellate hard, gritty neoplasm (tumor #1) which. overall measures 4 cm from medial to lateral, 1.2 cm from superior to inferior, and 1 cm from anterior to. posterior. This neoplasm is 1.5 cm from the closest skin. It is 2 cm from the closest anterior-superior margin. and is greater than 4 cm from all other margins. Representative sections of the medial portion of the tissue. are obtained for research purposes and the biopsy site clip is identified within the neoplasm in slab 7. Slab 10 (intervening tissue between tumor #1 and tumors #2 and #3) consists of palpably unremarkable. fibrofatty tissue. In slab 11, 1 cm lateral to the tumor #1, there is chalky yellow discoloration and slight retraction of the. fibrofatty tissue suggestive of two small deposits of neoplastic tissue. The larger of these (tumor #2) is 8 cm. lateral to the nipple. It measures 1.4 x 1 x 0.6 cm and is greater than 2 cm from the anterior-superior,. anterior-inferior, and posterior margins. It is 2.3 cm from the closest lateral margin and widely free of the. medial margin. The smaller tumor deposit (tumor #3) measures 0,5 cm and is 0.8 cm superior of the larger deposit in slab. 11. It is 2 cm from the closest anterior-superior margin and greater than 2 cm from all other margins. No. other palpable lesions are identified. No lymph nodes are identified within the lateral portion of the. excision. Representative sections are submitted. Section summary: B1) nipple and tissue just deep to nipple,. B2) medial edge of tumor #1 from slab 6,. B3) anterior-superior margin (tumor #1), slab 6,. B4) central sections of tumor #1 from slab 7 (biopsy site clip here),. B5) anterior-inferior margin (tumor #1) from slab 7,. B6) tumor #1 from slab 8 including closest anterior-superior margin,. B7) lateral section of tumor #1 from slab 8,. B8) representative section from slab 10 intervening tissue between tumor #1 and tumors #2 and #3,. 89) complete cross-section, slab 11, tumor #2 and #3,. B10) section of tumor #2 in slab 12,. B11) representative upper inner quadrant (slabs 2, 3, 4),. B12) representative lower inner quadrant (slabs 3, 4, 5),. B13) representative lower outer quadrant (slabs 9 and 10). C. The specimen is labeled left breast tissue and is received in formalin. It consists of a mastectomy. specimen weighing 341 grams. A black suture at one end of the skin ellipse marks medial. With this. Printed: This report continues. MR No. . Acct No. Pathology Report - Page 4/5. 4) Page 4. FINAL SURGICAL PATHOLOGY REPORT. orientation, the specimen measures 15.5 cm from medial to lateral, 11 cm from superior to inferior, and. 5.5 cm from superficial to deep. There is an overlying broad ellipse of tan skin which measures 12 x 7 cm. In the lateral skin, there is a 0.4 cm violaceous skin lesion. Centrally, there is a well-delineated 4 cm. areola and a flat to slightly retracted appearing 1 cm nipple. The anterior-superior margin is inked blue,. the anterior-inferior margin is inked green, and the posterior margin, which consists of lobulated fatty. tissue, with central fascial appearing tissue, is inked black. The specimen is serially sectioned at close. intervals to reveal lobulated fatty tissue and scattered tan-white fibrous parenchyma which is most. prominent centrally. The fibrous parenchyma is focally finely nodular to palpation but there are no. discrete areas suggestive of invasive neoplasm. There are scattered small fluid-filled cysts within the. fibrous parenchyma. No lymph nodes are identified within the lateral portion of the excision. Representative sections are submitted. Section summary: C1) nipple and tissue just deep to nipple,. C2) lateral skin lesion,. C3) representative upper inner quadrant,. C4) representative lower inner quadrant,. C5) representative upper outer quadrant,. C6) representative lower outer quadrant,. C7-C8) sections of central breast including central deep margin. Microscopic Description: A. Microscopic sections have been examined. The microscopic findings are reflected in the diagnosis. rendered. Immunohistochemistry was performed with adequate control and shows positive staining for. metastatic tumor cells in one lymph node. B. Microscopic sections have been examined. The microscopic findings are reflected in the diagnosis. rendered. C. Microscopic sections have been examined. The microscopic findings are reflected in the diagnosis. rendered. Dr. notified of results on. at. Printed: END OF REPORT (FINAL). Acct No. -. Patient Name - I. Pathology Report - Page 5/5.",BRCA,1,"Based on the report, 'One of two lymph nodes, POSITIVE metastatic carcinoma (1/2)' indicates that cancer was found in one out of two examined lymph nodes. This corresponds to an N1 stage according to the rules.",N1,23.0
741,TCGA-AN-A03Y.76734A82-9137-4DA4-871E-D4EC1BC33831,1,Sex: Female. Diagnosis: Breast Cancer Histological description: Infiltrative ductal carcinoma. Anatomic Site: Left Breast Tumor location: Primary. Tissue Specification: Tumor Specimen Matrix: Tissue Specimen Format: Frozen. Container: cryomold Type of Procurement: Radical mastectomy Grade: 2. T Stage: 2 N Stage: 0 M Stage: 0 Treatment: none. Treatment Details: n/a. Normal Sample. Anatomic Site: Blood Sample Type: Normal Type of Procurement: blood draw. Matrix: Blood Specimen Format: frozen Container: tube.,BRCA,0,"The N stage is determined by the number of positive lymph nodes, and not by the total number of lymph nodes examined. According to the report, N Stage is 0, which indicates no cancer found in the lymph nodes. This corresponds to an N0 stage, as per the rules provided.",N0,24.0
769,TCGA-AN-A0XL.A85A959B-F18C-43D3-8BBF-770DA2189462,1,Sex: Female. Diagnosis: Breast Cancer Histological description: Infiltrative ductal carcinoma. Anatomic Site: Breast Tumor location: Primary. Tissue Specification: Tumor Specimen Matrix: Tissue Specimen Format: OCT. Container: block Type of Procurement: surgery Grade: 2. T Stage: 2 N Stage: 0 M Stage: 0 Treatment: none. Treatment Details: n/a. Normal Sample. Anatomic Site: Blood Sample Type: Normal Type of Procurement: blood draw. Matrix: Blood Specimen Format: frozen Container: tube.,BRCA,0,"The N stage in this report is 0, which indicates no cancer found in the lymph nodes. This is based on the statement 'N Stage: 0' in the report. The rule used for this prediction is: 'N0 indicates no cancer found in the lymph nodes, regardless of the number of lymph nodes examined.', which is a general rule applicable to the AJCC staging system for breast cancer.",N0,25.0
761,TCGA-AN-A0FS.3CD1D537-29E4-479B-99FA-26D27E192948,0,Diagnosis: Breast Cancer Histological description: Infiltrative lobular carcinoma. Anatomic Site: Right breast Tumor location: Primary. Tissue Specification: Tumor Specimen Matrix: Tissue Specimen Format: OCT. Container: block Type of Procurement: surgery Grade: 2. T Stage: 1 N Stage: 0 M Stage: 0 Treatment: none. Treatment Details: n/a. Normal Sample. Anatomic Site: Blood Sample Type: Normal Type of Procurement: blood draw. Matrix: Blood Specimen Format: frozen Container: tube.,BRCA,0,"The N stage in this report is N0, which indicates no cancer found in the lymph nodes. This is based on the statement 'N Stage: 0' in the provided report.",N0,25.0
840,TCGA-AR-A0TU.81A39E94-059E-4307-A75A-E8C051E9D0C3,1,"Breast, right, simple mastectomy: Infiltrating ductal carcinoma, Nottingham grade III (of III), forming a. well circumscribed mass (4.2 x 4.0 x 3.0 cm) (AJCC pT2) in the lower outer quadrant. Extensive tumor. necrosis is present. There is no associated in situ component. The nipple is uninvolved. The surgical. resection margins are negative for tumor. The closest margin (deep) is free by 0.3 cm. The surrounding. breast tissue shows non-proliferative fibrocystic changes. Lymph nodes, right axillary sentinel Nos. 1A, 1B, IC, and 2, excision: Multiple (4) right axillary sentinel. lymph nodes are negative for tumor. Blue dye is identified in lymph nodes Nos. 1A and 1B. No blue dye. is present in lymph nodes 1C or 2 [AJCC pNO(sn)]. Immunohistochemical cytokeratin stain was. performed on the paraffin embedded sentinel lymph node tissue and confirms the H&E impression. HER2/neu protein overexpression is negative, score of 1+, according to the interpretation guidelines in. the FDA-approved HercepTest. Estrogen: Negative, 0% nuclear staining. Progesterone: Negative, 0% nuclear staining. ER (Estrogen Receptor) test was developed and its performance characteristics determined by. It has not been cleared or approved by the U.S. Food. and Drug Administration.",BRCA,0,"The report states that multiple right axillary sentinel lymph nodes (4) were excised and examined, and all were negative for tumor. This indicates that there is no cancer found in the lymph nodes, which corresponds to an N0 stage according to the rules.",N0,26.0
766,TCGA-AN-A0FY.6C520037-2A9B-41CB-8362-97FFCA2AA6E2,0,Sex: Female. Diagnosis: Breast Cancer Histological description: Infiltrative ductal carcinoma. Anatomic Site: Left Breast Tumor location: Primary. Tissue Specification: Tumor Specimen Matrix: Tissue Specimen Format: Frozen. Container: cryomold Type of Procurement: Radical mastectomy Grade: 3. T Stage: 1c N Stage: 0 M Stage: 0 Treatment: none. Treatment Details: n/a. Normal Sample. Anatomic Site: Blood Sample Type: Normal Type of Procurement: blood draw. Matrix: Blood Specimen Format: frozen Container: tube. ICD-0- - 3.,BRCA,0,"The N stage in this report is N0, which indicates no cancer found in the lymph nodes. This is based on the statement 'N Stage: 0' in the report.",N0,27.0
772,TCGA-AN-A0XP.80E9B7CE-0D5D-4C01-A8E3-E6345BE145EC,1,Sex: Female. Diagnosis: Breast Cancer Histological description: Infiltrative ductal carcinoma. Anatomic Site: Breast Tumor location: Primary. Tissue Specification: Tumor Specimen Matrix: Tissue Specimen Format: OCT. Container: block Type of Procurement: surgery Grade: 2. T Stage: 2 N Stage: 1 M Stage: 0 Treatment: none. Treatment Details: n/a. Normal Sample. Anatomic Site: Blood Sample Type: Normal Type of Procurement: blood draw. Matrix: Blood Specimen Format: frozen Container: tube.,BRCA,2,"The N stage is determined by the number of positive lymph nodes, and not by the total number of lymph nodes examined. According to the report, the N Stage is 1, which indicates metastasis in 1 to 3 axillary lymph nodes (ipsilateral) or in clinically negative level I axillary lymph nodes.",N1,28.0
