Unnamed: 0,patient_filename,t,text,type,n,cmem_n_reasoning,cmem_n_ans_str,cmem_n_num_update
764,TCGA-AN-A0FW.03BD8920-CA01-4818-BBD7-925DDD3F6908,1,Sex: Female. Diagnosis: Breast Cancer Histological description: Infiltrative ductal carcinoma. Anatomic Site: Left Breast Tumor location: Primary. Tissue Specification: Tumor Specimen Matrix: Tissue Specimen Format: Frozen. Container: cryomold Type of Procurement: Radical mastectomy Grade: 2. T Stage: 2 N Stage: 1 M Stage: 0 Treatment: none. Treatment Details: n/a. Normal Sample. Anatomic Site: Blood Sample Type: Normal Type of Procurement: blood draw. Matrix: Blood Specimen Format: frozen Container: tube.,BRCA,2,"The N stage in this report is 1, which indicates that there is cancer found in 1 to 3 axillary lymph nodes or in the infraclavicular (clavipectoral) lymph node(s). This is based on the AJCC staging system for breast cancer.",N1,0.0
839,TCGA-AR-A0TT.E9231B33-E1CE-4396-9F9E-03DBF049919A,1,"Breast, right, wide local excision: Infiltrating ductal carcinoma, Nottingham grade III (of III) [tubules. 3/3, nuclei 3/3, mitoses 2/3; Nottingham score 8/9], forming a mass (2.3 x 1.9 x 1.8 cm) [AJCC pT2]. Ductal carcinoma in situ is absent. Angiolymphatic invasion is absent. The non-neoplastic breast. parenchyma shows nonproliferative fibrocystic changes. All surgical margins are negative for tumor. (minimum tumor free margin, 0.5 cm, deep margin). Lymph nodes, right axillary sentinel Nos. 1A, 1B, 1C, 2A, 2B, and 2C, excision: Multiple (3 of 6) right. axillary sentinel lymph nodes, all without blue dye, are positive for for metastatic carcinoma. Lymph nodes, right axillary, dissection: Multiple (2 of 13) right axillary lymph nodes are positive for. metastatic carcinoma [AJCC pN2]. Extranodal extension is present. Her-2/NEU has been ordered on paraffin-embedded tissue.",BRCA,2,"The report mentions that multiple (3 of 6) sentinel lymph nodes and (2 of 13) axillary lymph nodes are positive for metastatic carcinoma. This indicates that the cancer has spread to 4-9 lymph nodes, which corresponds to N2 stage according to the provided rules.",N2,1.0
802,TCGA-AO-A0JG.3671D46F-6D69-42DA-9830-24F67EB8B0B6,1,"Clinical Diagnosis & History: year old female with 2.7 cm right breast cancer, lower outer quadrant and. FNA (+) metastatic right lymph node. Specimens Submitted: 1: SP: Right breast and axillary contents levels one and two with tags. attached. 2: SP: Subscapular nodes, right axilla level one. DIAGNOSIS: 1. BREAST, RIGHT; MASTECTOMY AND AXILLARY DISSECTION: - INVASIVE DUCTAL CARCINOMA, MIXED MUCINOUS & NOS TYPE AND WITH. SOLID-PAPILLARY FEATURES, HISTOLOGIC GRADE III/III (SLIGHT OR NO TUBULE. FORMATION), NUCLEAR GRADE II/III (MODERATE VARIATION IN SIZE AND SHAPE). MEASURING 2.3 CM IN LARGEST DIMENSION MICROSCOPICALLY. - (DCIS) IS ALSO IDENTIFIED, SOLID AND CRIBRIFORM TYPES WITH. INTERMEDIATE NUCLEAR GRADE. AND MINIMAL NECROSIS. - LOBULAR INVOLVEMENT BY DCIS IS PRESENT. - THE DCIS CONSTITUTES LESS THAN OR EQUAL TO 25% OF THE TOTAL TUMOR. MASS, AND IS PRESENT. ADMIXED WITH AND AWAY FROM THE INVASIVE COMPONENT. - THE INVASIVE CARCINOMA IS LOCATED IN THE LOWER OUTER QUADRANT. - THE DCIS IS LOCATED IN THE LOWER OUTER QUADRANT AND LOWER INNER. QUADRANT. - NO INVOLVEMENT OF THE NIPPLE BY EITHER IN SITU OR INVASIVE CARCINOMA. IS IDENTIFIED. - CALCIFICATIONS ARE PRESENT IN BENIGN BREAST PARENCHYMA. - VASCULAR INVASION IS PRESENT. - INVASIVE CARCINOMA IS CLOSE (LESS THAN OR EQUAL TO 1 MM) TO THE. FOLLOWING SURGICAL. MARGIN(S) : BLUE INKED MARGIN (ANTERIOR). NO SKIN INVOLVEMENT BY CARCINOMA IS IDENTIFIED. - THE NON-NEOPLASTIC BREAST TISSUE SHOWS BIOPSY SITE CHANGES AND. PROLIFERATIVE FIBROCYSTIC. CHANGES INCLUDING INTRADUCTAL PAPILLOMA. - LEVEL 1: METASTATIC ADENOCARCINOMA TO FOUR OUT OF TEN LYMPH NODES. (4/10). THE LARGEST METASTATIC FOCUS MEASURES 2.5 CM. THERE IS EXTRANODAL EXTENSION OF CARCINOMA, FOCAL. - LEVEL 2 : THREE BENIGN LYMPH NODES (0/3). Page or. IMMUNOHISTOCHEMICAL STAIN WAS PERFORMED ON FORMALIN-FIXED TISSUE WITH THE. FOLLOWING RESULTS FOR INVASIVE CARCINOMA (BLOCK 1T6) : HER2. NEGATIVE (0 / 1+). 5% OF INVASIVE TUMOR CELLS EXHIBIT COMPLETE MEMBRANOUS STAINING;. UNIFORMITY OF STAINING: ABSENT. HOMOGENEOUS, DARK CIRCUMFERENTIAL PATTERN: ABSENT. Comment: Controls are satisfactory. s PATHWAY anti-HER-2/neu is an. FDA-approved rabbit monoclonal primary antibody (clone 4B5) directed against. the internal domain of the c-erbB-2 oncoprotein (HER2) for. immunohistochemical detection of HER2 protein overexpression in breast. cancer tissue routinely processed for histologic evaluation. The HER2 test. results are reported in accordance with the ASCO/CAP guideline. recommendations for HER2 testing in breast cancer (J Clin Oncol 2007;. 25 (1) :118-145) The ER and PR rabbit monoclonal antibodies are also FDA. approved. 2. LYMPH NODES, RIGHT AXILLA LEVEL ONE, SUBCAPSULAR: - SIX BENIGN LYMPH NODES (0/6). Some of the immunohistochemistry and. tests were develoned and their. performance characteristics were determined by. They have not been cleared or approved by the US Food and Drug. Administration. The FDA has determined that such clearance or approval is. not necessary. These tests are used for clinical purposes. They should not. be regarded as investigational or for research. This laboratory is certified. under the Clinical Laboratory Improvement Amendments of 1988 (CLIA , 88) as. qualified to perform high complexity clinical laboratory testing. I ATTEST THAT THE ABOVE DIAGNOSIS IS BASED UPON MY PERSONAL EXAMINATION OF. THE SLIDES (AND/OR OTHER MATERIAL) AND THAT I HAVE REVIEWED AND APPROVED. THIS REPORT. Gross Description: 1) The specimen is received fresh labeled, ""right breast and axillary. contents levels one and two with tags attached and consists of a breast. measuring 19 x 18 x 3 cm with overlying skin ellipse measuring 11 x 3 cm. Situated centrally on the skin surface is an everted nipple measuring 1 x 1. x 0.6 cm and areola measuring 3 x 3 cm. A suture demarcates the axillary. contents which measures 11 x 7 x 3 cm. Two tags are present, designating. levels one and two. The posterior surface of the breast is inked black, the. anterior blue and the axillary aspect is inked yellow. The specimen is. serially sectioned to reveal a 2.5 cm diameter mass in the lower outer. Page 3 or. quadrant and 1 cm from the deep margin. A clip is identified in the mass. The remaining breast tissue shows nodular fibroadipose tissue. The axillary. tisbue is dissected to reveal multiple lymph nodes, ranging in size from 0.5. cm to 2.5 cm. Representative sections are submitted. All dissected lymph. nodes are entirely submitted. Summary of sections: N - nipple. NB - nipple base. D - deep margin. T - tumor. UIQ - upper inner quadrant. LIQ - lower inner quadrant. UOQ - upper outer quadrant. LOQ - lower outer quadrant. L1 lymph nodes, level 1. L2 lymph nodes level2. 2). The specimen is received in formalin, labeled ""subscapular nodes right. axilla level one"" and consists of pink tan firm lymph nodes ranging from 0.8. to up 2 cm in greatest dimension. All identified lymph nodes are submitted. Summary of sections: LN lymph nodes. BLN- bisected lymph nodes. Summary of Sections: Part 1: SP: Right breast and axillary contents levels one and two with tags. attached. Block. Sect. Site. PCs. 1. D. 1. 6. L1. 6. 1. L2. 2. 1. LIQ. 1. 1. LOQ. 1. 2. N. 2. 1. NB. 1. 3. 3. 1. UIQ. 1. 1. UOQ. 1. Part 2: SP: Subscapular nodes, right axilla level one. Block. Sect. Site. PCs. 2. BLN. 2. 1. LN. 1. Page 4 or.",BRCA,2,"The N stage is determined by the number of lymph nodes involved. According to the report, metastatic adenocarcinoma was found in 4 out of 10 lymph nodes in level 1 (4/10). Therefore, the N stage is N2.",N2,2.0
823,TCGA-AO-A1KR.FF188295-E139-4AEE-8EE8-364536F2BBE8,1,"Clinical Diagnosis & History: y/o female with right breast core biopsy positive for invasive carcinoma. and left breast with atypical ductal hyperplasia. For bilateral. mastectomies, right sentinel node biopsy; right breast carcinoma and left. atypia. Specimens Submitted: 1: SP: Sentinel node #1 level 1 right axilla (fs). 2: SP: Sentinel node #2 level 2 right axilla (fs). 3: SP: Non sentinel node, right axille. 4: SP: Non sentinel node, right axilla, level 2. 5: SP: Right breast. 6 : SP: Left breast. DIAGNOSIS: 1). LYMPH NODE, SENTINEL #1 LEVEL I RIGHT AXILLA; BIOPSY: - ONE BENIGN LYMPH NODE (0/1). - ADDITIONAL H/E STAINED SECTIONS AND IMNUNOHISTOCHEMICAL STAINS FOR. CITOKERATINS (AE1:AE3). SHOW NO EVIDENCE OF METASTATIC TUMOR. 2). LYMPH NODE, SENTINEL #2 LEVEL II RIGHT AXILLA; BIOPSY: - ONE BENIGN LYMPH NODE (0/1). - ADDITIONAL H/E STAINED SECTIONS AND IMMMUNOHISTOCHEMICAL STAINS FOR. CITOKERATINS (AE1:AE3). SHON NO EVIDENCE or METASTATIC TUMOR. LYMPH NODE, NON-SENTINEL RIGHT AXILLA; BIOPSY: - ONE BENIGN LYMPH NODE (0/1). 4). LYMPH NODE, NON-SENTINEL LEVEL II RIGHT AXILLA; BIOPSY: - ONE BENIGN LYMPH NODE (0/1). 5). BREAST; RIGET: TOTAL KASTECTONY: - INVASIVE POORLY DIFYERENTIATED DUCTAL CARCINONA, NOS TYPE, HISTOLOGIC. GRADE III/III (SLIGHT OR NO TUBULE FORMATION) NUCLEAR GRADE III/III (MARKED. VARIATION IN SIZE AND SHAPE), WITH EXTENSIVE NECROSIS, MEASURING 2.4 CM IN. LARGEST DIMENSION MICROSCOPICALLY. LOBULAR CARCINOMA IN SITU (LCIS) IS ALSO IDENTIFIED, CLASSICAL TYPE (TYPE. THE INVASIVE CARCINOMA IS LOCATED IN THE OPPER INNER QUADRANT. - NO INVOLVEMENT OF THE NIPPLE BY EITHER IN SITU OR INVASIVE CARCINOMA IS. IDENTIFIED. - NO VASCULAR INVASION IS NOTED. - NO INVOLVEMENT OF THE SURGICAL MARGINS BY INVASIVE CARCINOMA IS. IDENTIFIED. - NO SKIN INVOLVEMENT BY CARCINOMA IS IDENTIFIED. - THE NON-NEOPLASTIC BREAST TISSUE SHOWS BIOPSY SITE CHANGES, FIBROCYSTIC. AND FIBROADENOMATOID CHANGES. MICROCALCIPICATIONS FOCALLY IN BENIGN DUCTS. FIBROADENOMA WITH MYZOID STROMA MEASURING 0.8 CM. - ER: 0% NUCLEAR STAINING. - PR: 08 NUCLEAR STAINING. - HER2/NIU(HERCEPTEST) : NEGATIVE (STAINING INTENSITY of 1+). BREAST, LEFT; TOTAL MASTECTOMY: - DUCTAL HYPERPLASIA USUAL TYPE WITHOUT ATYPIA. COLUMNAR CELL CHANGES, ADENOSIS AND STROMAL FIBROSIS. - MOCROCALCIFICATIONS IN BENIGN DUCTS. BIOPSY SITE CHANGES. - UNREMARKABLE NIPPLE AND SKIN. I ATTEST THAT THE ABOVE DIAGNOSIS IS BASED UPON MY PERSONAL EXAMINATION OF. THE SLIDES (AND/OR OTHER MATERIAL), . AND THAT I HAVE REVIEWED AND APPROVED. THIS REPORT. Special studies: Special Stain. Comment. AE1:AE3. NEG CONT. IMK RECUT. AE1:AE3. NEG CONT. IMM RECUT. ER-C. PR-C. HER2-C. NEG CONT. IMDS RECUT. NEG-HER2. Gross Description: 1). The specimen is received fresh for frozen section consultation, labeled. ""Sentinel node number one, level 1, right axilla' and consists of one lymph. node measuring 1.0 cm. bisected and entirely submitted for frozen section. Summary of sections: FSC -- frozen section control. 2) The specimen is received fresh for frozen section consultation, labeled. Sentinel node number two, level 2, right axilla"" and consists of one lymph. node measuring 1.4 cm, bisected and entirely submitted for frozen section. Summary of sections: FSC -- frozen section control. 3) The specimen is received in formalin labeled, ""Non-sentinel node, right. axilla"", and consists of one lymph node measuring 1.3 cm, which in entirely. submitted. Summary of sections: BLN - hisected lymph node. 4) The specimen is received in formalin labeled, ""Non-santinel node, level. 2, right axilla"", and consists of one lymph node measuring 1.0 cm, which. is. entirely submitted. Summary of sections: BLN - bisected lymph node. 5). The specimen is received fresh labeled, ""right breast, stitch marks the. axillary tail and consists of a breast measuring 24 x 23 x 3.5 cm with. overlying skin ellipse measuring 16 x 8.5 cm. Situated superiorly on the. skin surface is an everted nipple measuring 1.2 x 0.9. A sucure demarcates. the axillary aspect. The posterior surface of the breast is inked black,. anterior blue and the specimen is serially sectioned to reveal a large. stellate mass measuring 2.4 x 2.2 x 1.8 cm, and located in the upper inner. quadrant, 2 cm from deep margin, 1.0 cm from anterior skin. Sectioning of. the axillary aspect reveals no grossly identifiable lymph nodes. 25% of the. tumor is given to tissue bank. Representative sections are submitted. Summary of sections: N - nipple. NB - nipple base. s - skin. D - deep margin. AA - axillary aspect. uro - upper inner quadrant. LIQ - lower inner quadrant. UOQ - upper outer quadrant. LOQ - lower outer quadrant. T tumor. 6). The specimen is received fresh labeled, ""left breast, stitch marks. the. axillary tail and consists of a breast measuring 24 x 19 x 2.8 cm with. overlying skin ellipse measuring 16 x 3.9 cm. Situated centrally on the. skin surface is an everted nipple measuring 1.5 x 1.1 cm. A suture. demarcates the axillary aspect. The posterior surface of the breast is. inked black, anterior blue and the specimen is serially sectioned to reveal. a recent biopsy site, located in the lower inner quadrant. Sectioning of. the axillary aspect reveals no grossly identifiable lymph nodes. 25% of. breast consists of fibrous tissue. Samples are given to tissue bank. Representative sections are submitted. Summary of sections: N nipple. NB - nipple base. s - skin. D - deep margin. AA - axillary aspect. UIQ - upper inner quadrant. LIQ - lower inner quadrant. UOQ - upper outer quadrant. LOQ - lower outer quadrant. BxSite - recent biopay site. Summary of Sections: Part 1: SP: Sentinel node #1 level 1 right axilla (fa). Block. Sect. Site. PCs. fsc. 1. Part 2: SP: Sentinel node #2 level 2 right axilla (fs). Block. Sect. Site. PCs. fsc. 1. Part 3: SP: Non sentinel node, right axilla. Block. Sect. Site. PCs. BLN. 3. Part 4: SP: Non sentinel node, right axilla, level 2. Block. Sect. Site. PCs. 1. BLN. 2. Part 5: SP: Right breast. Block. Sect. Site. PCs. AA. 1. 1. D. 1. 1. LIQ. 4. 1. LOQ. 4. 1. N. 2. 1. NB. 1. 1. S. 1. 4. 4. 1. UIQ. 4. UOQ. 4. Part 6: SP: Left breast. Block. Sect. Site. PCs. 1. AA. 2. 4. BxSite. 4. 1. D. 1. 2. LIQ. 8. 2. LOQ. 8. 1. N. 2. 1. NB. 1. 1. s. 1. 2. UIQ. 8. 2. UO. 8. Intraoperative Consultation: Note: The diagnoses given in this section pertain only to the tissue sample. examined at the time of the intraoperative consultation. 1). FROZEN SECTION DIAGNOSIS: BENIGN (0/1). PERMANENT DIAGNOSIS: SAME. 2). FROZEN SECTION DIAGNOSIS: BENIGN (0/1). PERMANENT DIAGNOSIS: SAME.",BRCA,0,"The report mentions that there is no evidence of metastatic tumor in any of the four lymph nodes examined (sentinel node #1 level I right axilla, sentinel node #2 level II right axilla, non-sentinel right axilla, and non-sentinel level II right axilla). Therefore, the N stage for this patient is N0, which indicates no cancer found in the lymph nodes.",N0,3.0
759,TCGA-AN-A0FL.049A2CA6-951A-452F-963A-F54FE87ECA31,1,Sex: Female. Diagnosis: Breast Cancer Histological description: Infiltrative ductal carcinoma. Anatomic Site: Left Breast Tumor location: Primary. Tissue Specification: Tumor Specimen Matrix: Tissue Specimen Format: OCT. Container: block Type of Procurement: surgery Grade: 2. T Stage: 2 N Stage: 0 M Stage: 0 Treatment: none. Treatment Details: n/a. Normal Sample. Anatomic Site: Blood Sample Type: Normal Type of Procurement: blood draw. Matrix: Blood Specimen Format: frozen Container: tube.,BRCA,0,"The N stage is determined by the number of lymph nodes involved. The report indicates that the N stage is 0, which means no cancer was found in the lymph nodes.",N0,4.0
847,TCGA-AR-A0U1.007C609A-7874-4E39-BC4D-1EA81F4722EA,1,"Breast, left, wide local excision: Invasive ductal carcinoma, Nottingham grade 3 (of 13), forming a 2.3 x. 2.2 x 2.0 cm mass (AJCCpT2). All surgical margins, including separately submitted inferior margin, are. negative for tumor. Lymph node, left breast intramammary, excision: Metastatic adenocarcinoma. no extranodal extension is. identified. Lymph nodes, left axillary sentinel, excisions: Multiple (5) left axillary sentinel lymph nodes are. negative for tumor (blue dye identified in left axillary lymph node No. 1 only). Lymph nodes, left axillary, dissection: Multiple left highest (2) and left axillary (23) lymph nodes are. negative for tumor. Her-2/NEU has been ordered on paraffin embedded tissue.",BRCA,1,"The report states that multiple (5) left axillary sentinel lymph nodes are negative for tumor, and multiple left highest (2) and left axillary (23) lymph nodes are also negative for tumor. This means that there is no cancer found in any of the examined lymph nodes, which corresponds to an N0 stage.",N0,5.0
797,TCGA-AO-A0JB.6C202D3E-5670-4B63-82A2-9EE7AC385089,2,"Clinical Diagnosis & History: 1/0 female with left breast IDC. Specimens Submitted: 1: SP: Level three left axillary lymph nodes. 2: SP: Level two left axillary lvmph nodes. 3: SP: Lateral left breast skin. 4: SP: Right upper abdominal skin tag. 5: SP: Left breast and level 1 axillary lymph nodes. DIAGNOSIS: 1). SOFT TISSUE, LEVEL III LEFT AXILLA; EXCISION: - BENIGN FIBROADIPOSE TISSUE. - NO LYMPH NODE IDENTIFIED. 2). LYMPH NODES, LEVEL II LEFT AXILLA; EXCISION: - THREE BENIGN LYMPH NODES (0/3). 3). SOFT TISSUE, LATERAL LEFT BREAST; EXCISION: - ONE BENIGN LYMPH NODE (0/1). - BENIGN FIBROADIPOSE TISSUE. 4). SKIN, RIGHT UPPER ABDOMINAL TAG; EXCISION: - IRRITATED SEBORRHEIC KERATOSIS. 5). BREAST AND LEVEL I AXILLARY LYMPH NODES, LEFT; MASTECTOMY: - INVASIVE DUCTAL CARCINOMA, HISTOLOGIC GRADK III/III (SLIGHT OR NO. TUBULE FORMATION). NUCLEAR GRADE II/III (MODERATE VARIATION IN SIZE AND. SHAPE) WITH AREAS OF LOBULAR GROWTH, MEASURING 11.0 CM IN LARGEST DIMENSION. GROSSLY. - DUCTAL CARCINOMA IN SITU (DCIS) IS ALSO IDENTIFIED, SOLID TYPE, WITH. MODERATE HIGH NUCLEAR GRADE AND EXTENSIVE NECROSIS. - LOBULAR INVOLVEMENT BY DCIS IS PRESENT. THE DCIS CONSTITUTES <= 25% OF THE TOTAL TUMOR MASS, AND IS PRESENT. ADMIXED WITH AND AWAY FROM THE INVASIVE COMPONENT. - THE INVASIVE CARCINOMA IS LOCATED IN THE UPPER OUTER QUADRANT, UPPER INNER. QUADRANT AND LOWER OUTER QUADRANT. - THE DCIS IS LOCATED IN THE UPPER OUTER QUADRANT, UPPER INNER QUADRANT AND. LOWER OUTER QUADRANT. - NO INVOLVEMENT OF THE NIPPLE BY EITHER IN SITU OR INVASIVE CARCINOMA IS. IDENTIFIED. CALCIFICATIONS ARE PRESENT IN THE IN SITU AND INVASIVE CARCINOMA, AND IN. BENIGN BREAST PARENCHYMA. EXTENSIVE VASCULAR INVASION IS PRESENT. NO INVOLVEMENT OF THE SURGICAL MARGINS BY EITHER INVASIVE OR IN SITU. CARCINOMA IS IDENTIFIED. - NO SKIN INVOLVEMENT BY CARCINOMA IS IDENTIFIED. - THE ATTACHED SKELETAL MUSCLE IS UNINVOLVED BY CARCINOMA. THE NON-NEOPLASTIC BREAST TISSUE SHOWS BIOPSY SITE CHANGES AND. PROLIFERATIVE FIBROCYSTIC CHANGES. - THE LYMPH NODE STATUS IS AS FOLLOWS (EXPRESSED AS THE NUMBER OF POSITIVE. LYMPH NODES IN RELATION TO THE TOTAL NUMBER OF LYMPH NODES EXAMINED) : LEVEL. I: 1/10. - THERE IS EXTRANODAL EXTENSION OF CARCINOMA, >2 MM. IMMUNOHISTOCHEMICAL STAINS WERE PERFORMED ON FORMALIN-FIXED TISSUE WITH. THE FOLLOWING RESULTS FOR INVASIVE CARCINOMA (BLOCK 5T5) : ESTROGEN RECEPTOR (6F11,. 90% NUCLEAR STAINING WITH. STRONG INTENSITY. PROGESTERONE RECEPTOR (1E2;. 608 NUCLEAR STAINING WITH. MODERATE INTENSITY. NEGATIVE (STAINING. HER2 (HERCEPTEST; DAKO) : INTENSITY OF 0). CONTROLS ARE SATISFACTORY. COMMENT: HERCEPTESTTM (DAKO) IS AN FDA-APPROVED METHOD FOR. ASSESSMENT OF HER2 PROTEIN OVEREXPRESSION IN BREAST CANCER TISSUE ROUTINELY. PROCESSED FOR HISTOLOGICAL EVALUATION. THE HER2 TEST RESULTS ARE REPORTED IN. ACCORDANCE WITH THE ASCO/CAP GUIDELINE RECOMMENDATIONS FOR HER2 TESTING IN. BREAST CANCER (J CLIN ONCOL 2007; 25 (1) :1-28) . I ATTEST THAT THE ABOVE DIAGNOSIS IS BASED UPON MY PERSONAL EXAMINATION OF. THE SLIDES (AND/OR OTHER MATERIAL), AND THAT I HAVE REVIEWED AND APPROVED. THIS REPORT. Special Studies: Special Stain. Comment. ER-C. PR-C. HER2-C. IMM RECUT. NEG CONT. NEG-HER2. Gross Description: MD. D. 1.) The specimen is received in formalin, labeled ""level 3 left axillary. lymph nodes"" and consists of two irregularly shaped fragments of yellow. lobulated adipose tissue measuring 1.0 x 1.0 x 0.2 cm in aggregate. No. lymph nodes are identified grossly. The specimen is entirely submitted. Summary of sections: U-undesignated. 2.) The specimen is received in formalin, labeled ""level 2 left axillary. lymph nodes"" and consists of one irregularly shaped fragment of yellow. lobulated adipose tissue measuring 3.5 x 2.5 x 0.3 cm. Three possible lymph. nodes are identified, ranging from 0.3 cm to 0.5 cm in greatest dimension. The lymph nodes are entirely submitted. Summary of sections: U undesignated. I.D. 3.) The specimen is received in formalin, labeled ""lateral left breast. skin"" and consists of one irregularly shaped fragment of yellow to tan. fibroadipose tissue measuring 10.3 x 2.9 x 1.4 cm. No skin is identified. grossly. Serial sectioning reveals a grossly unremarkable fibroadipose. tissue with a single possible lymph node measuring 0.4 cm in greatest. dimension. Representative sections are submitted. Summary of sections: U-undesignated. .D. 4.) The specimen is received in formalin, labeled ""right upper abdominal. skin tag"" and consists of one polypoid shaped fragment of brown skin. measuring 0.3 x 0.2 x 0.2 cm. The specimen is entirely submitted. Summary of sections: U-undesignated. ..D. 5.) The specimen is received fresh, labeled ""left breast and level 1. axillary lymph nodes, stitch marks level 1 axillary lymph nodes"" and. consists of a breast with attached axillary tail. The breast measures. 22.2. x 16.0 x 3.5 cm with overlying skin ellipse measuring 16.6 x 7.9 cm. Situated eccentrically on the skin surface is an everted nipple measuring. 1.2 x 1.1 x 0.3 cm and areola measuring 4.9 x 4.1 cm. The skin shows no. scars. A suture demarcates the axillary tail which measures 9.8 x 5.5 x 1.5. cm. The posterior surface of the breast is inked black and the specimen is. serially sectioned to reveal an irregularly shaped white-tan firm mass. measuring 11.0 x 6.5 x 4.8 cm, involving upper outer, lower outer and upper. inner quadrants, located 0.6 cm away from the deep resection margin. The. remaining breast tissue shows predominantly yellow lobulated adipose tissue. admixed with scant white-tan fibrous soft tissue with no other grossly. identifiable lesions. The axillary tissue is dissected to reveal multiple. lymph nodes ranging in size from 0.5 cm to 2.5 cm. The specimen is. submitted for lymph node dissection. Representative sections of the. mastectomy specimen and all identified axillary lymph nodes are submitted. Tissue submitted for TPS. Summary of sections: N - nipple. NB - nipple base. S skin. D - deep margin. T - tumor. UIQ - upper inner quadrant. LIQ - lower inner quadrant. UOQ - upper outer quadrant. LOQ - lower outer quadrant. LNS -- lymph nodes. Summary of Sections: Part 1: SP: Level three left axillary lymph nodes. Block. Sect. Site. PCs. 1. U. 1. Part 2: SP: Level two left axillary lymph nodes. Block. Sect. Site. PCs. 1. U. 1. Part 3: SP: Lateral left breast skin (sr). Block. Sect. Site. PCs. 1. U. 1. Part 4: SP: Right upper abdominal skin tag. Block. Sect. Site. PCs. 1. U. 1. Part 5: SP: Left breast and level 1 axillary lymph nodes. Block. Sect. Site. PCs. 1. D. 1. 2. LIQ. 2. 6. LN. 11. 2. LOQ. 2. 1. N. 1. 1. NB. 1. S. 1. 5. T. 5. 2. UIQ. 2. 2. UOQ. 2.",BRCA,1,"The report indicates that there is 1 positive lymph node out of 10 examined level I lymph nodes (1/10). According to the rules provided, this corresponds to an N1 stage. However, there is also extranodal extension of carcinoma, >2 mm, which upstages the N stage to N2.",N2,6.0
