Unnamed: 0,patient_filename,t,text,type,n,cmem_n_reasoning,cmem_n_ans_str,cmem_n_num_update
706,TCGA-AC-A2FO.5A7EB73F-E681-46CC-B2D6-C87EEAB0AC99,1,".4. Acct/Reg #. ADDENDUM REPORT "". ADDENDUM REPORT NUMBER TWO. BREAST PROGNOSTIC PANEL: Block B2. TEST. REFERENCE RANGES. DNA Analysis by Image: DNA Index: 1.1 (DIPLOID). 0.9-1.1 is Diploid. Her2 Gene Amplification By FISH: UNABLE TO BE DETERMINED. Average copies per cell: Her-2/neu: Chromosome 17: Ratio: > 2.0 Her2/neu. COMMENT: This specimen falled to hybridize successfully with probes specific to Her2/neu gene and chromosome 17 alpha satellite. sequences. Non formalin and ethanol based fixatives as well as age and storage conditions of the specimen may contribute to unsuccessful. FISH analysis. Repeat studies are recommended If additional tissue becomes available from subsequent specimens. Case interpreted by. Notes: Quantitative analysis performed using Chromavision ACIS. The Her2 /neu and CEP17 probes are manufactured by. The Her2/neu gene detection by Fluorescence In Situ Hyondization (FISH) was performed using the LSI Her2/neu DNA probe, specific. for the Her2/neu gene locus 17q11.2-q12 and the CEP1 DNA probe specific for the alpha sateilite DNA sequence at the centromeric. region of chromosome 17 (17p11.1-q11.1). These teste were developed and performance characteristics determined by the. They have not. been cleared or approved by the US Food and Drug Administration. The FDA has determined that such approval or clearance Is. necessary. These tests are used for clinical purposes. They should not be regarded as Investigational or for research. This. laboratory is certified under the Clinical Laboratory Improvement Act (CLIA) of 1988 as qualified to perform high complexity clinical. laboratory testing. ADDENDUM REPORT NUMBER ONE. BREAST PROGNOSTIC PANEL: (Preliminary test results on block B2.). TEST. REFERENCE RANGES. Estrogen Receptor: Positive (95%). 4% is Positive. 2-4% la Borderline. < 2% is Negative. Progesterone Receptor: Negative (0%). > 4% Is Positive. 2-4% is Borderline. for 4/10/11. < 2% Is Negative. KI-67 (MIB1) Proliferation Marker: Low (<10%). > 20% Is High. 10-20% is Borderline. < 10% is Low. These results were interpreted by E. An additional addendum report will follow when DNA and Her-2-neu tests. are completed. These tests were developed and performance characteristics determined by. They have not been cleared or approved by. the US Food and Drug Administration. The FOA has determined that such approval or clearance is not necessary. These tests are used for. clinical purposes. They should not be regarded as investigational or for research. This laboratory is certified under the Clinical Laboratory. Improvement Act (CLIA) of 1988 as qualified to perform high complexity clinical laboratory testing. DIAGNOSIS. DIAGNOSIS: A,B,C: Left mastectomy with left sentinel lymph node and additional lymph node for diagnosis of breast carcinoma: Tumor Characteristics: 1. Histologic type: Inflitrating lobular carcinomas. 2. Size: 2.5 x 2 x 1.8 cm. 3. Elston modification of Bloom-Richardson grade: a. Architectural Score:3/3. b. Nuclear Score: 2/3. C. Mitotic Score: 1/3. d. Total score: 6/9 - Grade: II. 4. In-situ component: Present. e. Amount: Less then 25%. f. Histologic type: Lobular carcinoma in situ. g. Architectural type: Solld. h. Nuclear grade: II. i. Comedo necrosis: Absent. 5. Margin status for in situ carcinoma: Not transected. 6. Lymphovascular space invasion: No. 7. Skin Involvement: No. 8. Are microcalcifications identified In association with tumor: No. Surgical Margin Status: 1. Is tumor transected: No. 2. Tumor distance to closest margin: 1.6 cm deep margin. Lymph Node Status: 1. Total number of lymph nodes examined: Ten. 2. Total number of lymph nodes containing metastatic carcinoma by gross exam or light microscopy: Sentinel, 1/2; Level 1 and II, 1/8. 3. Size of largest metastasis: 9 mm. 4. Extra-capsular extension of tumor: No. Other: 1. Other significant findings: Fibrocystic change with epithelial hyperplasia and benign calcifications. 2. Block prognostic Indicators will be obtained on paraffin block B2. 3. Correlation Statement with Intra-op consult or frozen section: Frozen section diagnosis sentinel lymph is confirmed by permanent. section malysis. 4. PTNM stäge: T2N1MX. 5. If further required In the future, infiltrating carcinoma is best seen in blocks B2,3,4 and 6. DIAGNOSIS. D. Skin, lip, blopsy: Benign solar lentigo (pigmented actinic keratosis). CLINICAL INFORMATION. CLINICAL HISTORY: Preoperative Diagnosis: Left breast cancer. Postoperative Diagnosis: Symptoms/Radiologic Findings: SPECIMENS: A. Left sentinei lymph node FS. B. Left breast tissue. C. Left lymph nodes. D. Seborrhelc keratosis of lip. SPECIMEN DATA. GROSS DESCRIPTION: A. Container A is labeled A and consists of a tan-yellow firm fatty nodule, 2.0 x 1.0x 1.0 cm in greatest dimension. The specimen is trisected. and entirely submitted for frozen section in one cassette labeled. B. Container B is labeled Ir, B and consists of a 255 gram portion of left breast tissue, 14.0 x 11.0 x 6.0 cm with attached tan-gray ellipse of skin,. 5,0 x 4.2 cm displaying a centrally located flattened nipple, 0.8 cm in greatest dimension. The deep margin is inked and the specimen is sectioned to. reveal predominately tan-yellow lobular adipose tissue intermixed with moderate amounts of tan-gray dense fibrous tissue. A gray-white stellate gritty. mass is noted in the upper outer quadrant and is 2.5 x 2.0x 1.8 cm in greatest dimension. Samples of this mase have been submitted for genomic. studies. This mass is located 2.0 cm from the skin surface and 1.5 cm from the deep margin. No other lesions are grossly noted. The lateral margin. displays a gray-white minute nodule possibly representing lymph node, 0.2 cm. Representative sections submitted in eleven cassettes lá. as follows: nipple-1; stellate mass-2 to 5; deep margin-6; upper inner quadrant-7; upper outer-8; lower inner-9; lower outer-10; lateral. nodule 11. C. Container c is labeled. consists of a tan-yellow lobular mass of adipose tissue, 11.0 x 4.0 x 2.0 cm in greatest dimension. Sectioning. reveals eight tan-yellow firm falty nodules, the largest 1.5 cm. Samples of these nodules submitted in four cassettes labeled. D. Container D is labeled D and consists of a tan-gray granular raised lesion, 0.5 x 0.3 x 0.2 cm. The skin surface displays a mottled dark. brown discoloration. The specimen is inked, serially sectioned and entirely submitted in one cassette labeled 1.",BRCA,1,"The report states that 'Total number of lymph nodes examined: Ten. Total number of lymph nodes containing metastatic carcinoma by gross exam or light microscopy: Sentinel, 1/2; Level 1 and II, 1/8.' This indicates that there is cancer in 1 out of 2 sentinel lymph nodes and 1 out of 8 non-sentinel lymph nodes. Therefore, the N stage is N1.",N1,42.0
864,TCGA-AR-A1AU.5654FC27-47D3-4C7F-A0E7-A5B6140991C2,1,"Final Diagnosis. Breast, right, total mastectomy: Infiltrating ductal carcinoma, Nottingham grade III (of III),. [tubules 3/3, nuclei 3/3, mitoses 2/3; Nottingham score 8/9], forming multiple (2) masses (central-. -2.6 x 2.2 x 1.6 cm and upper inner quadrant--0.3 x 0.2 x 0.2 cm) [AJCC pT2]. Ductal carcinoma. in situ, high nuclear grade, composes less than 5% of the tumor volume. Angiolymphatic. invasion is absent. The non-neoplastic breast parenchyma shows nonproliferative fibrocytic. changes and a fibroadenoma (0.3 x 0.2 x 0.2 cm). Biopsy site changes present. The tumor does. not involve the nipple, overlying skin, or underlying chest wall. All surgical resection margins,. including the deep margin, are negative for tumor (minimum tumor free margin, 1.4 cm, anterior. margin, for the central tumor). Lymph nodes, right axillary non-sentinel, excision: Multiple (2 of 3) right axillary non-sentinel. lymph nodes are positive for metastatic carcinoma. One of the positive lymph nodes shows focal. extracapsular extension. Lymph nodes, right axillary sentinel, excision: Multiple (2) right axillary sentinel lymph nodes. are negative for metastatic carcinoma. Blue dye is identified in right axillary sentinel lymph node. No. 1. Blue dye is not identified in right axillary sentinel lymph node No. 2. Lymph nodes, right high axillary, excision: Multiple (5) right high axillary lymph nodes are. negative for tumor. Lymph nodes, right mid/low axillary, dissection: Multiple (2 of 27) right mid/low axillary lymph. nodes are positive for metastatic carcinoma [AJCC pN2]. Residual right breast tissue, excision: Residual breast tissue shows non-proliferative fibrocystic. changes. Breast, left, simple mastectomy: Benign breast parenchyma with proliferative fibrocystic. changes, including a complex sclerosing lesion. Negative for malignancy. Additional left breast tissue, excision: Benign breast parenchyma with non-proliferative. fibrocystic changes; negative for malignancy.",BRCA,2,"The report indicates that there are positive lymph nodes in both the non-sentinel and sentinel lymph nodes of the right axilla. Specifically, 1 out of 3 non-sentinel lymph nodes and 2 out of 27 mid/low axillary lymph nodes are positive for metastatic carcinoma. This corresponds to a pN2 stage according to the AJCC staging system.",N2,43.0
871,TCGA-AR-A24L.BF82AD23-B40E-459F-83EC-590D392664FD,1,"Final Diagnosis. reast, right, wide local excision: Invasive ductal carcinoma, Nottingham grade 2 (of 3 3), forming a 2.5 x 2.1 x 1.0 cm mass(AJCC. PT2). Ductal carcinoma in situ, solid type, without necrosis and high nuclear grade identified. Angiovascular invasion present. After, re-excision of inferior and deep margins, all margins are negative by at least 1.0 cm. Skin ellipse identified without. abnormality. Lymph nodes, right axillary sentinel, excision: Multiple (2 of 5) sentinel lymph nodes are positive for metastatic breast carcinoma. (AJCC pN1). Lymph nodes, right axillary, excision: Multiple (7) right axillary lymph nodes are negative for tumor. Estrogen/progesterone analysis and Her2/Neu have been ordered on paraffin embedded tissue.",BRCA,1,"The report states that there were multiple (2 of 5) sentinel lymph nodes positive for metastatic breast carcinoma. This corresponds to an N1 stage, as the N stage is determined by the number of positive lymph nodes, regardless of sentinel or non-sentinel status. The mention of extranodal extension, grade, T stage, or immunohistochemical cytokeratin stain does not affect the N stage determination.",N1,44.0
676,TCGA-A8-A09M.EBBF2A70-2773-40FA-823A-E608ABFEF591,1,"Diagnosis: Right-sided breast excision material with a poorly differentiated invasive ductal breast. carcinoma measuring about 4.3 cm with invasion of the lymph vessels and a minimum margin. of 3 mm at 6 o 'clock and 10 mm at 12 o 'clock and 1.5 cm or more at 3 and 9 ""clock. No. intraductal tumor component. Tumor classification: M-8500/3, G3, pT 2, pN 3a (14/28), pMx, stage III c. R 0.",BRCA,3,"The report indicates that the patient has metastasis in 14 out of 28 examined axillary lymph nodes (ipsilateral), which corresponds to the pN3a stage. This is further specified as stage III c. The N stage is determined based on the number of positive lymph nodes and not on the total number of lymph nodes examined. The presence of extranodal extension, the grade or T stage of the tumor, immunohistochemical cytokeratin stain, and HER2/neu protein overexpression status do not affect the N stage determination.",N3,45.0
805,TCGA-AO-A0JL.C2976F78-89AF-4461-8D22-BFEBC0504722,1,"clinical Diagnosis & History: %/O female with left breast mass. Mammo showed 2 lesions in UOQ left. breast. Core biopaies IDC and DCIS. Proceeding to MRM. Specimens Submitted: 1: SP: Left breast with level 1 and low level 2 axillary contents. 2: SP: Additional level 2 left axillary contents. 3: SP: Left level 2 and level 3 axillary contents. DIAGNOSIS: 1). BREAST WITH LEVEL I AND LOW LEVEL II AXILLARY CONTENTS, LEFT;. MODIFIED RADICAL MASTECTOMY AND AXILLARY LYMPH NODE DISSECTION: - TWO SEPARATE TUMOR NODULES: ONE IS LOCATED IN THE UPPER OUTER. QUADRANT AND SHOWS AN INVASIVE DUCTAL CARCINOMA, POORLY DIFFERENTIATED. (HISTOLOGIC GRADE III/III, NUCLEAR GRADE III/III), MEASURING 3.9 CM IN. LARGEST DIMENSION GROSSLY. THE SECOND IS LOCATED IN THE UPPER AND LOWER OUTER QUADRANTS AT 3:00 AND IS. COMPOSED OF PREDOMINANTLY DUCTAL CARCINOMA IN SITU (DCIS) WITH SEVERAL FOCI. OF INVASIVE DUCTAL CARCINOMA, POORLY DIFFERENTIATED AND SIMILAR TO ABOVE,. RANGING IN SIZE FROM LESS THAN 0.1 CM TO ABOUT 0.4 CM. - THE DUCTAL CARCINOMA IN SITU (DCIS) IS OF THE SOLID AND CRIBRIFORM TYPES. WITH HIGH NUCLEAR GRADE, EXTENSIVE NECROSIS AND FOCALLY INVOLVES A LARGE. LACTIFEROUS DUCT OF THE NIPPLE. - CALCIFICATIONS ARE PRESENT IN THE IN SITU AND INVASIVE CARCINOMA, AND IN. BENIGN BREAST PARENCHYMA. - VASCULAR INVASION IS PRESENT. - NO INVOLVEMENT OF THE SURGICAL MARGINS BY EITHER INVASIVE OR IN SITU. CARCINOMA IS IDENTIFIED. - NO SKIN INVOLVEMENT BY CARCINOMA IS IDENTIFIED. - THE REMAINING BREAST TISSUE SHOWS PREVIOUS BIOPSY SITE AND MILD. FIBROCYSTIC CHANGES. - THE LYMPH NODE STATUS IS AS FOLLOWS (EXPRESSED AS THE NUMBER OF POSITIVE. LYMPH NODES IN RELATION TO THE TOTAL NUMBER OF LYMPH NODES EXAMINED) : THERE IS EXTRANODAL TUMOR EXTENSION (>2 MM). - RESULTS OF IMMUNOHISTOCHEMICAL STAINS ARE AS FOLLOWS: ER: 0% NUCLEAR STAINING. PR: 0% NUCLEAR STAINING. HER-2/NEU (HERCEPTEST) : NEGATIVE (STAINING INTENSITY OF 1+). 2). AXILLARY CONTENTS, LEFT ADDITIONAL LEVEL II; DISSECTION: TWELVE BENIGN LYMPH NODES (0/12). 3). AXILLARY CONTENTS, LEFT LEVELS II AND III; DISSECTION: - THREE BENIGN LYMPH NODES (0/3). I ATTEST THAT THE ABOVE DIAGNOSIS IS BASED UPON MY PERSONAL EXAMINATION OF. THE SLIDES (AND/OR OTHER MATERIAL), AND THAT I HAVE REVIEWED AND APPROVED. THIS REPORT. Special Studies: Special Stain. Comment. ER-C. PR-C. HER2-0. NEG CONT. IMM RECUT. NEG-HER2. Gross Description: 1). The specimen is received fresh labeled, ""Left breast with level 1 and. low level 2 axillary contents, stitch marks axillary contents and consists. of a breast with attached axillary tail. The breast measures 37.0 x 26.0. x. 6.7 cm with overlying skin ellipse measuring 36.5 x 18.0 cm. Situated on. the skin surface is an everted nipple measuring 1.4 x 1.2 x 0.1 cm and. areola measuring 4.8 x 4.5 cm. The skin shows no visible scars. A suture. demarcates the axillary tail which measures 11.0 x 4.0 x 3.5 cm. The. posterior surface of the breast is inked black and the specimen is serially. sectioned to reveal a white tan firm ill-defined mass in the upper outer. quadrant measuring 3.9 x 3.7 x 3.3 cm, located 1.5 from the deep margin. There is a biopsy site identified in the lower outer quadrant, corresponding. to the three o'clock position, measuring 2.0 x 2.0 x 1.5 cm. The remaining. breast tissue shows predominantly yellow lobulated adipose tissue admixed. with white-tan fibrous soft tissue with no other gross identifiable lesions. The axillary tissue is dissected to reveal several grossly positive lymph. nodes, measuring up to 4.5 cm. Representative sections of the mastectomy. specimen and all identified axillary lymph nodes are submitted (the large. grossly positive lymph nodes are representatively submitted). Tissue. is. taken for TPS. Summary of sections: N - nipple. NB - nipple base. s skin. D - deep margin. T tumor. BX - separate biopsy site. UIQ - upper inner quadrant. LIQ - lower inner quadrant. UOQ - upper outer quadrant. LOQ - lower outer quadrant. LN - individual lymph nodes. 2). The specimen is received in formalin, labeled ""Additional level 2. left axillary contents"" and consists of an axillary dissection measuring 7 x. 4.5 x 0.8 cm. The specimen consists of soft yellow-tan lobulated tissue. with several pink-tan lymph nodes identified on cut section ranging from 0.2. cm to 1.8 cm in greatest dimension. The specimen is submitted for lymph. node digest dissection. Summary of sections: LN - lymph nodes. 3). The specimen is received in formalin, labeled ""Left level 2 and level. 3 axillary contents"" and consists of an unoriented axillary dissection. measuring 7.5 x 4.7 x 1.8 cm. The specimen consists of yellow tan lobulated. tissue, which on sectioning reveals several pink-tan lymph nodes ranging. from 0.2 cm to 2.3 cm in greatest dimension. The specimen is submitted for. lymph node dissection. Summary of sections: LN - lymph nodes. Summary of Sections: Part 1: SP: Left breast with level 1 and low level 2 axillary contents. Block. Sect. Site. PCs. 3. BX. 3. 1. D. 1. 2. LIQ. 2. 4. LN. 4. 2. LOQ. 2. 1. N. 1. 1. NB. 1. 1. s. 1. 3. T. 3. 2. UIQ. 2. 2. 2. Part 2: SP: Additional level 2 left axillary contents. Block. Sect. Site. PCs. 4. LN. 4. 2art 3: . SP: Left level 2 and level 3 axillary contents. Block. Sect. Site. PCs. 2. LN. 2.",BRCA,2,"The report mentions 'exTRANODAL tumor extension (>2 MM)' which upstages the N stage to N2, as per the rule 'Extranodal extension of carcinoma, >2 mm, upstages the N stage to N2.' The number of positive lymph nodes is not explicitly stated, but it is clear that the N stage is not N0 or N1, and the extranodal extension warrants an N2 classification.",N2,46.0
866,TCGA-AR-A1AW.BB485405-199C-48C7-96D7-8C315DEA66B4,1,"Final Diagnosis. Breast,Meft ypper inner quadrant, lumpectomy: Infiltrating ductal carcinoma, with medullary like. features, Nottingham grade III (of III), [tubules 3/3, nuclei 3/3, mitoses 2/3; Nottingham score. 8/9], forming a 2.7 x 2.5 x 2.0 cm yellow-tan, somewhat circumscribed, sclerotic mass. [AJCCpT2]. Ductal carcinoma in situ is absent. Angiolymphatic invasion is absent. All surgical. resection margins, after re-excision of the deep and medial inferior margins, are negative for. tumor (minimum tumor free margin, 0.8 cm, deep margin). Lymph node, left axillary, sentinel biopsy: A single (1) left axillary sentinel lymph node is. negative for tumor, confirmed by cytokeratin (AE1/AE3) immunostains. ER/PR and Her2/neu have been ordered on paraffin-embedded tissue.",BRCA,0,"The report states that a single sentinel lymph node was examined and found to be negative for tumor, confirmed by cytokeratin (AE1/AE3) immunostains. This corresponds to an N0 stage, as there is no cancer found in the lymph nodes.",N0,47.0
799,TCGA-AO-A0JD.E8A43FF3-3D98-45EE-9567-6EED4DA38274,2,"Clinical Diagnosis & History: Left breast lump. FNA adenocarcinoma; core biopsy IFDC. Specimens Submitted: 1: SP: Sentinel node #1, level one, left axilla (fs). 2: SP: Sentinel node #2, level one, left axilla (fa). 3: SP: Left breast. 4: SP: Levels I and 11 left axillary contents. 5: SP: Levels II and III left axillary contents. DIAGNOSIS: 1). LYMPH NODES, SENTINEL #1, LEVEL I, LEFT AXILLA; EXCISION: - TWO BENIGN LYMPH NODES (0/2). 2). LYMPH NODES, SENTINEL #2, LEVEL I, LEFT AXILLA; EXCISION: - ONE OF ONE LYMPH NODE POSITIVE FOR METASTATIC CARCINOMA (1/1). - EXTRANODAL EXTENSION IS NOT PRESENT. 3). BREAST, LEFT; MASTECTOMY: - INVASIVE DUCTAL CARCINOMA, NOS TYPE, HISTOLOGIC GRADE III/III (SLIGHT. OR NO TUBULE FORMATION). NUCLEAR GRADK III/III (MARKED VARIATION IN. SIZE AND SHAPE) MEASURING 6 CM IN LARGEST DIMENSION GROSSLY. - THE INVASIVE CARCINOMA IS LOCATED IN THE UPPER OUTER QUADRANT. - NO INVOLVEMENT OF THE NIPPLE BY CARCINOMA IS IDENTIFIED. - CALCIFICATIONS ARE PRESENT FOCALLY IN BENIGN BREAST PARENCHYMA. - VASCULAR INVASION IS PRESENT. - NO INVOLVEMENT OF THE SURGICAL MARGINS BY INVASIVE CARCINOMA IS. IDENTIFIED. - NO SKIN INVOLVEMENT BY CARCINOMA IS IDENTIFIED. - THE ATTACHED SKELETAL MUSCLE IS NEGATIVE FOR TUMOR. - THE ON-NEOPLASTIC BREAST TISSUE SHOWS FLORID PAPILLOMATOSIS OF THE. NIPPLE, BIOPSY SITE CHANGES, FIBROCYSTIC CHANGES, AND SCLEROSING ADENOSIS. THE LYMPH NODE STATUS IS AS FOLLOWS (EXPRESSED AS THE NUMBER OF POSITIVE. LYMPH NODES IN RELATION TO THE TOTAL NUMBER OF LYMPH NODES EXAMINED) : 2/4. THERE IS NO EXTRANODAL EXTENSION OF CARCINOMA. - ONE BENIGN INTRAMAMMARY LYMPH NODE (0/1). 4). LYMPH NODES, LEFT AXILLARY, LEVELS I AND II; EXCISION: EIGHT BENIGN LYMPH NODES (0/10) . 5). LYMPH NODES, LEFT AXILLARY, LEVELS II AND III; EXCISION: NINE BENIGN LYMPH NODES (0/9) . I ATTEST THAT THE ABOVE DIAGNOSIS IS BASED UPON MY PERSONAL EXAMINATION OF. THE SLIDES (AND/OR OTHER MATERIAL), AND THAT I HAVE REVIEWED AND APPROVED. THIS REPORT. Special Studies: Special Stain. Comment. RECUT. RECUT. ER-C. PR-C. HER2-C. NEG CONT. IMM RECUT. NEG-HER2. Gross Description: 1). The specimen is received fresh for frozen section, labeled ""Sentinel. node #1, level 1, left axilla"". It consists of two lymph nodes measuring. 1.0 and 0.5 cm. They are bisected and entirely frozen. Summary of Sections: FSC - Frozen section control. 2). The specimen is received fresh for frozen section, labeled ""Sentinel. node #2, level 1, left axilla"". It consists of one large lymph node,. measuring 2.5 cm. The specimen is bisected and submitted in two cassettes. Z. Summary of Sections: FSCA - Frozen section control A. FSCB - Frozen section control B. 3). The specimen is received fresh, labeled ""Left breast. Stitch marks. axillary tail"" It consists of a 34 x 22 x 6 cm mastectomy with a 30 x 12. cm ellipse of skin and a 1.5 cm everted nipple. A mass is palpable in the. 12-3:00 position and the axillary tail is designated by a long black suture. The specimen is serially sectioned, revealing a 6.0 x 5.0 x 2.8 cm. gray-white, ill-defined mass, grossly 2 cm from the deep margin. Multiple. lymph nodes are identified in the axillary tail, ranging from 0.3 to 3.5 cm. A single intramammary lymph node is identified. All lymph nodes are. submitted. TPS is submitted. Summary of Sections: N Nipple. DM - Deep margin. MASS - Multiple sections of the mass. UOQ - Representative upper outer quadrant. LOQ - Representative lower outer quadrant. UIQ - Representative upper inner quadrant. LIQ - Representative lower inner quadrant. SK - Representative skin. IMLN - Single intramammary lymph node. LN - Multiple lymph nodes. BLN - Bisected lymph node. SSLN - Largest serially sectioned lymph node. 4). The specimen is received in formalin, labeled ""Levels 1 and 2, left. axillary contents"". It consists of an 11 x 7 x 2 cm lobulated portion of. fibrofatty tissue, with palpable lymph nodes ranging in size from 0.5 to 1.4. cm. A portion of a grossly positive lymph node is submitted for TPS. All. lymph nodes are submitted. Summary of Sections: LN - Single lymph node per cassette. 5). The specimen is received in formalin, labeled ""Levels 2 and 3 left. axillary contents"". It consists of a 3.0 x 2.0 x 1.5 cm lobulated, fatty. tissue fragment with palpable lymph nodes. All lymph nodes are submitted. Summary of Sections: LN - Lymph nodes. Summary of Sections: Part 1: SP: Sentinel node #1, level one, left axilla (fs). Block. Sect. Site. PCs. 1. fsc. 1. Part 2: SP: Sentinel node #2, level one, left axilla (fs). Block. Sect. Site. PCs. 1. fsca. 1. 1. 1. Part 3: SP: Left breast. Block. Sect. Site. PCs. 1. bln. 1. 1. dm. 1. 1. imln. 1. 2. liq. 2. 4. In. 4. 2. log. 2. 4. mass. 4. 1. n. 1. 1. sk. 1. 4. ssln. 4. 2. uiq. 2. 2. uog. 2. Part 4: SP: Levels I and II left axillary contents. Block. Sect. Site. PCs. 10. In. 10. 1. tpsln. 1. Part 5: SP: Levels II and III left axillary contents. Block. Sect. Site. PCs. 4. In. 4. Procedures/Addenda: Addendum. Date Complete;. Addendum Diagnosis. ADDENDUM. SITE: LEFT BREAST. PART #3. ER: 90% OF NUCLEAR STAINING WITH MODERATE INTENSITY. PR: 40% OF NUCLEAR STAINING WITH MODERATE INTENSITY. HER2/NEU (HERCEPTEST) : NEGATIVE (STAINING INTENSITY OF 1+) . MD. Intraoperative Consultation: 'NoLe: The diagnoses given in this section pertain only to the. tissue sample examined at the time of the intraoperative. consultation. 1). FROZEN SECTION DIAGNOSIS: BENIGN (0/2) . PERMANENT DIAGNOSIS: SAME. 2). 3ECTION DIAGNOSIS: METASTATIC CARCINOMA IN ONE LYMPH NODE. (1/1). PERMANENT DIAGNOSIS: SAME. MD.",BRCA,1,"Based on the pathology report, there is one sentinel lymph node (out of one examined) that is positive for metastatic carcinoma, with no extranodal extension present. This corresponds to an N1 stage according to the rules provided.",N1,48.0
