Unnamed: 0,patient_filename,t,text,type,n,cmem_n_reasoning,cmem_n_ans_str,cmem_n_num_update
585,TCGA-A7-A26I.CCE33A95-774E-4242-B2A1-05FF002ED1D9,1,"Date Coll: SPECIMEN. A. Left axillary sentinel node. B. Left breast mass. Long stitch anterior, short stitch superior. CLINICAL NOTES. PRE-OP DIAGNOSIS: Left breast cancer. CLINICAL HISTORY: year-old white female with breast cancer. POST-OP DIAGNOSIS: Left breast cancer. GROSS DESCRIPTION. A. Received fresh labeled ""left axillary sentinel nodes"". are two slightly rubbery tan-white-pink tissues in keeping. with lymph nodes measuring 0. and 1.0 cm. in greatest dimension. The specimens are bisected and entirely submitted independently in. two blocks (one bisected tissue per cassette). B. Received fresh within a TranSpec container labeled. 'left breast mass"" is a 7.3 cm. (medial to lateral) x 6.5. cm. (superior to inferior) x 3.7 cm. (anterior to posterior), soft,. lobulated tan gold-white portion of fibroadipose tissue with two. sutures as stated previously. The margins are inked as follows: Anterior - blue, posterior - black, superior - green, and inferior. orange. The specimen is sectioned from medial to lateral. There is. a central, moderately well-circumscribed, 3.2 cm. (medial to. lateral) x 2.5 cm. (superior to inferior) x 2.4 cm. (anterior to. posterior), firm tan white tumor mass with several central. associated cylindrical tan white structures in keeping with cyte of. prior needle core biopsy. A portion of tumor and a portion of. normal parenchyma are submitted for tissue procurement as requested. The tumor appears to focally extend to within 0.3 cm. of both the. anterior and posterior inked margins. The cut surfaces throughout. the remainder of the specimen consist predominantly of glistening. lobulated golden yellow adipose tissue with a minimal amount of. interspersed dense tan-white fibrous tissue. No additional. abnormality is noted. Representative sections are submitted in. a. sequential manner from medial to lateral in 10 blocks as labeled. BLOCK SUMMARY: 1 - Representative perpendicular sections medial. margin cap; 2-9 sequential sections; 10 - representative. perpendicular sections lateral margin cap. MICROSCOPIC DESCRIPTION. A. Microscopic examination involved the evaluation of the. four H&E stained sections of each of the tissue blocks. Also pan cytokeratin AE1/AE3 immunohistochemical stains were. evaluated of each tissue block and no metastatic tumor was. identified in any of the examined sections (0/2) (snpNO). B. Microscopic examination of the left breast lumpectomy. specimen reveals: Invasive Carcinoma: Present. Histologic type: Infiltrating ductal. Histologic grade: Elston's SBR grade 2. Overall grade: 2. Architectural score: 2. Nuclear score: 2. Mitotic score: 2. Greatest dimension (pT) : 3.2 cm. in greatest dimension (pT2). Specimen margins: The resection margins are negative for. carcinoma with the closest resection margins being superior and. anterior where invasive tumor is 2 mm. from the resection. margin. Tumor is 3 mm from the posterior resection margin. Vessel invasion: Not identified. Calcification: Present. Ductal carcinoma in situ: Present. Histologic pattern: Solid with cancerization of lobules. Nuclear grade: High grade. Central necrosis: Absent. % DCIS of total tumor (if mixed) : Less than 10%. Extensive intraductal component (present/absent) : Absent. Specimen margins: DCIS is 2 mm from the anterior and superior. margins and 3 mm from the posterior margin. Calcification: not identified. Description of non-tumorous breast: Fibrosis, apocrine metaplasia. and microcysts with sclerosing adenosis. Prognostic markers, Umpon been reported previously on the core. biopsy see. 4x2, 20x1. DIAGNOSIS. A. Left axillary sentinel lymph nodes, biopsy: Two lymph nodes negative for metastatic tumor (0/2). B. Left) breast, lumpectomy: Invasive ductal carcinoma, Elston's SBR grade 2, tumor size. 3.2 cm. Associated high grade solid ductal carcinoma in-situ. Invasive and in-situ carcinoma are 2 mm from the resection. margins designated superior and anterior and 3 mm from the. resection margin designated posterior. No lymphovascular space invasion identified. See microscopic description. (Electronic Signature). End Of Report ---.",BRCA,0,"The T stage is T2, as the greatest dimension of the tumor is 3.2 cm. The N stage is N0, as no metastatic tumor was identified in the sentinel lymph nodes. The M stage is not mentioned, so we assume its absence. Therefore, the TNM stage is T2N0M0, which corresponds to stage IIA in the AJCC staging system for breast cancer.",IIA,5.0
1497,TCGA-PL-A8LZ.436F3280-98C7-4FA9-BD6F-1B02CAF1D262,3,"Sex: Female. Date of Tumour Procurement: 1. GROSS ASSESSMENT: Cut section showed a chalky white tumour. 4x3x2cm,. 2. MICROSCOPIC ASSESSMENT. Microscopic description: Section shows an invasive tumour growing in solid nests and. tubular patterns. It is composed of cells having moderately pleomorphic hyperchromatic. nuclei and amphophilic cytoplasm. The stroma is desmoplastic containing thin-walled. vascular channels, tumour cells and lymphocytes. Focal areas of necrosis noted,. 3. Tumour Type: Malignant. 4. Tumour Site: Left Breast. 5. Distance of invasive carcinoma to closest margin: 5mm. Which margin? Deep resection. 6. HISTOLOGICAL DIAGNOSIS: Invasive ductal carcinoma, NOS. 7. COMMENTS: nil. Dr. Reporting Pathologist Name.",BRCA,2,"The report does not mention any information about regional lymph node metastasis, therefore we can assume based on the provided information that N0 (no regional lymph node metastasis) is the appropriate N stage.",N0,6.0
1144,TCGA-D8-A1XG.AA869507-1B46-4812-8EC5-A4E01C588E6E,3,"page 1 / 1. copy No. Examination: Histopathological examination. Gender: F. Material: 1. Total organ resection - right breast. Expected time of examination: up to 8 working days. Clinical diagnosis: Cancer of the right breast, ulcerous - Toilet mastectomy. Macroscopic description: Right breast Sized 13.7 x 7.6 x 4.8 cm removed without axillary tissues and with a skin flap of 17.8 x 10.2 cm. Weight 193 g. Tumour sized 6.2 x 4.3 x 7.8 cm in the middle part, 0.1 cm from the upper boundary, 0.1 cm from the base. Microscopic description: Carcinoma ductale invasivum - NHG3 (3+2+3/20 mitoses/10 HPF - visual area: 0.55mm). Infiltratio carcinomatosa cutis et musculi pectoralis. Mamilla sine laesionibus. Glandular tissue showing parenchyma atrophy. Histopathological diagnosis: Carcinoma ductale invasivum mammae dextrae. Invasive ductal carcinoma of the right breast. Metastases carcinomatosae in lymphonodis axillae (No II/II). Cancer metastases of the axillary lymph nodes. (NHG3, pT4b, pN1a). Results of immunohistochemical examination: Estrogen receptors found in 10-75% of neoplastic cell nuclei. Progesterone receptors found in 10-75% of. neoplastic cell nuclei. HER2 protein stained with HercepTest™M by DAKO. Negative reaction in invasive cancerous cells ( Score = 0). Compliance valida.",BRCA,1,"The report indicates that the tumor size is 6.2 x 4.3 x 7.8 cm, which is larger than 5 cm and thus qualifies as T4b. Additionally, there are cancer metastases in the axillary lymph nodes, which is indicated by N1a. The M stage is not mentioned, so it is assumed to be M0 (no distant metastasis).",pT4b pN1a,7.0
1033,TCGA-BH-A0HL.79DAEAE5-A177-40E0-9BFC-54DC9F544764,1,"FINAL DIAGNOSIS: PART 1: RIGHT AXILLARY SENTINEL LYMPH NODE #1, EXCISION -. LYMPH NODE WITH METASTATIC DUCTAL CARCINOMA, PAPILLARY TYPE, EXHIBITING EXTRACAPSULAR. SPREAD MEASURING 0.3 CM (See comment). PART 2: BREAST, RIGHT; MODIFIED RADICAL MASTECTOMY -. A. INVASIVE DUCTAL CARCINOMA. PAPILLARY TYPE, ARISING IN A BACKGROUND OF INTRACYSTIC. PAPILLARY CARCINOMA. B. NOTTINGHAM GRADE 2 (NUCLEAR 2, TUBULES 3, MITOSIS 1; TOTAL NOTTINGHAM SCORE 6/9). C. TUMOR SIZE IS 3 X2.5X2.4CM. D. DUCTAL CARCINOMA IN SITU, PAPILLARY AND MICROPAPILLARY, NUCLEAR GRADE 2, PRESENT. ADJACENT AND AWAY FROM THE TUMOR, AND ACCOUNTING FOR 5% OF TUMOR MASS. E. NO ANGIOLYMPHATIC IDENTIFIED. F. ALL MARGINS ARE FREE OF THE INVASIVE AND IN SITU CARCINOMA. CLOSEST MARGIN IS THE. ANTERIOR MARGIN (SKIN), WHICH IS 1.2 CM FROM THE TUMOR. G. ORGANIZING HEMATOMA WITH GRANULATION TISSUE, HEMOSIDERIN-LADEN MACROPHAGES, FAT. NECROSIS AND FOREIGN BODY GIANT CELL REACTION (BIOPSY SITE). H. NIPPLE AND SKIN WITH DUCT ECTASIA AND HEMOSIDERIN-LADEN MACROPHAGES WITHIN THE LUMINA. OF SOME OF THE LACTIFEROUS DUCTS. I. J. ONE OF SIXTEEN AXILLARY SENTINEL LYMPH NODES WITH METASTATIC DUCTAL CARCINOMA (1/16). FIBROCYSTIC CHANGES. CASE SYNOPSIS: SYNOPTIC - PRIMARY IVVASIVE CARCINOMA OF BREAST. LATERALITY: Right. PROCEDURE: Modified radical mastectomy. Lower outer quadrant. Lower inner quadrant. SIZE OF TUMOR: Maximum dimension invasive component: 3 cm. MULTICENTRICITY/MULTIFOCALITY OF INVASIVE FOCI: TUMOR AGGREGATE SIZE: Sum of the sizes of multiple invasive tumors: 3 cm. TUMOR TYPE (invasive component): Papillary carcinoma. NOTTINGHAM SCORE: Nuclear grade: 2. Tubule formation: 3. Mitotic activity score: 1. Total Nottingham score: 6. Nottingham grade (1, 2, 3): 2. ANGIOLYMPHATIC INVASION: DERMAL LYMPHATIC INVASION: CALCIFICATION: Yes, benign zones. TUMOR TYPE, IN SITU: Papillary. DCIS admixed and outside of invasive carcinoma component. Percent of tumor occupied by in situ component: 5 %. SURGICAL MARGINS INVOLVED BY INVASIVE COMPONENT: SURG MARGINS INVOLVED BY IN SITU COMPONENT: PAGET'S DISEASE OF NIPPLE: LYMPH NODES POSITIVE: 2. LYMPH NODES EXAMINED: 17. METHOD(S) OF LYMPH NODE EXAMINATION: H/E stain. SENTINEL NODE METASTASIS: ONLY KERATIN POSITIVE CELLS ARE PRESENT: SIZE OF NODAL METASTASES: Diameter of largest lymph node metastasis: 3 mm. LYMPH NODE METASTASIS(-ES) WITH EXTRACAPSULAR EXTENSION: METASTASES TO IPSILATERAL INTERNAL MAMMARY LYMPH NODE (IF APPLICABLE): SKIN INVOLVED (ULCERATION): NON-NEOPLASTIC BREAST TISSUE: FCD. T STAGE, PATHOLOGIC: pT2. N STAGE, PATHOLOGIC: pN1. M STAGE, PATHOLOGIC: pMX. ESTROGEN RECEPTORS: unknown. PROGESTERONE RECEPTORS: unknown. HER2/NEU: unknown.",BRCA,1,"The N stage is determined by the presence and extent of regional lymph node metastasis. In this report, it is stated that one out of sixteen axillary sentinel lymph nodes has metastatic ductal carcinoma, which indicates N1 stage in breast cancer. The substaging information is not considered for this prediction.",N1,8.0
879,TCGA-AR-A24T.226031B3-D9C2-4343-B3F7-4E0C36B901E7,2,"Final Diagnosis. Breast, right, simple mastectomy: Infiltrating lobular carcinoma, Nottingham grade I (of III) [tubules 3/3, nuclei 1/3,. mitoses. 1/3;. Nottingham score 5/9], forming a mass (5.7 x 4.8 x 2.1 cm) located in the mid outer quadrant of the breast [AJCC pT3]. Lobular. carcinoma in situ is identified. Angiolymphatic invasion is present. The non-neoplastic breast parenchyma is unremarkable. Biopsy site changes are present. The tumor does not involve the nipple, overlying skin, or underlying chest wall. All surgical. resection margins, including the deep margin, are negative for tumor (minimum tumor free margin, 0.3 cm, deep margin). Lymph node, right axillary sentinel, excision: A single (1 of 1) right axillary sentinel lymph node is positive for metastatic. carcinoma. Extranodal extension is not present. Blue dye is identified. Lymph nodes, right axillary, dissection: Multiple (14 of 16) axillary lymph nodes are positive for metastatic carcinoma [AJCC. pN3]. Breast, left, simple mastectomy: Proliferative fibrocystic disease without atypia characterized by ductal hyperplasia, usual type,. sclerosing adenosis, parenchymal fibrosis, and cyst formation. Her-2/NEU has been ordered on paraffin-embedded tissue.",BRCA,3,"The 'pT3' classification indicates a primary tumor size of greater than 5 cm, which falls under the T3 category. The report states that one out of one sentinel lymph node is positive for metastatic carcinoma and 14 out of 16 axillary lymph nodes are positive for metastatic carcinoma, without extranodal extension. This corresponds to the N3 category. Since there is no mention of distant metastasis, we can assume M0. Combining T3, N3, and M0 according to the AJCC staging system for breast cancer, the patient's pathologic stage is Stage III.",Stage III,8.0
1268,TCGA-E2-A576.967CCAA8-5BC6-4744-BD9A-3DFEF9EF4F27,0,"SPECIMEN(S): A. EXCISIONAL BIOPSY LEFT BREAST NEEDLE LOCALIZED. B. SLN #1 LEFT AXILLA. C. SLN #2 LEFT AXILLA. CLINICAL HISTORY: Left breast infiltrating lobular carcinoma with Nottingham grade 2; LCIS with. comedonecrosis at the 2:00 position. Ultrasound revealed 12 mm x 15 mm 9 mm lesion. INTRAOPERATIVE CONSULTATION DIAGNOSIS: A-excisional biopsy left breast needle localized: Lesion identified 0.5 cm (gross) from. superior margin. Diagnosis called by Dr. to Dr. DIAGNOSIS: A. BREAST, LEFT, NEEDLE LOCALIZATION WIDE LOCAL EXCISION: - MULTIFOCAL INVASIVE LOBULAR CARCINOMA, NOTTINGHAM. GRADE 2. - 1.7 CM AND 0.1 CM IN SIZE. - DUCTAL CARCINOMA IN SITU (DCIS), MICROPAPILLARY TYPE,. NUCLEAR GRADE 2, WITH MICROCALCIFICATIONS, MINOR. COMPONENT. - LOBULAR CARCINOMA IN SITU (LCIS), PLEOMORPHIC AND CLASSIC. TYPES. - MARGINS, NEGATIVE FOR INVASIVE CARCINOMA, DCIS, AND. PLEOMORPHIC LCIS. - VESSELS WITH MICROCALCIFICATIONS. NOTE: The size of the tumor (1.7 cm) was determined by measuring the tumor in slides. A4 and A5. A 0.1 cm non-contiguous focus of invasive carcinoma was also seen in slide. A12. B. SENTINEL LYMPH NODE 1, LEFT AXILLA, BIOPSY: FOUR LYMPH NODES, NEGATIVE FOR CARCINOMA (0/4). C. SENTINEL LYMPH NODE 2, LEFT AXILLA, BIOPSY: - ONE LYMPH NODE, NEGATIVE FOR CARCINOMA (0/1). SYNOPTIC REPORT - BREAST. Specimen Type: Excision. Needle Localization: Laterality: Left. Invasive Tumor: Present. Multifocality: Yes. WHO CLASSIFICATION. Invasive lobular carcinoma 8520/3. Tumor size: 1.7cm. Tumor Site: 2:00. Margins: Negative. Distance from closest margin: 0.8cm. superior. Tubular Score: 3. Nuclear Grade: 3. Mitotic Score: 1. Modified Scarff Bloom Richardson Grade: 2. Necrosis: Absent. Vascular/Lymphatic Invasion: None identified. Lobular neoplasia: LCIS. Lymph nodes: Sentinel lymph node. Lymph node status: Negative 0/5. DCIS present. Margins uninvolved by DCIS : 0.7 cm from the posterior margin. DCIS Quantity: Estimate 3%. DCIS Type: Micropapillary. DCIS Location: Separate from invasive tumor mass. DCIS Size (pure DCIS only): 0.3cm. Nuclear grade: Intermediate. Necrosis: Absent. Location of CA++: DCIS. Benign epithelium. ER/PR/HER2 Results. ER: Positive. PR: Positive. HER2: Negative by FISH. Performed on Case: Pathological staging (pTN): pT 1c N 0. Pathological staging is based on the AJCC Cancer Staging Manual, 7th Edition. SUMMARY OF IMMUNOHISTOCHEMISTRY/SPECIAL STAINS. Material: Block A3. Population: Tumor Cells. Stain/Marker: Comment: ECADHERIN. Negative. The interpretation of the above immunohistochemistry stain or stains is guided by published results in the medical literature, provided. package information from the manufacturer and by internal review of staining performance and assay validation within the. Immunohistochemistry Laboratory of the. e use of one or more reagents in the above tests is. regulated as an analyte specific reagent (ASR). These tests were developed and their performance characteristic determined by the. Department of Pathology Laboratory at. They have not been cleared or approved by the U.S. Food and. Drug Administration. The FDA has determined that such clearance or approval is not necessary. Special stains and/or immunohistochemical stains were performed with appropriately stained positive and/or negative. controls. GROSS DESCRIPTION: A. EXCISIONAL BIOPSY LEFT BREAST NEEDLE LOCALIZED. Received fresh labeled with the patient's identification and ""excisional biopsy left breast. needle localized"" is a previously inked, oriented (single stitch-anterior, double stitch-. lateral, triple stitch-superior) 54 g, 3.1 x 3 x 2.9 cm needle localized excision with. radiographs. Ink code: Anterior-yellow, posterior-black, medial-green, lateral-right,. superior-blue, inferior-orange. The specimen is serially sectioned from lateral to medial. into 7 slices revealing a 1.5 x 1.4 x 1.2 cm firm tan stellate mass that is closest to the. superior margin at 0.5 cm and a biopsy clip in slice 3. Tissue is procured; representatively. submitted as per the attached diagram (time placed in formalin): A1: perpendicular sections of lateral margin. A2: slice 2, mid section. A3: slice 3, anterior superior with mass. A4: slice 4, anterior superior with mass. A5: slice 4, posterior superior with mass. A6: slice 4, anterior inferior. A7: slice 4, mid inferior. A8: slice 4, posterior inferior. A9: slice 5, mid superior. A10: slice 5, posterior superior. A11: slice 5, mid section. A12: slice 5, mid inferior. A13: slice 6, anterior superior. A14: slice 6, anterior inferior. A15: perpendicular sections of medial margin. B. SLN #1 LEFT AXILLA. Received fresh labeled with patient's identification and ""SLN #1 left axilla"" is a piece of. yellow-tan soft tissue, 6.2 x 3.1 x 1.2 cm containing 4 lymph nodes ranging from 0.4 x. 0.3 x 0.2 cm to 1 x 0.7 x 0.6 cm. The lymph nodes are sectioned and submitted entirely. and separately in B1-B4. C. SLN #2 LEFT AXILLA. Received fresh labeled with the patient's identification and ""SLN #2 left axilla"" is a 1.5. x. 0.9 x 0.7 cm lymph node. It is sectioned and submitted entirely in C1.",BRCA,0,"The report states that four lymph nodes from the first sentinel lymph node (SLN #1) and one lymph node from the second sentinel lymph node (SLN #2) were all negative for carcinoma (0/4 and 0/1, respectively). This indicates that there is no regional lymph node metastasis, which corresponds to N0 stage.",N0,9.0
854,TCGA-AR-A1AK.F4DBFC71-9CD0-41C3-9F20-77FA0605D4A8,0,"Final diagnosis. Breast. right, simple mastectomy: Invasive mammary carcinoma, Nottingham grade II (of III),. with predominantly lobular features is identified forming multiple (4) masses (ranging in size. from 0.7 cm to 1.6 cm in greatest dimension) (AJCC pTc) situated in multiple quadrants (lower. inner quadrant, inferior central, upper outer quadrant, and 12 o' clock position). There is a. minimal (5%) component of ductal carcinoma in situ, intermediate nuclear grade. No. angiolymphatic invasion identified. Tumor closely approaches (0.1 cm) the original inferior. margin. Skin, nipple, and final surgical margins (after re-excision) are negative for tumor. Lymph nodes, right axillary sentinel, excision: Multiple (5) right axillary sentinel lymph nodes. are negative for tumor (AJCCpN0(sn)(i-)). Blue dye is identified in all five right axillary sentinel. lymph nodes. Immunohistochemical cytokeratin stain was performed on the paraffin embedded. sentinel lymph node tissue and confirms the H&E impression. HER2/neu protein overexpression is negative, score of 1+, according to the interpretation. guidelines in the FDA-approved HercepTest.",BRCA,0,"The N stage is determined by the presence and extent of regional lymph node metastasis, with N0 indicating no regional lymph node metastasis. In this report, it is stated that 'Multiple (5) right axillary sentinel lymph nodes are negative for tumor (AJCCpN0(sn)(i-))'. This indicates that there is no regional lymph node metastasis, so the N stage is N0. The T stage is determined by the size of the primary tumor, and in this report, it is stated that 'Invasive mammary carcinoma, Nottingham grade II (of III),. with predominantly lobular features is identified forming multiple (4) masses (ranging in size. from 0.7 cm to 1.6 cm in greatest dimension)'. However, the AJCC pTc notation indicates that the tumor is in situ, which means it has not invaded through the basement membrane. Therefore, the T stage is Tis. The absence of distant metastasis is assumed, so the M stage is M0. Combining the T, N, and M stages, the pathologic stage is I.",I,10.0
645,TCGA-A8-A08C.6E136F3D-A6E1-4541-AA4B-65BC5872DE06,1,"Diagnosis: , 1. Poorly differentiated invasive ductal carcinoma (tumor diameter: 3.5. cm; minimum distance dorsally 1 cm, other margins remain free). Tumor classification for left breast: NOS, G III, pT2NOLOVORO.",BRCA,0,"The report indicates that the patient has a 3.5 cm primary tumor (pT2) and no regional lymph node metastasis (N0) based on the statement 'pT2NO' in the diagnosis. The 'LOVORO' part of the diagnosis indicates the status of lymphovascular invasion, estrogen receptor, progesterone receptor, HER2/neu, and resection margins, which are not relevant for determining the TNM stage. The M stage is not specified in the report, so it is assumed to be M0 (no distant metastasis).",pT2N0M0,11.0
1140,TCGA-D8-A1XB.B7367E27-2A40-4E8F-8975-D5665E6506D9,1,"page 1 / 1. copy No. Examination: Histopathological examination. Cost of diagnostic procedure. Gender: F. Material: Multiple organ resection - right breast with axillary tissues. Expected time of examination: up to 8 working days. Clinical diagnosis: Cancer in the upper outer quadrant sucking skin. Results of immunohistochemical examination: Estrogen receptors found in over 75% of neoplastic cell nuclei. Progesterone receptors found in over 75% of neoplastic cell. nuclei. HER2 protein stained with HercepTest™M by DAKO. Negative reaction in invasive carcinoma cells ( Score = 1+). Compliance validated b. Macroscopic description: Right breast sized 18 x 12.5 x 3 cm removed along with axillary tissues sized 10 x 6 x 2 cm, a skin flap of 16.5 x 5.3 cm, and a piece. of the muscle sized 1 x 1 x 0.4 cm. Tumour sized 2.1 x 1 x 1.5 cm found in upper outer quadrant, located 1.5 cm from the upper boundary, 0.2 cm from the base and. 0 cm from the skin. Microscopic description: Carcinoma ductale invasivum - NHG1 (2+2+1/10 mitoses/10 HPF - visual area 0.55mm). Foci of carcinoma ductale in situ (DCIS). found within the tumour (cribrate type, with medium nuclear atypia, without necrosis, with calcifications covering 5% of the. tumour). Calcificationes in tumore. Mamilla sine laesionibus. Glandular tissue showing lesions of the type mastopathia fibrosa, microcalcificationes, fibroadenoma. AXILLARY LYMPH NODES: Metastases in lymphonodo (NO 1/X). Infiltratio capsulae lymphonodo et telae perinodalis. Histopathological diagnosis: Carcinoma ductale invasivum et ductale in situ mammae dextrae. Metastases lymphonodo axillae (No I/X). (NHG1,. pT2, pNla). Invasive ductal carcinoma and ductal carcinoma in situ of the right breast. Cancer metastases in axillary. lymph nodes (No I/X). (NHG1, pT2, pNla).",BRCA,1,"The T stage is determined by the size of the primary tumor. In this report, the tumor size is 2.1 x 1 x 1.5 cm, which falls under T2 category (Tis (in situ) ≤ 2 cm, T2 = > 2 cm but ≤ 5 cm). The N stage is determined by the presence and extent of regional lymph node metastasis. In this report, there are metastases in 1 out of X lymph nodes, which falls under N1a category (N1a: Metastases in 1-3 axillary lymph nodes and/or in internal mammary nodes with clinically negative nodes).",pT2 pN1a,12.0
