Unnamed: 0,patient_filename,t,text,type,n,cmem_n_reasoning,cmem_n_ans_str,cmem_n_num_update
456,TCGA-A1-A0SG.89A67051-898A-4E2A-A874-E0165F274E63,1,"Final Pathologic Diagnosis: A. Right axillary sentinel lymph node #1, count = 3500, dissection: Metastatic. adenocarcinoma in one of two lymph nodes (1/2). B. Right axillary sentinel lymph node #2, count = 500, dissection: No tumor in two. lymph nodes (0/2). C. Right breast, partial mastectomy: 1. Invasive micropapillary carcinoma, 2.1 cm, associated with microcalcifications; see. comment. 2. Atypical lobular hyperplasia. 3. Fibroadenoma. 4. Microcalcifications in benign ducts. D. Sentinel lymph node #3, count = 350, dissection: No tumor in two lymph nodes. (0/2). Note: Breast Tumor Synoptic Comment. - Laterality: Right. - Invasive tumor type: Invasive micropapillary carcinoma. - Invasive tumor size: 2.1 cm maximum diameter. The tumor is present in slices 4, 5, 9, and 10; however. the tumor has been banked from slices 6, 7, and 8. Therefore, the tumor extends through seven. consecutive slices, each with a width of approximately 0.3 cm, for a total maximum diameter of 2.1 cm. - Invasive tumor grade (modified Bloom-Richardson): 2. Nuclear grade: 3, 3 points. Mitotic count: < 10 mitotic figures/1 HPF, 1 point. Tubule/papilla formation: Definite tubule formation in <10%, 3 points. Working Draft. Total points and SBR grade - 7 points, grade 2. - Lymphatic-vascular invasion: None identified. - Perineural invasion: None identified. - Resection margins for invasive tumor: - Deep margin: Negative (1 cm). - Medial margin: Negative (0.9 cm). - Lateral margin: Negative (0.6 cm). - Anterior/superio: margin: Negative (0.5 cm). - Anterior/inferior margin: Negative (greater than 1 cm). - Ductal carcínoma in situ (DCIS) type: None identified. Microcalcifications: Present involving both benign ducts and invasive carcinoma. - Lobular carcinoma in situ (LCIS): None identified. - Lymph node status: - Number of positive lymph nodes: 1. - Total number sampled: 6. - Diameter of largest metastasis: 2.1 mm. - Extranodal extension: Absent. - AJCC/UICC stage: pT2N1aMX. - Nontumorous breast tissue: Atypical lobular hyperplasia, fibroadenoma, and sclerosing adenosis. - Additional comments: We reviewed the original frozen section slides and concur with the frozen section. diagnosis rendered. The metastatic tumor in Part A was only present in the additionally submitted. sections of the lymph node (slide A2). Level sections on A2-A4 confirms the diagnosis. Select slides from. part C were shown at the. the faculty in attendance concurred. with the above diagnosis of micropapillary type of invasive carcinoma. Dr. has reviewed A2. and concurs with the diagnosis. An immunohistochemical test for estrogen and progesterone receptors was performed on block C9. The test for estrogen receptors is positive. There is 3+ nuclear staining in >95% of tumor cells. The test for progesterone receptors is positive. There is 3+ nuclear staining in >95% of tumor cells. Result of HER2/neu test: This carcinoma is negative for HER2/neu oncoprotein over-expression. An immunohistochemical assay was performed on block C9 using the CB11 monoclonal antibody to. HER2/neu oncoprotein. The staining intensity of this carcinoma was 1 on a scale of 0-3. Carcinomas with staining intensity scores of 0 or 1 are considered negative for over-expression of HER2/neu oncoprotein. Those with a staining intensity score of 2 are considered indeterminate. We and others have observed that many carcinomas with. staining intensity scores of 2 do not show gene amplification. All carcinomas with staining intensity scores of 2 are therefore. submitted for FISH testing. The results of the FISH test are issued directly from the molecular cytogenetics laboratory. Carcinomas with staining intensity scores of 3 are considered positive for over-expression of HER2/neu oncoprotein. Tumors in this. category show an excellent correlation between the results of immunohistochemical and FISH testing, and almost always show gene. amplification. Slide A2 was shown at the departmental Consensus Conference, and the faculty in attendance concurred. with the above diagnosis. Intraoperative Consult Diagnosis. FS1 (A) Right axillary SLN #1, biopsy: Negative for carcinoma. (Dr. Clinical History. The patient is a. year-old woman with right breast carcinoma. Working Draft. Gross Description. The specimen is received in four parts, each labeled with the patient's name and medical record number. Part A is received fresh and labeled. It consists of one pink-yellow,. soft, fatty tissue that measures 3.1 x 2.5 x 0.8 cm. The specimen is strained and two candidate lymph. nodes are found, the smallest is inked blue and submitted with a representative section of the largest. submitted for frozen diagnosis #1, thereafter submitted in cassette A1. The remnant of the largest lymph. node is transected and entirely submitted in cassettes A2-A3, and the remnant of the yellow fatty tissue is. submitted in cassette A4. Part B, additionally labeled. consists of a single fragment of yellow,. fibrofatty tissue measuring 2 x 1.8 x 0.4 cm. The specimen is entirely submitted in cassette B1. Part C, additionally labeled. consists of a right breast specimen oriented. with a short superior and a long stitch lateral. The specimen measures 3.2 cm from anterior to posterior,. 5 cm from medial to lateral and 6.5 cm from superior to inferior. The resection margins are inked as. follows for microscopic evaluation: anterior superior in blue, anterior inferior in green and posterior in. black. The specimen is serially sectioned from medial to lateral into twelve slices. There is gray-white,. fibrous tissue in the superior half of the specimen in slices 3-11, measuring 2.4 x 2 x 1.5 cm. White. fibrous tissue extends from this area to the anterior inferior aspect in slices 5-8. The gray-white fibrous. tissue appears extend to the inked margin in the posterior superior aspect of slices 3 and 4, and appears. to be 0.5 cm from the anterior superior inked margins in slices 5 and 9. Representative sections are. submitted as follows: Cassette C1: Representative medial margin, slice 1, bread-loafed. Cassette C2: Representative section of slice 3. Cassettes C3-C5: Slice 4. Cassette C6: Representative section of slice 5. Cassette C7: Representative section of slice 6. Cassette C8: Representative section of slice 8. Cassette C9: Representative section of slice 9. Cassettes C10-C11: Representative sections of slice 10. Cassette C12: Representative section of slice 11. Cassette C13: Representative lateral margin, slice 12, bread-loafed. Part D, additionally labeled. consists of a single, yellow, fibrofatty tissue fragment. measuring 2.5 x 1.5 x 0.4 cm. The specimen is entirely submitted in cassette D1. The immunoperoxidase stain(s) reported above were developed and their performance characteristics determined by the. They have not been cleared or approved by the U. S. Food and Drug Administration The FDA has. determined that such clearance or approval is not necessary. These tests are used for clinical purposes. They should not be regarded. as. investigational or for research. This laboratory is certified under the Clinical Laboratory Improvement Amendments of 1988 (""CLIA""). as qualified to perform high-complexity clinical testing. Fee Codes: Other Specimens. pecimen Class: Accessioned: Specimen(s) Received: Right axillary contents. Final Diagnosis. Axilla, right, ""contents,"" excision: 1. Scar tissue, fat necrosis and suture with giant cell reaction. No malignancy is. identified. Working Draft. 2. No metastatic tumor identified in five lymph nodes. (0/5). Specimen Class: Accessioned: Specimen(s) Received: Final Diagnosis. Review of. from : Breast, right, 10 o'clock, core biopsies: Infiltrating ductal carcinoma, SBR Grade 2; see. comment. FND OF REPORT.",BRCA,1,"The patient has a T2 tumor (invasive micropapillary carcinoma in the right breast, 2.1 cm in maximum diameter) and N1 disease (metastasis in one of six sampled lymph nodes). There is no information about M stage, so it is denoted as 'Mx'.",pT2N1aMX,0.0
951,TCGA-B6-A2IU.EE769039-220E-4158-8999-09F17AFB4C46,1,"Patientel. !. CLINICAL HISTORY: Not provided. I. GROSS EXAMINATION: A. ""Right breast and axillary contents"", received fresh. A 1,330 grams, 33.0. x. 16.0 x 6.8 cm. The specimen is breast with attached fibrofatty tissue. The. breast itself measures 27.5 x 16.0 x 6.8, the axillary tail measures 10.5 x. 9.0 x 3.5 cm. The attached ellipse of skin measures 24 x 12.2 cm, with a 4.0. cm areola and a 1.4 cm nipple. The surgical margin of the specimen are inked. and the specimen is sliced serially. There is a 5.0 x 5.0 x 2.8 cm firm, ill. defined mass in the central region of the breast. It is 2.2 cm from the. closest (posterior) margin. BLOCK SUMMARY: A1- cross sections from the nipple. A2- hard mass with closest surgical margin. A3-A6- representative sections of the mass. A7- representative sections from the upper outer quadrant. A8- representative sections from the lower outer quadrant. A9- representative sections from the lower inner quadrant. A10- representative sections from the upper inner quadrant. A11- seven lymph node candidates from the proximal axillary fat. A12- seven lymph node candidates from the middle axillary fat. A13- six lymph node candidates from the middle axillary fat. A14- four lymph node candidates from the distal axillary fat. A15- one lymph node candidate from the distal axillary fat, bisected. A16- four lymph node candidates from the distal axillary fat. A17- one lymph node candidate from the distal axillary fat. A18- five lymph node candidates from the distal axillary fat. DIAGNOSIS: A. ""RIGHT BREAST AND AXILLARY CONTENTS"" (MODIFIED RADICAL MASTECTOMY) : INFILTRATING CARCINOMA PRESENT, HISTOLOGIC TYPE LOBULAR. N.S.A.B.P. NUCLEAR GRADE 2 OF 3. N.S.A.B.P. HISTOLOGIC GRADE: NOT APPLICABLE. GROSS TUMOR SIZE: 5.0 x 5.0 x 2.8 CM. SIZE OF INVASIVE COMPONENT 5.0 x 5.0 x 2.8 CM. LOCATION OF THE TUMOR, CENTRAL. LYMPHATIC/VASCULAR INVASION ABSENT. MULTIFOCAL TUMOR PRESENT, EXTENSIVE, SEE COMMENT. IN SITU CARCINOMA ABSENT. NIPPLE STATUS, FREE OF TUMOR. SKIN STATUS, FREE OF TUMOR. MUSCLE STATUS, NOT SAMPLED. STATUS OF NON-NEOPLASTIC BREAST TISSUE: BENIGN FIBROCYSTIC CHANGES. SURGICAL MARGIN STATUS: NEGATIVE. LYMPH NODE STATUS: TWENTY-EIGHT AXILLARY LYMPH NODES, NO EVIDENCE OF. MALIGNANCY (0/28). ESTROGEN/PROGESTERONE RECEPTOR AND CELL CYCLE ANALYSIS PENDING. METHODOLOGY: IMMUNOHISTOCHEMISTRY, PARAFFIN BLOCK A3. RESULTS WILL BE ISSUED IN AN ADDENDUM. COMMENT: There is very extensive mmultifocal/multicentric disease, with random. sections distant from the main tumor mass showing foci of infiltrating lobular. carcinoma involving all four quadrants of the breast. I certify that I personally conducted the diagnostic evaluation of the above. specimen (s) and have rendered the above diagnosis (es) . ADDENDUM 1: Tissue was sent to the. for assay of the estrogen. and progesterone receptors. The estrogen receptor activity was judged to be. positive with an estimated FMOL value of 30. The progesterone receptor. activity was judged as positive with an estimated FMOL of value of 101. Please refer to. for a complete report. I certify that I personally conducted the diagnostic evaluation of the above. specimen (s) and have rendered the above diagnosis (es). https://.",BRCA,0,"Based on the report, the T stage is T2 as the largest dimension of the tumor is greater than 2 cm but not more than 5 cm (5.0 x 5.0 x 2.8 cm). The N stage is N0 as there is no evidence of malignancy in the 28 axillary lymph nodes examined. The M stage is not mentioned in the report, but there is no indication of distant metastasis, so we can assume it to be M0. Therefore, the pathologic stage is IIA (T2N0M0) according to the AJCC staging system for breast cancer.",IIA,1.0
832,TCGA-AQ-A54N.9BF0E34A-F78C-4BFD-AC4C-926FA1D60342,1,"SURGICAL PATHOLOGY REVISED REPORT. Diagnosis: A: Breast, left, partial mastectomy. Tumor type: Invasive ductal carcinoma. Nottingham combined histologic grade: 3. Tubule formation score: 3. Nuclear pleomorphism score: : 3. Mitotic count score: 3. Focality of tumor: Unifocal. Tumor size (greatest dimension) : 4.9 cm. Lymphovascular invasion: Not identified. In Situ Component : Not identified. Nipple involvement: Not applicable. Skin involvement: Not identified. Margin status: Invasive component : Negative; 0.3 cm to anterior margin (see. comment) , all. other margins widely free of tumor. In Situ component : Not applicable. Axillary lymph nodes: Total number with metastasis: 0. Total number examined: 1. Microcalcifications: Not identified. Other findings: Duct ectasia. AJCC PATHOLOGIC TNM STAGE: pT2 pNO. Note: This pathologic stage assessment is based on information. available at the. time of this report, and is subject to change pending clinical. review and. additional information. B: Lymph node, sentinel left breast, removal. - No carcinoma identified in one lymph node (0/1). - Cytokeratin immunostain (AE1/AE3) negative. C: Breast, left lateral margin, stitch new margin, removal. - No atypia or carcinoma identified. D: Breast, left medial margin, stitch new margin, removal. - No atypia or carcinoma identified. Comment. The anterior margin represented in block A3 has ink within a. somewhat fragmented. tissue section that is 0.3 cm from tumor. The true margin may be. closer to the. gross measurement of 0.8 cm. Clinical correlation is advised. Clinical History: with left breast cancer. Gross Description: Received are four formalin-filled containers. Container A is additionally labeled ""left breast cancer, short. titch/superior,. long stitch/lateral.'. Specimen fixation: formalin. Time in fixative: 8.5 hours. Type of mastectomy: left partial mastectomy. Weight of specimen: 229 grams. Size of specimen: 13.5 cm superior to inferior, 11 cm medial to. lateral, 6. cm anterior to posterior. Orientation of specimen: Medial=green, lateral=red,. anterior=blue,. posterior=black. Skin ellipse dimensions: 12.1 x 5.2 cm ellipse of dark. brown/gray skin with no. lesions identified. Nipple/areola: not present. Axillary tail: not present. Biopsy site: not present. Discrete Mass (es) : present. Number of discrete masses: one. Size of mass (es)/biopsy site: 4.9 X 3.6 X 3.8 cm. Location of mass(es): : central portion of resected specimen. Distance of mass/biopsy site from surgical margin: The mass is. located 1.3 cm. from the black inked deep margin, 2.9 cm from the. medial margin, 2.7 cm from the lateral margin, 1 cm. subjacent. to. the skin. and within 0.8 cm of the blue inked anterior. margin adjacent to the skin. Gross involvement of skin or fascia/muscle by tumor: absent. Description of remaining breast: composed primarily of yellow. lobulated fat. which is blue dye stained along the superior edge. There are delicate bands of white/pink fibroconnective tissue. coursing. throughout the remainder of the specimen. Other remarkable features: none. Tissue submitted for special investigations: Tumor is given to. Tissue. Block Summary. (Inking: anterior=blue, posterior=black medial=green,. lateral=red). A1 - superior tip. A2 - inferior tip. A3 - tumor and closest approach to blue inked anterior margin. A4 - tumor and closest approach to black inked posterior margin. A5 - closest approach to green inked medial margin. A6 - closest approach to red inked lateral margin. A7 - closest approach to skin. A8,A9 - central tumor. A10-A13 representative sections from breast tissue. Container B is additionally labeled ""sentinel node, left. breast. It holds a 3.4. X 2.5 X 1.2 cm fragment of fat containing a 2.4 X 1.6 X 1.0 cm. gray/tan lymph. node candidate. The fat is removed and the lymph node candidate. is sectioned to. reveal a homogeneous gray/tan cut surface. The specimen is. entirely submitted in. blocks B1-B3. A small amount of fat remains in formalin. Container C is additionally labeled ""left lateral margin, stitch. new margin. "" It. holds a 13.2 x 6.5 cm discoid fragment of yellow/red fibrofatty. tissue ranging. in thickness from 0.6 to 1.7 cm. One surface has a stitch. designating ""new. margin. "" This surface is marked with blue ink and the opposite. surface is marked. with red ink for identification purposes. Sectioning reveals. yellow lobulated. fat with no lesions grossly identified. Representative sections. are submitted in. blocks C1-C5. The majority of the specimen is retained in. formalin. Container D is additionally labeled ""left medial margin, stitch. new margin. It holds a 10.7 X 5.6 cm discoid fragment of. yellow/tan fibrofatty tissue with a. uniform thickness of 1.8 cm. There is a stitch present on one. surface. designating the ""new margin.' This surface is marked with blue. ink and the. opposite surface is marked with red ink for identification. purposes. The. specimen is serially sectioned to reveal yellow lobulated fat. with no discrete. mass or nodule appreciated. Representative sections are. submitted in blocks. D1-D5.",BRCA,0,"The report indicates that the size of the primary tumor is 4.9 cm, which falls under T2. There is no evidence of regional lymph node metastasis as the total number of lymph nodes with metastasis is 0 and only one node was examined. Therefore, the N stage is N0.",pT2 pN0,2.0
822,TCGA-AO-A1KQ.EB5199BA-6164-4CFB-AFAA-B41544B83103,3,"Clinical Diagnosis & History: y/o male with left breast cancer (invasive ductal carcinoma (IDC)). Specimens Submitted: 1: SP: Sentinel node #1, level 1, left axilla (fs). 2: SP: Left breast with levels one and two axillary contents. DIAGNOSIS: 1). LYMPH NODE, LEFT AXILLA, SENTINEL LYMPH NODE #1; LEVEL 1; BIOPSY: METASTATIC CARCINOMA IN ONE LYMPH NODE (1/1). - THE METASTATIC DEPOSIT IS SEEN ONLY ON THE ACTUAL FROZEN SECTION AND. MEASURES AT LEAST. 2 MM. NO EXTRANODAL EXTENSION IDENTIFIED. - THE LYMPH NODE EXHIBITS INCIDENTAL BENIGN CAPSULAR NEVUS CELL. AGGREGATES. 2). BREAST. LEET: MASTECTOMY: - INVASIVE DUCTAL CARCINOMA. NOS TYPE. HISTOLOGIC GRADE III/III (SLIGHT. OR NO TUBULE FORMATION), NUCLEAR GRADE III/III (MARKED VARIATION IN SIZE AND. SHAPE) MEASURING 2.2 CM IN LARGEST DIMENSION MICROSCOPICALLY. - DUCTAL CARCINOMA IN-SITU (DCIS) IS ALSO IDENTIFIED, SOLID, CRIBRIFORM TYPE. WITH HIGH NUCLEAR GRADE AND MODERATE NECROSIS. - THE DCIS CONSTITUTES <= 25% OF THE TOTAL TUMOR MASS, AND IS PRESENT. ADMIXED WITH AND AWAY FROM THE INVASIVE COMPONENT. - THE INVASIVE CARCINOMA IS LOCATED IN THE LOWER INNER QUADRANT AND CENTRAL. AREA (RETROAREOLAR). - THE NIPPLE IS INVOLVED BY INVASIVE CARCINOMA. - A FOCUS OF PERINEURAL INVASION BY CARCINOMA IS SEEN IN THE DERMIS OF. THE NIPPLE REGION. THERE IS ALSO FOCAL LYMPHATIC INVASION IN THE NIPPLE. REGION. - CALCIFICATIONS ARE PRESENT IN THE IN SITU CARCINOMA. - NO INVOLVEMENT OF THE SURGICAL MARGINS BY EITHER INVASIVE OR IN SITU. CARCINOMA IS IDENTIFIED. THE ION-NEOPLASTIC BREAST TISSUE IS UNRENORKAELE. - THE LYMPH NODE STATUS IS AS FOLLOWS (EXPRESSED AS THE NUMBER OF. POSITIVE LYMPH NODES IN RELATION TO THE TOTAL NUMBER OF LYMPH NODES. EXAMINED) : METASTATIC CARCINONA IN ONE OF EIGHT LYMPH NODES (1/8). THIS IS A MACROMETASTASIS (1.8 CM). - THERE IS NO EXTRANODAL EXTENSION OF CARCINOMA. Nc. - RESULTS OF SPECIAL STAINS (ER, PR, HER2-NEU) WILL BE REPORTED AS AN. ADDENDUM. I ATTEST THAT THE ABOVE DIAGNOSIS IS BASED UPON MY PERSONAL EXAMINATION OF. THE SLIDES (AND/OR OTHER MATERIAL), AND THAT I HAVE REVIEWED AND APPROVED. THIS REPORT. Special Studies: Special Stain. Comment. ER-C. PR-C. HER2-0. NEG CONT. NEG-HER2. IMM RECUT. Gross Description: 1) The specimen is received fresh for frozen section consultation labeled,. Sentinel node #1, level 1, left axilla"", and consists of one lymph node. measuring 1.5 x 1.0 x 0.8 cm. The lymph node is bisected and submitted for. frozen section diagnosis. Summary sections: FSC - frozen section control. 2) The specimen is received fresh labeled, ""Left breast with levels one and. two axillary contents, stitch marks axillary tail"" and consists of a breast. measuring 19 x 18 x 3.5 cm with overlying skin ellipse measuring 19 x 11 cm,. attached axillary contents measuring 11 x 10 x 3 cm. The axillary tail is. marked with a black suture. Situated centrally on the skin surface is. a. flattened nipple measuring 0.8 x 0.8 em and areola measuring 2.5 x 2.5 cm. There are no scars or lesions noted on the skin. A suture demarcates the. axillary aspect. The posterior surface of the breast is inked black and the. specimen is serially sectioned to reveal a well circumscribed stony hard. white-tan tumor measuring 2.0 x 2.0 x 1.7 cm, and located 1.8 cm from the. deep margin. The tumor is located subjacent to the nipple The remainder. of. the breast tissue is yellow tan fatty and lobulated. The specimen is. submitted for lymph node dissection. Representative sections are submitted. A sample of the tumor is given to. Summary of sections: N nipple. NB - nipple base. DM - deep margin. T - tumor. UIQ - upper inner quadrant. LIQ - lower inner quadrant. UOQ - upper outer quadrant. LOQ - lower outer quadrant. LN-lymph nodes. Summary of Sections: Part 1: SP: Sentinel node #1, level 1, left axilla (fs). Block. Sect. Site. PCs. 1. FSC. 1. Part 2: SP: Left breast with levels one and two axillary contents. Block. Sect. Site. PCs. 1. dm. 1. 1. lig. 1. 5. LN. 8. 1. log. 1. 1. n. 1. 1. nb. 1. 6. 6. 1. uiq. 1. uog. Procedures/Addenda: Addendum. Date Complete: Addendum Diagnosis. ADDEN. SITK: #2, LEFT BREAST. ER: >95% OF NUCLEAR STAINING WITH STRONG INTENSITY. - PR: >80% OF NUCLEAR STAINING WITH STRONG TO NODERATE INTENSITY. - HER-2/NEU. (Hexcep Test) : NEGATIVE (STAINING INTENSITY OF FOCAL 1+). - CONTROLS ARZ SATISFACTORY. Intracperative Consultation: Note: The diagnoses given in this section pertain only to the tissue sample. examined at the time of the intraoperative consultation. 1). FROZEN SECTION DIAGNOSIS: METASTATIC CARCINOMA. PERMANENT DIAGNOSIS: SAME.",BRCA,1,"The N stage is determined by the presence and extent of regional lymph node metastasis. In this report, metastatic carcinoma is found in one of eight lymph nodes (1/8), which indicates N1. There is no extranodal extension of carcinoma.",N1,3.0
1405,TCGA-JL-A3YW.476488A9-3708-4B11-854A-C91B583C7804,1,"1. LAS NO : CLINICAL INFORMATONICOMMENTS: FEMALE YEARS. Loc: METRICS CANCER PR. PATIENT CODF. CONSULTANT: Histopathology Blopay Smatt. Specimen: Two blocks representing left breast tissue are received. Clinical Note: Carcinoma left breast. Microscopic Features: One of the block reveals breast tissue infiltrated by ácellular neoplastic lesion composed. of. intermediate size tumor cells exhibiting moderate nuclear pieomorphism with eosinophilic. cytoplasm. Mitotic figures are also identified. The surrounding stroma exhibits moderate. chronic inflammation, Focal necrosis (< than 5%) is noted. The other block reveals benign breast tissue. Conclusion: Two blocks representing left breast tissue received for 2nd opinion :-. Infiltrating Lobular Carcinoma grade Il (Tubule formation 2/3, Nuclear pleomorphism 2/3,. Mitoses 2/3, Total = (6/9), according to Modified Bloom and Richardson's grading system. Tumour nuclei constitute approximately 70% of the total nuclei. Dr.",BRCA,1,The report mentions an 'infiltrating lobular carcinoma grade II' which indicates the T stage is T2 based on the size of the primary tumor. The N stage is N0 as there is no mention of regional lymph node metastasis. The M stage is M0 by default as there is no mention of distant metastasis.,T2 N0 M0,4.0
