Unnamed: 0,patient_filename,t,text,type,n,cmem_n_reasoning,cmem_n_ans_str,cmem_n_num_update
1419,TCGA-LD-A7W6.859561F6-3113-45C8-8FBE-718BF860B582,1,"DATE OBTAINED: DATE RECEIVED: SUBMITTING MD: DIAGNOSIS. 1. LEFT BREAST, PROPHYLACTIC SIMPLE MASTECTOMY: FOCAL ATYPICAL DUCTAL HYPERPLASIA. (UPPER INNER QUADRANT, 1 MM, SLIDE 1J), COLUMNAR CELL HYPERPLASIA/CHANGES, COMPLEX. SCLEROSING LESION, USUAL DUCTAL HYPERPLASIA, SMALL PAPILLOMATOSIS, SCLEROSING. ADENOSIS (WITH ASSOCIATED MICROCALCIFICATIONS) AND APROCRINE METAPLASIA; NEGATIVE FOR. MALIGNANCY; NEGATIVE SKIN AND NIPPLE. 2. RIGHT BREAST, SIMPLE MASTECTOMY: INVASIVE LOBULAR CARCINOMA. SIZE (INVASIVE): 30 mm. LATERALITY: Right. TUMOR FOCALITY: Unifocal. LESIONAL SITE: Upper inner quadrant extending to the retroareolar area. HISTOLOGIC TYPE: Invasive lobular carcinoma, mixed classical (70%) and pleomorphic/solld (30%) types. NUCLEAR GRADE: I-II of III (classical type); III (pleomorphic type). HISTOLOGIC GRADE: N/A. (invasive lobular carcinoma). IN-SITU COMPONENT: LCIS. (classical, NG I-II and pleomorphic, NG II-III types). LYMPH NODE SAMPLING: Positive (2/18, largest 23mm; no extranodal involvement) see specimen #3. AJCC CATEGORIES: Stage IIB. (assuming ""cM0"" status). pTNM: pT2. pN1a. CTNM: cT2. cN1. cMO. INTEGRITY/ORIENTATION: Intact specimen with designated margins. MARGINS (invasive lobular): Negative (> 1 cm). LYMPHOVASCULARI INVASION: Focal suspicious for LVI. MICROCALCIFICATIONS: Present, associated with benign acini. NIPPLE/SKIN: (if applicable). Negative for tumor. SKELETAL MUSCLE: Not present. OTHER: Prior biopsy site changes; focal usual ductal hyperplasia, columnar cell changes,. microcysts and apocrine metaplasia. 3. RIGHT AXILLARY CONTENTS, DISSECTION: TWO OUT OF EIGHTEEN (2/18) LYMPH NODES POSITIVE. FOR METASTATIC BREAST CARCINOMA, LARGEST TUMOR 2.3 CM, WITH NO EXTRANODAL. INVOLVEMENT. COMMENT. 88307X3. Clinical Diagnosis and History: Year old female with right central ILC and + LN, left prophylactic. cT2,cN1,cM0, clinical stage IIB. Tissue(s) Submitted: 1: LEFT BREAST MASTECTOMY SUTURE MARKS SHORT SUPERIOR AND LONG LATERAL. 2: RIGHT BREAST MASTECTOMY SUTURE MARKS SHORT SUPERIOR LONG LATERAL. 3: RIGHT AXILLARY CONTENTS. Gross Description: Specimen #1 is received fresh labeled left breast mastectomy suture marks short superior and long lateral and consists. of. a. 719. gram, 19 x 17 x 4 cm left total mastectomy specimen with two attached sutures, the short designating superior and the long. designating lateral. There is a 13 x 4.5 cm elliptical portion of white skin on the anterior aspect displaying a 1 x 1 x 0.3 cm everted. nipple. No skin lesions are appreciated. The posterior margin is intact. The specimen is inked as follows: Superior-anterior-. blue. Inferior-anterior-. green. Posterior-. black. The specimen is serially sectioned to reveal two indurated foci within the fibrous tissue, one located retroareolar located. approximately 3 cm deep to the nipple. The retroareolar nodule measures approximately 0.6 x 0.6 x 0.4 cm and is 2 cm from the. anterior margin and 6.5 cm from the deep margin. Approximately 3 cm lateral to the aforementioned nodule is an additional 0.5 x. 0.4 x 0.4 cm ill-defined tan rubbery to indurated nodule located at the junction of the lower outer and upper outer quadrant, 3 cm. from the deep margin and 4.5 cm from the nearest anterior inferior margin. The remaining cut surface consists of approximately. 75% yellow lobulated adipose tissue and 25% scattered white rubbery micronodular fibrous tissue. Representative sections are. submitted as follows: 1A-1B: retroareolar indurated nodule (no margins). 1C: closest anterior and posterior margins to retroareolar nodule. 1D: skin overlying retroareolar nodule. 1E: nipple. 1F-1G: lateral nodule (no margins). 1H: posterior and nearest anterior margin to lateral nodule. 11: upper outer quadrant. 1J: upper inner quadrant. 1K: lower outer quadrant. 1L: lower outer quadrant. Please note all representative quadrant sections contain no margins. Time in formalin: submitted same day. Specimen #2 is received fresh labeled right breast mastectomy suture marks short superior long lateral and consists of an 833. gram, 23 x 18 x 4 cm right total mastectomy specimen with two attached sutures, short designating superior and the long. designating lateral. There is an 11.5 x 4.2 cm white elliptical portion of skin on the anterior aspect, which displays a 1 x 1 x 0.5. cm. everted nipple. There is a 0.5 x 0.3 X 0.2 cm raised tan-white nodule located on the skin at 4 o'clock, 0.8 cm from the 4 o'clock. margin. The posterior margin is intact. The specimen is inked as follows: Superior-anterior-. blue. Inferior-anterior-. green. Posterior-. black. The specimen is serially sectioned to reveal a 3 x 2.8 x 2.0 cm ill-defined markedly indurated tan-white irregular mass located. predominantly in the upper inner quadrant and extending retroareolar. The mass is located 4 cm from the distal margin and 2.2 cm. from the overlying skin. The specimen is radiographed and two clips are identified located in contiguous slices. Palpably the two. clips are present within the same mass. The mass is located within 1.1 cm of the nearest anterior margin. The remaining breast. parenchyma consists of approximately 75% yellow lobulated adipose tissue and 25% scattered white rubbery nodular fibrous. tissue. No additional masses are identified. Representative sections are submitted as follows: 2A-2D: representative sections of mass, one section per contiguous slices to include both areas surrounding clips. 2E: representative deep margin and mass. 2F-2G: mass to nearest anterior margin. 2H: nipple and skin nodule to closest margin (green 4 o'clock margin). 21: upper outer quadrant. 2J: lower outer quadrant. 2K: lower inner quadrant. 2L: upper inner quadrant. Time in formalin: submitted same day. Specimen #3 is received in formalin labeled right axillary content and consists of a 10 x 7 x 3 cm aggregate of fat in which multiple. lymph nodes are identified ranging from 0.1 cm to 2.3 cm in greatest dimension. Some of the larger lymph nodes are sectioned. to. reveal white and focally firm cut surfaces possibly consistent with tumor. The lymph nodes are submitted in its entirety with the. exception of the largest grossly polypoid lymph node as follows: 3A: five lymph nodes. 3B: six lymph nodes. 3C-3G: each cassette contains one lymph node bisected. 3H-3J: one lymph node trisected. 3K: representative section of largest grossly positive lymph node. 3L: one lymph node bisected.",BRCA,1,"Based on the report, there are 2 out of 18 lymph nodes positive for metastatic breast carcinoma in the right axillary contents, with the largest tumor being 2.3 cm and no extranodal involvement. This matches the criteria for N1 stage in the rules provided.",N1,17.0
731,TCGA-AC-A6IV.5B978086-7443-4721-854B-877CE0FC10C0,1,"Sex: Female. Ref Physman. ADDENDUM REPORT. BREAST PROGNOSTIC PANEL: Block(A4). TEST. REFERENCE RANGES. Estrogen Receptor: POSITIVE (93%). 1% is Positive. < 1% is Negative. Staining Intensity: Strong. Progesterone Receptor: POSITIVE (60%). 1% is Positive. < 1% is Negative. Staining Intensity: Strong. Ki-67 (MIB1) Proliferation Marker. HIGH (32%). > 20% is High. 10-20% is Borderline. <10% is Low. Her2 by IHC: EQUIVOCAL (2+ staining). 0-1+ Negative. 2+ Equivocal. 3+ Positive. Weak, circumferential membrane staining in > 10% of cancer cells or <30% with strong complete membrane. staining. A reflex to HER-2/neu by FISH (fluorescent in situ hybridization) will be performed and an additional report will follow. These results were interpreted at. Slides from this sample. were evaluated and deemed adequate for ER/PR/Ki-67/. asay conditions were met, including cold ischemia time and fixation. parameters. All controls show appropriate reactivity. [Specific testing information and references have been added to the microscopic description). The original diagnosis remains unchanged. DIAGNOSIS: A. Right breast mastectomy: Invasive mammary carcinoma. Favor pleomorphic lobular carcinoma. Size: 2.2 cm. Architectural score: 3 of 3. Nuclear score: 2 of 3. Mitotic score: 2 of 3. Total score: 7 of 9. Grade 2. Prognostic panel will follow as an addendum. No evidence of in situ carcinoma. No evidence of angiolymphatic invasion. All surgical margins of excision are free of carcinoma. Closest margin is deep and is 1.5 cm. B. Right axiliary sentinel lymph node: One lymph node, Metastatic carcinoma. Size of involvement within the node: 0.3 cm. No evidence of extracapsular extension. Confirmed by staining for pancytokeratin. TMN: T2pN1. CLINICAL HISTORY: Preoperative Diagnosis: Right modified radical mastectomy with sentinel node mapping with frozen section. Invasive mammary carcinoma. ER positive. PR positive. Her-2 negative. Postoperative Diagnosis: Symptoms/Radiologic Findings: SPECIMENS: A. Right breast. B. Right axilla sentinel node. GROSS DESCRIPTION: A. The first container A is received labeled with the patient's name. ight breast.' The specimen consists of portion of fibroadipose breast. tissue. and. overlying. skin. measuring 20.0 x 16.5 x 6.0 cm and weighs 643 grams. The skin surface measures 20.0 x 9.2 cm, is light tan, wrinkled. There. are. lesions. seen. grossly. The nipple is eccentrically placed and appears grossly unremarkable. There is no orientation given to the specimen. The. margins have been inked yellow with the exception of the deep margin, which has been inked black. Sectioning reveais a firm gray-tan ill-defined mass. that measures 2.2 x 2.0 x 1.8 cm that is 1.5 cm from the deep margin and is 2.7 from the closest lateral margin. The surrounding breast tissue reveals. yellow-tan fatty fibroadipose tissue. There are no other lesions identified. At the periphery of the breast, there are no lymph nodes identified. Received. with the specimen are three cassettes, one yellow, one green and one blue labeled. Representative sections are submitted in cassettes. labeled. follows: nipple block 1; deep margin overlying the mass in block 2; sections from the mass in blocks 3 through 7; random. sections taken from all four quadrants in blocks 8 through 11. B. The second container B is received in formalin labeled. right axilla sentinel node.' The specimen consists of a portion of fibroadipose. tissue that measures 3.5 x 2.0 x 1.5 cm. Sectioning reveais a single rymph node that measures 1.8 x 0.7 x 0.9 cm. The lymph node is sectioned and is. entirely submitted in two cassettes labeled. MICROSCOPIC EXAMINATION: THERAPEUTIC MARKER ASSAY CONDITIONS. Breast Cancer Analysis using Immuno-histochemistry,. and Pathologist. review. is an automated digital slide creation, management, viewing. and computer-assisted analysis system which aids the pathologist in the detection, classification,. ER/PgR,. and counting of cells of interest thereby standardizing slide scoring through quantitative. HER2/neu Scoring. assessment of marker intensity, size and shape. This laboratory uses a modified version of a FDA. approved test. An antibody other than the FDA approved antibody for the. system. algorithm is used. The performance characteristics of these assays have been determined by. Performance characteristics refer to the analytical performance of the. test. Cold Ischemic. Specimen should be placed in neutral buffered formalin within 1 hour of removal from the patient. Time, Fixative,. and fixed for a minimum of 6 but not in excess of 48 hours. Specimen are processed by routine. Processing. tissue processing methods. Staining Method Used. Staining platform, antibodies and associated reagent below are all manufactured by. and. are FDA approved. ER - Anti-Estrogen receptor (clone SP1) primary antibody is a rabbit monocional antibody (IgG) that. is used for the qualitative detection of estrogen receptor antigens. PgR - Anti-Progesterone Receptor (clone 1E2) primary antibody is a rabbit monocional antibody. Primary. (IgG) that is used for the quantitative detection of the A, B and C isoforms of human progesterone. Antibodies. receptor antigens. Ki-67 - Anti-Ki-67 primary antibody is directed against the C-terminal portion of the Ki-67 antigen,. which is expressed in the nuclei of proliferating cells (normal and neoplastic). The antibody identifies. proliferating activity in sections of formalin-fixed, paraffin-embedded tissue on an automated slide. stainer platform. (IgG) HER-2/neu that is used - PATHWAY for semi-quantitative Anti-HER-2/neu detection (485) of primary antibody is a rabbit monocional antibody. automated ER, PR, HER-2/neu are platform. prepared from sections of formalin-fixed, HER2 antigens. paraffin-embedded tissue on an. slide stainer. Controls. Antigen. A tris based buffer internal elements from normal breast tissue included low protein with expression,. protein All Controls expression, show appropriate reactivity (high protein expression, negative. Retrieval Type. Detection. the covalent with a slightly basic pH, tissue. which, at elevated temperatures is sample. capable of hydrolyzing. bonds formed by formalin in. System Type. Indirect biotin streptavidin detection system.",BRCA,1,"Based on the report, there is one metastatic carcinoma present in the sentinel lymph node with a size of involvement within the node of 0.3 cm and no evidence of extracapsular extension. According to the rules provided, this falls under N1 stage: 'N1 stage indicates involvement of 1-3 axillary lymph nodes, with or without extracapsular extension.'",N1,18.0
584,TCGA-A7-A26H.1159E2EF-6407-4D90-8ED6-7AB04CF4FB32,0,"DEPARTMENT OF PATHOLOGY AND LABORATORY MEDICINE. Date Coll: SPECIMEN. A. Left axillary sentinel node. B. Left breast (arrow points up). C. Right axillary sentinel node. D. Right axillary sentinel node #2 active in blue. E. Right breast (arrow points up). F. Left axillary contents. CLINICAL NOTES. PRE-OP DIAGNOSIS: Bilateral breast. FROZEN SECTION DIAGNOSIS. A) Sentinel lymph node, left axilla, biopsy: One lymph node,. positive for carcinoma. C. Sentinel lymph node, opsy: One lymph node,. negative for carcinoma. D. Sentinel lymph node, right axilia #2, biopsy: One lymph node,. negative for carcinoma. GROSS DESCRIPTION. A. The specimen is received unfixed labeled ""left axillary sentinel. noand consists of a yellow and red piece of soft tissue measuring. 2.5 x 2 x 0.8 cm. On cut section there is a contained lymph node. measuring 1.2 cm. in greatest dimension. The node is bis -and. submitted all for frozen section diagnosis as requested. B. The specimen is received unfixed labeled ""left breast. arrow points up"" and consists of a breast resection. specimen measuring 19.5 x 18.5 x 3.0 cm. There is an overlying. white ellipse of skin measuring 16 x 9.3 cm. There is a central. areola measuring 3 x 4 cm. and a central nipple measuring 1.2 x 1. x. 0.4 cm. There is an arrow incised in the skin and there is an area. of induration at the superior edge of the areola that might be. a. biopsy scar. It measures 1.5 x 0.7 cm. The deep surface of the. specimen is inked. The breast is sectioned at 1 cm. intervals in. the deep surface towards the skin. Some blue-domed cysts are. present. There is a relatively central red area compatible with a. biopsy site defect and there is some firmness around this area. The. firm area measures 1.5 x 1.5 x approximately 1.5 cm. This area. is. central and inferior and there is another area that is central below. the indurated part of the skin that looks like carcinoma grossly and. measures 1.2 x 1.5 x approximately 1.5 cm. A portion of the larger. area is taken for research purposes. Sections after fixation. Block summary: 1,2 nipple and skin with tumor; 3 deep margin; 4-6. biopsy site; 7-10 quadrants (UO, UI, LO, LI). C. Received unfixed labeled ""right axillary sentinel node"". and consist of two pieces of yellow and red soft tissue. measuring 2 x 1.8 x 0.7 cm. and 2.5 x 2.5 x 0.7 cm. There is a. contained lymph node measuring 1 cm. in greatest dimension and the. entire node is submitted for frozen section diagnosis as requested. D. Received unfixed labeled ""right axillary sentinel node. #2 active in blue"" and consist of a yellow, red and blue. piece of soft tissue measuring 5.5 x 3 x 0.6 cm. There is. a. partially blue contained lymph node measuring 2.3 cm. in greatest. dimension. The specimen is submitted all for frozen section. diagnosis as requested. E. [The original gross dictation on specimen E. is lost.] The. specimen was received unfixed labeled right breast and consisted of. a 27 x 19 x 4.5 cm breast resection specimen with overlying ellipse. of skin measuring 16.5 x 9 cm. There was a central areola and. nipple. An area of arrow was incised to the skin. Some blue dye. and. injected. The deep surface the specimen was inked and the breast. resection at 1 cm intervals from the deep surface towards the skin. There was a central biopsy site and additional relatively central. firm area compatible with carcinoma. Block summary: 1, nipple; 3 skin; 4 - deep margin; 5-7 biopsy. site; 8,9 area resembling tumor; 10-13 quadrants (UO.UI.LO.LI). F. The specimen was received unfixed, labeled ""left. axillary contents"" and consists of a yellow and pink of. soft tissue measuring 12 x 8 x 2 cm. RS-2. MICROSCOPIC DESCRIPTION. A. Metastatic carcinoma is present in one lymph node. The tumor is. 0.7 cm in diameter. No extranodal tumor is seen. B. Invasive carcinoma. Tumor type: Infiltrating ductal carcinoma. Tumor grade: 1 (Elston SBR grade; A/N/M = 2/2/1). Mitotic index: 3 mitoses/10 HPFs (1 HPF = 0.196 sq mm). Tumor size: 1.5 cm. Vessel invasion: Absent. Calcification: Absent. pTNM stage: T1 pN1a. Prognostic markers: Requested. Nipple: Carcinoma is present in skin adjacent to the nipple. Deep margin: Negative for malignancy. Nontumorous breast: Sections from the biopsy site away from. the tumor show scar, cyst formation, columnar metaplasia,. benign calcification, usual ductal hyperplasia and focal atypical. ductal hyperplasia. C. A Single lymph node is negative for malignancy. D. A single lymph node is negative for malignancy. E. Invasive carcinoma. Tumor type: Infiltrating ductal carcinoma. Tumor grade: 2 (Elston SBR grade; A/N/M = 3/2/1). Mitotic index: 3 mitoses/10 HPFs (1 HPF = 0.196 sq mm). Tumor size: 1.2 cm on the glass slide. Vessel invasion: Absent. Calcification: Absent. pTNM stage: T1. Prognostic markers: See previous biopsy. The tumor is specimen E from the right breast has a central fibrotic. focus. Sections near the biopsy site away from the gross carcinoma. described above show columnar metaplasia, usual ductal hyperplasia,. cyst formation apocrine metaplasia. An atypical area is p63. positive. F. There is no evidence of malignancy in any of 4 lymph nodes. 4x6,25x3,20,14x3. DIAGNOSIS. A. Sentinel lymph node, left axilla, biopsy: Metastatic carcinoma in. a single lymph node. B. Breast, left, resection: Infiltrating ductal carcinoma, Elston. SBR grade 1. C. Sentinel lymph node, right axilla, biopsy: A single lymph node is. negative for malignancy. D. Sentinel lymph node #2, right axilla, biopsy: A single lymph node. is negative for malignancy. E. Breast, right, resection: Infiltrating ductal carcinoma, Elston. SBR grade 2 F. Lymph nodes, left axilla, blopsy: There is no. evidence of malignancy in any of 4 lymph nodes. ictronic Signature).",BRCA,1,"Based on the information provided in the pathology report, there is metastatic carcinoma present in one lymph node in the left axilla, as stated in section A of the report. According to the rules provided, N1 stage indicates involvement of 1-3 axillary lymph nodes, with or without extracapsular extension. Therefore, the N stage for this patient is N1.",N1,19.0
944,TCGA-B6-A0X4.CA935E8D-ED8A-4485-BDC6-02C07CCE2EA5,1,"age & :-. urgical Pathology: CLINICAL HISTORY: Breast cancer, tumor was 3 x 2.5 x 2 cm. GROSS EXAMINATION: A. ""Left modified radical mastectomy"", received fresh. Submitted is a 2050. gram, 22 x 20 x 8 cm left mastectomy specimen with 10 x 10 x 2 cm axillary. tail. There is a 30 x 20 cm skin ellipse with a 1.5 cm nipple and 6 cm areola. A. sutured 10.5 cm linear incision is present over the lower inner quadrant. The margins are inked in blue. Sectioning reveals a 3 x 2 x 2 cm biopsy cavity. in the lower inner quadrant, 3 cm from the inferior margin, 2 cm from the. medial margin, 4.5 cm from the deep margin, 8 cm from the superior margin, and. more than 15 cm from the lateral margin. The biopsy cavity extends to within. 1. cm of the skin incision. Adjacent to the deep edge of the biopsy cavity is. a. 3 x 2 x 1 cm irregular mass of firm, tan-white tissue. The mass lies. approximately 3.5 cm from the deep surgical margin, 2 cm from the medial. margin, 3 cm from the inferior margin, 7.5 cm from the superior margin, and. greater than 15 cm from the lateral margin. In the upper inner quadrant,. 3.5 cm from the biopsy cavity, is a 1.5 x 1.2 x 0.8 cm well circumscribed. nodule of firm, pale pink-tan tissue. The nodule lies nearest the deep margin,. extending to within 2 cm of this margin. In the lower outer quadrant are two. similar well-circumscribed nodules of pale pink-tan tissue: a 1.1 x 0.6 x 0.5. cm nodule and, 1.5 cm lateral to this, a 0.6 x 0.5 x 0.2 cm nodule. The 1.1. x. 0.6 x 0.5 cm nodule lies 5 cm from the lateral surgical margin and 4 cm from. the inferior surgical margin. The 0.6 x 0.5 x 0.2 cm nodule is 3.5 cm from the. lateral surgical margin and 4 cm from the inferior surgical margin. Further. lateral and inferior within the lower outer quadrant is a small, 0.4 x 0.3 x. 0.2 cm, oblong mass of firm tan tissue, lying 2 cm from the deep and the. lateral surgical margins. In the upper outer quadrant there are small areas. of fibrosis, some associated with small cysts (up to 0.3 cm in diameter) . Within the axillary tail, thirty-two lymph node candidates, 0.5 to 2.2 cm in. greatest dimension, are identified: 8 within the proximal third (zone III),. 6. within the middle third (zone II), and 18 lymph nodes in the distal third. (zone I) . BLOCK SUMMARY: A1- six lymph node candidates from zone III, 0.5 to 1.1 cm in greatest. dimension. A2- two bisected lymph node candidates, 1.2 x 0.9 x 0.7 cm and 1 x 0.6 x 0.5. cm, from zone III. A3- five lymph node candidates from zone II, 0.4 to 1 cm in greatest dimension. A4-A5- one bisected lymph node candidate, 2.2 x 1.5 x 0.4 cm, from zone II. A6- four lymph node candidates, 0.8 to 1.2 cm, from zone I. A7- six lymph node candidates, 0.5 to 1.1 cm, from zone I. A8- six lymph node candidates, 0.8 to 1 cm, from zone I. A9- two bisected lymph node candidates, 1.3 x 1 x 0.4 cm and 1.6 x 1.3 x 0.5. cm, from zone I. A10- section through nipple. A11- sections adjacent to incision extending to the biopsy cavity. A12-A15- sections through 3 cm mass adjacent to biopsy cavity. A16-A17- sections through 1.5 cm nodule in the upper inner quadrant. A18- section through the 0.6 and 1.1 cm nodules in the lower outer quadrant. A19- section through 1.1 cm nodule in the lower outer quadrant. A20- section through 0.4 cm mass in the lower outer quadrant. A21- section extending to the deep surgical margin near the biopsy cavity. A22- section extending to the inferior surgical margin near the biopsy. cavity. A23- sections extending to the superior surgical margin nearest biopsy cavity. Page 2 of. A24- sections extending to the medial surgical margin nearest the biopsy. cavity. A25- - inner upper quadrant. A26- - outer upper quadrant, including portion of fibrous tissue with cysts. A27- outer lower quadrant. A28- inner lower quadrant. A29- section through superior/medial edge of the biopsy cavity. A30- section through deep edge of biopsy cavity. Dr. DIAGNOSIS: A. ""LEFT MODIFIED RADICAL MASTECTOMY"" (MODIFIED RADICAL MASTECTOMY). INFILTRATING DUCTAL CARCINOMA, AT LEAST 3 CM IN GREATEST DIMENSION, NSABP. CYTOLOGIC GRADE 2, HISTOLOGIC GRADE 2. LYMPHOVASCULAR INVASION IS IDENTIFIED. METASTATIC CARCINOMA IN TWO OF TWENTY-ONE LYMPH NODES. DUCTAL CARCINOMA IN SITU OF NON-COMEDO TYPE, EXTENSIVE. SURGICAL MARGINS FREE OF CARCINOMA. BREAST TISSUE AWAY FROM TUMOR MASS SHOWS BENIGN PROLIFERATIVE CHANGES. INCLUDING ATYPICAL INTRADUCTAL HYPERPLASIA, INTRADUCTAL HYPERPLASIA OF. THE USUAL TYPE, INTRADUCTAL PAPILLOMATOSIS, APOCRINE METAPLASIA, BLUNT. DUCT ADENOSIS, MICROCALCIFICATIONS, DUCT ECTASIA, AND MULTIPLE. FIBROADENOMATA. ADDENDUM 1: Tissue was sent to the. where assays for estrogen receptor. and progesterone receptor were performed. Assay for estrogen receptor. revealed an estimated Fmol value of 292 which was interpreted as positive. The. estrogen receptor activity was interpreted as positive with estimated Fmol. value of 268. Please refer to. for the complete report. ADDENDUM 2: ADDENDUM DIAGNOSIS: SURGICAL OPERATIVE MARGINS ARE FREE OF MALIGNANCY. DUCTAL CARCINOMA IN SITU OF NON COMEDO TYPE, EXTENSIVE. BREAST TISSUE AWAY FROM MAIN TUMOR MASS SHOWS BENIGN PROLIFERATIVE CHANGES. INCLUDING HYPERPLASIA, INTRADUCTAL PAPILLOMATOSIS, BLUNT DUCT ECTASIA,. APOCRINE METAPLASIA, MICROCALCIFICATIONS, AND MULTIPLE HYALIZING. FIBROADENOMA.",BRCA,1,"According to the report, metastatic carcinoma was found in two of the twenty-one lymph nodes examined. This corresponds to the N1 stage, which indicates involvement of 1-3 axillary lymph nodes. The exact number of involved lymph nodes is not specified, but it falls within the range for N1.",N1,20.0
