Unnamed: 0,patient_filename,t,text,type,n,cmem_n_reasoning,cmem_n_ans_str,cmem_n_num_update
872,TCGA-AR-A24M.56DFBCCE-A9D9-4F08-AC7E-33998F3439B2,1,"Final Diagnosis. Breast, left, wide local excision: Invasive mammary carcinoma with mixed ductal and lobular features, Nottingham grade II (of. III), forming a 2.5 x 2.4 x 2.2 cm mass (AJCC pT2). The surgical resection margins are negative for tumor. A fibroadenoma (0.9. x 0.8 x 0.6 cm) is also identified. Lymph nodes, left axillary sentinel, excision: Left axillary sentinel lymph nodes No. 1 and No. 2 are positive for metastatic. mammary carcinoma. Left axillary sentinel lymph node No. 3 is negative for tumor. Blue dye is identified in all three left. axillary sentinel lymph nodes. Lymph node, left axillary, excision: A single left axillary lymph node is negative for tumor. Lymph nodes, left axillary, dissection: Multiple (2 of 24) left axillary lymph nodes are positive for tumor (AJCC pN2). Her-2/Neu has been ordered on paraffin embedded tissue.",BRCA,2,"The report states that there are 2 positive lymph nodes out of 24 examined in the left axillary lymph node dissection (AJCC pN2). This indicates that the patient has metastasis in 2 to 9 axillary lymph nodes, which corresponds to N2 stage according to the rules.",N2,27.0
772,TCGA-AN-A0XP.80E9B7CE-0D5D-4C01-A8E3-E6345BE145EC,1,Sex: Female. Diagnosis: Breast Cancer Histological description: Infiltrative ductal carcinoma. Anatomic Site: Breast Tumor location: Primary. Tissue Specification: Tumor Specimen Matrix: Tissue Specimen Format: OCT. Container: block Type of Procurement: surgery Grade: 2. T Stage: 2 N Stage: 1 M Stage: 0 Treatment: none. Treatment Details: n/a. Normal Sample. Anatomic Site: Blood Sample Type: Normal Type of Procurement: blood draw. Matrix: Blood Specimen Format: frozen Container: tube.,BRCA,2,"The report specifies that the N Stage is 1, which indicates metastasis in 1 to 3 axillary lymph nodes or micrometastases. The specific N stage is not provided in the report, but based on the rules, we can predict that the N stage is N1.",N1,28.0
801,TCGA-AO-A0JF.D58E5D64-B5B9-4487-8E46-225AE3617C14,0,"Clinical Diagnosis & History: 1.2. cm invasive duct carcinoma left breast upper outer quadrant (on core. biopsy) for left wide excision SLNB, possible left ALND. Specimens Submitted: 1: SP: Sentinel node #1 level one left axilla (fs). 2: SP: Sentinel node #2 level one left axilla (fs). 3: SP: Excision of tumor left breast two o'clock. 4: SP: Superior margin left breast. 5: SP: Medial margin left breast. 6: SP: Inferior margin left breast. 7: SP: Lateral margin left breast. 8: SP: Non-sentinel node left axilla. 9: SP: Posterior margin left breast. 10: SP: Levels one and two left axillary contents. DIAGNOSIS: 1. LYMPH NODE, SENTINEL #1, LEVEL I, LEFT AXILLA; EXCISION: - METASTATIC ADENOCARCINOMA IN ONE LYMPH NODE (1/1). THE METASTATIC FOCUS MEASURES 5 MM IN GREATEST DIMENSION. - NEGATIVE FOR EXTRACAPSULAR EXTENSION. 2. LYMPH NODE, SENTINEL #2 LEVEL I LEFT AXILLA; EXCISION: METASTATIC ADENOCARCINOMA IN ONE LYMPH NODE (1/1). THE METASTATIC FOCUS MEASURES 6 MM IN GREATEST DIMENSION. - EXTRACAPSULAR EXTENSION (>2MM) IS PRESENT. 3. BREAST, LEFT, 2 O'CLOCK; EXCISION: - INVASIVE DUCTAL CARCINOMA, NOS TYPE, HISTOLOGIC GRADE II/III. (MODERATE TUBULE FORMATION), NUCLEAR GRADE I/III (SLIGHT OR NO VARIATION IN. SIZE AND SHAPE), MEASURING 2.0 CM IN LARGEST DIMENSION MICROSCOPICALLY. - DUCTAL CARCINOMA IN SITU (DCIS) IS ALSO IDENTIFIED, SOLID TYPE WITH LOW TO. INTERMEDIATE NUCLEAR GRADE. - THE DCIS CONSTITUTES LESS THAN OR EQUAL TO 25% OF THE TOTAL TUMOR MASS,. AND IS PRESENT ADMIXED WITH THE INVASIVE COMPONENT. - CALCIFICATIONS ARE PRESENT IN THE INVASIVE CARCINOMA ONLY. FOCAL VASCULAR INVASION IS PRESENT. FOR SURGICAL MARGINS SEE PARTS 4-7, AND 9. THE NON-NEOPLASTIC BREAST TISSUE THE NON-NEOPLASTIC BREAST TISSUE. SHOWS BIOPSY SITE CHANGES. RESULTS OF 108, PR, HER2-NEU) ARE AS FOLLOWS: ESTROGEN RECEPTOR. 95% nuclear staining with inhensity. PROGESTERONE RECEPTOR. 70% nucl. ith moderate intensity. HER2. Negative (1+). (<5% of invasive tumor cells exhibit weak complete membranous staining;. Uniformity of staining: absent;. Homogeneous, dark circumferential pattern: absent). Comment: Controls are satisfactory. PATHWAY anti-HER-2/neu is an. FDA-approved rabbit monoclonal primary antibody (clone 485) directed against. the internal domain of the c-erbB-2 oncoprotein (HER2) for. immunohistochemical detection of HER2 protein overexpression in breast. cancer tissue routinely processed for histologic evaluation. The HER2 test. results are reported in accordance with the ASCO/CAP guideline. recommendations for HER2 testing in breast cancer (J Clin Oncol 2007;. 25 (1) :118-145) The ER and PR rabbit monoclonal antibodies are also FDA. approved. 4. BREAST, LEFT, SUPERIOR MARGIN; EXCISION: - BENIGN BREAST TISSUE WITH PROLIFERATIVE FIBROCYSTIC CHANGES. 5. BREAST, LEFT, MEDIAL MARGIN; EXCISION: BENIGN BREAST TISSUE WITH FOCAL USUAL DUCTAL HYPERPLASIA. 6. BREAST, LEFT, INFERIOR MARGIN; EXCISION: - BENIGN BREAST TISSUE WITH FOCAL USUAL DUCTAL HYPERPLASIA. 7. BREAST, LEFT, LATERAL MARGIN; EXCISION: - BENIGN BREAST TISSUE WITH FOCAL USUAL DUCTAL HYPERPLASIA. LYMPH NODE, NON-SENTINEL, LEFT AXILLA; EXCISION: - ONE BENIGN LYMPH NODK (0/1). 9. BREAST, LEFT, POSTERIOR MARGIN; EXCISION: BENIGN BREAST TISSUE PREDOMINANTLY COMPOSED OF FIBROADIPOSK. ELEMENTS. SKELETAL MUSCLE TISSUE ALSO PRESENT. 10. LYMPH NODES, LEFT AXILLARY CONTENTS, LEVELS ONE AND TWO, EXCISION: ELEVEN BENIGN LYMPH NODES (0/11). Some of the mmunohistochemistry and. :ests were developed and their. performance characteristics were determined by. They have not been cleared or approved by the US FOO ana urug. Administration. The FDA has determined that such clearance or approval is. not necessary. These tests are used for clinical purposes. They should not. be regarded as investigational or for research. This laboratory is certified. under the Clinical Laboratory Improvement Amendments of 1988 (CLIA , 88) as. qualified to perform high complexity clinical laboratory testing. I ATTEST THAT THE ABOVE DIAGNOSIS IS BASED UPON MY PERSONAL EXAMINATION OF. THE SLIDES - (AND/OR OTHER MATERIAL) . AND THAT I HAVE REVIEWED AND APPROVED. THIS REPORT. Gross Description: 1. 1) The specimen is received fresh for frozen labeled, ""Sentinel node #1,. level 1, left axilla"", and consists of one fatty lymph node measuring 2.5 x. 1.5 x 1.5 cm, which is trisected and representatively submitted. A portion. of tissue sent to TPS. The remaining lymph node is submitted to permanent. Summary of sections: fac -- lymph node frozen section control. RS- remaining lymph node. 2) The specimen is received fresh for frozen labeled, ""Sentinel node #2,. level 1, left axilla"", and consists of one fatty lymph node measuring 2.4 x. 1.5 x 1.2 cm, which is trisected and representatively submitted. A portion. of tissue sent to TPS. The remaining lymph node is submitted to permanent. Summary of sections: fsc -- lymph node frozen section control. RS- remaining lymph node. 3) The specimen is received unoriented and fresh, labeled ""excision of. tumor, left breast two o' clock"" and consists of a piece of fibrofatty. breast tissue measuring 5.2 x 5.0 x 2.3 cm. The specimen is entirely inked. black. Serial sectioning reveals a spiculated, white mass measuring 1.2 x. 1.2 x 1.1 cm. Sectioning through the remaining breast tissue reveals yellow. adipose tissue. A clip is identified. The tumor is entirely submitted and. the remaining tissue is representatively submitted and a small portion is. given to TPS. Summary of sections: MT - tumor and closest tissue edge. T - tumor (clip was in block 2). SS - serial sections remaining tissue. 4) The specimen is received fresh, labeled ""superior margin left breast"" and. consists of a piece of fibrofatty breast tissue measuring 5.0 x 3.0 cm, and. 1.3 cm thick. A stitch marks the new margin of excision, which is inked. black. The tissue is serially sectioned and entirely submitted. Summary of sections: u - sequential sections. 5) The specimen is received fresh, labeled ""medial margin left breast"" and. consists of a piece of fibrofatty breast tissue measuring 3.2 x 2.5 cm, and. 1.2 cm thick. A stitch marks the new margin of excision, which is inked. black. The tissue is serially sectioned and entirely submitted. Summary of sections: u - sequential sections. 6) The specimen is received fresh, labeled inferior margin left breast"" and. consists of a piece of fibrofatty breast tissue measuring 4.0 x 3.0 cm, and. 1.3 cm thick. A stitch marks the new margin of excision, which is inked. black. The tiasue is serially sectioned and entirely submitted. Summary of sections: u - sequential sections. 7) The specimen is received fresh, labeled ""lateral margin left breast"" and. consists of a piece of fibrofatty breast tissue measuring 4.4 x 2.8 cm, and. 1.2 cm thick. A stitch marks the new margin of excision, which is inked. black. The tiasue is serially sectioned and entirely submitted. Summary of sections: u - sequential sections. 8) The specimen is received in formalin, labeled ""Non-sentinel node left. axilla"" and consists of a single pink tan fatty lymph node measuring 0.9 cm. The lymph node is bisected and entirely submitted. Summary of sections: BLN-bisected lymph node. 9). The specimen is received fresh, labeled ""posterior margin, left breast"". and consists of a piece of fibrofatty breast tissue measuring 4.2 x 3.0 cm,. and 0.5 cm thick. The specimen is unoriented, entirely inked black. sectioned and submitted in its entirety. Summary of sections: SS - sequential sections. 10) The specimen is received fresh labeled ""levels one and two left axillary. contents"" It consists of a fragment of yellow adipose tissue measuring 12.5. x 10.5 x 2.8 cm. The levels are not designated. Numerous lymph nodes are. identified ranging in size from 0.4 cm up to 2.0 cm, and all are submitted. Summary: RLN-representative lymph node (multiple). ARLN-additional representative lymph nodes. LN-lymph nodes. Summary of Sections: Part 1: SP: Sentinel node #1 level one left axilla (fs). Block. Sect. Site. PCs. 1. fsc. 1. 1. rs. 1. Part 2: SP: Sentinel node #2 level one left axilla (fs). Block. Sect. Site. PCs. 1. fsc. 1. 1. rs. 1. Part 3: SP: Excision of tumor left breast two o'clock. Block. Sect. Site. PCs. 1. MT. 1. 1. SS. 1. 2. T. 2. Part 4: SP: Superior margin left breast. Block. Sect. Site. PCs. 6. u. 6. Part 5: SP: Medial margin left breast. Block. Sect. Site. PCs. 6. u. 6. Part 6: SP: Inferior margin left breast. Block. Sect. Site. PCs. 6. u. 6. Part 7: SP: Lateral margin left breast. Block. Sect. Site. PCs. 6. u. 6. Part 8: SP: Non-sentinel node left axilla. Block. Sect. Site. PCs. 1. bln. 1. Part 9: SP: Posterior margin left breast. Block. Sect. Site. PCs. 6. ss. 6. Part 10: SP: Levels one and two left axillary contents. Block. Sect. Site. PCs. 5. arln. 5. 5. LN. 12. 4. RLN. 4. Intraoperative Consultation: Note: The diagnoses given in this section pertain only to the tissue sample. examined at the time of the intraoperative consultation. 1). FROZEN SECTION DIAGNOSIS: SP: Sentinel node #1 level one left. axilla (fs) : Metastatic ductal carcinoma (1/1). PERMANENT DIAGNOSIS: SAME. 2). FROZEN SECTION DIAGNOSIS: SP: Sentinel node #2 level one. left axilla (fs) Metastatic ductal carcinoma with extranodal extension. (1/1). PERMANENT DIAGNOSIS: SAME. Note: The diagnoses given in this section pertain only to the tissue sample. examined at the time of the intraoperative consultation. 1). FROZEN SECTION DIAGNOSIS: SP: Sentinel node #1 level one left. axilla (fs) : Metastatic ductal carcinoma (1/1). PERMANENT DIAGNOSIS: SAME. 2). FROZEN SECTION DIAGNOSIS: SP: Sentinel node #2 level one. left axilla (fs) : Metastatic ductal carcinoma with extranodal extension. (1/1). PERMANENT DIAGNOSIS: SAME.",BRCA,1,"Based on the pathology report, there are metastases in 1-3 axillary lymph nodes, specifically in sentinel nodes #1 and #2. The report mentions that there is no evidence of extracapsular extension in sentinel node #1, but there is extracapsular extension in sentinel node #2. However, as the N stage is based solely on the number of involved axillary lymph nodes and not on the presence or absence of extracapsular extension, the N stage remains N1.",N1,29.0
545,TCGA-A2-A25C.1D4CA1BA-B534-4CEA-ABA5-EF9B31694204,1,"Specimen: spec Type: SURGICAL P. LEFT BREAST CANCER INVASIVE. DOCTOR (S) : PROCEDURE: SENTNEL, NODE BX/STMPLE MASTRCTOMY. A. LT BREAST SIMPLE MASTECTOMY. B. LT SENTINEL NODE #1. C. LT SENTINEL NODE #2. RECEIVED IN 3 PARTS. PART A RECEIVED LABELED. SIMPLE LEFT BREAST. MASTECTOMY STITCH AT 12 O' CLOCK, IS A SIMPLE MASTECTOMY SPECIMEN. MEASURING 17.5 x 16 x 2.8 CM. THE NIPPLE IS UNREMARKABLE WITHIN A 9 x. 2.5-CM SKIN ELLIPSE. ADDITIONALLY WITHIN THE CONTAINER ARE 2 IRREGULAR. FRAGMENTS OF FATTY TISSUE WITH NO PALPABLE MASSES TOGETHER MEASURING 4.5. x 3 x 0.5 CM. THE SUPERFICIAL ASPECT IS MARKED WITH BLUE INK, THE DEEP. WITH BLACK. SECTIONING REVEALS 2 DISCRETE GRAY FIBROUS NODULES; THE MOST. LATERAL IS AT 3 O'CLOCK MEASURING 1.5 x 1.1 x 1.5 CM. ADJACENT TO THIS. SEPARATED BY 1.5 CM IN THE 6:30 AREA IS A MASS WITH A COIL CLIP MEASURING. 2.2 x 1.8 x 2.1 CM. THESE ARE BOTH 0.5 CM FROM THE DEEP MARGIN. CENTRALLY, THE BREAST HAS DENSE TAN FIBROUS TISSUE, BUT THE PERIMETER OF. THE SPECIMEN AND THE TISSUE ADJACENT TO THE DEEP MARGIN IS YELLOW FATTY. TISSUE. THE 3 O'CLOCK LESION IS 0.7 CM FROM THE SUPERFICIAL MARGIN. THE. 6 O'CLOCK LESION EXTENDS TO WITHIN 0.6 CM OF THE SUPERFICIAL MARGIN. SECTIONS ARE SUBMITTED AS FOLLOWS: 11--NIPPLE; 12--TISSUE BETWEEN THE. TWO LESIONS; A3--3 O' CLOCK LESION TO INCLUDE DEEP MARGIN; A4--3 O'CLOCK. LESION TO INCLUDE SUPERFICIAL MARGIN; A5 AND 6--FULL CROSS-SECTION OF 6. O' CLOCK LESION TO INCLUDE THE DEEP AND SUPERFICIAL MARGIN, RESPECTIVELY;. A7--6 O'CLOCK LESION; A8--UPPER OUTER QUADRANT; A9--UPPER INNER QUADRANT;. A10 - -LOWER INNER QUADRANT; A11--LOWER OUTER QUADRANT. TISSUE FROM EACH. LESION IS SUBMITTED PER PROTOCOL. PART B RECEIVED LABELED. LEFT SENTINEL NODE #1 HOT. AND BLUE, IS AN OVOID FRAGMENT OF YELLOW-RED SOFT TISSUE MEASURING 1.7 x. 1.0 x 0.9 CM. SECTIONING REVEALS A GROSSLY UNREMARKABLE 1.3-CM LYMPH. NODE WITH CENTRAL FAT REPLACEMENT AND BLUE COLORATION. THIS IS SUBMITTED. LABELED B, BISECTED. PART C RECEIVED LABELED. LEFT SENTINEL NODE #2 HOT. 1. Specimen: Spec Type: SURGICAL P. CPA : AND BLUE, IS A 1.5 x 0.6 x 0.4-CM OVOID PORTION OF RED-TAN TISSUE. SECTIONING REVEALS THIS TO BE A GROSSLY UNREMARKABLE LYMPH NODE WITH BLUK. COLORATION SUBMITTED LABELED C, BISECTED. PROCEDURES: 88307/3, IMMUNOPEROXIDAS/2, A BLK/11, BBX X6, CBX X6. PART A LEFT BREAST, SIMPLE MASTECTOMY : 1. MODERATELY DIFFERENTIATED INFILTRATING DUCT CARCINOMA, NUCLEAR GRADE. II/III, MODERATE MITOTIC INDEX AND TUBULE FORMATION 2, WITH A TOTAL. NOTTINGHAM SCORE OF 6. RARE FOCI OF DCIS OF THE CRIBRIFORM AND SOLID. TYPES, NUCLEAR GRADE II WITH LOW MITOTIC INDEX, ARE SEEN AT THE. PERIPHERY OF THE TUMOR. 2. A 1.5-CM TUMOR IS IDENTIFIED IN THE 3 O' CLOCK LOCATION AND A 2.2-CM. LESION IS IDENTIFIED IN THE 6 D'CLOCK PORTION WHICH ARE SEPARATED BY. AT LEAST 1.5 CM OF BENIGN BREAST TISSUE. 3. THE MARGINS OF EXCISION, NIPPLE SKIN AND RANDOM SECTIONS OF REMAINING 2.2cm I Scm. QUADRANTS ARE FREE OF TUMOR. 4. LYMPHOVASCULAR INVASION IS IDENTIFIED. 5. BIOPSY CHANGES. ARE PRESENT. PART B LEFT AXILLA, SENTINEL LYMPH NODE BIOPSY #1: METASTATIC BREAST. CARCINOMA IS MULTIFOCALLY IDENTIFIED ON H&E STEP SECTIONS AND CYTOKEBATIN. STAINS IN 1 LYMPH NODE EXAMINED, THE LARGEST FOCUS OF WHICH MEASURES 3 MM. IN GREATEST MICROSCOPIC DIMENSION. NO EVIDENCE OF EXTRANODAL EXTENS FON. PART C LEFT AXILLA, SENTINEL LYMPH NODE BIOPSY #2: MULTIFOCAL. METASTATIC BREAST CARCINOMA IS IDENTIFIED ON H&E STEP SECTIONS AND. CYTOKERATIN STAINS IN 1 LYMPH NODE EXAMINED, THE LARGEST FOCUS OF WHICH. MEASURES 2 MM IN GREATEST MICROSCOPIC DIMENSION. EXTRANODAL EXTENSION IS. NOT PRESENT. Specimen: Spec Type: SURGICAL P. Her-2/neu: NEGATIVE. Score: 1+. Reference Range : Negative o - 1+. Equivocal 2+. Positive 3+. M.D. See full scanned report for details. 1. SENT TO: 2. REQUESTED BY: DR. 3. DATE SENTs. 4. KETHOD or COURIER. 5. NO. OF BLOCKS: 1 BLOCR A3. 7. MATERIAL(S) TO BE RETURNED. 14. SPECIMEN SENT (Y/X) $. x. M.D. (prelim.). M.D.",BRCA,1,"Based on the pathology report, there is metastatic carcinoma in 1-3 axillary lymph nodes, specifically in sentinel lymph node biopsy #1 with the largest focus measuring 3 mm and in sentinel lymph node biopsy #2 with the largest focus measuring 2 mm. The N stage is based solely on the number of involved axillary lymph nodes and does not consider other factors such as tumor size or distant metastasis. Therefore, the N stage is N1.",N1,30.0
1051,TCGA-BH-A18I.01E8D241-C303-47FA-B484-B800D580B34C,0,"PATIENT HISTORY: CHIEF COMPLAINT/ PRE-OP/POST-OP DIAGNOSIS: Invasive ductal carcinóma in the left breast at 10 o'clock. Calcifications. and atypia at 12 o'clock. LMP DATE: Not listed. PROCEDURE: Left segmental mastectomy, sentinel lymph node biopsy, excisional biopsy. SPECIFIC CLINICAL QUESTION: Not listed. OUTSIDE TISSUE DIAGNOSIS: No. PRIOR MALIGNANCY: No. CHEMORADIATION THERAPY: No. OTHER DISEASES: No. FINAL DIAGNOSIS: PART 1: LEFT BREAST, 40 O'CLOCK, SEGMENTAL MASTECTOMY -. A. TWO FOCI OF INVASIVE DUCTAL CARCINOMA, NO SPECIAL TYPE. B. NOTTINGHAM GRADE 2 (TUBULE FORMATION: 2, NUCLEAR PLEOMORPHISM: 3, MITOTIC ACTIVITY: TOTAL SCORE: 7/9). 2;. C. THE DOMINANT MASS OF INVASIVE CARCINOMA MEASURES 1.9 CM IN LARGEST DIMENSION. D. THE SATELLITE FOCUS MEASURES 0.6 CM AND IS PRESENT 0.5 CM AWAY FROM THE MAIN MASS. E. DUCTAL CARCINOMA IN-SITU (DCIS), NUCLEAR GRADE 2, CRIBRIFORM TYPE. F. THE DCIS CONSTITUTES 10% OF THE TOTAL TUMOR VOLUME AND IS ADMIXED WITH INVASIVE. COMPONENT. G. NO LYMPHOVASCULAR SPACE INVASION IS NOTED. H. THE INVASIVE CARCINOMA (DOMINANT MASS) FOCALLY EXTENDS TO THE SUPERIOR MARGIN AND IS. <0.1 CM TO THE POSTERO-INFERIOR MARGIN. I. THE SATELLITE FOCUS OF INVASIVE CARCINOMA IS 0.15 CM FROM THE POSTERIOR MARGIN. J. FLAT EPITHELIAL ATYPIA. K. CALCIFICATIONS ARE ASSOCIATED WITH INVASIVE CARCINOMA AND BENIGN BREAST PARENCHYMA. L. THE NON-NEOPLASTIC BREAST SHOWS FLORID DUCTAL HYPERPLASIA, COLUMNAR CELL CHANGE AND. FIBROCYSTIC CHANGES. M. PREVIOUS BIOPSY SITE CHANGES. N. THE INVASIVE TUMOR CELLS ARE POSITIVE FOR ESTROGEN RECEPTOR (H- score 240) AND POSITIVE. FOR PROGESTERONE RECEPTOR (H-score 240) AND NEGATIVE FOR HER-2, AS PER PREVIOUS. PART 2: LEFT BREAST, 12 O'CLOCK, BIOPSY -. A. FLORID DUCTAL HYPERPLASIA. B. COLUMNAR CELL CHANGES AND HYPERPLASIA. C. RADIAL SCAR. D. FIBROADENOMATOID AND FIBROCYSTIC CHANGES. E. NO RESIDUAL ATYPIA SEEN. F. PREVIOUS BIOPSY SITE. PART 3: LEFT SENTINEL LYMPH NODE #1, BIOPSY -. A. ONE LYMPH NODE, POSITIVE FOR METASTATIC TUMOR (1/1). B. THE METASTATIC FOCUS MEASURES 0.6 CM IN LARGEST DIMENSION. C. FOCAL EXTRACAPSULAR EXTENSION (<0.1 CM) IS IDENTIFIED. PART 4: LEFT SENTINEL LYMPH NODE #2, BIOPSY -. TWO LYMPH NODES, NEGATIVE FOR METASTATIC TUMOR (0/2). COMMENT: The invasive tumor nuclear grade is variable and ranges-from nuclear grade 2 to nuclear grade 3. The highest grade is. taken into account for Nottingham scoring and grading. MICROSCOPIC: Microscopic examination substantiates the above diagnosis. Antibody/Antigen. E-cadherin. Membranous reactivity in invasive tumor cells. P120. Membranous reactivity in invasive tumor cells. Utilizing formalin-fixed (8-96 hour range), paraffin embedded tissue, immunohistology is. performed with the following selected antibodies and designated antibody clone (s) directed. against the following antigenic target (s) with adequate positive and negative internal and. external controls. Antibodies are optimized appropriate for fixation times. ANTIBODY. CLONE. TARGET ANTIGEN. VENDOR. E-cadherin. 36. Ductal Carcinoma. P120. 98. Lobular carcinoma. CASE SYNOPSIS: SYNOPTIC - PRIMARY INVASIVE CARCINOMA OF BREAST. LATERALITY: Left. PROCEDURE: Segmental. Clock position: 10.00. SIZE OF TUMOR: Maximum dimension invasive component: 19 mm. MULTICENTRICITY/MULTIFOCALITY OF INVASIVE FOCI: TUMOR AGGREGATE SIZE: Sum of the sizes of multiple invasive tumors: 2.5 mm. TUMOR TYPE (invasive component): Ductal adenocarcinoma, NOS. NOTTINGHAM SCORE: Nuclear grade: 3. Tubule formation: 2. Mitotic activity score: 2. Total Nottingham score: 7. Nottingham grade (1, 2, 3): 2. ANGIOLYMPHATIC INVASION: DERMAL LYMPHATIC INVASION: Not applicable. CALCIFICATION: Yes, benign zones. Yes, malignant zones. TUMOR TYPE, IN SITU: Cribriform. DCIS admixed with invasive carcinoma. Percent of tumor occupied by in situ component: 10 %. SURGICAL MARGINS INVOLVED BY INVASIVE COMPONENT: Yes, focal. SURG MARGINS INVOLVED BY IN SITU COMPONENT: LYMPH NODES POSITIVE: 1. LYMPH NODES EXAMINED: 3. METHOD(S) OF LYMPH NODE EXAMINATION: H/E stain. SENTINEL NODE METASTASIS: SIZE OF NODAL METASTASES: Diameter of largest lymph node metastasis: 6 mm. LYMPH NODE METASTASIS(-ES) WITH EXTRACAPSULAR EXTENSION: Yes, Maximum size is:0.75mm. NON-NEOPLASTIC BREAST TISSUE: FCD. T STAGE, PATHOLOGIC: pT1c. N STAGE MODIFIER: (sn). N STAGE, PATHOLOGIC: pNX. M STAGE: Not applicable. ESTROGEN RECEPTORS: positive, H-score: 240. PROGESTERONE RECEPTORS: positive, H-score: 240. HER2/NEU: 1+. Comment: The tumor pN stage is at least pN1. Since the sentinel node is positive, a final N. stage will be assigned after complete lymph node dissection.",BRCA,1,"The pathology report indicates that there is metastatic carcinoma in 1 sentinel lymph node (part 3, A) with a largest metastatic focus of 0.6 cm (part 3, B) and focal extracapsular extension of less than 0.1 cm (part 3, C). According to the rules provided, if there is metastatic carcinoma in 1-3 axillary lymph nodes, the N stage is N1. The N stage is based solely on the number of involved axillary lymph nodes and does not consider other factors such as tumor size or distant metastasis. The size of the metastasis or the presence of extracapsular extension does not affect the N stage in this case.",N1,31.0
