Unnamed: 0,patient_filename,t,text,type,n,cmem_n_reasoning,cmem_n_ans_str,cmem_n_num_update
511,TCGA-A2-A0SV.161E2817-7DB2-46F8-BFEB-256DBBEFE633,1,"Specimen #: Race: WHITE. Physician (s) : SPECIMEN: WUID:161E2817-7082-46F8-BFEB-256DBBEFE633. A: RIGHT BREAST B: RIGHT AXILLARY CONTENTS. FINAL DIAGNOSIS: A. RIGHT BREAST, MASTECTOMY: TUMOR TYPE: INFILTRATING DUCTAL CARCINOMA, NO SPECIAL TYPE. NOTTINGHAM GRADE: POORLY DIFFERENTIATED (G3). NOTTINGHAM SCORE: 9/9. (Tubules= 3, Nuclei= 3, Mitoses= 3 mitotic count 14 per 10 HPF at. 40x power). TUMOR SIZE (GREATEST DIMENSION) : 4.5 CM (MEASURED GROSSLY). TUMOR NECROSIS: PRESENT, IN INFILTRATING COMPONENT AND DCIS. MICROCALCIFICATIONS: PRESENT IN INFILTRATING COMPONENT AND BENIGN. PROCESSES. VENOUS / LYMPHATIC INVASION: PRESENT; EXTENSIVE. MARGINS : DEEP MARGIN POSITIVE FOR TUMOR IN TISSUE AND LYMPHATICS. INTRADUCTAL COMPONENT: PRESENT; MINIMAL. NIPPLE INVOLVEMENT: PRESENT (without Pagetoid spread) . SKIN INVOLVEMENT: PRESENT. MULTICENTRICITY: PRESENT; MULTIPLE SEPARATE MICROSCOPIC FOCI IN OTHER. QUADRANTS (SEE COMMENT). ESTROGEN RECEPTORS: Previously ordered and positive. PROGESTERONE RECEPTORS: Previously ordered and positive. HER 2 NEU by IHC: Previously ordered; weakly positive. HER 2 Neu BY FISH: Previously ordered and pending. PATHOLOGIC STAGE: pT4d N2a MX. ADDITIONAL PATHOLOGIC CHANGES. -DUCTAL CARCINOMA IN-SITU, HIGH GRADE. - -CYSTIC CHANGE WITH APOCRINE METAPLASIA. B. LYMPH NODES, RIGHT AXILLA, DISSECTION: EIGHT LYMPH NODES POSITIVE FOR TUMOR, WITH EXTENSIVE EXTRACAPSULAR. EXTENSION IDENTIFIED, AND DEPOSITS LARGER THAN 2 MM. COMMENT: ER, PR, and Her2Neu are performed on the patient's prior material. collected by mammotome biopsy,. and will not be. repeated. This tumor shows satellite nodules throughout all quadrants. Specimen #: FINAL DIAGNOSIS (continued) : sampled except the lower outer quadrant. These nodules are not measured. separately as separate primary tumors; they appear to have arisen from. intramammary lymphatic spread. It is likewise difficult to measure the. degree of extranodal extension of tumor from the lymph nodes due to the. extensive perinodal tumor deposits. CLINICAL DIAGNOSIS AND HISTORY: yo white female with right nipple inversion, right breast. Prior. mammotome biopsy with ductal carcinoma. A. Right breast, Long stitch lateral, short stitch superior (fresh). B. Right axillary contents including thoraco bundle (fresh). GROSS DESCRIPTION: A. Specimen received in formalin labeled with patient's name. consists of a 627 gram right mastectomy specimen oriented with short. stitch superior and long stitch lateral. Specimen measures 24 cm superior. to inferior, 23 cm medial to lateral, 4 cm anterior to posterior. Superficial skin ellipse measures 9.5 x 4 cm and displays a centrally. located inverted nipple. No scar is noted. No discharge is noted. Deep. resection margin shows scant portions of muscular tissue. Deep margin. inked black and superficial margin is inked blue. Serial sections reveal a. centrally located poorly defined firm pink white mass measuring 4.5 x 4.5. x. 2.0. cm. Periphery of the mass shows hemorrhage consistent with previous. biopsy. Mass abuts deep margin. Fibrous parenchyma surrounding mass is. nodular and cystic suggestive of additional foci. Located in the deep. margin of mid inner quadrant is a 0.4 cm firm tan ill defined nodule. consistent with possible additional lesion (located approximately 2 cm. from central lesion) . Sectioning of nipple shows dense fibrous tissue. with possible lesion involvement. Remainder of parenchyma is lobulated. yellow tan and fatty with scant fibrous tissue. No lymph nodes identified. Representative sections: A1: skin. A2: nipple. A3: mass (lateral portion). A4: mass and adjacent fibrous tissue (medial portion). Specimen #: GROSS DESCRIPTION (continued). A5: mid inner quadrant nodule with margins. A6: mass with deep margin (central). A7: upper outer quadrant. A8: lower outer quadrant. A9: lower inner quadrant. A10: upper inner quadrant . Matched sections of A1-A4 and A7-A10 are. submitted. for CBCP protocol. A11-A20 represent additional sections of mass. Remaining breast tissue is. unoriented, no sutures remain in tissue. Representative samples of lesion. beneath elliptical wedge of skin and nipple are represented. A13-A14. represent one match set. Specimen submitted. B. Received in formalin labeled with patient's name. labeled. ""RIGHT AXILLARY CONTENTS INCLUDING SARCO BUNDLE"" consists of an 11 x 6 x 3. cm irregular unoriented portion of fatty tissue. Sectioning reveals two. matted portions of soft tissue measuring 4 x 3.5 x 1.5 cm and 8 x 4 x 1.2. cm. On sectioing the cut surfaces show dense indurated fibrotic tissue. with red tan lymphoid tissue noted along periphery of the smaller portion. tissue. Single intact discrete lymph node is identified and remaining. tissue which measures 0.6 cm. Exact number of lymph nodes cannot be. determined. Representative sections are as follows: B1-B3: smaller portion of tissue. B4-B6: larger portion of tissue. B7: one bisected lymph node.",BRCA,2,"The report states that there are eight axillary lymph nodes positive for tumor, with extensive extracapsular extension identified and deposits larger than 2 mm. This meets the criteria for N2 stage in the AJCC staging system for breast cancer.",N2,15.0
1236,TCGA-E2-A1IE.95443906-A63B-4E07-8C4A-ED0A918B88F8,1,"SPECIMENS: A. SENTINEL LYMPH NODE RIGHT AXILLA #1. B. SLN RIGHT AXILLA #2. C. SLN RIGHT AXILLA #3. D. EXC. RIGHT BREAST CA. SPECIMEN(S): A. SENTINEL LYMPH NODE RIGHT AXILLA #1. B. SLN RIGHT AXILLA #2. C. SLN RIGHT AXILLA #3. D. EXC. RIGHT BREAST CA. GROSS DESCRIPTION: A. SENTINEL LYMPH NODE RIGHT AXILLA #1. Received fresh is a tan pink lymph node 0.5 x 0.5 x 0.3cm. The specimen is bisected and 2 touch preps. are taken. Toto A1. B. SLN RIGHT AXILLA #2. Received fresh is a tan pink lymph node 1.5 x 0.5 x 0.5cm. The specimen is bisected and 2 touch preps. are taken. Toto B1. C. SLN RIGHT AXILLA. Received fresh is are 3 tan pink lymph nodes ranging from 0.5cm to 1.2cm in greatest dimensions. Each specimen is bisected and touch preps are taken. Toto C1. D. EXCISION RIGHT BREAST: Single Stitch-Anterior/Double Stitch-Lateral/Triple Stitch-Superior. Received fresh is a 59g oriented tan pink WLE breast specimen, 7.0cm from superior to inferior, 6.0cm. from anterior to posterior and 5.5cm from medial to lateral. The specimen is inked as follows: Red-. Superior, Orange-inferior, Blue-Anterior, Black-Posterior, Green-Medial, Yellow-Lateral. The specimen. is serially sectioned from lateral to medial into 7 slices; slice 1 being most lateral, slice 7 being most. medial. The cut surface reveal a gray white firm well circumscribed mass 2.1 x 1.7 x 1.5cm, 0.6cm from. the closest superior margin, located in slices 3, 4 and 5. A surgical clip is identified in slice 3. The. mass is 0.9cm from the deep margin and greater than 10cm from the remaining margins. The. remaining cut surfaces reveal yellow lobulated adipose tissue interspersed with gray white fibrous. tissue. A portion of the specimen is submitted for tissue procurement. Representative sections are. submitted as follows: D1: lateral margin, perpendicular sections taken from superior to inferior, slice 1. D2: area adjacent to mass with deep margin, slice 2. D3: mass with anterior/superior margin, slice 3. D4: mass with superior/deep margin, clip identified, slice 3. D5: anterior/inferior margin, slice 3. D6: inferior/deep margin, slice 3. D7: mass with superior and anterior margin, slice 4. D8: anterior/inferior, slice 4. D9: mass with superior and deep margin, slice 4. D10: inferior/deep margin, slice 4. D11: superior/deep margin, slice 5. D12: anterior/superior margin, slice 5. D13: anterior margin, slice 5. D14: area next to mass with anterior and deep margin, slice 6. D15: anterior margin, slice 6. D16: deep margin, slice 6. D17: medial margin, perpendicular sections submitted from superior to inferior, slice 7. As per attached diagram. DIAGNOSIS: A. SENTINEL LYMPH NODE #1, RIGHT AXILLA, BIOPSY: - ONE LYMPH NODE, NEGATIVE FOR CARCINOMA (0/1). B. SENTINEL LYMPH NODE #2, RIGHT AXILLA, BIOPSY: - MICROMETASTATIC CARCINOMA (1.5 MM) IN ONE LYMPH NODE (1/1). (SEE NOTE). NOTE: The metastasis is subcapsular. No extranodal extension is seen; however, there is cautery. artifact at one edge of the metastasis limiting evaluation. The touch prep slides were reviewed and. show no evidence of metastasis. Dr. has reviewed specimen B. C. SENTINEL LYMPH NODE #3, RIGHT AXILLA, BIOPSY: - ONE LYMPH NODE, NEGATIVE FOR CARCINOMA (0/1). D. BREAST, RIGHT, WIDE LOCAL EXCISION: INVASIVE DUCTAL CARCINOMA, MODERATELY DIFFERENTIATED. (SBR GRADE 2) WITH FOCAL NECROSIS (SEE NOTE). - TUMOR MEASURES 2.1 X 1.7 X 1.5 CM. INVASIVE CARCINOMA IS 0.3 CM FROM POSTERIOR MARGIN. - LYMPHVASCULAR INVASION IS IDENTIFIED. DUCTAL CARCINOMA IN SITU (DCIS), SOLID AND CRIBRIFORM TYPES,. NUCLEAR GRADE 2-3, WITH FOCAL NECROSIS. - ATYPICAL DUCTAL HYPERPLASIA. NOTE: Microcalcifications are seen in vessels and non-neoplastic breast tissue. SYNOPTIC REPORT - BREAST. Specimen Type: Excision. Needle Localization: Laterality: Right. Invasive Tumor: Present. Multifocality: No. WHO CLASSIFICATION. Invasive ductal carcinoma, NOS 8500/3. Tumor size: 2.1cm. Additional dimensions: 1.7cm x 1.5cm. Tumor Site: 9:00. Margins: Negative. Distance from closest margin: 0.3cm. deep. Tubular Score: 3. Nuclear Grade: 2. Mitotic Score: 2. Modified Scarff Bloom Richardson Grade: 2. Necrosis: Present. Vascular/Lymphatic Invasion: Present. Lobular neoplasia: None. Lymph nodes: Sentinel lymph node only. Lymph node status: Positive 1 / 3. Micrometastases: Non-neoplastic areas: columnar cell change. DCIS present. Margins uninvolved by DCIS :0.5 cm from the superior margin. DCIS Quantity: Estimate 20%. DCIS Type: Solid. Cribriform. DCIS Location: Both associated and separate from invasive tumor mass. Nuclear grade: Intermediate. Necrosis: Present. Location of CA++: Benign epithelium. ER/PR/HER2 Results. ER: Positive. PR: Positive. HER2: Pending by FISH. Pathological staging (pTN): pT 2N1. SYNOPTIC REPORT - BREAST, ER/PR RESULTS. Specimen: Surgical Excision. Block Number: ER: Positive. Allred Score: 8. = Proportion Score 5 + Intensity Score 3. PR: Positive Allred Score: 6 = Proportion Score 3 + Intensity Score 3. COMMENT: The Allred score for estrogen and progesterone receptors is calculated by adding the sum of the. proportion score (0 = no staining, 1 = <1% of cells staining, 2 = 1 - 10% of cells staining, 3 = 11-30% of. cells staining, 4 = 31-60% of cells staining, 5 = >60% of cells staining) to the intensity score (1 = weak. intensity of staining, 2 = intermediate intensity of staining, 3 = strong intensity of staining), with a scoring. range from 0 to 8. ER/PR positive is defined as an Allred score of >2 and ER/PR negative is defined as an Allred score. of less than or equal to 2. METHODOLOGY: Tissue was fixed in 10% neutral buffered formalin for no less than 8 and no longer than 24 hours. Immunohistochemistry was performed using the mouse anti-human ER (ER 1D5, 1:100) and PR (PGR. 136, 1:100) provided by. following the manufacturer S instructions. This. assay was not modified. interpretation of the ER/PR immunohistochemical stain is guided by published. results in the medical literature, information provided by the reagent manufacturer and by internal. review of staining performance. SYNOPTIC REPORT - BREAST HER-2 RESULTS. Specimen: Surgical Excision. Block Number: Interpretation: EQUIVOCAL. Intensity: 2+. % Tumor Staining: 20%. Fish Ordered: Yes, on Date. METHODOLOGY: Tissue was fixed in 10% neutral buffered formalin for no less than 8 and no longer than 24 hours. Her2 analysis was performed using the FDA approved Dako HercepTes (TM) test kit. using rabbit anti-human HER2. This assay was not modified. External kit-slides. provided by the manufacturer (cell lines with high, low and negative HER2 protein expression) and in-. house known HER2 amplified control tissue were evaluated along with the test tissue. Adequate, well. preserved, clear-cut invasive carcinoma was identified for HER2 evaluation. Interpretation of the HER2. immunohistochemical stain is guided by published results in the medical literature, information provided. by the reagent manufacturer and by internal review of staining performance. This assay has been validated according to the 2007 joint recommendations and guidelines from. ASCO and CAP and from the NCCN HER2 testing in Breast Cancer Task Force. The L. takes full responsibility for this test's performance. PRE-OPERATIVE DIAGNOSIS: Right breast cancer. PRE-OPERTATIVE CONSULTATION: TPA/TPB/TPC: Negative for carcinoma. Diagnosis called to Dr. at. Dr. D. Gross Inspection Diagnosis: 2.1 cm tumor at 0.6cm from closest superior margin. Diagnosis called to. Dr. at. by Dr. ADDENDUM: PathVysion HER-2 DNA Probe Kit. Analytical Interpretation of Results: HER-2 NOT AMPLIFIED. Clinical Interpretation of results. Amplification of the HER-2 gene was evaluated with interphase fluorescence in-situ. hybridization (FISH) on formalin-fixed paraffin embedded tissue sections using a chromosome. 17 centromeric probe and a HER-2 probe that spans the entire HER-2 gene in the. by Dr.. A majority of tumors cells displayed 2 chromosome 17. signals and 2 HER-2 signals, with a HER-2/CEP 17 Ratio </=2.0, consistent with no. amplification of the HER2/neu gene. Block used D9. Source of case: RPCI. Tissue fixation. formalin-fixed tissue. Outside Case No: NA. Tissue source. breast Results interpreted: HER2/CEP17 ratio: 1.05. This ratio is derived by dividing the total number of LSI HER-2/neu signals by the total number of. CEP17 signals in at least 20 interphase nuclei with nonoverlapping nuclei in the neoplastic. mammary epithelial cells. Cells with no signals or with signals of only one color are disregarded. Method of ratio enumeration: manual count. Limitations. The Vysis PathVysion Kit is not intended for use to screen for or diagnose breast cancer. It is. intended to be used as an adjunct to other prognostic factors currently used to predict disease-free. and overall survival in stage II, node-positive breast cancer patients. In making decisions regarding. adjuvant CAF treatment, all other available clinical information should also be taken into. consideration, such as tumor size, number of involved lymph nodes, and steroid receptor status. treatment decision for stage II, node-positive breast cancer patients should be based on HER-. 2/neu. gene amplification status alone. Overview of this test. FDA APPROVED REAGENT. PathVysion HER-2 DNA Probe Kit is FDA approved for selection of. patients for whom Herceptin® therapy is being considered. These tests were performed in the. Institute under the direction. of. The results of these studies should always be interpreted in the context of the. clinical, morphological, and immunophenotypic diagnosis. Microscopic/Diagnostic Dictation:., Pathologist, l. Final Review:. Pathologist,. Final Review:. Pathologist. Microscopic/Diagnostic Dictation:., Pathologist,. Final Review:, Pathologist. Final:., Pathologist,. Addendum: Pathologist,. Addendum Final:. Pathologist,.",BRCA,1,"The report indicates that there is metastatic carcinoma in one of the sentinel lymph nodes (SLN Right Axilla #2) with a tumor deposit of 1.5mm. This meets the criteria for N1 stage, which is metastasis in 1 to 3 axillary lymph nodes (at least one tumor deposit greater than 2.0mm).",N1,16.0
882,TCGA-AR-A24W.0F2464F7-4108-4700-B2EC-17BC6C432D42,1,"Breast, right, total mastectomy: Infiltrating ductal carcinoma, Nottingham grade II (of III), [tubules 3/3, nuclei 2/3, mitoses 1/3;. Nottingham score 6/9], forming a 2.1 x 1.4 x 1.1 cm mass located in the central breast (AJCC pT2). Ductal carcinoma. in. situ,. intermediate nuclear grade, comprising approximately 5-25% of tumor volume. Angiolymphatic invasion is present. The non-. neoplastic breast parenchyma shows proliferative fibrocystic changes. Calcifications present in malignant ducts. Biopsy site. changes present. The tumor does not involve the nipple, overlying skin, or underlying chest wall. All surgical resection margins,. including deep margin, are negative for tumor (minimum tumor free margin, 2.1 cm, deep margin). Lymph nodes, right axillary sentinel Nos. 1A, 1B, 1C and 2, sentinel biopsy: Three (of 4) right axillary sentinel lymph nodes are. positive for metastatic carcinoma (>2.0 mm) [AJCC pN1(5n) ]. Extranodal extension is not present. Blue dye is identified in. lymph nodes Nos. 1A and 1B. Lymph node No. 1C does not contain blue dye. Lymph nodes, right axillary, dissection: Multiple (18) right axillary lymph nodes are negative for tumor. Breast, left, total mastectomy: Ductal carcinoma in situ, micropapillary and cribriform types, low nuclear grade without. intraluminal necrosis, involving an area over 5.7 x 2.3 x 1.4 cm [AJCC pTis]. The non-neoplastic breast parenchyma shows. nonproliferative fibrocystic changes. Calcifications are present in malignant ducts. Biopsy site changes are present. Nipple and. skin are without diagnostic abnormality. All surgical resection margins are negative for tumor (minimum tumor free margin, 1.5. cm, deep margin).",BRCA,1,"The report states that three out of four sentinel lymph nodes in the right axilla are positive for metastatic carcinoma with a size greater than 2.0 mm (AJCC pN1(5n)). The N stage is based solely on the number of involved axillary lymph nodes and does not consider other factors such as tumor size or distant metastasis. Therefore, the N stage for this report is N1.",N1,17.0
1004,TCGA-BH-A0DQ.D644B589-A6ED-4DCC-97D4-751E22AE3A7D,1,"P.13/33. INAL DIAGNOSIS: PART 1: BREAST, RIGHT. SEGMENTAL MASTECTOMY -. A. INFILTRATING DUCTAL CARCINOMA, NOS TYPE, MODERATELY DIFFERENTIATED,. B. THE TUMOR MEASURES 2.3 CM (GROSS MEASUREMENT), NOTTINGHAM SCORE 6/9 (TUBULES 2. NUCLEAR GRADE 2, MITOSES 2), OVERALL GRADE 2/3. c. DUCTAL CARCINOMA IN-SITU (DCIS), CRIBRIFORM TYPE WITH ASSOCIATED COMEDO NECROSIS,. NUCLEAR GRADE 2. COMPRISING 5% OF TOTAL TUMOR VOLUME AND IS PRESENT IN ASSOCIATION. WITH INVASIVE CARCINOMA. D. NO DEFINITIVE LYMPHOVASCULAR INVASION IS SEEN. E. MARGINS: THE INVASIVE CARCINOMA EXTENDS TO THE SUPERIOR MARGIN, REMAINDER OF MARGINS. ARE FREE. F. ATYPICAL DUCTAL HYPERPLASIA, FLAT EPITHELIAL ATYPIA. FIBROCYSTIC CHANGES WITH. ASSOCIATED CALCIFICATIONS, DUCTAL EPITHELIAL HYPERPLASIA, FIBROADENOMATOID NODULE AND. PREVIOUS BIOPSY SITE CHANGES. G. ER-POSITIVE, PR-POSITIVE, HER 2/NEU-NEGATIVE (IHC SCORE 0), CROSS REFER. PART 2: #1 SENTINEL LYMPH NODE, RIGHT AXILLA, BIOPSY -. A. ONE LYMPH NODE POSITIVE FOR MICRO METASTATIC CARCINOMA (1/1). B. THE METASTATIC FOCUS MEASURES 1MM (ON GLASS SLIDE), NO EXTRA CAPSULAR EXTENSION IS. IDENTIFIED. PART 3: #2 SENTINEL LYMPH NODE. RIGHT AXILLA, BIOPSY -. ONE BENIGN LYMPH NODE, NO TUMOR SEEN (0/1). PART 4: #1 NON-SENTINEL LYMPH NODE, RIGHT AXILLA, BIOPSY -. Site: breast, NOS C50.9 3/0/11 lew. CASE a NUT VIN. ONE BENIGN LYMPH NODE, NO TUMOR SEEN (0/1). LATERALITY: SYNOPTIC - PRIMARY INVASIVE CARCINOMA OF BREAST. PROCEDURE: Right. Segmental. SIZE OF TUMOR: Not specified. MULTICENTRICITY/MULTIFOCALITY OF Maximum INVASIVE dimension FOCI: invasive component: 2.3 cm. TUMOR TYPE (Invasive component): NOTTINGHAM SCORE: Ductal adenocarcinoma, NOS. Nuclear grade: 2. Tubule formation: 2. Mitotic activity score: 2. Total Nottingham score: 6. JUDD:0644B589-A6ED-4DCC-97D4-751E22AE3A70. ANGIOLYMPHATIC INVASION: Nottingham grade (1. 2, 3): 2. DERMAL LYMPHATIC INVASION: CALCIFICATION: Not applicable. TUMOR TYPE, IN SITU: Cribriform. Comedo. DCIS admixed with invasive carcinoma. SURGICAL MARGINS INVOLVED BY INVASIVE Percent of COMPONENT: tumor occupied by in situ component: 5 %. SURG MARGINS INVOLVED BY IN SITU COMPONENT: Yes, focal. LYMPH NODES POSITIVE: LYMPH NODES EXAMINED: 1. ME I MOU(S) OF LYMPH NODE EXAMINATION: 3. SENTINEL NODE METASTASIS: H/F stain. SIZE OF NODAL METASTASES: LYMPH NODE METASTASIS(-ES) 1 inm. METASTASES TO IPSILATERAL INTERNAL No MAMMARY LYMPH NODE (IF APPLICABLE): T ADH No. N STAGE, PATHOLOGIC: pT2. M STAGE, PATHOLOGIC: pN1mi. ESTROGEN RECEPTORS: pMX. PROGESTERONE RECEPTORS: positive. HER2/NEU: positive. zero or 1+.",BRCA,1,"According to the report, there is one sentinel lymph node positive for micrometastatic carcinoma (1/1) with a metastatic focus measuring 1mm and no extracapsular extension identified. This information indicates that the N stage is N1, as per the rule: 'N1: Metastasis in 1 to 3 axillary lymph nodes (at least 1 tumor deposit greater than 2.0mm).'",N1,18.0
1285,TCGA-E9-A1R0.DD0ADC20-2059-435E-9EB4-351C87D7CBEB,0,"OC ID. Gross Description: Microscopic Description: Diagnosis Details: Comments: BREAST TISSUE CHECKLIST. Specimen type: Mastectomy. Site: breast, NOS C50.9 4/8/u for. Specimen size: Not specified. Tumor site: Breast. Tumor size: 2 x 1.5 x 1.5 cm. Grossly evident lesion: Yes. Histologic type: Infiltrating ductal carcinoma. Histologic grade: Moderately differentiated. Tumor extent: Not specified. Lymph nodes: 1/12 positive for metastasis (Axillary 1/12). Extracapsular invasion of the lymph nodes: Not specified. Margins: Not specified. Nottingham Histologic Score. Tubule formation: Not specified. Nuclear pleomorphism: Not specified. Mitotic count (25x): Not specified. Mitotic count (40x): Not specified. Total Nottingham Score: Score cannot be determined. Evidence of neo-adjuvant treatment: Not specified. Additional pathologic findings: Not specified. Comments: None.",BRCA,1,"The report indicates that there is metastatic carcinoma in 1 out of 12 axillary lymph nodes, and the size of the metastasis is not specified, but it's greater than 2.0mm as per the definition of N1 stage. Therefore, the N stage is N1.",N1,19.0
995,TCGA-BH-A0DD.35FFF2A4-7956-47AC-B6B8-1AA6775E332B,1,"FINAL DIAGNOSIS: RART SENTINEL LYMPH NODE #1, RIGHT AXILLA, BIOPSY -. 1: CARCINOMA INVOLVING ONE LYMPH NODE (1/1). A. METASTATIC METASTATIC FOCUS MEASURES 3.0 CM IN GREATEST DIAMETER 0.1 (ENTIRE CM. LYMPH NODE). B. c. EXTRACAPSULAR EXTENSION IS IDENTIFIED MEASURING 0.2 X. PART 2: BREAST, LEFT, SIMPLE MASTECTOMY -. A. DUCTAL EPITHELIAL HYPERPLASIA. B. PREDOMINANTLY ADIPOSE BREAST PARENCHYMA. c. SKIN AND NIPPLE HISTOLOGICALLY UNREMARKABLE. PART 3: A. BREAST. INVASIVE RIGHT, DUCTAL MODIFIED CARCINOMA RADICAL 3.0 MASTECTOMY 3/3, CM NUCLEAR (GROSS) NOTTINGHAM PLEOMORPHISM - GRADE 2/3, MITOTIC 3 (COMBINED ACTIVITY NOTTINGHAM 3/3) WITH. TUBULE. LYMPHOPLASMACYTIC SCORE 8/9: INFILTRATE AND NECROSIS. B. DEFINITIVE LYMPHOVASCULAR. C. DUCTAL CARCINOMA IN SITU IS NOTIBENTIFIED. D. RESECTION MARGINS FREE. E. DUCTAL EPITHELIAL HYPERPLASIAL. F. G. SKIN TWENTY-TWO AND NIPPLE, LYMPH HISTOLOGICALLY NODES, NEGATIVE UNREMARKABLE FOR METASTATIC CARCINOMA (0/22). H. PATHOLOGIC STAGE (see comment): I. RECEPTOR STATUS (see comment). CASE SYNOPSIS: SYNOPTIC - PRIMARY INVASIVE CARCINOMA OF BREAST. LATERALITY: Right. PROCEDURE: Modified radical mastectomy. Upper inner quadrant. SIZE OF TUMOR: Maximum dimension invasive component: 3.0 cm. MULTICENTRICITY/MULTIFOCALITY OF INVASIVE FOCI: TUMOR TYPE (invasive component): Ductal adenocarcinoma, NOS. NOTTINGHAM SCORE: Nuclear grade: 2. Tubule formation: 3. Mitotic activity score: 3. Total Nottingham score: 8. Nottingham grade (1, 2, 3): 3. ANGIOLYMPHATIC INVASION: DERMAL LYMPHATIC INVASION: CALCIFICATION: SURGICAL MARGINS INVOLVED BY INVASIVE COMPONENT: PAGET'S DISEASE OF NIPPLE: LYMPH NODES POSITIVE: 1. LYMPH NODES EXAMINED: 23. METHOD(S) OF LYMPH NODE EXAMINATION: H/E stain. SIZE OF NODAL METASTASES: Diameter of largest lymph node metastasis: 30.0 mm. LYMPH NODE METASTASIS(-ES) WITH EXTRACAPSULAR EXTENSION: SKIN INVOLVED (ULCERATION): T STAGE, PATHOLOGIC: p12. N STAGE, PATHOLOGIC: pN1a. M STAGE, PATHOLOGIC: pMX. ESTROGEN RECEPTORS: positive. PROGESTERONE RECEPTORS: positive. HER2/NEU: 2+.",BRCA,1,"The pathology report indicates that there is metastatic carcinoma in 1 axillary lymph node, with the largest metastatic focus measuring 3.0 cm in greatest diameter. However, the N stage is based on the number of involved axillary lymph nodes and does not consider other factors such as tumor size or distant metastasis. Therefore, the N stage is N1, as per the rule: 'N1: Metastasis in 1 to 3 axillary lymph nodes (at least one tumor deposit greater than 2.0mm).'",N1,20.0
874,TCGA-AR-A24O.887F0E3A-DC70-4CD4-AAAF-3C613195D895,2,"Final Diagnosis. Breast, left, modified radical mastectomy: Multifocal lobular carcinoma with focal ductal features, Nottingham grade I (of III). forming two separate masses, 5.3 x 2.7 x 1.4 cm and 1.2 x 1.0 x 1.0 cm in the inferior and medial breast respectively (AJCC. pT3). A biopsy cavity is identified adjacent to the tumor in the medial breast. Lymphovascular space invasion is not seen. The. remaining breast parenchyma shows adenosis and duct ectasia. The nipple shows no diagnostic abnormalities. Margins of. resection are negative for tumor (closest margin is anterior/inferior, free by at least 0.8 cm). Multiple (6 of 17) left axillary lymph. nodes are involved by metastatic lobular carcinoma (AJCC pN2). Focal extracapsular extension is also present. Her-2/NEU has been ordered on paraffin embedded tissue.",BRCA,2,"The report states that 'Multiple (6 of 17) left axillary lymph nodes are involved by metastatic lobular carcinoma (AJCC pN2)'. This indicates that there are between 4-9 positive lymph nodes, which corresponds to N2 stage according to the rules provided.",N2,20.0
