Unnamed: 0,patient_filename,t,text,type,n,cmem_n_reasoning,cmem_n_ans_str,cmem_n_num_update
806,TCGA-AO-A0JM.3023C34B-CF59-43EA-9241-33B738D19B05,1,"Clinical Diagnosis & History: y/o female with right lower inner quadrant carcinoma IDC/DCIS with. microcalcifications, Right 3:00 => IDC poorly differentiated; DCIS with. microcalcification. Specimens Submitted: 1: SP: Senitnle node #1, level one, right axilla (fp). 2: SP: Sentinel node #2, level one, right axilla (fi. 3: SP: Sentinel node #3, level two, right axilla (fs. 4: SP: Right breast and axillary contents levels 1, 2 and 3. DIAGNOSIS: 1). LYMPH NODE, SENTINEL #1 LEVEL I RIGHT AXILLA; BIOPSY: METASTATIC CARCINOMA IN ONE OUT OF SIX LYMPH NODES (1/6). - THERE IS NO EXTRANODAL EXTENSION OF CARCINOMA. 2). LYMPH NODE, SENTINEL #2 LEVEL I RIGHT AXILLA; BIOPSY: - METASTATIC CARCINOMA IN ONE OF ONE LYMPH NODE (1/1) (SEE NOTE). - NO EXTRANODAL EXTENSION SEEN. NOTE: THE METASTASIS IS PRESENT ON DEEPER LEVEL PERMANENT SECTION ONLY. 3). LYMPH NODE, SENTINEL #3 LEVEL II RIGHT AXILLA; BIOPSY: - TWO BENIGN LYMPH NODES (0/2). 4). BREAST AND AXILLARY CONTENTS, RIGHT LEVELS I, II, AND III;. MASTECTOMY: - MULTIPLE FOCI OF INVASIVE DUCTAL CARCINOMA, NOS TYPE, HISTOLOGIC. GRADE III/III (SLIGHT OR NO TUBULE FORMATION) NUCLEAR GRADE III/III (MARKED. VARIATION IN SIZE AND SHAPE), RANGING IN SIZE FROM 0.1 CM UP TO 3 CM. - DUCTAL CARCINOMA IN SITU (DCIS) IS ALSO IDENTIFIED, SOLID, CRIBRIFORM, AND. MICROPAPILLARY TYPES WITH HIGH NUCLEAR GRADE AND MODERATE NECROSIS. - LOBULAR INVOLVEMENT BY DCIS IS PRESENT. - THE DCIS CONSTITUTES >= 25% OF THE TOTAL TUMOR MASS, AND IS PRESENT. ADMIXED WITH AND AWAY FROM THE INVASIVE COMPONENT. - THE INVASIVE CARCINOMA IS LOCATED IN THE LOWER OUTER QUADRANT AND LOWER. INNER QUADRANT. - THE DCIS IS LOCATED IN THE LOWER OUTER QUADRANT AND LOWER INNER QUADRANT. - DCIS INVOLVES THE LARGE LACTIFEROUS DUCTS. - CALCIFICATIONS ARE PRESENT IN BOTH THE IN SITU AND INVASIVE CARCINOMA. - VASCULAR INVASION IS PRESENT. - NO INVOLVEMENT OF THE SURGICAL MARGINS BY INVASIVE CARCINOMA IS. IDENTIFIED. - RARE FOCI OF DCIS/IN SITU CARCINOMA ARE CLOSE (1 MM) TO THE FOLLOWING. SURGICAL MARGIN: DEEP. - NO SKIN INVOLVEMENT BY CARCINOMA IS IDENTIFIED. - THE ATTACHED SKELETAL MUSCLE IS NEGATIVE FOR TUMOR. - THE NON-NEOPLASTIC BREAST TISSUE SHOWS BIOPSY SITE CHANGES. - THE LYMPH NODE STATUS IS AS FOLLOWS (EXPRESSED AS THE NUMBER OF POSITIVE. LYMPH NODES IN RELATION TO THE TOTAL NUMBER OF LYMPH NODES EXAMINED) : LEVEL. I: 0/13; LEVEL II: 0/9; AND LEVEL III: 0/2. RESULTS OF SPECIAL STAINS (ER, PR, HER2-NEU) WILL BE REPORTED AS AN. ADDENDUM. I ATTEST THAT THE ABOVE DIAGNOSIS IS BASED UPON MY PERSONAL EXAMINATION OF. THE SLIDES (AND/OR OTHER MATERIAL), AND THAT I HAVE REVIEWED AND APPROVED. THIS REPORT. El .conically Signed Out. Special Studies: Special Stain. Comment. ER-C. PR-C. HER2-C. IMM RECUT. NEG CONT. Gross. MD. 1). The specimen is received fresh for frozen section consultation,. labeled ""Sentinel node number one, level 1, right axilla"" and consists of 7. lymph nodes and measure 3.5 x 2.6 x 1.0 cm in aggregate. One lymph node is. blue and has been bisected, and the lymph nodes are entirely submitted in. two cassettes. Summary of sections: FSCA- frozen section control A. FSCB--frozen section control B. 2) The specimen is received fresh for frozen section consultation,. labeled ""Sentinel node number two, level 1, left axilla"" and consists of a. soft lymph node measuring 0.6 x 0.5 x 0.5 cm, bisected and entirely. submitted for frozen section. Summary of sections: FSC-frozen section control. PA. 3). The specimen is received fresh for frozen section consultation,. labeled ""Sentinel node number three, level 2, right axilla"" and consists of. two soft tan lymph nodes totaling 2.0 x 1.2 x 0.6 cm, entirely submitted for. frozen section. Summary of sections: FSC-frozen section control. MD. 4). The specimen is received fresh in a container, labeled ""Right breast and. axillary contents levels 1, 2 and 3 with tags attached"". The specimen. consists of a mastectomy measuring 30 x 19 x 3 cm. That axillary tail. measures 13 x 8 x 2 cm. The overlying ellipse of skin measures 10 x 3 cm. No scar can be identified on the skin. The nipple measures 1 x 1 cm and it. is grossly unremarkable. The deep resection margin is inked blue. The. specimen is serially sectioned revealing a pinkish red, relatively. well-circumscribed and firm lesion measuring 3 x 1.5 x 1 cm which closely. abuts the inked resection margin. The lesion is 2 cm away from the skin. The lesion is located in the lower inner quadrant. Surrounding the lesion,. are areas of fibrosis which show punctate areas of cheesy necrosis. Away. from this lesion, in the lower outer quadrant is a vaguely defined area of. fibrosis and nodularity. Approximate measurements of this area are 10 x 6. cm. The upper inner and outer quadrants show mainly fatty tissue. An. axillary dissection is performed revealing 3 level one lymph nodes, 4 level. two lymph nodes and 2 level three lymph nodes. Summary of sections: TRM-tumor in relation to inked resection margin. TRS-tumor in relation to skin. LIQ-lower inner quadrant. LOQ-lower outer quadrant. UOQ-upper outer quadrant. UIQ-upper inner quadrant. N-nipple. L1-level one lymph nodes. L2-level two lymph nodes. L3-level three lymph nodes. Summary of Sections: Part 1: SP: Senitnle node #1, level one, right axilla (fa). Block. Sect. Site. PCs. 1. {not entered}. 1. 1. fsc. 1. Part 2: SP: Sentinel node #2, level one, right axilla (fs). Block. Sect. Site. PCs. 1. fsc. 1. Part 3: SP: Sentinel node #3, level two, right axilla (fs). Block. Sect. Site. PCs. 1. fsc. Part 4: SP: Right breast and axillary contents levels 1, 2 and 3. Block. Sect. Site. PCs. 1. 11. 1. 1. 12. 1. 1. 13. 1. 11. lig. 11. 15. log. 15. 1. n. 1. 3. trm. 3. 1. trs. 1. 1. uiq. 1. 1. uoq. 1. Procedures/Addenda. Addendum. Date Complete: Addendum Diagnosis. ADDENDUM. SITE; RIGHT BREAST. PART #4. ER: 90% OF NUCLEAR STAINING WITH MODERATE INTENSITY. PR: 1% OF NUCLEAR STAINING WITH MODERATE TO WEAK INTENSITY. HER2/NEU (HERCEPTEST) : POSITIVE (STAINING INTENSITY OF 3+). MD. Intraoperative Consultation: Note: The diagnoses given in this section pertain only to the tissue sample. examined at the time of the intraoperative consultation. Page 5 of. 5. 1). FROZEN SECTION DIAGNOSIS: METASTATIC CARCINOMA (SLIDE B) . PERMANENT DIAGNOSIS: SAME. 2). FROZEN SECTION DIAGNOSIS: NEGATIVE LYMPH NODE. PERMANENT DIAGNOSIS: SEE FINAL DIAGNOSIS. 3). FROZEN SECTION DIAGNOSIS: NEGATIVE LYMPH NODE. PERMANENT DIAGNOSIS: SAME.",BRCA,1,"Based on the pathology report, there are a total of 24 lymph nodes examined, with metastatic carcinoma found in 2 out of 24 (2/24). This indicates that there is involvement of 1-3 axillary lymph nodes, which corresponds to N1 stage based on Rule 3 and New Rule 11.",N1,11.0
1228,TCGA-E2-A1AZ.4E233F7D-035A-44A0-A5B6-6248357EB7B2,1,"SPECIMENS: A. SENTINEL LMYPH NODE LEFT AXILLA #1. B. SLNODE LEFT AXILLA 2. C. SLNODE 3. D. WIDE EXCISION LEFT BREAST. E. ADDITIONAL DEEP MARGIN. F. ADDITIONAL MEDIAL MARGIN. DIAGNOSIS: A. LYMPH NODE, SENTINEL #1, LEFT AXILLARY, RESECTION: -MICROMETASTATIC CARCINOMA TO ONE OF ONE LYMPH NODE (1/1). B. LYMPH NODE, SENTINEL #2, LEFT AXILLARY, RESECTION: -ONE LYMPH NODE, NEGATIVE FOR METASTASIS (0/1). C. LYMPH NODE, SENTINEL #3, LEFT AXILLARY, RESECTION: -ONE LYMPH NODE, NEGATIVE FOR METASTASIS (0/1). D. BREAST/LEFT, RESECTION: INVASIVE DUCTAL CARCINOMA, SBR GRADE III/III. -TUMOR SIZE: 3.3x2.6x2.5 CM. -MARGINS FREE OF TUMOR. -SEE TEMPLATE. FIBROCYSTIC CHANGES WITH APOCRINE METAPLASIA, SCLEROSING AND BLUNT DUCT. ADENOSIS. E. BREAST, ADDITIONAL DEEP MARGIN, RESECTION: -BREAST TISSUE, NEGATIVE FOR TUMOR. F. BREAST, ADDITIONAL MEDIAL MARGINS, RESECTION: -BENIGN BREAST TISSUE WITH SCLEROSING ADENOSIS AND FOCAL ATYPICAL DUCTAL. HYPERPLASIA. Invasive Breast Cancer Template. INVASIVE TUMOR: Histologic type: Ductal. Tumor Size : 3.3x2.6x2.5 cm. Size of Invasive Focus: 3.3x2.6x2.5 cm. Grade, Histologic: 3. Grade, Nuclear: 3. Mitoses : 3. Scarff Bloom Richardson grade: III. Necrosis: present. Invasion Vasc/Lymphatic: present. DCIS component. DCIS Quantity: <25%. DCIS Type: solid. DCIS Location: Inside main mass. Nuclear grade: high. Necrosis: absent. Margins: Negative. Lymph nodes: Positive (1/3). Micrometastases: Yes. Extranodal extension: no. Stage, Pathology : pT2N1a (see below). Non-neoplastic areas: Fibrocystic changes with sclerosing and blunt duct adenosis. Hormone receptor status & HERCEPTEST: Previously done,. SPECIMEN(S): A. SENTINEL LMYPH NODE LEFT AXILLA #1 B. SLNODE LEFT AXILLA 2 C. SLNODE 3 D. WIDE. EXCISION LEFT BREAST E. ADDITIONAL DEEP MARGIN F. ADDITIONAL MEDIAL MARGIN. CLINICAL HISTORY: year old with left breast ca. FROZEN SECTION DIAGNOSIS: A. SENTINEL LYMPH NODE LEFT AXILLA #1. Touch Prep: Negative by Dr., called to Dr at. B. SENTINEL LYMPH NODE LEFT AXILLA #2. Touch Prep: Negative by Dr., called to Dr al. C. SENTINEL LYMPH NODE #3. Touch Prep: Negative by Dr., called to Dr. a. GROSS DESCRIPTION: A. SENTINEL LYMPH NODE LEFT AXILLA #1. Received fresh is a 1.8x0.9x0.8cm. lymph node. The lymph node is bisected to reveal tan pink. homogenous cut surface. Touch preparation is made. The specimen is submitted in toto in one. cassette. B. SENTINEL LYMPH NODE LEFT AXILLA #2. Received fresh are two pieces of tan pink soft tissue measuring 0.4x0.4x0.3cm. each. One of them is. recognized as lymph node which is bisected. Touch preparations are made. The specimen is submitted. in toto in one cassette. C. SENTINEL LYMPH NODE #3. Received fresh is one lymph node measuring 1.3x0.8x0.3cm. It is bisected. Touch preparations are. made. The specimen is submitted in toto in one cassette. D. WIDE EXCISION LEFT BREAST. Received fresh is an oriented portion of firm breast tissue measuring 7.5x7x4.5cm. The specimen is. inked and sectioned to reveal a 3.3x2.6x2.5cm. white firm tumor mass, located 0.5cm. from the. posterior margin, 1.5cm. from superior margin, 0.4cm. from the medial margin, 0.7cm. from the inferior. margin. One section from the tumor is submitted for tissue procurement. A separate white nodule. measuring 0.3cm. in diameter is located 1.2cm. from the main tumor mass. This nodule is .1cm. from. the medial margin. Representative sections are submitted as follows: D1-D4: tumor mass with adjacent margin, representative. D5: separate nodule in toto. D6-D9: representative sections from normal looking breast tissue. E. ADDITIONAL DEEP MARGIN. Received in formalin is an unoriented portion of breast tissue measuring 2.2x2.5x1.5cm. The specimen. is inked and serially sectioned to reveal tan yellow lobulated cut surface. No gross lesion is identified. Representatives are submitted in two cassettes. F. ADDITIONAL MEDIAL MARGIN. Received in formalin is one fragment of tan yellow to pink soft to firm tissue measuring 2.7x2x1.5cm. The specimen is inked and serially sectioned to reveal tan fibrotic cut surface. No gross lesion is. identified. The specimen is submitted in toto in two cassettes. Microscopic/Diagnostic Dictation: Pathologist,. Microscopic/Diagnostic Dictation: Pathologist,. Final Review: Pathologist,. Final: Pathologist,.",BRCA,1,"Based on the report, there is micrometastatic carcinoma in one of the three sentinel lymph nodes (1/3). This corresponds to N1 stage according to Rule 11, which states that N# stage indicates the number of axillary lymph nodes involved in breast cancer, with or without extracapsular extension.",N1,12.0
1285,TCGA-E9-A1R0.DD0ADC20-2059-435E-9EB4-351C87D7CBEB,0,"OC ID. Gross Description: Microscopic Description: Diagnosis Details: Comments: BREAST TISSUE CHECKLIST. Specimen type: Mastectomy. Site: breast, NOS C50.9 4/8/u for. Specimen size: Not specified. Tumor site: Breast. Tumor size: 2 x 1.5 x 1.5 cm. Grossly evident lesion: Yes. Histologic type: Infiltrating ductal carcinoma. Histologic grade: Moderately differentiated. Tumor extent: Not specified. Lymph nodes: 1/12 positive for metastasis (Axillary 1/12). Extracapsular invasion of the lymph nodes: Not specified. Margins: Not specified. Nottingham Histologic Score. Tubule formation: Not specified. Nuclear pleomorphism: Not specified. Mitotic count (25x): Not specified. Mitotic count (40x): Not specified. Total Nottingham Score: Score cannot be determined. Evidence of neo-adjuvant treatment: Not specified. Additional pathologic findings: Not specified. Comments: None.",BRCA,1,"Based on the report, there is 1 out of 12 axillary lymph nodes involved (Axillary 1/12), which matches the criteria for N1 stage as per Rule 3 and New Rule 11.",N1,13.0
1348,TCGA-EW-A1P3.042304AE-706A-4033-A97F-3765A6AEC649,1,"F. Pathologic Interpretation: A. Sentinel node #1, left side, CT. ouch prep: - No tumor seen in one lymph node (0/1). - Immunohistochemistry for Keratin to follow. B. Left/breast 1 stitch superior, 2 stitches lateral: - Invasive, moderately differentiated ductal carcinoma, intermediate nuclear grade, 0.5 cm. - Specimen margins are negative (see tumor summary). - Fibroadenoma, 0.5 cm. C. Sentinel node #1, right side CT. - No tumor seen in two lymph nodes (0/2). - Immunohistochemistry for Keratin to follow. D. Non-sentinel lymph node right side: - No tumor seen in one lymph node (0/1). E. Sentinel lymph node #2, right side, CT #. touch prep: - No tumor seen in one lymph node (0/1). - Immunohistochemistry for Keratin to follow. F. Right breast additional superior flap: - No tumor seen in adipose tissue. G. Right breast 1 stitch superior, 2 stitches lateral: - Invasive, moderately differentiated ductal carcinoma, intermediate nuclear grade, 2.5 cm, extending within 0.1 cm of the. anterior specimen margin (see tumor summary). TUMOR SUMMARY ""B"": Specimen Type: Mastectomy. Lymph Node Sampling: Sentinel lymph node(s) only. Laterality: Left. Tumor Site: Upper inner quadrant. Size of Invasive Component: Greatest dimension: 0.5 cm. Histologic Type: Invasive ductal carcinoma. Histologic Grade: Tubule Formation: Moderate 10% to 75% (score =2). Nuclear Pleomorphism: Moderate increase in size, etc (score =2). Mitotic Count: 10 to 20 mitoses per 10 HPF (score = 2). Total Nottingham Score: Grade II: 6-7 points. Pathologic Staging (pTNM). Primary Tumor: pT1a. Regional Lymph Nodes: pNO. Number examined: 1. Number Involved: 0. Distant Metastasis: pMX. Margins: Margins uninvolved by invasive carcinoma. Venous/Lymphatic Invasion: Absent. TUMOR SUMMARY ""G"": Specimen Type: Mastectomy. Lymph Node Sampling: Sentinel lymph node with axillary dissection. Laterality: Right. Tumor Site: Lower outer quadrant. SURGICAL PATHOL Report. Size of Invasive Component: Greatest dimension: 2.5 cm. Histologic Type: Invasive ductal carcinoma. Histologic Grade: Tubule Formation: Minimal less than 10% (score =3). Nuclear Pleomorphism: Moderate increase in size, etc (score = 2). Mitotic Count: Less than 10 mitoses per 10 HPF (score =1). Total Nottingham Score: Grade II: 6-7 points. Pathologic Staging (pTNM). Primary Tumor: pT2. Regional Lymph Nodes: pNO. Number examined: 4. Number Involved: 0. Distant Metastasis: pMX. Margins: Margins uninvolved by invasive carcinoma. Distance from closest margin: 1.0 mm. Specify which margin: Anterior. Venous/Lymphatic Invasion: Absent. not with require formain or molecular freed, paramfn embedded tissue Detection is by LSAB. The results are read by a pathologier as positive or negative. NOTE: Some FDA immunohistochemical approval. These clones are used: ID5-ER, PgR 636-PR, A486-HER2, H-11=EGFR, CCH2/DOG9=CMV, F39.4. 1-AR and HPV by ISH. AII immunohistochemical. antibodies are analyte specific reagents (ASRs) validated by our laboratory (Her 2. Parvo, H. pylori, HScore). These ASRs are clinically useful indicatora stains are that used do. , MD. As the attending pathologiet, I attest that I: (0 Examined the relevant. preparation(s) for the specimen(s); and (ii) Rendered the diagnosis(es). Procedures/Addenda. Addendum. Date Complete: Addendum Diagnosis. A. Immunohlstochemistry for Keratin is negative for tumor. C. Immunohistochemistry for Keratin is negative for tumor. E. Immunohistochemistry for Keratin is negative for tumor. MD. Intraoperative Consultation. A (FS): No malignancy seen in one lymph node (0/1). C (FS): No malignancy seen in two lymph nodes examined (0/2). E (FS): No malignancy seen in one lymph node examined (0/1). MD. Clinical History: SURGICAL PATHOL Report. Patient is a. female with right infiltrate ductal carcinoma. Specimen(s) Received: A: Sentinel node #1, left side, ct ;. ouch prep (FS). B: Left Breast 1 stitch superior, 2 stitches lateral, fresh. C: Sentinel node #1, right side ct 1 (FS). D: Non-sentinel lymph node right side. E: Sentinel lymph node #2, Right side, ct #. touch prep (FS). F: Right breast additional superior flap - perm. G: Right breast 1 stitch superior, 2 stitches lateral fresh. Gross Description: A. Received fresh and labeled ""sentinel node #1, left side, ct. touch prep (FS)"" is a segment of tan-yellow, fibroadipose. tissue measuring 2.5 x 1.1 x 0.5 cm. Cassettes are submitted as follows: 1. One lymph node bisected submitted in toto for frozen section. 2. Remainder adipose tissue submitted in toto in one cassette. B. Received fresh and labeled ""left breast 1 stitch superior, 2 stitches lateral"" is a mastectomy specimen, which measures. 22.0 x 19.0 x 4.0 cm and weighs 790.0 grams. The specimen has an attached ellipse of paie-tan skin with areola and. nipple measuring 9.0 x 4.5 cm. The skin and nipple are unremarkable. The specimen is oriented by one stitch superior. and two stitches lateral. Surgical margins are inked as follows: superior anterior margin inked in green and the remaining. margins are inked in black. Serial section through the specimen revealed one suspicious area of pale-pink induration. consistent with previous biopsy site. The indurated area measures approximately 1.1 cm in greatest dimension and is. located in the upper inner quadrant at 11 to 12 o'clock, 0.8 cm from the superficial margin, 0.9 cm from the deep margin,. 3.0 cm from the superior margin, 16.0 cm from the inferior margin, 3.5 cm from the medial margin and 12.0 cm from the. lateral margin. An area of interparenchyma hemorrhage is also identified in the inner upper quadrant, approximately 5.0. cm from the nipple. An additional suspicious area of pale-pink Induration with a granular, cut surface is identified in the. lower outer quadrant at approximately 4 o'clock. The second suspicious area is located 2.6 cm away from the deep. margin, 1.8 cm away from the superficial margin, 10.5 cm away from the superior margin, 8.5 cm away from the inferior. margin, 4.5 cm away from the lateral margin and 13.5 cm away from the medial margin. Cassettes are submitted as. follows: 1. Superficial margin. 2. Deep margin. 3. Superior margin. 4. Inferior margin. 5. Medial margin. 6. Lateral margin. 7-13. Suspicious area and surrounding parenchyma submitted in toto. 14. Section of the hemorrhagic area. 15. Sections of the second suspicious area. 16. Section of the nipple. 17. Representative section of uninvolved breast parenchyma in the upper outer quadrant. 18. Representative section of uninvolved parenchyma in the upper inner quadrant. 19. Representative section of uninvolved parenchyma in the lower inner quadrant. 20. Representative section of uninvolved parenchyma in the lower outer quadrant. C. Received fresh and labeled ""sentinel node #1, right side. is a segment of tan-yellow, fibroadipose tissue. measuring 2.0 x 1.3 x 1.0 cm. Examinations of the specimen revealed two possible lymph nodes. Cassettes are submitted. as follows: 1. One lymph node bisected and submitted for frozen section. 2. One lymph node bisected submitted for frozen section. 3. Remainder of the adipose tissue submitted for frozen section in one cassette. D. Received in formalin and labeled ""non-sentinel lymph node right side""is a segment of tan-white, soft tissue measuring 1.8. x 0.7 x 0.4 cm. The specimen is bisected and submitted in toto in one cassette. SURGICAL PATHOL Report. E. Received fresh and labeled ""sentinel lymph node #2, right side, c' buch prep (FS)"" is a segment of tan-yellow,. fibroadipose tissue measuring 2.1 x 1.1 x 0.6 cm. Examinations of the segment revealed one lymph node. Cassettes are. submitted as follows: 1. One lymph node bisected and submitted for frozen section. 2. F. Received in formalin and labeled ""right breast additional superior flap"" is a segment of tan-yellow, fibroadipose tissue. measuring 6.0 x 3.7 x 1.6 cm. The specimen is received unoriented. One of the surface is rough, irregular and appears. to. face the previous resection site. The surface was inked in orange. The opposite surface was inked in black. Serial. sections through the specimen revealed no suspicious areas. Representative sections submitted in six cassettes. G. Received fresh and labeled ""right breast 1 stitch superior, 2 stitches lateral"" is a mastectomy specimen, which measures. 23.0 x 22.0 x 4.0 cm and weighs 670.0 grams. There is an ellipse of skin with areola and nipple, which measures 9.0 x 3.5. x 0.2 cm. The nipple measures 1.2 x 1.1 cm. The skin is unremarkable. The section margins are inked as follows: superior, green and all other margins are inked in black. Serial section through the specimen revealed an area of pale-. pink induration measuring 2.5 x 1.4 x 1.2 cm and is located in the lower outer quadrant. A firm area is present at the. superficial margin and is located 3.0 cm from the inferior margin, 2.5 cm from the deep margin and 7.0 cm from the. superior margin. The remainder of the parenchyma consists of unremarkable fibroadipose tissue with approximately 70%. adipose tissue and 30% stroma. No other suspicious areas were identified. Cassettes are submitted as follows: 1. Anterior margin. 2. Inferior margin. 3. Deep margin. 4. Lateral margin. 5. Superior margin. 6. Medial margin. 7-13. Area of induration submitted. 14. Representative section of uninvolved parenchyma in the upper outer quadrant. 15. Representative section of uninvolved parenchyma in the upper inner quadrant. 16. Representative section of uninvolved parenchyma in the lower inner quadrant. 17. rative section of uninvolved parenchyma in the lower outer quadrant near the lesion. ICD-9(s): 174.2 174.5.",BRCA,0,"Based on the report, there is no evidence of regional lymph node metastasis in either the left or right breast. The left breast had 1 sentinel lymph node examined with no tumor found, and the right breast had 4 lymph nodes examined with no tumor found. Therefore, the N stage is N0.",N0,14.0
746,TCGA-AN-A04C.045B2852-E1FF-4376-8F39-60FC940224D0,1,Sex: Female. Diagnosis: Breast Cancer Histological description: Infiltrative ductal carcinoma. Anatomic Site: Left Breast Tumor location: Primary. Tissue Specification: Tumor Specimen Matrix: Tissue Specimen Format: OCT. Container: block Type of Procurement: Radical mastectomy Grade: 2. T Stage: 2 N Stage: 1 M Stage: 0 Treatment: none. Treatment Details: n/a. Normal Sample. Anatomic Site: Blood Sample Type: Normal Type of Procurement: blood draw. Matrix: Blood Specimen Format: frozen Container: tube.,BRCA,1,"According to the report, the N stage is 1, which indicates involvement of 1-3 axillary lymph nodes, with or without extracapsular extension (Rule 3).",N1,15.0
1279,TCGA-E9-A1NE.CF6E29A2-FAE6-45BB-B625-33877887A89E,1,"BREAST TISSUE CHECKLIST. Specimen type: Excision of tumor. Specimen size: Not specified. Tumor site: Breast. Tumor size: 3.5 x 3.5 X 3.5 cm. Grossly evident lesion: Yes. Histologic type: Infiltrating ductal and lobular carcinoma. Histologic grade: Tumor extent: Not specified. Lymph nodes: 1/2 positive for metastasis (Axillary 1/2). Extracapsular invasion of the lymph nodes: Not specified. Right, lower. Margins: Not specified. outer. quadrant. Nottingham Histologic Score. Tubule formation: Not specified. Nuclear pleomorphism: Not specified. Mitotic count (25x): Not specified. Mitotic count (40x): Not specified. Total Nottingham Score: Score cannot be determined. Evidence of neo-adjuvant treatment: Not specified. Additional pathologic findings: Not specified. Comments: None.",BRCA,1,"Based on the report, 1 out of 2 examined axillary lymph nodes were positive for metastasis. According to the rules provided, this falls under N1 stage, which indicates involvement of 1-3 axillary lymph nodes, with or without extracapsular extension.",N1,16.0
