Unnamed: 0,patient_filename,t,text,type,n,cmem_n_reasoning,cmem_n_ans_str,cmem_n_num_update
1368,TCGA-EW-A423.0BB6CAC8-CE26-461F-A9FE-46E28E96A368,1,"Laboratory. Collected: xx. F. Received: xx. Reported: xx. Pathologic Interpretation: A. LEFT BREAST NEEDLE LOCALIZATION LUMPECTOMY: INVASIVE LOBULAR CARCINOMA with pleomorphic features, Nottingham grade 2 (3+2+2=7), measuring. 2. cm. PLEOMORPHIC LOBULAR CARCINOMA IN SITU is present. Prior biopsy site present. The invasive carcinoma is 0.1 cm from inferior and lateral margins (green, orange). B. HOT SPOT #1, AXILLAI, CT-xxx: One lymph node, negative for carcinoma (0/1). C. HOT SPOT #1, AXILLAI CT -xxx: One lymph node, negative for carcinoma (0/1). Note: Receptor studies and keratin stains to follow. See Tumor Summary. Surgical Pathology Cancer Case Summary. Procedure: Excision with wire-guided localization. Lymph Node Sampling: Sentinel lymph nodes. Specimen Integrity: Single intact specimen (margins can be evaluated). Specimen Size (for excisions less than total mastectomy): Greatest dimension: 5 cm. Additional dimensions: 4.5 x 3.5 cm. Specimen Laterality: Left. Tumor Size: Size of Largest Invasive Carcinoma: Greatest dimension of largest focus of invasion: 2 cm. Tumor Focality: Single focus of invasive carcinoma. Macroscopic and Microscopic Extent of Tumor: Skin: Skin is not present. Skeletal Muscle: No skeletal muscle present. Ductal Carcinoma in Situ (DCIS): No DCIS is present. Lobular Carcinoma in Situ (LCIS): Present (pleomorphic type). Histologic Type of Invasive Carcinoma: Invasive lobular carcinoma (pleomorphic type). Histologic Grade: Nottingham Histologic Score: Glandular (Acinar)/Tubular Differentiation. Score 3: < 10% of tumor area forming glandular/tubular structures. Nuclear Pleomorphism. Score 2: Cells larger than normal with open vesicular nuclei, visible nucleoli, and moderate. variability in both size and shape. Mitotic Count: Score 2. Overall Grade: Grade 2. Margins: Margins uninvolved by invasive carcinoma. Distance from closest margin: 1 mm. Distance from superior margin: > 5 mm. Distance from inferior margin: 1 mm. Distance from anterior margin: > 5 mm. Distance from posterior margin: > 5 mm. Distance from medial margin: 4 mm. Distance from lateral margin: 1 mm. Treatment Effect: Response to Presurgical (Neoadjuvant) Therapy: In the Breast: No known presurgical therapy. Lymph-Vascular Invasion: Not identified. Lymph Nodes: Number of sentinel lymph nodes examined: 2. Total number of lymph nodes examined (sentinel and nonsentinel): 2. Number of lymph nodes with macrometastases (> 0.2 cm): 0. Number of lymph nodes with micrometastases (> 0.2 mm to 0.2 cm and/or > 200 cells): 0. Number of lymph nodes with isolated tumor cells (s 0.2 mm and S 200 cells): 0. Method of Evaluation of Sentinel Lymph Nodes: Hematoxylin and eosin (H&E), one level. Pathologic Staging (pTNM): Primary Tumor (pT): pT2: Tumor > 20 mm but 50 mm in greatest dimension. Regional Lymph Nodes (pN): pNO: No regional lymph node metastasis identified histologically. Distant Metastasis (pM): Not applicable. Ancillary Studies (performed on another specimen: xxxx): Estrogen Receptor: POSITIVE (> 50%). Progesterone Receptor: NEGATIVE (less than 1% immunoreactive cells present). HER2/neu Immunoperoxidase Studies: NEGATIVE (CISH: NOT AMPLIFIED). NOTE: Some immunohistochemical antibodies are analyte specific reagents (ASRs) validated by our laboratory (Her 2, Parvo, H. pylori, HBcore). These ASRs are clinically. useful indicators that do not require FDA approval. These clones are used: ID5=ER, PgR 636=PR, A485=HER2, H-11=EGFR, CCH2/DDG9=CMV, F39.4 1=AR and HPV. ISH. Allimmunohistochemical stains are used with formalin or molecular fixed, paraffin embedded tissue. Detection is by LSAB. The results are read by a pathologist as positive. or negative. Procedures/Addenda. Addendum. Date Complete: xx. Addendum Diagnosis. A. LEFT BREAST NEEDLE LOCALIZATION LUMPECTOMY: Immunohistochemical studies were performed on formalin fixed tissue with the following results for [invasive. carcinoma/DCIS/metastatic carcinoma] (block xx): Estrogen receptor. POSITIVE ( > 90%). Progesterone receptor. PgR 636. POSITIVE (1-10%). HER-2/neu (c-erb-B2). NEGATIVE 0. B. HOT SPOT #1, AXILLA I, CT-xx: Immunohistochemical studies were performed on formalin fixed tissue with the following results for metastatic. carcinoma (block B): Keratin: NEGATIVE (see note). Note: A single cell that appears to be keratin positive is present in the subcapsular space. However, the nuclear size. and morphology of this cell is different than the primary tumor cells. Selected slides were reviewed with Dr. XX and. concurs with the diagnosis. C. HOT SPOT #1, AXILLAI CT -xx: Immunohistochemical studies were performed on formalin fixed tissue with the following results for metastatic. carcinoma (C): Keratin: NEGATIVE. Interpretation Guidelines: For hormone receptor immunohistochemical analysis, the percent of immunoreactive. nuclei in the invasive or in-situ carcinoma is assessed manually by light microscopic examination and reported as. follows: Positive: greater than or equal to 1 percent of nuclei immunoreactive. Negative: less than 1 percent of nuclei immunoreactive. Non-neoplastic mammary epithelial cells are immunoreactive for estrogen and progesterone receptors (internal. control). For HER2/neu immunohistochemical analysis, the cell membrane staining is assessed manually by light microscopic. examination. Cytoplasmic immunoreactivity alone is scored as a negative result. Reference #1: XX. Reference #2: XX. Clinical History: Infiltrating lobular cancer in left breast. Please evaluate margins of lumpectomy. If sentinel nodes are negative, do. immunohistochemistry. Specimen(s) Received/Processing Information: Fee Codes: A: Left breast lumpectomy, 1 suture superficial margin, 2 suture medial, 3 suture. inferior H&E, Initial x 1, H&E, Initial x 1, H&E, Initial x 1, H&E, Initial x 1, H&E, Initial x 1,. H&E, Initial x 1, H&E, Initial x 1, H&E, Initial x 1, H&E, Initial x 1, Estrogen Receptor (ER) x 1,. Progesterone Receptor x 1, CERbB2, HER2/neu x 1. B: Hot spot #1, axilla I, CT-356 H&E, Initial x 1, unstained x 1, unstained x 1, unstained x. 1, unstained x 1, Desmin 33 x 1. C: Hot spot #1, axilla I CT -473 H&E, Initial x 1, unstained x 1, unstained x 1, unstained x. 1, unstained x 1, Cytokeratin Cocktail (KER) x 1. Gross Description: A. Received fresh and labeled ""Left breast lumpectomy"" is a yellow-tan irregular-shaped lumpectomy,. measuring 5.0 x 4.5 x 3.5 cm and weighing 35.0 grams. The specimen is inked as follows: superior. margin. inked blue, inferior margin inked green, medial margin inked red, lateral margin inked orange,. anterior/superficial margin inked yellow and deep margin inked black. Sections reveal an ill-defined area with. firm to hard consistency, 2.0 x 2.0 x 1.5 cm. This area is located toward the medial to posterior resection. margin at 0.2 to 0.3 cm from the deep resection margin (nearest), 0.3 cm from the inferior resection margin,. 3.0 cm from lateral resection margin, 2.0 cm from the superior resection margin, 1.0 cm from the superficial. resection margin. The remainder of the specimen is homogeneous, yellow-tan, grossly unremarkable. adipose tissue. No other suspicious lesions are present. The specimen is submitted in nine cassettes, as. follows: Cassette #1-3: Tissue with clip in toto. Cassette #4: Perpendicular section superior margin. Cassette #5: Perpendicular section inferior margin. Cassette #6: Perpendicular section medial margin. Cassette #7: Perpendicular section lateral margin. Cassette #8: Perpendicular section superficial margin. Cassette #9: Perpendicular section deep margin. B. Received in formalin and labeled ""Hot spot #1, axilla I, ct xx"" is a yellow-tan irregular-shaped soft tissue. fragment, 3.5 x 3.0 x 1.0 cm. Sections reveal one lymph node, 1.5 x 1.0 x 1.0 cm. The lymph node is bisected and. submitted in toto in one. cassette. C. Received in formalin and labeled ""Hot spot #1, axilla I, ct xx"" is a yellow-tan irregular-shaped soft tissue. fragment, 2.8 x 2.0 x 1.0 cm. Sections reveal one lymph node, 1.5 x 1.0 x 1.0 cm. the lymph node is bisected and. submitted in toto in one cassette.",BRCA,0,"The report states that two sentinel lymph nodes were examined and no metastases were found in either node (0/2). This indicates that the N stage is N0, as there is no regional lymph node metastasis.",N0,14.0
866,TCGA-AR-A1AW.BB485405-199C-48C7-96D7-8C315DEA66B4,1,"Final Diagnosis. Breast,Meft ypper inner quadrant, lumpectomy: Infiltrating ductal carcinoma, with medullary like. features, Nottingham grade III (of III), [tubules 3/3, nuclei 3/3, mitoses 2/3; Nottingham score. 8/9], forming a 2.7 x 2.5 x 2.0 cm yellow-tan, somewhat circumscribed, sclerotic mass. [AJCCpT2]. Ductal carcinoma in situ is absent. Angiolymphatic invasion is absent. All surgical. resection margins, after re-excision of the deep and medial inferior margins, are negative for. tumor (minimum tumor free margin, 0.8 cm, deep margin). Lymph node, left axillary, sentinel biopsy: A single (1) left axillary sentinel lymph node is. negative for tumor, confirmed by cytokeratin (AE1/AE3) immunostains. ER/PR and Her2/neu have been ordered on paraffin-embedded tissue.",BRCA,0,"The T stage is T2 (2.7 x 2.5 x 2.0 cm tumor size). The N stage is N0 (no regional lymph node metastasis) as the sentinel lymph node is negative for tumor. The M stage is M0 (no distant metastasis) as it is not specified in the report. Therefore, the pathologic stage is IIA.",IIA,14.0
953,TCGA-B6-A400.AF83CCA2-3AA4-4933-B6AD-9C11DF501DDD,1,"AP Surgical Pathology: Corrected. CLINICAL HISTORY: Not provided. GROSS EXAMINATION: A. ""Left axilla non-sentinel node (AF1) "". Received fresh for frozen section is. a 1.8 x 1 x 0.6 cm tan-yellow lymph node candidate which is bisected and. frozen as AF1, the frozen section remnant is submitted in block A1. B. ""Left sentinel node number one (BF1) "". Received fresh for frozen section. are three tan-yellow lymph node candidates. The larger lymph node candidate (2. x 1.2 x 1 cm) is bisected and frozen as BF1, and frozen section remnant is. submitted in block B1. The remaining two lymph node candidates (0.5 x 0.5 x. 0.3 cm and 1 x 0.7 x 0.4 cm lymph node candidate) are submitted in toto as. frozen section BF2, and the frozen remnant is submitted in block B2. C. ""Left sentinel node number two (CF1) Received fresh for frozen section is. a 3 x 2.5 x 0.8 cm fragment of tan-yellow fibrofatty tissue. One lymph node. candidate is identified (1.9 x 1 x 0.7 cm) which is bisected and frozen as. CF1. The frozen section remnant is submitted in block C1. D. ""Left breast cancer, 1:00"", received fresh and placed in formalin: Procedure: Wire guided partial mastectomy. Specimen orientation: Suture: long=lateral, short-superior. Clips: two clips. medial, one clip=inferior. Specimen dimensions: Medial to Lateral: 8.5 cm. Anterior to Posterior: 2.5 cm. Superior to Inferior: 9.5 cm. Skin dimensions: 4.3 x 1.3 cm with a 0.4 cm long scar. Margins inked: Superior: Red. Inferior: Yellow. Anterior: Blue. Posterior: Black. Sectioned: Medial to lateral. Gross findings: There is a tan-white indurated ill defined area with. peripheral hemorrhage and fat necrosis. Lateral and superior to this area is a. second focus of white-tan induration with adjacent thick white-tan fibrous. tissue. The remaining parenchyma is tan-yellow lobulated adipose tissue. Gross tumor size: 2.3 x 2.1 x 1.2 cm. Multifocal tumor: Additional lesion is 1.2 x 0.8 x 0.5 cm which directly abuts. the primary focus. Distance of tumor from gross surgical margin for the primary tumor: Superior: 2.1 cm. Inferior: 3.2 cm. Anterior: 0.6 cm. Posterior: 1.2 cm. Medial: 4.2 cm. Lateral: 1 cm. Additional lesion: Superior: 3.1 cm. Inferior: 2 cm. Anterior: 1 cm. Posterior: 1 cm. Medial: 6.9 cm. Lateral: 0.5 cm. Sectioned specimen radiographed? Yes. Radiograph findings: Mass: Yes. Microcalcifications: Yes. Biopsy site microclip: No. Specimen photograph? Yes. Block diagram? Yes. Sections submitted from medial to lateral in blocks D1 through D35. Specimen completely submitted? No. BLOCK SUMMARY: Medial margin-D1. Lateral margin-D34 and D35. Inferior margin: D13. Superior margin: D19. Anterior and posterior margins: D23. Primary tumor: D10, D11, D15, D16, D17, D18, D21, D22, D23, D24, D25, D27,. D28, D31, D33. Secondary lesion: D25, D27, D28, D31, D32, D33. Microcalcifications: D12, D15, D16, D17, D18, D20, D23, D25, D33. E. ""Left axillary mass, long stitch-lateral, short-superior"", received fresh. and placed in formalin: Procedure: Wire guided partial mastectomy. Specimen orientation: Long stitch lateral, short stitch superior. Specimen dimensions: Medial to Lateral: 5.6 cm. Anterior to Posterior: 1 cm. Superior to Inferior: 3.6 cm. Margins inked: Superior: Red. Inferior: Yellow. Anterior: Blue. Posterior: Black. Sectioned: Medial to lateral. Gross findings: A well circumscribed white-brown nodule with an embedded. microclip in the medial portion. Lateral to this first nodule is a second ill. defined firm nodule. The remaining parenchyma is yellow-tan lobulated adipose. tissue. Gross tumor size:1.6 x 0.6 x 0.5 cm. Multifocal tumor: Second lesion is 1.2 x 0.5 x 0.4 cm, and it is 0.7 cm from. the first. Distance of tumor from gross surgical margin: First nodule: Superior: 1.8 cm. Inferior:0. cm. Anterior: 0.2 cm. Posterior: 0.2 cm. Medial: 2 cm. Lateral: 3.6 cm. Second nodule: Superior: 1.7 cm. Inferior: 1 cm. Anterior: 0.2 cm. Posterior 0.3 cm. Medial: 5.9 cm. Lateral: 1.8 cm. Sectioned specimen radiographed?. Radiograph findings: Mass: Yes. Microcalcifications: Yes. Biopsy site microclip: Yes. Specimen photograph? Yes. Block diagram? Yes. Sections submitted from medial to lateral in blocks E1 through E21. Specimen completely submitted? Yes. BLOCK SUMMARY: Medial margin-E1. Lateral margin:E21. Anterior, posterior, inferior margins for first nodule=E8. Anterior, posterior, superior, inferior margin for second nodule-E13. First nodule-E6, E7, E8, E9, E10, E11. Second nodule:E13, E14, E15, E16. Microclip: E11. Microcalcifications: E8, E13, E19. F. ""Left axillary contents"". Received fresh and placed in formalin is a 6.5 x. 6.5 x 2 cm aggregate of multiple fragments of tan-yellow fibrofatty tissue. Fourteen lymph node candidates are identified ranging in size from 0.5 x 0.5 x. 0.4 cm to 3.5 x 1.5 x 1.3 cm. The smallest lymph node candidate is submitted. in blocks F1-F3, and the two largest lymph node candidates are inked blue and. black, bisected and submitted in blocks F4-F6. A. REPORT REVISED ON. INTRA OPERATIVE CONSULTATION: A. ""Non-sentinel node right axilla"": AF1- one lymph node candidate, bisected. (1.3 x 1 x 0.6 cm) - no tumor is seen (Dr. B. ""Sentinel node number one"": BF1 (one lymph node candidate, bisected, 2 x. 1.6 x 1 cm) positive for metastatic cancer (micrometastases) (Dr. BF2 (two lymph node candidates, intact (0.5 x 0.5 x 0.3 cm) and 1 x 0.6 x 0.4. cm, no tumor is seen (Dr. C. ""Sentinel node number two"": CF1- one lymph node candidate, bisected, 1.9 x. 2 x 0.7 cm, positive for metastatic cancer (micrometastases) (Dr. MICROSCOPIC EXAMINATION: Microscopic examination is performed. PATHOLOGIC STAGE: PROCEDURE: Partial mastectomy, sentinel lymph node biopsy with completion. axillary dissection. PATHOLOGIC STAGE (AJCC. Edition) : pT2 pN2a pMX. NOTE: Information on pathology stage and the operative procedure is. transmitted to this Institution's Cancer Registry as required for. accreditation by the Commission on Cancer. Pathology stage is based solely. upon the current tissue specimen being evaluated, and does not incorporate. information on any specimens submitted separately to our Cytology section,. past pathology information, imaging studies, or clinical or operative. findings. Pathology stage is only a component to be considered in determining. the clinical stage, and should not be confused with nor substituted for it. The exact operative procedure is available in the surgeon's operative report. REVISED DIAGNOSIS. A. ""LEFT AXILLA, NON-SENTINEL LYMPH NODE"" (BIOPSY) : ONE LYMPH NODE, NO EVIDENCE OF MALIGNANCY (0/1) . B. ""LEFT AXILLA, SENTINEL LYMPH NODE # 1"" (BIOPSY) : METASTATIC ADENOCARCINOMA IN THREE LYMPH NODES (3/3) . SIZE OF LARGEST METASTASIS: 6 MILLIMETERS. EXTRACAPSULAR INVASION: ABSENT. C. ""LEFT AXILLA, SENTINEL LYMPH NODE # 2"" (BIOPSY) : METASTATIC ADENOCARCINOMA IN ONE LYMPH NODE (1/1) . SIZE OF LARGEST METASTASIS: 4 MILLIMETERS. EXTRACAPSULAR INVASION: ABSENT. D. ""LEFT BREAST CANCER, 1:00"" (WIRE GUIDED PARTIAL MASTECTOMY) : INVASIVE ADENOCARCINOMA OF THE BREAST. HISTOLOGIC TYPE: DUCTAL. NOTTINGHAM COMBINED HISTOLOGIC GRADE: 3 OF 3. TUBULE FORMATION SCORE: 3. NUCLEAR PLEOMORPHISM SCORE: 3. MITOTIC RATE SCORE: 3. GROSS TUMOR SIZE: 2.3 x 2.1 x 1.2 CM. SIZE OF INVASIVE COMPONENT: 2.3 CM. LOCATION OF THE TUMOR: ADJACENT TO PREVIOUS BIOPSY SITE. LYMPHATIC/VASCULAR INVASION: PRESENT. MULTIFOCAL TUMOR: ABSENT (SECOND MASS LESION DESCRIBED GROSSLY IS FAT. NECROSIS) . IN-SITU CARCINOMA: PRESENT. TYPE OF IN-SITU CARCINOMA: COMEDO. NUCLEAR GRADE OF IN-SITU CARCINOMA: 3 OF 3. NECROSIS: PRESENT. DCIS EXTENDING OUTSIDE INVASIVE TUMOR MASS: ABSENT. SIZE OF IN-SITU CARCINOMA: NOT APPLICABLE. SKIN STATUS: FREE OF TUMOR. STATUS OF NON-NEOPLASTIC BREAST TISSUE: NEEDLE CORE BIOPSY SITE, AND FAT. NECROSIS. SURGICAL MARGIN STATUS: NEGATIVE (GREATER THAN 2 MM) . ESTROGEN/PROGESTERONE RECEPTOR, CELL CYCLE, EGFR AND HER2/NEU ANALYSIS: PENDING, PARAFFIN BLOCK NUMBER D11. RESULTS WILL BE ISSUED SEPARATELY FROM THE IMAGE CYTOMETRY LAB. E. ""LEFT AXILLARY MASS"" (EXCISION) : METASTATIC ADENOCARCINOMA IN ONE OF FOUR AXILLARY LYMPH NODES (1/4). SIZE OF METASTASIS: 1.6 CM. EXTRACAPSULAR INVASION: PRESENT. CHANGES CONSISTENT WITH A NEEDLE CORE BIOPSY SITE ARE PRESENT. MARGIN STATUS: NEGATIVE. F. ""LEFT AXILLARY CONTENTS"" (COMPLETION NODE DISSECTION) : METASTATIC ADENOCARCINOMA IN ONE OF TWENTY LYMPH NODES (1/20) . SIZE OF METASTASIS: 0.5 MILLIMETERS. EXTRACAPSULAR INVASION: ABSENT. COMMENT: This report revised. to correct the site for specimens A-C,. which were received labelled as ""right"" Per. the correct site is. left. is notified of this revision. I certify that I personally conducted the diagnostic evaluation of the above. specimen (s) and have rendered the above diagnosis (es). DIAGNOSIS: SEE REVISED REPORT: REPORT REVISED ON. I certify that I personally conducted the diagnostic evaluation of the above. specimen (s) and have rendered the above diagnosis (es) . CI ADDENDUM 1: Please see. for results of supplementary. tests. I certify that I personally conducted the diagnostic evaluation of the above. specimen (s) and have rendered the above diagnosis (es).",BRCA,2,"The N stage is determined by the number of involved lymph nodes, regardless of the size of the metastases or the presence of extracapsular extension. In this report, there are metastases in 4 out of 24 lymph nodes (1/20 from the left axillary contents, 3/3 from sentinel lymph node #1, and 1/1 from sentinel lymph node #2), which indicates an N2 stage.",N2,15.0
467,TCGA-A2-A04P.0E4B0EA9-14D1-4A82-814D-51CC2B9BA2B5,1,"Specimen #: Race: Physician (s) : SPECIMEN: A: LEFT BREAST LUMPECTOMY B: AXILLARY CONTENTS. C: LEFT SUPRACLAVICULAR LYMPH NODE. FINAL DIAGNOSIS: A. LEFT BREAST, LUMPECTOMY: RESIDUAL INFILTRATING DUCTAL CARCINOMA, POORLY DIFFERENTIATED. RESIDUAL TUMOR SIZE: 2.5 X 2.0 X 1.5 CM. DEEP SURIGIAL MARGIN INVOLVED BY MAIN TUMOR. MEDIAL, SUPERIOR, AND INFERIOR MARGINS FOCALLY INVOLVED BY. DISCONTINUOUS TUMOR FOCI (LOCAL MICROMETASTASES). EXTENSIVE LYMPHATIC INVOLVEMENT. B. LEFT AXILLARY CONTENTS, DISSECTION: METASTATIC CARCINOMA INVOLVING 18 OF 20 EXAMINED LYMPH NODES. EXTENSIVE EXTRANODAL EXTENSION AND NON-NODAL METASTASES. C. LEFT SUPRACLAVICULAR LYMPH NODE, EXCISON: METASTATIC CARCINOMA INVOLVING 1 EXAMINED LYMPH NODE. COMMENT: The findings were discussed with. by phone. The deep surgical margin is involved by residual gross tumor (Block A24) . The medial, superior, and inferior margins are involved K< 0.6mm) by. microscopic foci, separate from the tumor. (Blocks A5, A10, A11, A23, A39) . Of the 18 involved axillary lymph nodes, 1 has a micrometastasis (B3) . An. additional lymph node (B22) has isolated tumor cells. These were. identified by routine light microscopy and hematoxylin-eosin stain. ==. Specimen #: CLINICAL DIAGNOSIS AND HISTORY: A. year old. female with left breast cancer with a positive margin. Palpable lymph node. PRE-OPERATIVE DIAGNOSIS: Left breast cancer. POST-OPERATIVE DIAGNOSIS: Left breast cancer. GROSS DESCRIPTION: A. LEFT BREAST LUMPECTOMY Received fresh, labeled with the patient's. name, and designated ""LEFT BREAST TISSUE, SKIN INTERIOR, ONE STITCH. MEDIAL, TWO STITCHES SUPERIOR"" is a specimen which consists of a piece of. fibrofatty tissue, 6.5 x 6.5 x 5.3cm with an overlying ellipse of skin,. 5.0 x 2.0cm. There is a 3. 5cm scar on the skin surface. Posteriorly a. small patch of skeletal muscle is noted. The specimen is oriented with. sutures (one - medial; two - superior) . Inked as follows: blue -. superior; green - inferior; yellow - medial, red - lateral, and black -. posterior. Sectioning reveals a 3. 0cm biopsy cavity with hemorrhagic. walls and surrounding fat necrosis in the medial half of the specimen. Medially. adjacent to the cavity and involving the deep margin is a firm,. tan tumor measuring 2.5 x 2.0 x 1.5cm. The remaining tissue is fat and. fibrous tissue. Sections of skin, tumor, and grossly normal fibrous. tissue are harvested for the CBCP protocol with matching paraffin sections. as follows: A1, skin, lateral tip; A2, tumor, medial portion; A3, tumor,. lateral aspect; A4, grossly normal fibrous, mid medial - superior, 2.5cm. from the tum; A5-A6, medial margin; A7-A8, adjacent representative. section; A9-A12, biopsy cavity; A13-A17, representative biopsy cavity; A18. A19, biopsy cavity; A20-A22, biopsy cavity; A23-A25, biopsy cavity;. A26-A28, biopsy cavity; A29-A30, biopsy cavity; A31-A33, adjacent left mid. section; A34, representative section; A35, representative section;. A36-A39, lateral margin. 39CF. B. AXILLARY CONTENTS Received fresh, labeled with the patient's name,. anddesignated ""AXILLARY CONTENTS, LEFT TAG AT HIGHEST AXILLARY NODE"" is. a. specimen which consists of a piece of soft yellow tissue, 14.5 x 6.5 x. 3 5cm, containing numerous and large lymph nodes. There are several. cyst-like structures found on serial sectioning ranging in size from 2.5. x 2.0 x 1.0cm to 1.5 x 1.5 x 1. Ocm. The cyst are filled with a red. viscous fluid. Further sectioning reveals a 3.5 x 3.0 x 2.0cm hemorrhagic. cyst-like structure that has a tan-red surface and is poorly defined. Its. mass trails to the lateral edge biopsy tail. Multiple possible lymph nodes. are identified ranging in size from 2.0 x 2.0 x 1.5cm to 0.4 x 0.3 x. 0.2cm. Two grossly positive lymh nodes and one grossly benign lymph node. Specimen # : GROSS DESCRIPTION (continued) : are harvested for the CBCP protocol with matching paraffin sections as. follow: Cassette B1, lymph node with tumor, 2.0 x 2.0 x 1.2cm, lower. axillary tale; B2, lymph node with tumor, 1.6cm, lower axillary tail; B3,. grossly benign lymph node, 0. 7cm, upper axillary tail; B4, grossly. positive single lymph node; B5, single lymph node in multiple pieces;. B6-B7, multiple possible lymph nodes; B8, bisected possible lymph node;. B9, single positive possible lymph node; B10, single possible bisected. lymph node; B11, fragments of possible lymph node; B12, fragments of. possible lymph node; B13-B14, bisected possible lymph node; B15, possible. lymph node; B16, single possible lymph node; B17-B18, skeletal muscle with. cyst wall; B19-B22, representative sections of axillary mass; B23-B25,. area of possible lymph nodes. 25CF. C. LEFT SUPRACLAVICULAR LYMPH NODE Received in formalin, labeled with the. patient's name, and designated ""LEFT SUPRACLAVICULAR LYMPH NODE"" is a. specimen which consists of a 1.3 x 0.7cm lymph node containing a 0. .8cm. tumor. A portion of the lymph node is submitted for the CBCP protocol. 1CF.",BRCA,3,"The N stage is determined by the number of involved lymph nodes, with N1 indicating 1-3 involved lymph nodes. The report states that there are 18 involved lymph nodes in the left axillary contents. This exceeds the criteria for N3 (metastases in 4 or more axillary lymph nodes or in infraclavicular lymph nodes), but the exact number of involved lymph nodes is not specified for the supraclavicular node. However, since the report specifies 18 involved lymph nodes in the axillary contents, we can assume that the supraclavicular node does not add any additional involved nodes. Therefore, the N stage is N3.",N3,16.0
