Unnamed: 0,patient_filename,t,text,type,n,cmem_n_reasoning,cmem_n_ans_str,cmem_n_num_update
1016,TCGA-BH-A0EA.28231C7B-64EE-49AC-B7AB-9BADDDDCC17C,0,"P.29/33. DIGGNOSIS: SENTINEL EYMPH NODE #1, LEFT AXILLA, BIOPSY -. ONE KYMPH NODE WITH METASTATIC CARCINOMA (1/1). METASTATIC FOCUS MEASURES 2.1 MM (ON GLASS SLIDE), NO EXTRACAPSULAR EXTENSION. IDENTIFIED. PART 25 NODE #2, LEFT AXILLA, BIOPSY -. ONE GEMIGNI YMPH NODE, NO TUMOR SEEN (0/1). PART 31 BREAST LEFT, TOTAL MASTECTOMY -. A CARCINOMA, NOS AND TUBULAR TYPE WITH ASSOCIATED CALCIFICATIONS. B: THE TFMORIMEASURES 2.4CM (GROSS MEASUREMENT), TIMOR IS LOCATED CENTRALLY. C; NOTINGHAMIGRADE.-/3 (TUBULES FORMATION 2, NUCLEAR GRADE 2, MITOTIC ACTIVITY 1; TOTAL. NOTTINGHAM SCORE 5/9). D. NO LYMPHOVASCULAR INVASION. IS SEEN. E. DUCTAL CARCINOMA IN SITU, CRIBRIFORM AND SOLID TYPE, NUCLEAR GRADE 2 COMPRISING 40% OF. TOTAL TUMOR VOLUME PRESENT IN ASSOCIATION WITH INVASIVE CARCINOMA. F. MARGINS: AEL MARGINS OF RESECTION ARE FREE OF INVASIVE AS WELL AS IN SITU CARCINOMA. CLOSEST POSTERIOR MARGIN IS 1.5 CM AWAY. G. LOBULAR NEOPLASIA(ATYPICAL LOBULAR HYPERPLASIA AND LOBULAR CARCINOMA IN SITU). ASSOCIATED WITH CALCIFICATIONS. H. ATYPICAL DUCTAL HYPERPLASIA WITH ASSOCIATED CALCIFICATIONS AND PREVIOUS BIOPSY SITE. CHANGES. I. UPPER OUTER QUADRANT: BENIGN BREAST TISSUE. J. LOWER OUTER QUADRANT: ATYPICAL DUCTAL HYPERPLASIA, FIBROCYSTIC CHANGE AND. SCLEROSING ADENOSIS. K. UPPER INNER QUADRANT: BENIGN BREAST TISSUE. L. LOWER INNER QUADRANT: LOBULAR NEOPLASIA AND FIBROCYSTIC CHANGE. M. SKIN, NIPPLE: NO TUMOR SEEN. N. ER POSITIVE, PR POSITIVE. HER-2/NEU POSITIVE. REFER TO. PART 4: SENTINEL LYMPH NODE #3, LEFT AXILLA, BIOPSY -. A. ONE LYMPH NODE WITH METASTATIC CARCINOMA (1/1). B. METASTATIC FOCUS MEASURES 7 MM (ON GLASS SLIDE), EXTRACAPSULAR EXTENSION is IDENTIFIED. AS WELL. PART 5: SENTINEL LYMPH NODE #4, LEFT AXILLA, BIOPSY -. ONE BENIGN LYMPH NODE, NO TUMOR IS SEEN (0/1). CASE SYNOPSIS: SYNOPTIC - PRIMARY INVASIVE CARCINOMA OF BREAST. LATERALITY: Left. PROCEDURE: Simple mastectomy. Central, subareolar. SIZE OF TUMOR: Maximum dimension invasivo component: 2.4 cm. MULTICENTRICITY/MULTIFOCALITY OF INVASIVE FOCI: TUMOR TYPE (Invasive component): Ductal adenocarcinoma, NOS, Tubular carcinoma. NOTTINGHAM SCORE: Nuclear grade: 2. Tubulo formation: 2. Mitotic activity score: 1. Total Nottingham score: 5. Nottingham grade (1, 2, 3): 1. ANGIOLYMPHATIC INVASION: VEKMAL LYMPHATIC INVASION: CALCIFICATION: Yes, malignant zones. TUMOR TYPE, IN SITU: Cribriform. Solid. DCIS admixed with invasive cercinoma. LCIS. Percent of tumor occupied by in situ component: 40%. SURGICAL MARGINS INVOLVED BY INVASIVE COMPONENT. SURG MARGINS INVOLVED BY IN SITU: COMPONENT. PAGET'S DISEASE OF NIPPLE: LYMPH NODES POSITIVE: LYMPH NODES EXAMINED: METHOD(S) OF LYMPHINODEEXAMIIAON. SENTINEL NODE MÉTASTASIS: Xes: ONLY KERATIN POSITIVE CELLS;ARE RRESENT. SIZE OF NODAL METASTASES: iameterofilargestiymphinod. LYMPH NODE METASTÁSIS(-ES), WITH EXITRACAPSULAREEXTENSION:",BRCA,1,"The patient has metastatic carcinoma present in one sentinel lymph node (#1) in the left axilla, with a metastatic focus measuring 2.1 mm and no extracapsular extension. Additionally, there is another sentinel lymph node (#3) in the left axilla with metastatic carcinoma, a metastatic focus measuring 7 mm, and extracapsular extension. The N stage is determined by the number of involved lymph nodes and the presence of extracapsular extension. In this case, the patient has involvement of 1-3 axillary lymph nodes and extracapsular extension, which corresponds to N1 stage according to the AJCC staging system for breast cancer.",N1,0.0
511,TCGA-A2-A0SV.161E2817-7DB2-46F8-BFEB-256DBBEFE633,1,"Specimen #: Race: WHITE. Physician (s) : SPECIMEN: WUID:161E2817-7082-46F8-BFEB-256DBBEFE633. A: RIGHT BREAST B: RIGHT AXILLARY CONTENTS. FINAL DIAGNOSIS: A. RIGHT BREAST, MASTECTOMY: TUMOR TYPE: INFILTRATING DUCTAL CARCINOMA, NO SPECIAL TYPE. NOTTINGHAM GRADE: POORLY DIFFERENTIATED (G3). NOTTINGHAM SCORE: 9/9. (Tubules= 3, Nuclei= 3, Mitoses= 3 mitotic count 14 per 10 HPF at. 40x power). TUMOR SIZE (GREATEST DIMENSION) : 4.5 CM (MEASURED GROSSLY). TUMOR NECROSIS: PRESENT, IN INFILTRATING COMPONENT AND DCIS. MICROCALCIFICATIONS: PRESENT IN INFILTRATING COMPONENT AND BENIGN. PROCESSES. VENOUS / LYMPHATIC INVASION: PRESENT; EXTENSIVE. MARGINS : DEEP MARGIN POSITIVE FOR TUMOR IN TISSUE AND LYMPHATICS. INTRADUCTAL COMPONENT: PRESENT; MINIMAL. NIPPLE INVOLVEMENT: PRESENT (without Pagetoid spread) . SKIN INVOLVEMENT: PRESENT. MULTICENTRICITY: PRESENT; MULTIPLE SEPARATE MICROSCOPIC FOCI IN OTHER. QUADRANTS (SEE COMMENT). ESTROGEN RECEPTORS: Previously ordered and positive. PROGESTERONE RECEPTORS: Previously ordered and positive. HER 2 NEU by IHC: Previously ordered; weakly positive. HER 2 Neu BY FISH: Previously ordered and pending. PATHOLOGIC STAGE: pT4d N2a MX. ADDITIONAL PATHOLOGIC CHANGES. -DUCTAL CARCINOMA IN-SITU, HIGH GRADE. - -CYSTIC CHANGE WITH APOCRINE METAPLASIA. B. LYMPH NODES, RIGHT AXILLA, DISSECTION: EIGHT LYMPH NODES POSITIVE FOR TUMOR, WITH EXTENSIVE EXTRACAPSULAR. EXTENSION IDENTIFIED, AND DEPOSITS LARGER THAN 2 MM. COMMENT: ER, PR, and Her2Neu are performed on the patient's prior material. collected by mammotome biopsy,. and will not be. repeated. This tumor shows satellite nodules throughout all quadrants. Specimen #: FINAL DIAGNOSIS (continued) : sampled except the lower outer quadrant. These nodules are not measured. separately as separate primary tumors; they appear to have arisen from. intramammary lymphatic spread. It is likewise difficult to measure the. degree of extranodal extension of tumor from the lymph nodes due to the. extensive perinodal tumor deposits. CLINICAL DIAGNOSIS AND HISTORY: yo white female with right nipple inversion, right breast. Prior. mammotome biopsy with ductal carcinoma. A. Right breast, Long stitch lateral, short stitch superior (fresh). B. Right axillary contents including thoraco bundle (fresh). GROSS DESCRIPTION: A. Specimen received in formalin labeled with patient's name. consists of a 627 gram right mastectomy specimen oriented with short. stitch superior and long stitch lateral. Specimen measures 24 cm superior. to inferior, 23 cm medial to lateral, 4 cm anterior to posterior. Superficial skin ellipse measures 9.5 x 4 cm and displays a centrally. located inverted nipple. No scar is noted. No discharge is noted. Deep. resection margin shows scant portions of muscular tissue. Deep margin. inked black and superficial margin is inked blue. Serial sections reveal a. centrally located poorly defined firm pink white mass measuring 4.5 x 4.5. x. 2.0. cm. Periphery of the mass shows hemorrhage consistent with previous. biopsy. Mass abuts deep margin. Fibrous parenchyma surrounding mass is. nodular and cystic suggestive of additional foci. Located in the deep. margin of mid inner quadrant is a 0.4 cm firm tan ill defined nodule. consistent with possible additional lesion (located approximately 2 cm. from central lesion) . Sectioning of nipple shows dense fibrous tissue. with possible lesion involvement. Remainder of parenchyma is lobulated. yellow tan and fatty with scant fibrous tissue. No lymph nodes identified. Representative sections: A1: skin. A2: nipple. A3: mass (lateral portion). A4: mass and adjacent fibrous tissue (medial portion). Specimen #: GROSS DESCRIPTION (continued). A5: mid inner quadrant nodule with margins. A6: mass with deep margin (central). A7: upper outer quadrant. A8: lower outer quadrant. A9: lower inner quadrant. A10: upper inner quadrant . Matched sections of A1-A4 and A7-A10 are. submitted. for CBCP protocol. A11-A20 represent additional sections of mass. Remaining breast tissue is. unoriented, no sutures remain in tissue. Representative samples of lesion. beneath elliptical wedge of skin and nipple are represented. A13-A14. represent one match set. Specimen submitted. B. Received in formalin labeled with patient's name. labeled. ""RIGHT AXILLARY CONTENTS INCLUDING SARCO BUNDLE"" consists of an 11 x 6 x 3. cm irregular unoriented portion of fatty tissue. Sectioning reveals two. matted portions of soft tissue measuring 4 x 3.5 x 1.5 cm and 8 x 4 x 1.2. cm. On sectioing the cut surfaces show dense indurated fibrotic tissue. with red tan lymphoid tissue noted along periphery of the smaller portion. tissue. Single intact discrete lymph node is identified and remaining. tissue which measures 0.6 cm. Exact number of lymph nodes cannot be. determined. Representative sections are as follows: B1-B3: smaller portion of tissue. B4-B6: larger portion of tissue. B7: one bisected lymph node.",BRCA,2,"Based on the report, there are 8 positive lymph nodes in the right axilla with extensive extracapsular extension identified, and deposits larger than 2 mm. This meets the criteria for N2 stage in breast cancer as per rule 4.",N2,1.0
644,TCGA-A8-A08B.2261B407-340D-4BB3-94BC-F06096FBDA80,1,"Diagnosis: 1. Bifocal poorly differentiated invasive ductal carcinoma (tumor diameters: 2.5. cm and 0.7 cm) with focal intraductal components. Concluding tumor classification: NOS, G III, pT2(mult)NO(sn)LOVORO.",BRCA,0,"The report indicates that the patient has no regional lymph node metastasis, as evidenced by the 'pT2(mult)NO(sn)LOVORO' classification. This is consistent with Rule 2, which states that N0 stage indicates no regional lymph node metastasis.",N0,2.0
938,TCGA-B6-A0WV.506BFD3B-240B-440E-B7A0-E596FC0B7F72,1,"Gurgical. Patho. CLINICAL HISTORY: S/P tru cut biopsy of 3.5 cm breast self detected lesion. Moderately. differentiated NSABP II, grade adenocarcinoma. Breast carcinoma. GROSS EXAMINATION: A. ""Right breast mass"", in formalin. A 4 x 3 x 1.5 cm piece of yellow-white. fibrofatty breast tissue containing a 3.5 x 3 x 2 cm firm, gritty, white-pink,. infiltrating tumor. Margins are not an issue for this specimen per Dr. therefore, the specimen is not inked. Representative sections of. the tumor are submitted in Blocks A1-A3. B. ""Right breast"", unfixed. A 22 x 15 x 5 cm mastectomy specimen with. axillary tail. The breast has a 19 x 13 cm skin ellipse containing nipple and. areola with a 6 cm long horizontal sutured biopsy site located directly above. the nipple. The external surface of the breast is inked in black. The skin surface, nipple and areola are grossly unremarkable. Cross sectioning through the breast specimen reveals a soft yellow-white. fibrofatty breast parenchyma along with an 8 x 6 x 5 cm hollow biopsy cavity. running in a horizontal direction beneath the nipple which is lined by pink,. thin, smooth, membranous tissue. No residual tumor is identified. The edges. of the biopsy cavity lie 3 cm, 1 cm, 7 cm and 7 cm from the superior,. deep/posterior and inferior inked tissue margins. No other lesions are noted. BLOCK SUMMARY: B1 representative section of nipple. B2 biopsy cavity and corresponding inked deep/posterior surface. B3-B4 additional sections of biopsy cavity. B5-B6 representative sections of upper lateral portion of breast. B7-B8 representative sections of lower lateral portion of breast. B9-B10 representative sections of upper medial portion of breast. B11-B12 representative sections of lower medial portion of breast. B13 1 bisected lymph node candidate from most medial portion of axillary. tail. B14. 2 lymph node candidates from most medial portion of axillary tail. B15. 3 lymph node candidates from the middle portion of the axillary tail. B16. 2 lymph node candidates from the middle portion of the axillary tail. B17. 1 bisected lymph node candidate from the middle portion of the axillary. tail. B18 2 lymph node candidates from the middle portion of the axillary tail. B19 2 lymph node candidates from the most lateral portion of. tail. Dr. DIAGNOSIS: A. ""RIGHT BREAST"", (BIOPSY) : INFILTRATING DUCTAL CARCINOMA. 3.5 x 3 x 2. NSABP HISTOLOGIC GRADE 2 OF 3, NUCLEAR GRADE MODERATELY DIFFERENTIATED. VASCULAR INVASION IDENTIFIED. B. ""RIGHT BREAST"", (MASTECTOMY WITH AXILLARY TAIL) : BREAST: NO RESIDUAL CARCINOMA. BENIGN PROLIFERATIVE CHANGES, INCLUDING EPITHELIAL HYPERPLASIA OF USUAL. TYPE AND BLUNT DUCT ADENOSIS. RECENT BIOPSY CAVITY WITH NO EVIDENCE OF MALIGNANCY. SKIN AND NIPPLE WITH NO HISTOLOGIC ABNORMALITY. AXILLARY LYMPH NODES. METASTATIC CARCINOMA IN 4 OF 7 LYMPH NODES. EXTRACAPSULAR SPREAD PRESENT. LARGEST LYMPH NODE 2.1 CM. M.D. Pager ID#. COMMENT:",BRCA,1,"According to the report, metastatic carcinoma was found in 4 out of 7 axillary lymph nodes, and extracapsular spread was also present. Based on the provided rules, N1 stage indicates involvement of 1-3 axillary lymph nodes, with or without extracapsular extension. However, the modified rule 3 (N1 stage revised) can be applied here, which indicates involvement of 1-3 axillary lymph nodes, with or without extracapsular extension. Therefore, the N stage for this patient is N1.",N1,3.0
657,TCGA-A8-A08X.CA911D90-5DDA-49F1-993F-68FCA77A8558,3,"Diagnosis: Poorly differentiated invasive ductal carcinoma with focal intraductal components and. angioinvasion (maximum microscopic tumor diameter: 4.0 cm). Diagnosis: 1. Ablated (left) breast sample with extensive further invasive and angioinvasive. tumor components, as well as foci of further intraductal tumor components in the. cavity region of the sample excision (maximum spread: 8 cm). Massive subepidermal. carcinomatous lymphangitis of the skin spindle. Dorsal resection margin tumor-free. Comment: The massive subepidermal carcinomatous lymphangitis in the region of the skin. spindle could correlate closely with the clinical appearance of an inflammatory. carcinoma, although there is no ulceration of the skin spindle. This gives rise to the concluding tumor classification NOS, G III, pT3N3aL1V1R0.",BRCA,3,"The report indicates that the patient has 'pT3N3aL1V1R0' classification. According to the rule for interpreting the TNM staging system, N3 stage indicates involvement of 10 or more axillary lymph nodes, or involvement of the infraclavicular lymph nodes, or involvement of ipsilateral internal mammary nodes and axillary lymph nodes. The 'N3a' in the classification suggests involvement of ipsilateral internal mammary nodes and axillary lymph nodes.",N3,4.0
528,TCGA-A2-A0YH.0C344CD7-6FAB-462B-9A8E-75B720F2D626,1,"Chief of. CPNSU. Specimen. Spec Type: SURGICAL p. OPERATION. DOCTOR (8) : PROCEDURE: PARTIAL MASTECTOMY/LUMPECTOMY-AXTLLARY NODE DISSECTION. TISSUE REMOVED. A. LT PARTIAL MASTECTOMY. B. LT AXILLARY NODE. C. LT BREAST INFERIOR AND SUPERFICIAL MARGIN. GROSS DESCRIUTION. PART A RECEIVED FRESH LABELED. LEFT PARTIAL MASTECTOMY LONG. EQUALS LATERAL SHORT EQUALS SUPERIOR, IS AN OVOID PORTION OF YELLOW-PINK. FATTY TISSUE MEASURING 7 x 6 x 3.5 CM. THE SPECIMEN IS ORIENTED BY TWO. SUTURES AND MARKED AS FOLLOWS LATERAL ORANGE, MEDIAL RED, SUPERIOR. GREEN, INFERIOR BLUE, SUPERFICIAL BLACK, DEEP YELLOW. A LARGE PALPABLE. MASS IS FELT WITHIN THE SPECIMEN INFERIOR AND MEDIALLY. SECTIONING. REVEALS A ROUNDED PINK-TAN MASS MEASURING 2.4 x 2.2 x 2.7 CM IN GREATEST. DIMENSIONS. THIS APPROACHES THE SUPERFICIAL, DEEP AND INFERIOR MARGINS,. GROSSLY EXTENDING TO WITHIN 0.2 CM OF EACH OF THESE. IT IS GREATER THAN. 1 CM FROM THE OTHER MARGINS. THE SPECIMEN CONSISTS OF PINK-TAN FIBROUS. TISSUE IN THE MEDIAL ASPECT OF THE SPECIMEN AND YELLOW FATTY TISSUE MORE. LATERALLY. A RIBBON CLIP IS IDENTIFIED WITHIN THIS LESION. SECTIONS ARE. SUBMITTED AS FOLLOWS: A1 --REPRESENTATIVE PERPENDICULAR MEDIAL MARGIN,. A2 - -REPRESENTATIVE - PERPENDICULAR LATERAL MARGIN, A3 - --TUMOR (MIRROR IMAGE. TO PROTOCOL), A4--TUMOR AND INFERIOR MARGIN (MIRROR IMAGE TO PROTOCOL). A5 - -LESION AND INFERIOR MARGIN, A6--TUMOR AND SUPERFICIAL MARGIN,. A7--TUMOR AND DEEP MARGIN. NOTE THAT A5 THROUGH A6 IS ONE FULL. CROSS-SECTION OF LESION, WITH A6 MIRROR IMAGE TO TISSUE TAKEN PER. PROTOCOL. A8 --TISSUE - AND SUPERFICIAL MARGIN CORRESPONDING TO THE TUMOR. IN A3 (MIRROR IMAGE TO PROTOCOL TISSUE), A9--TISSUE TO INCLUDE THE DEEP. AND SUPERIOR MARGINS CORRESPONDING TO THE CROSS-SECTION DEPICTED IN A5. THROUGH 7, A10--THE CORRESPONDING DEEP MARGIN TO THE TUMOR TAKEN IN A3,. All --THE LATERAL ASPECT OF THE TUMOR TO INCLUDE THE INFERIOR SUPERFICIAL. MARGIN. PART B RECEIVED FRESH LABELED. LEFT AXILLARY NODE. DISSECTION, IS A PORTION OF YELLOW-RED FATTY TISSUE MEASURING 10 x 7.6 x. 4.8 CM IN GREATEST DIMENSIONS. THIS IS EXAMINED FOR LYMPH NODES WHICH. ARE THEN SUBMITTED AS FOLLOWS: 1--GROSSLY UNREMARKABLE LYMPH NODE,. B2 - - SECTION OF GROSSLY POSITIVE LYMPH NODE, B3 --SECTION - OF GROSSLY. POSITIVE LYMPH NODE WITH COIL CLIP. NOTE: SPECIMENS B1 THROUGH 3 ARE. MIRROR IMAGES TO PROTOCOL SECTIONS. B4 AND ---ONE NODE TOTAL, B6--TWO. NODES EACH BISECTED, B7--TWO NODES EACH BISECTED, B8 - THREE - NODES EACH. BISECTED, B9 - THREE NODES, B10--ONE NODE BISECTED, B11--ONE NODE. BISECTED, B12 - ONE NODE BISECTED. AFTER A SHORT TIME OF ACETIC FORMALIN FIXATION, ADDITIONAL NODES ARE. Chief of Pathology. specimen: spec Type: SURGICAL p. GROSS DESCRIPTION. IDENTIFIED AND SUBMITTED AS FOLLOWS: B13--ONE NODE BISECTED, B14 - -FIVE -. NODES, B15--THREE NODES EACH BISECTED, B16--TWO NODES EACH BISECTED. PART C RECEIVED LABELED LEFT BREAST INFERIOR AND. SUPERFICIAL MARGIN STITCH AT NEW MARGIN, IS AN OVOID PORTION OF. YELLOW-PINK FATTY TISSUE MEASURING 6.4 x 5.4 x 1.1 CM. SUTURE DENOTES A. NEW MARGIN. THIS SIDE IS MARKED WITH BLUE INK WITH A PERIMETER OF BLACK. INK. THE SPECIMEN IS SECTIONED AND ENTIRELY SUBMITTED LABELED C1 THROUGH. 10. PATH PROCEDURES. PROCEDURES: 88307/3, A BLK/11, B BLK/16, C BLK/10. FINAL DIAGHONTS. PART A LEFT PARTIAL MASTECTOMY: IN SITU AND POORLY DIFFERENTIATED. INFILTRATING DUCT CARCINOMA, NUCLEAR GRADE III/III WITH A HIGH MITOTIC. INDEX. THE INVASIVE TUMOR IS 2.- 4 CM IN MAXIMUM MICROSCOPIC DIMENSION. A 0.9 CM FOCUS OF DUCT CARCINOMA IN SITU OF THE MICROPAPILLARY AND. COMEDOCARCINOMA TYPES IS PRESENT ADMIXED WITH AND ADJACENT TO THE. INVASIVE TUMOR. DUCT CARCINOMA IN SITU IS PRESENT 1 MM FROM THE. SUPERFICIAL MARGIN, WITH INVASIVE CARCINOMA 1.5 MM FROM THE SUPERFICIAL/. MARGIN. INVASIVE CARCINOMA IS ALSO PRESENT IN A MICROSCOPIC SATELLITE. NODULE 1 MM FROM THE DEEP MARGIN. THE INFERIOR MARGIN IS CLEAR BY A. DISTANCE OF 3 MM. THE SUPERIOR, MEDIAL, AND LATERAL MARGINS ARE ALL. CLEAR OF TUMOR BY DISTANCES EXCEEDING 1 CM. THERE IS A SMALL FOCUS OF. ATYPICAL DUCT HYPERPLASIA 3 MM FROM THE MEDIAL MARGIN. PART B LEFT AXILLARY LYMPH NODE DISSECTION: METASTATIC CARCINOMA. IDENTIFIED IN 5 OF 28 AXILLARY LYMPH NODES. PART C LEFT BREAST SUPERFICIAL AND INFERIOR MARGIN, REEXCISION: FRAGMENTS OF BENIGN FATTY BREAST TISSUE AND A MICROSCOPIC FOCUS OF. INFILTRATING DUCT CARCINOMA. THIS 1 MM FOCUS OF CARCINOMA HAS A. CAUTERIZED MARGIN AND IS SEPARATE FROM THE ADJACENT ADIPOSE TISSUE. THE. AREA IS NOT INKED, BUT ITS RELATIONSHIP TO THE MARGIN CANNOT BE. ACCURATELY DETERMINED BECAUSE IT IS NOT ATTACHED TO THE INKED MARGIN. PORTION OF THE SPECIMEN. THIS FOCUS OF TUMOR IS PRESENT IN 1 OF 10. TISSUE BLOCKS (BLOCK C10). CODE. 1. (prelim.).",BRCA,2,"Based on the report, metastatic carcinoma was identified in 5 out of 28 axillary lymph nodes (part B). This corresponds to the N2 stage, which indicates involvement of 4-9 axillary lymph nodes.",N2,5.0
1090,TCGA-BH-A204.531B1E8E-9936-42E0-B49B-39C61DD4E943,1,"PATIENT HISTORY: DATE OF LMP: Procedure Date: DATE OF LAST DELIVERY: PRE-OP DIAGNOSIS: CARCINOMA LEFT BREAST. POST-OP DIAGNOSIS: SAME. OPERATIVE PROCEDURE: EXC BREAST LEST BR FS - LEFT MOD RAD MASTECTOMY. MATERIAL SUBMITTED: A) LEFT GREAST BIOPSY/TISSUE, PROCUREMENT BY SURGICAL PROCRDURE. CLINICAL HISTORY: B) LEFT (MOD) RADICAL MASTECTOMY, PROCUREMENT nY SURGICAL PROCEDURE. and axillary contents. Frozen section: ""Left breast mass biopsy"" 1.5 by cm x 2' biopsies. F's duct Ca. INTRAOPERATIVE CONSULTATION: ER/PR taken. Tissue taken for DNA studtes. FINAL DIAGNOSIS: FINAL DIAGNOSIS: AEAFS) LEFT BREAST AND AXILLA: - INFILTRATING DUCTAL CARCINOMA, 4.0 CM, POOR NUCLEAR GRADE. - MICROSCOPIC FOCI OF DUCTAL CARCINOMA IN SITU. - ANGIOLYMPHATIC AND PERINEURAL INVASION SEEN. - TUMOR INVOLVES SKELETAL MUSCLE. - RESECTION MARGINS ARE FREE OF CARCINOMA. TWO OF SIXTEEN (2/16) LYMPR NODES ARE POSITIVE FOR CARCINOMA. - NOTE: The large 2.5 em axillary lymph node is totally replaced by tumor with extracapeular extension.",BRCA,1,"Based on the report, there are two out of sixteen (2/16) lymph nodes positive for carcinoma, and one of these nodes has extracapsular extension. According to the rules provided, N1 stage indicates involvement of 1-3 axillary lymph nodes, with or without extracapsular extension. Therefore, the N stage for this patient is N1.",N1,6.0
847,TCGA-AR-A0U1.007C609A-7874-4E39-BC4D-1EA81F4722EA,1,"Breast, left, wide local excision: Invasive ductal carcinoma, Nottingham grade 3 (of 13), forming a 2.3 x. 2.2 x 2.0 cm mass (AJCCpT2). All surgical margins, including separately submitted inferior margin, are. negative for tumor. Lymph node, left breast intramammary, excision: Metastatic adenocarcinoma. no extranodal extension is. identified. Lymph nodes, left axillary sentinel, excisions: Multiple (5) left axillary sentinel lymph nodes are. negative for tumor (blue dye identified in left axillary lymph node No. 1 only). Lymph nodes, left axillary, dissection: Multiple left highest (2) and left axillary (23) lymph nodes are. negative for tumor. Her-2/NEU has been ordered on paraffin embedded tissue.",BRCA,1,"Based on the report, there is no evidence of regional lymph node metastasis. The left breast intramammary lymph node has metastatic adenocarcinoma but no extranodal extension was identified. All 28 sentinel and axillary lymph nodes excised were negative for tumor. Therefore, the N stage is N0.",N0,6.0
