Unnamed: 0,patient_filename,t,text,type,n,cmem_n_reasoning,cmem_n_ans_str,cmem_n_num_update
601,TCGA-A7-A56D.D564A7FB-4F0A-4589-AB32-A6CD8B547219,1,"Final Surgical Pathology Report. Procedure: Diagnosis. A. Left axillary sentinel lymph node, resection: No evidence of metastasis in one lymph node (0/1) . B. Left breast, simple mastectomy: Infiltrating ductal carcinoma, grade 3, 3.2 cm in greatest dimension. Surgical margins negative but close, less than 2 mm. C. Left axillary contents, resection: No evidence of metastasis in 7 lymph nodes (0/7). Microscopic Description: Microscopic examination performed. A. Sections of the sentinel lymph node demonstrate no evidence of. metastatic disease. The node is examined by multiple sectioning with. hematoxylin and eosin and by immunohistochemistry for pankeratin. Invasive Carcinoma: present. Histologic type: Infiltrating ductal carcinoma. Histologic grade: Overall grade: 3. Architectural score: 2. Nuclear score: 3. Mitotic score: 3. Greatest dimension (pT) : 3.2 cm,. pT2. Specimen margins: Negative but close, less than 2 mm over a. distance of 5 mm. Vessel invasion: Not identified. Calcification: Not identified. Ductal carcinoma in situ: Not identified. Description of non-tumorous breast: Proliferative fibrocystic. changes with intraductal papillomatosis. Comments: None. Prognostic markers: Previously performed. C Sections of the left axillary contents demonstrate no evidence of. metastasis in 7 lymph nodes. Specimen. A. Left sentinel node-axillary. B. Left breast-tumor at 7 o'clock. C. Axillary contents. Clinical Information. Carcinoma left breast, core biopsy positive here. Intraoperative Consultation. AFS left axillary sentinel lymph node, excision: No evidence of metastasis in one lymph node. Gross Description. A. Container a is labeled with the patient's name, medical record. number and ""sentinel lymph node"". The specimen consists of a single. piece of fatty tissue which when bisected holds a single lymph node. measuring 1.0 x 0.0 0. cm. Bisected and submitted in block AFS. B. Received fresh labeled ""left breast"" is a 25.5 cm (medial to. lateral) by 17.0 cm (superior to inferior) by 4.5 cm (anterior to. posterior) soft, lobulated tan-white-gold portion of fibroadipose. tissue oriented per placement of designated tumor as stated previously. A 19.3 x 8.5 cm wrinkled tan skin ellipse with an eccentric, 1.0 x 1.0. x 0.5 cm nipple is present along the anterior aspect. A palpable mass. is evident at 7 o'clock, corresponding to the lower inner quadrant. The antero-inferior surface of the specimen in the vicinity of the mass. is inked blue. The intact deep margin is inked black and the specimen. is sectioned. There is a well-circumscribed, 3.2 cm (medial to. lateral) by 2.4 cm (anterior to posterior) by 2.0 cm (superior to. inferior) rubbery tan-white tumor mass within the lower outer quadrant. On sectioning the tumor appears to extend to within 0.2 cm of the. inked anteroinferior surface and 1.5 cm of the inked deep margin. A. portion of tumor and a portion of normal parenchyma are submitted for. tissue procurement as requested. The cut surfaces throughout the. remainder of the specimen consist predominantly of soft, lobulated tan. gold adipose tissue with a minimal amount of interspersed dense. tan-white fibrous tissue. No additional mass lesion or abnormality is. identified. Summary: 1 - tumor to inked deep margin, 2 through 4 - tumor to inked. anteroinferior margin, 5 and 6 - tumor to adjacent parenchyma, 7 -. random upper outer quadrant, 8 - upper inner quadrant, 9 - lower inner. quadrant, 10 - lower outer quadrant, 11 - junction of the 4 quadrants,. 12 - nipple. C. Received fresh labeled ""Axillary contents"" is a 9.3 x 7.8 x 1.7 cm. portion of soft, lobulated tan gold adipose tissue. A few slightly. rubbery pale tan to tan pink tissues in keeping with lymph nodes. measuring up to 3.4 cm in greatest dimension are recovered. The. lymphoid tissues are entirely submitted. RS 4. Summary: 1 - 2 lymph nodes, 2 - 1 bisected lymph node, 3 and 4 -. bisected largest lymph node. the. Criteria. Discrepancy. Temar S. Discripancy. PIP.",BRCA,0,"The report mentions that there is no evidence of metastasis in the sentinel lymph node (0/1) and in 7 additional lymph nodes (0/7). This indicates that the cancer has not spread to the regional lymph nodes, which corresponds to an N0 stage.",N0,8.0
1143,TCGA-D8-A1XF.FCBB54EB-6FBF-4DC4-B4D5-DB533687FA58,1,"page 1 / 1. copy No. Examination: Histopathological examination. Gender: F. Material: Multiple organ resection - left breast with axillary tissues. Expected time of examination: up to 8 working days. Clinical diagnosis: Cancer of the left breast. Macroscopic description: Left breast sized 22 x 15 x 4 cm removed along with axillary tissues sized 10 x 6x2 cm and a 17 x 6.5 cm skin flap. Weight 780. g. A post-operative scar visible round the nipple with a site of 6 x 4 x 2 cm. Microscopic description: Infiltratio carcinomatosa mamillae. Status post resectionem tumoris. Glandular tissue containing foci of carcinoma ductale in situ (solid and cribrate type, with medium nuclear atypia, with. necrosis and calcifications, as well as lesions of the type mastopathia fibrosa. Axillary lymph nodes: Lymphonodulitis chronica (No VIII). Preliminary result: (including the examination No. Carcinoma invasivum mammae sinistrae. (NHG2, pT2, pNO). Histopathological diagnosis: Carcinoma ductale invasivum mammae sinistrae. Invasive ductal carcinoma of the left breast. ,. NHG2, pT2, pNO.",BRCA,0,"The report mentions 'pNO' under the 'pN' category, which indicates no regional lymph node metastasis. This aligns with the 'N0' stage definition.",N0,9.0
514,TCGA-A2-A0SY.8E6902A6-A673-46CC-9AEB-3A71EF11099F,2,"Lab No.: Sex: F. Date Collected: Date Received: Doctor: M.R. No.: Room No: Account No: CLINICAL HISTORY: PREOPERATIVE DIAGNOSIS: LEFT BREAST CA. POSTOPERATIVE DIAGNOSIS: LEFT BREAST CA. OPERATION: LEFT SIMPLE MASTECTOMY, SENTINEL LYMPH. NODE BIOPSY, F.S. SPECIMENS: A. LEFT SENTINEL LYMPH NODE #1, F.S. B. LEFT SENTINEL LYMPH NODE #2, F.S. C. SENTINEL LYMPH NODE #3, F.S. D. LEFT BREAST SIMPLE MASTECTOMY. FROZEN SECTION DIAGNOSIS: A. LEFT SENTINEL LYMPH NODE #1 -. NUMEROUS HISTIOCYTES WITH ATYPICAL CELLS. DEFER FOR PERMANENT SECTION. B. LEFT SENTINEL LYMPH NODE #2 -. ONE NEGATIVE LYMPH NODE (0/1). C. SENTINEL LYMPH NODE #3 -. ONE NEGATIVE LYMPH NODE (0/1). FINAL DIAGNOSIS: A. LEFT SENTINEL LYMPH NODE #1 -. POSITIVE FOR METASTATIC CARCINOMA (1/1); THE TUMOR. INVOLVES THREE-FOURTHS OF THE NODE WHICH MEASURES .6. CM. IN DIAMETER, NO PERICAPSULAR SOFT TISSUE EXTENSION. B. LEFT SENTINEL LYMPH NODE #2 -. ONE REACTIVE LYMPH NODE (0/1). Lab No.: C. SENTINEL LYMPH NODE #3 -. ONE REACTIVE LYMPH NODE (0/1). D. LEFT BREAST MASTECTOMY -. INVASIVE LOBULAR CARCINOMA (7 CM.). TUMORAL CALCIFICATION/NECROSIS: NONE IDENTIFIED. DCIS/LCIS: NONE IDENTIFIED. SURGICAL MARGINS/NIPPLE, SKIN AND AREOLA: UNINVOLVED. NON-NEOPLASTIC BREAST: FIBROCYSTIC CHANGES TO INCLUDE DUCTAL EPITHELIAL. HYPERPLASIA. PTNM CLASSIFICATION: T3 N1 MX; STAGE IIIA. COMMENT: The multiple sections from the tumor reveal patchy areas of tumor infiltration. extending up to lactiferous ducts. In addition, the tumor cells also display unfavorable. nuclear features in many areas. The ER, PR and Her-2/neu have been performed on the. previous biopsy. The PanKeratin Immunostain is performed on specimens A, B. and C. GROSS: A. The container is received fresh unfixed labele. eft sentinel lymph node #1. for frozen section"". The specimen consists of an ovoid mass of pink-tan soft rubbery. tissue mixed with fatty tissue measuring 0.6 cm. in greatest dimension. Frozen section is. obtained by. The entire specimen including frozen section in one block. B. The container is received fresh unfixed labele. left sentinel lymph node #2. for frozen section"". The specimen consists of an ovoid mass of tan-gray soft rubbery. tissue with attached fat. Frozen section is obtained by. The entire specimen. including frozen section in one block. Lab No.: C. The container is received fresh unfixed labele. sentinel lymph node #3 for. frozen section"". The specimen consist of an ovoid mass of pink-tan soft rubbery tissue. measuring 1.3 cm. in diameter in the aggregate. Frozen section is obtained by. The entire specimen including frozen section in one block. D. The container is received fresh unfixed labeled. ""left breast"". The specimen. consists of an 809 gm. apparent left breast which is 23 x 15 x 4 cm. in greatest overall. dimension. There is an inverted nipple. The attached skin ellipse is 21 x 9.5 cm. Sectioning through the breast stroma reveals dense gray-white fibrous tissue varying up. to 7.5 cm. in greatest dimension. This area has been previously marked with blue dye. There are scattered cystic spaces varying up to 0.1 cm. in greatest dimension filled with. an amber-colored fluid. Sectioning also reveals a firm tan-gray striated tumor mass. which is 7 x approximately 5.5 cm. in greatest overall dimension and is approximately. 0.7 cm. from the deep/underlying resection margin. The specimen is submitted in ten. blocks. Key Note Block Summary: 1-nipple, 2 through 4-cystic spaces, 5-random,. 6. through 10-tumor mass. MICROSCOPIC EXAMINATION: MICROSCOPIC EXAMINATION CONDUCTED BY PATHOLOGIST CONFIRMS FINAL DIAGNOSIS. SPECIAL STAINS PERFORMED: PanKeratin (specimens A,B,C).",BRCA,1,"The report mentions that there is metastatic carcinoma in 1 axillary lymph node (left sentinel lymph node #1) and no extracapsular extension. There is no mention of 'pN2a' or any 'pN2' category or 'pN3' category in the report. Therefore, based on the rules, the N stage is N1.",N1,10.0
1474,TCGA-OL-A5RV.0CA74400-1596-4C14-AF02-4F5169D61942,1,"FINAL PATHOLOGIC DIAGNOSIS. A. Right breast; modified radical mastectomy: - Invasive ductal (tubulo-lobular) carcinoma, SBR grade II, focally associated. with microcalcification, see parameters. - Ductal carcinoma in situ, low and intermediate nuclear grade, cribriform,. micropapillary and solid type, associated with necrosis and microcalcifications. - Ductal carcinoma in situ is < 2 mm from posterior margin. - Biopsy site changes. - Columnar cell changes. - Two small fibroadenomas. - Twenty of twenty-nine lymph nodes, positive for metastatic carcinoma (20/29). - Extranodal extension present. Breast Pathologic Parameters. 1. Invasive carcinoma: A. Gross measurement: 4.5 cm (main lesion) and 1 cm (satellite in upper. outer quadrant). B. Composite histologic (modified SBR) grade: II. - Architecture: 2. - Nuclear grade: 2. - Mitotic count: 2. C. Associated intraductal carcinoma in situ (DCIS): - Within main mass (forming 40% of tumor volume). 2. Intraductal carcinoma: A. Gross measurement: 4.5 cm, admixed with invasive carcinoma. B. Type: Cribriform / Solid / Micropapillary. C. Nuclear grade: Low / Intermediate. D. Associated features: Necrosis / Microcalcifications / Cancerization of. lobules. 3. Excisional biopsy margins: - DCIS < 2 mm from posterior (closest) margin. - Invasive carcinoma > 4 mm from posterior (closest) margin. 4. Blood vessel and lymphatic invasion: Present. - Present in breast parenchyma. - Present in axillary tissue. 5. Nipple: DCIS extending into lactiferous duct. 6. Skin: uninvolved. 7. Skeletal muscle: absent. 8. Axillary lymph nodes: Positive (20/29). - Size of largest metastatic deposit: 12 mm. - Extranodal extension: present (7 mm; largest focus). - Tumor deposits in axillary tissue (up to 5 mm). 9. Special studies (see. - ER: Strong expression in >90 % of invasive tumor nuclei. - PR: Strong expression in >90 % of invasive tumor nuclei. - Her2/neu antigen (FISH): Non-amplified (ratio:1.00). 10. pTNM (AJCC, 7th edition, 2010): pT2(m), N3, MX. Clinical History: The patient is a year old female, with a right breast mass (MRI: 1.3 x 0.9 x. 0.8 cm) and biopsy diagnosis of invasive ductal carcinoma undergoing right. modified radical mastectomy. Specimens Received: A: Right breast; mastectomy. Gross Description: A. The specimen is received in a single container labeled with the patient's. name, medical record number, and additionally identified as, 'right breast'. Received fresh and placed in formalin is a 653 gm modified radical mastectomy. specimen. The specimen is oriented with a short suture designating the superior. margin and a long suture designating lateral margin. The specimen measures 18.5. cm from superior to inferior, 22.5 cm from medial to lateral, and 3.9 cm from. anterior to posterior. There is an attached 9.6 X 7.9 X 1.5 cm axillary tail. On the anterior surface is a 18.0 X 8.0 cm tannish brown ellipse of skin with a. 4.0 X 4.5 cm areola and a 1.5 X 1.4 X 0.5 cm raised nipple. The nipple-areolar. complex reveals no evidence of ulceration or retraction. The specimen is inked as follows: superior edge - blue;. inferior edge - green;. posterior - black. The specimen is serially sectioned from medial to lateral into 11 slices to. reveal a rubbery, irregularly shaped, white-tan, 4.5 X 3.5 x 2.5 cm mass with. a. granular cut surface in slices 3 through 5. A clip is identified in slice 3. The. mass is 0.5 cm from the posterior margin and widely free (>2 cm) from the. anterior superior and anterior inferiormargins. The remainder of the specimen. consists of approximately 30% dense gray-white fibrous breast parenchyma and 70%. lobulated yellow adipose tissue. No additional masses or nodules are grossly. identified. Sectioning through the axillary tail reveals multiple tan-brown,. rubbery lymph nodes ranging from 0.3-2.5 cm in greatest dimension. Block summary: A1: mass surrounding clip and closest approach to posterior margin and. surrounding clip, slice 3. A2: mass, slice 4. A3: mass, slice 4. A4: mass, slice 5. A5: mass and biopsy site, slice 5. A6: upper outer quadrant, slice 7. A7: lower outer quadrant, slice 6. A8: upper inter quadrant, slice 2. A9: lower-inner quadrant, slice 5. A10: skin adjacent to mass. A11: nipple. A12: tissue directly beneath nipple. A13: one lymph node, sectioned. A14: one lymph node, bisected. A15: one lymph node, sectioned. A16: one lymph node, bisected. A17: one lymph node, bisected. A18: one lymph node, bisected. A19: two lymph nodes. A20: two lymph nodes. A21: three lymph nodes. A22: three lymph nodes. A23: one lymph node, sectioned. A24: three lymph nodes. A25: four lymph nodes. A26: three lymph nodes.",BRCA,3,"The report states that there are 20 positive lymph nodes out of 29 examined (20/29). This puts the N stage at N3 according to the rule: 'N3: Metastasis in 10 or more axillary lymph nodes (at least one tumor deposit greater than 2.0mm) or in infraclavicular (N1b), or supraclavicular (N1c), or internal mammary nodes.'",N3,11.0
758,TCGA-AN-A0FK.5F5FF3CA-2DBB-4DE1-9190-1FE36E2B5ACB,3,Sex: Female. Diagnosis: Breast Cancer Histological description: Infiltrative ductal carcinoma. Anatomic Site: Right breast Tumor location: Primary. Tissue Specification: Tumor Specimen Matrix: Tissue Specimen Format: OCT. Container: block Type of Procurement: surgery Grade: 2. T Stage: 4 N Stage: 0 M Stage: 0 Treatment: none. Treatment Details: n/a. Normal Sample. Anatomic Site: Blood Sample Type: Normal Type of Procurement: blood draw. Matrix: Blood Specimen Format: frozen Container: tube.,BRCA,0,"The report specifies that the N stage is 0 (N0) and there is no mention of 'pN2a' or any 'pN2' category, or 'pN3' category. This is consistent with rule 1, 2, 3, 4, 5 and 7. The N stage is based solely on the number of involved axillary lymph nodes and does not consider other factors such as tumor size or distant metastasis.",N0,12.0
878,TCGA-AR-A24S.C0A8A457-8790-4745-BD5D-AFBE55254A1C,0,"Final Diagnosis. Breast, right, wide local excision: Infiltrating ductal carcinoma, Nottingham grade II (of III) [tubules 3/3, nuclei 2/3, mitoses. 1/3,. Nottingham score 6/9], forming a 1.3 x 1.1 x 1.0 cm mass. Ductal carcinoma in situ is absent. An intramammary lymph node. present is negative for metastatic carcinoma. Angiolymphatic invasion is absent. The non-neoplastic breast parenchyma shows. nonproliferative fibrocystic changes. Biopsy site changes present. All surgical resection margins are negative for tumor. (minimum tumor free margin, 0.5 cm, deep margin). (AJCCpT1c). Lymph nodes, right axillary sentinel, excision: Multiple (2) sentinel lymph nodes are negative for metastatic carcinoma [AJCC. pN0(i-)(sn)]. Blue dye is identified in sentinel lymph node No. 1 only. Immunohistochemical cytokeratin stain was performed on. the paraffin embedded sentinel lymph node tissue and confirms the H&E impression. Lymph node, right intramammary, excision: A single intramammary lymph node is negative for metastatic carcinoma. Lymph node, right axillary, excision: A single right axillary lymph node is negative for metastatic carcinoma. HER2/neu ordered.",BRCA,0,"The report states that there is no evidence of metastatic carcinoma in the sentinel lymph nodes (pN0(i-)(sn)) and in the single intramammary and axillary lymph nodes. The N stage is based solely on the number of involved axillary lymph nodes, and in this case, there are no positive lymph nodes. Therefore, the N stage is N0.",N0,12.0
1396,TCGA-GM-A5PV.A616A83A-8D19-4085-B430-1AF80D4F9642,1,"DIAGNOSIS. (A) RIGHT BREAST, TOTAL MASTECTOMY: INVASIVE LOBULAR CARCINOMA, INTERMEDIATE GRADE. (SEE COMMENT). LOBULAR CARCINOMA IN SITU (LCIS), LOW AND INTERMEDIATE NUCLEAR GRADES. INVASIVE CARCINOMA MEASURES 3.0 X 1.1 CM IN CONTIGUOUS SECTIONS/SLICES. INVASIVE CARCINOMA IS PRESENT AT LEAST 1.0 CM FROM MARGINS. No lymphovascular invasion identified. Microcalcifications present in association with benign breast tissue. NIPPLE, LCIS/ATYPICAL LOBULAR HYPERPLASIA. (B) RIGHT AXILLARY SENTINEL LYMPH NODE #1, EXCISIONAL BIOPSY: METASTATIC CARCINOMA PRESENT IN ONE OF ONE LYMPH NODE (1/1). METASTATIC FOCUS MEASURES AT LEAST 1.05 CM. No definite extracapsular extension identified.. (C) RIGHT AXILLARY POSSIBLE SENTINEL LYMPH NODE #2, EXCISIONAL BIOPSY: Fibroadipose tissue, no tumor present. No lymphoid cells identified. (D) LEFT BREAST, TOTAL MASTECTOMY: Fibrocystic changes including focal florid ductal hyperplasia (usual type), cysts. Microcalcifications present in association with benign breast tissue and blood vessel wall. Nipple, no tumor present. (E) RIGHT AXILLARY POSSIBLE SENTINEL LEVEL I, EXCISIONAL BIOPSY: Fibroadipose tissue, no tumor present. (F) RIGHT AXILLA, ADDITIONAL LEVEL II LYMPH NODE, EXCISION: Two lymph node, no tumor present (0/2). (G) RIGHT AXILLA, ADDITIONAL LEVEL I LYMPH NODE, EXCISION: Three lymph node, no tumor present (0/3). (H) RIGHT AXILLARY CONTENTS, AXILLARY DISSECTION: Thirteen lymph nodes, no tumor present (0/13). (I). RIGHT AXILLA, ADDITIONAL LEVEL I LYMPH NODE #2, EXCISIONAL BIOPSY: Three lymph node, no tumor present (0/3). COMMENT. Immunohistochemical stain for E-cadherin is negative, consistent with the diagnosis. GROSS DESCRIPTION. (A) RIGHT BREAST, SHORT SUPERIOR, LONG LATERAL - A 24.0 x 23.5 x 5.5 cm mastectomy specimen that is oriented by. the surgeon with a short stitch designating superior and a long stitch designating lateral. The specimen is partly surfaced by a 22.5. x 13.0 cm ellipse of pale tan wrinkled skin. Located on the surface of the skin is a 1.3 cm everted nipple surrounded by a 4.5 cm. rim of areola, respectively. The specimen is serially sectioned from lateral to medial into thirteen slices. The nipple is located in. slices 7 and 8. In the upper portion of slices 5 through 9, a 5.0 x 2.7 x 2.0 cm gray-white, firm tumor mass with calcifications and. surrounding fibrosis that grossly comes to within 1.2 cm from the skin, 4.5 cm from the deep margin, 4.0 cm from the superior. margin, and 7.0 cm from the inferior margin. There is a metal biopsy clip located in the mass in slice 8. Located in slices 6 and 7. at the 6 o'clock position, there is a 3.8 x 1.8 X 0.6 cm gray-white firm fibrous area with calcifications, marked by the radiologist. This fibrous area grossly comes to within 0.5 cm from the deep margin and 0.8 cm from the inferior margin. Remaining cut. surfaces. are. 85%. yellow glistening adipose tissue and 15% gray-white fibrous tissue. Some tissue has been given to tumor bank. for research purposes. IOA/DX; MARGINS ARE FREE. INK CODE: Blue - superior; orange - inferior; black - deep. SECTION CODE: A1-A3, nipple from slices 7 and 8; A4-A6, mass and calcifications from 10-1 o'clock position from slice. 5; A7, representative sections from slice 4, adjacent to mass; A8, mass and calcifications from slice 6; A9, 6 o'clock marked area. from. slice. 6;. A10, 6 o'clock marked area to inferior margin from slice 6; A11, 6 o'clock marked area to deep margin from slice 6;. A12, mass and calcifications at 10-1 o'clock position from slice 7; A13-A15, 6 o'clock abnormal enhancement from slice 7; A16,. representative sections subjacent to nipple and adjacent to mass from slice 8; A17, A18, mass in area of clip and its mirror image. from. slice 8; A19, mass from slice 8; A20, representative section of tissue adjacent to mass from slice 8; A21, superior margin. from slice 8; A22, representative section from slice 8, adjacent to 6 o'clock abnormal enhancement; A23, mass at position from. slice 9; A24, representative section from slice 10, adjacent to mass position; A25, representative section from slice 5, adjacent to. 6 o'clock abnormal enhancement; A26, lower inner quadrant from slice 11. (B) RIGHT AXILLA, SENTINEL LYMPH NODE #1, BLUE, IN VIVO 4, EX VIVO 36 - A 3.5 x 2.4 x 1.0 cm lymph node submitted. entirely. FS/DX: ONE NODE, METASTATIC CARCINOMA. SECTION CODE: B1-B5, one possible lymph node serially sectioned for frozen section diagnosis. (C) RIGHT AXILLA, SENTINEL LYMPH NODE #2, BLUE, IN VIVO 0, EX VIVO 0 - A 0.8 x 0.3 x 0.1 cm possible lymph. node. submitted entirely. /DX: DEFER TO PERMANENT. SECTION CODE: C, one possible lymph node bisected for frozen section diagnosis. (D) LEFT BREAST, SHORT SUPERIOR, LONG LATERAL - A 24.0 x 23.5 x 6.0 cm mastectomy specimen that is oriented by the. surgeon. with. a. short stitch designating superior and a long stitch designating lateral. The specimen is partly surfaced by a 20.0 x. 17.0 cm ellipse of pale tan wrinkled skin. Located on the surface of the skin is an everted nipple surrounded by a rim of areola. that. measure. 1.2 and 5.5 cm in diameter, respectively. The specimen is serially sectioned from medial to lateral into twelve slices. The nipple is located in slice 7. Cut surfaces are composed of 75% yellow glistening adipose tissue and 25% dense gray-white. fibrous tissue. A definite mass is not grossly identified. Some normal tissue has been given to tumor bank for research purposes. INK CODE: Blue - superior; orange - inferior; black - deep. SECTION CODE: D1, D2, nipple from slice 7; D3, upper inner quadrant from slice 3; D4, upper inner quadrant from slice. 5;. D5, lower inner quadrant, including inferior margin from slice 4; D6, lower inner quadrant, including deep margin from slice 6;. D7, upper outer quadrant from slice 7; D8, upper outer quadrant including superior margin from slice 9; D9, lower outer quadrant. from slice 8; D10, lower outer quadrant from slice 10. (E). RIGHT AXILLA, LEVEL I LYMPH NODE - Consists of a single nodular tissue with blue dye (0.7 cm). The specimen is. submitted entirely in E. (F) RIGHT AXILLA, ADDITIONAL LEVEL II LYMPH NODE - Consists of a single fragment of yellow-red fibroadipose tissue (6.5. x. 4. x. 1.3 cm). Dissection reveals two possible lymph nodes (0.6 cm and 3.4 cm in greatest dimension). Both lymph nodes are. submitted entirely. SECTION CODE: F1, one possible lymph node; F2-F5, one possible lymph node, serially sectioned. (G). ADDITIONAL LEVEL I LYMPH NODE, RIGHT AXILLA - Consists of a single fragment of yellow-red fibroadipose tissue (6 x 3. cm). Dissection reveals three possible lymph nodes, ranging in size from 0.2 to 2.2 cm in greatest dimension. All possible lymph. nodes are entirely submitted. SECTION CODE: G1, one possible lymph node; G2, one possible lymph node; G3, G4, one possible lymph node,. sectioned. (H). RIGHT. AXILLARY CONTENTS - Consists of a single fragment of bright yellow fibroadipose tissue (9 x 3 x 3 cm). Dissection. reveals thirteen possible lymph nodes, ranging in size from 0.1 cm to 3 cm in greatest dimension. All possible lymph nodes are. entirely submitted. SECTION CODE: H1, five possible lymph nodes; H2, three possible lymph nodes; H3, two possible lymph nodes; H4,. two possible lymph nodes; H5-H7, one possible lymph node, sectioned. (I) ADDITIONAL LEVEL I LYMPH NODE #2, RIGHT AXILLA - Consists of multiple fragments of yellow-tan fibroadipose tissue. aggregating. to. 5. x 5 x 1.5 cm. Dissection reveals three possible lymph nodes ranging in size from 1 cm to 1.2 cm in greatest. dimension. All possible lymph nodes are entirely submitted. SECTION CODE: I1, two possible lymph nodes; 12, one possible lymph node, bisected. CLINICAL HISTORY. Breast cancer. SNOMED CODES. T-04050, M-Y2003. ""Some tests reported here may have been developed and performance characteristics determined by. These tests have not been. specifically cleared or approved by the U.S. Food and Drug Administration."". END OF REPORT-.",BRCA,1,"Based on the pathology report, there is metastatic carcinoma present in one of one lymph node (1/1) in the right axillary sentinel lymph node #1. This indicates that the N stage is N1, as per the rule: 'N1: Metastasis in 1 to 3 axillary lymph nodes (at least 1 tumor deposit greater than 2.0mm).'",N1,13.0
