Unnamed: 0,patient_filename,t,text,type,n,cmem_n_reasoning,cmem_n_ans_str,cmem_n_num_update
730,TCGA-AC-A62Y.83BCCC3C-0384-45CD-84B4-67E2EDE822EE,1,"Sex: Female. I.O.B.: IRN #: (ef Phys. SPECIMENINFORMATION. Acct i Reg #: DIAGNOSIS. DIAGNOSIS: Right breast modified radical mastectorny: Two areas of invasive lobular carcinoma. Sizes: 2.8 and 1.8 cm. Architectural score: 3 of 3. Nuclear score: 2 of 3. Mitotic score: 1 of 3. Total score: 6 of 9. Grade 2. Extensive lobular carcinoma in situ present. No evidence of angiolymphatic invasion. No evidence of skin and nipple involvement. Prognostic was previously performed and will not be repeated unless requested. Deep margin of excision is inveived by carcinoma. Attached axillary lymph node: One lymph node, metastatic carcinoma present. Size: 0.4 cm. No evidence of extracapsular extension. TMN: T2pN1. OLINICAL INFORMATION. CLINICAL HISTORY: Preoperative Diagnosis: Right modified radical mastectomy with sentinel node mapping with frozen section. Invasive lobular carcinoma. ER positive, PR. positive, Her-2 negative. Postoperative Diagnosis: Symptams/Radiologic Findings: SPECIMENS: Right breast. SPECIMENDOTA. GROSS DESCRIPTION: The specimen is received in formalin labeled with the patient's name. tht breast. The specimen consists of a portion of fibroadipose. breast tissue and overlying skin measuring 20.0x 15.0 x 6.0 cm and weighs 448 grams. The skin surface measures 15.0 x 10.5 cm and is light tan. wrinkled. There is slight puckering of the skin surface noted that measures 2,0 cm that is 8.5 cm from the nipple. The nipple is eccentrically placed and. appears grossly unremarkable. There is no orientation given to the specimen. The deep margin is inked. Sectioning reveals gray-tan mass measuring. 1.8 x 1.5 x 1.5 cm that is 0.1 cm from the deep margin. it is located at the periphery of the breast. A second mass measuring 2,8 x 2.5 x 2.5 cm that is. 0.1 cm from the deep margin, 0,2 cm from the skin surface, corresponds to the puckered area noted previously mentioned on the skin surface The. surrounding tissue reveals yellow-tan fatty fibroadipose tissue predominantiy with areas of gray fibrous tissue. No other lesions are identifiea, On the. periphery of the breast, there is a grav-tan nodule possible lymph node measuring 2,0 x 1.0x 1,0 cm. Received with the specimen ara thrse cassettes. one green, one yellow. one clue labeled. epresentative sections are submitted in cassettes labeled : follows: pipple,. block 1; sections from the first lesion in blocks 2 througn 5, sections from the second lesion in biocks 6 through 9; posorule lymph node sectioned in total. in blocks 10 through 12; random sections from all four quadrants in blocks 13 through 16,.",BRCA,1,"The pathology report mentions the presence of metastatic carcinoma in one attached axillary lymph node, with a size of 0.4 cm and no evidence of extracapsular extension. This corresponds to AJCC N1 stage for breast cancer.",N1,0.0
1010,TCGA-BH-A0E0.975989FE-8785-42C1-8551-53661B7B16A1,2,"P.23/33. SNOSIS: MODIFIED RADICAL MASTECTOMY -. INVASIVE DUCTAL CARCINOMA, NOTTINGHAM SCORE 3; NUCLEAR GRADE 3, TUBULES 3, MITOSIS 3, TOTAL. SCORE 9/9. B. TUMOR SIZE 5.5 CM WITH EXTENSIVE INTRATUMORAL LYMPHOCYTIC INFILTRATION. C. TUMOR LOCATED IN THE UPPER/OUTER AND LOWER/OUTER QUADRANT. D. DUCTAL CARCINOMA IN-SITU, NUCLEAR GRADE 3, SOLID AND CRIBRIFORM WITH COMEDO NECROSIS. PRESENT ADMIXED WITH TUMOR AND ACCOUNTS FOR 25% OF TUMOR MASS. E. ANGIOLYMPHATIC INVASION IDENTIFIED. F. POSTERIOR MARGIN OF UPPER/OUTER AND LOWER/OUTER QUADRANT FREE OF TUMOR. CLOSEST. MARGIN IS POSTERIOR MARGIN WHICH IS 0.6 CM AWAY FROM THE TUMOR. G. BIOPSY SITE CHANGES. H. ESTROGEN RECEPTOR IS NEGATIVE, PROGESTERONE RECEPTOR IS NEGATIVE, HER-2/NEU IS NEGATIVE. (1+) PER CORE BIOPSY. 1. ATYPICAL DUCTAL EPITHELIAL HYPERPLASIA (see comment). J. TEN OF TWENTY-ONE LYMPH NODES WITH METASTATIC CARCINOMA (10/21)WITH EXTRACAPSULAR. SPREAD IN ONE. K. FIBROCYSTIC CHANGES, WITH DUCTAL EPITHELIAL HYPERPLASIA AND APOCRINE METAPLASIA. CASE SYNOPSIS: SYNOPTIC - PRIMARY INVASIVE CARCINOMA OF BREAST. LATERALITY: Left. PROCEDURE: Modified radical mastectomy. Upper outer quadrant. Lower outer quadrant. SIZE OF TUMOR: Maximum dimension invasive component: 5.5 cm. MULTICENTRICITY/MULTIFOCALITY OF INVASIVE FOCI: TUMOR AGGREGATE SIZE: Sum of the sizes of multiple invasive tumors: 5.5 cin. TUMOR TYPE (invasive component): Ductal adenocarcinoma, NOS. NOTTINGHAM SCORE: Nuclear grade: 3. Tubule formation: 3. Mitotic activity score: 3. Total Nottingham score: 9. Nottingham grade (1, 2, 3): 3. ANGIOLYMPHATIC INVASION: DERMAL LYMPHATIC INVASIÓN: CALCIFICATION: TUMOR TYPE, IN SITU: Cribriform. Solid. Comedo. DCIS admixed and outside of invasive carcinoma component. SURGICAL MARGINS INVOLVED BY INVASIVE COMPONENT: Distance of invasive tumor to closest margin: 6 mm. SURG MARGINS INVOLVED BY IN SITU COMPONENT: Distance of in situ disease to closest margin: 6 mm. PAGET'S DISEASE OF NIPPLE: LYMPH NODES POSITIVE: 10. LYMPH NODES EXAMINED: 21. METHOD(S) OF LYMPH NODE EXAMINATION: H/E stain. SENTINEL NODE METASTASIS: ONLY KERATIN POSITIVE CELLS ARE PRESENT: SIZE OF NODAL METASTASES: Diameter of largest lymph node metastasis: 28 mm. LYMPH NODE METASTASIS(-ES) WITH EXTRACAPSULAR EXTENSION: METASTASES TO IPSILATERAL INTERNAL MAMMARY LYMPH NOOE (IF APPLICABLE): SKIN INVOLVED (ULCERATION): NON-NEOPLASTIC BREAST TISSUE: ADH, FCD. T STAGE, PATHOLOGIC: N STAGE, PATHOLOGIC: pNX. M STAGE, PATHOLOGIC: pMX. ESTROGEN RECEPTORS: ncgative. PROGESTERONE RECEPTORS: negative. HER2/NEU:",BRCA,3,"The report states that 10 out of 21 lymph nodes have metastatic carcinoma, and one of those has extracapsular spread. This meets the criteria for N1 staging according to the rules provided.",N1,1.0
773,TCGA-AN-A0XR.1351520E-9B6A-4F06-B631-DF374396C7E6,1,Sex: Female. Diagnosis: Breast Cancer Histological description: Infiltrative ductal carcinoma. Anatomic Site: Breast Tumor location: Primary. Tissue Specification: Tumor Specimen Matrix: Tissue Specimen Format: OCT. Container: block Type of Procurement: surgery Grade: 2. T Stage: 2 N Stage: 2b M Stage: 0 Treatment: none. Treatment Details: n/a. Normal Sample. Anatomic Site: Blood Sample Type: Normal Type of Procurement: blood draw. Matrix: Blood Specimen Format: frozen Container: tube.,BRCA,2,"The N stage is based on the number of involved axillary lymph nodes, and the report specifies an N stage of 2b. This corresponds to 4-9 positive axillary lymph nodes. The other rules do not apply to this report.",N2,2.0
1185,TCGA-E2-A107.BA87D188-A3B3-4A6F-B3AF-1FEB25B9E357,2,"SPECIMENS: A. LEFT BREAST WLE NEEDLE LOC. B. SLN #1. C. SLN #2. D. RIGHT BREAST. E. SLN #3. F. ADDITIONAL SENTINEL LYMPH NODE RIGHT AXILLA. G. RIGHT AXILLARY CONTENTS LEVELS 1 &2. SPECIMEN(S): A. LEFT BREAST WLE NEEDLE LOC. B. SLN #1. C. SLN #2. D. RIGHT BREAST. E. SLN #3. F. ADDITIONAL SENTINEL LYMPH NODE RIGHT AXILLA. G. RIGHT AXILLARY CONTENTS LEVELS 1 & 2. INTRAOPERATIVE CONSULTATION DIAGNOSIS: FSA-left breast: No definitive mass seen, tissue with fibrosis by Dr. to Dr. at. TPB-SLN #1: Lymph node negative for carcinoma. TPC/TPE-SLN #2 & #3: Lymph nodes positive for carcinoma. Called by Dr. to Dr at. GROSS DESCRIPTION: A. LEFT BREAST WLE NEEDLE LOC. Received fresh labeled with the patient's identification and ""left breast WLE needle localization"" is an. oriented (single-anterior, double-lateral, triple-superior) needle localized lumpectomy with out. radiograph. Ink code: anterior-yellow, posterior-black, medial-green, lateral-red, superior-blue, inferior-. orange. The specimen is serially sectioned into 5 sections revealing dense fibrous tissue without a. distinct mass. No tissue is procured. Entirely submitted: A1-A3: slice 1, lateral margin, perpendicular sections. A4: slice 2, anterior. A5: slice 2, posterior. A6: slice 3, anterior. A7: slice 3, posterior. A8: slice 4, anterior. A9: slice 4, posterior. A10-A11: slice 5, medial margin, perpendicular sections. B. SLN #1. Received fresh is a 3 x 0.8 X 0.5 cm lymph node, A touch prep is performed and the lymph node is. submitted entirely in cassette B1. C. SLN #2. Received fresh is a lymph node measuring 1.4 x 1.2 X 0.5 cm. One touch prep is performed and the. lymph node is submitted entirely in cassette C1. D. RIGHT BREAST. Received fresh labeled with the patient's identification and ""right breast"" is an oriented 678 g, 24 X 21 x. 5 cm mastectomy with 11.5 x 7 the skin ellipse and 1.7 cm everted nipple. Ink code: anterior/superior-. blue, anterior/inferior-orange, posterior-black. The specimen is serially sectioned into 12 slices from. medial to lateral with nipple and slice 5 revealing an area of dense nodular firm fibrous tissue, 10 x 8 X 4. cm, extending from the upper inner quadrant to the mid outer quadrant at is closest to the. posterior/deep margin at 1.5 cm. Representatively submitted. D1: slice 2, lower-superior anterior. D2: slice 2, upper-inferior anterior. D3-D8: slice 3, mid section submitted from superior to inferior. D9: slice 4, lower-superior anterior. D10: slice 4, lower-superior posterior. D11: slice 5, lower-superior anterior. D12: slice 5, lower-superior posterior. D13: slice 5, made anterior. D14: slice 5, mid posterior. D15: slice 5, upper-inferior anterior. D16: slice 5, upper-inferior posterior. D17: slice 6, mid superior. D18: slice 6, lower-superior posterior. D19: slice 6, upper-inferior anterior. D20: slice 6, mid inferior. D21: slice 7, mid superior. D22: slice 7, mid inferior. D23: slice 8, mid lower-superior. D24: slice 8, mid upper-inferior. D25: slice 9, mid upper-inferior. D26: slice 9, mid inferior. D27: slice 10, mid upper-inferior. D28: slice 10, mid inferior. D29: slice 11, upper-inferior posterior. D30: slice 1, mid. D31-D32: nipple, perpendicular sections. D33: skin. D34: 1 axillary lymph node. E. SLN #3. Received fresh is a lymph node, 2 x 1 X 0.5 cm. A touch prep is performed and the lymph node is. submitted entirely in cassette E1. F. ADDITIONAL SENTINEL LYMPH NODE RIGHT AXILLA. Received fresh is a piece of yellow-tan tissue 2.5 x 2.1 x 1 cm. Two lymph nodes are identified. measuring 1.4 and 1.8 cm. Lymph nodes are submitted separately in cassettes F1-F2. G. RIGHT AXILLARY CONTENTS LEVELS 1 AND 2. Received fresh is an aggregate of adipose tissue, 7 x 5 x 1.5 cm. Multiple lymph nodes are identified. ranging from 0.1 to 2.1 cm; they have a variegated pink-tan cut surface. Lymph nodes submitted as. follows: G1-G2: 4 lymph nodes each. G3: 6 lymph nodes. G4: 2 lymph nodes. G5-G8: 1 lymph node each. DIAGNOSIS: A. BREAST/LEFT, WIDE LOCAL EXCISION: USUAL DUCTAL HYPERPLASIA WITHOUT ATYPIA, MICROCALCIFICATIONS IN BENIGN DUCTS. AND FIBROCYSTIC CHANGES WITH FIBROSIS. - FOCAL FAT NECROSIS AND MILD ACUTE INFLAMMATION, NO TUMOR SEEN. B. LYMPH NODE, SENTINEL #1, EXCISION: - ONE LYMPH NODE, NEGATIVE FOR METASTASES (0/1). C. LYMPH NODE, SENTINEL #2, EXCISION: - METASTATIC CARCINOMA TO ONE OF ONE LYMPH NODE (1/1),. MEASURING 0.8-CM WITH NO EXTRANODAL EXTENSION. D. BREAST, RIGHT, SIMPLE MASTECTOMY: 1 - MULTIFOCAL, INVASIVE, LOBULAR CARCINOMA, SBR GRADE 2, MEASURING 10-CM. - INVASIVE TUMOR PRESENT 2-MM FROM DEEP SURGICAL RESECTION MARGIN. - METASTATIC CARCINOMA TO ONE OF TWO AXILLARY LYMPH NODES (1/2). - SEE SYNOPTIC REPORT AND SEE NOTE. E. LYMPH NODE, SENTINEL #3, EXCISION : - METASTATIC CARCINOMA TO ONE OF ONE LYMPH NODE (1/1),. MEASURING 0.7-CM WITH FOCAL EXTRANODAL EXTENSION. F. LYMPH NODE, ADDITIONAL SENTINEL, RIGHT AXILLA, BIOPSY: - METASTATIC CARCINOMA TO ONE OF TWO LYMPH NODES (1/2). G. LYMPH NODES, RIGHT AXILLARY CONTENTS, LEVELS 1 AND 2, DISSECTION: TWENTY LYMPH NODES, NEGATIVE FOR METASTASES (0/20). NOTE: Extensive and multifocal invasive lobular carcinoma is identified. The tumor grossly measures. 10-cm. Microscopic examination reveals that the tumor extends from slice #1 to slice #8 (predominantly. in the inner half, central and subareolar region, with extension to outer quadrants. SYNOPTIC REPORT - BREAST. Specimen Type: Mastectomy. Needle Localization: Laterality: Right. Invasive Tumor: Present. Multifocality: Yes. WHO CLASSIFICATION. Invasive lobular carcinoma 8520/3. Tumor size: 10cm. Tumor Site: Upper outer quadrant. Lower outer quadrant. Upper inner quadrant. Lower inner quadrant. Central. Margins: Negative. Distance from closest margin: 0.2cm. deep. Tubular Score: 3. Nuclear Grade: 2. Mitotic Score: 1. Modified Scarff Bloom Richardson Grade: 2. Necrosis: Absent. Vascular/Lymphatic Invasion: None identified. Lobular neoplasia: None. Lymph nodes: Sentinel lymph node and axillary dissection. Lymph node status: Positive 4 / 27 Extranodal extension. DCIS not present. ER/PR/HER2 Results. ER: Positive. PR: Negative. HER2: Negative by FISH. Performed on Case: HER2 by FISH performed in outside facility. Pathological staging (pTN): pT 3N2a. SYNOPTIC REPORT - BREAST, ER/PR RESULTS. Specimen: Surgical Excision. Block Number: D1. ER: Positive. Allred Score: 8 = Proportion Score 5 + Intensity Score 3. PR: Negative Allred Score: 0 = Proportion Score 0 + Intensity Score 0. COMMENT: The Allred score for estrogen and progesterone receptors is calculated by adding the sum of the. proportion score (0 = no staining, 1 = <1% of cells staining, 2 = 1 - 10% of cells staining, 3 = 11-30% of. cells staining, 4 = 31-60% of cells staining, 5 = >60% of cells staining) to the intensity score (1 = weak. intensity of staining, 2 = intermediate intensity of staining, 3 = strong intensity of staining), with a scoring. range from 0 to 8. ER/PR positive is defined as an Allred score of >2 and ER/PR negative is defined as an Allred score. of less than or equal to 2. METHODOLOGY: Tissue was fixed in 10% neutral buffered formalin for no less than 8 and no longer than 24 hours. Immunohistochemistry was performed using the mouse anti-human ER (ER 1D5, 1:100) and PR (PGR. 136, 1:100) provided by. following the manufacturer S instructions. This. assay was not modified. Interpretation of the ER/PR immunohistochemical stain is guided by published. results in the medical literature, information provided by the reagent manufacturer and by internal. review of staining performance. CLINICAL HISTORY: None given. PRE-OPERATIVE DIAGNOSIS: Right breast cancer, left abnormal imaging. Microscopic/Diagnostic Dictation:. Pathologist,. Final Review: Pathologist,. Final Review: Pathologist. Final Review: Pathologist,. Final: Pathologist,.",BRCA,2,"Based on the pathology report, there is metastatic carcinoma in 1-3 axillary lymph nodes (SLN #2, SLN #3, and additional sentinel lymph node from the right axilla), which indicates an N1 stage according to the rules.",N1,3.0
1307,TCGA-E9-A22D.ED60F792-A71B-4BAE-A536-5FF6D8C3DEAA,1,Laterality:Right upper outer quadrant. Path Report: BREAST TISSUE CHECKLIST. Specimen type: Radical mastectomy. Specimen size: Not specified. Tumor site: Breast. Tumor size: 2.4 x2.4x2.4 cm. Grossly evident lesion: Yes. Histologic type: Infiltrating ductal carcinoma. Histologic grade: Moderately differentiated. Tumor extent: Not specified. Lymph nodes: 0/10 positive for metastasis (Regional 0/10). Extracapsular invasion of the lymph nodes: Not specified. Margins: Not specified. Nottingham Histologic Score. Tubule formation: Not specified. Nuclear pleomorphism: Not specified. Mitotic count (25x): Not specified. Mitotic count (40x): Not specified. Total Nottingham Score: Score cannot be determined. Evidence of neo-adjuvant treatment: Not specified. Additional pathologic findings: Not specified. Comments: None.,BRCA,0,"The report indicates that there are 0/10 positive lymph nodes in the regional lymph nodes. This means that there is no metastatic carcinoma found in the axillary lymph nodes, which corresponds to an N0 stage according to the rules.",N0,3.0
602,TCGA-A7-A5ZV.FA5CF5A2-F44A-4303-9200-32250FAEF374,1,"Final Surgical Pathology Report. Procedure: Diagnosis. A, B. Lymph nodes, left axillary sentinel #1 & #2, excisions -. Negative for malignancy. C. Breast, left, segmental mastectomy -. Invasive mammary carcinoma, no special type, high combined histologic. grade, high proliferative rate. D. Breast, left, posterior to segmental mastectomy, excision. Negative for malignancy. Note: The above diagnoses are rendered per expert consultation from. of. Please see the. consultation report from Dr. In a comment,. states: ""This invasive carcinoma is curcumscribed and has an expansile. rather then infiltrative growth pattern, which may explain the lack of. nodal involvement. The margins are adequate.' In an addendum comment,. :ates: ""The closest margin from the left segmental. mastectomy (specimen C) is posterior (1.5 mm), however the separately. submitted new posterior margin (specimen D) is negative. The other. margins are negative by least 4 mm. Microscopic Description: A,B,D. Microscopic examination performed. C. The following template summarizes the findings in part C: Invasive Carcinoma: Present. Histologic type: Invasive mammary carcinoma, no special type. Histologic grade: High combined histologic grade, high. proliferative rate. Greatest dimension (pT) : 4.2 cm (pT2). Specimen margins : The margins are adequate (see comment in. diagnosis). Vessel invasion: Not identified. Calcification: Not identified. Ductal carcinoma in situ: Not identified. Comment: Please note that in addition to examining H&E stained. sections, representative blocks in part C were immunostained with. antibodies to p63 to aid in assessment. Prognostic markers: Previously performed (see. [A few of the antibodies used in our laboratory may be classified as. analyte specific reagents. These antibodies are monitored and. controlled in our laboratory and their performance for in vitro. diagnosis is well described in the medical literature. They have not. been cleared or approved by the FDA.]. Specimen. A. Left axillary sentinel node #1, hot, not blue, 1018. B. Left axillary sentinel node #2, hot, blue, 237. C. Left breast segmental mastectomy. D. Tissue posterior. to segmental mastectomy. Clinical Information. PRE-OP DIAGNOSIS: Left breast CA. Gross Description. A. Received fresh in a container labeled ""left axillary sentinel node. #1, hot, not blue, 1018"" is a 2.2 x 1.7 x 1 cm soft tan-pink lymph node. with some surrounding yellow adipose tissue. AS-4, following fixation. B. Received fresh in a container labeled ""left axillary sentinel node. #2, hot, blue, 237"" is a 2.5 x 2.2 x 1.2 cm portion of tissue. containing two soft tan-pink lymph nodes with surrounding yellow. adipose tissue, with the lymph nodes 1 and 1.5 cm in greatest. dimension. RS-4, following fixation, with the lymph nodes entirely. submitted, with the larger lymph node in blocks B2-B4. C. Received fresh in a. container labeled ""left breast. segmental mastectomy"" is a 7.3 x 5.7 x 4.3 cm portion of soft. tan-yellow breast tissue, with orienting sutures present. The margins. are inked as follows based upon the sutures: anterior - green;. posterior - black; lateral - orange; medial - red; inferior - blue;. superior - violet. The specimen is serially sectioned revealing a 4.2 x. 4.2 x 3.5 cm red-brown to white-tan nodular mass, which grossly comes. near to the medial, posterior, and anterior margins. RS-10, following. fixation, with tumor to closest medial margin in block C1, tumor to. closest lateral margin in block C2, tumor to closest anterior margin in. block C3, tumor to closest posterior margin in block C4, tumor to. closest superior margin in block C5, tumor to closest inferior margin. in block C6, and with additional sections of tumor in blocks C7-C10. D. Received fresh in a container labeled ""tissue posterior to segmental. mastectomy"" is a 1.7 x 1.2 x 1.2 cm portion of soft red-brown skeletal. muscle, with a suture indicating the new posterior border. The new. margin is inked. The specimen is sectioned and is without focal. lesion. AS-3, following fixation.",BRCA,0,"The report states that there is no evidence of metastatic carcinoma in the left axillary sentinel lymph nodes #1 and #2 (specimens A and B). The N stage is based solely on the number of involved axillary lymph nodes and does not consider other factors such as tumor size or distant metastasis. Therefore, the N stage for this patient is N0.",N0,3.0
