Unnamed: 0,patient_filename,t,text,type,n,cmem_t_reasoning,cmem_t_ans_str,cmem_t_num_update
1195,TCGA-E2-A14P.FD8CDFD9-6DCF-4CE1-9BB1-A7FF568EE53C,1,"SPECIMENS: A. RIGHT AXILLARY CONTENTS. B. RIGHT BREAST LUMPECTOMY. C. RIGHT BREAST SUPERIOR MARGIN. SPECIMEN(S): A. RIGHT AXILLARY CONTENTS. B. RIGHT BREAST LUMPECTOMY. C. RIGHT BREAST SUPERIOR MARGIN. INTRAOPERATIVE CONSULTATION DIAGNOSIS: B. Right breast, lumpectomy (Gross examination only): 3.0 cm firm tumor, 1.5 cm from deep margin. Satellite tumor. 1 cm from main tumor, 1 cm in diameter (1.0 cm from antero medial margin). By Dr. called to Dr. at. GROSS DESCRIPTION: A. RIGHT AXILLARY CONTENTS. Received in formalin in a container labeled with the patient name designated ""a. right axillary contents"" is a portion of. red-yellow firm adipose tissue measuring 10.1 x 8.5 x 3.7 cm. Multiple firm enlarged lymph nodes are identified,. ranging in size from 0.3 x 0.2 x 0.2 up to 3.5 x 2.5 x 2.0 cm. Cassettes are submitted as follows: A1-A2: representative sections, 1 lymph node. A3-A5: 1 lymph node. A6-A8: 1 lymph node. A9-A10: 1 bisected lymph node. A11: 1 bisected lymph node. A12: 4 lymph nodes. A13: 3 lymph nodes. A14: 3 lymph nodes. A15: 2 lymph nodes. A16: 3 lymph nodes. A17: 3 lymph nodes. A18-A20: additional possible lymph nodes. B. RIGHT BREAST LUMPECTOMY. Received fresh is an oriented 226 gm lumpectomy specimen, 15 x 10 x 4 cm. The specimen is partially surfaced. with a tan-pink ellipse of skin, 11.5 x 5.5 cm. The skin surface is grossly unremarkable. The specimen is inked as. follows: anterior-blue, posterior-black, superior-red, inferior-orange, medial-green, lateral-yellow. Specimen is. serially sectioned from superior to inferior into 6 slices; slice 1 being most superior, slice 6 being most inferior to. reveal a gray-white firm well circumscribed mass, 3.0 x 2.5 x 1.7 cm located in slice 2 and 3. Mass #1 measures 1.5. cm from the closest deep margin and 2.0 cm from the anterior margin. A 2nd possible satellite nodule is identified,. 0.8 x 0.7 x 0.6 cm, 0.6 cm medial to mass #1 located in slice 2. The 2nd mass measures <1.0 cm from all margins. The 2nd mass measures 0.6 cm from the medial margin. Mass #2 measures 0.6 cm from mass #1. The remaining. cut surface reveal predominantly yellow lobulated adipose tissue inter dispersed with gray-white fibrous tissue. A. portion of the specimen is submitted for tissue procurement and representative sections are submitted as follows: B1: area immediately adjacent to mass #1 slice 1. B2: perpendicular sections of the superior margin slice 1. B3: lateral margin slice 2. B4: posterior margin slice 2. B5: mass #1 slice 2. B6-B7: mass #1, bisected slice 2. B8-B9: #2, bisected slice 2. B10: medial margin slice 2. B11: skin slice 2. B12: lateral margin slice 3. B13-B14: mass #2 slice 3. B15: area immediately adjacent to mass #2 slice 3. B16: medial margin slice 3. B17: skin slice 3. B18: posterior margin slice 3. B19: area immediately adjacent to mass #1 slice 4. B20: medial margin slice 4. B21: medial and posterior margin slice 5. B22: lateral margin slice 5. B23: perpendicular section taken of the inferior margin slice 6 as per attached diagram. B24: posterior margin. B25: superior margin. C. RIGHT BREAST SUPERIOR MARGIN. Received in formalin is a 12 gm oriented fragment of fibrofatty tissue, 9.0 x 3.0 x 1.5 cm. The new true margin is. inked blue and the specimen is serially sectioned to reveal grossly unremarkable breast parenchyma. Entirely. submitted in cassettes C1-C10. DIAGNOSIS: A. AXILLARY CONTENTS, RIGHT, DISSECTION: - METASTATIC CARCINOMA TO 10 OF 24 LYMPH NODES WITH. EXTRANODAL EXTENSION, LARGEST METASTASIS IS 3.5 CM (10/24). B. BREAST, RIGHT, LUMPECTOMY: - INVASIVE DUCTAL CARCINOMA WITH SATELLITE NODULE. - SBR GRADE 3. - TUMOR MEASURES 3 CM AND 1.1 CM. - MARGINS, NEGATIVE FOR CARCINOMA. - LYMPHOVASCULAR INVASION IS PRESENT. - DUCTAL CARCINOMA IN SITU (DCIS), SOLID AND CRIBRIFORM TYPES,. NUCLEAR GRADE 3, WITH COMEDO NECROSIS, MINOR COMPONENT. - SKIN, NEGATIVE FOR CARCINOMA. C. BREAST, RIGHT, SUPERIOR MARGIN, EXCISION: - BREAST TISSUE, NEGATIVE FOR CARCINOMA. SYNOPTIC REPORT - BREAST. Specimen Type: Excision. Needle Localization: Laterality: Right. Invasive tumor: Present. Multifocality: Yes. WHO CLASSIFICATION. Invasive ductal carcinoma, NOS 8500/3. Tumor size: 3cm. Tumor site: Upper outer quadrant. Margins: Negative. Distance from closest margin: Greater than 1cm. all margins. Tubular score: 3. Nuclear grade: 3. Mitotic score: 2. Modified Scarff Bloom Richardson Grade: 3. Necrosis: Absent. Vascular/Lymphatic Invasion: Present. Lobular neoplasia: None. Lymph nodes: Axillary dissection. Lymph node status: Positive 10 /24 Extranodal extension. DCIS present. Margins uninvolved by DCIS: 0.4 cm from medial margin, focal. DCIS Quantity: Estimate 10%. DCIS type: Solid. Cribriform. DCIS location: Both associated and separate from invasive tumor mass. Nuclear grade: High. Necrosis: Present. ER/PR/HER2 Results. Performed on Case: ER: Negative. PR: Negative. HER2: Positive by IHC. Pathological staging (pTN): pT 2N3. SYNOPTIC REPORT - BREAST, ER/PR RESULTS. Specimen: Surgical Excision. Block Number: B14. ER: Negative Allred Score: 0 = Proportion Score 0 + Intensity Score. 0. PR: Negative Allred Score: 0 = Proportion Score 0 + Intensity Score 0. COMMENT: The Allred score for estrogen and progesterone receptors is calculated by adding the sum of the proportion score (0. = no staining, 1 = <1% of cells staining, 2 = 1 - 10% of cells staining, 3 = 11-30% of cells staining, 4 = 31-60% of. cells staining, 5 = >60% of cells staining) to the intensity score (1 = weak intensity of staining, 2 = intermediate. intensity of staining, 3 = strong intensity of staining), with a scoring range from 0 to 8. ER/PR positive is defined as an Allred score of >2 and ER/PR negative is defined as an Allred score of less than or. equal to 2. Methodology: Fixation Type and Length: Tissue was fixed in 10% neutral buffered formalin. -) for no less than 8 and no longer than 24 hours. Antibody and Assay Methodology: Mouse anti-human ER and. PR,. Comment: This assay Car; be used to select invasive breast cancer patients for hormone therapy (1). ER and PR analysis was performed on this case by immunohistochemistry utilizing the ER (ER 1D5, 1:100) and PR. (PGR 136, 1:100) antibody provided by Dako, following the manufacturer's instructions listed in the package insert. This assay was not modified, and adherence to all instruction and guidelines were strictly followed. Interpretation of. the ER/PR immunohistochemical staining characteristics is guided by published results in the medical literature (1),. information provided by the reagent manufacturer and by internal review of staining performance within the. Pathology Department. 1. Harvey JM, et al. Estrogen receptor status by immunohistochemistry is superior to the ligand-binding assay for. predicting response to adjuvant endocrine therapy in breast cancer. J Clin Oncol. 17:1474-1481, 1999. SYNOPTIC REPORT - BREAST HER-2 RESULTS. HER2 Status Results, Immunohistochemistry Evaluation. Specimen: Surgical Excision. Block Number: B14. Interpretation: POSITIVE. Intensity: 3+. % Tumor Staining: 100%. Fish Ordered: No. METHODOLOGY. Methodology: Fixation Type and Length: Tissue was fixed in 10% neutral buffered formalin. for no less than 8 and no longer than 24 hours. Antibody and Assay Methodology: Rabbit anti-human HER2,. HerceptestTM (FDA-approved test kit),. ). Control Slides Examined: External kit-slides. provided by manufacturer (cell lines with mign, low and regative HER2 protein expression), and in-house known. HER2 amplified control tissue were evaluated along with the test tissue. These control slides run along side of this. patient's sample showed appropriate staining. Adequacy of Specimen: Adequate, well preserved, clear-cut invasive. carcinoma identified for HER2 evaluation. Scoring Criterion and Scoring System: IHC Level of Expression(Score) /Tumor Cell Membrane Staining Pattern. Negative (0)/Absence of Staining. Negative (1+)/Faint Incomplete membrane Staining, >10% of Cells. Equivocal (2+)/Weak complete membrane Staining, >10% of Cells. Positive (3+)/Strong complete membrane Staining, >10% of Cells. Equivocal Category for HER2 IHC results: A HER2, 2+ staining result that is interpreted as equivocal may not. indicate gene amplification. A FISH test for HER2 gene amplification will be ordered for all HER2 IHC 2+ results. COMMENT. This assay can be used to select invasive breast cancer patients for Trastuzumab (Hereptin) therapy (1,2). Clinical. Trials have shown that Trastuzumab substantially increases the likelihood for an objective response and overall. survival for patients with metastatic HER2-positive breast cancer, regardless of whether HER2 tumor status was. determined as IHC 3+ or FISH positive. Trastuzumab added to adjuvant chemotherapy substantially increase. disease-free survival and decreases the risk of disease recurrence by about 50% for patients with early-stage HER2. protein over-expressed or gene amplified invasive breast cancer (3). HER2 analysis was performed on this case by immunohistochemistry utilizing the FDA approved Dako HercepTest. (TM) test kit following the manufacturer's instructions listed in the package insert. This assay was not modified, and. adherence to all instruction and guidelines were strictly followed. Interpretation of the HER2 immunohistochemical. staining characteristics is guided by published results in the medical literature (4), information provided by the. reagent manufacturer and by internal review of staining performance within the Pathology Department. HER2 TEST VALIDATION. This HER2 immunohistochemical assay has been validated according to the recently revised recommendations and. guidelines from the NCCN HER2 testing in Breast Cancer Task Force, and the jointly issued recommendations and. guidelines from ASCO and the CAP (5). 80 randomly selected breast cancer samples were tested for HER2 by IHC. as outline above and interpreted as, negative (score 0/1+) equivocal (score 2+) and positive (score 3+) without. knowledge of the previous reported results. These cases were also blindly read using two different FISH assay as amplified or non-amplified and. the. HER2/CEP17 ratios were recorded. After analyzing these results, there was 100% concordance between the IHC. and FISH results for cases that were interpreted as either positive or negative by IHC. 9 of the 80 cases were. interpreted as equivocal by IHC and of these 3/9 (33%) were non-amplified by FISH and 6/9 (66%) were found to be. amplified. The Pathology Department Immunohistochemistry laboratory takes full responsibility for this tests performance. and has programs in place to regularly monitor the proficiency and the interpretation of HER2 assays. The. laboratory also participates in external quality assurance HER2 programs including the CAP proficiency testing. program. REFERENCE. 1. Carlson RW, Anderson BO, Burstein HJ, et al., NCCN breast cancer clinical practice guidelines in oncology. J. Natl Compr Canc Netw. 2005;3:238-289. 2. Carlson RW, Brown E, Burstein HJ, et al., NCCN Task Force Report: adjuvant therapy for breast cancer. J Nati. Compr Canc Netw. 2006;4:S1-S26. 3. Romond EH, Perez EA, Bryant J, et al. Trastuzumab plus adjuvant chemotherapy for operable HER2-positive. breast cancer. N Eng J Med 2005;353(16):1673-84. 4. Leong ASY, Formby M, Haffajee Z, et al. Refinement of immunohistologic parameters for Her2/neu scoring. validation by FISH and CISH. Appl Immunohistochem Mol Morphol. 2006;14:384-389. 5. Wolff AC, Hammond EH, Schwartz JN, et al., American Society of Clinical Oncology/College of American. Pathologists Guideline Recommendations for Human Epidermal Growth Factor Recepto 2 Testing in Breast Cancer. Arch of Path and Lab Med 2007; 131:18-43. CLINICAL HISTORY: year old female with large right breast mass and satellite lesion (1 cm) anterior to main tumor. Now for. lumpectomy. PRE-OPERATIVE DIAGNOSIS: None given. Microscopia/Diagnostic Dictation: Pathologist,. Microscopic/Diagnostic Dictation: Pathologisi. Final Review: Pathologist,. Final: Pathologist,.",BRCA,3,"The report states that the largest contiguous tumor mass measures 3.0 cm in greatest dimension, which falls under the 'T2: Tumor size is more than 2 cm but not more than 5 cm in greatest dimension' category.",T2,7.0
840,TCGA-AR-A0TU.81A39E94-059E-4307-A75A-E8C051E9D0C3,1,"Breast, right, simple mastectomy: Infiltrating ductal carcinoma, Nottingham grade III (of III), forming a. well circumscribed mass (4.2 x 4.0 x 3.0 cm) (AJCC pT2) in the lower outer quadrant. Extensive tumor. necrosis is present. There is no associated in situ component. The nipple is uninvolved. The surgical. resection margins are negative for tumor. The closest margin (deep) is free by 0.3 cm. The surrounding. breast tissue shows non-proliferative fibrocystic changes. Lymph nodes, right axillary sentinel Nos. 1A, 1B, IC, and 2, excision: Multiple (4) right axillary sentinel. lymph nodes are negative for tumor. Blue dye is identified in lymph nodes Nos. 1A and 1B. No blue dye. is present in lymph nodes 1C or 2 [AJCC pNO(sn)]. Immunohistochemical cytokeratin stain was. performed on the paraffin embedded sentinel lymph node tissue and confirms the H&E impression. HER2/neu protein overexpression is negative, score of 1+, according to the interpretation guidelines in. the FDA-approved HercepTest. Estrogen: Negative, 0% nuclear staining. Progesterone: Negative, 0% nuclear staining. ER (Estrogen Receptor) test was developed and its performance characteristics determined by. It has not been cleared or approved by the U.S. Food. and Drug Administration.",BRCA,0,"The report states that the infiltrating ductal carcinoma forms a single, well-circumscribed mass with a greatest dimension of 4.2 cm. This falls within the T2 category of tumor size being more than 2 cm but not more than 5 cm in greatest dimension.",T2,8.0
1120,TCGA-D8-A1JD.332880ED-FE4E-4EE4-9E96-0A61BFCCA27E,1,"Nos page 1 / 2. copy No. Examination: Histopathological examination. Cost of diagnostic procedure. xamination No.: Gender: F. Material: 1. Total organ resection - left breast and axillary tissue. Expected time of examination: up to 8 working days. Clinical diagnosis: Cancer of the left breast - outer upper quad. Results of immunohistochemical examination: Estrogen receptors found in over 75% of neoplastic cell nuclei. Progesterone receptors found in 10-75% of neoplastic cell nuclei. HER2 protein stained with HercepTest™M by DAKO. Negative reaction in invasive cancerous cells ( Score = 1+ ). Macroscopic description: Left breast sized 19 x 18 x 5 cm removed along with axillary tissues sized 11 x 4.5 x 1.5 cm and a 19. x 10 cm skin flap. Weight 620 g. Tumour sized 2.8 x 1.5 x 2.5 cm on the border of upper quadrants, 4.5 cm from the upper. boundary, 0.2 cm from the base and 1.0 cm from the skin. Another tumour sized 0.5 x 0.7 x 0.5 cm found 1.5 cm away from the first one (margins: lower. boundary - 10 cm; base - 0.1 cm; skin - 3.5 cm). Microscopic description: Both tumours showing similar pattern. Carcinoma ductale invasivum bifocal - NHG2 (2 + 3 +1/7 mitoses/10 HPF, visual area diameter 0.55. mm). Foci of carcinoma ductale in situ DCIS found within the tumour (solid and cribrate type with high. nuclear atypia and comedo necrosis, 5% of the tumour). Reactio lymphocytaria peritumoralis. Mamilla sine laesionibus. Glandular tissue showing mastopathia fibrosa et cystica. AXILLARY LYMPH NODES: Metastases carcinomatosae in lymphonodis No III/XIV. Infiltratio capsulae lymphonodis et telae perinodalis. page 2 / 2. Gender: F. Histopathological diagnosis: Carcinoma ductale invasivum bifocale mammae sinistrae. Invasive bifocal ductal carcinoma of the left breast. Metastases carcinomatosae in lymphonodis axillae No. III/XIV. Cancer metastases in axillary lymph nodes. No. III/XIV. (NHG2, pT2, pN1a).",BRCA,1,"The report states that the largest contiguous tumor mass is 2.8 x 1.5 x 2.5 cm, which is more than 2 cm but not more than 5 cm in greatest dimension. This matches the criteria for T2 as defined in the rules.",T2,9.0
1347,TCGA-EW-A1P1.AE0C51EF-017E-4F53-968C-804110F9A7E6,1,"F. Pathologic Interpretation: A. Sentinel node #1 (. right FS: - Metastatic carcinoma into one lymph node (1/1). B. Sentinel node #2 I. ) FS: - Metastatic carcinoma into theree out of four lymph nodes (3/4). C. Sentinel node #3 (. FS: - One benign lymph node (0/1). D. Right breast lumpectomy, long - lateral, short - superior: - In situ and invasive carcinoma. - The entire tumor mass measures 2.3 cm in greatest dimensions. - The invasive component represents the majority of the tumor mass and is of Nottingham grade of 3 +3 +3=9/9. - Foci of vascular invasion are noted. - The in-situ component is of ductal type, high nuclear grade with central necrosis and calcifications (comedocarcindma). - All margins of resection appear free of invasive and intraductal carcinoma. - The closest margins of resection are the medial and anterior at 4 mm from the tumor. - The non-neoplastic breast tissue shows fibroproliferative disease, radial scar, atypical ductal hyperplasia and changes consistent. with previous biopsy site. D. Right axillary content: - Metastatic carcinoma into six out of twenty-thre lymph nodes (6/23). E. Level 3 (right) permanent: - Metastatic carcinoma into one out of three lymph nodes (1/3). Tumor Summary: Specimen Type Lumpectomy. Lymph Node Sampling: Axillary dissection. Specimen Size (for excisions less than total mastectomy): 6 cm in greatest dimensions. Laterality: Right. Tumor Site: Not specified. Size of Invasive Component: 2.3 cm in greatest dimensions. Histologic Type: Ductal. Histologic Grade (any grading system may be used; mitotic count is also required independent of the grading system): 3 +3 +3=9/9. Total Nottingham Score:9/9. Margins: Free. Pathologic Staging (pTNM). pT 2, N3, MX. SURGICAL PATHOL Report. NOTE: IDS-ER. Some PgR immunokissochemical 636-PR, A4RS-HER2. antibodies H-II=EGFR. are analyte All immunohistochemical specific reagents (ASRs) stains validated are used by with our formalin laborasory. or molecular These ASRs fixed. are paraffis clinically embedded useful indicators tissue. Derection that do not is by require Envision FDA Method. approval. the These results ciones are read are used: by a. pathologist as positive or negative. As the attending pathologist, / attest that I: (i) Examined the relevant preparation(s). for the specimen(s); and (ii) Rendered the diagnosis(es). Intraoperative Consultation. A. Sentinel node #1 (. right FS: Metastatic adenocarcinoma to one lymph node (1/1). B. Sentinel node #2 (. ) FS: Metastatic adenocarcinoma to three of four lymph nodes (3/4). C. Sentinel node #3 (. 1 FS: One lymph node, no tumor seen (0/1). 1 MD. Clinical History: None provided. Operation Performed. Right breast lumpectomy with sentinei node blopsy, possible axiliary node dissection; possible left breast reduction. Pre Operative Diagnosis: Breast cancer. Specimen(s) Received: A: Sentinel node #1. 1) right FS. B: Sentinel node #2 (. ) FS. C: Sentinel node #3 (. FS. D: Right breast lumpectomy, long - lateral, short - superior. E: Right axillary content. F: Level 3 (right) permanent. Gross Description: A. Received fresh is an irregular fragment of fibroadipose tissue, measuring 2.3 x 1.2 x 0.7 cm. One lymph node is ill-. defined. The lymph node is submitted in toto in one cassette for frozen section. B. Received fresh is an irregular fragment of fibroadipose tissue, measuring 3.2 x 1.7 x 0.9 cm. Four lymph nodes are. grossly identified. The lymph nodes are submitted in toto as follows: 1. One lymph node for frozen. 2. Lymph node for frozen section. C. Received fresh is an irregular fragment of fibroadipose tissue, measuring 1.9 x 1.1 x 0.7 cm. One lymph node is grossly. identified. The lymph node is submitted in toto in one cassette for frozen section. D. Received in formalin is a lumpectomy specimen measuring 6 cm from medial to lateral, 5.4 cm from superior to inferior. and 4.4 cm from anterior to posterior. The specimen has an ellipse of skin in the anterior surface measuring 3.8 x 0.9 cm. The specimen is labelled as follows: long stitch lateral; short stitch superior. The margin is inked as follows: Anterior. yellow, posterior black, superior blue, inferior green, medial red, lateral orange. Upon sectioning ill-defined fiem white and. SURGICAL PATHOL Report. tan mass is identified measuring 2.3 x 2 x 1.5 cm. The mass is 1 cm from the lateral margin up to 1.6 cm from. the. superior margin, 0.5 cm from the inferior margin, 0.5 cm from the posterior margin, 0.4 cm from the medial. margin and 0.4. cm from the anterior margin from the skin. Other areas of the mastectomy specimen show unremarkable ibroadipose. tissue. Representative sections are submitted as follows: 1. Lateral margin. 2. Superior margin. 3. Anterior margin and skin in relation with the tumor. 4. Medial margin in relation with the tumor. 5. Posterior margin in relation with the tumor. 6. Inferior margin in relation with the tumor. 7-8. Other areas of the mass. E. Received in formalin are multiple irregular fragments of fibroadipose tissue measuring 9 x 7.5 x 2.2 cm in aggregate. Five-. possible lymph nodes are identified. The lymph nodes are submitted in toto-. as follows: 1-2. One lymph node bisected per cassette. 3-4. Lymph node bisected per cassette. 5-6. Three lymph nodes bisected per c assette. 7-8. Four lymph nodes per cassette. F. Received in formalin are four irregular fragments of soft tan brown and yellow tissue measuring 1 x 0.5 x 0.4 cm in. aggregate. Submitted in toto in one cassette.",BRCA,3,"The report states that the size of the invasive component is 2.3 cm in greatest dimensions, which falls under the 'T2: Tumor size is more than 2 cm but not more than 5 cm in greatest dimension' category. Therefore, the T stage for this patient is T2.",T2,10.0
664,TCGA-A8-A095.41A41A7F-E4DD-4D3A-B97D-B4657CA211E1,0,"2. Invasive ductal breast carcinoma (maximum diameter 1.8 cm, malignancy grade II) with. angioinvasion and infiltration of the neural sheath in the tumor periphery. Likewise in the. tumor periphery a concomitant DCIS (malignancy grade II, procomponent of tumor < 10%). Distant fibrocystic parenchyma of the breast with fibroadenoma buds free of tumor and/or. DCIS. Tumor classification: G2 (L1, V0), pTlc, pNO (sn), MX, R0 (minimum width of dorsocranial. safety margin 1 cm!). 1711E1.",BRCA,0,"The report states that the maximum diameter of the invasive ductal breast carcinoma is 1.8 cm, which falls under the 'T1' category of 'Tumor size is 2 cm or less in greatest dimension'.",T1,11.0
1144,TCGA-D8-A1XG.AA869507-1B46-4812-8EC5-A4E01C588E6E,3,"page 1 / 1. copy No. Examination: Histopathological examination. Gender: F. Material: 1. Total organ resection - right breast. Expected time of examination: up to 8 working days. Clinical diagnosis: Cancer of the right breast, ulcerous - Toilet mastectomy. Macroscopic description: Right breast Sized 13.7 x 7.6 x 4.8 cm removed without axillary tissues and with a skin flap of 17.8 x 10.2 cm. Weight 193 g. Tumour sized 6.2 x 4.3 x 7.8 cm in the middle part, 0.1 cm from the upper boundary, 0.1 cm from the base. Microscopic description: Carcinoma ductale invasivum - NHG3 (3+2+3/20 mitoses/10 HPF - visual area: 0.55mm). Infiltratio carcinomatosa cutis et musculi pectoralis. Mamilla sine laesionibus. Glandular tissue showing parenchyma atrophy. Histopathological diagnosis: Carcinoma ductale invasivum mammae dextrae. Invasive ductal carcinoma of the right breast. Metastases carcinomatosae in lymphonodis axillae (No II/II). Cancer metastases of the axillary lymph nodes. (NHG3, pT4b, pN1a). Results of immunohistochemical examination: Estrogen receptors found in 10-75% of neoplastic cell nuclei. Progesterone receptors found in 10-75% of. neoplastic cell nuclei. HER2 protein stained with HercepTest™M by DAKO. Negative reaction in invasive cancerous cells ( Score = 0). Compliance valida.",BRCA,1,"The report indicates that the tumor size is 6.2 x 4.3 x 7.8 cm, which is more than 5 cm in greatest dimension, satisfying the 'T3: Tumor size is more than 5 cm in greatest dimension' rule. However, the report also mentions 'Tumor of any size with direct extension to the chest wall and/or skin', which is satisfied in this case, leading to a T4 stage. The T stage is based on the primary tumor size and its invasion into surrounding tissues, not on the presence of lymph node or distant metastases, so the information about lymph node metastases does not affect the T stage.",T4,12.0
871,TCGA-AR-A24L.BF82AD23-B40E-459F-83EC-590D392664FD,1,"Final Diagnosis. reast, right, wide local excision: Invasive ductal carcinoma, Nottingham grade 2 (of 3 3), forming a 2.5 x 2.1 x 1.0 cm mass(AJCC. PT2). Ductal carcinoma in situ, solid type, without necrosis and high nuclear grade identified. Angiovascular invasion present. After, re-excision of inferior and deep margins, all margins are negative by at least 1.0 cm. Skin ellipse identified without. abnormality. Lymph nodes, right axillary sentinel, excision: Multiple (2 of 5) sentinel lymph nodes are positive for metastatic breast carcinoma. (AJCC pN1). Lymph nodes, right axillary, excision: Multiple (7) right axillary lymph nodes are negative for tumor. Estrogen/progesterone analysis and Her2/Neu have been ordered on paraffin embedded tissue.",BRCA,1,"The report states that the invasive ductal carcinoma forms a 2.5 x 2.1 x 1.0 cm mass, which falls under the 'T2: Tumor size is more than 2 cm but not more than 5 cm in greatest dimension' category.",T2,13.0
