Unnamed: 0,patient_filename,t,text,type,n,cmem_t_reasoning,cmem_t_ans_str,cmem_t_num_update
1130,TCGA-D8-A1JN.021DF0B3-A535-4AD4-9545-1B9A7BC3E1E6,2,"page 1 / 2. copy No. Examination: Histopathological examination. PESEL: Gender: F. Material: Multiple organ resection - left breast. Expected time of examination: up to 8 working days. Clinical diagnosis: Results of immunohistochemical examination: Estrogen receptors found in 75% of neoplastic cell nuclei. Progesterone receptors found in 10% of neoplastic. cell nuclei. HER2 protein stained with HercepTest by DAKO. Score = 2+, verification by the FISH method recommended. Macroscopic description: Left breast sized 17.8 x 11.3 x 4.8 cm removed with axillary tissues sized 9 x 5 x 3 cm. Weight 400 g. Skin flap. 21.7 x 9.2 cm in size. Tumour sized 3.9 x 6.6 x 2.8 cm found in the central part, placed 1.4 cm from the upper. edge, 0.9 cm from the base and 0.0 cm from the skin. Status after blopsy (test No. Microscopic description: Carcinoma lobulare invasivum (G2 acc. to Elston: 3+2+1; 0 mitoses /10 HPF diam. 0.55 mm) Infiltratio. carcinomatosa cutis et mammillae. Glandular tissue showing parenchyma atrophy. Invasive lesions are placed 0.1 cm from the base of the surgical specimen. Axillary lymph nodes: Metastases. carcinomatosae in lymphonodo (No XI/XIII). Histopathological diagnosis: (including test No. Ca rei nom alobulare invasivum mammae sinistrae. Invasive lobular carcinoma of the left breast. Metastases carcinomatosae in lymphonodis axillae (XI/XIII) Cancer metastases in axillary lymph nodes (XI/XIII). (NHG2, pT3, pN3a). Examination: Histopathological examination page 2 / 2. PESEL: Gender: F. Results of immunohistochemical examination: RESULT OF HER2/neu GENE AMPLIFICATION with the FISH method by Path Vysion HER2 DNA Probe Kit. HER-2 GENE AMPLIFICATION NOT FOUND.",BRCA,3,"The report states that the size of the largest focus of invasive carcinoma is 3.9 x 6.6 x 2.8 cm. According to the rules provided, T3 tumors are more than 5.0 cm in size. However, the exact measurement of the tumor size in a single dimension is not explicitly stated in the report. Given that the largest dimension of the tumor is 6.6 cm, which is more than 5.0 cm, the T stage would be T3.",T3,16.0
843,TCGA-AR-A0TX.4FC34715-9004-4F53-B914-F0004AEA88C8,0,"Breast, left, wide local excision: Infiltrating ductal carcinoma, Nottingham grade II (of III), forming a. multilobulated mass (1.5 x 1.2 x 1.0 cm) adjacent to the prior core biopsy site (AJCC pTlc). Ductal. carcinoma in-situ, solid type, high nuclear grade, is present outside the main tumor mass. No. angiolymphatic invasion is identified. The skin is without diagnostic abnormality. All surgical resection. margins, after re-excision of the deep margin (skeletal muscle), are negative for tumor (minimum tumor. free margin, 0.4 cm, superior margin). Lymph nodes, left axillary, dissection: Multiple (3 of 25) left axillary lymph nodes are positive for. metastatic carcinoma with extranodal extension (AJCC pN1). Two positive lymph nodes are matted. together. Her-2/NEU has been ordered on paraffin embedded tissue.",BRCA,1,"The report states that the largest focus of invasive carcinoma is a multilobulated mass with dimensions of 1.5 x 1.2 x 1.0 cm. Based on the rules provided, T1 tumors are 2.0 cm or less in size, and are further divided into T1a (0.1-0.5 cm), T1b (0.5-1 cm), and T1c (>1 cm but not more than 2 cm) based on size. The mass in this report falls into the T1c category.",T1c,17.0
772,TCGA-AN-A0XP.80E9B7CE-0D5D-4C01-A8E3-E6345BE145EC,1,Sex: Female. Diagnosis: Breast Cancer Histological description: Infiltrative ductal carcinoma. Anatomic Site: Breast Tumor location: Primary. Tissue Specification: Tumor Specimen Matrix: Tissue Specimen Format: OCT. Container: block Type of Procurement: surgery Grade: 2. T Stage: 2 N Stage: 1 M Stage: 0 Treatment: none. Treatment Details: n/a. Normal Sample. Anatomic Site: Blood Sample Type: Normal Type of Procurement: blood draw. Matrix: Blood Specimen Format: frozen Container: tube.,BRCA,2,"The report specifies that the patient is a female with a diagnosis of breast cancer, specifically infiltrative ductal carcinoma. The T stage is provided as T2, which means the tumor is more than 2.0 cm but not more than 5.0 cm in size. The T stage is not affected by the presence of in situ carcinoma or the number of tumors, and is determined by the size of the largest tumor. The report also mentions that the tumor grade is 2, but this information is not relevant to the T stage prediction.",T2,18.0
876,TCGA-AR-A24Q.CCE8E855-2582-4214-B9B1-25F0431065CB,2,"Final Diagnosis. Yeast, left, simple mastectomy: Invasive ductal carcinoma, Nottingham grade III (of III), is identified forming a 6.0 x 4.0 x 3.5. cm tumor (AJCC pT3) in the central-upper inner region of the breast. The deep and lateral margins of resection are. negative. for. tumor. The closest margin is deep and is free by 1.0 cm. The overlying skin and nipple are not involved by carcinoma. Breast, right, simple mastectomy: Invasive ductal carcinoma, Nottingham grade III (of III), is identified forming a 1.7 x. 1.3. x. 1.0. cm tumor (AJCC pTlc) in the upper outer region of the breast. The deep and lateral margins of resection are negative for tumor. The closest margin is deep and is free by 2.8 cm. The overlying skin and nipple are negative for involvement by carcinoma. Lymph nodes, left axillary sentinel, excision: Multiple (2) left axillary sentinel lymph nodes, both containing blue dye, are. negative for metastatic carcinoma [(AJCC pNO (i-)]. Immunohistochemical cytokeratin stain was performed on the paraffin. embedded sentinel lymph node tissue and confirms the H&E impression. Lymph nodes, right axillary sentinel, excision: Multiple (4) right axillary sentinel lymph nodes are negative for tumor [(AJCC. pN0) (i-)]. A single lymph node (1A) contains blue dye. Immunohistochemical cytokeratin stains were performed on the paraffin. embedded sentinel lymph node tissue and confirm the H&E impression. Her-2/NEU has been ordered on paraffin-embedded tissue on the left breast.",BRCA,0,"The T stage is determined by the size of the largest tumor. In this report, the largest tumor is found in the left breast, measuring 6.0 x 4.0 x 3.5 cm (AJCC pT3), which is larger than the 5.0 cm threshold for T3 tumors.",T3,19.0
850,TCGA-AR-A0U4.6424BA69-DA2B-4CCD-ADDF-DB1BEDA11EBF,1,"Breast, right, simple mastectomy: Breast parenchymal tissue is negative for tumor. Focal calcifications. identified. The nipple is negative for tumor. A single intraparenchymal lymph node is negative for. tumor. Breast, left, simple mastectomy: Infiltrating ductal carcinoma, Nottingham grade III (of III), [tubules 3. (of 3), nuclei 3 (of 3), mitoses 2 (of 3); Nottingham score 7-8 (of 9) forming a 4.7 x 4.0 x 2.7 cm mass,. located in the upper outer quadrant of the breast (AJCCpT2). Ductal carcinoma in situ is absent. Angiolymphatic invasion is absent. No calcifications are present. The tumor does not involve the nipple,. overlying skin, or underlying chest wall. All surgical resection margins, including deep margin, are. negative for tumor (minimum tumor free margin, 1.7 cm, deep margin). Lymph nodes, left axillary sentinel, excision: Multiple (10) sentinel lymph nodes are negative for tumor. AJCC PN0(1-)(sn). Immunohistochemical stains were performed on paraffin embedded tissue from the breast tumor using. antibodies to ER, PR, and HER2/neu. Estrogen is negative, 0% nuclear staining. Progesterone is. negative, 0% nuclear staining. HER2/neu protein overexpression is negative, score of 0, according to the. interpretation guidelines in the FDA-approved HercepTest. ER (Estrogen Receptor) test was developed and its performance characteristics determined by. It has not been cleared or approved by the U.S. Food. and Drug Administration.",BRCA,0,"The report states that the patient has 'infiltrating ductal carcinoma, Nottingham grade III forming a 4.7 x 4.0 x 2.7 cm mass' in the left breast. The T stage is determined by the size of the largest tumor, and in this case, the tumor measures 4.7 cm, which falls under the T2 category of tumors that are more than 2.0 cm but not more than 5.0 cm in size.",T2,20.0
811,TCGA-AO-A129.DD973A0E-3CC3-4ED7-BE2C-7E5E3C55032B,1,"Clinical Diagnosis & History: Patient with left breast cancer IFDC on core left MRM and right prophylactic. TM and SLNB. Specimens Submitted: 1: SP: Left breast & axillary contents levels 1, with tags attached. 2: SP: Right breast. 3: SP: Level 3 axillary contents. 4: SP: Sentinel node #1, level one right axilla. 5: SP: Sentinel node #2. lovel one right axilla. DIAGNOSIS: 1). BREAST, LEFT AND AZILLARY CONTENTS, LEVELS I AND II; EXCISION: - INVASIVE DUCTAL CARCINOMA, WITH MEDULLARY FEATURES, HISTOLOGIC GRADE. II/ILI (MODERATE TUBULE FORMATION), NUCLEAR GRADE III/III (MARKED VARIATION. IN SIZE AND SHAPE) MEASURING 2.3 CM IN LARGEST DIMENSION MICROSCOPICALLY. - DUCTAL CARCINOMA IN SITU (DCIS) IS ALSO IDENTIFIED, SOLID TYPE WITH HIGH. NUCLEAR GRADE AND EXTENSIVE NECROSIS. -THE DCIS CONSTITUTES <- 25% OF THE TOTAL TUMOR MASS, AND IS PRESENT ADMIXED. WITH THE INVASIVE COMPONENT. - THE INVASIVE CARCINOMA IS LOCATED IN THE LOWER OUTER QUADRANT. THE DCIS. IS LOCATED IN THE LOWER OUTER QUADRANT. - NO INVOLVEMENT OF THE NIPPLE BY EITHER IN SITU OR INVASIVE CARCINOMA IS. IDENTIFIED. - NO CALCIFICATTONS ARE IDENTIFIED IN EITHER THE INVASIVE OR IN SITU. CARCINOMA. - NO VASCULAR INVASION IS NOTED. - NO INVOLVEMENT OF THE SURGICAL MARGINS BY EITHER INVASIVE OR IN SITU. CARCINOMA IS IDENTIFIED. - NO SKIN INVOLVEMENT BY CARCINOMA IS IDENTIFIED. - THE NON-NEOPLASTIC BREAST TISSUE IS UNREMARKABLE. - THE LYMPH NODE STATUS IS AS FOLLOWS (EXPRESSED AS THE NUMBER OF. POSITIVE LYMPH NODES IN RELATION TO THE TOTAL NUMBER OF LYMPH NODES. EXAMINED) : LEVEL I: 2/13; LEVEL II: 0/4. - THERE IS EXTRANODAL EXTENSION OF CARCINOMA. RESULTS OF SPECIAL STAINS (ER, PR, HER2-NEU) WILL BE REPORTED AS AN. ADDENDUM. 2). BREAST, RIGHT; EXCISION: - BENIGN BREAST PARENCHYMA WITH SECRETORY CHANGE. 3). LYMPH NODES, LEFT AXILLA, LEVEL III; EXCISION: - TWO BENIGN LYMPH NODES (0/2). 4). LYMPH NODES, SENTINEL #1, LEVEL I, RIGHT AXILLA; EXCISION: - TWO BENIGN LYMPH NODES (0/2) DEEPER LEVEL RECUTS AND SPECIAL. STAINS HAVE BEEN ORDERED. THE RESULTS WILL BE REPORTED IN AN ADDENDUM. 5). LYMPH NODE, SENTINEL #2, LEVEL I, RIGHT AXILLA; EXCISION: - BENIGN BREAST TISSUE. NO LYMPH NODE IDENTIFIED. I ATTEST THAT THE ABOVE DIAGNOSIS IS BASED UPON MY PERSONAL EXAMINATION OF. THE SLIDES (AND/OR OTHER MATERIAL), AND THAT I HAVE REVIEWED AND APPROVED. THIS REPORT. Special Studies: Special Stain. Comment. HER2-C. ER-C. PR-C. NEG CONT. IMM RECUT. NEG-HER2. AE1:AE3. CAM 5.2. AE1:AE3. CAM 5.2. NEG CONT. IMM RECUT. NEG CONT. IMM RECUT. Gross Description: 1). The specimen is received fresh, labeled, ""Left breast & axillary. contents levels 1,2 with tags attached"". It is a product of left modified. mastectomy, consisting of an ellipse of tan skin, breast tissue and axillary. tail designated as levels one and two. The skin measures 15.0 x 4.0 cm. The breast tissue measures 23.0 x 23.0 x 6.5 cm. The axillary tail site. measures 14.0 x 6.5 x 2.0 cm. The nipple is everted. No visible scars are. present on the skin surface. A scanty amount of skeletal muscle tissue is. present at the deep margin which is inked. The breast tissue was sectioned. to reveal an ill-defined pink-gray focally hemorrhagic rubbery tumor. completely surrounded by thickened fibrous tissue situated in the lower. outer quadrant, 3.5 em from the deep surgical margin. The fibrous tissue. surrounding the tumor abuts the deep surgical margin. The rest of the tissue. is. predominantly fibrous. Serial sectioning of the axillary tail reveals. ?age 3 of 5. multiple lymph nodes, ranging from 0.3 up to 1.5 cm in greatest dimension. Representative sections were submitted, portion of the tumor was given to. TPS. Summary of Sections: N nipple. T tumor. DM deep margin closest to the tumor. UOQ upper outer quadrant. LOQ lower outer quadrant. LIQ lower inner quadrant. LN1 lymph nodes level one. LN2 lymph nodes level two. 2). The specimen is received fresh, labeled, ""Right breast, (stitch marks. axillary tail)"" It is a product of right modified mastectomy consisting of. an. ellipse of tan skin with breast tissue. The skin measures 15.5 x 5.0 cm. The breast tissue measures 16.0 x 16.0 x 6.0 cm. The nipple is everted. Grossly no visible scars are present on the skin surface. There is a scanty. amount of skcletal muscle tissue present at the deep margin which is inked. The breast tiscue was sectioned to reveal fibrofatty tissue. The fibrous. tissue counts to approximately 55% of the entire breast tissue. Grossly. evert lesions were identified. No lymph nodes were present at the axillary. tail site. Representative sections were submitted. Summary of Sections: N nipple. OUQ upper outer quadrant. LOW lower outer quadrant. UIQ upper inner quadrant. LIQ lower inner quadrant. DM deep margin. AXT axillary tail site. 3). The specimen is received in formalin, labeled, ""Level 3 axillary. contents' It consists of three piece of fibroadipose tissue measuring in. aggregate 1.5 x 1.0 x 0.6 cm. Entirely submitted. Summary of Sections: U undesignated. 4). The specimen is received in formalin, labeled, ""Sentinel node #1,. level onc, right axilla"". It consists of a single piece of adipose tissue. meacuring 2.5 x 2.0 x 0.5 cm. Entirely submitted. Summary of Sections: U undesignated. 5). The specimen is received in formalin, labeled, Sentinel node #2,. level one right axilla"". It consists of a single piece of fibroadipose. tissue with embedded lymph node, measuring 0.8 cm in its greatest dimension. Entirely submitted. Summary of Sections: LN lymph node. Summary of Sections: Part 1: SP: Left breast & axillary contents levels 1,2 with tags attached. Block. Secr. Site. PCs. 5. ALN. 13. 2. BLN. 7. 1. DM. 3. 2. LIQ. 2. 2. LOQ. 2. 2. N. 2. 4. 4. 2. UIQ. 2. 2. UOQ. 2. Part 2: SP: Right breast. Block. Sect. Site. PCs. 1. AXT. 2. 1. DM. 3. 4. LIQ. 4. 4. LOQ. 4. 2. N. 2. 4. UIQ. 4. 4. UOQ. 4. Part 3: SP: Level 3 axillary contents. Block. Sect. Site. PCs. 1. U. 3. Part 4: SP: Sentinel node #1, level one right axilla. Block. Sect. Site. PCs. 2. 2. Part 5: SP: Sentinel node #2, level one right axilla. Block. Sect. Site. PCs. 1. LN. 1. Procedures/Addenda: Addendum. Date Complete. Addendum Diagnosis. ADDENDUM. SITE: LEFT BREAST. - ER-ICA: NEGATIVE. - PR-ICA: NEGATIVE. - HER2/NEU (HERCEPTEST) : NEGATIVE (STAINING INTENSITY OF 0) . CONTROLS ARE SATISFACTORY. Addendum. Date Complete: Addendum Diagnosis. ADDENDUM. SITE: SENTINEL LYMPH NODE, RIGHT AXILLA. PART #4. ADDITIONAL H&E STAINED SECTIONS AND IMMUNOHISTOCHEMICAL STAINS FOR. CYTOKERATINS (AE1:AE3 AND CAM 5.2) SHOW NO EVIDENCE OF METASTATIC TUMOR.",BRCA,1,"The report states that the largest focus of invasive carcinoma measures 2.3 cm in size. According to the rules provided, T1 tumors are 2.0 cm or less in size. Therefore, the T stage for this patient is T1.",T1,21.0
1252,TCGA-E2-A1LB.A868EC86-9CB6-445E-B961-5D4C57263548,1,"SPECIMENS: A. WLE RIGHT BREAST. B. RIGHT AXILLARY CONTENTS. SPECIMEN(S): A. WLE RIGHT BREAST. B. RIGHT AXILLARY CONTENTS. INTRAOPERATIVE CONSULTATION DIAGNOSIS: Part A, WLE Right breast, gross examination: Tumor 0.2-cm from posterior margin. Called to Dr. at. by Dr. GROSS DESCRIPTION: A. WLE RIGHT BREAST. Received fresh labeled with matching patient identifiers is an oriented (short-superior, long-lateral) 124. g, 9.7 (medial to lateral) x 9 x 3 cm lumpectomy with a slender fragment of tan skin 2.8 x 0.3 cm. The. specimen is inked as follows: anterior - blue, posterior - black, superior - red, inferior - orange, medial. green, lateral - yellow. The specimen is serially sectioned from medial to lateral into 7 slices revealing. a 2.8 x 2.5 x 1.4 cm ill defined firm tan mass approaching the closest posterior margin at 0.2 cm, and. superior margin at 0.5 cm. A portion of the specimen is submitted for tissue procurement. Representative sections are submitted as follows: A1-A2: Perpendicular sections medial margin. A3-A4: Section 2 anterior. A5: Section 2 posterior. A6: Section 3 inferior. A7: Section 3 anterior/superior. A8-A9: Section 3 superior. A10-A11: Section 4 lesion and posterior. A12: Section 4 anterior/inferior. A13-A16: Section 5, lesion and nearest posterior. A17-A18: Section 6, lesion and posterior/anterior. A19-A20: Section 6, lesion and superior. A21-A22: Perpendicular sections lateral margin. A23-A26: Medial margin. A27: Section 6, inferior aspect. A28: Lateral margin. A29: Lateral margin. A30: Section 5, superior margin. A31: Section 2, superior aspect. A32: Section 2, inferior aspect. A33: Section 5, inferior margin. A34: Section 2, superior aspect. B. RIGHT AXILLARY CONTENTS. Received in formalin in a container labeled with matching patient identifiers is a portion of red yellow. fibroadipose tissue measuring 10.7 x 5.9 x 2.5 cm. Multiple possible lymph nodes are identified ranging. in size from 0.3 x 0.3 x 0.3 up to 4 x 3.5 x 2 cm. Cassette summary: B1-B3: Representative sections, largest lymph node. B4: Two possible lymph nodes. B5: Two possible lymph nodes. B6: Four possible lymph nodes. B7: Four possible lymph nodes. B8: Two possible lymph nodes. B9: Two possible lymph nodes. B10: Three possible lymph nodes. B11-B15: Additional possible lymph nodes. DIAGNOSIS: A. BREAST, RIGHT, WIDE LOCAL EXCISION: - INVASIVE DUCTAL CARCINOMA, POORLY DIFFERENTIATED. (SBR GRADE 3), WITH APOCRINE FEATURES, AND SEVERAL FOCI OF. MICROINVASION ASSOCIATED WITH DCIS. - TUMOR MEASURES AT LEAST 3 CM IN GREATEST DIMENSION. INVASIVE CARCINOMA IS 2 MM FROM THE DEEP MARGIN. - EXTENSIVE LYMPHVASCULAR INVASION IS PRESENT. DUCTAL CARCINOMA IN SITU (DCIS), SOLID TYPE, NUCLEAR GRADE 3,. WITH NECROSIS AND ASSOCIATED LYMPHOID INFILTRATE, INVOLVING. LOBULES. DCIS IS PRESENT AT THE LATERAL MARGIN, IS WITHIN 1 MM OF THE. ANTERIOR/MEDIAL AND ANTERIOR MARGIN, AND IS WITHIN 2 MM. OF THE DEEP MARGIN. B. AXILLARY CONTENTS, RIGHT, DISSECTION: - METASTATIC CARCINOMA TO 2 OF 25 LYMPH NODES WITH LARGEST. METASTASIS MEASURING 4 CM (2/25). - NO EXTRACAPSULAR EXTENSION IS SEEN. SYNOPTIC REPORT - BREAST. Specimen Type: Excision. Needle Localization: Laterality: Right. Invasive Tumor. Present. Multifocality: Yes. WHO CLASSIFICATION. Invasive ductal carcinoma, NOS 8500/3. Tumor size: 3cm. Tumor Site: Upper outer quadrant. Margins: Negative. Distance from closest margin: deep. Tubular Score: 3. Nuclear Grade: 3. Mitotic Score: 2. Modified Scarff Bloom Richardson Grade: 3. Necrosis: Absent. Vascular/Lymphatic Invasion: Present. Lobular neoplasia: None. Lymph nodes: Axillary dissection. Lymph node status: Positive 2/25. DCIS present. Margins involved by DCIS: lateral margin. DCIS Quantity: Estimate 25%. DCIS Type: Solid. DCIS Location: Both associated and separate from invasive tumor mass. Nuclear grade: High. Necrosis: Present. ER/PR/HER2 Results. ER: Negative. PR: Negative. HER2: Positive by IHC. Performed on. Case: This case - the largest lymph node with metastasis. Pathological staging (pTN): pT 2N1. SYNOPTIC REPORT - BREAST, ER/PR RESULTS. Specimen: Surgical Excision. Block Number: B2 (Lymph node with metastasis). ER: Negative. Allred Score: 0 = Proportion Score 0 + Intensity Score 0. PR: Negative. Allred Score: 0 = Proportion Score 0 + Intensity Score 0. COMMENT: The Allred score for estrogen and progesterone receptors is calculated by adding the sum of the. proportion score (0 = no staining, 1 = <1% of cells staining, 2 = 1 - 10% of cells staining, 3 = 11-30% of. cells staining, 4 = 31-60% of cells staining, 5 = >60% of cells staining) to the intensity score (1 = weak. intensity of staining, 2 = intermediate intensity of staining, 3 = strong intensity of staining), with a scoring. range from 0 to 8. ER/PR positive is defined as an Allred score of >2 and ER/PR negative is defined as an Allred score. of less than or equal to 2. METHODOLOGY: Tissue was fixed in 10% neutral buffered formalin for no less than 8 and no longer than 24 hours. Immunohistochemistry was performed usina the mouse anti-human ER (ER 1D5, 1:100) and PR (PGR. 136, 1:100) provided by. following the manufacturer s instructions. This. assay was not modified. Interpretation of the ER/PR immunohistochemical stain is guided by published. results in the medical literature, information provided by the reagent manufacturer and by internal. review of staining performance. SYNOPTIC REPORT - BREAST HER-2 RESULTS. Specimen: Surgical Excision. Block Number: B2 (Lymph node with metastasis). Interpretation: POSITIVE. Intensity: 3+. % Tumor Staining: 100%. Fish Ordered: METHODOLOGY: Tissue was fixed in 10% neutral buffered formalin for no less than 8 and no longer than 24 hours. Her2 analysis was performed using the FDA approved. HercepTest (TM) test kit. using rabbit anti-human HER2. This assay was not modified. External kit-slides. provided by the manufacturer (cell lines with high, low and negative HER2 protein expression) and in-. house known HER2 amplified control tissue were evaluated along with the test tissue. Adequate, well. preserved, clear-cut invasive carcinoma was identified for HER2 evaluation. Interpretation of the HER2. immunohistochemical stain is guided by published results in the medical literature, information provided. by the reagent manufacturer and by internal review of staining performance. This assay has been validated according to the 2007 joint recommendations and guidelines from. ASCO and CAP and from the NCCN HER2 testing in Breast Cancer Task Force. Pathology. Department takes full responsibility for this test's performance. CLINICAL HISTORY: :year-old woman, right breast, upper outer 4 cm mass, IDC, ER/PR negative; HER-2/neu positive,. with palpable adenopathy, here for lumpectomy and axillary lymph node dissection. PRE-OPERATIVE DIAGNOSIS: Right breast cancer. Microscopic/Diagnostic Dictation; Pathologist,. Final Review: Pathologist,. Final Review: Pathologist,. Final: Pathologist.",BRCA,1,"The report states that the invasive ductal carcinoma measures at least 3 cm in greatest dimension, which falls under the T2 category. The specific sub-staging information (T2a, T2b, etc.) is not provided in the report.",T2,22.0
640,TCGA-A8-A084.6A49B3F9-6B43-4D74-A28B-C83BFE61EC7B,1,"Diagnosis: Poorly differentiated invasive ductal carcinoma (tumor diameter: 3.5 cm) with focally. marked intraductal patterns of spread. Concluding tumor classification: NOS, G III, pT2N1aLOV0RX. IGA-A8-A0S4-01A-PR.",BRCA,1,"The report specifies that the tumor diameter is 3.5 cm, which falls within the range for T2 tumors (>2.0 cm but not more than 5.0 cm).",T2,23.0
