Unnamed: 0,patient_filename,t,text,type,n,cmem_t_reasoning,cmem_t_ans_str,cmem_t_num_update
1260,TCGA-E2-A2P5.85E91C9F-9F61-4A25-B4D9-1BCBC7108F5E,1,"SPECIMENS: A. EXCISION RIGHT BREAST NEEDLE LOCALIZATION. B. LEFT BREAST AND AXILLARY CONTENTS. C. ADDITIONAL LEFT AXILLARY TISSUE. SPECIMEN(S): A. EXCISION RIGHT BREAST NEEDLE LOCALIZATION. B. LEFT BREAST AND AXILLARY CONTENTS. C. ADDITIONAL LEFT AXILLARY TISSUE. DIAGNOSIS: A. BREAST, RIGHT, NEEDLE LOCALIZATION EXCISIONAL BIOPSY: DUCTAL CARCINOMA IN SITU (DCIS), CRIBRIFORM TYPE, NUCLEAR. GRADE 2, WITH NECROSIS AND MICROCALCIFICATIONS. - DCIS IS PRESENT AT THE MEDIAL MARGIN, IS WITHIN 0.1 CM. OF THE POSTERIOR AND SUPERIOR MARGINS, AND IS WITHIN. 0.2 CM OF THE ANTERIOR MARGIN. - ATYPICAL INTRADUCTAL PAPILLOMAS, 0.1 CM FROM THE MEDIAL. MARGIN. - COMPLEX SCLEROSING LESION WITH EXTENSIVE LOBULAR CARCINOMA. IN SITU (LCIS), INTRADUCTAL PAPILLOMAS, SCLEROSING ADENOSIS,. APOCRINE METAPLASIA, AND MICROCALCIFICATIONS. NOTE: DCIS is present in 3 of 10 slides. On a single slide, DCIS measures 0.8 cm. Immunostains were. performed with appropriate positive and negative controls. SMMHC, p63, and calponin are positive,. showing no evidence of invasive carcinoma. B. BREAST, LEFT, AND AXILLARY CONTENTS, MODIFIED RADICAL MASTECTOMY: - INVASIVE LOBULAR CARCINOMA, NOTTINGHAM GRADE 3. - 3.3 CM IN SIZE. - EXTENSIVELY INVOLVES THE NIPPLE DERMIS. - LOBULAR CARCINOMA IN SITU (LCIS), PLEOMORPHIC TYPE, WITH. FOCAL NECROSIS. - MARGINS, NEGATIVE FOR CARCINOMA. - ATYPICAL DUCTAL HYPERPLASIA. - METASTATIC CARCINOMA IN 20 OF 24 LYMPH NODES WITH. EXTRANODAL EXTENSION, LARGEST METASTASIS IS 2.4 CM (20/24). C. ADDITIONAL AXILLARY TISSUE, LEFT, EXCISION: - METASTATIC CARCINOMA IN ONE LYMPH NODE AND TUMOR. IN FIBROADIPOSE TISSUE (1/1). NOTE: There is a 0.4 cm focus of invasive carcinoma in the fibroadipose tissue with no definite lymph. node adjacent to the focus and no breast parenchyma present. This focus is best interpreted as. extranodal extension. SYNOPTIC REPORT - BREAST. Specimens Involved. Specimens: A: EXCISION RIGHT BREAST NEEDLE LOCALIZATION. Specimen Type: Excision. Needle Localization: Yes - For mass. Laterality: Right. Invasive Tumor: Absent. Multifocality: N/A. WHO CLASSIFICATION. Intraductal proliferative lesions. Ductal carcinoma in situ 8500/2. DCIS present. Margins involved by DCIS: : medial margin. DCIS Type: Cribriform. DCIS Size (pure DCIS only): 0.8cm. Nuclear grade: Intermediate. Necrosis: Present. Location of CA++: DCIS. Benign epithelium. ER/PR/HER2 Results. ER: Positive. PR: Positive. Performed on Case: Pathological staging (pTN): pT is N X. Pathological staging is based on the AJCC Cancer Staging Manual, 7th Edition. SYNOPTIC REPORT - BREAST, ER/PR RESULTS. Specimens Involved. Specimens: A: EXCISION RIGHT BREAST NEEDLE LOCALIZATION. Specimen: Surgical Excision. Block Number: A2. ER: Positive. Allred Score: 8 = Proportion Score 5 + Intensity Score 3. PR: Positive. Allred Score: 8 = Proportion Score 5 + Intensity Score 3. COMMENT: The Allred score for estrogen and progesterone receptors is calculated by adding the sum of the. proportion score (0 = no staining, 1 = <1% of cells staining, 2 = 1 - 10% of cells staining, 3 = 11-30% of. cells staining, 4 = 31-60% of cells staining, 5 = >60% of cells staining) to the intensity score (1 = weak. intensity of staining, 2 = intermediate intensity of staining, 3 = strong intensity of staining), with a scoring. range from 0 to 8. ER/PR positive is defined as an Allred score of >2 and ER/PR negative is defined as an Allred score. of less than or equal to 2. METHODOLOGY: Tissue was fixed in 10% neutral buffered formalin for no less than 8 and no longer than 24 hours. Immunohistochemistry was performed usina the mouse anti-human ER (ER 1D5, 1:100) and PR (PGR. assay was not modified. Interpretation of the ER/PR immunohistochemical stain is guided by published. 136, 1:100) provided by. ) following the manufacturer S instructions. This. results in the medical literature, information provided by the reagent manufacturer and by internal. review of staining performance. SYNOPTIC REPORT - BREAST. Specimens Involved. Specimens: B: LEFT BREAST AND AXILLARY CONTENTS. C: ADDITIONAL LEFT AXILLARY TISSUE. Specimen Type: Mastectomy. Needle Localization: Laterality: Left. Invasive Tumor: Present. Multifocality: No. WHO CLASSIFICATION. Invasive lobular carcinoma 8520/3. Tumor size: 3.3cm. Tumor Site: Central. Margins: Negative. Distance from closest margin: 0.9cm. deep. Tubular Score: 3. Nuclear Grade: 3. Mitotic Score: 2. Modified Scarff Bloom Richardson Grade: 3. Necrosis: Absent. Lobular neoplasia: LCIS. Lymph nodes: Axillary dissection. Lymph node status: Positive 21/25 Extranodal extension. DCIS not present. ER/PR/HER2 Results. ER: Positive. PR: Positive. HER2: Negative by FISH. Performed on Case: Pathological staging (pTN): pT 2 N 3. Pathological staging is based on the AJCC Cancer Staging Manual, 7th Edition. GROSS DESCRIPTION: A. EXCISION RIGHT BREAST NEEDLE LOCALIZATION. Received fresh labeled with the patient's identification and ""right breast needle localization"" is an. oriented (short stitch-superior, long stitch-lateral, double stitch-deep), 35 g, 5.5 x 5.5 x 2.5 cm needle. localized lumpectomy with radiographs. Ink code: Anterior-yellow, posterior-black, medial-green, lateral-. red, superior-blue, inferior-orange. The specimen is serially sectioned from medial to lateral into 7 slices. revealing a 1.7 x 0.7 X 0.4 cm gritty, lobulated white tumor that is closest to the anterior margin at 0.1. cm. A clip is identified in slice 2. No additional lesions are noted. Representatively submitted: A1-medial margin. A2-slice 2, superior margin. A3-4-slice 2, anterior/posterior margins to tumor. A5-A8-slice 3, full cross-section/tumor. A9-slice 4, additional deep margin to firmer fibrous tissue. A10-lateral margin. B. LEFT BREAST AND AXILLARY CONTENTS. Received fresh labeled with the patient's identification and ""left breast and axillary contents"" is an. oriented 1150 g, 26 x 21 X 4 cm mastectomy with a 15 x 7 cm skin ellipse and 1.5 cm in diameter. inverted nipple. There is also 15 x 11 cm attached axillary tissue. Ink code: Posterior-black, anterior. superior-blue, anterior inferior-orange. The specimen is serially sectioned into 12 slices from medial to. lateral with nipple in slices 5/6 revealing a retroareolar, 3.3 x 3 x 2.7 cm infiltrative, gritty indurated,. lobulated tan to white tumor in slices 5 and 6, closest to the anterior margin (areolar skin) at 0.5 cm. No. additional lesions are identified. There are 24 possible lymph nodes identified, ranging from 0.2 cm to. 2.4 cm in greatest dimension. Representatively submitted: B1-deep margin closest to tumor, slice 5. B2-B3-entire nipple, slices5-6. B4-tumor to closest anterior (skin) margin, slice 6. B5-B7-additional tumor, slice 6. B8-UOQ, slice 9. B9-LOQ, slice 8. B10-UIQ, slice 4. B11-LIQ, slice 4. B12-superior skin margin, shave. B13-6 lymph nodes. B14-one trisected lymph node. B15-6 lymph nodes. B16-5 lymph nodes. B17-one bisected lymph node. B18-2 lymph nodes. B19-2 lymph nodes. B20-one lymph node. LH. C. ADDITIONAL LEFT AXILLARY TISSUE. Received in formalin labeled with patient's identification and ""additional left axillary tissue"" is adipose. tissue measuring 3 x 2.5 X 1 cm in aggregate. Representative sections submitted in C1. CLINICAL HISTORY: ; year-old female with multicentric left breast cancer; FNA-positive lymph nodes and right mass biopsy. shows atypia, left mass retroareolar, right atypical ductal hyperplasia at 12:00. PRE-OPERATIVE DIAGNOSIS: Invasive pleomorphic lobular carcinoma retroareolar, left breast. Microscopic/Diagnostic Dictation:,. Microscopic/Diagnostio Dictation:,. Final Review:., Pathologist,. Final:., Pathologisi.",BRCA,3,"The T stage is determined by the size of the primary tumor. In this report, the left breast and axillary contents show an invasive lobular carcinoma that is 3.3 cm in size. Therefore, the T stage is T2.",T2,0.0
1235,TCGA-E2-A1BD.DF746E32-AD2F-49CB-9AA6-4F8494C16B20,1,"SPECIMENS: A. SENTINEL NODE 1 RIGHT AXILLA. B. WLE RIGHT BREAST NEEDLE LOCALIZATION. SPECIMEN(S): A. SENTINEL NODE 1 RIGHT AXILLA. B. WLE RIGHT BREAST NEEDLE LOCALIZATION. GROSS DESCRIPTION: A. SENTINEL NODE 1 RIGHT AXILLA. Received fresh is a tan pink lymph node 1.8 x 1.1 x 0.5cm. The specimen is serially sectioned and three. touch preps are taken. Toto A1. B. WLE RIGHT BREAST NEEDLE LOCALIZATION. Received fresh labeled with the patient's identification and ""WLE right breast needle localization"" is an. oriented 98g, 8 x 4.5 x 4cm needle localized lumpectomy with radiograph. Ink code: anterior-yellow,. posterior-black, superior-blue, inferior-orange, medial-green, lateral-red. Specimen is serially sectioned. from superior to inferior into 11 slices revealing a tan white firm stellate mass 2.3 x 1.8 x 1.7cm, 0.4cm. from the closest medial margin and 0.5cm from the anterior margin in slices 8-10. A portion of the. specimen is submitted for tissue procurement. Representatively submitted: B1: superior margin slice 1. B2: slice 2. B3-B4: slice 3. B5-B7: slice 4. B8-B10: slice 5. B11-812: slice 6. B13-B16: slice 7. B17-B20: slice 8 with mass in B17. B21: mass slice 9. B22: superior margin slice 9. B23: anterior margin slice 9. B24: anterior margin slice 9. B25: inferior margin slice 9. B26: deep margin slice 9. B27: mass slice 10. B28-B29: slice 10. B30: perpendicular sections of inferior margin slice 11. DIAGNOSIS: A. SENTINEL NODE 1, RIGHT AXILLA: - ONE REACTIVE LYMPH NODE (1), NO METASTATIC CARCINOMA IS SEEN. B. WIDE LOCAL EXCISION, RIGHT BREAST, NEEDLE LOCALIZATION: - INVASIVE DUCTAL CARCINOMA, SEE SYNOPTIC REPORT. SYNOPTIC REPORT - BREAST. Specimen Type: Excision. Needle Localization: Laterality: Right. Invasive Tumor: Present. Multifocality: No. WHO CLASSIFICATION. Invasive ductal carcinoma, NOS 8500/3. Tumor size: 2.3cm. Additional dimensions: 1.8cm x 1.7cm. Margins: Negative. Distance from closest margin: Less than 0.2cm. anterior. Tubular Score: 2. Nuclear Grade: 2. Mitotic Score: 2. Modified Scarff Bloom Richardson Grade: 2. Necrosis: Absent. Vascular/Lymphatic Invasion: Indeterminate. Lobular neoplasia: None. Lymph nodes: Sentinel lymph node. Lymph node status: Negative 0/1. Micrometastases: Non-neoplastic areas: fibrocystic disease. DCIS present. Margins uninvolved by DCIS. DCIS Quantity: Estimate 2%. DCIS Type: Solid. Cribriform. DCIS Location: Associated with invasive tumor. Nuclear grade: Low. Necrosis: Absent. ER/PR/HER2 Results. ER: Positive. PR: Positive. HER2: Negative by FISH. Performed on Case: Pathological staging (pTN): pT2pNO pT 2 N. Pathological staging is based on the AJCC Cancer Staging Manual, 7th Edition. CLINICAL HISTORY: female with right breast mass, biopsy shows ? ductal carcinoma. PRE-OPERATIVE DIAGNOSIS: Right breast carcinoma. INTRAOPERATIVE CONSULTATION: TPA- SLN #1 right axilla: Negative for tumor cells. Diagnosis called to Dr. at. Dr. ADDENDUM: ONCOTYPE DX BREAST CANCER ASSAY. RESULTS: Recurrence Score: 10. CLINICAL EXPERIENCE: Patients with a recurrence score of: 10 in the clinical validation study. had an average rate of Distant Recurrence at 10 years of 7%. ER Score: 11.1 Positive. PR Score: 10 Positive. Her2 Score: 8.9 Negative. Interpretation: ER. Negative < 6.5. Positive >= 6.5. PR. Negative < 5.5. Positive >= 5.5. Her2 Negative <10.7 Positive 11.5 Equivocal = 10.7 - 11.4. >=. See separate. report for further information. Final Review:., Pathologist. Final:., Pathologist,. Addendum: Pathologist,. Addendum Final: Pathologist,.",BRCA,0,"The T stage is determined by the size of the primary tumor. According to the report, the size of the tumor is 2.3 cm, which falls under the T2 category of tumors that are more than 2.0 cm but not more than 5.0 cm in size.",T2,1.0
