Unnamed: 0,patient_filename,t,text,type,n,cmem_t_reasoning,cmem_t_ans_str,cmem_t_num_update
1267,TCGA-E2-A574.F3FAB505-03FF-4FAA-ABB6-96AD20F47871,1,"SPECIMEN(S): A. PAPILLOMA MEDIAL LEFT BREAST. B. EXCISION LEFT BREAST CANCER. C. SENTINEL LYMPH NODE #1 LEFT AXILLA. D. SENTINEL LYMPH NODE #2 LEFT AXILLA. CLINICAL HISTORY: 1) Cancer 2 cm in axillary tail left breast. 2) Medial left breast mass - Papilloma by core biopsy. PRE-OPERATIVE DIAGNOSIS: None Given. INTRA-OPERATIVE DIAGNOSIS. B: Lumpectomy, left breast, excision; margins check: Mass is located 0.2 cm from the. posterior margin. Reported to Dr. by Dr. DIAGNOSIS: A. BREAST, LEFT MEDIAL, EXCISION: - INTRADUCTAL PAPILLOMA. - APOCRINE METAPLASIA AND COLUMNAR CELL CHANGE. - BIOPSY SITE CHANGES. - SURGICAL MARGINS NEGATIVE FOR TUMOR. B. BREAST, LEFT, EXCISION: - INVASIVE DUCTAL CARCINOMA, 2.3 CM IN GREATEST DIMENSION, SBR. GRADE 3. - SURGICAL MARGINS NEGATIVE FOR TUMOR. - BIOPSY SITE CHANGES. - SEE SYNOPTIC REPORT. C. LYMPH NODES, SENTINEL #1, LEFT AXILLA: - TWO LYMPH NODES NEGATIVE FOR METASTATIC CARCINOMA (0/2). D. LYMPH NODES SENTINEL #2, LEFT AXILLA: TWO LYMPH NODES NEGATIVE FOR METASTATIC CARCINOMA (0/2). SYNOPTIC REPORT - BREAST. Specimens Involved. Specimens: B: EXCISION LEFT BREAST CANCER. Specimen Type: Excision. Needle Localization: Yes - For mass. Laterality: Left. Invasive Tumor: Present. Multifocality: No. WHO CLASSIFICATION. Invasive ductal carcinoma, NOS 8500/3. Tumor size: 2.3cm. Additional dimensions: 2. 1cm x 2cm. Tumor Site: Not specified. Margins: Negative. Distance from closest margin: 0.3cm. deep. Tubular Score: 2. Nuclear Grade: 3. Mitotic Score: 3. Modified Scarff Bloom Richardson Grade: 3. Necrosis: Present. Vascular/Lymphatic Invasion: None identified. Lobular neoplasia: None. Lymph nodes: Sentinel lymph node. Lymph node status: Negative 0/4. DCIS not present. ER/PR/HER2 Results. ER: Negative. PR: Negative. HER2: Negative by FISH. Performed on Case: Pathological staging (pTN): pT 2N0. Pathological staging is based on the AJCC Cancer Staging Manual, 7th Edition. GROSS DESCRIPTION: A. APILLOMA MEDIAL LEFT BREAST. Received fresh/in formalin labeled with the patient's identification and designated. ""papilloma medial left breast"" is an oriented (single anterior, double lateral, triple. superior), previously inked, 14 g, 4.3 x 3.2 x 2.1 cm needle localized excision. Ink code: anterior-yellow, posterior-black, medial-green, lateral-red, superior-blue, inferior-orange. The specimen is serially sectioned from medial to lateral into 7 slices revealing firm,. focally hemorrhagic breast parenchyma. No lesions or nodules are grossly appreciated. Entirely submitted as per the attached diagram: A1: Perpendicular sections medial margin. A2-A3: Slice 2, bisected. A4-A5: Slice 3, bisected. A6-A7: Slice 4, bisected. A8-A9: Slice 5, bisected. A10-A11: Slice 6, bisected. A12-A13: Perpendicular sections lateral margin. B. EXCISION LEFT BREAST CANCER. Received fresh labeled with the patient's identification and designated ""excision left. breast cancer"" is an oriented (triple - superior, double - lateral, single - anterior), 46 g,. (Medial to lateral - 6.5 cm, superior to inferior - 5.4 cm, anterior to posterior - 3.5 cm). lumpectomy specimen. (The specimen is previously inked) Ink code: anterior-yellow,. posterior-black, medial-green, lateral-red, superior-blue, inferior-orange. The specimen is. serially sectioned from medial to lateral into 9 slices revealing a 2.3 x 2.1 x 2 cm, tan-. white to tan-pink, firm to hard mass that is closest to the posterior margin at 0.2 cm, in. slices 6 to 9. Tissue is procured. Representatively submitted in 18 cassettes as per the attached diagram: B1: slice 1 entire, perpendicular sections of the medial margin. B2: slice 2, representative anterior margin. B3: slice 3, representative posterior margin with the mass. B4-B5: slice 4, sections of the mass showing the closest posterior margin,. B6-B7: slice 5, mass with anterior and posterior margins. B8: slice 5, superior margin. B9-B10: slice 6, mass with anterior and posterior margins. B11: slice 6, inferior margin. B12-B13: slice 6, superior margin. B14-B15: slice 7, representative anterior and key and posterior margins. B16: slice 8, posterior margin. B17-B18: slice 9, lateral margin, perpendicular sections. C. SENTINEL LYMPH NODE #1 LEFT AXILLA. Received in formalin with the patient's identification and designated ""sentinel lymph. node #1 left axilla"" is a 3.2 x 1.5 x 1.2 cm fibrofatty tissue within which 2 lymph nodes, 2. x 1.3 x 0.7 cm and 2.5 x 1.2 x 1 cm are identified. The lymph nodes are serially sectioned. and entirely submitted in 2 cassettes, C1-C2. D. SENTINEL LYMPH NODE #2 LEFT AXILLA. Received in formalin with the patient's identification and designated ""sentinel lymph. node #2 left axilla"" is a 3.5 x 2.5 x 0.8 cm fibrofatty tissue within which 2 lymph nodes,. 1.2 x 1 x 0.5 cm and 0.5 x 0.4 x 0.3 cm are identified. The lymph nodes are serially. sectioned and entirely submitted in 2 cassettes, d1-D2.",BRCA,0,"The T stage is determined by the size of the largest focus of invasive carcinoma. The report indicates that the size of the invasive ductal carcinoma is 2.3 cm, which falls within the T2 category of tumors that are more than 2.0 cm but not more than 5.0 cm in size.",T2,32.0
993,TCGA-BH-A0C3.3A54CF6E-AFDB-4609-A827-77D75BB376A7,0,"FINAL DIAGNOSIS: PART 1: LYMPH NODE, LEFT AXILLARY SENTINEL NODE #1, BIOPSY -. TWO SENTINEL LYMPH NODES, NEGATIVE FOR CARCINOMA (0/2). PART 2: LYMPH NODE, LEFT AXILLARY SENTINEL NODE #2, BIOPSY -. TWO SENTINEL LYMPH NODES, NEGATIVE FOR CARCINOMA (0/2). PART 3: BREASI, LEET, 12 O'CLOCK SEGMENTAL MASTECTOMY -. A. INFILTRATING MAMMARY CARCINOMA, WITH MIXED DUCTAL AND LOBULAR PHENOTYPES, NOTTINGHAM. GRADE 2/3 (TUBULE FORMATION: 3, NUCLEAR PLEOMORPHISM. 3, MITOTIC ACTIVITY: 1, TOTAL SCORE: 7/9). B. THE INVASIVE CARCINOMA MEASURES 1.9 CM IN GREATEST DIMENSION (GROSS MEASUREMENT). C. DUCTAL CARCINOMA IN SITU (DCIS), NUCLEAR GRADE 2, SOLID TYPE. D. DCIS CONSTITUTES LESS THAN 5% OF THE TOTAL TUMOR MASS, AND IS PRESENT ADMIXED WITH THE. INVASIVE CARCINOMA. E. SURGICAL MARGINS ARE NEGATIVE FOR INFILTRATING CARCINOMA AND DCIS. INFILTRATING CARCINOMA. IS 0.3 CM FROM THE CLOSEST POSTERIOR MARGIN (3I). F. NO LYMPHOVASCULAR INVASION IDENTIFIED. G. FOCAL DUCTAL EPITHELIAL HYPERPLASIA. H. PREVIOUS BIOPSY SITE CHANGES. I. FIBROCYSTIC CHANGES WITH APOCRINE HYPERPLASIA AND SCLEROSING ADENOSIS. J. IMMUNOSTAIN FOR ESTROGEN RECEPTOR IS POSITIVE. NEGATIVE. CASE SYNOPSIS: SYNOPTIC - PRIMARY INVASIVE CARCINOMA OF BREAST. LATERALITY: Left. PROCEDURE: Segmental. Upper outer quadrant. SIZE OF TUMOR: Maximum dimension invasive component: 1.9 cm. MULTICENTRICITY/MULTIFOCALITY OF INVASIVE FOCI: TUMOR TYPE (invasive component): Ductal adenocarcinoma, NOS, Infiltrating lobular carcinoma. HISTOLOGIC TYPE: Classical. NOTTINGHAM SCORE: Nuclear grade: 3. Tubule formation: 3. Mitotic activity score: 1. Total Nottingham score: 7. Nottingham grade (1, 2, 3): 2. ANGIOLYMPHATIC INVASION: DERMAL LYMPHATIC INVASION: Not applicable. CALCIFICATION: TUMOR TYPE, IN SITU: Solid, DCIS admixed with invasive carcinoma. SURGICAL MARGINS INVOLVED BY INVASIVE COMPONENT: SURG MARGINS INVOLVED BY IN SITU COMPONENT: LYMPH NODES POSITIVE: 0. LYMPH NODES EXAMINED: 4. METHOD(S) OF LYMPH NODE EXAMINATION: H/E stain. SENTINEL NODE METASTASIS: NON-NEOPLASTIC BREAST TISSUE: FCD. T STAGE, PATHOLOGIC: pT1c. N STAGE, PATHOLOGIC: pNO. M STAGE, PATHOLOGIC: pMX. ESTROGEN RECEPTORS: positive. PROGESTERONE RECEPTORS: negative. zero or 1+. COMMENT: invasive HER2/NEU: carcinoma show features of lobular carcinoma in H&E sections. ductal carcinoma The immunohistochemical (membranous stains stains for for E-. E-. The tumors cells show the patten of E-cadherin and strong. diffuse cytoplasmic stain for P120.",BRCA,0,"According to the report, the size of the largest focus of invasive carcinoma is 1.9 cm, which falls within the range for T1 tumors (2.0 cm or less). However, since it is more than 1.0 cm, it is specifically a T1c tumor. The presence of in situ carcinoma, the number of tumors, angiolymphatic invasion, involvement of the nipple or overlying skin, and lymph node metastasis do not affect the T stage. Therefore, the T stage for this patient is T1c.",T1c,33.0
953,TCGA-B6-A400.AF83CCA2-3AA4-4933-B6AD-9C11DF501DDD,1,"AP Surgical Pathology: Corrected. CLINICAL HISTORY: Not provided. GROSS EXAMINATION: A. ""Left axilla non-sentinel node (AF1) "". Received fresh for frozen section is. a 1.8 x 1 x 0.6 cm tan-yellow lymph node candidate which is bisected and. frozen as AF1, the frozen section remnant is submitted in block A1. B. ""Left sentinel node number one (BF1) "". Received fresh for frozen section. are three tan-yellow lymph node candidates. The larger lymph node candidate (2. x 1.2 x 1 cm) is bisected and frozen as BF1, and frozen section remnant is. submitted in block B1. The remaining two lymph node candidates (0.5 x 0.5 x. 0.3 cm and 1 x 0.7 x 0.4 cm lymph node candidate) are submitted in toto as. frozen section BF2, and the frozen remnant is submitted in block B2. C. ""Left sentinel node number two (CF1) Received fresh for frozen section is. a 3 x 2.5 x 0.8 cm fragment of tan-yellow fibrofatty tissue. One lymph node. candidate is identified (1.9 x 1 x 0.7 cm) which is bisected and frozen as. CF1. The frozen section remnant is submitted in block C1. D. ""Left breast cancer, 1:00"", received fresh and placed in formalin: Procedure: Wire guided partial mastectomy. Specimen orientation: Suture: long=lateral, short-superior. Clips: two clips. medial, one clip=inferior. Specimen dimensions: Medial to Lateral: 8.5 cm. Anterior to Posterior: 2.5 cm. Superior to Inferior: 9.5 cm. Skin dimensions: 4.3 x 1.3 cm with a 0.4 cm long scar. Margins inked: Superior: Red. Inferior: Yellow. Anterior: Blue. Posterior: Black. Sectioned: Medial to lateral. Gross findings: There is a tan-white indurated ill defined area with. peripheral hemorrhage and fat necrosis. Lateral and superior to this area is a. second focus of white-tan induration with adjacent thick white-tan fibrous. tissue. The remaining parenchyma is tan-yellow lobulated adipose tissue. Gross tumor size: 2.3 x 2.1 x 1.2 cm. Multifocal tumor: Additional lesion is 1.2 x 0.8 x 0.5 cm which directly abuts. the primary focus. Distance of tumor from gross surgical margin for the primary tumor: Superior: 2.1 cm. Inferior: 3.2 cm. Anterior: 0.6 cm. Posterior: 1.2 cm. Medial: 4.2 cm. Lateral: 1 cm. Additional lesion: Superior: 3.1 cm. Inferior: 2 cm. Anterior: 1 cm. Posterior: 1 cm. Medial: 6.9 cm. Lateral: 0.5 cm. Sectioned specimen radiographed? Yes. Radiograph findings: Mass: Yes. Microcalcifications: Yes. Biopsy site microclip: No. Specimen photograph? Yes. Block diagram? Yes. Sections submitted from medial to lateral in blocks D1 through D35. Specimen completely submitted? No. BLOCK SUMMARY: Medial margin-D1. Lateral margin-D34 and D35. Inferior margin: D13. Superior margin: D19. Anterior and posterior margins: D23. Primary tumor: D10, D11, D15, D16, D17, D18, D21, D22, D23, D24, D25, D27,. D28, D31, D33. Secondary lesion: D25, D27, D28, D31, D32, D33. Microcalcifications: D12, D15, D16, D17, D18, D20, D23, D25, D33. E. ""Left axillary mass, long stitch-lateral, short-superior"", received fresh. and placed in formalin: Procedure: Wire guided partial mastectomy. Specimen orientation: Long stitch lateral, short stitch superior. Specimen dimensions: Medial to Lateral: 5.6 cm. Anterior to Posterior: 1 cm. Superior to Inferior: 3.6 cm. Margins inked: Superior: Red. Inferior: Yellow. Anterior: Blue. Posterior: Black. Sectioned: Medial to lateral. Gross findings: A well circumscribed white-brown nodule with an embedded. microclip in the medial portion. Lateral to this first nodule is a second ill. defined firm nodule. The remaining parenchyma is yellow-tan lobulated adipose. tissue. Gross tumor size:1.6 x 0.6 x 0.5 cm. Multifocal tumor: Second lesion is 1.2 x 0.5 x 0.4 cm, and it is 0.7 cm from. the first. Distance of tumor from gross surgical margin: First nodule: Superior: 1.8 cm. Inferior:0. cm. Anterior: 0.2 cm. Posterior: 0.2 cm. Medial: 2 cm. Lateral: 3.6 cm. Second nodule: Superior: 1.7 cm. Inferior: 1 cm. Anterior: 0.2 cm. Posterior 0.3 cm. Medial: 5.9 cm. Lateral: 1.8 cm. Sectioned specimen radiographed?. Radiograph findings: Mass: Yes. Microcalcifications: Yes. Biopsy site microclip: Yes. Specimen photograph? Yes. Block diagram? Yes. Sections submitted from medial to lateral in blocks E1 through E21. Specimen completely submitted? Yes. BLOCK SUMMARY: Medial margin-E1. Lateral margin:E21. Anterior, posterior, inferior margins for first nodule=E8. Anterior, posterior, superior, inferior margin for second nodule-E13. First nodule-E6, E7, E8, E9, E10, E11. Second nodule:E13, E14, E15, E16. Microclip: E11. Microcalcifications: E8, E13, E19. F. ""Left axillary contents"". Received fresh and placed in formalin is a 6.5 x. 6.5 x 2 cm aggregate of multiple fragments of tan-yellow fibrofatty tissue. Fourteen lymph node candidates are identified ranging in size from 0.5 x 0.5 x. 0.4 cm to 3.5 x 1.5 x 1.3 cm. The smallest lymph node candidate is submitted. in blocks F1-F3, and the two largest lymph node candidates are inked blue and. black, bisected and submitted in blocks F4-F6. A. REPORT REVISED ON. INTRA OPERATIVE CONSULTATION: A. ""Non-sentinel node right axilla"": AF1- one lymph node candidate, bisected. (1.3 x 1 x 0.6 cm) - no tumor is seen (Dr. B. ""Sentinel node number one"": BF1 (one lymph node candidate, bisected, 2 x. 1.6 x 1 cm) positive for metastatic cancer (micrometastases) (Dr. BF2 (two lymph node candidates, intact (0.5 x 0.5 x 0.3 cm) and 1 x 0.6 x 0.4. cm, no tumor is seen (Dr. C. ""Sentinel node number two"": CF1- one lymph node candidate, bisected, 1.9 x. 2 x 0.7 cm, positive for metastatic cancer (micrometastases) (Dr. MICROSCOPIC EXAMINATION: Microscopic examination is performed. PATHOLOGIC STAGE: PROCEDURE: Partial mastectomy, sentinel lymph node biopsy with completion. axillary dissection. PATHOLOGIC STAGE (AJCC. Edition) : pT2 pN2a pMX. NOTE: Information on pathology stage and the operative procedure is. transmitted to this Institution's Cancer Registry as required for. accreditation by the Commission on Cancer. Pathology stage is based solely. upon the current tissue specimen being evaluated, and does not incorporate. information on any specimens submitted separately to our Cytology section,. past pathology information, imaging studies, or clinical or operative. findings. Pathology stage is only a component to be considered in determining. the clinical stage, and should not be confused with nor substituted for it. The exact operative procedure is available in the surgeon's operative report. REVISED DIAGNOSIS. A. ""LEFT AXILLA, NON-SENTINEL LYMPH NODE"" (BIOPSY) : ONE LYMPH NODE, NO EVIDENCE OF MALIGNANCY (0/1) . B. ""LEFT AXILLA, SENTINEL LYMPH NODE # 1"" (BIOPSY) : METASTATIC ADENOCARCINOMA IN THREE LYMPH NODES (3/3) . SIZE OF LARGEST METASTASIS: 6 MILLIMETERS. EXTRACAPSULAR INVASION: ABSENT. C. ""LEFT AXILLA, SENTINEL LYMPH NODE # 2"" (BIOPSY) : METASTATIC ADENOCARCINOMA IN ONE LYMPH NODE (1/1) . SIZE OF LARGEST METASTASIS: 4 MILLIMETERS. EXTRACAPSULAR INVASION: ABSENT. D. ""LEFT BREAST CANCER, 1:00"" (WIRE GUIDED PARTIAL MASTECTOMY) : INVASIVE ADENOCARCINOMA OF THE BREAST. HISTOLOGIC TYPE: DUCTAL. NOTTINGHAM COMBINED HISTOLOGIC GRADE: 3 OF 3. TUBULE FORMATION SCORE: 3. NUCLEAR PLEOMORPHISM SCORE: 3. MITOTIC RATE SCORE: 3. GROSS TUMOR SIZE: 2.3 x 2.1 x 1.2 CM. SIZE OF INVASIVE COMPONENT: 2.3 CM. LOCATION OF THE TUMOR: ADJACENT TO PREVIOUS BIOPSY SITE. LYMPHATIC/VASCULAR INVASION: PRESENT. MULTIFOCAL TUMOR: ABSENT (SECOND MASS LESION DESCRIBED GROSSLY IS FAT. NECROSIS) . IN-SITU CARCINOMA: PRESENT. TYPE OF IN-SITU CARCINOMA: COMEDO. NUCLEAR GRADE OF IN-SITU CARCINOMA: 3 OF 3. NECROSIS: PRESENT. DCIS EXTENDING OUTSIDE INVASIVE TUMOR MASS: ABSENT. SIZE OF IN-SITU CARCINOMA: NOT APPLICABLE. SKIN STATUS: FREE OF TUMOR. STATUS OF NON-NEOPLASTIC BREAST TISSUE: NEEDLE CORE BIOPSY SITE, AND FAT. NECROSIS. SURGICAL MARGIN STATUS: NEGATIVE (GREATER THAN 2 MM) . ESTROGEN/PROGESTERONE RECEPTOR, CELL CYCLE, EGFR AND HER2/NEU ANALYSIS: PENDING, PARAFFIN BLOCK NUMBER D11. RESULTS WILL BE ISSUED SEPARATELY FROM THE IMAGE CYTOMETRY LAB. E. ""LEFT AXILLARY MASS"" (EXCISION) : METASTATIC ADENOCARCINOMA IN ONE OF FOUR AXILLARY LYMPH NODES (1/4). SIZE OF METASTASIS: 1.6 CM. EXTRACAPSULAR INVASION: PRESENT. CHANGES CONSISTENT WITH A NEEDLE CORE BIOPSY SITE ARE PRESENT. MARGIN STATUS: NEGATIVE. F. ""LEFT AXILLARY CONTENTS"" (COMPLETION NODE DISSECTION) : METASTATIC ADENOCARCINOMA IN ONE OF TWENTY LYMPH NODES (1/20) . SIZE OF METASTASIS: 0.5 MILLIMETERS. EXTRACAPSULAR INVASION: ABSENT. COMMENT: This report revised. to correct the site for specimens A-C,. which were received labelled as ""right"" Per. the correct site is. left. is notified of this revision. I certify that I personally conducted the diagnostic evaluation of the above. specimen (s) and have rendered the above diagnosis (es). DIAGNOSIS: SEE REVISED REPORT: REPORT REVISED ON. I certify that I personally conducted the diagnostic evaluation of the above. specimen (s) and have rendered the above diagnosis (es) . CI ADDENDUM 1: Please see. for results of supplementary. tests. I certify that I personally conducted the diagnostic evaluation of the above. specimen (s) and have rendered the above diagnosis (es).",BRCA,2,"The report states that the gross tumor size of the primary breast cancer is 2.3 x 2.1 x 1.2 cm, which is larger than 2.0 cm but not more than 5.0 cm. This corresponds to a T2 stage according to the rules provided.",T2,34.0
646,TCGA-A8-A08F.683AAF99-3B91-4501-B701-C3A4E8439647,1,"Diagnosis: 1. Ablated (right) breast sample with a multifocal invasive ductal carcinoma with. intraductal components and focal angioinvasion (focus of a poorly differentiated. invasive ductal carcinoma with a tumor diameter of 2.8 cm and two further foci of. a. moderately invasive ductal carcinoma with tumor diameters of 3.0 cm and 1 cm). Dorsal resection margin tumor-free with minimum margin of 0.5 cm with the first. tumor focus, 1.5 cm with the second and 0.7 cm with the third, other margins are. free. Tumor classification: NOS, G III, pT2(mult)N3aL1V0R0. N. Site. Prior Prigian Noted QUALIFIED. is. (circle): Die.",BRCA,3,"The report mentions a 'focus of a poorly differentiated invasive ductal carcinoma with a tumor diameter of 2.8 cm'. This is the largest focus of invasive carcinoma, which is larger than 2.0 cm but not larger than 5.0 cm, making it a T2 tumor. The T stage is not affected by the presence of in situ carcinoma or the number of tumors, so the multifocal nature of the tumor does not change the T stage.",T2,35.0
785,TCGA-AO-A03T.D5EF8C37-811E-42B7-84E5-E6ED71217971,1,"Clinical Diagnosis & History: Palpable left breast cancer showing IDC on core. Specimens Submitted: 1: SP: Sentinel node #1, level one, left axilla (fs). 2: SP: Sentinel node #2, level one, left axilla (fs). 3: SP: Sentinel node #3, level one, left axilla (fa). 4: SP: Left breast. 5: SP: Level one anu two lymph nodes left axilla. DIAGNOSIS: 1). LYMPH NODE, SENTINEL #1, LEFT AXILLA LEVEL I, BIOPSY: - METASTATIC CARCINOMA INVOLVING ONE OUT OF ONE LYMPH NODE (1/1). - NO EXTRANODAL EXTENSION SEEN. 2). LYMPH NODE. SENTINEL #2, LEFT AXILLA LEVEL I, BIOPSY: - ONE BENIGN LYMPH NODE (0/1). 3). LYMPH NODE, SENTINEL #3, LEFT AXILLA LEVEL I, BIOPSY: - METASTATIC CARCINOMA INVOLVING ONE OUT OF ONE LYMPH NODE (1/1). - NO EXTRANODAL EXTENSION SEEN. 4). BREAST, LEFT, TOTAL MASTECTOMY: - INVASIVE DUCTAL CARCINOMA, NOS TYPE, HISTOLOGIC GRADE III/III (SLIGHT. OR NO TUBULE FORMATION),. NUCLEAR GRADE II/III (MODERATE VARIATION IN. SIZE AND SHAPE), MEASURING 2.5 CM, GROSSLY. - DUCTAL CARCINOMA IN SITU (DCIS) IS ALSO IDENTIFIED, SOLID TYPE WITH. INTERMEDIATE NUCLEAR GRADE AND MODERATE NECROSIS. LOBULAR INVOLVEMENT BY DCIS IS PRESENT. - THE DCIS CONSTITUTES <= 25% OF THE TOTAL TUMOR MASS, AND IS PRESENT. ADMIXED WITH AND AWAY. FROM THE INVASIVE COMPONENT. - THE INVASIVE CARCINOMA IS LOCATED NI THE UPPER OUTER QUADRANT AND. CENTRAL AREA. - THE DCIS IS LOCATED IN THE UPPER OUTER QUADRANT AND CENTRAL AREA. - NO INVOLVEMENT OF THE NIPPLE BY EITHER IN SITU OR INVASIVE CARCINOMA. IS IDENTIFIED. VASCULAR INVASION IS PRESENT. - NO INVOLVEMENT OF THE SURGICAL MARGINS BY EITHER INVASIVE OR IN SITU. CARCINOMA IS IDENTIFIED. NO SKIN INVOLVEMENT BY CARCINOMA IS IDENTIFIED. - THE NON-NEOPLASTIC BREAST TISSUE SHOWS BIOPSY SITE CHANGES, STROMAL. FIBROSIS, ADENOSIS. AND FIBROCYSTIC CHANGES. - RESULTS OF SPECIAL STAINS (ARE AS FOLLOWS: Immunohistochemical stains were performed on formalin-fixed tissue with the. following results for invasive carcinoma (block 4 T 11). ESTROGEN RECEPTOR (6F11,. 95% nuclear staining with moderate intensity. PROGESTERONE RECEPTOR (1E2;. 60% nuclear staining with moderate intensity. HER2 (HercepTest; -. Negative (0 ). Controls are satisfactory. Comment: HercepTestTM. ) is an FDA-approved method for assessment of. HER2 protein overexpression in breast cancer tissue routinely processed for. histological evaluation. The HER2 test results are reported in accordance. with the ASCO/CAP guideline recommendations for HER2 testing in breast. cancer (J Clin Oncol 2007; 25 (1) :1-28) . 5). LYMPH NODES, LEFT AXILLA LEVELS I AND II, RESECTION: - NINE BENIGN LYMPH NODES (0/9). I ATTEST THAT THE ABOVE DIAGNOSIS IS BASED UPON MY PERSONAL EXAMINATION OF. THE SLIDES (AND/OR OTHER MATERIAL), AND THAT I HAVE REVIEWED AND APPROVED. THIS REPORT. Special Studies: Special Stain. Comment. NEG-HER2. Gross Description: 1) The specimen is received fresh for frozen section consultation, labeled. ""sentinel node number one level 1 left axilla"" and consists of a pink-tan. lymph node measuring 1.2 x 1.0 x 0.4 cm. Bisected and entirely submitted. for frozen section. Summary of sections: FSC -- frozen section control. 2) The snecimen is received fresh for frozen section consultation, labeled. ""sentinel node number two level 1 left axilla"" and consists of tan lymph. node measuring 1.0 x 0.5 x 0.5 cm. Bisected and entirely submitted for. frozen section. Summary of sections: FSC frozen section control. 3) The specimen is received fresh for frozen section consultation, labeled. ""sentinel node number three level 1 left axilla"" and consists of a tan lymph. node measuring 1.5 x 0.8 x 0.8 cm. Bisected and entirely submitted for. frozen section. Summary of sections: FSC - frozen section control. 4). The specimen is received fresh, labeled ""left breast stitch marks. axillary tail"" and consists of a breast measuring 21.5 x 17.5 x 4 cm with. overlying skin ellipse measuring 9.5 x 3 cm. Situated centrally on the skin. surface is an everted nipple measuring 1.5 x 1.2 x 0.8 cm and areola. measuring 3.4 x 2.5 cm. A suture demarcates the axillary aspect. The. posterior surface of the breast is inked black and the specimen is serially. sectioned to reveal a centrally located white-tan firm tumor measuring 2.5 x. 2.5 x 2 cm with extension into upper outer quadrant, and located 1.1 cm from. the deep margin. A metal clip marking the previous biopsy site is. identified. Sectioning of the axillary aspect reveals no grossly. identifiable lymph nodes. Representative sections are submitted. TPS. is. taken. Summary of sections: N - nipple. NB - nipple base. D - deep margin. BX - biopsy site with tumor. T - tumor. UIQ - upper inner quadrant. LIQ - lower inner quadrant. UOQ - upper outer quadrant. LOQ - lower outer quadrant. 5) The specimen is received fresh, labeled ""level 1 and 2 lymph nodes left. axilla"" It consists of a 8 x 8 x 1.5 cm fragment of fibroadipose tissue. without orientation. Multiple lymph nodes are identified, ranging in size. from 0.3 cm to 1.2 cm. All identified lymph nodes are submitted. Summary of sections: LN - whole lymph nodes. Summary of Sections: Part. 1: SP: Sentinel node #1, level one, left axilla (fs). Block. Sect. Site. PC's. 1. FSC. 1. Part 2: SP: Sentinel node #2, level one, left axilla (fs). Block. Sect. Site. PCs. 1. FSC. 1. Part 3: SP: Sentinel node #3, level one, left axilla (fs). Block. Sect. Site. PCs. 1. FSC. 1. Part 4: SP: Left breast. Block. Sect. Site. PCs. 5. BX. 5. 1. D. 1. 2. LIQ. 2. 2. LOQ. 2. 2. N. 2. 1. NB. 1. 7. T. 7. 20. TEST. 20. 2. UIQ. 2. 2. UOQ. 2. Part 5: SP: Level one and two lymph nodes left axilla. Block. Sect. Site. PCs. 4. LN. 9. Intraoperative Consultation: Note: The diagnoses given in this section pertain only to the tissue sample. examined at the time of the intraoperative consultation. 1). FROZEN SECTION DIAGNOSIS: METASTATIC DUCT CARCINOMA. PERMANENT DIAGNOSIS: SAME. 2). FROZEN SECTION DIAGNOSIS: BENIGN. PERMANENT DIAGNOSIS: SAME. 3). FROZEN SECTION DIAGNOSIS: METASTATIC DUCT CARCINOMA. PERMANENT DIAGNOSIS: SAME. M.D.",BRCA,1,"The T stage is determined by the size of the largest focus of invasive carcinoma. In this report, the invasive ductal carcinoma measures 2.5 cm, which falls under T2 (more than 2.0 cm but not more than 5.0 cm in size).",T2,36.0
