Unnamed: 0,patient_filename,t,text,type,n,cmem_t_reasoning,cmem_t_ans_str,cmem_t_num_update
1286,TCGA-E9-A1R2.5B9C0E4A-3958-4ECF-B8B2-E758E04E7722,1,"OC ID: Gross Description: Labeled left breast lumpectomy. Received is an 85 g unoriented ovoid. portion of lobulated tan fibroadipose tissue measuring 8 x 7 x 3.5 cm. The. specimen contains 2 needle localization wires and there is an accompanying. specimen mammogram, which is used to orient the specimen and select the. sections. The radiologist has circled two areas of concern marked 1 and 2,. both of which are associated with microcalcifications. The margins are. inked blue for microscopic evaluation. Upon sectioning, area 1 is present. near the midpoint of the long axis and consists of a 2.4 x 1.9 x 1.4 cm. irregular mass. The cut surfaces of the mass are white-tan, smooth and have. well-defined borders. The mass grossly abuts the inked margin. At one end. of the mass is a 0.7 x 0.3 cm biopsy cavity containing collagen material. and a small metal clip as well as adjacent focal hemorrhage. Area 2 is. present at one end of the specimen and consists of a 1.2 x 0.9 cm ovoid. portion of firm white fibrous tissue that is slightly more dense than the. adjacent white fibrous tissue. This area comes to within 0.7 cm of the. nearest inked margin. The remaining cut surfaces are tan and lobulated with. interspersed areas of condensed white fibrous tissue comprising. approximately 25% of the specimen. Poorly-defined areas of blue staining. are also present. Microscopic Description: Microscopic sections of the principal mass (grossly area 1) demonstrate. an infiltrating markedly pleomorphic epithelial neoplasm with a brisk. mitotic rate that is arranged in nests. Occasional areas of intratumoral. high grade ductal carcinoma in situ are. Diagnosis Details: INVASIVE BREAST CARCINOMA CHECKLIST. 1). Tumor focality: Single focus. 2). Tumor size: 2.4x1.9cm. 3). Histologic type: Ductal. 4). Nottingham Combined Histologic Grade: Poorly differentiated. a). Ductule formation: 3. b). Nuclear features: 3. c). Mitotic index: 2. 5). Angiolymphatic invasion: Present. 6) Margins: a). Not involved by tumor. b). Distance from closest margin: 1.9 cm (thickness of part B tissue). 7). Lymph nodes: 17 positive/ 19 found. 8) Size of largest metastatic deposit: 2.1 x 1.2 cm. 9). Extracapsular invasion of lymph nodes: No. 10) Extensive DCIS component (>25%): No. 11) DCIS component, extratumoral: No. 12) TNM: pT2 pN3a MX. 13). ERA/PRA: Positive/negative on prior biopsy. 14). Her-2/neu over-expression: Negative (score 2) by FISH on prior biopsy. Comments: BREAST TISSUE CHECKLIST. Specimen type: Lumpectomy. Specimen size: Not specified. Tumor site: Breast. Tumor size: 2.4x1.9x1.4cm. Grossly evident lesion: Yes. Histologic type: Infiltrating ductal carcinoma. Histologic grade: Poorly differentiated. Tumor extent: Not specified. Lymph nodes: 17/19 positive for metastasis (Axillary 17/19). Extracapsular invasion of the lymph nodes: No. Margins: Uninvolved. Nottingham Histologic Score. Tubule formation: Minimal less that 10% (score=3). Nuclear pleomorphism: Marked variation in size, nucleoli, etc (score=3). Mitotic count (25x): 10 to 20 mitoses per 10 HPF (score=2). Mitotic count (40x): Not specified. Total Nottingham Score: Grade III (poorly differentiated): 8-9 points. Evidence of neo-adjuvant treatment: Not specified. Additional pathologic findings: Not specified. Comments: None. Laterality: Left, upper outer quadrant.",BRCA,3,"According to the report, the size of the largest tumor (area 1) is 2.4 x 1.9 cm, which falls within the T2 category (tumor size > 2 cm and <= 5 cm). Therefore, the T stage for this patient is T2.",T2,27.0
908,TCGA-B6-A0I6.2D3D759B-D06A-4FC6-855A-5E9F83ADBED9,0,"Material. Submitted: !eft breast with axillary contents. History: Clinical. Diagnosis: Operating. Dr. Gross Examination: The specimen is received in a single container, labeled with the patient's name, history. number, date and ""left breast and axillary contents"". Received is a breast measuring. approximately 23.0 x 16.0 x 8.5 cm. Also received is axillary contents measuring 8.0 cm. x. 9.0 cm.x 3.0 cm. There is no previous scars or other lesions on the surface of the breast. Noted grossly was a 5.0 x 5.0x 4.0 cm. mass submitted for receptors. The specimen has. been inked in blue and sectioned extensively before accessioning. Examination of the. specimen reveals a firm white nodule measuring approximately 3.5 x 3.0 cm. in two. dimensions. Gross inspection of the tumor at the deep margin does not show extension. through the deep margin grossly. Representative sections are submitted as follows: Block I: representative section of tumor to show deep margin. Block II: representative section of tumor to show deep margin. Blocks III and IV: representative sections of the tumor. Palpation of the remainder of the breast does not reveal any separate nodules from the. main tumor region. From the main mass, a couple of satellite nodules are noted that appear. to be contiguous with the main mass. A section of this area is submitted in Block V. Block VI: representative section of nipple. Block VII: representative section of skin over tumor. Block VIII: random sample of upper inner quadrant. Block IX: random sample of lower inner quadrant. Block X: random sample of upper outer quadrant. Block XI: random sample of lower outer quadrant. The axillary contents are separate from the remainder of the specimen and palpated for. lymph nodes. Lymph node candidates are submitted from the inferior to the superior. direction. They are submitted as follows: Block XII: two lymph node candidates. Block XIII: three lymph node candidates. Block XIV: three lymph node candidates. Block XV: five lymph node candidates. Block XVI: three lymph node candidates. Block XVII: three lymph node candidates. Block XVIII: five lymph node candidates. (Continued on. ragé 2. Dr. Dr. (Continuation from page 1). Block XIX: five lymph node candidates. Block XX: three lymph node candidates. Block XXI: five lymph node candidates. Block XXII: five lymph node candidates. Block XXIII: three lymph node candidates. Block XXIV: three lymph node candidates. MICROSCOPIC: The apparent satellite nodules seen grossly (Block 5) consist of sclerosis and. hemangioma (so-called ""peritubular hemangioma""). Portions of the. carcinoma have intermediate grade nuclei, but areas have a high grade nuclear pattern. DIAGNOSIS: #i""LEFT"" BREAST, MASTECTOMY: A. LARGE (5.0 x 5.0 x 4.0 CM.) INFILTRATING DUCTAL. CARCINOMA, N.S.A.B.P. NUCLEAR GRADE POORLY. DIFFERENTIATED, HISTOLOGIC GRADE 3 OF 3. 13. FOCAL INTRATUMORAL INTRADUCTAL CARCINOMA. C. PROMINENT VASCULAR INVASION BY CARCINOMA. D. NO CARCINOMA IDENTIFIED IN SURGICAL MARGINS. E. HEMANGIOMA. F. FIBROCYSTIC CHANGES: 1. MARKED DUCTAL EPITHELIAL HYPERPLASIA. 2. PAPILLARY APOCRINE METAPLASIA. 3. DUCT ECTASIA. 4. SCLEROSIS. #2 ""LEFT"" AXILLARY DISSECTION: A. METASTATIC CARCINOMA IN 6 OF 32 LYMPH NODES. B. FOCAL CARCINOMA IN PERINODAL BLOOD VESSELS.",BRCA,1,"The report mentions a single tumor in the left breast with a greatest dimension of 5.0 cm, which falls under the 'T2' category of the TNM staging system for breast cancer (T2: tumor size > 2 cm and <= 5 cm).",T2,28.0
602,TCGA-A7-A5ZV.FA5CF5A2-F44A-4303-9200-32250FAEF374,1,"Final Surgical Pathology Report. Procedure: Diagnosis. A, B. Lymph nodes, left axillary sentinel #1 & #2, excisions -. Negative for malignancy. C. Breast, left, segmental mastectomy -. Invasive mammary carcinoma, no special type, high combined histologic. grade, high proliferative rate. D. Breast, left, posterior to segmental mastectomy, excision. Negative for malignancy. Note: The above diagnoses are rendered per expert consultation from. of. Please see the. consultation report from Dr. In a comment,. states: ""This invasive carcinoma is curcumscribed and has an expansile. rather then infiltrative growth pattern, which may explain the lack of. nodal involvement. The margins are adequate.' In an addendum comment,. :ates: ""The closest margin from the left segmental. mastectomy (specimen C) is posterior (1.5 mm), however the separately. submitted new posterior margin (specimen D) is negative. The other. margins are negative by least 4 mm. Microscopic Description: A,B,D. Microscopic examination performed. C. The following template summarizes the findings in part C: Invasive Carcinoma: Present. Histologic type: Invasive mammary carcinoma, no special type. Histologic grade: High combined histologic grade, high. proliferative rate. Greatest dimension (pT) : 4.2 cm (pT2). Specimen margins : The margins are adequate (see comment in. diagnosis). Vessel invasion: Not identified. Calcification: Not identified. Ductal carcinoma in situ: Not identified. Comment: Please note that in addition to examining H&E stained. sections, representative blocks in part C were immunostained with. antibodies to p63 to aid in assessment. Prognostic markers: Previously performed (see. [A few of the antibodies used in our laboratory may be classified as. analyte specific reagents. These antibodies are monitored and. controlled in our laboratory and their performance for in vitro. diagnosis is well described in the medical literature. They have not. been cleared or approved by the FDA.]. Specimen. A. Left axillary sentinel node #1, hot, not blue, 1018. B. Left axillary sentinel node #2, hot, blue, 237. C. Left breast segmental mastectomy. D. Tissue posterior. to segmental mastectomy. Clinical Information. PRE-OP DIAGNOSIS: Left breast CA. Gross Description. A. Received fresh in a container labeled ""left axillary sentinel node. #1, hot, not blue, 1018"" is a 2.2 x 1.7 x 1 cm soft tan-pink lymph node. with some surrounding yellow adipose tissue. AS-4, following fixation. B. Received fresh in a container labeled ""left axillary sentinel node. #2, hot, blue, 237"" is a 2.5 x 2.2 x 1.2 cm portion of tissue. containing two soft tan-pink lymph nodes with surrounding yellow. adipose tissue, with the lymph nodes 1 and 1.5 cm in greatest. dimension. RS-4, following fixation, with the lymph nodes entirely. submitted, with the larger lymph node in blocks B2-B4. C. Received fresh in a. container labeled ""left breast. segmental mastectomy"" is a 7.3 x 5.7 x 4.3 cm portion of soft. tan-yellow breast tissue, with orienting sutures present. The margins. are inked as follows based upon the sutures: anterior - green;. posterior - black; lateral - orange; medial - red; inferior - blue;. superior - violet. The specimen is serially sectioned revealing a 4.2 x. 4.2 x 3.5 cm red-brown to white-tan nodular mass, which grossly comes. near to the medial, posterior, and anterior margins. RS-10, following. fixation, with tumor to closest medial margin in block C1, tumor to. closest lateral margin in block C2, tumor to closest anterior margin in. block C3, tumor to closest posterior margin in block C4, tumor to. closest superior margin in block C5, tumor to closest inferior margin. in block C6, and with additional sections of tumor in blocks C7-C10. D. Received fresh in a container labeled ""tissue posterior to segmental. mastectomy"" is a 1.7 x 1.2 x 1.2 cm portion of soft red-brown skeletal. muscle, with a suture indicating the new posterior border. The new. margin is inked. The specimen is sectioned and is without focal. lesion. AS-3, following fixation.",BRCA,0,"The report states that the greatest dimension of the tumor is 4.2 cm, which falls within the T2 category of tumor size being > 2 cm and <= 5 cm.",T2,29.0
1040,TCGA-BH-A0HX.8C4FEB77-99B6-4C73-9751-508953A874DC,1,"FINAL DIAGNOSIS: PART 1: TWO LYMPH OF NODE, THREE LEFT LYMPH AXILLARY, NODES POSITIVE SENTINEL FOR NODE METASTATIC #1, BIOPSY CARCINOMA - (2/3) (see comment). A. B. LARGEST METASTATIC FOCUS IS 0.4 CM (Slide 1FS). C. EXTRACAPSULAR EXTENSION IS IDENTIFIED (Slide 1FS). PART NODE, LEFT AXILLARY, SENTINEL NODE #2, BIOPSY -. 2: ONE LYMPH LYMPH NODE, NEGATIVE FOR METASTATIC CARCINOMA (0/1) (see comment). PART A. 3; TWO DIMENSION, BREAST, (2) FOCI LEFT, AND OF TOTAL INYASIVE THE SMALLER MASTECTOMY CARCINOMA, TUMOR - is LARGER LOBULAR TUMOR AND IS MEASURES DUCTAL AND .0 CM MEASUTE IN GREATEST 2.5 CM IN DIMENSION GREATEST (see. comment). LARGER TUMOR NOTTINGHAM GRADE 3 (TUBULE FORMATION 3, NUCLEAR PLEOMORPHISM 3, MITOTIC. B. ACTIVITY SMALLER TUMOR NOTTINGHAM SCORE 9/9). GRADE 2 (TUBULE FORMATION 3, NUCLEAR PLEOMORPHISM 2, MITOTIC. 3; TOTAL. c. D. ACTIVITY DUCTAL CARCINOMA SCORE IN-SITU 6/9). (DCIS), NUCLEAR GRADE 3, SOLID TYPE WITH COMEDO-TYPE NECROSIS,. 1; TOTAL. OF THE LARGER TUMOR. E. COMPRISING RESECTION FOCAL LOBULAR MARGINS 5% CARCINOMA ARE FREE IN OF SITU TUMOR. AND ATYPICAL LOBULAR HYPERPLASIA. F. G. FOCAL SCLEROSING ATYPICAL ADENOSIS DUCTAL AND HYPERPLASIA. FIBROCYSTIC CHANGES WITH ASSOCIATED MICROCALCIFICATIONS. H. PREVIOUS CORE BIOPSY SITES. 1. J. CHANGES TUMOR IS CONSISTENT ESTROGEN AND WITH PROGESTERONE POSITIVE AND HER2/NEU NEGATIVE AS PER CORE BIOPSIES. K. NIPPLE AND SKIN, NEGATIVE FOR CARCINOMA. REPORTS. PART MASTECTOMY. A. 4: FLORID BREAST, DUCTAL RIGHT, EPITHELIAL TOTAL HYPERPLASIA - AND COLUMNAR CELL CHANGE ASSOCIATED WITH. MICROCALCIFICATIONS. 8. SCLEROSING ADENOSIS. c. D. FIBROCYSTIC CHANGES WITH ASSOCIATED MICROCALCIFICATIONS. PSEUDOANGIOMATOUS STROMAL HYPERPLASIA. E. UNREMARKABLE NIPPLE AND SKIN. PART 5: LYMPH TWENTY NODES, LYMPH LEFT NODES, AXILLARY, NEGATIVE DISSECTION FOR METASTATIC - CARCINOMA (0/20) (see comment). sie. SYNOPTIC PRIMARY INVASIVE CARCINOMA OF BREAST. LATERALITY: Left. PROCEDURE: Simple mastectomy. Upper outer quadrant. Lower outer quadrant. SIZE OF TUMOR: Maximum dimension invasive component: 2.5 cm. MULTICENTRICITYIMULTIFOCALITY OF INVASIVE FOCI: TUMOR AGGREGATE SIZE: Sum of the sizes of multiple invasive tumors: 3.5 cm. TUMOR TYPE (invasive component): Ductal adenocarcinoma, NOS, Infiltrating lobular carcinoma. HISTOLOGIC TYPE: Classical. NOTTINGHAM SCORE: Nuclear grade: 3. Tubule formation: 3. Mitotic activity score: 3. Total Nottingham score: 9. Nottingham grade (1,2,: 3): 3. ANGIOLYMPHATIC INVASION: DERMAL LYMPHATIC INVASION: CALCIFICATION: Yes, benign zones. Yes, malignant zones. TUMOR TYPE, IN SITU: Solid. DCIS admixed with invasive carcinoma. Percent of tumor occupied by in situ component: 5 %. SURGICAL MARGINS INVOLVED BY INVASIVE COMPONENT: Distance of invasive tumor to closest margin: 5 mm. SURG MARGINS INVOLVED BY IN SITU COMPONENT: Distance of in situ disease to closest margin: 5 mm. PAGETS DISEASE OF NIPPLE: LYMPH NODES POSITIVE: 2. LYMPH NODES EXAMINED: 24. METHOD(S) OF LYMPH NODE EXAMINATION: H/E stain, Keratin stain. SENTINEL NODE METASTASIS: ONLY KERATIN POSITIVE CELLS ARE PRESENT: SIZE OF NODAL METASTASES: Diameter of largest lymph node metastasis: 4 mm. LYMPH NODE METASTASIS(-ES) WITH EXTRACAPSULAR EXTENSION: SKIN INVOLVED (ULCERATION): NON-NEOPLASTIC BREAST TISSUE: ADH, FCD. T STAGE, PATHOLOGIC: pT2. N STAGE, PATHOLOGIC: pN1a. M STAGE, PATHOLOGIC: pMX. ESTROGEN RECEPTORS: positive. PROGES ERONE RECEPTORS: positive. HER2/NEU: zero or 1+. Comment: Nottingham grade is recorded for the ductal carcinoma. Nottingham score for the. lobular carcinoma is nuclear grade 2, tubule formation 3, and mitotic activity 1 for a.",BRCA,1,The report indicates that the 'SIZE OF TUMOR: Maximum dimension invasive component: 2.5 cm.' This corresponds to the T2 stage as defined by the rules: 'T2: tumor size > 2 cm and <= 5 cm'.,T2,30.0
1227,TCGA-E2-A15T.8FEBDA40-59FF-4E76-A9B1-F46BAB7C3E4A,1,"SPECIMENS: A. SENTINEL LYMPH NODE #1 LEFT AXILLA. B. SENTINEL LYMPH NODE #2 LEFT AXILLA. C. LEFT BREAST. D. LEFT BREAST SKIN. E. RIGHT BREAST TISSUE. SPECIMEN(S): A. SENTINEL LYMPH NODE #1 LEFT AXILLA. B. SENTINEL LYMPH NODE #2 LEFT AXILLA. C. LEFT BREAST. D. LEFT BREAST SKIN. E. RIGHT BREAST TISSUE. INTRAOPERATIVE CONSULTATION DIAGNOSIS: TPA/TPB-SLN #1, #2: Negative for carcinoma. Diagnosis called by Dr. to Dr. at. (A,B). GROSS DESCRIPTION: A. SENTINEL LYMPH NODE #1 LEFT AXILLA. Received fresh labeled with the patient's identification and ""sentinel LN #1"" is a fragment of yellow fibroadipose. tissue, 5 x 3 x 1 cm containing a lymph node measuring 2 x 1 x 0.9 cm. The lymph node is sectioned and a touch. prep performed; lymph node submitted entirely in A1. B. SENTINEL LYMPH NODE #2 LEFT AXILLA. Received fresh labeled with the patient's identification and ""sentinel LN #2"" is a fragment of yellow fibroadipose. tissue measuring 2.5 x 1.5 x 1 cm containing a 1.5 x 1 x 0.9 cm lymph node. It is sectioned, a touch prep is. performed, and lymph node is submitted entirely in B1. C. LEFT BREAST. Received fresh labeled with the patient's identification and ""left breast"" is an oriented 1408 g, 28 x 20 x 4 cm. mastectomy with 17 x 7 cm skin ellipse and a 0.9 cm everted nipple. Ink code: Anterior/superior-blue,. anterior/inferior-orange, posterior-black. Specimen is serially sectioned into 12 slices from lateral to medial with. nipple in slice 7 revealing a 7.2 x 5.8 x 3.2 cm ill-defined infiltrating mass extending from the 12 to 3 o'clock positions. in the upper outer quadrant in slices 3-7 that is closest to the anterior margin at 1.2 cm. In the axillary region is a. possible lymph node, 2.3 x 1.5 x 0.6 cm. Representatively submitted: C1: slice 2, UOQ lateral to lesion. C2-C3: slice 3, UOQ lesion (bisected). C4: slice 4, UOQ superior portion of lesion. C5-C6: slice 4, UOQ lesion (bisected). C7: slice 4, LOQ inferior lesion. C8: slice 5, UOQ superior to lesion. C9: slice 5, posterior margin (grossly closest deep margin). C10: slice 6, mid section including lesion. C11: slice 7, mid section. C12: slice 8, medial to lesion. C13: slice 9, UIQ. C14: slice 11, LIQ. C15: slice 2, LOQ. C16: slice 1, UOQ. C17: possible lymph node. C18-C19: skin and nipple (bisected perpendicular sections). D. LEFT BREAST SKIN. Received in formalin labeled with the patient's identification and ""left breast skin"" is an unoriented tan pink skin. excision 32 x 1cm excised to a depth ranging from 0.4cm to 1.8cm. The skin surface is grossly unremarkable. Representatively submitted in D1-D2. E. RIGHT BREAST TISSUE. Received in formalin labeled with the patient's identification and ""right breast tissue"" is a 236g, 27 x 12 x 5.4cm. aggregate of fibrofatty tissue with attached unremarkable tan pink skin 10.5 x 4.3cm. The specimen is serially. sectioned to reveal unremarkable breast parenchyma. Representatively submitted in B1-B2. DIAGNOSIS: A. SENTINEL LYMPH NODE 1, LEFT AXILLA, BIOPSY: - ONE LYMPH NODE, NO TUMOR SEEN (0/1). B. SENTINEL LYMPH NODE 2, LEFT AXILLA, BIOPSY: - ONE LYMPH NODE, NO TUMOR SEEN (0/1). C. BREAST, LEFT SIMPLE MASTECTOMY: - INVASIVE DUCTAL CARCINOMA, SBR GRADE 2, WITH MUCINOUS. FEATURES. - INVASIVE CARCINOMA MEASURES AT LEAST 3 CM. - MARGINS, FREE OF TUMOR. - DUCTAL CARCINOMA IN SITU (DCIS), MICROPAPILLARY, PAPILLARY,. CRIBRIFORM, AND SOLID TYPES, NUCLEAR GRADE 2, WITH NECROSIS. - SKIN, NIPPLE, AND SKELETAL MUSCLE, NO TUMOR SEEN. NOTE: The tumor involves the upper outer quadrant and consists of multiple foci of invasive carcinoma admixed with. DCIS. On a single. slide, the largest focus of invasive carcinoma measures at least 3 cm. Invasive carcinoma spans. an area - 7 cm. D. SKIN, LEFT BREAST, EXCISION: - SKIN, NO TUMOR SEEN. E. BREAST, RIGHT, EXCISION: - APOCRINE METAPLASIA AND STROMAL FIBROSIS. - BENIGN SKIN. SYNOPTIC REPORT - BREAST. Specimen Type: Mastectomy. Needle Localization: Laterality: Left. Invasive Tumor: Present. Multifocality: Yes. WHO CLASSIFICATION. Invasive ductal carcinoma, NOS 8500/3. Tumor size: 3cm. Tumor Site: Upper outer quadrant. Margins: Negative. Tubular Score: 3. Nuclear Grade: 2. Mitotic Score: 2. Modified Scarff Bloom Richardson Grade: 2. Necrosis: Absent. Vascular/Lymphatic Invasion: None identified. Lobular neoplasia: None. Lymph nodes: Sentinel lymph node. Lymph node status: Negative 0/2. DCIS present. Margins uninvolved by DCIS. DCIS Quantity: Estimate 35%. DCIS Type: Solid. Cribriform. Micropapillary. Papiliary. DCIS Location:Associated with invasive tumor. Nuclear grade: Intermediate. Necrosis: Present. ER/PR/HER2 Results. ER: Positive. PR: Positive. HER2: Negative by FISH. Performed on Case: Pathological staging (pTN): pT2N0. Pathological staging is based on the AJCC Cancer Staging Manual, 7th Edition. CLINICAL HISTORY;. Multicentric cancer left breast; two areas were core biopsy showed invasive cancer. ADDENDUM: ONCOTYPE DX BREAST CANCER ASSAY. RESULTS: Recurrence Score: 21. CLINICAL EXPERIENCE: Patients with a recurrence score of: 21 in the clinical validation study had an average. rate of Distant Recurrence at 10 years of 14%. ER Score: 12.1 Positive. PR Score: 5.5 Positive. Her2 Score: 10.3 Negative. Interpretation: ER. Negative < 6.5. Positive >= 6.5. PR. Negative < 5.5. Positive >= 5.5. Her2 Negative <10.7 Positive >=11.5 Equivocal = 10.7 - 11.4. See separate. report for further information. Final Review: Pathologist, (. Final: Pathologist,. Addendum: Pathologist,. Addendum Final: Pathologis.",BRCA,0,"According to the report, the largest focus of invasive carcinoma in the left breast measures at least 3 cm. Based on the rules provided, a T2 stage is assigned when the tumor size is > 2 cm and <= 5 cm. Therefore, the T stage for this patient is T2.",T2,31.0
