Unnamed: 0,patient_filename,t,text,type,n,cmem_t_reasoning,cmem_t_ans_str,cmem_t_num_update
1115,TCGA-D8-A1J8.E8E799F8-158D-4AEC-8F86-D40F132C071C,1,"page 1 / 1. copy No. Examination: Histopathological examination (cito). PESET. Gender: F. Material: Multiple organ resection - right breast. Expected time of examination: 5 working days. Clinical diagnosis: Macroscopic description: Right breast, sized 21.3 x 18.6 x 4.8 cm, removed along with axillary tissues sized 10 x 7 x 3.5 cm and a skin. flap of 19.2 x 7.1 cm. Weight 923 g. Tumour sized 3.3 x 1.8 x 3.2 cm on the border of outer quadrants, placed 2.2 cm from the lower edge, 0.3 cm. from the base and 2.8 cm from the skin. Lymph nodes of 0.4 cm in length, fat. Microscopic description: Carcinoma ductale invasivum - NHG2 (3 + 3 +2:14 mitoses/10 HPF, visual area diameter 0.55 mm). Mamilla. sine laesionibus. Glandular tissue showing mastopathia fibrosa et cystica. (fibrocystic changes). AXILLARY LYMPH NODES. Metastases carcinomatosae in lymphonodis (No III/XVI). Examination result://istopathology diagnosis: Carcinoma ductale invasivum mammae dextrae. Invasive ductal carcinoma of the right breast. Metastases carcinomatosae in lymphonodis axillae (NO III/XVI). Cancer metastases in axillary lymph nodes (No III/XVI). (NHG2, pT2, pN1a). Results of immunohistochemical examination: Estrogen receptors found in 75% of neoplastic cell nuclei. Progesterone receptors found in 10-75%. of neoplastic cell nuclei. HER2 protein stained with HercepTest™M by DAKO. Negative reaction. in. invasive cancerous cells ( Score = 0).",BRCA,1,"The T stage for breast cancer is determined by the size of the tumor. In this report, the tumor size is given as 3.3 x 1.8 x 3.2 cm. The largest diameter of the tumor is 3.3 cm, which falls within the T2 category (tumor size > 2 cm and <= 5 cm) according to the AJCC staging system for breast cancer.",T2,0.0
638,TCGA-A8-A082.3E967C4F-B916-4A80-A9A1-A5E94F02322C,1,"Diagnosis: 1. Ablated breast sample with a bifocal poorly differentiated invasive ductal. carcinoma (first tumor is poorly differentiated with a tumor diameter of 2.3 cm and a. distance from the resection margins of 2.2 cm cranially, 2.5 cm dorsally, 3 cm. laterally and caudally, and 5 cm medially; the second tumor is moderately. differentiated, measuring 2 cm, with a distance from the resection margins of less. than 0.1 cm dorsally, 0.2 cm caudally, 1.5 cm laterally, 3.5 cm cranially, and 7 cm. medially) with focal intraductal components. In conjunction with the preliminary finding, this gives rise to the following tumor. classification: NOS, G II, pT2N2aL1V0R0.",BRCA,1,"The first tumor in this report has a diameter of 2.3 cm, which falls within the range for T2 (tumor size > 2 cm and <= 5 cm). Although the second tumor is moderately differentiated and measures 2 cm, the T stage is determined by the size of the largest tumor, which is the first tumor in this case.",T2,1.0
546,TCGA-A2-A25D.BE63B06A-E3E0-4E00-9B9F-5E7DE8852E07,1,"TO. Patient: : Specimen #: Race: WHITE. Physician (s): SPECIMEN: A: RIGHT OUTER BREAST LUMPECTOMY. B: HIGHEST RIGHT AXILLARY LYMPH NODE. C: RIGHT AXILLARY LYMPH NODE DISSECTION. FINAL DIAGNOSIS: A. BREAST, RIGHT OUTER, LUMPECTOMY: - TUMOR TYPE: INVASIVE LOBULAR CARCINOMA, PLEOMORPHIC TYPE (SEE. COMMENT). NOTTINGHAM GRADE: POORLY DIFFERENTIATED (G3). NOTTINGHAM SCORE: 8/9 (Tubules= 3, Nuclei= 3, Mitoses= 2) . - TUMOR SIZE (GREATEST DIMENSION) : 3.2 CM (MEASURED GROSSLY) . - TUMOR FOCALITY: SINGLE FOCUS OF INVASIVE CARCINOMA. - TUMOR SIDE (QUADRANT) : RIGHT OUTER. - VENOUS/LYMPHATIC INVASION: PRESENT. - MARGINS: POSITIVE. TUMOR EXTENDS TO THE ANTERIOR AND INFERIOR INKED TISSUE EDGES. - LOBULAR CARCINOMA IN SITU: NOT IDENTIFIED. - LYMPH NODES: TWENTY-THREE (23) LYMPH NODES POSITIVE FOR METASTATIC. CARCINOMA (SEE PARTS ""B"" AND ""C""). - ESTROGEN RECEPTORS: POSITIVE (95% NUCLEI STAINING, REFER TO. - PROGESTERONE RECEPTORS: NEGATIVE (0% STAINING. REFER TO. - HER 2 NEU by IHC: NEGATIVE, 1+ (REFER TO. - AJCC PATHOLOGIC STAGE (7TH EDITION) : pT2 N3a. B. AXILLARY LYMPH NODE, RIGHT (""HIGHEST"") BIOPSY: - ONE (1) LYMPH NODE POSITIVE FOR METASTATIC CARCINOMA (SEE COMMENT). SIZE OF LARGEST METASTATIC DEPOSIT: 0.9 CM. EXTRACAPSULAR EXTENSION: FOCALLY PRESENT. C. AXILLARY LYMPH NODES, RIGHT, DISSECTION: - TWENTY-TW (22) OF TWENTY-THREE (23) LYMPH NODES POSITIVE FOR. METASTATIC CARCINOMA (SEE COMMENT). SIZE OF LARGEST METASTATIC DEPOSIT: 2.1 CM. EXTRACAPSULAR EXTENSION: PRESENT. Specimen #: FINAL DIAGNOSIS (continued) : Comment : The lymph node metastases seen in parts ""B"" and ""C"". demonstrate multiple foci of extracapsular extension and in most cases. represent near complete replacement of the underlying nodal architecture. This case received prospective peer review. CLINICAL DIAGNOSIS AND HISTORY: female with medical diagnosis of breast cancer (invasive. mammary adenocarcinoma, right breast breast; positive right axillary node) . PRE-OPERATIVE DIAGNOSIS: None provided. POST-OPERATIVE DIAGNOSIS: None provided. GROSS DESCRIPTION: A: Received fresh, labeled with the patient's name. and designated, ""Right Outer Breast Lumpectomy"" and consists of an. irregular portion of soft tissue oriented with a single suture - anterior;. double - lateral; and short - superior. The specimen measures 10.5. cm. superior to inferior; 7.0 cm medial to lateral; and 3.0 cm anterior to. posterior. The specimen is inked as follows: superior = blue; inferior =. green; medial = red; lateral = yellow; anterior = orange; and posterior =. black. Serial sections reveal a poorly-defined, firm tan-white mass. measuring 3.2 x 2.5 x 2.0 cm. The mass approaches the closest margin as. follows: 0.2 cm inferior; 0.5 cm deep and anterior; and 1.0 cm medial. The remainder of the specimen is composed of lobulated, yellow-tan adipose. tissue admixed with a minimal amount of fibrous tissue and is otherwise. unremarkable. Representative sections are sequentially submitted from. superior to inferior as follows A1 - superior margin; A2-A4- adjacent. normal; A5-A7- mass with deep and anterior margins; A8- - mass; A9-A10- mass. with deep margin; All-A13- - mass with deep, anterior and medial margin;. A14-A16- - mass with lateral, inferior and anterior margin; A17-A19- mass. with deep and inferior margins. Matched sections of A4 and A6-A8 - are submitted in OCT and Paraffin per. Specimen #: GROSS DESCRIPTION (continued) : CBCP protocol. Time in formalin: 28 hours. B: Received in formalin, labeled with the patient's name. and designated, ""Highest Right Axillary Lymph Node"" and consists. of an irregular fragment of tan-yellow adipose tissue measuring 1.5 x 1.0. x 0.5 cm. Blunt dissection reveals an ovoid fragment of tan, soft tissue. representing possible lymph node measuring 1.5 cm in greatest dimension. Sectioning of the possible lymph node reveals a tan-white, firm cut. surface. C: Received in formalin, labeled with the patient's name. ind designated, ""Right Axillary Lymph Node Dissection"" and. consists of an irregular fragment of tan-yellow, lobular adipose tissue. measuring 10.0 x 6.0 x 3.0 cm. The specimen is blunt dissected to reveal. 22 roughly ovoid fragments of tan-white, firm tissue representing possible. lymph nodes ranging from 0.4 to 4.3 cm in greatest dimension. Sectioning. of the possible lymph nodes reveals a tan-white, firm cut surface with. focal areas of hemorrhage. Sections are submitted as follows: C1- five. possible lymph nodes; C2- representative sections of four possible lymph. nodes; C3- - representative sections of four possible lymph node; C4-. representative sections of three possible lymph nodes; C5 - representative. sections of two possible lymph nodes; C6- representative sections of two. possible lymph nodes; C7- - representative section of one possible lymph. node; C8- - one whole possible lymph node, bisected.",BRCA,3,"The T stage is determined by the size of the tumor in breast cancer. According to the report, the tumor size is 3.2 cm, which falls under the T2 category: 'T2: tumor size > 2 cm and <= 5 cm'.",T2,2.0
539,TCGA-A2-A1G1.E2E6CA22-AFE4-4B8F-90AC-32639687A590,1,"SURGICAL REPORT. Sex. F. Date Collected: I. Date Received: M.R. Number. Doctor: Account Numbe. PRE-OPERATIVE DIAGNOSIS. RIGHT BREAST CA. POST-OPERATIVE DIAGNOSIS. RIGHT BREAST CA. PROCEDURE. RIGHT BREAST LUMPECTOMY WITH SENTINEL LYMPH NODE BIOPSY, F.S.: POSSIBLE AXILLARY DISSECTION. TISSUES. A. BREAST EXCISION,NEEDLE LOC, SIMPLE,MARGINS,ETC - RIGHT BREAST LUMP. B. SENTINEL LYMPH NODE (S) - #1 ""FS. FS DIAGNOSIS. RIGHT BREAST LUMP (GROSS MARGINS) -. MARGINS GROSSLY NEGATIVE FOR MALIGNANCY. a. RIGHT SENTINEL LYMPH NODE #1, F.S. -. SENTINEL NODE #1, NEGATIVE FOR MALIGNANCY. (REPORTED TO SURGEON: Diagnosed by: FINAL DIAGNOSIS. A. RIGHT BREAST LUMP -. POORLY DIFFERENTIATED INFILTRATINO DUCTAL CARCINOMA WITH CENTRAL. THE TUMOR MEASURES IN MAXIMUM DIMENSION. II//II). NECROSIS (SCARFF-BLOOM-RICHARDSON GRADE. 3 CM. LYMPHOVASCULAR INVASION IDENTIFIED INSIDE THE TUMOR. ALL SURGICAL MAROINS ARE FREE OF THE TUMOR. B. RIGHT SENTINEL LYMPH NODE #1 . ONE POSITIVE LYMPH NODE (1/1). PTNM CLASSIFICATION: STAGE IIB, T2 N1 MX. PQRI CATEGORY II: 3260F. Diagnosed by: Revlewed and electronically signed out by: SURGICAL REPORT. COMMENT. Specimen ""B"" shows metastatic carcinoma which is shown in the permanent section and not In. the frozen section. This case is discussed with Dr. GROSS DESCRIPTION. The specimen is received in two separate containers labeled. designated A. and B. A. The container Is received fresh unfixed labeled ""right breast lump"" and consists of a 33 gm. ovoid. mass of apparent fatty and fibrous-encased tissue which is 5.5 x 4.5 x 2 om. In greatest overall. dimension. There are two sutures indicating superior margin inked with yellow dye, inferior Is. inked green. There Is a single short suture indicating lateral margin inked with orange dye,. medial is inked black. There is a single short suture indicating anterior margin Inked with blue. dye, posterior Is Inked red. Sectioning reveais a tumor which is 3x 2.5) 1 cm. in greatest overall. dimension and grossly appears to be 0.4 cm. from the superior/yellow, 0.9 cm. from the. inferior/green, 0.4 cm. from the medial/black, 0.3 cm. from the lateral/orange, 0.5 cm. from the. anterior/blue, 0.6 cm. from the posterior/red. The specimen is submitted In twelve blocks. Key Note Block Summary: 1-superior, 2-inferlor, 3-medial, 4-lateral, 5-anterior, 6-. posterior, 7 through - tumor, 10 through 12-random. B. The container Is received fresh unfixed labeled ""right sentinel lymph node #1 for frozen section"". and consists of an ovoid mass of apparent fat which is 1.5x x 0.6 cm. in greatest overail. dimension. Sectioning reveais a 1 cm. pink-tan firm nodule. Touch prep and frozen section are. obtained by Dr. The entire specimen including frozen section is submitted in two. blocks. MICROSCOPIC EXAM. MICROSCOPIC EXAMINATION CONDUCTED BY PATHOLOGIST CONFIRMS FINAL DIAGNOSIS. Patient Narr. SURGICAL REPORT.",BRCA,1,"The report states that the tumor measures 3 x 2.5 x 1 cm in greatest overall dimension. Based on the rules provided, T2 corresponds to a tumor size of greater than 2 cm and less than or equal to 5 cm. The given dimensions fall within this range, making the T stage T2.",T2,3.0
796,TCGA-AO-A0JA.2E8A1816-E963-4063-B2F0-6289514084A5,1,"Clinical Diagnosis & History: Right multicentric IDC and ILC presents for bilateral TM, bilateral SLNBx. Specimens Submitted: 1: SP: Sentinel node #1 level 1 left axilla. 2: SP: Sentinel node #2 level 1 left axilla. 3: SP: Sentinel node #1 level 1 right axilla (fs). 4: SP: Sentinel node #2 level 1 right axilla (fs). 5: SP: Right breast and axillary contents level 1, 2, and 3. 6: SP: Left breast. 7: SP: Right rotter's node. 8: SP: Additional level 1 lymph right axilla node 1. 9: SP: Additional right level 2 axillary contents. 10: SP: Level 3 lymph node right axilla. DIAGNOSIS: 1). SENTINEL NODE #1 LEVEL 1 LEFT AXILLA; EXCISION: - ONE BENIGN LYMPH NODE (0/1). 2). SENTINEL NODE #2 LEVEL 1 LEFT AXILLA; EXCISION: - ONE BENIGN LYMPH NODE (0/1). 3). SENTINEL NODE #1 LEVEL 1 RIGHT AXILLA; EXCISION: - METASTATIC CARCINOMA INVOLVING ONE OF ONE LYMPH NODE (1/1). - THE METASTATIC CARCINOMA IS PRESENT AS SUB-CAPSULAR TUMOR CELL. CLUSTERS MEASURING <0 2MM AND COMPOSED OF 30-40 CELLS. THE TUMOR CELLS ARE. SEEN BOTH IN THE HE STAINED AND KERATIN (AE1:AE3) IMIMUNOSTAINED SECTIONS. 4). SENTINEL NODE #2 LEVEL 1 RIGHT AXILLA; EXCISION: - METASTATIC CARCINOMA INVOLVING ONE OF ONE LYMPH NODE (1/1). - THE METASTATIC FOCUS MEASURES 1.2 CM, WITH EXTRANODAL EXTENSION. (>2MM). 5). BREAST, RIGHT; MASTECTOMY: TUMOR #1: - INVASIVE DUCTAL CARCINOMA, WITH FOCAL LOBULAR GROWTH PATTERN,. HISTOLOGIC GRADE II/III (MODERATE TUBULE FORMATION), NUCLEAR GRADE II/III. (MODERATE VARIATION IN SIZE AND SHAPE). MEASURING `3.6 CM IN LARGEST. DIMENSION GROSSLY. - DUCTAL CARCINOMA IN-SITU (DCIS) IS ALSO IDENTIFIED, MICROPAPILLARY TYPE. WITH INTERMEDIATE NUCLEAR GRADE AND MINIMAL NECROSIS. - THE DCIS CONSTITUTES LESS THAN OR EQUAL TO 25% OF THE TOTAL TUMOR MASS,. AND IS PRESENT ADMIXED WITH THE INVASIVE COMPONENT. THE INVASIVE CARCINOMA IS LOCATED IN THE UPPER INNER QUADRANT, AT. 1:00. - THE DCIS IS LOCATED IN THE UPPER INNER QUADRANT. NO INVOLVEMENT OF THE NIPPLE BY EITHER IN SITU OR INVASIVE CARCINOMA. IS IDENTIFIED. - NO CALCIFICATIONS ARE IDENTIFIED IN EITHER THE INVASIVE OR IN SITU. COMPONENT. - EXTENSIVE VASCULAR INVASION IS PRESENT. - NO INVOLVEMENT OF THE SURGICAL MARGINS BY EITHER INVASIVE OR IN SITU. CARCINOMA IS IDENTIFIED. - INVASIVE CARCINOMA IS 3.3 CM FROM THE DEEP MARGIN GROSSLY. TUMOR #2: - INVASIVE DUCTAL CARCINOMA, NOS TYPE, WITH FOCAL LOBULAR GROWTH. PATTERN, HISTOLOGIC GRADE II/III (MODERATE TUBULE FORMATION) , NUCLEAR GRADE. II/III (MODERATE VARIATION IN SIZE AND SHAPE) . MEASURING 2.5 CM IN LARGEST. DIMENSION GROSSLY. - DUCTAL CARCINOMA IN-SITU (DCIS) IS ALSO IDENTIFIED, SOLID, CRIBRIFORM TYPE. WITH INTERMEDIATE NUCLEAR GRADE AND MODERATE NECROSIS. - LOBULAR INVOLVEMENT BY DCIS IS PRESENT. - THE DCIS CONSTITUTES LESS THAN OR EQUAL TO 25% OF THE TOTAL TUMOR. MASS, AND IS PRESENT ADMIXED WITH THE INVASIVE COMPONENT. - THE INVASIVE CARCINOMA IS LOCATED IN THE LOWER INNER QUADRANT AT. - THE DCIS IS LOCATED IN THE LOWER INNER QUADRANT. - NO. INVOLVEMENT OF THE NIPPLE BY EITHER IN SITU OR INVASIVE CARCINOMA IS. IDENTIFIED. - CALCIFICATIONS ARE PRESENT IN THE INVASIVE CARCINOMA ONLY. - VASCULAR INVASION IS PRESENT. - NO INVOLVEMENT OF THE SURGICAL MARGINS BY EITHER INVASIVE OR IN SITU. CARCINOMA IS IDENTIFIED. - INVASIVE CARCINOMA IS 4.5 CM FROM THE DEEP MARGIN GROSSLY. - THE NON-NEOPLASTIC BREAST TISSUE SHOWS USUAL DUCTAL HYPERPLASIA,. PAPILLARY APOCRINE HYPERPLASIA, COLUMNAR CELL CHANGE, AND CYSTS. - THE LYMPH NODE STATUS IS AS FOLLOWS (EXPRESSED AS THE NUMBER OF POSITIVE. LYMPH NODES IN RELATION TO THE TOTAL NUMBER OF LYMPH NODES EXAMINED) : 13/17. - THERE IS EXTRANODAL EXTENSION (>2mm) OF CARCINOMA. THE LARGEST. METASTATIC CARCINOMA MEASURES .1CM. - RESULTS OF SPECIAL STAINS (ER, PR, HER2-NEU) ARE AS FOLLOWS: TUMOR 1: ESTROGEN RECEPTOR. 90% nuclear staininy with woderate intensity. PROGESTERONE RECEPTOR. 1: <5% nucle: weak intensity. HER2. Negative ( 1+). (<10% of invasive tumor cells exhibit weak complete membranous staining;. Uniformity of staining: absent;. Homogeneous, dark circumferential pattern: absent). TUMOR 2: ESTROGEN RECEPTOR. 50-60% nuclear staining with moderate intensity. PROGESTERONE RECEPTOR. 10-20% nuclear staining with moderate intensity. Negative ( 1+). (<10% of invasive tumor cells exhibit weak complete membranous staining;. Uniformity of staining: absent;. Homogeneous, dark circumferential pa. absent). Comment: Controls are satisfactory. a PATHWAY anti-HER-2/neu is an. FDA-approved rabbit monoclonal primary antibody (clone 4B5) directed against. the internal domain of the c-erbB-2 oncoprotein (HER2) for. immunohistochemical detection of HER2 protein overexpression in breast. cancer tissue routinely processed for histologic evaluation. The HER2 test. results are reported in accordance with the ASCO/CAP guideline. recommendations for HER2 testing in breast cancer (J Clin Oncol 2007;. 25 (1) :118-145) The ER and PR rabbit monoclonal antibodies are also FDA. approved. 6). LEFT BREAST; MASTECTOMY: - BENIGN BREAST WITH PAPILLARY APOCRINE HYPERPLASIA, USUAL DUCTAL. HYPERPLASIA AND COLUMNAR CELL CHANGE. - BENIGN NIPPLE. 7). RIGHT ROTTER'S NODE; EXCISION: - METASTATIC CARCINOMA LARGELY REPLACING ONE OF ONE LYMPH NODE (1/1). - THE METASTATIC FOCUS MEASURES 0.9 CM, WITH NO EXTRANODAL EXTENSION. 8). ADDITIONAL LEVEL 1 LYMPH RIGHT AXILLA NODE 1; EXCISION: - METASTATIC CARCINOMA INVOLVING THREE OF THREE LYMPH NODES (3/3) . LARGEST METASTATIC CARCINOMA MEASURES .3CM. - EXTRANODAL EXTENSION IS PRESENT. 9). ADDITIONAL RIGHT LEVEL 2 AXILLARY CONTENTS; EXCISION: - METASTATIC CARCINOMA INVOLVING FOUR OF FOUR LYMPH NODES (4/4). LARGEST METASTATIC CARCINOMA MEASURES 0 5CM. - EXTRANODAL EXTENSION IS PRESENT. 10). LEVEL 3 LYMPH NODE RIGHT AXILLA; EXCISION: METASTATIC CARCINOMA LARGELY REPLACING ONE OF ONE LYMPH NODE (1/1) . LARGEST METASTATIC CARCINOMA MEASURES 0.2CM. - EXTRANODAL EXTENSION IS PRESENT. I ATTEST THAT THE ABOVE DIAGNOSIS IS BASED UPON MY PERSONAL EXAMINATION OF. THE SLIDES (AND/OR OTHER MATERIAL), AND THAT I HAVE REVIEWED AND APPROVED. THIS REPORT. Gross Description: 1) . The specimen is received for a canceled a canceled frozen section. consultation, placed in formalin labeled ""Sentinel node number one level. 1. left axilla"" and consists of a 1.4 x 0.5 x 0.5 cm piece of lymphoid fatty. tissue is bisected and entirely submitted. Summary of sections: U - undesignated. 2) The specimen is received for a canceled frozen section consultation,. placed in formalin, labeled ""Sentinel node number two, level one left. axilla"" and consists of 1.3 x 1.3 x 0.5 cm pink-tan lymph node which is. bisected and entirely submitted. Summary of sections: U - undesignated. 3) The specimen is received fresh for frozen section consultation, labeled. "". Sentinel node number one level 1 right axilla"" and consists of a 0.4 x 0.4. x 0.3 cm lymph node which is bisected and entirely submitted for frozen. section. Summary of sections: FSC frozen section control. 4). The specimen is received fresh for frozen section consultation,. labeled ""Sentinel node number two level 1 right axilla"" and consists of a. 1.2 x 1.0 x 1.0 cm lymph node which is bisected and entirely submitted for. frozen section. Summary of sections: FSC -- frozen section control. 5) The specimen is received fresh labeled, ""right breast and axillary. contents level 1,2, and 3"" and consists of a breast with attached axillary. contents. The breast measures 19 x 18 x 6 cm with overlying skin ellipse. measuring 18.5 x 7.5 cm. Situated on the skin surface is a nipple measuring. 1.5 x 1.5 x 0.5 cm and areola measuring 3.5 cm. The skin shows no scar. Axillary contents measures 12 x 7 x 2.5 cm. The posterior surface of the. breast is inked black and the anterior blue. The specimen is serially. sectioned to reveal a mass (mass 1) measuring 3.6 x 3.01 x 2.5 cm, and. located in the UIQ at 1 o' clock and 3.3 cm from the deep margin. A clip. is. identified in the mass 1. Another mass (mass 2) measuring 2.5 x 2.2 x 1.5 cm. LIQ at 5 o' clock located 4.5 cm from the deep margin is identified. The. remaining breast tissue shows fibroglandular tissue. The axillary tissue is. dissected to reveal multiple lymph nodes. Representative sections are. submitted. All dissected lymph nodes are entirely submitted. Summary of sections: N - nipple. NB - nipple base. D1 - deep margin for mass 1. D2 deep margin for mass 2. T1 mass 1. T2 mass 2. UIQ - upper inner quadrant. LIQ - lower inner quadrant. UOQ - upper outer quadrant. LOQ - lower outer quadrant. LN lymph nodes. M.D. 6) The specimen is received fresh labeled, ""left breast"" and consists of. a. breast measuring 25 x 18 x 5cm with overlying skin ellipse measuring 18 x. 8. cm. Situated on the skin surface is a nipple measuring 1.8 x 1.3 x 1cm and. areola measuring 3.5 cm. The skin is unremarkable. A suture demarcates the. axillary aspect. The posterior surface of the breast is inked black and the. axillary aspect is inked yellow. The specimen is serially sectioned to. reveal unremarkable fibroglandular tissue without mass lesion. Sectioning of. the axillary aspect reveals no grossly identifiable lymph nodes. Representative sections are submitted. Summary of sections: N - nipple. NB - nipple base. D - deep margin. UIQ - upper inner quadrant. LIQ - lower inner quadrant. UOQ - upper outer quadrant. LOQ - lower outer quadrant. 7) The specimen is received in formalin, labeled ""Right Rotter' s node"" and. consists of a single pink tan fleshy lymph node measuring 1 x 0.8 x 0.5 cm. The lymph node is entirely submitted. Summary of sections: LN- lymph node. 8) The specimen is received in formalin, labeled ""Additional level 1 lymph. node, right axilla"" and consists of four pink tan firm lymph nodes ranging. from 0.4 to 2.2 cm in greatest dimension. All identified lymph nodes are. submitted. Summary of sections: LN - - lymph nodes. BLN1- - bisected lymph node #1. BLN2' bisected lymph node #2. 9). The specimen is received in formalin, labeled ""Additional right level. two axillary contents"" and consists of a portion of yellow tan adipose. tissue, with four pink tan firm lymph nodes ranging from 0.6 to 1 cm. in. greatest dimension. All identified lymph nodes are submitted. Summary of sections: LN -- lymph nodes. 10) The specimen is received in formalin, labeled ""Level three lymph node,. right axilla"" and consists of a single pink tan fatty lymph node measuring. 0.8 x 0.3 x 0.2 cm. The lymph node is entirely submitted. Summary of sections: LN- lymph node. Summary of Sections: Part 1: SP: Sentinel node #1 level 1 left axilla. Block. Sect. Site. PCs. 1. u. 1. Part 2: SP: Sentinel node #2 level 1 left axilla. Block. Sect. Site. PC's. 1. u. 1. Part 3: SP: Sentinel node #1 level 1 right axilla (fs). Block. Sect. Site. PCs. 1. fsc. 1. Part 4: SP: Sentinel node #2 level 1 right axilla (fs). Block. Sect. Site. PCs. 1. fsc. 1. Part 5: SP: Right breast and axillary contents level 1, 2, and 3. Block. Sect. Site. PCs. 5. BLN. 10. 1. D1. 1. 1. D2. 1. 1. LIQ. 1. 5. LN. 15. 2. LOQ. 2. 1. N. 1. 1. NB. 1. 3. T1. 3. 3. T2. 3. 1. UIQ. 1. 2. UOO. 2. Part 6: SP: Left breast. Block. Sect. Site. PCs. 1. D. 1. 2. LIQ. 2. 2. LOQ. 2. 1. N. 2. 1. NB. 1. 2. UIQ. 2. 2. UOQ. 2. Part 7: SP: Right rotter's node. Block. Sect. Site. PCs. 1. LN. 1. Part 8: SP: Additional level 1 lymph right axilla node 1. Block. Sect. Site. PCs. 1. bln1. 2. 2. bln2. 2. 1. LN. 2. Part 9: SP: Additional right level 2 axillary contents. Block. Sect. Site. PCs. 1. LN. 4. Part 10: SP: Level 3 lymph node right axilla. Block. Sect. Site. PCs. 1. LN. Intraoperative Consultation: Note: The diagnoses given in this section pertain only to the tissue sample. examined at the time of the intraoperative consultation. 3). FROZEN SECTION DIAGNOSIS: SP: SENTINEL NODE #1 LEVEL 1 RIGHT. AXILLA (FS) : BENIGN LYMPH NODE (. PERMANENT DIAGNOSIS: SAME. 4). FROZEN SECTION DIAGNOSIS: SP: SENTINEL NODE #2 LEVEL 1 RIGHT. AXILLA (FS) METASTATIC CARCINOMA. PERMANENT DIAGNOSIS: SAME. .e: The diagnoses given in this section pertain only to the tissue sample. amined at the time of the intraoperative consultation. 3). FROZEN SECTION DIAGNOSIS: SP: SENTINEL NODE #1 LEVEL 1 RIGHT. AXILLA (FS) : BENIGN LYMPH NODE. PERMANENT DIAGNOSIS: SAME. 4). FROZEN SECTION DIAGNOSIS: SP: SENTINEL NODE #2 LEVEL 1 RIGHT. AXILLA (FS) : METASTATIC CARCINOMA. PERMANENT DIAGNOSIS: SAME.",BRCA,3,"Based on the report, the largest tumor in the right breast measures 3.6 cm, which falls under the T2 category of tumor size being greater than 2 cm and less than or equal to 5 cm.",T2,4.0
