Unnamed: 0,patient_filename,t,text,type,n,cmem_t_reasoning,cmem_t_ans_str,cmem_t_num_update
1374,TCGA-EW-A6SD.9FB40DC5-BED9-420E-B334-4D0BE8B8BCF5,1,"F. Pathologic Interpretation: A. LEFT BREAST LUMPECTOMY: INVASIVE DUCTAL CARCINOMA, poorly differentiated, Nottingham grade 3 (3+3+3=9), 2.1 cm in greatest. dimension. Resection margins are free of tumor; closest is inferior, 0.1 cm. B. LEFT AXILLARY CONTENTS: METASTATIC DUCTAL CARCINOMA to two out of twenty-six lymph nodes (2/26) with extranodal. extension. C. ADDITIONAL LEFT AXILLARY CONTENTS LEVEL 2-3: No malignancy seen in five lymph nodes (0/5). Surgical Pathology Cancer Case Summary. Specimen: Partial breast. Procedure: Excision without wire-guided localization. Lymph Node Sampling: Axillary dissection (partial or complete dissection). Specimen Integrity: Single intact specimen (margins can be evaluated). Specimen Laterality: Left. Tumor Size: Size of Largest Invasive Carcinoma: Greatest dimension of largest focus of invasion over 0.1 cm: 2.1 cm. Additional dimensions: 1.7 x 1.7 cm. Tumor Focality: Single focus of invasive carcinoma. Macroscopic and Microscopic Extent of Tumor: Skin: Skin is not present. Skeletal Muscle: No skeletal muscle present. Ductal Carcinoma in Situ (DCIS): DCIS is present. Architectural Patterns: Solid. Nuclear Grade: Grade III (high). Histologic Type of Invasive Carcinoma: Invasive ductal carcinoma (no special type or not otherwise specified). Histologic Grade: Nottingham Histologic Score: Glandular (Acinar)/Tubular Differentiation. Score 3: < 10% of tumor area forming glandular/tubular structures. Nuclear Pleomorphism. Score 3: Vesicular nuclei, often with prominent nucleoli, exhibiting marked variation in size and. shape, occasionally with very large and bizarre forms. Mitotic Count. Score 3. Overall Grade. Grade 3. Margins: Margins uninvolved by invasive carcinoma. Distance from closest margin: 1 mm (inferior). Margins uninvolved by DCIS. Lymph Nodes: Number of sentinel lymph nodes examined: 0. Total number of lymph nodes examined (sentinel and nonsentinel): 31. Number of lymph nodes with macrometastases (> 0.2 cm): 2. Largest metastatic deposit: 3.0cm. Extranodal Extension: Present. Method of Evaluation of Sentinel Lymph Nodes: Hematoxylin and eosin (H&E), one level. Pathologic Staging (pTNM): Primary Tumor (pT): pT2: Tumor > 20 mm but 50 mm in greatest dimension. Regional Lymph Nodes (pN): pN1a: Metastases in 1 to 3 axillary lymph nodes, at least 1 metastasis greater than 2.0 mm. Distant Metastasis (pM): Not applicable. Ancillary Studies: Estrogen Receptor: Performed on another specimen: Results: Less than 1% immunoreactive cells present. Progesterone Receptor: Performed on another specimen: Results: Less than 1% immunoreactive cells present. HER2/neu Immunoperoxidase Studies: Performed on another specimen: Results: Positive (Score 3+). Clinical History: None Provided. Operation Performed. Left Breast Lumpectomy. Pre Operative Diagnosis: Breast Cancer. Specimen(s) Received/Processing Information: Fee. Codes: A: LEFT BREAST LUMPECTOMY H&E, Initial x 1, H&E, Initial x 1, H&E, Initial x 1, H&E,. Initial x 1, H&E, Initial x 1, H&E, Initial x 1, H&E, Initial x 1, H&E, Initial x 1, H&E, Initial x. 1. B: LEFT AXILLARY CONTENTS H&E, Initial x 1, H&E, Initial x 1, H&E, Initial x 1, H&E,. Initial x 1, H&E, Initial x 1, H&E, Initial x 1, H&E, Initial x 1, H&E, Initial x 1, H&E, Initial x 1,. H&E, Initial x 1. C: ADDITIONAL LEFT AXILLARY CONTENTS LEVEL 2-3 H&E, Initial x 1, H&E, Initial x. Gross Description: A. Received in formalin is a yellow tan fibrotic adipose tissue fragment weighing 86 grams and measures 8.0 x. 7.0 x 4.0 cm. The specimen is oriented with a long stitch lateral, short superior and double stitch. Inked as. follows: Superior in Blue - deep black, anterior yellow, inferior green, lateral orange and medial red. Cross. sections of the specimen shows a firm pale tan well circumscribed mass measuring 2.1 x 1.7 x 1.7 cm. It is. within 1 mm from inferior resection margin, all additional margins are uninvolved by tumor. The mass shows. a metallic clip (previous biopsy site). No additional lesions are grossly present. Sections submitted as. follows: Cassette #1-4. Representative section of the mass with relations to the inferior margin (almost in toto). (Cassette #1) -largest dimension of the mass, (Cassette #4) previous biopsy site. Cassette# 5. Superior margin. Cassette# 6. Deep margin. Cassette# 7. Anterior margin. Cassette#8. Lateral margin. Cassette #9. Medial resection margin. B. Received in formalin are multiple yellow tan fibrotic adipose tissue fragments measuring 15.0 x 13.0 x 4.0. cm in aggregate. Twenty-six lymph nodes were grossly identified measuring up to 3.0 x 2.0 cm in greatest. dimension. The two largest lymph nodes show a metastatic tumor. Sections submitted as follows: Cassette #1. Representative section from one large lymph node. Cassette #2. Representative section from the second largest lymph node. Cassettes# 3&4. One lymph node in toto per cassette. Cassettes#5-10. Four lymph nodes in toto per cassette. C. Received in formalin is a yellow tan fibrotic adipose tissue fragment. It measures 10. 0 x 6.0 x 2.0 cm in. aggregate. The five lymph nodes are grossly identified measuring up to 0.4 x 0.3 cm in greatest dimension. Sections submitted as follows: Cassette #1. Two lymph nodes in toto. Cassette# 2. Three lymph nodes in toto.",BRCA,1,"The T stage is determined by the size of the largest focus of invasion in the breast tissue. In this report, the size of the largest invasive carcinoma is given as 2.1 cm, which falls within the T2 category (tumor size > 20 mm but ≤ 50 mm).",T2,0.0
1121,TCGA-D8-A1JE.746C603E-FB1F-40D7-BEAF-20ACE27D6C21,0,"page 1 / 2. copy No. Examination: Histopathological examination. Cost of diagnostic procedure. Gender: F. Material: Multiple organ resection - the left breast and axillary tissue. Expected time of examination: up to 8 working days. Clinical diagnosis: Cancer of the left breast. Results of immunohistochemical examination: Estrogen receptors found in over 75% of neoplastic cell nuclei. Progesterone receptors found in over 75% of neoplastic cell nuclei. HER2 protein stained with HercepTest™M by DAKO. Negative reaction in invasive cancerous cells 1 Score = 1+ ). Macroscopic description: Left breast sized 19 x 20 x 5 cm removed along with axillary tissues sized 12 x 6 x 2 cm and a 16 x 11. cm skin flap. Weight 800 g. Tumour sized 1.5 x 1.5 x 1.5 cm on the border of upper quadrants, 6.5. cm from the upper boundary, 0.7 cm from the base and 0.1 cm from the skin. Microscopic description: Carcinoma ductale invasivum - NHG2 (2 + 2 +3/15 mitoses/10 HPF, visual area diameter 0.55 mm). Glandular, outside the tumour, tissue showing lesions of the type mastopathia fibrosa et cystica,. hyperplasia ductalis simplex (UDH). AXILLARY LYMPH NODES. Metastases carcinomatosae in lymphonodis No III/X. Infiltratio capsulae lymphonodorum. page 2 / 2. Histopathological diagnosis: Carcinoma ductale invasivum mammae sinistrae. Invasive ductal carcinoma of the left breast. Metastases carcinomatosae in lymphonodis axillae No. III/X. Cancer metastases in axillary lymph. nodes No III/X. (NHG2, pT1c, pN1a).",BRCA,1,"The report specifies that the tumor size is 1.5 x 1.5 x 1.5 cm, which is equal to or less than 20 mm in its greatest dimension. This corresponds to T1 stage according to the provided rules.",T1,1.0
665,TCGA-A8-A096.91BFC77A-E56F-49F0-A294-A5EE9F266FB6,1,"Diagnosis: 1. Moderately differentiated invasive ductal carcinoma (tumor diameter 4.0 cm). In conjunction with the preliminary finding, this gives rise to the following tumor. classification: NOS, G II, pT2NOi+(sn)LOVORO.",BRCA,0,"The report states that the tumor diameter is 4.0 cm, which falls within the range for T2 (> 20 mm but <= 50 mm). Therefore, the T stage for this patient is T2.",T2,2.0
723,TCGA-AC-A4ZE.6931CAAE-6DFE-4A61-84D5-4EC804C2F2C6,2,"F. Path Report. ACCESSION NO. : Final Diagnosis(es): (A) Left simple mastectomy: 1) Benign breast with areas of stromal fibrosis. 2) No atypia, in-situ or invasive malignancy identified,. including margins. 3) Skin and nipple unremarkable. (B) Right simple mastectomy: 1) Infiltrating lobular carcinoma, Nottingham grade Il of. III. 2) Pathologic stage pT3 psnNo pMX. 3) See Synoptic report (below) for details. (C) Right axilla sentinel lymph node #1: One lymph node. negative for metastasis (0/1). Synoptic Report: Specimen Type: Total breast (including nipple and skin). Procedure: Simple mastectomy. Lymph Node Sampling: Sentinel lymph node. Laterality: Right. Tumor Type: Lobular. Tumor Focality: Single. Tumor Site: Lower outer quadrant. Tumor Size: 7.8 x 7.0 x 6.0 cm. Nottingham Grade: II of III. Skin: Present, unremarkable. Nipple: Present, unremarkable. Skeletal Muscle: Absent. Invasive Margins: Widely negative. Lobular Carcinoma in Situ: Not present. Ductal Carcinoma in Situ: Not present. Lymphvascular Invasion: Not identified. Lymph nodes: Sentinel: 0/1 (positive/total). CK 10.11 performed on block B1. Anciliary Studies: Estrogen Receptor: Positive, strong, 95%. Progesterone Receptor. Positive, strong, 50%. Her-2/neu: 0+ (0-3+ scale). (was not sent for FISH analysis). KI-67: 25%. MD. Specimen(s) Received: A: left simple mastectomy. B: right simple mastectomy. C: right axilla sentinel lymph node # 1. Printed from: Default. Page: 1 of 5. F. Clinical History: High risk breast cancer left. (A) Short - superior, long - lateral. (B) Short superior, long - lateral. (C) Count 166. Intraoperative Consultation: FSC1-FSC2: Right axilla sentinel lymph node #1: Benign (2. blocks). M.D. Gross Description: (A) (left simple mastectomy). Specimen type: Simple mastectomy. Specimen weight and dimensions: The specimen weighs 1595 gm and. measures 23.5 x 22.5 x 6.3 cm. Skin: The overlying skin ellipse measures 22.0 x 11.0 cm. The. skin appears tan-pink and unremarkable. Orientation and inking scheme: The specimen is oriented as. follows: One short suture denoting the superior orientation and. one long suture representing the lateral left orientation. The. specimen is inked as follows: Medial - red, lateral - green. Estimated size of lesion: Sectioning of the breast demonstrates. unremarkable fibrofatty tissue with no nodules or masses seen or. palpated. Blocks submitted: A1 - section of nipple. A2-A3 - two sections from upper lateral portion of breast. A4-A5 - two representative sections of the lower lateral. quadrant. A6-A7 - representative sections of lower medial quadrant. A8-A9 - representative sections of upper medial quadrant. (B) (right simple mastectomy). Specimen type: Simple mastectomy. Specimen weight and dimensions: The specimen weighs 1670 gm and. measures 26.0 x 28.0 x 6.0 cm. Skin: The ellipse of overlying skin measure 24.5 x 9.0 cm. The. skin is pink and unremarkable. Orientation and inking scheme: The specimen is oriented as. follows: One short suture denoting the superior orientation and. one long suture representing the lateral left orientation. The. specimen is inked as follows: Deep margin - black, anterior. lateral margin - red, anterior medial margin - blue. Estimated size of lesion: The breast is serially sectioned. The. primary lesion measures approximately 7.0 x 7.8 x 6.0 cm. Appearance of lesion: The lesion is firm and tan-white, and. infiltrates into the breast parenchyma. Printed from: Default. Page: 2 of 5. F. Location of lesion: The lesion is located approximately 7.0 cm. medial to the center of the specimen in the lower lateral. quadrant. Distance from closest margin: The primary lesion is located 1.5. cm superficial to the deep margin, 4.0 cm from the anterior. margin, 6.0 cm from the lateral margin, 19.0 cm to the medial. margin, 6.0 cm to the inferior margin, and 14.0 cm to the. superior margin. Other findings: Two possible satellite lesions are located with. one central and one at 2:00. The central lesion measures 6.5 x. 3.0 x 3.0 cm. The lesion at 2:00 measures 1.5 x 2.5 x 2.5 cm. Uninvolved parenchyma: The uninvolved parenchyma demonstrates. unremarkable fibrofatty tissue. Axillary tail and lymph nodes: No axillary tail is received in. this specimen. Blocks submitted: B1 nipple. B2 - fat overlying tumor. B3 - skin overlying tumor. B4-B8 - representative sections from the primary tumor. B9-B10 - representative sections from the centrally located. possible satellite lesion. B11-B12 - two representative sections from the lesion at 2:00. B13-14 - representative sections of uninvolved parenchyma from. the upper medial quadrant. B15-B16 - representative sections of uninvolved parenchyma. B17-B18 - representative sections of the lower lateral quadrant. B19-B20 - two representative sections of uninvolved parenchyma. from the upper lateral quadrant. B21 - section of the medial margin. B22 - section of the lateral margin. B23 - section of the inferior margin. B24 - section of the superior margin of uninvolved parenchyma. (C) (right axilla sentinel lymph node #1) Received fresh for. intraoperative consultation is one piece of fatty tissue. measuring 3.3 x 2.4 x 1.0 cm. The specimen is bisected with. one-half submitted in FSC1 and the other half submitted in FSC2. for frozen section evaluation. One lymph node was received in. formalin and submitted entirely in C3. Microscopic Description: Complete microscopic evaluation has been performed. Appropriately reacting controls have been performed and. evaluated for all stains on this case as required. Histopathology has a list of IH antibodies that are regulated as. analyte specific reagents (ASR's). These assays were developed. and their performance characteristics determined by the. at. They. have not been cleared by the US Food and Drug Administration. Printed from: Default. Page: 3 of 5. F. 1. The FDA has determined that such clearance or approval is not. necessary for the ASR's. These tests are not investigational. and are used in standard clinical care. In cases where. Immunohistochemistry testing is performed, the following. antibodies and their respective clones may be used to determine. therapy for the patient: EFGR(31G7), ER(SP1), PR(1E2),. Her2neu(4B5), CD117(Poly), CD20(L26). Unless otherwise stated in the report, all tissue tested for. ERPR by IHC, Her2 by IHC and/or HER2 by FISH have been fixed as. per ANP 22998 for a minimum of 6 hours and a maximum of 48. hours. ER, PR, Ki-67, p53 are reported as a semi-quantitative. percentage of positively stained nuclei. Her-2/neu and EGFR are. scored as follows: No staining at all is scored as (0), weak,. incomplete membrane staining in any proportion of cells is. scored as (1+), less than strong but complete staining in any. proportion of cells or complete strong staining in less than 30%. of cells is scored as (2+), and strong complete staining in more. that 30% of cells is scored as (3+). All studies are performed. on tissue fixed in 10% neutral buffered formalin and embedded in. paraffin unless otherwise stated in the report. Page: 4 of 5.",BRCA,0,"The report specifies that the size of the tumor in the right breast is approximately 7.0 x 7.8 x 6.0 cm, which is larger than 50 mm in the greatest dimension. This corresponds to T3 in the TNM staging system.",T3,3.0
1061,TCGA-BH-A18T.B8FF655E-47AB-4BB0-B119-1402A335126A,1,"PATIENT HISTORY: The patient is a -year-oid female with no clinical history or LMP given. PRE-OP DIAGNOSIS: Right breast CA. POST-OP DIAGNOSIS: Same. PROCEDURE: Right segmental mastéctomy, sentinel node. ADDENDA: Addendum. ESTROGEN/PROGESTERONE AND HER-2/NEU REPORT. Using appropriate positive and negative controis, the test for the presence of these hormone receptor proteins is. performed by the immunoperoxidase method. and reported according to the. consensus statement on adjuvant. therapy for breast cancer, of,. A positive ER or PR tumor shows any nuclear immunostaining, and is. semiquantitated as indicated below. Semiquantitative Statement. ER negative. Percent cells staining as: (0 100%). PR negative. Percent cells staining as: (0 100%). HER-2/NEU DAKO HERCEPTEST: A WEAK TO MODERATE COMPLETE MEMBRANE STAINING IS OBSERVED IN MORE. THAN 10% OF THE TUMOR CELLS. HER-2/NEU IS INTERPRETED AS WEAKLY POSITIVE (SCORE 2+). NOTE: Her-2/Neu FISH was ordered and will be subsequently reported. The Her-2/neu and estrogeniprogesterone receptor assays were performed with FDA approved. methods. FINAL DIAGNOSIS: PART 1: BREAST, RIGHT, SEGMENTAL MASTECTOMY -. A. INFILTRATING DUCTAL CARCINOMA, 3.1 CM, POORLY DIFFERENTIATED, NOTTINGHAM SCORE - 9/9. (TUBULES = 3, NUCLEAR GRADE = 3, MITOSES = 3). B. LYMPHOVASCULAR INVASION IS IDENTIFIED. C. SEPARATE FOCI OF DUCTAL CARCINOMA IN SITU, SOLID TYPE, HIGH NUCLEAR GRADE. D. THE DUCTAL CARCINOMA IN SITU EXTENDS CLOSE (<0.1CM) TO THE POSTERIOR SURGICAL MARGIN. OF RECECTION. E. ALL SURGICAL MARGINS OF RESECTION ARE FREE OF TUMOR. F. NON-NEOPLASTIC BREAST WITH FIBROCYTIC CHANGES. PART 2: SENTINEL LYMPH NODE #1, RIGHT AXILLA, BIOPSY -. ONE (1) LYMPH NODE, NEGATIVE FOR TUMOR (0/1), (see comment). PART 3: SENTINEL LYMPH NODE #2, RIGHT AXILLA, BIOPSY -. ONE LYMPH NODE, NEGATIVE FOR TUMOR, (0/1), (see comment). PART 4: NON-SENTINEL LYMPH NODE, RIGHT AXILLA, BIOPSY -. ONE LYMPH NODE, NEGATIVE FOR TUMOR, (0/1). COMMENT: Cytokeratin (AE1/3) stains have been performed and confirm the negative status of the sentinal lymph nodes.",BRCA,0,"The report indicates that the size of the infiltrating ductal carcinoma is 3.1 cm, which falls under T2 as per the rules provided: T2: Tumor size > 20 mm but <= 50 mm. The tumor size is greater than 20 mm but less than or equal to 50 mm.",T2,4.0
805,TCGA-AO-A0JL.C2976F78-89AF-4461-8D22-BFEBC0504722,1,"clinical Diagnosis & History: %/O female with left breast mass. Mammo showed 2 lesions in UOQ left. breast. Core biopaies IDC and DCIS. Proceeding to MRM. Specimens Submitted: 1: SP: Left breast with level 1 and low level 2 axillary contents. 2: SP: Additional level 2 left axillary contents. 3: SP: Left level 2 and level 3 axillary contents. DIAGNOSIS: 1). BREAST WITH LEVEL I AND LOW LEVEL II AXILLARY CONTENTS, LEFT;. MODIFIED RADICAL MASTECTOMY AND AXILLARY LYMPH NODE DISSECTION: - TWO SEPARATE TUMOR NODULES: ONE IS LOCATED IN THE UPPER OUTER. QUADRANT AND SHOWS AN INVASIVE DUCTAL CARCINOMA, POORLY DIFFERENTIATED. (HISTOLOGIC GRADE III/III, NUCLEAR GRADE III/III), MEASURING 3.9 CM IN. LARGEST DIMENSION GROSSLY. THE SECOND IS LOCATED IN THE UPPER AND LOWER OUTER QUADRANTS AT 3:00 AND IS. COMPOSED OF PREDOMINANTLY DUCTAL CARCINOMA IN SITU (DCIS) WITH SEVERAL FOCI. OF INVASIVE DUCTAL CARCINOMA, POORLY DIFFERENTIATED AND SIMILAR TO ABOVE,. RANGING IN SIZE FROM LESS THAN 0.1 CM TO ABOUT 0.4 CM. - THE DUCTAL CARCINOMA IN SITU (DCIS) IS OF THE SOLID AND CRIBRIFORM TYPES. WITH HIGH NUCLEAR GRADE, EXTENSIVE NECROSIS AND FOCALLY INVOLVES A LARGE. LACTIFEROUS DUCT OF THE NIPPLE. - CALCIFICATIONS ARE PRESENT IN THE IN SITU AND INVASIVE CARCINOMA, AND IN. BENIGN BREAST PARENCHYMA. - VASCULAR INVASION IS PRESENT. - NO INVOLVEMENT OF THE SURGICAL MARGINS BY EITHER INVASIVE OR IN SITU. CARCINOMA IS IDENTIFIED. - NO SKIN INVOLVEMENT BY CARCINOMA IS IDENTIFIED. - THE REMAINING BREAST TISSUE SHOWS PREVIOUS BIOPSY SITE AND MILD. FIBROCYSTIC CHANGES. - THE LYMPH NODE STATUS IS AS FOLLOWS (EXPRESSED AS THE NUMBER OF POSITIVE. LYMPH NODES IN RELATION TO THE TOTAL NUMBER OF LYMPH NODES EXAMINED) : THERE IS EXTRANODAL TUMOR EXTENSION (>2 MM). - RESULTS OF IMMUNOHISTOCHEMICAL STAINS ARE AS FOLLOWS: ER: 0% NUCLEAR STAINING. PR: 0% NUCLEAR STAINING. HER-2/NEU (HERCEPTEST) : NEGATIVE (STAINING INTENSITY OF 1+). 2). AXILLARY CONTENTS, LEFT ADDITIONAL LEVEL II; DISSECTION: TWELVE BENIGN LYMPH NODES (0/12). 3). AXILLARY CONTENTS, LEFT LEVELS II AND III; DISSECTION: - THREE BENIGN LYMPH NODES (0/3). I ATTEST THAT THE ABOVE DIAGNOSIS IS BASED UPON MY PERSONAL EXAMINATION OF. THE SLIDES (AND/OR OTHER MATERIAL), AND THAT I HAVE REVIEWED AND APPROVED. THIS REPORT. Special Studies: Special Stain. Comment. ER-C. PR-C. HER2-0. NEG CONT. IMM RECUT. NEG-HER2. Gross Description: 1). The specimen is received fresh labeled, ""Left breast with level 1 and. low level 2 axillary contents, stitch marks axillary contents and consists. of a breast with attached axillary tail. The breast measures 37.0 x 26.0. x. 6.7 cm with overlying skin ellipse measuring 36.5 x 18.0 cm. Situated on. the skin surface is an everted nipple measuring 1.4 x 1.2 x 0.1 cm and. areola measuring 4.8 x 4.5 cm. The skin shows no visible scars. A suture. demarcates the axillary tail which measures 11.0 x 4.0 x 3.5 cm. The. posterior surface of the breast is inked black and the specimen is serially. sectioned to reveal a white tan firm ill-defined mass in the upper outer. quadrant measuring 3.9 x 3.7 x 3.3 cm, located 1.5 from the deep margin. There is a biopsy site identified in the lower outer quadrant, corresponding. to the three o'clock position, measuring 2.0 x 2.0 x 1.5 cm. The remaining. breast tissue shows predominantly yellow lobulated adipose tissue admixed. with white-tan fibrous soft tissue with no other gross identifiable lesions. The axillary tissue is dissected to reveal several grossly positive lymph. nodes, measuring up to 4.5 cm. Representative sections of the mastectomy. specimen and all identified axillary lymph nodes are submitted (the large. grossly positive lymph nodes are representatively submitted). Tissue. is. taken for TPS. Summary of sections: N - nipple. NB - nipple base. s skin. D - deep margin. T tumor. BX - separate biopsy site. UIQ - upper inner quadrant. LIQ - lower inner quadrant. UOQ - upper outer quadrant. LOQ - lower outer quadrant. LN - individual lymph nodes. 2). The specimen is received in formalin, labeled ""Additional level 2. left axillary contents"" and consists of an axillary dissection measuring 7 x. 4.5 x 0.8 cm. The specimen consists of soft yellow-tan lobulated tissue. with several pink-tan lymph nodes identified on cut section ranging from 0.2. cm to 1.8 cm in greatest dimension. The specimen is submitted for lymph. node digest dissection. Summary of sections: LN - lymph nodes. 3). The specimen is received in formalin, labeled ""Left level 2 and level. 3 axillary contents"" and consists of an unoriented axillary dissection. measuring 7.5 x 4.7 x 1.8 cm. The specimen consists of yellow tan lobulated. tissue, which on sectioning reveals several pink-tan lymph nodes ranging. from 0.2 cm to 2.3 cm in greatest dimension. The specimen is submitted for. lymph node dissection. Summary of sections: LN - lymph nodes. Summary of Sections: Part 1: SP: Left breast with level 1 and low level 2 axillary contents. Block. Sect. Site. PCs. 3. BX. 3. 1. D. 1. 2. LIQ. 2. 4. LN. 4. 2. LOQ. 2. 1. N. 1. 1. NB. 1. 1. s. 1. 3. T. 3. 2. UIQ. 2. 2. 2. Part 2: SP: Additional level 2 left axillary contents. Block. Sect. Site. PCs. 4. LN. 4. 2art 3: . SP: Left level 2 and level 3 axillary contents. Block. Sect. Site. PCs. 2. LN. 2.",BRCA,2,"The report mentions a tumor size of 3.9 cm in the largest dimension, which falls under the 'T3: Tumor size > 50 mm but <= 100 mm' category. Therefore, the T stage for this patient is T3.",T3,5.0
