Unnamed: 0,patient_filename,t,text,type,n,cmem_t_reasoning,cmem_t_ans_str,cmem_t_num_update
641,TCGA-A8-A085.64F84FF4-A477-4E1E-B4BB-E5614517229E,1,"Diagnosis: Poorly differentiated invasive carcinoma with discrete in situ spread. (tumor diameter 2.5 cm). Infiltration of the corial connective tissue of superficial. adjacent skin spindle. No ulceration of the skin. Focal tumor spread within the lymph. vessels. In conclusion, this is a poorly differentiated invasive ductal carcinoma. Tumor classification: NOS, G III, pT2N1aL1V0R0.",BRCA,1,"The report mentions that the tumor diameter is 2.5 cm and there is infiltration of the corial connective tissue of superficial adjacent skin spindle, but no ulceration of the skin. According to the AJCC staging system for breast cancer, T2 classification applies to tumors that are greater than 2 cm in size but not more than 5 cm in size. This information supports the prediction of T2 stage.",T2,0.0
1295,TCGA-E9-A1RD.EDDEB48B-B712-40B0-9DE5-9F5B5791AF4D,1,"OC ID. Gross Description: Breast with the tumor of 2.8 x2.6 cm in size; lymph nodes are up to 1 cm in their diameter, dense, hyperemic. Microscopic Description: Infiltrating duct carcinoma; G2. Ten examined lymph nodes demonstrate sinus histiocytosis. Diagnosis Details: Tumor Features: Unknown, Tumor Extent: T2 tumor size more than 2cm not more than 5 cm, Venous Invasion: Absent,. Margins: Absent, Treatment Effect: Comments: BREAST TISSUE CHECKLIST. Specimen type: Radical mastectomy. Specimen size: Not specified. Tumor site: Lower inner quadrant. Tumor size: 2.6 x 0 x 2.8 cm. Grossly evident lesion: Yes. Histologic type: Infiltrating ductal carcinoma. Histologic grade: Moderately differentiated. Tumor extent: Not specified. Lymph nodes: 0/10 positive for metastasis (Axillary 0/10). Extracapsular invasion of the lymph nodes: Not specified. Margins: Uninvolved. Nottingham Histologic Score. Tubule formation: Not specified. Nuclear pleomorphism: Not specified. Mitotic count (25x): Not specified. Mitotic count (40x): Not specified. Total Nottingham Score: Score cannot be determined. Evidence of neo-adjuvant treatment: Not specified. Additional pathologic findings: Not specified. Comments: None. Laterality: Right, lower inner quadrant.",BRCA,0,"The report states that the tumor size is 2.8 x 2.6 cm, which falls within the T2 category of 'Tumor size is more than 2 cm but not more than 5 cm in greatest dimension'.",T2,1.0
1270,TCGA-E9-A1N3.4F50E811-0743-440B-9094-6BA0F40BD734,0,"BREAST TISSUE CHECKLIST. Specimen type: Radical mastectomy. Specimen size: Not specified. Tumor site: Breast. Tumor size: 1.8 x 1 x 1 cm. Grossly evident lesion: Yes. Histologic type: Infiltrating ductal and lobular carcinoma. Histologic grade: Tumor extent: Not specified. Lymph nodes: 7/7 positive for metastasis (Regional 7/7). Right,Jupper. Extracapsular invasion of the lymph nodes: Not specified. inner. Margins: Not specified. quadrant. Nottingham Histologic Score. Tubule formation: Not specified. Nuclear pleomorphism: Not specified. Mitotic count (25x): Not specified. Mitotic count (40x): Not specified. Total Nottingham Score: Score cannot be determined. Evidence of neo-adjuvant treatment: Not specified. Additional pathologic findings: Not specified. Comments: None.",BRCA,2,"The report states that the tumor size is 1.8 x 1 x 1 cm which is less than or equal to 2 cm in greatest dimension, therefore the T stage is T1 according to the rules.",T1,2.0
1281,TCGA-E9-A1NG.73953A70-DAC0-443A-AC04-28BDA8D5F673,1,"the. the. BREAST TISSUE CHECKLIST. Specimen type: Mastectomy. Specimen size: Not specified. Tumor site: Breast. Tumor size: 3.2 X 3.2 x 3.2 cm. Grossly evident lesion: Yes. Histologic type: Infiltrating ductal carcinoma. Histologic grade: Tumor extent: Not specified. Lymph nodes: 0/5 positive for metastasis (Regional 0/5). Right,Jupper. Extracapsular invasion of the lymph nodes: Not specified. outer. Margins: Not specified. quadrant. Nottingham Histologic Score. Tubule formation: Not specified. Nuclear pleomorphism: Not specified. Mitotic count (25x): Not specified. Mitotic count (40x): Not specified. Total Nottingham Score: Score cannot be determined. Evidence of neo-adjuvant treatment: Not specified. Additional pathologic findings: Not specified. Comments: None.",BRCA,0,"The report states that the tumor size is 3.2 x 3.2 x 3.2 cm, which falls within the range for T2 (more than 2 cm but not more than 5 cm in greatest dimension). The histologic type is infiltrating ductal carcinoma, which meets the requirement for invasive carcinoma. The T stage is based on the primary tumor size and its invasion into surrounding tissues, not on the presence of lymph node or distant metastases. The tumor grade and other factors do not affect T classification.",T2,3.0
1256,TCGA-E2-A1LI.B3A319BE-2230-43E2-91E5-A3B3C76B85BA,1,"SPECIMENS: A. SENTINEL LYMPH NODE LEFT AXILLA. B. SENTINEL LYMPH NODE #2 LEFT AXILLA. C. WIDE LOCAL EXCISION LEFT BREAST. DIAGNOSIS: A. SENTINEL LYMPH NODE #1, LEFT AXILLA: -ONE LYMPH NODE, NO TUMOR SEEN (0/1). B. SENTINEL LYMPH NODE #2, LEFT AXILLA: -ONE LYMPH NODE, NO TUMOR SEEN (0/1). C. WIDE LOCAL EXCISION, LEFT BREAST: -INVASIVE AND IN-SITU DUCTAL CARCINOMA, SBR GRADE III/III WITH. EXTENSIVE NECROSIS AND CANCERIZATION OF LOBULES, SEE TEMPLATE. Invasive Breast Cancer Template. INVASIVE TUMOR: Histologic type: ductal. Tumor Size (cm): 2.5 cm. Size of Invasive Focus: 2.5 cm. Grade, Histologic: 3. Grade, Nuclear: 3. Mitoses. 3. Scarff Bloom Richardson grade: III. Necrosis: present. Invasion Vasc/Lymphatic: absent. DCIS component. DCIS Quantity: <25%. DCIS Type: Clining. DCIS Location: outside main mass: diffuse. Nuclear grade: high. Necrosis: absent. Margins: DCIS present within 1 hpf of lateral and 1 mm of deep and medial margins. Lymph nodes: Negative (0/2). Stage, Pathology : T2N1. Hormone receptor status (by IHC): ER & PR: PENDING. HERCEPTEST (by IHC): Pending. ADDENDUM. The ER/PR/HER2 status of the invasive breast carcinoma was determined by immunohistochemistry. and quantitated via ACIS (image analysis). Results are as follows: ER. 0%. PR. 0%. HER2. 2.3 (borderline). A separate ACIS report has been generated. NOTE: FISH analysis for HER2 gene amplification has been ordered. Addendum. Fluorescence in situ hybridization (FISH) for Her-2 gene amplification. Her-2/neu gene: Not amplified. Ratio of Her-2/neu to CEP17: 1.21. The assay is performed on formalin fixed, paraffin embedded section using Her-2 DNA probe kit from. Vysis. The quality of the fluorescence signals and tissue section is adequate for analysis. The signals of. both Her-2 and CEP17 are counted in 60 invasive tumor nuclei. The Her-2 gene is considered amplified. when the ratio of Her-2 to CEP17 signal is >2.0. SPECIMEN(S): A. SENTINEL LYMPH NODE LEFT AXILLA B. SENTINEL LYMPH NODE #2 LEFT AXILLA C. WIDE. LOCAL EXCISION LEFT BREAST. CLINICAL HISTORY: None. FROZEN SECTION DIAGNOSIS: A. SENTINEL LYMPH NODE LEFT AXILLA. Touch prep: No tumor seen by Dr. B. SENTINEL LYMPH NODE #2 LEFT AXILLA. Touch prep: No tumor seen by Dr. GROSS DESCRIPTION: A. SENTINEL LYMPH NODE LEFT AXILLA. Received fresh is a 1x0.8x0.5cm. lymph node. It is bisected and touch prep done. Specimen entirely. submitted for permanent section. B. SENTINEL LYMPH NODE #2 LEFT AXILLA. Received fresh is sentinel lymph node left axilla measuring 0.7x0.5x0.4cm. It is bisected and touch prep. done. Submitted in toto in cassette B for permanent section. C. WIDE LOCAL EXCISION LEFT BREAST. Received fresh is an oriented portion of breast tissue measuring 6x5.5x2.7cm Sectioning shows a well. circumscribed tan nodular tumor mass measuring 2.5x1.8x1cm. It closely approaches the superior. posterior medial margin. Specimen is inked as follows: superior red, inferior orange, medial green,. lateral yellow, posterior black. Tumor tissue and normal tissue given for tissue procurement and tumor. sent for flow cytometry. Representative sections submitted in seventeen cassettes. Microscopic/Diagnostic Dictation: Pathologist. Final Review: Pathologist. Final: Pathologist. Addendum: Pathologist. Addendum Review: Pathologist. Addendum Final: Pathologist. Addendum: Pathologist, 1. Addendum Review: Pathologist,. Addendum Final: Pathologis.",BRCA,1,"The T stage is determined by the size of the primary tumor. In this report, the tumor size is given as 2.5 cm, which falls under the 'T2' category: 'T2: Tumor size is more than 2 cm but not more than 5 cm in greatest dimension'.",T2,4.0
1073,TCGA-BH-A1F5.F70DE761-F081-4F4C-AD22-9A166CF78CA8,0,"PATIENT HISTORY: The patient is a. -old female. Date of last menstrual period: Not given. PRE OP DIAGNOSIS: Breast cancer. POST OP DIAGNOSIS: Same. PROCEDURE: Right sentinel node biopsy, right segmental mastectomy. FINAL DIAGNOSIS: PART 1: RIGHT SENTINEL LYMPH NODE #1, BIOPSY -. ONE LYMPH NODE, NEGATIVE FOR TUMOR (0/1). PART 2: RIGHT NON-SENTINEL LYMPH NODE #2, BIOPSY -. FIBROADIPOSE TISSUE, NO LYMPH NODE IDENTIFIED. PART 3: RIGHT NON-SENTINEL LYMPH NODE #1, BIOPSY -. ONE LYMPH NODE, NEGATIVE FOR TUMOR (0/1). PART 4: RIGHT NON-SENTINEL LYMPH NODE #3, BIOPSY -. ONE LYMPH NODE, NEGATIVE FOR TUMOR (0/1). PART 5: RIGHT SENTINEL LYMPH NODE #2, BIOPSY -. ONE LYMPH NODE, NEGATIVE FOR TUMOR (0/1). PART 6: RIGHT SENTINEL LYMPH NODE #3, BIOPSY -. ONE LYMPH NODE, NEGATIVE FOR TUMOR (0/1). PART 7: RIGHT BREAST, BIOPSIES X4-. A. ONE OUT OF 4 LYMPH NODES POSITIVE FOR METASTATIC CARCINOMA (1/4). B. BENIGN FIBROADIPOSE TISSUE (see comment). PART 8: RIGHT BREAST, SEGMENTAL MASTECTOMY -. A. INFILTRATING DUCT CARCINOMA. 1.4 CM IN GREATEST DIMENSION AS MEASURED ON THE SLIDE,. NOTTINGHAM SCORE 7/9 (TUBULES 3, NUCLEI 3, MITOSIS 1) ASSOCIATED WITH MICROCALCIFICATIONS. B. LYMPHOVASCULAR INVASION IDENTIFIED. C. DUCTAL CARCINOMA IN SITU, SOLID AND CRIBRIFORM TYPE, NUCLEAR GRADE 2 ASSOCIATED WITH. MICROCALCIFICATIONS AND COMPRISING LESS THAN 5% OF TUMOR. D. SURGICAL MARGINS NEGATIVE. E. INFILTRATING DUCT CARCINOMA APPROACHES ANTERIOR MARGIN WITHIN 0.3 CM. F. CHANGES CONSISTENT WITH PREVIOUS CORE BIOPSY SITE. G. TUMOR IS ESTROGEN RECEPTOR POSITIVE, PROGESTERONE RECEPTOR POSITIVE AND HER-2/NEU. NEGATIVE AS PER PREVIOUS CORE BIOPSY REPORT. H. UNREMARKABLE SKIN. I. FIBROCYSTIC CHANGES. COMMENT: One lymph node in specimen number 7 contains micrometastatic carcinoma that measures less than 0.2 cm in diameter.",BRCA,1,"The report indicates that the infiltrating duct carcinoma in the right breast is 1.4 cm in greatest dimension. According to the rules provided, T1 tumors are those with a size of 2 cm or less in greatest dimension. In this case, 1.4 cm is below the 2 cm threshold, so the T stage is T1.",T1,5.0
1048,TCGA-BH-A18F.771497E1-473E-421A-A149-CFA58E95B728,1,"CHIEF COMPLAINT/ PRE-OPI POST-OP DIAGNOSIS: 1.2-cm mass posterior 12 o'clock right breast. Core blopsy Invasive ductal. carcinoma. LMP DATE: Not provided. PROCEDURE. Right segmental mastectomy/sentinel lymph node biopsies. SPECIFIC CLINICAL QUESTION: Not provided. OUTSIDE TISSUE DIAGNOSIS: No. PRIOR MALIGNANCY No. CHEMORADIATION THERAPY: No. OTHER DISEASES No. ADDENDA: Addendum. There a few satellite nodules ranging in size from 0.5-2 mm, which measure 0.5-1.2 cm from the main dominant nodule. These. satellite nodules are the nodules that are seen closest to the margins, as reported. FINAL DIAGNOSIS: PART 1: BREASTÍRIGHT/SEGMENTAL MASTECTOMY -. A. INVASIVE DUCTAL CARCINOMA (see comment). B. NOTTINGHAM GRADE 3 (TUBULE FORMATION 3, NUCLEAR PLEOMORPHISM 3, MITOTIC ACTIVITY 3;. TOTAL SCORE 9/9). C. THE INVASIVE TUMOR MEASURES 1.1 CM IN GREATEST DIMENSION (ON SLIDE IK). D. NO DUCTAL CARCINOMA IN-SITU (DCIS) IS IDENTIFIED. E. NO LYMPHOVASCULAR SPACE INVASION IS IDENTIFIED. F. RESECTION MARGINS ARE NEGATIVE FOR INVASIVE CARCINOMA; INVASIVE CARCINOMA MEASURES. LESS THAN 1 MM FROM THE ANTERIOR AND INFERIOR MARGINS, 1 MM FROM THE MEDIAL MARGIN, AND. 1.5 MM FROM THE POSTERIOR MARGIN. G. SKIN, NEGATIVE FOR TUMOR. H. ATYPICAL DUCTAL HYPERPLASIA. I. CALCIFICATIONS ASSOCIATED WITH INVASIVE CARCINOMA. J. FIBROCYSTIC CHANGES WITH DUCTAL EPITHELIAL HYPERPLASIA ANO COLUMNAR CELL ALTERATIONS. K. CHANGES CONSISTENT WITH PRIOR BIOPSY SITE. THE INVASIVE TUMOR CELLS ARE NEGATIVE FOR ESTROGEN AND PROGESTERONE RECEPTORS AND. ALSO NÉGATIVE FOR HER-2/NEU (SCORE 0). AS PER PREVIOUS REPORT. PART 2: AXILLA, RIGHT, CYST EXCISION -. EPIDERMAL INCLUSION CYST. PART 3: LYMPH NODE, RIGHT AXILLARY, SENTINEL #1, BIOPSY -. ONE LYMPH NODE, NEGATIVE FOR METASTATIC CARCINOMA (0/1). PART 4: LYMPH NODE, RIGHT AXILLARY, SENTINEL #2, BIOPSY -. ONE LYMPH NODE, NEGATIVE FOR METASTATIC CARCINOMA (0/1). PART 5: LYMPH NODE, RIGHT AXILLARY, SENTINEL #3, BIOPSY -. ONE LYMPH NODE, NEGATIVE FOR METASTATIC CARCINOMA (0/1). COMMENT: The triple negative invasive tumor was reported to be positive for basal markers, as per previous report (I. Although the mass grossly measured 1.4 cm by gross examination, the tumor is best estimated to be 1.1 cm. based on the microscopic measurement from slide 1K. CASE SYNOPSIS: SYNOPTIC . PRIMARY INVASIVE CARCINOMA OF BREAST. LATERALITY: Right. PROCEDURE: Segmental. Clock position:12 oclock. SIZE OF TUMOR: Maximum dimension invasive component: 11 mm. MULTICENTRICITY/MULTIFOCALTY OF INVASIVE FOCI: TUMOR TYPE (invasive component): Ductal adenocarcinoma, NOS, Other Type(s): Basal-like phenotype confirmed by IHC. on biopsy. NOTTINGHAM SCORE: Nuclear grade: 3. Tubule formation 3. Mitotic activity score. 3. Total Nottingham score: 9. Nottingham grade (1, 2, 3): 3. ANGIOL YMPHATIC INVASION: DERMAL LYMPHATIC INVASION: CALCIFICATION: Yes, malignant zones. SURGICAL MARGINS INVOLVED BY INVASIVE COMPONENT: Distance of invasive tumor to closest margin: 0.5 mm. LYMPH NODES POSITIVE: 0. LYMPH NODES EXAMINED: 3. METHOD(S) OF LYMPH NODE EXAMINATION: H/E stain. SENTINEL NODE METASTASIS: SKIN INVOLVED (ULCERATION): NON-NEOPLASTIC BREAST TISSUE: ADH, FCD, Other: ductal epithelial hyperplasia, columnar cell alterations. T STAGE, PATHOLOGIC: pTic. N STAGE, PATHOLOGIC: pNO. M STAGE: Not applicable. ESTROGEN RECEPTORS: negative. PROGESTERONE RECEPTORS: negative. HER2/NEU: 0.",BRCA,0,"The report states that the maximum dimension of the invasive component of the tumor is 1.1 cm, which falls within the criteria for T1 (Tumor size is 2 cm or less in greatest dimension).",T1,6.0
