Unnamed: 0,patient_filename,t,text,type,n,cmem_t_reasoning,cmem_t_ans_str,cmem_t_num_update
1251,TCGA-E2-A1LA.8F401B38-8D91-4F75-ADE5-52521EAA7DFE,0,"SPECIMENS: A. SENTINEL NODE #1 AND #2. B. RIGHT BREAST. C. RIGHT AXILLARY CONTENTS. SPECIMEN(S): A. SENTINEL NODE #1 AND #2. B. RIGHT BREAST. C. RIGHT AXILLARY CONTENTS. GROSS DESCRIPTION: A. SENTINEL NODE #1 AND #2. Received fresh labeled with the patient's identification and ""sentinel node #1 and #2, right axilla"" is a 1.8. x 1.5 x 0.6 cm portion of adipose tissue, within which, two lymph nodes are identified, 0.4 cm( #2) and. 0.8 cm( #1). A touch preparation is made on each node. The specimen is entirely submitted as follows: A1- lymph node #1. A2-lymph node #2. B. RIGHT BREAST. Received fresh labeled with the patient's identification and designated ""right breast"" is an oriented. (suture in axilla), 358 g, 21 x 17 x 5 cm mastectomy specimen with 7.5 x 5.4 cm beige skin ellipse. showing a 1 cm diameter retracted nipple. Ink code: Posterior-deep, anterior/superior-blue,. anterior/inferior-orange. The specimen is serially sectioned from lateral to medial into 13 slices. revealing two possible lesions. Mass #1, in the upper inner quadrant (two o'clock, slices 9-10), 2 x 1.5 x. 1.4 cm, is located 2.2-cm from the deep margin and 1.4-cm from anterior. Approximately 4.5-cm from. mass #1, a second mass is demonstrated in the upper outer quadrant (slice 8), 2 x 1.5 x 1 cm, located. 2.5-cm from the deep margin and 1 cm from anterior. A portion of the specimen is submitted for tissue. procurement (mass #1). Representatively submitted: B1-B2: Nipple. B3: Skin. B4-B5: Mass #1, two o'clock, UIQ, slice 9. B6-B7: Mass #1, two o'clock, UIQ, slice 9. B8: Deep margin overlying mass #1, slice 9. B9: Firm tissue adjacent to mass #1, slice 9. B10-B12: Mass #2, UOQ, slice 8. B13: Deep margin, mass #2, slice 8. B14: Representative section, LOQ, slice 6. B15-B16: Representative sections, LIQ, slice 12. B17: Possible axillary lymph nodes. C. RIGHT AXILLARY CONTENTS. Received fresh labeled with the patient's identification and "" axillary contents"" is a 10.5 x 10.0 x 2.5 cm. portion of adipose tissue, within which, 34 possible lymph nodes are identified, ranging from 0.1 to 2.5. cm. The cut surfaces of the larger nodes are fatty to soft tan-pink. No evidence of tumor is grossly. noted. The specimen is entirely submitted as follows: C1-six lymph nodes. C2-six lymph nodes. C3-six lymph nodes. C4-six lymph nodes. C5-seven lymph nodes. C6-one lymph node bisected. C7-one lymph node bisected. C8-C9-one lymph node. C10-C14-remaining soft tissue. DIAGNOSIS: A. LYMPH NODE, SENTINEL #1 and #2, RIGHT AXILLA, EXCISION: - METASTATIC CARCINOMA TO ONE OF ONE LYMPH NODE (1/1),. MEASURING 8-MM WITH EXTRANODAL EXTENSION. B. BREAST, RIGHT, MASTECTOMY: - INVASIVE DUCTAL CARCINOMA, SBR GRADE 2, MEASURING 1.1 CM, PRESENT IN UPPER. INNER QUADRANT. - HIGH NUCLEAR GRADE, DUCTAL CARCINOMA IN SITU, SOLID type. - SURGICAL RESECTION MARGINS NEGATIVE FOR TUMOR. BIOPSY SITE CHANGES WITH FIBROSIS, GRANULATION TISSUE. - usual ductal hyperplasia without atypia. - fibroadenoma (0/.7-CM) AND INTRADUCTAL PAPILLOMA (0.2-CM). SEE SYNOPTIC REPORT. C. LYMPH NODES, RIGHT, AXILLARY DISSECTION: - Thirty-FOUR LYMPH NODES, NEGATIVE FOR METASTASES (0/34). NOTE: Two nodules are grossly identified, one located in the upper inner quadrant and one located in. the upper outer quadrant. Microscopically, the former is invasive ductal carcinoma and the later is. fibroadenoma. SYNOPTIC REPORT - BREAST. Specimen Type: Mastectomy. Needle Localization: No. Laterality: Right. Invasive Tumor: Present. Multifocality: No. WHO CLASSIFICATION. Invasive ductal carcinoma, NOS 8500/3. Tumor size: 1.1cm. Tumor Site: Upper inner quadrant. Margins: Negative. Tubular Score: 3. Nuclear Grade: 2. Mitotic Score: 2. Modified Scarff Bloom Richardson Grade: 2. Necrosis: Absent. Vascular/Lymphatic Invasion: None identified. Lobular neoplasia: None. Lymph nodes: Sentinel lymph node and axillary dissection. Lymph node status: Positive 1 /35 Extranodal extension. Micrometastases: DCIS present. Margins uninvolved by DCIS. DCIS Quantity: Estimate 5%. DCIS Type: Solid. DCIS Location: Associated with invasive tumor. Nuclear grade: High. Necrosis: Absent. ER/PR/HER2 Results. ER: Positive. PR: Positive. HER2: Negative by FISH. Performed on Case: Pathological staging (pTN): pT 1c N 1a. CLINICAL HISTORY: year old with right breast cancer, previous biopsy. PRE-OPERATIVE DIAGNOSIS: None given. INTRAOPERATIVE CONSULTATION. TPA: Positive for carcinoma. Called by Dr. to Dr at. Right breast, gross examination: Two possible lesions, mass number one, 1.5-cm located 3.2-cm from. deep margin and 1.4-cm from anterior, mass number two, 2-cm in size located 2.5-cm from deep and. 1cm from anterior. Diagnosis called at. by Dr. ADDENDUM: PathVysion HER-2 DNA Probe Kit. Case oAnalytical Interpretation of Results: HER-2 NOT AMPLIFIED. Clinical Interpretation of results. Amplification of the HER-2 gene was evaluated with interphase fluorescence in-situ. hybridization (FISH) on formalin-fixed paraffin embedded tissue sections using a chromosome. 17 centromeric probe and a HER-2 probe that spans the entire HER-2 gene in the. by Dr.. A majority of tumors cells displayed 2 chromosome 17. signals and 2 HER-2 signals, with a HER-2/CEP 17 Ratio </=2.0, consistent with no. amplification of the HER2/neu gene. Block used B7. Source of case: Tissue fixation. formalin-fixed tissue. Outside Case No: NA. Tissue source. breast Results interpreted: HER2/CEP17 ratio: 1.15. This ratio is derived by dividing the total number of LSI HER-2/neu signals by the total number of. CEP17 signals in at least 20 interphase nuclei with nonoverlapping nuclei in the neoplastic. mammary epithelial cells. Cells with no signals or with signals of only one color are disregarded. Method of ratio enumeration: manual count. Limitations. The Vysis PathVysion Kit is not intended for use to screen for or diagnose breast cancer. It is. intended to be used as an adjunct to other prognostic factors currently used to predict disease-free. and overall survival in stage II, node-positive breast cancer patients. In making decisions regarding. adjuvant CAF treatment, all other available clinical information should also be taken into. consideration, such as tumor size, number of involved lymph nodes, and steroid receptor status. treatment decision for stage II, node-positive breast cancer patients should be based on HER-. 2/neu. gene amplification status alone. Overview of this test. FDA APPROVED REAGENT. PathVysion HER-2 DNA Probe Kit is FDA approved for selection of. natients for whom Herceptin therapy is being considered. These tests were performed in the. under the direction. of Dr.. The results of these studies should always be interpreted in the context of the. clinical, morphological, and immunophenotypic diagnosis. Microscopic/Diagnostic Dictation:,. Microscopic/Diagnostic Dictation: Final Review:,. Microscopic/Diagnostic Dictation:, I. Final Review: Pathologist,. Final: Pathologist. Addendum:. Pathologist,. Addendum Final: Pathologist.",BRCA,1,"The report mentions that the largest tumor in the breast measures 1.1 cm, which falls within the T1 category. Specifically, it is classified as T1c since it is larger than 1 cm but not more than 2 cm.",T1,49.0
674,TCGA-A8-A09I.AF12859A-D67A-488D-8BC2-ED28698F2ACA,1,"Diagnosis. 1. and 2. Poorly differentiated invasive ductal right breast carcinoma measuring up to 4.4 cm. with a minimum dorsal margin of 2.9 cm in the ablated breast tissue. Circumscribed ductal. carcinoma in situ (high-grade DCIS with comedo necrosis) in the tumor center, about 0.2 cm. in diameter. Lipomatous atrophy of the remaining breast tissue. Regular nipple. Regular skin. Sixteen right axillary lymph nodes free of metastases (0/16). Tumor classification: M-8500/3, G 3, pT2, pNO (0/16), pMX, stage II A.",BRCA,0,"The report states that the largest size of the tumor is 4.4 cm, which falls within the T2 category of 'tumor size > 2 cm and <= 5 cm'.",T2,50.0
948,TCGA-B6-A1KF.40EE8416-9DD8-457D-94AC-A871B5C62873,1,"Patien. Surgical Pathology: Additional Info. CLINICAL HISTORY: Right breast carcinoma. GROSS EXAMINATION: A. ""Righty breast tissue (AF1) "", received fresh. An oriented breast excision. with sutures as follows: Long - lateral, short - superior, (Dr. 1. A. 4.3 x 0.8 cm ellipse of tan skin with a 6.8 x 5.2 x 3.4 cm of underlying. fibrofatty breast tissue is inked as follows: Superior - blue, inferior -. black, posterior - green. The specimen is sectioned from lateral to medial to. reveal a circumscribed firm yellow sabulous 2.4 x 1.5 x approximately 1.5 cm. mass. The mass is within 0.1 cm of the green inked posterior margin and. within 0.2 cm of the blue inked superior margin. The lesion's edge is. approximately 0.4 cm from the black inked inferior margin, 2.5 cm subjacent to. the skin surface and approximately 0.6 cm from the lateral margin. The. adjacent parenchyma is composed of lobules of yellow-pink adipose intermixed. with focally dense white-pink fibroconnective tissue with no additional. lesions noted. Representative sections from the mass is frozen as AF1. The. remnant is submitted as A1. Block Summary: A1 - Frozen section remnant. A2-14 Representative sections from lateral towards medial respectively. The. sections include the entire lesion in relationship to the closest. margins as well as the lateral margin (A2) and the medial margin A14. A15-25 Remaining breast, submitted in toto. See photograph on file in. pathology department for location of blocks. B. ""Right breast tissue new posterior margin suture in new margin"", received. fresh. A 3.9 x 2.7 x 0.8 cm portion of fibrofatty tissue with a suture on one. surface. The suture surface is marked blue, the specimen is transversely. sectioned and entirely submitted as B1-B4. C. ""Right breast tissue new superior margin suture on new margin"", received. fresh. A 4.1 x 2.7 x 1.2 cm portion of yellow-white fibrofatty tissue with a. suture present on one surface. The suture surface is marked blue, the. specimen is transversely sectioned and submitted as C1-C4. D. ""Right axillary node, suture on apex"". received fresh. An 11.2 x 7.5 x 1.2. cm portion of fibrofatty tissue with a suture present at the apex. The. specimen is dissected for lymph node candidates. Block Summary: D1 - 1 Lymph candidate proximal. D2 - 3 lymph node candidates, medial. D3-. 6 Lymph nodes, medial. D4-5 Bisected lymph node candidate. D6. 2 lymph node candidates, distal. D7 - 2 lymph node candidates, distal. /Dr. INTRA OPERATIVE CONSULTATION: A. ""Right breast tissue"" AF1- invasive carcinoma present. (Dr. DIAGNOSIS: A. ""RIGHT BREAST TISSUE"" (EXCISIONAL BIOPSY) : INFILTRATING CARCINOMA PRESENT, HISTOLOGIC TYPE DUCTAL. https: N.S.A.B.P. NUCLEAR GRADE: 3 OF 3. N.S.A.B.P. HISTOLOGIC GRADE: 3 OF 3. GROSS TUMOR SIZE: 2.4 x 2.4 X 1.5 CM. SIZE OF INVASIVE COMPONENT: 2. x 1.5 CM. LYMPHATIC/VASCULAR INVASION: ABSENT. MULTIFOCAL TUMOR: ABSENT. IN-SITU CARCINOMA: PRESENT, OCCUPYING LESS THAN 5% OF TUMOR (SEE COMMENT) . TYPE OF IN-SITU CARCINOMA: COMEDO AND CRIBRIFORM. SIZE OF IN-SITU CARCINOMA: APPROXIMATELY 4.8 CM, SEE COMMENT. EXTENSIVE INTRADUCTAL COMPONENT: ABSENT. STATUS OF NON-NEOPLASTIC BREAST TISSUE: BENIGN FIBROCYSTIC CHANGES. SIZE OF BIOPSY: 6.8 x 5.2 X 3.4 CM. MICROCALCIFICATIONS ABSENT. SURGICAL MARGIN STATUS: NEGATIVE (CLOSEST MARGIN 3 MM TO DCIS) . ESTROGEN/PROGESTERONE RECEPTOR AND CELL CYCLE ANALYSIS: PENDING. METHODOLOGY: IMMUNOHISTOCHEMISTRY, PARAFFIN BLOCK A6. RESULTS WILL BE ISSUED IN AN ADDENDUM. COMMENT: Although there is very little in-situ carcinoma within the invasive. tumor mass, there is a large area of DCIS adjacent to the tumor, extending in. a medial direction to near the medial margin. Based on the number of slides. involved, the DCIS involves an area of approximately 4.8 cm in largest. dimension. B. ""RIGHT BREAST TISSUE, NEW POSTERIOR MARGIN"" (RE-EXCISION) : BREAST TISSUE, NO EVIDENCE OF MALIGNANCY. C. ""RIGHT BREAST TISSUE, NEW SUPERIOR MARGIN"" (RE-EXCISION). BREAST TISSUE, NO EVIDENCE OF MALIGNANCY. D. ""RIGHT AXILLARY LYMPH NODES"" (DISSECTION). METASTATIC ADENOCARCINOMA IN TWO OF FOURTEEN AXILLARY LYMPH NODES (2/14). SIZE OF LARGEST METASTASIS: 1.0 CM. EXTRACAPSULAR EXTENSION: ABSENT. I certify that I personally conducted the diagnostic evaluation of the above. specimen (s) and have rendered the above diagnosis (es) . M.D. Page #. ADDENDUM 1: Tissue was sent to the. for assay of the estrogen. and. progesterone receptors. The estrogen receptor activity was judged to be. negative with an estimated FMOL value of 0. The progesterone receptor activity. was judged as negative with an estimated FMOL of value of 0. Please refer to. for a complete report. I certify that I personally conducted the diagnostic evaluation of the above. specimen (s) and have rendered the above diagnosis (es). M.D. Page #. https://. ADDENDUM 2: This addendum is issued to report the results of an additional study. The. previous diagnoses are unchanged. An immunostain for HER2/neu shows moderate. (2+) membrane staining in approximately 50-75% of the tumor cells and is. interpreted as POSITIVE for HER2/neu overexpression. METHODOLOGY: Immunostaining for HER2/neu (c-erbB-2) oncoprotein is performed on recut. sections of Block A6. The immunostaining is done using DAKO rabbit anti-human. c-erbB-2 oncoprotein which is an affinity-isolated antibody. product. number. The immunostaining is performed after antigen retrieval by. heating the unstained sections at 95 degrees centigrade for 20 minutes in 10. mM citrate buffer, pH 6.0. The primary antibody is used at a dilution of. 1:1500 (manual staining) or 1:2000 (autostainer), with an incubation for one. hour at 37 degrees centigrade. The Histostain Plus kit. is used as the detection system. I certify that I personally conducted the diagnostic evaluation of the above. specimen (s) and have rendered the above diagnosis (es). M.D. Page #. https:",BRCA,1,"The report states that the 'GROSS TUMOR SIZE: 2.4 x 2.4 X 1.5 CM', which is larger than 2 cm but not larger than 5 cm. This corresponds to T2 stage according to the rules provided.",T2,51.0
1253,TCGA-E2-A1LE.42E3E8C1-D18A-4457-B2F0-FE49F4C027D7,1,"SPECIMENS: A. NON-SENTINEL NODES RIGHT AXILLA Path Site-breast, upperimen. B. RIGHT BREAST. SPECIMEN(S): A. NON-SENTINEL NODES RIGHT AXILLA. B. RIGHT BREAST. INTRAOPERATIVE CONSULTATION DIAGNOSIS: TPA: Lymph nodes, right axillary non-sentinel, biopsy: Two lymph nodes positive for carcinoma on. tough prep. By Dr. called to Dr. GROSS DESCRIPTION: A. NON-SENTINEL NODES RIGHT AXILLA. Received fresh and labeled with the patient name designated ""A - non-sentinel nodes right axilla"", are 2. portions of fibroadipose tissue demonstrating 2 presumptive palpable lymph nodes; one lymph node. measures 3.5 x 1.2 x 0.8 cm, the second measures 2.0 x 1.2 x 0.7 cm. Both nodes are bisected. Touch prep performed. One lymph node is submitted in cassette A1 and the second is submitted in. cassette A2. B. RIGHT BREAST. Received fresh and labeled with the patient name designated ""B - right breast"", is a resected. mastectomy specimen weighing 1,383 grams and measuring 29.5 x 22.0 x 4.0 cm. The attached. axillary tail measures 13.0 x 7.2 x 1.5 cm. A suture indicates the axillary region. The posterior margin. is inked black. The white-beige ellipse of overlying skin measures 21.8 x 11.0. The light beige areola. measures 3.5 cm in diameter. The inverted nipple measures 1.0 cm in diameter. The surface of the. skin is dense and wrinkled. The specimen is serially sectioned from medial to lateral. Cut section. shows two firm beige distinct lesions; the larger lesion is located in the lower inner quadrant in the. subareolar region and measures 3.6 x 2.2 x 1.5 cm located 4.4 cm from the smaller lesion. The smaller. lesion is firm present in the upper inner quadrant measuring 1.0 x 0.9 x 0.8 cm. The larger lesion is 5.1. cm from the deep margin. The smaller lesion approaches the deep margin at a distance of 2.0 cm. The. remainder of the specimen shows dark yellow lobulated adipose tissue. Many firm lymph nodes are. demonstrated in the axillary tail ranging in size from 0.5 x 0.5 x 0.4 cm up to 2.5 x 2.0 x 1.0 cm. A. portion of the specimen is submitted for tissue procurement. Representative sections are submitted as. follows: B1-B2: The smaller lesion submitted entirely with overlying deep margin. B3-B9: Sections from the larger lesion. B10: Margin overlying the larger lesion. B11-B13: Sections of nipple. B14: Section of skin adjacent to nipple. B15: Additional section of skin. B16-B17: Representative sections upper outer quadrant. B18-B19: Representative sections lower outer quadrant. B20: Additional section upper inner quadrant. B21-B22: One bisected lymph node. B23: One-half of one bisected lymph node. B24: One bisected lymph node. B25: Three possible lymph nodes. B26: Three possible lymph nodes. B27: Four possible lymph nodes. B28: Four possible lymph nodes. B29: Four possible lymph nodes. B30: One lymph node. B31: One lymph node. B32: One lymph node. DIAGNOSIS: A. LYMPH NODE, NON-SENTINEL, RIGHT AXILLA, BIOPSY: METASTATIC CARCINOMA TO TWO OF TWO LYMPH NODES (2/2),. MEASURING 2-CM, WITH EXTRANODAL EXTENSION. B. BREAST, RIGHT, MASTECTOMY AND AXILLARY NODE DISSECTION: - MULTIFOCAL, INVASIVE, DUCTAL CARCINOMA, SBR GRADE 3, LARGEST. MEASURING 3.6-CM, PRESENT IN THE LOWER INNER AND UPPER INNER. QUADRANTS AND INVOLVES NIPPLE AND ADJACENT SKIN. - SURGICAL RESECTION MARGINS NEGATIVE FOR TUMOR. - EXTENSIVE LYMPHOVASCULAR INVASION IDENTIFIED. - METASTATIC CARCINOMA TO TWENTY FIVE OF TWENTY SIX LYMPH. NODES (25/26), LARGEST MEASURING 2.1-CM, WITH EXTENSIVE. EXTRANODAL EXTENSION. - SEE SYNOPTIC REPORT AND SEE NOTE. NOTE: Breast biomarkers have been ordered and addendum report to follow. SYNOPTIC REPORT - BREAST. Specimen Type: Mastectomy. Needle Localization: No. Laterality: Right. Invasive Tumor: Present. Multifocality: Yes. Tumor size: 3.6cm. Tumor Site: Upper inner quadrant. Lower inner quadrant and nipple and adjacent skin. Margins: Negative. Tubular Score: 3. Nuclear Grade: 3. Mitotic Score: 3. Modified Scarff Bloom Richardson Grade: 3. Necrosis: Absent. Vascular/Lymphatic Invasion: Present. Extent: extensive. Lobular neoplasia: None. Lymph nodes: Axillary dissection. Lymph node status: Positive 27/28 Extranodal extension. DCIS not present. ER/PR/HER2 Results. ER: Pending. PR: Pending. HER2: Pending. Pathological staging (pTN): pT 2 N 3a. CLINICAL HISTORY: A -year-old Caucasian female post menopausal abnormal mammogram. Biopsy showed an. adenocarcinoma, ER/PR-, Her2+, 2 masses at right breast seen. One at 12 o'clock position subareolar,. 2nd mass at 1 o'clock posterior to 1st mass (3.0 cm). PRE-OPERATIVE DIAGNOSIS: Infiltrating adenocarcinoma. ADDENDUM: SYNOPTIC REPORT - BREAST, ER/PR RESULTS. Specimen: Surgical Excision. Block Number: B4. ER: Negative Allred Score: 0 = Proportion Score 0 + Intensity Score 0. PR: Negative Allred Score: 0 = Proportion Score 0 + Intensity Score 0. COMMENT: The Allred score for estrogen and progesterone receptors is calculated by adding the sum of the. proportion score (0 = no staining, 1 = <1% of cells staining, 2 = 1 - 10% of cells staining, 3 = 11-30% of. cells staining, 4 = 31-60% of cells staining, 5 = >60% of cells staining) to the intensity score (1 = weak. intensity of staining, 2 = intermediate intensity of staining, 3 = strong intensity of staining), with a scoring. range from 0 to 8. ER/PR positive is defined as an Allred score of >2 and ER/PR negative is defined as an Allred score. of less than or equal to 2. METHODOLOGY: Tissue was fixed in 10% neutral buffered formalin for no less than 8 and no longer than 24 hours. Immunohistochemistry was performed using the mouse anti-human ER (ER 1D5, 1:100) and PR (PGR. 136, 1:100) provided by. following the manufacturer S instructions. This. assay was not modified. Interpretation of the ER/PR immunohistochemical stain is guided by published. results in the medical literature, information provided by the reagent manufacturer and by internal. review of staining performance. SYNOPTIC REPORT - BREAST HER-2 RESULTS. Specimen: Surgical Excision. Block Number: B4. Interpretation: POSITIVE. Intensity: 3+. % Tumor Staining: 90%. Fish Ordered: METHODOLOGY: Tissue was fixed in 10% neutral buffered formalin for no less than 8 and no longer than 24 hours. Her2 analysis was performed using the FDA approved. HercepTest (TM) test kit. using rabbit anti-human HER2. This assay was not modified. External kit-slides. provided by the manufacturer (cell lines with high, low and negative HER2 protein expression) and in-. house known HER2 amplified control tissue were evaluated along with the test tissue. Adequate, well. preserved, clear-cut invasive carcinoma was identified for HER2 evaluation. Interpretation of the HER2. immunohistochemical stain is guided by published results in the medical literature, information provided. by the reagent manufacturer and by internal review of staining performance. This assay has been validated according to the 2007 joint recommendations and guidelines from. ASCO and CAP and from the NCCN HER2 testing in Breast Cancer Task Force. Pathology. Department takes full responsibility for this test's performance. Microscopic/Diagnostic Dictation: Pathologist. Final Review: Pathologist. Final: Pathologist,. Addendum: Pathologist,. Addendum Final: Pathologis'.",BRCA,3,"Based on the information provided in the pathology report, the largest tumor in this patient's breast measures 3.6 cm, which falls within the T2 category (tumor size > 2 cm and <= 5 cm). The report states 'Tumor size: 3.6cm' under the 'Synoptic Report - Breast' section, which is the basis for this prediction.",T2,52.0
1145,TCGA-D8-A1XJ.EEA126DE-A667-4373-9DC5-96B55E4ABF07,2,"page 1 / 1. copy No. Examination: Histopathological examination. Gender: F. Material: 1. Multiple organ resection - left breast with axillary tissues. Expected time of examination: up to 8 working days. Clinical diagnosis: Cancer of the breast. Macroscopic description: Left breast-sized 22.4 x 14.2 x 5.3 cm removed along with axillary tissues sized 8 x 9 x 3.5 cm and a 24.3 x 8.2 cm skin flap. Weight 860 g. Tumour sized 5 x 3.5 x 5.5 cm found on the boundary of outer quadrants, 2.4 cm from the upper boundary, 0.4 cm from the base. and 1.6 cm from the skin. Microscopic description: Carcinoma ductale invasivum (partim mucinosum) - NHG2 (2+2+3/24 mitoses/10 HPF - visual area: 0.55mm). Carcinoma intraductale mamillae. Glandular tissue with lesions of the type mastopathia fibrosa. Invasive lesions 0.5 cm away from the base. AXILLARY LYMPH NODES: Metastases carcinomatosae in lymphonodis (No II/XLIII). Histopathological diagnosis: Carcinoma invasivum partim mucinosum mammae sinistrae. Invasive ductal and partially mucinous carcinoma of the left breast.'. Metastases carcinomatosae in lymphonodis axillae (No II/XLIII). Cancer metastases in axillary lymph nodes. (NHG2, pT3, pN1a). Results of immunohistochemical examination: Estrogen receptors found in over 75% of neoplastic cell nuclei. Progesterone receptors found in 10-75% of neoplastic cell nuclei. HER2 protein stained with HercepTest™M by DAKO. Positive reaction in invasive carcinoma cells ( Score = 3+ ).",BRCA,1,"The report states that the tumor size is 5 x 3.5 x 5.5 cm, which falls under the 'T3: tumor size > 5 cm' category. Therefore, the T stage for this patient is T3.",T3,53.0
