Unnamed: 0,patient_filename,t,text,type,n,cmem_t_reasoning,cmem_t_ans_str,cmem_t_num_update
1148,TCGA-D8-A1XM.7E48315C-3717-40DB-8773-71D070AFC47B,0,"page 1 / 2. Examination: Intraoperative examination. Gender: F. Material: Lesion excision - right breast. Internal referral. Expected time of examination: 20 minutes (from receipt of material). Clinical diagnosis: Cancer of the right breast - marked with 1 thread for sternum, 2 threads for the shoulder, 3 threads for the. axilla. Please, review the margins. Examination performed or. Result of intraoperative examination: Carcinoma invasivum mammae 1.1 cm in diameter. Final response to be given after paraffin specimens are analysed. Results of immunohistochemical examination: Estrogen receptors found in over 75% of neoplastic cell nuclei. Progesterone receptors found in over 75% of neoplastic cell nuclei. HER2 protein stained with HercepTest™ by DAKO. Negative reaction in invasive cancerous cells Score = 1+ ). Macroscopic description: Partial reaction of the mammary gland;. Fragment of the breast sized 6.7 x 5.7 x 3.8 cm with a skin flap of 5.3 x 1.6 cm. We marked typically. Tumour sized 1.1 x 0.6 x 0.8 cm in the cross section. Margins: 0.8 cm to the base; 1.9 cm to the skin; 3.4 cm to the edge of. sternum; 1.8 cm to the axilla, 1.4 cm to the shoulder; 1.3 cm to the lower boundary. Microscopic description: Carcinoma ductale invasivum mammae dextrae NHG1 (2 + 2 + 1/2 mitoses/10 HPF - visual area of 0.55 mm). The largest. dimension of the lesion 1.1 cm. Margins of normal tissues as in the macroscopic description. Glandular tissue showing lesions of. the type mastopathia fibrosa partim lipomatosis. Examination: Intraoperative examination. page 2 / 2. xamination No.: Gender: F. Histopathology diagnosis: Carcinoma ductale invasivum mammae dextrae. Invasive ductal carcinoma of the right breast. NHG1, pT1c, pNo/sn/.",BRCA,0,"The report specifies that the tumor size is 1.1 cm in diameter, which falls under the 'T1' category of the rules provided: 'T1: Tumor size <= 20 mm'. Although the exact measurement in millimeters is not provided, the centimeter measurement can be converted to millimeters by multiplying by 10 (1.1 cm x 10 = 11 mm), which is still within the 'T1' range.",T1,12.0
998,TCGA-BH-A0DH.79B22278-2BA1-4904-BCA6-2B1368C77475,1,"To: P.9/33. OIAGNOSIS: f: AXILLARY CONTENTS. LEFT. RESECTION -. A. METASTATIC ADENOCARCINOMA (1H, 1Q-1R and 13-1T) INVOLVING THREE OF TWENTY-EIGHT LYMPH. NODES (3/28), UP TO 1.5 CM (1R). WITH EXTRACAPSULAR EXTENSION (0.2 CM). B. CHANGES CONSISTENT WITH PREVIOUS FINE NEEDLE ASPIRATION SITE, SEE PRIOR. PART 2: BREAST. LEFT. SEGMENTAL MASTECTOMY -. A. INFILTRATING OUCIAL CARCINOMA (ZA thru 21, 2M thru 20 and 2S), WITH ASSOCIATED. MICROCALCIFICATIONS. THE INVASIVE TUMOR INVOLVES THE POSTERIOR RESECTION MARGIN (2A),. THE INFERIOR RESECTION MARGIN (2F, 2N and 20), AND COMES TO WITHIN 0.2 CM FROM THE ANTERIOR. RESECTION MARGIN (2H). B. THE TUMOR SIZE IS 3.5 2.5 x 1.7 CM. C. NOTTINGHAM SCORE 6/9 (TUBULES 3. NUCLFI 2, MITOSIS 1). D. LYMPHOVASCULAR INVASION IS PRESENT. E. DUCTAL CARCINOMA IN SITU, SOUD AND CRIBRIFORM TYPES, NUCLEAR GRADE 2, WITH. COMEDONECROSIS, ASSUCIATED MICROCALCIFICATIONS AND RETROGRADE CANCERIZATION OF. LOBULES, REPRESENTING ABOUT 2% OF TUMOR VOLUME. F. DUCTAL CARCINOMA IN SITU IS PRESENT ADMIXED WITH INVASIVE TUMOR. G. ALL OTHER MARGINS OF RESECTION ARE FREE OF TUMOR. H. ATYPICAL DUCTAL HYPERPLASIA. I. DUCTAL PAPILLOMAS. J. RADIAL SCARS WITH DUCTAL EPITHELIAL HYPERPLASIA AND COLUMNAR CELL CHANGES,. K. PROLIFERATIVE FIBROCYSTIC CHANGES WITH DUCTAL EPITHELIAL HYPERPLASIA, COLUMNAR CELL. CHANGE8 AND MULTIFOCAL SCLEROSING ADENOSIS WITH ASSOCIATED MICROCALCIFICATIONS. L. CHANGES CONSISTENT WITH PREVIOUS BIOPSY SITE, SEE PRIOR. M. IMMUNOHISTOCHEMICAL STAINING FOR ESTROGEN RECEPTOD D. ICRUME RECEPTOR AND HER. 2/NEU WERE PREVIOUSLY PERFORMED ON CORE BIOPSY. AND WERG REPORTED AS. FOLLOWS: ESTROGEN RECEPTOR - POSITIVE, PROGESTERONE RECEPTOR - POSITIVE AND HER-2/NEU. NEGATIVE (SCORE 0). PART 3: BREAST, LEFT, NEW POSTERIOR-LATERAL MARGINS, EXCISION -. A. MICROSCOPIC FOCUS OF INVASIVE DUCTAL CARCINOMA (3E), COMING TO WITHIN 0.3 CM FROM THE. NEW INKED RESECTION MARGIN (9ce comment). B. ATYPICAL DUCTAL MYPERPLASIA. c. DUCTAL PAPILLOMA. D. RADIAL SCARS WITH DUCTAL EPITHELIAL HYPERPLASIA AND ASSOCIATED MICROCALCIFICATIONS. E. PROLIFERATIVE FIBROCYSTIC CHANGES. CHANGES AND EXTENSIVE SCLEROSING ADENOSIS WITH ASSOCIATED MULTIFOCAL. MICROCALCIFICATIONS. F. MEDIAL CALCIFICATIONS OF BLOOD VESSEL. G. NEW RESECTION MARGINS ARE FREE OF TUMOR. CASE SYNOPSIS: SYNOPTIC PRIMARY INVASIVE CARCINOMA OF BREAST. LATERALITY: Left. PROCEDURE: Segmentel. SIZE OF TUMOR: Not specified. MULTICENTRICITY/MULTIFOCALITY OF INVASIVE FOCI: Maximum dimension invasivo component: 3.5 cm. TUMOR TYPE (Invanive componant): Ductal adenocarcinoine. NOS. NOTTINGHAM SCORE: Nuclcar grade: 2. Tubule formation: 3. Mitotic activity scoie: 1. Total Nottingham score: A. ANGIOLYMPHATIC INVASION: Nollingham grede (1. 2, 3). 2. DERMAL LYMPHATIC INVASION: Not applicable. Yes, benign zones. TUMOR TYPE. IN SITU: Yes. malignent zones. Cribriform. Solld. DCIS admixod with invasivo cancinoma. SURGICAL MARGINS INVOLVED BY INVASIVE COMPONENT: Percent of tumor occupied by In situ component: 2 %. Yes, diffuse. SURG MARGINS INVOLVED BY IN SITU COMPONENT: LYMPM NODES POSITIVE: 3. LYMPH NODES EXAMINED: 28. METHOD(S) OF LYMPM NODE EXAMINATION;. H/E stuin. SENTINEL NODE METASTASIS: SIZE OF NODAL METASTASES: Diameter of targuet lymph node metastaus: 15 min. LYMPH NODE METASTASIS(-ES) WITH EXTRACAPSULAR EXTENSION: T STAGE, PATHOLOGIC: NON-NEOPLASTIC BREAST TISSUE: ADH, Redial scar, Papillonn, FCU. pT2. N STAGE, PATHOLOGIC: pN1a. M STAGE, PATHOLOGIC: pMX. ESTROGEN RECEPTORS: positive. PROGESTERONE RECEPTOR9: positive. HER2/NEU: zoro or 1+.",BRCA,1,"The report states that the size of the tumor is 3.5 x 2.5 x 1.7 cm. Using the provided rules, this falls under T2 as the tumor size is greater than 20 mm but less than or equal to 50 mm.",T2,13.0
459,TCGA-A1-A0SJ.0C0EEC9F-A715-4769-B58C-99D06C3C91F3,2,"Final Pathologic Diagnosis: A. Sentinel lymph node #1, left axilla (count=4414), biopsy: Metastatic ductal. carcinoma, 2 cm focus, in one (1/1); see comment. B. Lymph node, left axilla, dissection: Metastatic ductal carcinoma in two of fourteen. (2/14). Working Draft. C. Lymph node, left axilla level III, biopsy: No tumor in one (0/1). D. Left breast, modified radical mastectomy: 1. Invasive ductal carcinoma, SBR grade 3, 6.5 cm; see comment. 2. Ductal carcinoma in situ (DCIS), high grade, micropapillary and cribriform. patterns, with comedonecrosis, narrowly excised; see comment. 3. Invasive carcinoma present at inked anterior-superior resection margin; see. comment. 4. Microcalcifications in DCIS. 5. Non-proliferative fibrocystic change with apocrine metaplasia and microcysts. 6. Benign sclerosing papilloma. E. Left breast, anterior/superior/medial margin, excision: Invasive ductal carcinoma,. SBR grade 3, close to inked margin; see comment. F. Skin, left breast nodule, excision: 1. Invasive ductal carcinoma, SBR grade 3, present in dermis, subcutaneous tissue. and fibrous tissue; see comment. 2. Fibrous tissue, suggestive of scar, with invasive tumor; see comment. G. Skin, newest anterior/superior/medial margin, excision: No significant pathologic. abnormality, no tumor. H. Left breast, new nipple margin, biopsy: Benign lactiferous ducts, no in situ or. invasive tumor. I. Non-sentinel lymph node #1, dissection: No tumor in two (0/2). J. Non-sentinel lymph node #2, biopsy: No tumor in one (0/1). Note: The tumor present in the main mastectomy specimen (part D) encompasses a 7.5 cm maximal. area, which includes an area of tumor satellites adjacent to a 6.5 cm solid tumor mass. The tumor. consists of infiltrating trabeculae, nests and glands of cells with ample and mostly clear cytoplasm,. and large pleomorphic nuclei with nucleoli. Abundant mitotic figures are present. Ductal carcinoma in. situ is also present with cribriform, micropapillary, and comedo patterns, and shows cytology similar to. that of invasive tumor, with cells showing clear cytoplasm and pleomorphic high-grade nuclei. The. DCIS is present only as scattered foci admixed within the invasive carcinoma itself. Material from the. patient's prior biopsy (. ) shows analogous features. Invasive carcinoma are present at the inked anterior-superior margin of the main specimen (slides D2,. D3; see details in synoptic below), however, the separately submitted additional margin (part E),. shows invasive tumor that is narrowly (<0.5mm) excised (slide E8). In this specimen (part E), there. is also tumor extending to the edges of the specimen that were indicated by the surgeon as not the. new margin. The skin nodule (part F) shows invasive ductal carcinoma (0.6 cm) within the subcutaneous tissue,. dermis and immediately beneath the epidermis, where it is seen to involve an area of fibrosis that is. suggestive of a skin scar. The tumor is within 0.5 mm of the excision margin, however, the separately. submitted new skin margin (part G) shows no tumor. The extensive clear cell features and nested architecture of the tumor are morphologic features that. are often seen in renal cell carcinoma (RCC). Therefore, this possibility was considered and. immunohistochemical studies were performed and evaluated on a lymph node metastasis (block B7). and interpreted as follows: Working Draft. CD10: Negative (result does not support renal tumor). Renal cell carcinoma Ab (RCC): Positive (result supports renal tumor). Cytokeratin 7: Positive (result does not support renal tumor). E-Cadherin: Positive (result does not support renal tumor). Estrogen receptor: Negative (result does not support renal tumor). Overall, while RCC Ab is positive, all other stains are indicative of this being metastatic breast. carcinoma in a lymph node that has features mimicking RCC. Breast Tumor Synoptic Comment. - Laterality: Left. - Invasive tumor type: Invasive ductal carcinoma. - Invasive tumor size: 6.5 cm maximum diameter (calculated by the presence of tumor in 4. consecutive 1.6 cm thick slices). Invasive tumor grade (modified Bloom-Richardson): 3. Nuclear grade: 3, 3 points. Mitotic count: >30 mitotic figures/10 HPF, 3 points. Tubule/papilla formation: >10% but <75%, 2 points. Total points and overall grade = 8 points = grade 3. - Lymphatic-vascular invasion: present. - Perineural invasion: None identified. -Tumor necrosis: Present. - Resection margins for invasive tumor: In the main mastectomy specimen (part D), invasive tumor is. present at the inked anterior/superior margin, near the medial end (approximately 10 o'clock,. 10 cm from the nipple; slides D2, D3). However, the separately submitted. ""anterior/superior/medial"" margin shows tumor that is narrowly excised near one edge of the. ""new margin"" of specimen part E K< 0.5 mm; slide E8). - Deep margin: Negative; (tumor is 1 cm away, on slide D6). - Medial margin: Negative; (tumor is 0.2 cm away, on slide D1). - Lateral margin: Widely clear. - Anterior/superior margin: Positive on main specimen (slides D2, D3). - Anterior/inferior margin: Widely clear. - Nipple bed margin: Widely clear. - Ductal carcinoma in situ (DCIS) type: Comedo, cribriform, micropapillary. - Ductal carcinoma in situ size: DCIS is present as scattered foci admixed with the invasive. carcinoma. - Ductal carcinoma in situ nuclear grade: High nuclear grade. - Necrosis in DCIS: Comedonecrosis, focal (<1/3). - Microcalcifications: Present, involving DCIS only. - Resection margins for ductal carcinoma in situ: In the main mastectomy specimen (part D), DCIS is. present < 0.5mm from the anterior/superior margin, near the medial end (approximately 10. o'clock, 10 cm from the nipple; slide D2). However, the separately submitted. ""anterior/superior/medial"" margin has no definite DCIS in it. - Deep margin: Widely clear; (tumor is 1 cm away, on slide D6). - Medial margin: Negative; (tumor is 0.2 cm away, on slide D1). - Lateral margin: Widely clear. - Anterior/superior margin: Close; <0.5mm (slide D2). - Anterior/inferior margin: Widely clear. - Nipple bed margin: Widely clear. - Lobular carcinoma in situ (LCIS): Not present. - Lymph node status: Positive. - Number of positive lymph nodes: 3. - Total number sampled: 19. - Diameter of largest metastasis: 2 cm. - Extranodal extension: Not present. - AJCC/UICC stage: pT3N1aMX. Working Draft. - Nontumorous breast tissue: Cystic changes, apocrine metaplasia, papilloma. - Nipple: Not present. - Skin/dermis: Focus of invasive ductal carcinoma in dermis (see part F above). An immunohistochemical test for estrogen and progesterone receptors was performed on block A1. (lymph node). The test for estrogen receptors is positive. There is strong nuclear staining in > 70% of tumor cells. The test for progesterone receptors is positive. There is at least weak nuclear staining in > 10% of. tumor cells, with strong staining in ~5% of tumor nuclel. Result of HER2/neu test: This carcinoma is indeterminate for HER2/neu oncoprotein over-expression. An immunohistochemical assay was performed on block A1 using the CB11 monocional antibody to. HER2/neu oncoprotein. The staining intensity of this carcinoma was 2 on a scale of 0-3 (HER2 test. interpreted by Dr. Carcinomas with staining intensity scores of 0 or 1 are considered negative for over-expression of HER2/neu oncoprotein. Those with a staining intensity score of 2 are considered indeterminate. We and others have observed that many carcinomas with. staining intensity scores of 2 do not show gene amplification. All carcinomas with staining intensity scores of 2 are therefore. submitted for FISH testing. The results of the FISH test are issued directly from the molecular cytogenetics laboratory. Carcinomas with staining intensity scores of 3 are considered positive for over-expression of HER2/neu oncoproteln. Tumors in. this category show an excellent correlation between the results of immunohistochemical and FISH testing, and almost always show. gene amplification. Intraoperative Consult Diagnosis. FS1 (A) Sentinel lymnh node #1, left axilla, biopsy: Carcinoma, approximately 2 cm (1/1). (Dr. Clinical History. The patient is a. vear-old woman with left breast cancer. She undergoes mastectomy. Gross Description. The specimen is received in ten parts, each labeled with the patient's name and unit number. Parts. A-C are received fresh. Parts E-J are received in formalin. Part A, additionally labeled n. isists of a single, pink,. unorlented tissue fragment measuring 2 x 1.8 x 0.6 cm. The specimen is bisected and entirely. submitted for frozen section diagnosis 1, and subsequently submitted in cassette A1. Part B, additionally labeled "". consists of a brown-yellow,. ovoid piece of fatty tissue with a stitch indicating the apex, measuring 8.5 x 8.5 x 3.3 cm. Also in the. specimen container are two fragments of yellow-tan, soft tissue measuring 5.5 x 4.5 x 2.5 cm in. aggregate. Multiple lymph nodes are found in the specimen. Lymph nodes from the main specimen. are submitted from apex to base and all lymph nodes are submitted as follows: Cassettes B1-B6: Multiple whole lymph nodes. Cassette B7: One lymph node, bisected. Cassette B8: Multiple whole lymph nodes from smaller tissue fragment. Part C, additionally labeled. nsists of two fragments of tan-yellow,. fatty tissue measuring 3.5 x 3.5 x 2.5 cm in aggregate. No lymph nodes are identified in the. specimen. The specimen is entirely submitted in cassettes C1-C3. Part D is additionally labeled. It. consists of a mastectomy, without skin, nippie, or areoia, that has been previously inked and incised. prior to receipt in Pathology. Short suture and long suture are present, in additional to a blue nylon. suture present at the anterior-mid area. Following the provided orientation, the specimen measures. Pape 4 of 7. Working Draft. 22 cm from medial to lateral, 19 cm from superior to inferior, and 6 cm from anterior to posterior. The designated nipple/areolar bed measures 3.5 x 3.5 cm in area. The specimen has been previously. inked as follows: posterior aspect in black, anterior superior blue, and anterior inferior green. A 14. cm long previous incision is present on the posterior surface running vertically that is 5 cm deep and. reveals an irregular firm area in the superior half of the cut surface (upper inner quadrant). The. specimen is further serially sectioned, from medial to lateral, with slice 1 as medial and slice 13 as. lateral and the previous incision present between slice 5 and slice 6. An irregular, ill-defined, firm,. white-to- tan lesion is present in slices 1 through 6, encompassing a 8 cm dimension from medial to. lateral, 5 cm from superior to inferior, and 2.5 cm from anterior to posterior. The majority of this. lesion is present as a solid area in slices 3 through 6 (6.5 cm from medial to lateral). In slices 1 and. 2, the lesion is present as an area of multiple satellite nodules, of up to 0.4 cm each, directly adjacent. to the solid area. The lesion overall abuts the anterior- superior margin and is 0.5 cm from medial. margin, 1.2 cm to deep margin, 3 cm to anterior inferior, 13 cm to lateral, 2.5 cm to the nipple bed,. 3.4 cm to superior edge, and 8.5 cm to inferior edge. Two 0.5 cm, spherical cystic cavities are present. within or adjacent to the lesion, the first in the superior half of slices 4 and 5, and the second in the. mid-portion of slice 5. Up to a 0.5 cm thickness of muscle is present in focal areas of the posterior. aspect. Remainder of the specimen consists almost entirely of unremarkable yellow fat. There are. thin, delicate strands of white, fibrous tissue present throughout most of the remainder of the. specimen. Representative sections are submitted as follows: Cassette D1: Representative medial margins, perpendicular. Cassette D2: Anterior-superior margin, slice 2, in relation to nodular masses. Cassette D3: Anterior-superior margin, slice 3, in relation to mass. Cassette D4: Anterior-superior margin, slice 4, including cavity. Cassette D5: Deep margin in relation to mass, from slice 5. Cassette D6: Deep margin, slice 6, with muscle. Cassette D7: Superior edge, slice 4. Cassette D8: Inferior edge, slice 5. Cassette D9: Anterior-inferior margin, slice 5. Cassette D10: Nipple bed margin, slice 6. Cassette D11: Lateral margin, perpendicular. Cassette D12: Representative section of the mass from slice 5, with cavity. Cassette D13: Inferior edge of mass, slice 6. Cassette D14: Representative upper outer quadrant, slice 8. Cassette D15: Representative upper outer quadrant, slice 10. Cassette D16: Representative lower inner quadrant, slice 6. Cassette D17: Representative lower inner quadrant, slice 4. Cassette D18: Representative lower outer quadrant, slice 9. Cassette D19: Representative lower outer quadrant, slice 8. Part E is additionally labeled. t consists of a segment of. adipose tissue containing a singie suture. The requisition form indicates the suture marks the new. margin. The specimen is 4.5 x 4 x 2 cm with the suture present at one longitudinal end of the. specimen. There is a 1.5 cm maximal dimension area containing irregular, white-firm mass that is 2. cm from the new margin. In addition, there are 2-3 0.2 to 0.3 cm firm nodules present abutting the. new margin. The new margin is inked black. The remainder of the surfaces are inked blue and. representative sections including the entire new margin are submitted as follows: Cassettes E1-E8: Entire new margin. Cassette E9: Representative section of 1.5 cm lesion. Part F is additionally labeled. It consists of a skin ellipse that is 1.2 x 0.6 cm. in area and 0.8 cm in maximal depth, that contains an irregular 0.5-cm area of firm, white nodules. The resection margins are inked blue and the specimen is entirely submitted as follows: Cassette F1: Tips. Cassette F2: Remainder of specimen. Part G is additionally labeled. It consists of a 1.4. x 1.1 x 0.2 cm segment of tissue with apparent skin on one broau surrace. A 0.7 cm central hole is. present. The non-skin surfaces are inked blue and the specimen is entirely submitted as follows: Working Draft. Cassette G1: Tips. Cassettes G2-G3: Remainder of specimen. Part H is additionally labeled. It consists of a segment of. irregular, brown soft tissue sutured to a Telfa pad. There is a single long suture present on the. non-Telfa surface. The requisition form indicates the stitch marks new margin (margin side up) and. this new margin surface is inked black. The opposite surface (Telfa surface) is inked blue. The. specimen is bisected and entirely submitted in cassette H1. Part I, additionally labeled. consists of one soft and firm, tan-yellow piece of fatty tissue. measuring 2.5 x 2 x 0.6 cm. The specimen is trimmed and extensively searched for lymph nodes. One candidate lymph node is found; this is inked blue and bisected, and entirely submitted in cassette. I1. The remaining yellow fatty tissue is submitted in cassette I2. Part J, additionally labeled. consists of one soft and firm, tan-light brown tissue fragment. measuring 2 x 1.6 x 0.7 cm. The specimen is inked black and bisected, and entirely submitted in. cassettes J1-J2. The. immunonernvidace ctain(s) reported above were developed and their performance characteristics determined by the !. They have not been cleared or approved by the U. S. Food and Drug Administration. me FDA has determined that such ciearance or approval Is not necessary. These tests are used for clinical purposes. They should. not be regarded as Investigational or for research. This laboratory is certified under the Clinical Laboratory Improvement. Amendments of 1988 (""CLIA"") as qualified to perform high-complexity clinical testing. /Pathologist. Fee Codes: Other Specimens. Specimen Class: Accessioned: Specimen(s) Received: Final Diagnosis. Review of. A. Left breast, ""#1 with calcs,"" biopsy : 1. Ductal carcinoma in situ, high grade, solid and papillary patterns with comedo. necrosis and extension to lobules; see comment. 2. Microscopic focus (< 1mm) suspicious for invasion; see comment. 3. Microcalcifications present in association with ductal carcinoma in situ. B. Left breast, ""#2 with calcs,"" biopsy: 1. Invasive ductal carcinoma; see comment. 2. Ductal carcinoma in situ, high grade, solid and papillary patterns with comedo. necrosis and extension to lobules; see comment. 3. Microcalcifications present in association with ductal carcinoma in situ and stroma. Working Draft. A. Left breast ""nodule,"" biopsy: 1. No in situ or invasive carcinoma identified. 2. Fibroadenoma. FND OF REPORT.",BRCA,1,"The tumor size in this report is 6.5 cm, which exceeds the maximum size for T2 (5.0 cm) and falls within the range for T3 (> 5.0 cm but <= 10.0 cm).",T3,14.0
1406,TCGA-JL-A3YX.25782EF0-8786-446E-ADBA-21F489844237,1,1. LAB NO. C.P #. CLINICAL INFORMATIONICOMMENTS: FEMALE YEARS Loc. PR. PATIENT CODE 1. CONSULTANT. Histogathology Biopsy Small. Clinical Note: Carcinoma breast left side. Microscopic Features: Section examined reveal breast tissue an infiltrative neoplastic lesion composed of cells. showing moderate pleomorphism with nuclear hyperchromasia and eosinophilic cytoplasm. Few mitotic figures are seen. Almost 100% of the tumor is viable. No areas of necrosis are. seen. Conclusion: Carcinoma left breast :-. Infiltrating Lobular Carcinoma grade II. 100% of tumor is viable. No areas of necrosis are seen. Additional Report. Necrosis. : 0%. Percent of tumor nuclei 90%. Other nuclei. : 10%.,BRCA,0,"The report mentions that the tumor size is not specified, but it does mention that the tumor size is less than or equal to 20mm. This is because the report states that the tumor is an infiltrating lobular carcinoma grade II and 100% of the tumor is viable with no areas of necrosis. Based on the rules provided, a tumor size of less than or equal to 20mm corresponds to T1.",T1,15.0
840,TCGA-AR-A0TU.81A39E94-059E-4307-A75A-E8C051E9D0C3,1,"Breast, right, simple mastectomy: Infiltrating ductal carcinoma, Nottingham grade III (of III), forming a. well circumscribed mass (4.2 x 4.0 x 3.0 cm) (AJCC pT2) in the lower outer quadrant. Extensive tumor. necrosis is present. There is no associated in situ component. The nipple is uninvolved. The surgical. resection margins are negative for tumor. The closest margin (deep) is free by 0.3 cm. The surrounding. breast tissue shows non-proliferative fibrocystic changes. Lymph nodes, right axillary sentinel Nos. 1A, 1B, IC, and 2, excision: Multiple (4) right axillary sentinel. lymph nodes are negative for tumor. Blue dye is identified in lymph nodes Nos. 1A and 1B. No blue dye. is present in lymph nodes 1C or 2 [AJCC pNO(sn)]. Immunohistochemical cytokeratin stain was. performed on the paraffin embedded sentinel lymph node tissue and confirms the H&E impression. HER2/neu protein overexpression is negative, score of 1+, according to the interpretation guidelines in. the FDA-approved HercepTest. Estrogen: Negative, 0% nuclear staining. Progesterone: Negative, 0% nuclear staining. ER (Estrogen Receptor) test was developed and its performance characteristics determined by. It has not been cleared or approved by the U.S. Food. and Drug Administration.",BRCA,0,"The report states that the infiltrating ductal carcinoma forms a well-circumscribed mass in the lower outer quadrant of the right breast, with a size of 4.2 x 4.0 x 3.0 cm. According to the rules provided, this falls under the T2 category: 'T2: Tumor size > 20 mm but <= 50 mm'. The exact measurement of the tumor size is not provided, but it is clearly larger than 20 mm and the report does not mention any direct extension to the chest wall or skin.",T2,16.0
