Unnamed: 0,patient_filename,t,text,type,n,cmem_t_reasoning,cmem_t_ans_str,cmem_t_num_update
1483,TCGA-OL-A66L.B8C192A7-E530-4301-B4D3-FF528A230260,0,"FINAL PATHOLOGIC DIAGNOSIS. A. Right axillary sentinel node #1; biopsy: -One lymph node, no tumor (0/1). B. Right axillary sentinel node #2; biopsy: -One lymph node, no tumor (0/1). C. Right breast lumpectomy; lumpectomy: -Invasive ductal carcinoma with tubulo-lobular features, similar to. previous biopsy, extending into dermis, see below. -Separate focus of infiltrating ductal carcinoma (1.0 cm) with dermal. involvement, histologically similar to and superior to first mass. -Hemorrhagic fat necrosis at previous biopsy site. Breast Pathologic Parameters. 1. Invasive carcinoma: A. Microscopic measurement: 1.9 cm. B. Composite histologic (modified SBR) grade: I. - Architecture: 2. - Nuclear grade: 2. - Mitotic count: 1. 2. Intraductal carcinoma: not identified. 3. Excisional biopsy margins: Free of tumor (2 mm from ante4rior margin). 4. Blood vessel and lymphatic invasion: - Present in dermal lymphatics (C20 and C27). 5. Nipple: N/A. 6. Skin: direct extension of tumor. Inked edges free of tumor. 7. Skeletal muscle: absent. 8. Axillary lymph nodes: Negative. 9. Special studies (see . to. - ER: Strong expression in >90% of invasive tumor nuclei. - PR: Strong expression in >90% of invasive tumor nuclei. - Her2/neu antigen (FISH): Non-amplified (ratio: 1.10). 10. pTNM (AJCC, 7th edition, 2010): pT1c(m)NOMX. Effective. this Checklist utilizes the 7th edition TNM staging. system for breast of the American Joint Committee on Cancer (AJCC) and the. International Union Against Cancer (UICC). Clinical History: The patient is a -year-old female with right breast lump undergoing right. breast lumpectomy, right axillary s-node biopsy. On. bilateral. diagnostic mammography/R UTS-Right revealed a 1.7 cm area of architectural. distortion in the mid posterior depth in the right breast with no associated. calcifications. Breast MRI on. showed a right breast unifocal suspicious. abnormality at 5 s'olock that measures 19 x 19 X 14 mm. On. right UTS core. biopsy at 5 o'clock revealed IDC, with tubular-lobular features, Grade 1 with. associated microcalcifications. Specimens Received: A: Right axillary sentinel node #1. B: Right axillary sentinel node #2. C: Right breast lumpectomy; lumpectomy. Gross Description: The specimens are received in three containers each labeled with the patient's. name and medical record number. A. The first container is additionally identified as, 'right axillary s-node. -1'. Received fresh for frozen section diagnosis is one lymph node measuring 2.0. X 1.6 X 0.5 cm, which is bisected for frozen and diagnosed as, 'one lymph node,. no tumor present,"" per Dr. Specimen is entirely submitted in A1 FS. B. The second container is additionally identified as, 'right axillary s-node. -2¹. Received fresh for frozen section diagnosis is one lymph node measuring. 1.5 x 0.5 x 0.3 cm that is frozen and read as, 'one lymph node, no tumor. present,' per Dr. ,. The specimen is entirely submitted in B1 FS. C. The third container is additionally identified as, 'right breast. lumpectomy'. Received fresh is a 92.6 gm lumpectomy specimen measuring 9.6 cm. from medial to lateral, 7.7 cm from superior to inferior and 2.7 cm from. anterior to posterior. A double short suture designates superior, and a double. long suture designates lateral. No single short stitch is found although the. container label states that there is a single short stitch at the anterior. aspect; however there is a portion of skin that designates the anterior aspect. that measures 7.5 x 1.5 cm. The margins are inked as follows: anterior- - black. posterior - red. superior - blue. inferior - green. medial - yellow. lateral - violet. The specimen is serially sectioned from medial to lateral into 17 slices. There. is a 1.5 x 1.0 X 0.9 cm firm, white, stellate mass, with a central dark. gray-brown area, located in slices 8 through 10 in the anterior/central aspect. of the specimen. It is located 1.0 cm from the black margin, 2.2 cm from the red. margin, 2.0 cm from the blue margin and 2.0 cm from the green margin. A metallic. clip is identified in slice #10, adjacent to the mass. Superior to the mass and. in slices 6 through 11 is a brownish focus consistent with hemorrhage measuring. up to 1.0 X 1.0 cm, most prominent in slice 11. Representative sections are. submitted as follows: C1: Entire medial margin, serially sectioned. C2-C3: Entire lateral margin, serially sectioned. C4-C8: Slice #9 including lesion. C9-C14 Slice #10 including lesion. C15-C18: Slice #8 with some tissue removed for banking. C19-C22: Slice #7. C23-C27: Slice #11, with hemorrhagic lesion most prominent in C26. C28-C29: Slice #3, including skin in C29. C30-C33: Slice #15. Tissue fixed for at least 6 hours in 10% NBF and no more than 72 hours. , M.D. Pathologist Sign Out:",BRCA,0,"The report mentions that the 'microscopic measurement of invasive carcinoma' is 1.9 cm. According to the rules provided, this falls under the category of T1c, as the tumor size is greater than 1 cm but less than or equal to 2 cm.",T1c,23.0
1068,TCGA-BH-A1EW.56EFCA58-2328-4C5C-9618-981447E76B12,1,"Procedure Date: Procedure Physician: Attending Physician/Copies To: PATIENT HISTORY: nnDATE of LMP. DATE or LAST DELIVERY: PRE-OP DIAGNOSIS: LT BR MASS. POST-OP DIAGNOSIS: SAME. OPERATIVE PROCEDURE: LT SEGM MAST-NEEDLE LOC. CLINICAL HISTORY: MATERIAL SUBMITTED: A) LEFT BREAST BIOPSY/MASS/SEGMENTAL MASTECTOMY, PROCUREMENT BY SURGICAL PROCEDORE. 3) LEFT NEW MARGIN TISSUE, PROCUREMENT BY SURGICAL PROCEDURE. SUPERIOR. INTRAOPERATIVE CONSULTATION: CONSULT Left breast tissue: 11.0 by 5.0 by 4.5 cm breast tissue with 3.0 by 2.2 by 3.2 cm tumor. Superior. margin grossly positive. Remaining margins free. Another firm area immediately inferior to the. tumor,. 0.7. 0.5 by 0.3 cm. Left breast, new superior margin"": Segment of breast tissue, 1.0 by 8.5 by 1.3 cm. Surgical clips marks true. new superior margin. Grossly negative for tumor. ADDENDA: Addendum. MACROSCOPIC DESCRIPTION: Block ""Al"" for ER/PR and Her-2/Neu. FINAL DIAGNOSIS: My signature is attestation that I have personally reviewed the submitted material(a) and the final. diagnosis reflects that evaluation. ER/PR. IMMUNOPEROXIDASE IDENTIFICATION or ESTROGEN AND PROGESTERONE RECEPTORS IS CARRIED OUT ON SLIDE ""Al"". DISTINCT INTRANUCLEAR STAINING IS IDENTIFIED FOR ESTROGEN RECEPTOR (90%) BUT NOT FOR PROGESTERONE RECEPTOR. THEREFORE, ESTROGEN RECEPTOR IS INTERPRETED AS POSITIVE AND PROGESTERONE RECEPTOR IS INTERPRETED AS. NEGATIVE. HER-2/NEU. c-erb82 (HER-2/NBU) IMMUNOSTAINING IS CARRIED OUT ON MAGEE SURGICAL. BLOCK ""A1"" (BREAST CANCER). USING A 1:300 DILUTION OF DAKO'S POLYCLONAL ANTIRODY A485 (DIRECTED AGAINST THE INTRACEILULAR DOMAIN OF c-. erb82) WITHOUT ANTIGEN RETRIEVAL. DISTINCT COMPLETE MEMBRANTE STAINING IS IDENTIFIED ONLY RARELY IN 5-10% OF. TUMOR CELLS. THEREFORE, c-erbB2 (HER-2/NEU) IS INTERPRETED AS NEGATIVE (SCORE 1+). FINAL DIAGNOSIS: TIAGNOSIS: A) LEFT-BREAST, SEGMENTAL MASTECTOMY: - ISFILTRATINGAMODERATEL DIFFERENTIATEÓ DUCTAL AND FOCAL (APFROXIMATELY 10%) INTRADUCTAL CARCINOMA,. 3.2. CM. AND 0.7 CM. - NOTTINGHAM SCORE OF 7 (TUBULE FORMATION 2/3, NUCLEAR ATYPIA 3/3, MITOTIC INDEX 2/3). - TOCAL TUMOR ASSOCIATED MICROCALCIVICATIONS. - INFTLTRATING CARCINOMA IS PRESENT WITHIN <1 MM or THE INKED SUPERIOR AND DEEP MARGINS. B) LEFT BREAST, NEW SUPERIOR MARGIN: - BENIGN BREAST TISSUE.",BRCA,1,"The report mentions the size of the tumor as 3.0 by 2.2 by 3.2 cm which is greater than 20 mm (T2 threshold) but not greater than 50 mm (T3 threshold). Therefore, the T stage for this report is T2.",T2,24.0
552,TCGA-A2-A3XT.A614B6B7-256F-4148-8941-6145B2D9B8B5,1,"R. Specimen #: (Age: Race/: Physician (s) : AMENDED carcinoma, infiltrating ductal NOS. SPECIMEN: LEFT BREAST TISSUE. FINAL DIAGNOSIS: BREAST, LEFT, LUMPECTOMY: - POORLY DIFFERENTIATED ADENOCARCINOMA, CONSISTENT WITH INFILTRATING. DUCTAL CARCINOMA. SEE COMMENT. - NOTTINGHAM GRADE: POORLY DIFFERENTIATED, 9/9 (TUBULES=3, MITOSES=3,. NUCLEI=3) . - TUMOR SIZE 4 CM (GROSS) . - TUMOR NECROSIS: EXTENSIVE, ALL INFILTRATING COMPONENT. - LYMPHOVASCULAR INVASION PRESENT (EXTENSIVE) . - MARGINS POSITIVE (INFERIOR AND ANTERIOR, A10,A6) . - NO INTRADUCTAL COMPONENT IDENTIFIED. ESTROGEN RECEPTOR: NEGATIVE (NO NUCLEAR STAINING, 0%). PROGESTERONE RECEPTOR NEGATIVE (NO NUCLEAR STAINING, 0%). HER2 BY IMMUNOHISTOCHEMISTRY: NEGATIVE (SCORE 0). SEE COMMENT. COMMENT: There is extensive lymphovascular invasion as well as foci of high grade. tumor cells in grossly normal tissue sections away from the tumor. This. report will be amended pending stains to confirm a breast primary origin. Dr. was notified of these results at. ; on. The. clinical history was incorrect, and has been .changea. discussion with Dr. AMENDED COMMENTS: The tumor is CK7+, CK20-, and GCPFD- The pattern is consistent with a. FOR OFFICIAL USE ONLY - PERSONAL DATA - PRIVACY ACT OF. FOR OFFICIAL USE ONLY - PERSONAL DATA - PRIVACY ACT OF. specimen #: FINAL DIAGNOSIS (continued) : poorly differentiated infiltrating duct carcinoma, however, a metastatic. process cannot be entirely excluded. CLINICAL DIAGNOSIS AND HISTORY: year. old -- with enlarging complex cystic lesion in the left breast. PRE-OPERATIVE DIAGNOSIS: left breast palpable lesion. GROSS DESCRIPTION: A. Received in formalin labeled with patient's name. BLACK LATERAL, SINGLE BLUE MEDIAL, DOUBLE BLUE DEEP ON PECTORAL FASCIA,. designated ""LEFT BREAST TISSUE SINGLE SHORT BLACK SUPERIOR, SINGLE LONG. SINGLE GREEN INFERIOR STITCH"". Specimen consists of an ovoid portion of cm. fibrofatty tissue oriented as designated on label. Specimen measures 8. posterior. Specimen is inked as follows: superior blue, inferior green,. superior to inferior, 7 cm medial to lateral, 3.5 cm anterior to. medial red, lateral yellow, anterior orange, posterior black. Serial. sections reveal centrally located 4 x 3.2 x 3.2 cm fleshy pink tan well. circumscribed mass with scattered foci of hemorrhage and necrosis. Mass. abuts anterior margin and located 0.2 cm from posterior margin and 1.5 cm. from superior inferior margin. Surrounding tissue is densely fibrous with. multiple cysts. Cassette summary : A1-A2: mass. A3: adjacent normal. A4: lateral section adjacent to mass. A5: lateral portion of mass near orange margin. A6-A7: contiguous sections adjacent to A2 near orange and black margin. A8-A9: contiguos sections medial to A6-A7. A10: medial sections to A8-A9 nearing green margin. All: most medial glandular section of specimen. FOR OFFICIAL USE ONLY - PERSONAL DATA - PRIVACY ACT OF 1. FOR OFFICIAL USE ONLY - PERSONAL DATA - PRIVACY ACT o. Specimen # : GROSS DESCRIPTION (continued) : A12: inferior glandular appearing portion in same section as A8-A9. Matched sections of A1-A3 are submitted in. for. FOR OFFICIAL USR ONLY - PERSONAL DATA - PRIVACY ACT OF.",BRCA,1,"The report states that the tumor size is 4 cm (gross), which falls within the range for T3 (tumor size > 50 mm but <= 100 mm).",T3,25.0
757,TCGA-AN-A0FJ.59163BD6-41E8-4489-81F0-036484447886,1,iex: Female. Diagnosis: Breast Cancer Histological description: Infiltrative ductal carcinoma. Anatomic Site: Left Breast Tumor location: Primary. Tissue Specification: Tumor Specimen Matrix: Tissue Specimen Format: OCT. Container: block Type of Procurement: surgery Grade: 2. T Stage: 2 N Stage: 1 M Stage: 1 Treatment: none. Treatment Details: n/a. Normal Sample. Anatomic Site: Blood Sample Type: Normal Type of Procurement: blood draw. Matrix: Blood Specimen Format: frozen Container: tube.,BRCA,2,"The report does not provide specific tumor size information, but it does mention that the patient was diagnosed with Infiltrative Ductal Carcinoma and had a T Stage of 2. According to the rules provided, T2 corresponds to a tumor size greater than 20 mm but less than or equal to 50 mm. Therefore, I predict the T stage to be T2.",T2,26.0
686,TCGA-A8-A0A2.6443B16E-E6D9-4A1D-B950-BEEC7BAEDBBE,1,"Diagnosis: Well-differentiated invasive lobular carcinoma of the right breast measuring up to 3.3 cm with. circumscribed infiltration into the dorsal resection margin in the main preparation and with. tumor-free follow-up dorsal resection material (thus tumor-free dorsal margin of at least 1.2. cm). Minimum margin 0.5 cm at 3 o'clock and carcinoma-free follow-up resection material at. 3 o'clock with moderate mammary fibrosis and focal intraductal hyperplasia without atypia. Further minimum cranial and caudal margins > 1.2 cm. No invasion of lymph vessels. Fifteen. Fifteen right axillary lymph nodes free of metastases with pre-existing lymphatic hyperplasia. and pre-existing slight scarring in isolated larger lymph nodes. Tumor classification: M-8500/3, G 1, pT 2, L .0, V / 0, pN 0 (0/15), pMX, R 0. Stage II a.",BRCA,0,"The report states that the size of the tumor is up to 3.3 cm. According to the rules provided, this falls into the T2 category, as the tumor size is greater than 20 mm but less than or equal to 50 mm.",T2,27.0
687,TCGA-A8-A0A4.25F8F043-2CD0-4344-9B4A-5BBB691B5BF9,1,"Diagnosis: 1. Invasive lobular breast carcinoma in the classical differentiation. variant (G II) with extensive infiltration of the skin but no ulceration of the skin (tumor. diameter 3 cm, minimum distance from dorsal resection margin 2.5 cm). Summary tumor classification: invasive lobular breast carcinoma, G II,. pT2pN0(0/10)LOVORO, positive for estrogen and progesterone receptors, negative for. C-erb B-2 oncoprotein. Follow-up finding: three times) A metastatic infiltration and also an influx of. individual cells of the invasive lobular beast carcinoma into the excised axillary lymph. node is definitely excluded. The pNO status is thus confirmed.",BRCA,0,"The report states that the tumor diameter is 3 cm, which falls within the range for a T2 stage tumor (T2: Tumor size > 20 mm but <= 50 mm).",T2,28.0
874,TCGA-AR-A24O.887F0E3A-DC70-4CD4-AAAF-3C613195D895,2,"Final Diagnosis. Breast, left, modified radical mastectomy: Multifocal lobular carcinoma with focal ductal features, Nottingham grade I (of III). forming two separate masses, 5.3 x 2.7 x 1.4 cm and 1.2 x 1.0 x 1.0 cm in the inferior and medial breast respectively (AJCC. pT3). A biopsy cavity is identified adjacent to the tumor in the medial breast. Lymphovascular space invasion is not seen. The. remaining breast parenchyma shows adenosis and duct ectasia. The nipple shows no diagnostic abnormalities. Margins of. resection are negative for tumor (closest margin is anterior/inferior, free by at least 0.8 cm). Multiple (6 of 17) left axillary lymph. nodes are involved by metastatic lobular carcinoma (AJCC pN2). Focal extracapsular extension is also present. Her-2/NEU has been ordered on paraffin embedded tissue.",BRCA,2,"The report states that the larger tumor mass is 5.3 x 2.7 x 1.4 cm. Using the provided rules, this falls into the T3 category as the tumor size is greater than 50 mm (50 mm = 5 cm) but less than or equal to 100 mm.",T3,29.0
1032,TCGA-BH-A0HK.575F2EFD-2D8B-4140-9FCB-D8CB9EC14D09,1,"FINAL DIAGNOSIS: BREAST. RIGHT, MODIFIED RADICAL MASTECTOMY AND AXILLARY DISSECTION -. A. INFILTRATING MAMMARY CARCINOMA (A, B, C, D, E, F, G and N). THE INVASIVE TUMOR COMES TO WITHIN. LESS THAN 1.0 MM FROM THE UPPER INNER DEEP RESECTION MARGIN (E) AND IS ABOUT 1.0 MM AWAY. FROM THE JUNCTION OF UPPER INNER AND UPPER OUTER DEEP RESECTION MARGIN (D) (see comment). B. THE TUMOR SIZE IS 4.3 x 3.2 x 2.2 CM. C. NOTTINGHAM SCORE: 6/9 (TUBULES - 3, NUCLEI - 2, MITOSIS - 1). D. LYMPHOVASCULAR INVASION IS NOT APPRECIATED. E. MARGINS OF RESECTION ARE FREE OF TUMOR. F. NIPPLE, WITH TUMOR INVOLVING DEEP DERMIS (A). G. SKIN WITH SEBORRHEIC KERATOSIS, NO TUMOR IS SEEN. H. CHANGES CONSISTENT WITH THE PREVIOUS CORE BIOPSY SITE, SEE PRIOR. I. ATYPICAL DUCTAL EPITHELIAL HYPERPLASIA. J. FIBROCYSTIC CHANGES WITH DUCT ECTASIA AND DUCTAL EPITHELIAL HYPERPLASIA. K. MEDIAL CALCIFICATION OF BLOOD VESSELS. L. METASTATIC ADENOCARCINOMA INVOLVING TWO (2) (W AND AA, BB) OUT OF SEVENTEEN (17) RIGHT. AXILLARY LYMPH NODES, UP TO 6.0 CM WITH EXTRACAPSULAR EXTENSION, UP TO 4.0 CM (AA AND BB) (see. comment). M. IMMUNOHISTOCHEMICAL STAINING FOR ESTROGEN RECEPTOR, PROGESTERONE RECEPTOR, AND HER-. 2/neu WERE PREVIOUSLY PERFORMED ON. AND WERE REPORTED AS FOLLOWS: ESTROGEN. RECEPTOR - POSITIVE, PROGESTERONE RECEPTOR - NEGATIVE, AND HER-2/neu - NEGATIVE (SCORE: 0). CASE SYNOPSIS: SYNOPTIC - PRIMARY INVASIVE CARCINOMA OF BREAST. LATERALITY: Right. PROCEDURE: Modified radical mastectomy. Upper outer quadrant. Upper inner quadrant. Lower outer quadrant. Not specified. SIZE OF TUMOR: Maximum dimension invasive component: 43 mm. MULTICENTRICITY/MULTIFOCALITY OF INVASIVE FOCI: TUMOR TYPE (invasive component): Ductal adenocarcinoma, NOS, Infiltrating lobular carcinoma, Other Type(s): Predominently lobular-90% with focal 10% ductal. HISTOLOGIC TYPE: Classical, Alveolar. NOTTINGHAM SCORE: Nuclear grade: 2. Tubule formation: 3. Mitotic activity score: 1. Total Nottingham score: 6. Nottingham grade (1, 2, 3): 2. ANGIOLYMPHATIC INVASION: DERMAL LYMPHATIC INVASION: CALCIFICATION: Yes, benign zones. critcria Diagnosils. SURGICAL MARGINS INVOLVED BY INVASIVE COMPONENT: Primary HiPAA Malignancy. Prior Primary. PAGET'S DISEASE OF NIPPLE: LYMPH NODES POSITIVE: 2. case Reviewer is (circle): Initials Date previewed. LYMPH NODES EXAMINED: 17. METHOD(S) OF LYMPH NODE EXAMINATION: H/E stain. SIZE OF NODAL METASTASES: Diameter of largest lymph node metastasis: 60.0 mm. LYMPH NODE METASTASIS(-ES) WITH EXTRACAPSULAR EXTENSION: Yes, Maximum size is:40.0mm. NON-NEOPLASTIC BREAST TISSUE: ADH, FCD. T STAGE, PATHOLOGIC: pT2. N STAGE, PATHOLOGIC: pN1. M STAGE: Not applicable. ESTROGEN RECEPTORS: positive. PROGESTERONE RECEPTORS: negative. HER2/NEU: 0.",BRCA,1,"The maximum dimension of the invasive component of the tumor is 43 mm, which falls within the range for T2 (> 20 mm but <= 50 mm).",T2,30.0
1147,TCGA-D8-A1XL.762963FB-3D8C-4616-8C8C-0CD3E45FD243,1,"page 1 / 2. conv No. Examination: Histopathological examination. Cost of diagnostic procedure. Gender: F. Material: 1. lesion excision - from the left breast outer upper quadrant. Unit in charge: Central C. Expected time of examination: 5 working days. Clinical diagnosis: and left axillary nodes in one block. Results of immunohistochemicarexaminanon: Estrogen receptors found in over 75% of neoplastic cell nuclei. Progesterone receptors found in over 75% of neoplastic cell. nuclei. HER2 protein stained with HercepTest™M by DAKO. Score = 2+, FISH verification recommended. Macroscopic description: Partial resection of breast - outer upper quadrant. Breast segment sized 8.4 x 7.4 x 2.6 cm with a 2.8 x 6.8 cm skin flap and axillary tissue sized 8 x 9 x 2, no RTG. Tumour cross section sized 3.0 x 1.8 x 2.9 cm. Margin: to the base 0.1 cm, to the front skin surface 0.2 cm, to the sternum 3.5 cm, to the axilla 2.2 cm, to the shoulder 1.3 cm,. lower 0.8 cm. Microscopic description: Carcinoma ductale invasivum NHG3 (3 + 2 + 3/19 mitoses/10 HPF - visual area of 0.55 mm). Largest dimension of the lesion 3.0 cm. Minimum margin at the base side < 0.05 cm. The other margins as in macroscopic description. Lymph nodes: Metastases carcinomatosae in lymphonodis (No II / XIII). Infiltratio carcinomatosa capsulae lymphonodorum et telae adiposae perinodalis. Histopathological diagnosis: Carcinoma ductale invasivum NHG3, pT2, pN1a. Invasive ductal carcinoma of the left breast. Compliance validated t. Examination: Intraoperative examination. page 2 / 2. Fyamination No.: Results of immunohistochemical. examination: RESULT OF HER2/neu GENE AMPLIFICATION with the FISH method by Path Vysion HER2 DNA Probe Kit. HER-2 GENE AMPLIFICATION NOT FOUND.",BRCA,1,"The report mentions that the 'largest dimension of the lesion is 3.0 cm'. According to the provided rules, a tumor size between 20 mm (2 cm) and 50 mm (5 cm) corresponds to a T2 stage.",T2,31.0
577,TCGA-A7-A13E.2180850C-CC8D-4376-B2EE-1ADC3F5B3EC1,1,"PECIMEN. A. Left sentinel node. B. Left breast tissue. C. Axillary contents. CLINICAL NOTES. PRE-OP DIAGNOSIS: Left breast cancer. CLINICAL HISTORY: Left breast cancer. FROZEN SECTION DIAGNOSIS. FSA) Left sentinel node - Two of three lymph nodes positive for. metastatic carcinoma (2/3). GROSS DESCRIPTION. A. Submitted fresh for frozen section as ""left sentinel. node"" are two portions of fatty tissue, the larger of the. two is 2 cm. in size, the smaller 1.2 cm. in size. The section. through the tissue reveals three small nodules which may be lymph. nodes varying in size from 6 mm. to a centimeter. All three. submitted for frozen section. B. Received fresh, subsequently fixed in formalin labeled. ""left breast tissue"" is a 7.8 x 7.5 X 4.0 cm. yellow. lobular fatty tissue fragment which is partially covered with a 4.0. X 1.2 cm. pink-tan wrinkled skin ellipse. The specimen has a long. suture designating lateral and a short suture designating superior. The specimen is inked as follows: Superior orange, anterior blue,. posterior black, inferior green and the specimen is sectioned from. medial to lateral to show a yellow lobular fatty cut surface with. minimal fibrous tissue. There is also a white tan firm nodule. which. is centrally located, measuring 3.5 x 2.5 x 2.5 cm. This comes. within 2 cm. of superior-inferior margin and comes within 1.5 cm. of. the anterior and posterior margin. This was located equal distance. between the medial and lateral margins. Representative sections of. the specimen are submitted as follows: Block 1 - representative. GROSS DESCRIPTION. medial margin; block 2 - representative lateral margin; block 3-10. representative sections additional margins and skin. RS-10. C. Received fresh, subsequently fixed in formalin labeled. ""axillary content"" is a 7 X 6 X 1.5 cm. aggregate of. yellow. lobular fatty tissue fragments which are palpated to identify. possible lymph nodes. Multiple lymph nodes are grossly identified. which range from 0. cm. to 2.0 cm. in greatest dimension. The. lymph nodes are entirely submitted as follows: block 1 - two. possible lymph nodes; block 2 - three possible lymph nodes; block 3. - two possible lymph nodes; block 4 - one possible lymph node. bisected. RS4. MICROSCOPIC DESCRIPTION. A. Sections of the left sentinel lymph nodes demonstrate. metastatic carcinoma involving 2 of 3 lymph nodes. The. largest metastasis is 1.2 cm and extracapsular extension is. present. B. The following template applies to the left breast. Invasive Carcinoma: Present. Histologic type: Infiltrating ductal carcinoma. Histologic grade: Overall grade: 3. Architectural score : 3. Nuclear score: 3. Mitotic score: 3. Greatest dimension: 3.5 cm (pT2). Specimen margins : Negative, nearest 1.3 cm, posteriorly. Vessel invasion: Present. MICROSCOPIC DESCRIPTION. Calcification : Present. Ductal carcinoma in situ: Present. Histologic pattern: Solid and comedo. Nuclear grade: 3. Central necrosis: Present. %DCIS of total tumor: Less than 10%. Extensive intraductal component (present/absent) : Absent. Specimen margins: Negative. Calcification: Present. Description of non-tumorous breast: Proliferative changes. Comments: None. Prognostic markers: Previously performed. C. There is no evidence of metastatic disease present in. 9. additional left axillary lymph nodes. 14, 4x3. DIAGNOSIS. A. Left axillary sentinel lymph nodes, excision: Metastatic carcinoma present in 2 of 3 lymph nodes (2/3) . Size of largest metastasis 1.2 cm. Extracapsular extension present. B. Left breast, excisional biopsy: Infiltrating ductal carcinoma, grade 3, 3.5 cm, margins. negative. Ductal carcinoma in situ, grade 2, margins negative. C. Left axillary contents, resection: No evidence of metastasis in nine lymph nodes (0/9). DIAGNOSIS. M. .D, (Electronic Signature). End Of Report ---.",BRCA,1,"The report indicates that the largest tumor size is 3.5 cm, which falls within the range for T2 (Tumor size > 20 mm but <= 50 mm).",T2,32.0
672,TCGA-A8-A09E.C55B6F4B-1248-4FBF-83C2-B0A1B33DEA03,3,"Diagnosis. 1. Left-sided ablated breast tissue with a poorly differentiated invasive ductal breast. carcinoma measuring a good 55 mm with invasion of the lymph vessels and focally also of. the blood vessels, infiltration of the overlying epidermis with very slight paracentral erosion. and extension to the basal resection margin with infiltration of the resection margin. The. nipple is tumor-free, including the lactiferous sinus and the other glandular tissue with a. fibrocystic mammopathy. Assessment: According to these findings, complete removal of the carcinoma as far as the basal epidermis. is not definite. Tumor classification: M-8500/3, G3, pT4b, pLI, pV1, pNla (1/11), pMx, stage III B. R1.",BRCA,1,"The report states that the tumor measures 55 mm and has extended to the chest wall (pT4b), which falls under the T4 category of the TNM staging system.",T4,33.0
685,TCGA-A8-A0A1.3BC6CE69-2641-4B6D-85DF-E8FE838015D0,1,"Diagnosis: Invasive lobular breast carcinoma (maximum diameter 2.5 cm, malignancy grade II), with. excision extending into the healthy tissue. Tumor classification (also taking into account xxxxxxxx): pT2 (maximum diameter 2.5 cm),. pNO sn (0/1), MX, R0, G2 (L0, V0).",BRCA,0,"The report specifies that the maximum diameter of the tumor is 2.5 cm. According to the rules provided, this falls within the range for a T2 stage tumor (T2: Tumor size > 20 mm but <= 50 mm).",T2,34.0
