Unnamed: 0,patient_filename,t,text,type,n,cmem_t_reasoning,cmem_t_ans_str,cmem_t_num_update
1382,TCGA-GM-A2DF.CA6B733A-6030-422C-9DE9-B9718CBB2FDC,0,"ACC # 26. A) ADDITIONAL MARGIN OF MOST MEDIAL TUMOR, EXCISION: Benign breast tissue, no tumor present. (B). LEFT BREAST, SEGMENTAL MASTECTOMY: MULTIFOCAL INVASIVE DUCTAL CARCINOMA WITH ASSOCIATED LYMPHOCYTIC. INFILTRATE, HIGH NUCLEAR GRADE, NOTTINGHAM HISTOLOGIC GRADE. 3. (SEE COMMENT). LARGEST FOCUS OF INVASIVE CARCINOMA MEASURES 1.2 CM IN GREATEST. DIMENSION IN THE MEDIAL ASPECT OF THE SPECIMEN. MULTIPLE SATELLITE FOCI OF INVASIVE CARCINOMA ARE LATERAL TO THE. MAIN FOCUS AND MEASURE 5 MM (X 2), 4 MM, 3 MM AND 1 MM. LYMPHOVASCULAR INVASION IDENTIFIED. DUCTAL CARCINOMA IN SITU (DCIS), HIGH GRADE, PREDOMINANTLY. CRIBRIFORM AND CLINGING TYPES WITH CANCERIZATION OF LOBULES. AND ASSOCIATED LYMPHOCYTIC INFILTRATE. DCIS EXTENDS IN AN APPARENT IRREGULAR DISTRIBUTION OVER A 4 CM AREA. DCIS EXTENDS TO LESS THAN 1 MM FROM THE ANTERIOR MARGIN, TO 1 MM. FROM THE INFERIOR MARGIN, AND TO 2 MM FROM THE SUPERIOR AND. POSTERIOR MARGINS. INVASIVE CARCINOMA EXTENDS TO 2 MM FROM THE ANTERIOR MARGIN. (SEE. COMMENT). (C) ADDITIONAL CENTRAL ANTERIOR INFERIOR MARGIN, EXCISION: Benign breast tissue, no tumor present. (D) LEFT AXILLARY CONTENTS, DISSECTION: METASTATIC CARCINOMA IN ONE OF THIRTY LYMPH NODES (1/30); METASTASIS. MEASURES 7 MM; NO EXTRANODAL EXTENSION IDENTIFIED. (E) ADDITIONAL LEVEL I LEFT AXILLARY TISSUE, EXCISION: Two lymph nodes, no tumor present (0/2). Entire report and diagnosis completed by. COMMENT. Additional tissue was re-excised, and invasive carcinoma does not approach the final margins. However, I. with involvement of lobules is 1 mm from the final inferior margin and 2 mm from. the final superior and posterior margins. Tumor marker studies will be performed and reported in an addendum. GROSS DESCRIPTION. (A) ADDITIONAL MARGIN OF MOST MEDIAL TUMOR - Received is a piece of fibroadipose. tissue (1.8 x 1.2 x 0.5 cm) with clips on the true margin. The true margin inked black. The. specimen is serially sectioned and entirely submitted in A. (B) LEFT SEGMENTAL MASTECTOMY - A segmental mastectomy specimen (8.0 x 6.5 X 5.5. cm) with a short stitch at the superior aspect, long stitch at the lateral aspect, and multiple clips. on the anterior aspect. The specimen is serially sliced from medial to lateral into 11 slices. A. well-circumscribed tan-pink tumor 1.4 x 1.1 x 1.0 cm, with an associated biopsy clip is identified in. slice #3, which is 0.7 cm from the closest anterior margin. Multiple smaller nodules are identified. lateral to the main tumor. One of these is very close to the anterior margin in the central anterior. inferior aspect of the specimen, and additional tissue is requested from this margin. INK CODE: Anterior - yellow, posterior - black, superior - blue, inferior - green, medial. and lateral - red. SECTION CODE: B1, medial perpendicular margin; B2, tissue adjacent to tumor from. slice #2 ; B3-B7, tumor and margins from slice #3 (B3 and B4, tumor with anterior margin in area. of clip; B5, inferior margin; B6, posterior margin; B7, superior margin); B8, fibrous tissue adjacent. to the tumor from slice #4; B9, one small nodule, 1.2 cm from superior margin and 1.8 from. anterior margin of slice #4; B10, one small nodule 1.0 cm from anterior margin and 1.2 cm from. superior margin of slice #5; B11, one small nodule, 1.5 cm from anterior margin, 2.0 cm from. superior margin of slice #5; B12, B13, one small nodule, 0.1 cm from anterior margin and 1.2 cm. from inferior margin of slices #6 and #7; B14, one small nodule 0.4 cm from posterior margin and. 1.5 cm from inferior margin of slice #4; B15-818, remainder of margins of slice #4, entirely. submitted (B15, anterior margin; B16, superior margin; B17, posterior margin; B18, inferior. margin); B19, representative section from slice #8; B20, lateral perpendicular margin. (C) ADDITIONAL CENTRAL ANTERIOR INFERIOR MARGIN, LEFT BREAST - A portion of. fibroadipose tissue (2.0 x 1.3 x 0.5 cm) with clips on the true margin. The true margin is inked. black. The specimen is serially sectioned and entirely submitted in C1-C2. (D) LEFT AXILLARY CONTENTS - Adipose tissue (11.0 x 7.5 x 3.0 cm). Multiple lymph nodes. are identified ranging from 0.2 x 0.2 x 0.2 cm to 2.5 x 1.5 x 0.8 cm. SECTION CODE: D1-D3, each containing six lymph nodes; D4, four lymph nodes; D5,. four. lymph nodes; D6, one lymph node, trisected; D7, one lymph node, serially sectioned: n8. one lymph node, serially sectioned; D9 and D10, one lymph node, serially sectioned. (E) ADDITIONAL LEVEL I LEFT AXILLARY TISSUE - Two lymph nodes (0.2 x 0.2 x 0.2 cm and. 0.8 x 0.4 x 0.4 cm), entirely submitted. SECTION CODE: E1, one lymph node; E2, one lymph node, trisected. CLINICAL HISTORY. Left breast cancer. SNOMED CODES. T-04050, M-85003, M-85002 T-C4710, M-85006. ""Some tests reported here may have been developed and performance characteristics. determined by. These tests have not been. specifically cleared or approved by the U.S. Food and Drug Administration."". Released by: Start of ADDENDUM #1. ADDENDUM. Addendum completed by. This report is issued to give immunohistochemistry results. Immunohistochemical staining is performed on a representative formalin-fixed, paraffin-. embedded section of INVASIVE DUCTAL CARCINOMA, left breast, block B3. MARKER. % POSITIVE. SCORE. Estrogen Receptor. Negative. 0 %. Progesterone Receptor. Negative. < 1 %. N/A. HER-2/neu. overexpression. Negative. Focal 1+. Due to the above HER-2/neu immunohistochemical staining result, gene. copy level (HER-2/neu: CEP17 signal ratio) will be evaluated by FISH. and a separate report will be issued. FOOTNOTE. Estrogen receptor was assessed by immunohistochemistry using antibody 6F11 (. Progesterone receptor was assessed by immunohistochemistry using antibody PgR1294(. HER-2/neu was assessed by immunohistochemistry using antibody AB8 (I. Released by: Start of ADDENDUM #2. ADDENDUM #2. This modified report is being issued to report the results of HER-2/neu FISH. Addendum completed by. SPECIMEN SOURCE. Left breast. SUMMARY. Tissue section of the invasive carcinoma. B3 was evaluated for HER-2/neu gene. amplification by interphase fluorescence in situ hybridization technique using the -. HER-2/neu DNA Probe Kit (LSI HER-2/neu. /CEP17. Slide adequacy is satisfactory. Sixty tumor nuclei were counted and showed an average of 1.57. copies of LSI HER-2/neu gene per nucleus and an average of 1.40 copies of CEP17 per nucleus. Negative and positive controls (established by. 1 with this batch are. appropriate. Two representative images have been archived. INTERPRETATION. The tumor cells demonstrated no amplification of the HER-2/neu gene copy levels (HER-2/neu: CEP17 signal ratio: 1.12). The following guideline has been established for HER-2/neu testing: Normal HER-2/neu levels: < 1.80; equivocal HER-2/neu levels: 1.80 - 2.20; amplified HER-2/neu. levels: > 2.20. (Ref: Arch Patholo Lab Med. 2007; 131:18-43). NOTES. The LSI HER-2/neu probe is specific for the HER-2/neu gene Locus (17q 11.2-q12) and the CEP. 17 DNA probe is specific for the alpha satellite DNA sequence at the centromeric region of. Chromosome 17 (17 p11.1-q11.2). This test has been cleared and approved for specific uses by the U.S. Food and Drug. Administration. Its system is operating within the performance specifications stated in the product. insert. Released by:",BRCA,1,"The largest focus of invasive carcinoma measures 1.2 cm in greatest dimension, which falls under T1 tumors that are 2.0 cm or less in size.",T1,3.0
632,TCGA-A8-A07R.FD75D315-EED7-4350-A890-8FB94648E9FC,1,"Diagnosis: 1. Left breast segment at 2 o'clock with a poorly differentiated invasive ductal carcinoma,. max. 4.6 cm in size, with concomitant high-grade DCIS III with comedo necroses. Tumor classification based on the preliminary findings: pT2 (4.6 cm), pN3a (15/22), MX, R1. (peripheral invasive carcinoma), G3, (L1, V1).",BRCA,3,"The T stage is determined by the size of the primary tumor. The report states that the size of the largest focus of invasive carcinoma is 4.6 cm, which falls in the T2 category of being more than 2.0 cm but not more than 5.0 cm in size.",T2,3.0
1420,TCGA-LD-A9QF.E8601979-AE05-4E4D-BB39-6B9C5E67D050,0,"DATE OBTAINED: DATE RECEIVED: SUBMITTING MD: DIAGNOSIS. 1. LEFT AXILLARY ""SENTINEL"" LYMPH NODES: NEGATIVE (0/3); NEGATIVE CUTDOWNS SECTIONS. 2. LEFT AXILLARY ""PALPABLE"" LYMPH NODES: NEGATIVE (0/4); NEGATIVE CUTDOWNS SECTIONS. 3. LEFT AXILLARY ""SENTINEL"" LYMPH NODE: NEGATIVE (0/1); NEGATIVE CUTDOWNS SECTIONS. 4. LEFT AXILLARY ""SENTINEL"" LYMPH NODES #3: NEGATIVE (0/6); NEGATIVE CUTDOWNS SECTIONS. 5. LEFT TOTAL MASTECTOMY: INVASIVE AND INTRADUCTAL MAMMARY DUCT CARCINOMA. SIZE (INVASIVE): 1.6 cm (additional incidental < 1mm microinvasion). SIZE (DCIS COMPONENT): -11 cm scattered foci (subareolar region to 11 cm from nipple @ 12-1 o'clock). LATERALITY: Left. TUMOR FOCALITY: Unifocal gross reference mass; incidental microinvasive lesion. LESIONAL SITE: Subareolar (both reference mass and incidental microinvasion). HISTOLOGIC TYPE: Invasive ductal carcinoma, apocrine type. NUCLEAR GRADE: III of III. HISTOLOGIC GRADE:(EEmSBR). III of III (Tubules score 3 + NG score 3 + mitoses score 3). IN-SITU COMPONENT: DCIS (variable histology). comedo NG3 subareolar. cribriform non-apocrine with comedonecrosis NG2-3 UOQ. cribriform apocrine without comedonecrosis NG2 UOQ. LYMPH NODE SAMPLING: Negative (0/14); see specimen #1 - #4. AJCC CATEGORIES: Stage I (assuming ""cM0"" status). pTNM: pT1c. pNO. cTNM: cT1. cNO. cMO. INTEGRITY/ORIENTATION: Intact specimen with designated margins. MARGINS (invasive and DCIS): Negative; 3 cm to nearest margins (anterior & posterior locations). LYMPHOVASCULAR INVASION: Focal. MICROCALCIFICATIONS: Present (associated with comedo-DCIS). NIPPLE/SKIN: (if applicable). Negative nipple; numerous pigmented seborrheic keratoses & simple lentigines. SKELETAL MUSCLE. Not present. OTHER: Two core biopsy sites (1 o'clock subareolar; 12-1 o'clock UOQ); focal microcysts,. mammary duct stasis/ectasia and focal usual duct hyperplasia. COMMENT. 1-88329,88307 2-88333,88307 3-88333,88307 4-88307 5-88309. Clinical Diagnosis and History: ear old female with left invasive CA/DCIS ? extensive DCIS 12-1:00. cT1,cNo,cMo clinical stage I. Tissue(s) Submitted: 1: LEFT AXILLARY SENTINEL LYMPH NODES #1. 2: LEFT AXILLARY PALPABLE LYMPH NODES. 3: LEFT AXILLARY SENTINEL LYMPH NODE #2. 4: LEFT AXILLARY SENTINEL LYMPH NODE #3. 5: LEFT TOTAL MASTECTOMY SUTURE IN AXILLARY TAIL. Gross Description: Specimen #1 is received fresh for intraoperative consultation labeled left axillary sentinel lymph nodes, and consists of three lymph. nodes with attached fat, ranging from 0.2 cm to 2.4 cm in greatest dimension. The lymph nodes are submitted in their entirety for. permanent microscopy as follows: 1A: two lymph nodes. 1B: one lymph node serially sectioned. Specimen #2 is received fresh for intraoperative consultation labeled left axillary palpable lymph nodes, and consists of four lymph. nodes,. ranging from 0.8 cm to 1.5 cm in greatest dimension. The lymph nodes are serially sectioned to reveal predominantly pink-. tan. cut surfaces, one of which displays a white focus. A smear preparation from the lymph node with the white focus is performed. The lymph nodes are submitted in their entirety for permanent microscopy as follows: 2A-D: one lymph node per cassette. Specimen#3 is received fresh for intraoperative consultation labeled left axillary lymph node, sentinel #2, and consists of one, 0.9. cm lymph node, which is serially sectioned and submitted in its entirety labeled 3A. Specimen #4 is received in formalin labeled left axillary sentinel lymph node #3, and consists of six lymph nodes ranging from 0.2. cm to 0.7 cm in greatest dimension. The largest lymph node is bisected and the lymph nodes are submitted in their entirety as. follows: 4A: five lymph nodes. 4B: one lymph node, bisected. Specimen #5 is received fresh labeled left total mastectomy, suture in axillary tail, and consists of an 858 gm, 25 x 23 x 5 cm left. total mastectomy specimen, with a suture marking the axillary tail. There is a 24 x 17 cm, ovoid to elliptical portion of brown skin. on the anterior aspect, displaying a 2 X 2 X 1 cm everted nipple. The skin displays multiple brown-black, flat to raised,. predominantly keratotic skin lesions, ranging from 0.1 cm to 1.0 cm and 0.6 to 0.2 cm. The largest lesion is located at 12 o'clock,. 1.7 cm from the nearest 12 o'clock margins. One of the smaller lesions appears to be transected at the 5 d'clock margin. The. specimen is inked as follows: superoanterior - blue, inferoanterior - green, posterior - black. The posterior margin is intact. The. specimen is serially sectioned to reveal a 1.6 x 1.2 x 1.2 cm tan-white, ovoid, lobulated, indurated mass located retroareolar, 6 cm. from the deep margin and 3 cm from the overlying skin. Sectioning of the mass reveals a clip. Anterior to the mass is some dense. fibrosis, displaying possible comedonecrosis. Sectioning of the remaining fibrous tissue reveals a 1.2 x 1.0 x 0.6 cm rubbery,. but. stellate area of fibrosis at 1-2 o'clock, 11 cm from the nipple. Sectioning of this area reveals a clip. The clip is located 3 cm from. the. deep margin, and 6.5 cm from the overlying skin. No definitive gross tumor is associated with this clip. The remaining breast. parenchyma consists of approximately 90% yellow, lobulated adipose tissue, and 10% scattered white, rubbery fibrous tissue. A. small portion of tumor and normal are submitted for TCGA studies. Representative sections are submitted as follows: 5A: nipple. 5B-5D: mass with clip, no margin. 5E-5G: representative fibrous tissue anterior to mass, no margin. 5H: representative deep margin to mass. 5I-5K: stellate area of fibrosis with clip. 5L: posterior margin and anterior skin to stellate area of fibrosis with clip. 5M-50: representative fibrous tissue at 12-1 o'clock. 5P: representative upper inner quadrant. 5Q: representative lower inner quadrant. 5R: representative lower outer quadrant. 5S: representative upper outer quadrant. 5T: representative margin in second largest skin lesion. 5U: representative medium five skin lesions. 5V: representative smaller skin lesions. Time in formalin: 1 p.m, submitted same day. Intraoperative Consult Diagnosis. 1A. THREE NEGATIVE LYMPH NODES (BY GROSS). 2A. FOUR LYMPH NODES IDENTIFIED; THREE NEGATIVE (BY GROSS); ONE NEGATIVE (BY GROSS AND. SMEAR). 3A. ONE NEGATIVE LYMPH NODE (BY GROSS AND SMEAR).",BRCA,0,"The T stage is based on the size of the largest focus of invasive carcinoma. In this report, the size of the largest focus of invasive carcinoma is 1.6 cm, which falls under the T1 category. More specifically, it is T1c as the size is more than 1 cm but not more than 2 cm.",T1c,4.0
691,TCGA-A8-A0AB.E4D30B42-383A-40BF-BB91-511A90227655,1,"Diagnosis: Skin and fatty tissue with small foci of resorptive inflammatory reactions and also incipient. scarring. But no evidence of carcinoma. A regional R0 status is therefore likely to have been attained. Diagnosis: Invasive lobular breast carcinoma (maximum tumor diameter 2.7 cm, malignancy grade 2). with an invasive satellite node and multicentric, in parts confluent LIN formations (grade I). Remaining glandular body fibrolipomatous and with cystic duct ectasia, also small focal areas. of adenosis. Submitted tissue samples of cutaneous/subcutaneous tissue histologically. unremarkable. Tumor-free resection margins. Minimum width of dorsal safety margin 0.6 cm. Tumor classification: pT2m (maximum diameter 2.7 cm), pNO sn (0/2) (compare xxxxx),. MX, R0, G2 (L0, V0).",BRCA,0,"The report indicates that the maximum tumor diameter is 2.7 cm, which falls within the range for T2 tumors (more than 2.0 cm but not more than 5.0 cm).",T2,5.0
1011,TCGA-BH-A0E1.891F4C63-8207-4CB8-AB59-A970CC6F1A1A,1,"P.24/33. FINAL DIAGNOSIS. PART 1: LEFT AXILLARY SENTINER. CARCINOMA, EACH DEPOSIT. A. TWO LYMPH. (274). MEASURING LESSTHAD. B. NO EXTRACAPSULARIEXTENSIS. PART 2: LEFT AXILLARY SENTINEL: #2, BIOPSY. TWO LYMPH NODES, NEGATIVE FOR NEOPLASM (0/2)-. PART 3: LEFT BREAST.TOTAL MASTECTOMY. A. INFILTRATING DUCTAL CARCINOMA, NOTTINGHAM GRADE 2 (NUCLEAR GRADE 2, TUBULE SCORE 3. MITOTIC ACTIVITY SCORE 2; TOTAL SCORE 7/9). B. TUMOR MEASURES 4.5 CM IN GREATEST DIMENSION. C. LYMPHOVASCULAR SPACE INVASION IS PRESENT. D. TUMOR IS PRESENT IN THE LOWER INNER QUADRANT. E. MARGINS ARE NEGATIVE FOR NEOPLASM; TUMOR APPROACHES MOST CLOSELY TO THE ANTERIOR. MARGIN (1.5 MM). F. FIBROCYSTIC CHANGES. G. NIPPLE SKIN IS NEGATIVE FOR NEOPLASM. H. PATHOLOGIC STAGE: pT2 pN1mi pMX. CASE SYNOPSIS: SYNOPTIC . PRIMARY INVASIVE CARCINOMA OF BREAST. LATERALITY: Left. PROCEDURE: Simple mastectomy. Lower inner quadrant. SIZE OF TUMOR: Maximum dimension invasive component: 4.5 cm. MULTICENTRICITY/MULTIFOCALITY OF INVASIVE FOCI: TUMOR TYPE (invasive component): Ductal adenocarcinoma, NOS. NOTTINGHAM SCORE: Nuclear grade: 2. Tubule formation: 3. Mitotic activity score: 2. Total Nottingham score: 7. Nottingham grade (1, 2, 3): 2. ANGIOLYMPHATIC INVASION: DERMAL LYMPHATIC INVASION: CALCIFICATION: SURGICAL MARGINS INVOLVED BY INVASIVE COMPONENT: Distance of invasive tumor to closest margin: 1.5 mm. LYMPH NODES POSITIVE: 2. LYMPH NODES EXAMINED: 6. METHOD(S) OF LYMPH NODE EXAMINATION: H/F. stain. SENTINEL NODE METASTASIS: ONLY KERATIN POSITIVE CELLS ARE PRESENT: SIZE OF NODAL METASTASES: Diameter of largest lymph node metastasis: 1 mm. LYMPH NODE METASTASIS(-ES) WITH EXTRACAPSULAR EXTENSION: T STAGE, PATHOLOGIC: N STAGE, PATHOLOGIC: pN1mi. M STAGE, PATHOLOGIC: pMX. ESTROGEN RECEPTORS: positive. PROGESTERONE RECEPTORS: positive. HER2/NEU: 2+.",BRCA,1,"The T stage is determined by the size of the primary tumor. The report states that the size of the tumor is 4.5 cm in greatest dimension (part 3, section B). According to the rules provided, T2 tumors are more than 2.0 cm but not more than 5.0 cm in size. Therefore, the T stage for this patient is T2.",T2,6.0
1150,TCGA-D8-A1XQ.33B6269D-1D59-4184-A786-2BEB73F6D3A8,1,"page 1 / 1. copy No. Examination: Histopathological examination. Cost of diagnostic procedure. Gender: F. Material: Multiple organ resection - right breast with axillary tissues. Expected time of examination: up to 8 working days. Clinical diagnosis: Cancer of the right breast. Specimen from a modified radical mastectomy using. technique. Macroscopic description: Right breast sized 20 x 16 x 5 cm removed along with axillary tissues sized 9 x 11 x 3 cm and a skin flap of 20 x 8 cm. Weight 880. g. Tumour sized 2.2 x 2.0 x 1.5 cm on the border of the outer quadrants, located 3.0 cm from the lower boundary, 1.2 cm from the. base and 1.6 cm from the skin. Lymph nodes of 1.0 cm in length. Microscopic description: Carcinoma ductale invasivum, basal-like NHG3 (3 + 3 +2/15 mitoses/10 HPF - visual area 0.55 mm). Reactio lymphocytaria peritumoralis. Mamilla sine laesionibus. Axillary lymph nodes: Lymphonodulitis reactiva No VII. Histopathological diagnosis: Invasive ductal carcinoma of the right breas)(NHG3, pT2, pNO). Results of immunohistochemical examination: No estrogen receptors found in neoplastic cell nuclei. Progesterone receptors found in less than 10% of neoplastic cell nuclei. HER2 protein stained with HercepTestM by DAKO. Negative reaction in invasive cancerous cells ( Score = 1+). Tests performed. twice. Compliance vali.",BRCA,0,"The report states that the tumor size is 2.2 x 2.0 x 1.5 cm, which is more than 2.0 cm but not more than 5.0 cm. This falls under the T2 category according to the rules provided.",T2,7.0
514,TCGA-A2-A0SY.8E6902A6-A673-46CC-9AEB-3A71EF11099F,2,"Lab No.: Sex: F. Date Collected: Date Received: Doctor: M.R. No.: Room No: Account No: CLINICAL HISTORY: PREOPERATIVE DIAGNOSIS: LEFT BREAST CA. POSTOPERATIVE DIAGNOSIS: LEFT BREAST CA. OPERATION: LEFT SIMPLE MASTECTOMY, SENTINEL LYMPH. NODE BIOPSY, F.S. SPECIMENS: A. LEFT SENTINEL LYMPH NODE #1, F.S. B. LEFT SENTINEL LYMPH NODE #2, F.S. C. SENTINEL LYMPH NODE #3, F.S. D. LEFT BREAST SIMPLE MASTECTOMY. FROZEN SECTION DIAGNOSIS: A. LEFT SENTINEL LYMPH NODE #1 -. NUMEROUS HISTIOCYTES WITH ATYPICAL CELLS. DEFER FOR PERMANENT SECTION. B. LEFT SENTINEL LYMPH NODE #2 -. ONE NEGATIVE LYMPH NODE (0/1). C. SENTINEL LYMPH NODE #3 -. ONE NEGATIVE LYMPH NODE (0/1). FINAL DIAGNOSIS: A. LEFT SENTINEL LYMPH NODE #1 -. POSITIVE FOR METASTATIC CARCINOMA (1/1); THE TUMOR. INVOLVES THREE-FOURTHS OF THE NODE WHICH MEASURES .6. CM. IN DIAMETER, NO PERICAPSULAR SOFT TISSUE EXTENSION. B. LEFT SENTINEL LYMPH NODE #2 -. ONE REACTIVE LYMPH NODE (0/1). Lab No.: C. SENTINEL LYMPH NODE #3 -. ONE REACTIVE LYMPH NODE (0/1). D. LEFT BREAST MASTECTOMY -. INVASIVE LOBULAR CARCINOMA (7 CM.). TUMORAL CALCIFICATION/NECROSIS: NONE IDENTIFIED. DCIS/LCIS: NONE IDENTIFIED. SURGICAL MARGINS/NIPPLE, SKIN AND AREOLA: UNINVOLVED. NON-NEOPLASTIC BREAST: FIBROCYSTIC CHANGES TO INCLUDE DUCTAL EPITHELIAL. HYPERPLASIA. PTNM CLASSIFICATION: T3 N1 MX; STAGE IIIA. COMMENT: The multiple sections from the tumor reveal patchy areas of tumor infiltration. extending up to lactiferous ducts. In addition, the tumor cells also display unfavorable. nuclear features in many areas. The ER, PR and Her-2/neu have been performed on the. previous biopsy. The PanKeratin Immunostain is performed on specimens A, B. and C. GROSS: A. The container is received fresh unfixed labele. eft sentinel lymph node #1. for frozen section"". The specimen consists of an ovoid mass of pink-tan soft rubbery. tissue mixed with fatty tissue measuring 0.6 cm. in greatest dimension. Frozen section is. obtained by. The entire specimen including frozen section in one block. B. The container is received fresh unfixed labele. left sentinel lymph node #2. for frozen section"". The specimen consists of an ovoid mass of tan-gray soft rubbery. tissue with attached fat. Frozen section is obtained by. The entire specimen. including frozen section in one block. Lab No.: C. The container is received fresh unfixed labele. sentinel lymph node #3 for. frozen section"". The specimen consist of an ovoid mass of pink-tan soft rubbery tissue. measuring 1.3 cm. in diameter in the aggregate. Frozen section is obtained by. The entire specimen including frozen section in one block. D. The container is received fresh unfixed labeled. ""left breast"". The specimen. consists of an 809 gm. apparent left breast which is 23 x 15 x 4 cm. in greatest overall. dimension. There is an inverted nipple. The attached skin ellipse is 21 x 9.5 cm. Sectioning through the breast stroma reveals dense gray-white fibrous tissue varying up. to 7.5 cm. in greatest dimension. This area has been previously marked with blue dye. There are scattered cystic spaces varying up to 0.1 cm. in greatest dimension filled with. an amber-colored fluid. Sectioning also reveals a firm tan-gray striated tumor mass. which is 7 x approximately 5.5 cm. in greatest overall dimension and is approximately. 0.7 cm. from the deep/underlying resection margin. The specimen is submitted in ten. blocks. Key Note Block Summary: 1-nipple, 2 through 4-cystic spaces, 5-random,. 6. through 10-tumor mass. MICROSCOPIC EXAMINATION: MICROSCOPIC EXAMINATION CONDUCTED BY PATHOLOGIST CONFIRMS FINAL DIAGNOSIS. SPECIAL STAINS PERFORMED: PanKeratin (specimens A,B,C).",BRCA,1,"The report states that the largest tumor size in the left breast is 7 cm, which falls under the category of T3 tumors, which are more than 5.0 cm in size. The specific sub-staging information is not provided, but the minimum size of 7 cm is sufficient to determine the T stage as T3.",T3,8.0
