Unnamed: 0,patient_filename,t,text,type,n,cmem_t_reasoning,cmem_t_ans_str,cmem_t_num_update
1297,TCGA-E9-A1RF.50F3690C-2082-4590-A923-656C5F226FAE,1,"DC IC. Gross Description: Breast with the tumor of 3 x 5 cm in size; fatty tissue lymph nodes are dense, hyperemic, up to 1 cm in their diameter. Microscopic Description: Infiltrating duct carcinoma; G. Ten lymph nodes were examined, five lymph nodes demonstrated metastases. Diagnosis Details: Tumor Features: Unknown, Tumor Extent: T2 tumor size more than 2cm not more than 5 cm, Venous Invasion: Absent,. Margins: Absent, Treatment Effect: Comments: BREAST TISSUE CHECKLIST. Specimen type: Radical mastectomy. Specimen size: Not specified. Tumor site: Breast. Tumor size: 5 x0x3 cm. Grossly evident lesion: Yes. Histologic type: Infiltrating ductal carcinoma. Histologic grade: Moderately differentiated. Tumor extent: Not specified. Lymph nodes: 5/10 positive for metastasis (Axillary 5/10). Extracapsular invasion of the lymph nodes: Not specified. Margins: Not specified. Nottingham Histologic Score. Tubule formation: Not specified. Nuclear pleomorphism: Not specified. Mitotic count (25x): Not specified. Mitotic count (40x): Not specified. Total Nottingham Score: Score cannot be determined. Evidence of neo-adjuvant treatment: Not specified. Additional pathologic findings: Not specified. Comments: None. Laterality: Left, upper outer quadrant.",BRCA,2,"The report states that the tumor size is 5 x 0 x 3 cm, which is equivalent to 3 x 5 cm (the greatest length and width are considered for T stage). This falls within the T2 category, as the tumor size is greater than 20 mm but less than or equal to 50 mm.",T2,17.0
1143,TCGA-D8-A1XF.FCBB54EB-6FBF-4DC4-B4D5-DB533687FA58,1,"page 1 / 1. copy No. Examination: Histopathological examination. Gender: F. Material: Multiple organ resection - left breast with axillary tissues. Expected time of examination: up to 8 working days. Clinical diagnosis: Cancer of the left breast. Macroscopic description: Left breast sized 22 x 15 x 4 cm removed along with axillary tissues sized 10 x 6x2 cm and a 17 x 6.5 cm skin flap. Weight 780. g. A post-operative scar visible round the nipple with a site of 6 x 4 x 2 cm. Microscopic description: Infiltratio carcinomatosa mamillae. Status post resectionem tumoris. Glandular tissue containing foci of carcinoma ductale in situ (solid and cribrate type, with medium nuclear atypia, with. necrosis and calcifications, as well as lesions of the type mastopathia fibrosa. Axillary lymph nodes: Lymphonodulitis chronica (No VIII). Preliminary result: (including the examination No. Carcinoma invasivum mammae sinistrae. (NHG2, pT2, pNO). Histopathological diagnosis: Carcinoma ductale invasivum mammae sinistrae. Invasive ductal carcinoma of the left breast. ,. NHG2, pT2, pNO.",BRCA,0,The report indicates that the tumor size is greater than 20 mm but less than or equal to 50 mm (22 x 15 x 4 cm). This corresponds to the T2 stage in the AJCC staging system.,T2,18.0
755,TCGA-AN-A0FD.F124155D-6131-47F6-8320-46A41AB125D3,1,Sex: Female. Diagnosis: Breast Cancer Histological description: Infiltrative ductal carcinoma. Anatomic Site: Right breast Tumor location: Primary. Tissue Specification: Tumor Specimen Matrix: Tissue Specimen Format: OCT. Container: block Type of Procurement: surgery Grade: 2. T Stage: 2 N Stage: 0 M Stage: 0 Treatment: none. Treatment Details: n/a. Normal Sample. Anatomic Site: Blood Sample Type: Normal Type of Procurement: blood draw. Matrix: Blood Specimen Format: frozen Container: tube.,BRCA,0,"The report states that the tumor size is greater than 20 mm but does not provide a specific measurement or indicate that the tumor has direct extension to the chest wall or skin. Therefore, based on the provided rules, the T stage would be T2.",T2,19.0
730,TCGA-AC-A62Y.83BCCC3C-0384-45CD-84B4-67E2EDE822EE,1,"Sex: Female. I.O.B.: IRN #: (ef Phys. SPECIMENINFORMATION. Acct i Reg #: DIAGNOSIS. DIAGNOSIS: Right breast modified radical mastectorny: Two areas of invasive lobular carcinoma. Sizes: 2.8 and 1.8 cm. Architectural score: 3 of 3. Nuclear score: 2 of 3. Mitotic score: 1 of 3. Total score: 6 of 9. Grade 2. Extensive lobular carcinoma in situ present. No evidence of angiolymphatic invasion. No evidence of skin and nipple involvement. Prognostic was previously performed and will not be repeated unless requested. Deep margin of excision is inveived by carcinoma. Attached axillary lymph node: One lymph node, metastatic carcinoma present. Size: 0.4 cm. No evidence of extracapsular extension. TMN: T2pN1. OLINICAL INFORMATION. CLINICAL HISTORY: Preoperative Diagnosis: Right modified radical mastectomy with sentinel node mapping with frozen section. Invasive lobular carcinoma. ER positive, PR. positive, Her-2 negative. Postoperative Diagnosis: Symptams/Radiologic Findings: SPECIMENS: Right breast. SPECIMENDOTA. GROSS DESCRIPTION: The specimen is received in formalin labeled with the patient's name. tht breast. The specimen consists of a portion of fibroadipose. breast tissue and overlying skin measuring 20.0x 15.0 x 6.0 cm and weighs 448 grams. The skin surface measures 15.0 x 10.5 cm and is light tan. wrinkled. There is slight puckering of the skin surface noted that measures 2,0 cm that is 8.5 cm from the nipple. The nipple is eccentrically placed and. appears grossly unremarkable. There is no orientation given to the specimen. The deep margin is inked. Sectioning reveals gray-tan mass measuring. 1.8 x 1.5 x 1.5 cm that is 0.1 cm from the deep margin. it is located at the periphery of the breast. A second mass measuring 2,8 x 2.5 x 2.5 cm that is. 0.1 cm from the deep margin, 0,2 cm from the skin surface, corresponds to the puckered area noted previously mentioned on the skin surface The. surrounding tissue reveals yellow-tan fatty fibroadipose tissue predominantiy with areas of gray fibrous tissue. No other lesions are identifiea, On the. periphery of the breast, there is a grav-tan nodule possible lymph node measuring 2,0 x 1.0x 1,0 cm. Received with the specimen ara thrse cassettes. one green, one yellow. one clue labeled. epresentative sections are submitted in cassettes labeled : follows: pipple,. block 1; sections from the first lesion in blocks 2 througn 5, sections from the second lesion in biocks 6 through 9; posorule lymph node sectioned in total. in blocks 10 through 12; random sections from all four quadrants in blocks 13 through 16,.",BRCA,1,"The report mentions the size of the two invasive lobular carcinoma areas as 2.8 cm and 1.8 cm. The larger of these two tumors is 2.8 cm, which falls within the T2 category of tumor size being greater than 20 mm but less than or equal to 50 mm (T2: Tumor size > 20 mm but <= 50 mm).",T2,20.0
1007,TCGA-BH-A0DV.3A0E1EF6-B234-46EC-BD15-95B5FAB06D45,1,"P.18/33. INAL DIAGNOSIS: PART 1: SENTINEL LYMPH NODE #1. LEFT AXILLA, BIOPSY -. A. METASTATIC CARCINOMA INVOLVES ONE LYMPH NODE AND FORMS A SINGLE TUMOR DEPOSIT IN. ADJACENT SOFT TISSUE (1.3 CM) (SLIDE 1A). B. THE METASTATIC FOCUS IN THE LYMPM NODE IS ALMOST ENTIRELY REPLACING THE LYMPU NONE. PARENCHYMA (0.8 CM) WITH EXTRACAPSULAR EXTENSION (0.7 x 0.3 CM). PART 2: BREAST. EFT.MODIFIED RADICAL MASTECTOMY AND LEFT AXILLARY CONTENTS -. A. INVASIVE DUCIAL CARCINOMA, TWO FOCI, 3.2 CM AND 1.5 CM (GROSS) AT 6 AND 10 O'CLOCK POSITION. RESPECTIVELY, NOTTINGHAM GRADE 1/3 (COMBINED NOTTINGHAM SCORE 5/9; TUBULE FORMATION 2/3. NUCLEAR ATYPIA 2/3, MITOTIC ACTIVITY 1/3) WITH LOBULAR FEATURES (soo comment). B. TUMOR INVADES INTO SKELETAL MUSCLE FIBERS. c. DUCTAL CARCINOMA IN-SITU, NUCLEAR GRADE 2, CRIBRIFORM TYPE ASSOCIATEO WITH INVASIVE TUMOR. AND COMPRISING 1% OF TUMOR MASS. D. LYMPHOVASCULAR INVASION is IDENTIFIED,. E. MAKGINS FREE, IUMOR WITHIN LESS THAN T MM rnum DEEP MARGINS IN BOTH THE 6 O'CLOCK AND 10. O'CLOCK POSITION. F. UNINVOLVED BREAST. PARENCHYMA WITH FIBROCYSTIC CHANGES. G. GKIN AND NIPPLE, FREE or l'UMOR. H. METASTATIC CARCINOMA INVOLVES TWO OF NINE LYMPH NODES (2/9) AND FORMS FIVE TUMOR DEPOSITS. IN AXILLARY SOFT TISSUE. 1. LARGEST TUMOR SIZE AN THE LYMPH NODE is 1.0 CM WITH EXTRACAPSULAR EXTENSION (0.9 CM.). J. AXILLARY SOFT TISSUE TUMOR DEPOSIT RANGE FROM 0.2 TO 0.6 CM. K. PATHOLOGIC STAGE (sec comment). L. ER/PR - POSITIVE, HER-2/NEU NEGATIVE (PERFORMED ON BIOPSY). PART 3: ADDITIONAL LEFT AXILLARY CONTENTS, DIOPSY -. A. METASTATIC CARCINOMA INVOLVING FIBROADIPOSE TISSUE (TUMOR DEPOSIT). B. TUMOR MEASURES 0.6 x 0.5 CM (MICROSCOPIC). SYNOPTIC - PRIMARY INVASIVE CARCINUMATUF BREAST. LATERALITY: Left. PROCEDURE: Modified radical mastectomy. upper outer quadrant. Lower outer quadrant. Lower inner quadrant. SIZE OF TUMOR: Maximum dimension invasive component. 3.2 cm. MULTICENTRICITY/MULTIFOCALITY OF INVASIVE FOCI: TUMOR AGGREGATE SIZE: Sum of the sizet of multiple invasive tumora: 4.7 em. TUMOR TYPE (invasive component): Ductal adenocarcinoma. NOS. NOTTINGHAM SCORE: Nuclear grade. 2. Tubule formation: 2. Mitotic activity score 1. Total Nottingham score: 5. Nottingham grade (1. 2. 3) 1. ANGIOLYMPHATIC INVASION: DERMAL LYMPHATIC INVASION: CALCIFICATION: TUMOR TYPE, IN SITU: Cribritorm. Percent or tumor occupied by in situ component: 1 %. SURGICAL MARGINS INVOLVED BY INVASIVE COMPONENT-. SURG MARGINS INVOLVED BY IN SITU COMPONENT: PAGET'S DISEASE OF NIPPLE: LYMPH NODES POSITIVE: LYMPH NODES EXAMINED: 9. METHOD(9) OF LYMPH NODE EXAMINATION: IVE stain. SENTINEL NODE METASTASIS: SIZE OF NODAL METASTASES: Diameter of lergest lymph node melastasis 10 mm. LYMPH NODE METASTASIS(-ES) WITH EXTRACAPSULAR EXTENSION: Yos. SKIN INVOLVED (ULCERATION): NON-NEOPLASTIC BREAST FCD. T STAGE, PATHOLOGIC: N STAGE, PATHOLOGIC: pN2. M STAGE, PATHOLOGIC: pMX. ESTROGEN RECEPTORS: positive. PROGESTERONE RECEPTORS: positive. HER2/NEU: zeio ar 1+.",BRCA,2,"The report mentions 'SIZE OF TUMOR: Maximum dimension invasive component. 3.2 cm' which indicates that the tumor size is greater than 20 mm (T2 threshold) but less than or equal to 50 mm, which falls under T2 staging.",T2,21.0
707,TCGA-AC-A2QH.C2A0E948-2B9E-4E49-90C4-57CE4C4A95B3,2,"Patient Location: Date of Service: Date Received: Room: Bed: A copy of this report will be faxed to: FINAL SURGICAL PATHOLOGY REP. Diagnosis: A. LEFT BREAST, TOTAL MASTECTOMY (PROPHYLACTIC): - Multiple intraductal papillomas with atypical ductal hyperplasia (ADH). - Radial scar, 8 mm in diameter. - Fibrosis, cysts, apocrine metaplasia, and sclerosing adenosis. - Skin with seborrheic keratosis. - No invasive carcinoma is identified. - Unremarkable intramammary lymph node. B. & C) RIGHT BREAST AND AXILLARY LYMPH NODES, MODIFIED RADICAL. MASTECTOMY: - Invasive high-grade sarcomatoid (metaplastic) carcinoma, with areas of. matrix-producing carcinoma. - Invasive tumor measures 95 mm in diameter. - Lymphatic invasion is identified near the periphery of the tumor. - Resection margins are widely free of invasive carcinoma. - Invasive carcinoma is present 40 mm from the closest margin (inferior),. and is at least 50 mm from all other margins. - Twenty-two axillary lymph nodes, no tumor present. PATHOLOGIC TUMOR STAGING SYNOPSIS: Type and grade (invasive): High-grade sarcomatoid carcinoma, with areas of. matrix-producing carcinoma (subtypes of metaplastic carcinoma). Primary tumor: pT3. Regional lymph nodes: pNO. Distant metastasis: pMX. Pathologic stage: IIB. Lymphovascular invasion: Identified near periphery of tumor. Margin status: Negative (RO). Printed: This report continues (FINAL). FINAL SURGICAL PATHOLOGY REPORT. COMMENT: The majority of the invasive carcinoma is characterized by solid sheets of. high-grade malignant cells. In some areas, tumor cells have prominent spindle cell. morphology, whereas in other areas, the malignant cells retain vaguely epithelioid. (rounded) shapes, but have highly anaplastic nuclear features. Prominent tumor-. associated necrosis is present, and no discernable glandular differentiation is evident. The morphologic appearance of these areas is compatible with designation as. sarcomatoid (metaplastic) carcinoma. Other areas of tumor contain malignant cells. present in close proximity to blue-gray chondromyxoid or hyaline matrix, compatible. with at least focal matrix-producing carcinoma, another subtype of metaplastic breast. carcinoma. Immunohistochemical staining shows some scattered tumor cells to be positive for. p63 and CK5/6, in support of designation as metaplastic carcinoma. This Is in. accordance with IHC staining performed on the previous biopsy. In addition,. some tumor cells are positive for smooth muscle actin, a feature not uncommon in. metaplastic sarcomatoid carcinoma, representing immunohistochemical evidence of. differentiation towards a myoepithelial phenotype. Staining for. and S100. are negative in tumor cells. Focally, the invasive carcinoma is seen in association with a fibroepithelial neoplasm, a. portion of which appears to be necrotic. The stroma of the fibroepithelial neoplasm. does not show striking hypercellularity, except for a few areas in which there is. granulation tissue. The lack of stromal cellularity within this lesion argues that the. fibroepithelial neoplasm is best regarded as fibroadenoma, even though the lesion has. some architectural features of phyllodes tumor. In some areas, high-grade malignant. cells are seen to line the ducts/clefts of the fibroadenoma, suggesting that the. carcinoma is invading into the fibroadenoma. Another possibility is that the carcinoma. has arisen out of the epithelial component of the fibroadenoma, which is considered. less likely. Sarcomatoid carcinomas are highly malignant tumors with capability to metastasize to. distant sites (hematogenous metastasis to sites such as liver, lung, brain, etc.), even. though some studies have shown that metastasis to axillary lymph nodes are. significantly less frequent than in more typical cases of breast carcinoma (i.e. invasive. Printed: This report continues. FINAL SURGICAL PATHOLOGY REPORT. ductal carcinoma, NOS). Dr. i Dr. have reviewed. representative slides from this case, and concur with the diagnosis of metaplastic. breast carcinoma. Pathology Consultation Report. Printed: This report continues. FINAL SURGICAL PATHOLOGY REPORT. Breast (AJCC Cancer Invasive Staging Tumor Handbook, Staging 7th Ed., Information and CAP protocol, Oct 2009). This staging also incorporates: Previous biopsy: Breast profile. Total breast, axillary lymph nodes, and. Specimen type: contralateral breast. Modified radical mastectomy and contralateral. Specimen procedure: prophylactic mastectomy. Axillary dissection. Lymph node sampling: Single intact specimen. Specimen integrity: Right. Specimen. Specimen (other than mastectomy): laterality: size. INVASIVE TUMOR FEATURES: 95 mm. Invasive tumor size: Upper outer quadrant. Invasive tumor site: Single focus of invasive carcinoma. Invasive tumor focality: Sarcomatoid (metaplastic) carcinoma, with areas. Histologic type: of matrix producing carcinoma. 3 (high-grade). Total Nottingham Grade: 3 of 3. Tubule formation: 3 of 3. Nuclear Pleomorphism: 3 of 3. Mitotic count for Nottingham: Greater than 20 mitosis per 10 high power fields. Mitotic count: N/A. Other Grading System: Not identified. Lymphatic invasion: MARGIN STATUS FOR INVASIVE COMPONENT: 40 mm. Distance of tumor from margins: Inferior. Closest margin: Invasive and in situ carcinoma are present at. Other margins: least 50 mm from all other margins. DCIS not present. IN-SITU CARCINOMA (DCIS) FEATURES: FINAL SURGICAL PATHOLOGY REPORT. LOBULAR CARCINOMA IN-SITU (LCIS): Absent. Skin: Unremarkable. Nipple: Unremarkable. Skeletal Muscle: Not present. INVASIVE PATHOLOGIC TUMOR STAGING (pTNM). Primary tumor (pT): pT3. Regional lymph nodes (pN): pNO. Distant metastasis (pM): pMX. RECEPTOR STATUS AND HER2/NEU: ProPath, CM11-1333. Estrogen receptors: Negative (0% positive cells). Progesterone receptors: Negative (0% positive cells). Her2/neu: Not overexpressed (IHC score 0). Ki-67 proliferative index: 50% positive cells. Source of Specimen: A. Left Breast total mastectomy. B. Right Breast total mastectomy. C. Additional Axillary Contents. Clinical History/Operative Dx: Cancer, female breast, upper-outer. Gross Description: A. The specimen is labeled left simple mastectomy and is received in formalin. It consists of a. mastectomy specimen which weighs 1430 grams. A white suture at one end of the skin ellipse designates. the lateral portion of the excision. With this orientation the specimen measures 26 cm from medial to. lateral, 17.5 cm from superior to inferior, and is up to 6 cm from superficial to deep. There is an overlying. broad ellipse of tan-white skin which measures 26 x 15 cm. In the central slightly medial portion of the. skin there is a 4 cm areola with a protuberant 1.2 cm nipple. The medial-inferior skin displays a 0.7 cm. plaque-like brown skin lesion. No other skin lesions are present. The anterior-superior margin is inked blue,. the anterior-inferior margin is inked green, and the posterior margin, which consists of predominantly. smooth fascial tissue, is inked black. The breast is serially sectioned at close intervals to reveal coarsely. lobulated fatty tissue and scattered tan-white fibrous parenchyma. The fibrous parenchyma contains. multiple punctate areas of fine nodularity throughout the breast with scattered blue-dome cysts. There are. no areas which have a stellate or retracted appearance. There are no lymph nodes identified in the. Printed: This report continues (FINAL). FINAL SURGICAL PATHOLOGY REPORT. axillary portion of the tissue. Representative sections are submitted. Section summary: A1) nipple and tissue just deep to nipple,. A2) inferior skin lesion,. A3) representative breast tissue upper-inner quadrant,. A4) representative breast tissue lower-inner quadrant,. A5) representative breast tissue upper-outer quadrant,. A6) representative breast tissue lower-outer quadrant,. A7) representative tissue central breast including representative deep margin. Following review of the initial slides, additional representative sections from the central portion of the. breast tissue are submitted from medial to lateral in cassettes A8-A12. A lymph node and random sections. of breast tissue are submitted in cassette A13. B. The specimen is labeled right modified radical mastectomy and is received without fixative. It consists. of a mastectomy specimen which weighs 1681 grams. A suture marks the axillary tissue. With this. orientation the breast measures 26 cm from medial to lateral, 16 cm from superior to inferior, and 6.5 cm. from superficial to deep. The axillary portion measures 9 x 7 x 3 cm. The breast has an overlying broad. ellipse of tan skin measuring 25 x 16 cm. There is a medial and slightly inferiorly located poorly. delineated 4 cm areola with a protuberant 1.2 cm nipple. The central skin surface bulges outward in the. periareolar area over a distance approximately 8 cm. The skin is otherwise tan-white and unremarkable. Sections of the bulging anterior skin reveal a partially hemorrhagic cavitary lesion which measures 7 cm. from medial to lateral, 7 cm from superior to inferior, and up to 3.5 cm from superficial to deep. The. cavitary space is filled with gray-tan tissue which has a finely lobulated appearance. Just inferior to the. cavitary space along the lateral edge there is creamy tan-white moderately firm fibrous breast. parenchyma. Representative tissue obtained for research purposes. Following fixation the anterior-. superior margin is inked blue, the anterior-inferior margin is inked green, and the posterior margin, which. consists predominantly of smooth fascial tissue, is inked black. The breast is serially sectioned from the. posterior surface at close intervals to reveal the cavitary lesion described above. The breast parenchyma. is otherwise tan-white and has fine palpable nodularity most notable in the lower-inner quadrant. The. creamy tan-white tissue at the posterior edge of the hemorrhagic lesion is 5 cm from the closest superior. margin, 4 cm from the closest inferior margin, 5.5 cm from the closest deep margin, 7.5 cm from the. closest medial margin, and 13 cm from the closest lateral margin. At its greatest dimension which is. superior-inferior the creamy white tissue at the posterior edge of the cavitary lesion measures 6.5 cm. Representative sections are submitted. Section summary: B1) nipple and tissue just deep to nipple,. B2) representative skin with closest approach of hemorrhagic cavitary lesion,. B3) medial edge of hemorrhagic lesion,. B4-B5) sections cavitary lesion progressing centrally,. B6-B8) central-posterior portion of cavitary lesion with firm white tissue,. B9-B10) representative sections from lateral portion of hemorrhagic lesion,. B11) possible intramammary node 2.5 cm lateral to hemorrhagic lesion,. B12) representative breast tissue upper-inner quadrant (medial to hemorrhagic lesion),. B13) representative tissue lower-inner quadrant of breast (medial to hemorrhagic lesion),. Pathology Consultation Report. This report continues (FINAL). Printed: FINAL SURGICAL PATHOLOGY REPORT. B14) representative breast tissue upper-outer quadrant (lateral to hemorrhagic lesion),. B15) representative breast tissue lower-outer quadrant (lateral to hemorrhagic lesion),. B16) deep surgical margin closest to posterior edge of cavitary lesion,. B17-B19) nodal tissue trimmed from largest predominantly fatty (3.9 cm) node,. B20-B21) second largest node serially sectioned,. B22) single node serially sectioned,. B23) two nodes bivalved (one inked),. B24) two node, one inked and trisected, one trisected,. B25) four possible nodes intact,. B26) two nodes bivalved (one inked),. B27) smaller possible nodes intact. Following review of the initially submitted sections, additional sections of the tumor are submitted as. follows: B28-B32) polypoid necrotic appearing portion of tumor,. B33) breast tissue surrounding tumor,. B34-B35) representative sections of solid tan portion of tumor. (. C. The specimen is labeled additional axillary contents right axilla and is received in formalin. It consists. of a 1.8 cm fragment of fibrofatty tissue. On dissection there are two intact nodes, the larger node. measuring 1.5 x 1.1 x 0.6 cm and the smaller node 0.6 cm in maximum dimension. The larger node is. sectioned and submitted in cassette C1. The smaller node is bivalved and submitted in cassette C2. (DS). Microscopic Description: A. Microscopic sections have been examined. The microscopic findings are reflected in the diagnosis. rendered. B. Microscopic sections have been examined. The microscopic findings are reflected in the diagnosis. rendered. IHC stains: p63, CK5/6, SMA,. S100. See comment for staining results. Appropriate positive and negative controls reviewed. C. Microscopic sections have been examined. The microscopic findings are reflected in the diagnosis. rendered. Pathology Consultation Report. Printed: REPRINT: Orig. printing on.",BRCA,0,"The report states that the 'Invasive tumor measures 95 mm in diameter.' According to the rules provided, T3 corresponds to 'Tumor size > 50 mm but <= 100 mm'.",T3,22.0
