Unnamed: 0,patient_filename,t,text,type,n,cmem_t_reasoning,cmem_t_ans_str,cmem_t_num_update
1346,TCGA-EW-A1P0.F9FB00C3-9F86-40AC-A5E8-08712CD5002B,1,"F. Pathologic Interpretation: A. Right breast 1 short stitch superior, 1 long stitch lateral: -Fibrocystic changes including consisting of apocrine metaplasia, stromal fibrosis and microcysts. B. Right axillary node: -Two lymph nodes, no carcinoma seen (0/2). C. Left rotter lymph node: -Metastatic carcinoma to one lymph node,6.0 cm, (1/1). -Perinodal tumoral invasion seen. D. Leftbreast and axilla (fresh) 1 short suture superior; 1 long suture fateral: -Invasive, multifocal moderately differentiated ductal carcinoma with mucinous (colloid) morphology, 2.0 and 2.4 cm. (sum: 4.4 cm). -No carcinoma seen in eighteen lymph nodes, (0/18). -Intraductal papilloma. -Intradermal nevus. (See tumor summary). Tumor Summary. Specimen Type: Mastectomy. Lymph Node Sampling: Axillary dissection. Specimen Size Greatest dimension 21.0 cm. Additional dimension: 21.0 x 6.0 cm. Laterality: Left. Tumor Site: Upper outer quadrant. Size of invasive component: Greatest dimension: 2.0 cm and 2.4 cm (sum: 4.4 cm). Histologic type: Invasive ductal carcinoma with mucinous differentiation. Histologic Grade: Nottingham Histologic Score: 2 (2+2+2=6). Tubule formation: (2). Nuclear Pleomorphism: (2). Mitotic Count: (2). Pathologic staging (pTNM). Primary tumor: pT2. Regional Lymph Nodes: pN1a. Number examined: 21. Number involved: 1. Distant Metastasis: pMX. Margins: Uninvolved by invasive carcinoma, 1.5 cm from the superior margin. Venous/Lymphatic Invasion: Absent. ER: Positive (In-house Immunoperoxidase performed). PR: Negative (In-house Immunoperoxidase performed). Her2: Negative (In-house Immunoperoxidase performed). Note: This neoplasm demonstrates a more defined mucinous differentiation on the 2.4 cm nodule, however focal mucinous. differentiation. is also seen on the 2.0 cm neoplasm. AJCC pathologic staging pT2 N1a Mx. NOTE: Some immunohistochemica/ antibodies are analyte specific reagents (ASRs) validated by our laboratory (Her 2, Parvo, H. pylori, HBcore). These ASRs are clinically uséful. indicators. that. do. not require FDA approval. These ciones are used: ID5=ER, PgR 636=PR, A485=HER2, H-11=EGFR, CCH2/DDG9=CMV, F39 4 1=AR and HPV by ISH. All immunohistochemical stains are used. with formalin or molecular fixed, peraffn embedded tissue. Detection is by LSAB. The results are read by a pathologist as positive or negative. SURGICAL PATHOL Report. As the attending pathologist, / attest that 1. (i) Examined the relevant. preparation(s) for the specimen(s); and (ii) Rendered the diagnosis(es). Procedures/Addenda. Addendum. Date Complete: Addendum Diagnosis. D. Left breast and axilla (fresh) 1 short suture superior; 1 long suture lateral: -The cells of intradermal nevus are positive fo. by immunohistochemistry. :, PhD. Clinical History: Patient is a. I white female with history of left breast cancer. Pre Operative Diagnosis: Right breast cancer. Specimen(s) Received: A: Right breast 1 short stitch superior, 1 long stitch lateral (fresh). B: Right axillary node (perm). C: Left rotter lymph node (perm). D: Left breast and axilla (fresh) 1 short suture superior; 1 long suture lateral. Gross Description: A. Received fresh and labeled ""right breast 1 short stitch superior, 1 long stitch lateral"" specimen consist of right breast. oriented with 1 short stitch superior resection margin and 1 long stitch in lateral resection margin, 18.0 x 150x 5.0 cm and. weighs 775.0 grams. The skin mesures 13.0 x 8.0 cm, nipple measures 1.2 cm and the areola, 4.0 cm in circumference. Sections reveal abundant grossly unremarkable fibroadipose tissue. The central area reveal white-tan, fibrocystic area,. 2.0 cm in greatest dimension. No tumor or any other lesions are grossly identified. Representative sections are submitted. in ten cassettes as follows: 1. Perpendicular representative sections from superior resection margins. 2. Perpendicular representative sections from inferior resection margins. 3. Perpendicular representative sections from medial resection margins. Perpendicular representative sections from lateral resection margins. 5. Representative sections from nipple. 6. Perpendicular representative sections from deep resection margins. 7-10. The lesion described submitted in toto (fibrocystic areas). 11. Representative from upper outer quadrant. 12. Representative sections from lower outer quadrant. 13. Representative sections from upper inner quadrant. 14. Representative sections from lower inner quadrant. B. Received in formalin and labeled 'right axillary node"" specimen consist of yellow-tan, fibroadipose tisseu, 3.0 x 1.5 x 1.0. cm. Section reveal two lymph nodes. The lymph nodes submitted in toto in one cassette bissected each. SURGICAL PATHOL Report. C. Received in formalin and labeled ""left rotter lymph node"" specimen consist of one lymph node, 6.0 x 5.0 x 3.0 cm and. weighs 35.0 grams. Sections reveals pink-tan, well defined multinodular No calcified or hemorrhagic arejas are grossly. identitified. Representative sections are submitted in eight cassettes: D. Received fresh and labeled ""left breast and axilla 1 short suture superior; 1 long suture lateral"" is a mastectomy specimen. with axillary contents, weighing 1150.0 grams and measuring 21.0 x 21.0 x 6.0 cm and the axillary contents, 14.0 x 12.0 x. 2.0 cm. There is an anterior ellipse of white skin, 20.0 x 10.0 cm. Located centrally within this ellipse of skin there is a. nipple areola complex 3.5 cm in circumference and 1.0 cm in circumference. Located toward the outer quadrant there are. two verrucose shaped hyperkeratosis lesions, 0.7 x 0.5 cm in greatest dimension. The remainder of the skin surface is. unremarkable. The rest of the specimen is covered by yellow-tan lobulated adipose tissue. The surgical résection. margins are inked din black. Multiple cross sections reveals an ill circumscribed gray-tan, hard greatly mass, 2.0 cm in. greatest dimension. The mass is located in the outer quadrant approximately 1.00 o'clock position, 1.5 cm from the. superior resection margin (nearest margin) and 2.5 cm from deep resection margin. Located in the same quadrant. 2.5. cm. from the mass previously described there is a second ill circumscribed gray-tan, hard nodule measuring 2 4 cm. in. greatest. dimension, this mass is 2.8 cm from deep resection margin (closest margin). The remainder of the specimen shows a. heterogeneous breast tissue. No other lesions or masses are grossly identified. The stroma to fat ratio is 30.70. Multiple. sections through the axillary contents reveal eighteen possible lymph nodes ranging in size from, 0.3 cm to 2.0 cm in. greatest dimension. Representative sections are submitted as follows: 1. Superior resection margin nearest to the 1.00 o'clock mass. 2. Inferior resection margin. 3. Medial resection margin. 4. Lateral resection margin. 5. Deep margin closest to 1.00 o'clock mass (outer upper quadrant). 6. Deep margin closest to the second mass (outer upper quadrant). 7. Representative sections from the areola and nipple. 8. Representative sections from the skin wit verrucose lesion. 9-11. Representative sections from the mass at 1.00 o'clock (outer upper quadrant). 12-14. Representative sections from the second mass (outer upper quadrant). 15. Representative sections from inner upper quadrant. 16. Representative sections from inner lower quadrant. 17. Representative sections from outer lower quadrant. 18-20. One lymph node multisected. 21-23. One lymph node multisected. 248.25. One lymph node multisected. 26-33. One lymph node bisected per cassette. 34. Four possible lymph nodes submitted in toto. 35. Three possible lymph nodes submitted in toto. ICD-9(s): 174.8 196.3 216.5.",BRCA,1,"Based on the pathology report, the patient has invasive, multifocal moderately differentiated ductal carcinoma with mucinous (colloid) morphology in the left breast, with the largest tumor having a greatest dimension of 2.4 cm. According to the rules provided, T2 corresponds to a tumor size > 2 cm and <= 5 cm, which matches the size of the largest tumor in this case. Therefore, the T stage for this patient is T2.",T2,63.0
1290,TCGA-E9-A1R6.8A865E33-082A-454F-A6DF-89E994206E65,1,"OC ID: Gross Description: Lump with the tumor of 2.5 x 2.2 cm in size; fatty tissue lymph nodes demonstrate lipomatosis, hyperemia. Microscopic Description: Infiltrating duct carcinoma, G2. Ten dissected lymph nodes demonstrate sinus histeocytosis. Diagnosis Details: Tumor Features: Unknown, Tumor Extent: T2 tumor size more than 2cm not more than 5 cm, Venous Invasion: Absent,. Margins: Absent, Treatment Effect: Comments: BREAST TISSUE CHECKLIST. Specimen type: Lumpectomy. Specimen size: Not specified. Tumor site: Upper outer quadrant. Tumor size: 2.2 x 0x 2.5 cm. Grossly evident lesion: Yes. Histologic type: Infiltrating ductal carcinoma. Histologic grade: Moderately differentiated. Tumor extent: Not specified. Lymph nodes: 0/10 positive for metastasis (Axillary 0/10). Extracapsular invasion of the lymph nodes: Not specified. Margins: Uninvolved. Nottingham Histologic Score. Tubule formation: Not specified. Nuclear pleomorphism: Not specified. Mitotic count (25x): Not specified. Mitotic count (40x): Not specified. Total Nottingham Score: Score cannot be determined. Evidence of neo-adjuvant treatment: Not specified. Additional pathologic findings: Not specified. Comments: None. Laterality: Right, upper outer quadrant.",BRCA,0,"The report states that the tumor size is 2.2 x 0 x 2.5 cm, which is larger than 2 cm but not more than 5 cm. This corresponds to a T2 stage according to the rules provided.",T2,63.0
1169,TCGA-D8-A27L.1281F503-C256-4DFF-A3BD-BD5E51CE4249,0,"page 1 / 1. copy No. 2. Examination: Histopathological examination. PESEL: XX. Gender: F. Material: Multiple organ resection 1 right breast.). Expected time of examination: up to 8 working days. Clinical diagnosis: Cancer of the right breast. Macroscopic description: Right breastsized 19.0 x 14.0 x 2.5 cm removed without axillary tissues and with a skin flap of 14 x 8 cm. Tumour sized 1.1 x 0.6. x 1.0 cm found in upper inner quadrant, located 2.5 cm from the lower boundary, 0.5 cm from the base and 1.0 cm from the. skin. Microscopic description: Carcinoma ductale invasivum NHG1 (2 + 2 + 1/5 mitoses/10 HPF - visual area 0.55 mm). Numerous foci of carcinoma ductale in situ (DCIS) found within the tumour (cribrate type with medium nuclear atypia and point. necrosis, 30% of the tumour). Mamilla sine laesionibus. Glandular texture showing lesions of the type mastopathia fibrosa et cystica. Invasive lesions are situated 5 cm from the base. Histopathological diagnosis: Carcinoma ductale invasivum et in situ mammae dextrae. Invasive and in situ ductal carcinoma of the right breast. i. ( NHG1, pT1c, pNx). Compliance validated by: dr. Results of immunohistochemical examination: Estrogen receptors found in over 75% of neoplastic cell nuclei. Progesterone receptors found in over 75% of neoplastic cell. nuclei. HER2 protein stained with Ventana's Pathway HER-2/neu (4B5) Rabbit Monoclonal Antibody. Negative reaction in. invasive cancerous cells (Score=1+). di. dr.",BRCA,2,"The report states that the size of the largest tumor is 1.1 x 0.6 x 1.0 cm, which is less than or equal to 2 cm. According to the rules provided, this falls under T1 category.",T1,63.0
666,TCGA-A8-A097.5B867CB6-F94D-435D-83E3-0ADB814B8077,1,"Diagnosis: 1. Poorly differentiated invasive ductal carcinoma with a discrete. intraductal component (tumor diameter 2.8 cm). Provisional tumor classification: NOS, G III, pT2 N1mi(sn)LOVORO.",BRCA,1,"The report states that the tumor diameter is 2.8 cm, which falls within the range for T2 (tumor size > 2 cm and <= 5 cm) according to the rules provided. The presence of an intraductal component does not affect T stage, and the provisional tumor classification of NOS, G III, pT2 N1mi(sn)LOVORO also supports the T2 classification.",T2,64.0
898,TCGA-AR-A2LO.E5B6771D-450A-49AD-AEBC-7FC056BFCDBE,1,"Final Diagnosis. A. Breast, left, simple mastectomy: Infiltrating lobular carcinoma, Nottingham grade I (of III). [tubules 3/3, nuclei 1/3, mitoses 1/3; Nottingham score 5/9] is identified forming a mass (4.8 x. 2.7 x 1.9 cm) located in the lower outer quadrant of the breast. Biopsy site changes are present. The tumor does not involve the nipple, overlying skin, or underlying chest wall. Lobular. carcinoma in situ is also present. All surgical resection margins, including the deep margin, are. negative for tumor (minimum tumor free margin, 0.3 cm, deep margin and 0.5 cm, superficial. margin). With available surgical material, the AJCC staging is pT2NXMX (see comment). B. Breast, right, simple mastectomy: Benign nonproliferative breast parenchyma. C. Lymph nodes, left axillary, lymphadenectomy: Multiple (14) lymph nodes are negative for. tumor. D. Lymph nodes, left lowest axillary, lymphadenectomy: Fibroadipose tissue, negative for. tumor. No lymphoid tissue identified.",BRCA,1,"The report states that the largest tumor measures 4.8 x 2.7 x 1.9 cm, which is larger than 2 cm but not larger than 5 cm, making it a T2 stage according to the rule: 'Tumor size is the primary factor in determining T stage, with T1 being <= 2 cm, T2 being > 2 cm and <= 5 cm, T3 being > 5 cm, and T4 being any size with direct extension to the chest wall or skin.'",T2,65.0
933,TCGA-B6-A0RT.64D53A4B-4735-4AD2-A413-520797F5F9CB,2,"ourgie. CLINICAL HISTORY: year old female with breast cancer. GROSS EXAMINATION: A. ""Right breast biopsy"". received fresh and fixed in formalin. An unoriented,. 6.5 x 5.5 x 2.5 cm incisional breast biopsy received cross-sectioned. One. surface of the specimen has previously been inked black, and a frozen section. has been taken from this area. Grossly, the tumor is present at the ink. Serial sectioning reveals an irregular, whitish, infiltrative tumor 3.5 x 1.7. x 2.1 cm in greatest dimension, with focal petechia hemorrhage. A 0.3 cm area. of yellowish gritty texture in the center of the tumor is suspicious of. calcification. There is no gross tumor necrosis. A separate, 0.3 cm well. defined, yellowish nodule is located approximately 0.5 cm from the main. tumor. The specimen is inked and serially sectioned every 0.5 cm. Representative sections are submitted. BLOCK SUMMARY: A1- - remnants of AF1. 2.7 x 1.6 x 0.3 cm soft tissue fragment. A2-A13- serial sections of the specimen every 0.5 cm, of which: A7- tumor including the calcification,. A8- section adjacent to AF1,. A9- 0.3 cm nodule,. A13-normal appearing breast. B. ""Right breast"", received fresh and fixed in formalin. A modified right. mastectomy 21.1 x 15.2 x 3.5 cm, a skin ellipse 14.2 x 7.1 cm, and axillary. tail 7.5 x 6 x 2 cm. A fresh, horizontal 5 cm incision line is located. superior lateral to the nipple, 1.5 cm below the superior skin resection. margin. The skin surface is smooth with no discoloration, gross mass, or. nipple retraction. The specimen is serially sectioned to reveal a biopsy. cavity 6.5 x 5.5 x 2 cm, which corresponds to the size of the previous biopsy. specimen. The superior wall of the cavity appears to contain a 2.5 x 1.5 x 2. cm residual tumor which has a similar cut surface and texture to that in the. biopsy specimen. The residual tumor is located approximately 1.5 cm from the. closest deep resection margin, and over 4 cm from the superior margin. The. biopsy cavity is otherwise 3 cm from the inferior margin, 4.9 cm from the. superior margin, 1 cm from the deep margin, 4.5 cm from the medial margin, 2.5. cm from the lateral margin, and 1 cm from the skin. The deep resection margin. is inked in blue, superior margin in black, and inferior margin in red. The. axillary tail is dissected for lymph nodes. Multiple lymph node candidates are. found, the largest measuring 1.5 x 1.3 x 1.0 cm. Representative sections of. the breast and lymph nodes are submitted. BLOCK SUMMARY: B1- inner upper quadrant. B2- inner lower quadrant. B3- outer upper quadrant. B4- outer lower quadrant. B5- nipple. B6- skin with incision. B7-B8- tumor in biopsy cavity and the closest deep resection margin. B9- biopsy cavity (superior wall). B10- biopsy cavity (inferior wall) . B11-B17- axillary lymph node candidates. B18- low axillary tail. INTRA OPERATIVE CONSULTATION: A. ""Right breast"": Af1- adenocarcinoma extending to inked margin. DIAGNOSIS: A. ""RIGHT BREAST"" (BIOPSY) : INFILTRATING ADENOCARCINOMA OF DUCTAL TYPE, NOT OTHERWISE SPECIFIED. N.S.A.B.P. HISTOLOGIC GRADE, 3 OF 3. N.S.A.B.P. NUCLEAR GRADE, 2 TO 3 OF 3. GROSS TUMOR SIZE IS 3.5 X 2.2 X 1.7 CM. INVASIVE TUMOR SIZE IS 3.5 CM. IN SITU CARCINOMA OF COMEDO TYPE IS PRESENT, OCCUPYING LESS THAN 10% OF. TUMOR. NO EXTENSIVE INTRADUCTAL CARCINOMA OR MULTIFOCAL TUMOR IS PRESENT. NON-NEOPLASTIC BREAST TISSUE SHOWS DUCTAL ECTASIA, FIBROSIS, AND MICROCYST. FORMATION. LYMPHATIC/VASCULAR INVASION IS PRESENT (A9). CARCINOMA EXTENDS TO SURGICAL MARGIN MULTIFOCALLY. ESTROGEN/PROGESTERONE AND CELL CYCLE ANALYSIS IS PENDING. METHODOLOGY: FRESH TISSUE. B. ""RIGHT BREAST"" (MODIFIED MASTECTOMY) : INFILTRATING ADENOCARCINOMA OF DUCTAL TYPE, NOT OTHERWISE SPECIFIED. N.S.A.B.P. HISTOLOGIC GRADE, 3 OF 3. N. S.A.B. NUCLEAR GRADE, 3 OF 3. GROSS TUMOR SIZE IS AT LEAST 6.0 CM. INVASIVE TUMOR SIZE IS 6.0 CM. CARCINOMA IS LOCATED IN THE UPPER-OUTER QUADRANT. IN SITU CARCINOMA OF COMEDO TYPE: SEE SPECIMEN ""A"". MULTIFOCAL TUMOR IS NOT PRESENT. NON-NEOPLASTIC BREAST TISSUE SHOWS DUCTAL ECTASIA, FIBROSIS, AND MICROCYST. FORMATION. LYMPHATIC/VASCULAR INVASION PRESENT. CARCINOMA IS FOCALLY TO WITHIN 0.7 CM OF THE DEEP SURGICAL MARGIN (A7). NIPPLE SHOWS NO INVOLVEMENT BY PAGET'S DISEASE. SKIN IS NOT INVOLVED BY CARCINOMA. ONE OF 23 LYMPH NODES POSITIVE FOR CARCINOMA (1/23) . ESTROGEN/PROGESTERONE AND CELL CYCLE ANALYSIS PENDING. RESULTS WILL BE. ISSUED IN AN ADDENDUM. METHODOLOGY: FRESH TISSUE. ADDENDUM 1: Tissue was sent to the. for assay of the Estrogen. and Progesterone receptors. The Estrogen receptor activity was judged as. negative with an estimated fmol valve of 0. The Progesterone receptor activity. was judged as negative with an estimated fmol of valve of 0. The. proliferation index was estimated to be high with a PI of 70%. Please refer. to. for a complete report. 2 of 2.",BRCA,1,"The largest tumor size in this report is 6.0 cm, which falls under the 'T2' category of 'T2: tumor size > 2 cm and <= 5 cm'. The 'T' stage is determined by the size of the largest tumor, and it does not consider the presence or absence of metastasis or the number of positive lymph nodes in breast cancer.",T2,65.0
891,TCGA-AR-A2LE.95DC80AB-C070-4613-8C11-A124AEDF9754,0,"Final Diagnosis. Breast, right, excision: Infiltrating lobular carcinoma, Nottingham I (of. III) forming a 1.6 x 1.5 x 1.3 cm mass (AJCC pT1c) The carcinoma shows. ductular involvement. No angiolymphatic involvement is present. The. surgical resection margins, including the separately submitted margins,. are negative for tumor. Lymph nodes, right sentinel, excision: Negative for tumor. Immunohistochemical cytokeratin stain was performed on the paraffin. embedded sentinel lymph node tissue and confirms the H&E impression. The infiltrating breast carcinoma is positive for estrogen receptor and. negative for progesterone receptor.",BRCA,0,"The report states that the largest tumor is 1.6 x 1.5 x 1.3 cm, which falls under the T1 category. Specifically, it is T1c as the tumor size is greater than 1 cm and less than or equal to 2 cm.",T1,65.0
770,TCGA-AN-A0XN.4C9C9D24-07E1-47BE-8D34-F94693576BD2,1,Sex: Female. Diagnosis: Breast Cancer Histological description: Infiltrative ductal carcinoma. - Anatomic Site: Breast Tumor location: Primary. Tissue Specification: Tumor Specimen Matrix: Tissue Specimen Format: OCT. Container: block Type of Procurement: surgery Grade: 2. T Stage: 2 N Stage: 1 M Stage: 0 Treatment: none. Treatment Details: n/a. Normal Sample. Anatomic Site: Blood Sample Type: Normal Type of Procurement: blood draw. Matrix: Blood Specimen Format: frozen Container: tube.,BRCA,2,"The report specifies a T Stage of 2, which corresponds to a tumor size > 2 cm and <= 5 cm according to the rules provided.",T2,66.0
1101,TCGA-BH-A6R9.1DB8FAFB-FC4A-4401-8316-30FB5352335D,1,"FINAL DIAGNOSIS: BREAST, LEFT, TOTAL MASTECTOMY (120.1 GRAMS) -. A. METAPLASTIC CARCINOMA OF THE BREAST, SPINDLE CELL TYPE, NOTTINGHAM GRADE II (TUBULE. FORMATION 3, NUCLEAR PLEOMORPHISM 3, MITOTIC ACTIVITY 1; TOTAL SCORE 7/9). B. THE INVASIVE TUMOR MEASURES 3.8 CM IN GREATEST DIMENSION. C. NO LYMPHOVASCULAR SPACE INVASION IS NOTED. D. INKED MARGINS ARE NEGATIVE FOR CARCINOMA; HOWEVER, A FOCUS OF INVASIVE CARCINOMA IS LESS. THAN 1.0 MM (LESS THAN 0.1 CM) FROM THE ANTERIOR INKED MARGIN. E. THE INVASIVE CARCINOMA IS LOCATED IN THE CENTRAL AREA. F. THE NIPPLE DERMIS AND ADJACENT SKIN DERMIS, BUT NOT THE EPIDERMIS, ARE INVOLVED BY INVASIVE. CARCINOMA. G. NIPPLE DUCTS WITH SQUAMOUS METAPLASIA. H. PREVIOUS BIOPSY SITE CHANGES. I. THE INVASIVE TUMOR CELLS ARE NEGATIVE FOR ESTROGEN RECEPTOR, WEAKLY POSITIVE FOR. PROGESTERONE RECEPTOR, AND NEGATIVE FOR HER-2, AS PER PREVIOUS PATHOLOGY REPORT. (see comment). J. NON-NEOPLASTIC BREAST WITH RADIAL SCARS. COMMENT: Due to the weakly positive PR result on the core biopsy based on stains performed at. hormone. receptor immunohistochemistry will be repeated and an addendum will follow. Addendum. BREAST TUMOR IMMUNOHISTOLOGY RESULTS. HORMONE RECEPTOR IMMUNOHISTOCHEMISTRY. H SCORE. RAW IMMUNOSTAINING SEMIQUANTITATION. ER: Weakly positive. 10. (0: 91%; 1+: 8%; 2+: 1%; 3+: 0%). PR: Negative. o. (0: 100%; 1+: 0%; 2+: 08; 3+:0%). ESTROGEN/PROGESTERONE RECEPTORS (ER/PR) TEST DETAILS: Using formalin fixed tissues (8-96 hours) and appropriate. positive and negative internal/external controls; the test for the presence of hormone receptor protein is performed by the. immunoperoxidase method according to the ASCO-CAP Guidelines. A positive Estrogen or Progesterane receptor tumor shows. nuclear immunostaining in greater than or equal to 1% of the tumor cells (i.e. and H-score of 1 or higher). The ER and PR. Histologic Score (H-Score, or HS) is calculated as the sum of intensity of staining times the proportion of cells staining and has a. dynamic range of 0 to 300. The semiquantitation immunostaining raw data used to calculate the H-score is also shown above in. the report. Generally, the H-score correlates to percentage of positive cells. According to. the correlation of mean H-score versus percent cells staining for ER is as follows: H-score of 251 (>75% cells staining); H-. score of 130 (51-75% cells staining); H-score of 42 (10-50% cells staining); H-score of 4 (<10% cells staining). Estrogen receptor antibody SP1, an IVD, is performed using the. Progesterone receptor antibody 1E2, an IVD, is performed using the. CASE SYNOPSIS: SYNOPTIC - PRIMARY INVASIVE CARCINOMA OF BREAST. LATERALITY: Left. PROCEDURE: Simple mastectomy. Central subareolar. SIZE OF TUMOR: Maximum dimension invasive component: 38 mm. MULTICENTRICITY/MULTIFOCALITY OF INVASIVE FOCI: TUMOR TYPE (invasive component): Metaplastic carcinoma. NOTTINGHAM SCORE: Nuclear grade: 3. Tubule formation: 3. Mitotic activity score: 1. Total Nottingham score: 7. Nottingham grade (1, 2, 3): 2. ANGIOLYMPHATIC INVASION: DERMALLYMPHATIC INVASION: CALCIFICATION: SURGICAL MARGINS INVOLVED BY INVASIVE COMPONENT: Distance of invasive tumor to closest margin: 1 mm. PAGET'S DISEASE OF NIPPLE: LYMPH NODES EXAMINED: 0. METHOD(S) OF LYMPH NODE EXAMINATION: Other: None. SKIN INVOLVED (ULCERATION): T STAGE, PATHOLOGIC: pT2. N STAGE, PATHOLOGIC: pNX. M STAGE: Not applicable. ESTROGEN RECEPTORS: negative. PROGESTERONE RECEPTORS: positive, H-score: 60. HER2/NEU: 0. MICROSCOPIC: Block 1B: Antibody/Antigen. Vimentin. Positive. S-100. Rare weakly positive cells. CK5. Positive. AE1/AE3. Weakly positive. CK17. Positive. P63. Positive. CK14. Positive. Block 1C: Antibody/Antigen. P63. Highlights tumor cells and myoepithelial cells. Smooth muscle myosin heavy chain Highlights myoepithelial cells. Utilizing formalin-fixed (8-96 hour range), paraffin embedded tissue, immunohistology is. performed with the following selected antibodies and designated antibody clone (s), directed. against the following antigenic target (s), with adequate positive and negative internal and. external controls. Antibodies are optimized appropriate for fixation times. ANTIBODY. CLONE. TARGET ANTIGEN. VENDOR. Vimentin. V9. Mesenchymal cells. S-100. Polyclonal Rabbit. Melanoma screen. CK 5. XM26. High molec wt keratin. AE1/AE3. AE1/AE3. carcinomas. CK 17. E3. High molec wt keratin. p63. 4A4. Myoepithelial cells. CK 14. LL002. High molec wt keratin. Myosin. SMMS-1. Myoepithelial cells.",BRCA,0,"The report states that 'SIZE OF TUMOR: Maximum dimension invasive component: 38 mm.' This exceeds the T2 threshold of 2 cm (20 mm) but does not meet the T3 threshold of 5 cm (50 mm). Therefore, the T stage is T2.",T2,66.0
